Artist,Title,Lyrics
404Billy,RVRE,"37 ContributorsRVRE Lyrics[Paroles de ""RVRE"" ft. Damso]

[Intro : Damso]
Yah, yah (Yah)
Yah, yah (Yah)

[Refrain : Damso]
Les dealers sont d'la partie, pax de vingt g, raclo, racli, bordel, tout l'monde fume de l'herbe (Yah, yah, yah)
Les dealers à peine partis, descente des keufs dans le parking, bordel, font qu'me questionner (Yah, yah, yah)
I don't know know know know (Know, know)
J'sais pas, j'ai rien vu, rien entendu
I don't know know know know (Know, know)
J'sais pas, j'ai rien vu, rien entendu

[Couplet 1 : 404Billy]
Sombre haine et violence : tout c'que je suscite (Bang)
Négro, pour des passages radio, rien qu't'ingurgites (Bang)
J'instaure une dictature, j'fais plus d'la musique, reflet du biff dans mon iris, autant puriste que futuriste, hey hey, allez zouin (Allez zouin)
J'fais du sale qu'avec les miens, j'irai dans la shnek à ta mère pour mieux savoir d'où tu viens (Choush)
Il m'faudrait du temps, de l'argent, à part ça, j'n'ai b'soin de rien
Contradictoire à temps plein, j'peux t'faire du mal pour t'faire du bien
Sénégal sur le drapeau, j'ai ma flotte, trop d'fiottes dans le game
L'industrie s'ra sous le choc, j'suis différent vu l'époque (Fuck)
Tasse-pé fourrée entraîne échauffourées (Sale, sale)
Faites-le pour la culture (Yah, yah, yah), après mourez si vous voulez
You might also like[Refrain : Damso]
Les dealers sont d'la partie, pax de vingt g, raclo, racli, bordel, tout l'monde fume de l'herbe (Yah, yah, yah)
Les dealers à peine partis, descente des keufs dans le parking, bordel, font qu'me questionner (Yah, yah, yah)
I don't know know know know (Know, know)
J'sais pas, j'ai rien vu, rien entendu
I don't know know know know (Know, know)
J'sais pas, j'ai rien vu, rien entendu

[Couplet 2 : 404Billy]
Sale, j'ai rien vu, rien entendu, l'agent m'tire quand même dessus
J'ai rien dit, rien prétendu, en pleine guerre, j'suis détendu
J'y passerai un siècle donc mes péchés, j'vais pas t'énumérer, hey
Pute, pendant qu'j'suis dans sa chatte, elle est rémunérée, hey
Percé par les grands mais pressé par le temps
Innocent, j'ai pas compris qu'l'argent se gagnait par le sang
L'heure n'est pas la même, elle est beaucoup plus belle dans l'Audemars (Fort)
Le rap game va rejoindre sa pute de grand-mère dans l'au-delà, hey hey

[Pont : 404Billy]
Fils de pute, j'ai descendu (Dose), les keufs me questionnent
Et les pétasses m'espionnent, j'ai rien vu, rien entendu (Hey)
Il reste des résidus (Hey), les keufs me questionnent
Et les pétasses m'espionnent (Yah, yah, yah), j'ai rien vu, rien entendu

[Refrain : Damso]
Les dealers sont d'la partie, pax de vingt g, raclo, racli, bordel, tout l'monde fume de l'herbe (Yah, yah, yah)
Les dealers à peine partis, descente des keufs dans le parking, bordel, font qu'me questionner (Yah, yah, yah)
I don't know know know know (Know, know)
J'sais pas, j'ai rien vu, rien entendu
I don't know know know know (Know, know)
J'sais pas, j'ai rien vu, rien entendu
[Outro : 404Billy et Damso]
Hey, #KultureVie
Sombre, sale
Dems, eh2Embed"
404Billy,Anti élite,"21 ContributorsAnti élite Lyrics[Paroles de ""Anti Élite""]

[Intro]
4
La chose que j'regrette le plus ?
Attends, laisse-moi réfléchir
Ok

[Couplet unique]
La chose que j'regrette le plus ? Hum, facile (Hein)
C'est quand j'ai fait un freestyle sur une radio d'pédophile
J'ai pas confiance en l'être humain, c'est trop dangereux (Allez, zouin)
Y a même des cousins et cousines qui baisent entre eux
J'suis pas misogyne, des fois, c'est elle sur moi (Des fois, c'est еlle)
J'suis pas homophobe, des fois, j'écoutе Angèle (Ça m'arrive)
J'passe pas partout, dommage car j'ai des mots cyniques
Pendant qu'tu l'aimes, elle s'fait soulever dans un gros Renault Scénic
Je sais qu'jamais j'remplis l'Zénith avec mon rap anti-élite (Ça c'est sûr)
Boycotté comme Dieudonné sans faire de blague antisémite (J'sais pas pourquoi)
Chaque jour, j'me lève, j'me dis ""Aujourd'hui, c'est quel soucis ?"" (C'est quel soucis ?)
Les jours s'ressemblent comme David Luiz et Guendouzi
J'suis métis donc y a des choses que j'suis pas censé voir (Ouais)
J'ai une vision, mes ancêtres blancs fouettaient mes ancêtres noirs (Sale)
Et vu qu'on est toujours des esclaves, mes gosses, j'leur apprends pas les mots, j'leur apprends les pourcentages (C'est important)
Sheitan se ruine pas, leur âme coûte dix balles à Saint-Denis
Même pour le troll, j'aurais jamais featé Bilal Hassani (Jamais d'la vie)
A part flamber et faire monter des putes à bord (Ouais)
Tu m'as servi à rien comme théorème de Pythagore (J'te jure)
Tellement l'argent t'a eu, maintenant t'hésites à être pieux
Qui est sûr d'être là demain ? Même pas Élisabeth II (R.I.P.)
Alors nique sa grand-mère de partager l'gâteau à dix
Donc je suis mon producteur, mon éditeur et mon artiste (Cent pour cent)
Même un mec qui viole sa fille (Attends, regarde)
Hanouna serait capable de l'inviter (Ouais)
Y a des choses à éviter, indécis, rien qu'j'hésite même quand y a pas à hésiter (Y a pas, y a pas)
Vu ta madre, j'aimerais pas sortir du trou par l'quel t'es sorti (Woo)
Quand l'diable s'habille en Prada, j'crois qu'la planète Terre s'assortit
J'mets ces bouffons dans l'mur comme Chris Partlow
J'baise l'industrie, elle jouit, j'lui dis ""fais plus d'harmo'""
Le mot ""guerre"" dans nos binks, tu sais qu'c'est plus qu'un mot
J'sais qu'un jour, j'serais riche mais p't-être pas plus qu'Arnault
J'rêvais d'étrangler l'prof, j'le regardais du fond d'la classe
J'suis toujours d'humeur froide, j'crois qu'j'suis né au fond d'la glace
Ils veulent nous dresser comme des chiens, j'ai compris leur vice
C'est pour ça qu'le vrai rap, ils l'ont appelé ""rap de niche"" (Woh)
You might also like[Outro]
Woh
Fuck, fuck, fuck, fuck
404Embed"
404Billy,J’fais le bilan calmement,"11 ContributorsJ’fais le bilan calmement Lyrics[Paroles de ""J’fais le bilan calmement""]

[Couplet unique]
J'arrive en pyromane (Hey), j'arrive en Dracarys
Ça nous regarde pas les histoires de l'ex-femme à Kaaris (Oh)
L'industrie veut m'travestir, j'réagis pas à ses combines
J'fais pas du rap pour que ma meuf fasse écouter à ses copines (Wouh)
Tu trouves que j'change trop d'style (Hey), tu crois qu'c'est fini ? (Tu crois ?)
T'as pas compris, 404 error, j'ai pas d'style défini
Tu nous répètes que si t'as pas d'taff, c'est la faute de l'État
Et qu'si demain, tu prends dans l'cul, c'est qu'il s'est ouvert tout seul (Menteur)
Ils connaissent rien, c'est eux qui contrôlent ? Faut pas trop cautionner (Nan)
J'suis l'plus talentueux mais j'sais pas trop m'promotionner (Wouh)
J'arrive plus trop à m'concentrer, symptôme de l'ADHD
J'le fais pour m'en sortir, tu l'fais pour plaire à Mehdi Maizi (Zouin)
Faut faire tout et tout d'suite, j'ai retenu la leçon (J'ai retenu)
J'devais feat' avec Nekfeu et Damso sur l'même son
Vous avez des bons p'tits flows, des bons p'tits lyrics
Mais j'peux pas vous prendre au sérieux, vous v'nez d'un concours Netflix (Oh)
Faut souligner les fautes, quelques LGBT ont milité pour leurs droits, pour ensuite l'imposer aux autres (C'est vrai)
Jusqu'à preuve du contraire, j'fais c'que j'veux, j'suis chez moi
Si j'veux pas qu'mon marmot soit non binaire, j'ai l'droit (Et alors ?)
Faut arrêter l'cirque, stop l'association (Sale)
Stop les blasphèmes (Wouh), faut arrêter l'shirk (Zouin)
J'dis c'que j'ai à dire sur du tempo Griselda (Hey)
Dans la scène, j'suis Brother Mouzone, t'es Idris Elba (Tou, tou, tou)
J'ai appris à vous connaître, vous prenez direction du vent (Ouais)
La culture de l'instant, opinion du moment (Je sais)
Lors d'la polémique, ils ont soutenu Freeze Corleone
Si le public le soutenait pas, ils auraient tous fermé leurs gueules (Hey)
Niveau rap féminin, j'suis pas si sexiste (Nan)
Vous sucez tous Diam's alors que Casey existe (Hey)
Ils sont pas passionnés, le font pour draguer des p'tites (Hey)
Vos albums donnent envie d'ronfler, rendent narcoleptique
Grosse montée d'adrénaline dans un moment décisif
Tu répètes que t'es indé' mais tu parles pas d'ton déficit (Jamais)
J'ai la vingtaine mais j'ai les idées claires
J'sais qu'pour sortir d'la merde, j'vais devoir niquer des mères
Et c'est c'que j'suis en train d'faire (Clairement, clairement, zouin)
Ok, si tu dis la vérité, ils vont dire que t'es aigri
Ils veulent qu'on dise qu'le ciel est bleu, alors qu'le ciel est gris (C'est ça, zouin)
Ok, j'vais les prendre, imminent, intimement, par devant
J'suis un négro couleur marron, j'fais l'bilan calmement
You might also like[Outro]
0.4, zouin
C'est carréEmbed"
404Billy,Rutt’s,"13 ContributorsRutt’s Lyrics[Paroles de ""Rutt's""]

[Intro]
I don't want peace, I want problems! Always!

[Couplet unique]
En tant qu'fouteur de merde, j'étais dans plusieurs sau-auces (Zoin)
Fuck Jon Stryker, Fuck Georges Soros (Fuck!)
404 (404), j'épargne personne à part les bébés (No! No!)
Fuck ces négros qui me parlent de Dieu avec des gri-gri (Fuck!)
Ça existe pas, tout comme le calibre dans ton jean
Ou comme la bite imaginaire de Christine And The Queens (Elle est où?!)
Tema l'attitude, comme si j'ai grandi dans l'Queens
Ma fille occupe mon cœur, poto, jе n'ai qu'une seule queen (Fort!)
Maintеnant ces putes veulent discuter pour éviter l'drame (No!)
Dans ma tête on est deux, je me sens comme 88Glam (On est deux)
Tu n'vas pas changer le monde, alors vire ton cul d'héros
Ma devise : suce zéro chibre, sois froid comme Sub-Zero
Génération GTA, génération GTO
Si l'union fait la force, pourquoi j'suis au-d'ssus de ces négros ? (Zoin!)
Pour qu'les derniers soient premiers, faut leur mettre la tête à l'envers
En tant qu'bon français, il m'faut un chargeur camembert (Grah! Grah! Grah!)
Les poukavs, j'leur donne pas l'heure
Ce seraient des juifs en 42, ils auraient balancé les leurs (Snitch, snitch)
Méprenez-vous contre vous, j'ressens pas de colère
Tant que vous n'mettez pas des mecs qui s'enculent dans manuels scolaires
Zoin
Si c'est une traître, écarte-toi, si elle est loyale, garde-la
De toute façon, on s'barre de là, si passe Jordan Bardella (Okay)
N'fais pas l'bandit de Chicago, ou on va t'mettre toi et tes locks à terre
Plusieurs dans ma tête, il faut qu'je calme tous mes locataires (Calmez-vous)
Appelle-moi l'erreur, l'aigri, appelle-moi l'aigreur
Appelle-moi Danger, toi Abella Danger (Tu fais des films de boule!)
Vos albums durent 30 titres, ils durent plus longtemps qu'Le Parrain
J'vous jure, j'vais vous faire un par un (Vos vieux albums qui font chier)
Pour eux, j'aime trop la sentence
Vu que la mode c'est m'détester, ah, j'aime trop la tendance (Allez-y!)
J'ai beau m'instruire, étudier, j'comprends toujours pas c'système
Quand j'vois des racistes qui dansent sur des sons d'Magic System (J'comprends rien, moi...)
95, sur les traces de Passi Driver
Mais j'plonge dans la folie, j'suis Travis dans Taxi Driver
Massacre de Thiaroye, ici on connaît l'malheur
Charles de Gaulle a tué plus de renois que Jeffrey Dahmer (Gang! Gang! Gang!)
J't'annule, si tu m'as pris pour un p'tit
Gros, le psy que j'ai consulté, il a lui-même pris un psy (Meskine)
J'suis pas body positive, j'suis pas ce genre de Nizzo
Moi, c'est sûr que j'te baise ap, si t'as le corps de Lizzo (C'est sûr)
Moi, j'suis solo, aka l'unique chevalier noir
J'suis le nouveau KKK, mais habillé en noir
Le génocide amérindien, ils se sont fait racketter
Mais comparé à d'autres, ils n'sont pas très bien marketés (...)
Niger, Mali, Burkina (Burkina)
J'porte pas leur brassard comme Gueye Gana
Ces putes dévergondées ne méritent même pas le resto
Comme le rap français ne mérite même pas Despo
Zoin
You might also like[Outro]
Sale
Grah! grah! grah!
Wouuuuuuuuuuh!Embed"
404Billy,La Plus Grande Des Illusions,"18 ContributorsLa Plus Grande Des Illusions Lyrics[Paroles de ""La Plus Grande Des Illusions""]

[Intro]
Eppsito
Où es-tu, où es-tu ?
Le 4
ZoinGoinZoin
Zoin

[Couplet unique]
Pour m'clasher faut être sado (Fort), tu dois être pas mal soumis (Ouais)
T'as l'syndrome de l'imposteur, Eppsito Epps Chalghoumi (Ouf)
Ah t'as signé chez Sony, c'est p't-être ce qui t'as rendu guez (Sûrement)
J'te clash pendant cinq minutes, c'est déjà plus que quand tu baises
Dis au revoir à la gloire (Au revoir)
J'sais pourquoi tu m'traites d'homophobe, pétasse (Pétasse)
T'as le même cul noir que Magloire
Peine de mort pour les pédos, mais tu mérites la même peine (Fort)
Quand elle était encore mineure, tu voulais zouker Wejdene (C'est toi qui l'a dit)
J't'ai vu clasher Raplume (J't'ai vu), j't'ai vu perdre la raison (J't'ai vu)
Blac'KKK est v'nu pendre ce nègre de maison (Blac'KKK)
T'es pas l'meilleur rappeur de France (Non)
Jamais les rois s'en vantent (Jamais)
T'es l'seul mec qui gagne un BET en faisant trois cents ventes (Miskine)
Mais, dites-moi qui l'connait ? (Grah)
Ils savent que mythonner (Grah)
Pédale pistonné (Grah)
Westside Pistolet (Grah)
Rien qu'j'lui pisse au nez (Grah), et j'crache sur cette grosse folle (Tiens)
J'vais pas trop t'terminer ou on va dire qu'j'suis grossophobe (Belek)
Allez j'me lance (Allez), tu sais qu'j'suis plein d'défi
B2o l'avait prédit, t'es villain comme Ndiefi
Puis actualise tes vêtements (Fait un effort), il faut changer la donne (Faut)
T'as vingt-sept piges tu mets les mêmes jeans qu'Akhenaton (Miskine)
Range ton bandana (Range le), range tes Timberlands (Range les)
T'es qu'un p'tit gosse que l'industrie a violé comme à Neverland (Zoin)
Tu m'dis que j'clash mon propre type
Mais tu t'es vanté auprès d'moi d'avoir fumé Dinos sur son propre titre (Arh)
Vu qu'le bro est un vendu, j'vais devoir clash contre le bro
C'est petit Boo contre le gros, t'es trop gentil, négro (Grah)
Explique nous cette coïncidence (Explique nous)
T'as remporté un BET et ton manager taff chez BET FRANCE (Comment ça s'fait ?)
Il s'appelle Sindanu (Sindanu)
J'viens niquer ton rêve africain frérot
Tu s'ra pas Francis Ngannou  (Oh, non, non, non)
On t'as vendu comme le sauveur
Promotionné comme une mascotte (Zoin)
Mets une perruque, t'es une pute noir de rue d'Aerschot (Tu vaut vingt balles)
T'es qu'un produit t'es planifié comme aucun gars (No, no)
T'as p't-être vendu ton cul mais pas tes places pour l'Olympia
Négro, j'te baise de pleins d'sortes, négro, j'te fume en one shot (Ok)
T'as dis qu'tu venais prendre le trône (Zoin), donc j't'ai assis sur un chiotte (Zoin)
J'crois qu'tu vas finir caissier, gros ta carrière est biaisée
T'es trop laid, j'sais pas comment ta meuf elle fait pour t'baiser
J'ai cru qu'j'étais vraiment intimidant, pour clash, t'as pris du temps
Dis moi c'que ça fait d'être industry plant dans une industrie d'blanc (Ok)
Tu joues sur l'dos des indés, du genre tu fuck Polydor (Tu fuck)
Mais tu fais des big photos avec le boss de Capitol (Ouh)
Pourquoi on en est là ? (Pourquoi) Demande à ton frère (Demande lui)
Ton manager voulait produire et magouiller mon concert (Escroc)
J'ai refusé, mais pour qui vous prenez vous ? (Mais pour qui ?)
C'est votre fin, prenez une corde et pendez vous (Pendez vous tous)
S/o Index, mais j'm'en bats les couilles que tu l'connaisses
T'habites à la campagne, j'peux pas connaître négro d'ton tieks
Sur moi t'as fait deux diss track (Deux), mais c'est sans impact (Sans impact)
T'as plus l'talent, tu peux pas l'faire sans tricher ou sans un pacte
T'as dis qu't'as ramené rap, mais les calculs sont pas bons
J'écrivais ""Hostile"", tu mangeais des cailloux au Gabon (Miskine)
Les gens ont besoin d'comprendre
Les gens ont besoin d'un contexte
Tu m'as invité à ton concert
Et t'as oublié tout ton texte
T'as répété avec les autres, pas avec nous, t'as pris de haut
Bizarrement, la veille j'avais sorti BLKKKK VAN GOGH (Bizarrement)
En interview, tu dis qu'j'suis ton ami, négro, tu sembles fan
Faut l'dire, depuis qu'j'suis dans l'Boom bap, négro, tu sembles fade
Tu n'es qu'l'ombre de toi même, y a ta carrière à l'hôpital
Fais des tiktoks  comme Jawad ou va ouvrir un OnlyFans (Ahah)
Parce que le rap c'est cuit (C'est cuit), faut relativiser
J'ai comme l'impression que ta fan base s'est volatilisée
C'que j'voulais tu m'la donné
T'as mordu à l'hameçon, t'es l'poisson sur la cover de ISHA et Limsa d'Aulnay
Tu voles la voix à Westside Gunn, un BET à Central Cee
Tu fais un Olympia à perte, négro mais qui es tu vraiment ? (Escroc)
Range ton gilet pare-balles, jamais d'la vie tu pointes un gun
Malgré qu'tu sois industry plant, l'industrie ne veut pas d'ta gueule
You might also like[Outro]
ZoinGoinZoin
Shoot un industry plant
Vas-y shoot un industry plant
Sale menteur, sale tricheur, sale voleur
Bande d'escrocs
Vous trafiquez des dates de concerts
Vous trafiquez des BET AWARDS
Alors pour la culture j'ai dû te dézinguer
Je ne peux pas te signer, comme Jay-Z a signé Nas t'es trop flingué
Tu m'avais pourtant dis que tu n'voulais pas d'cette fumée au téléphone
Tu m'avais dit qu'il n'y aurait pas de suite… t'es un lâche au fait
Le 4Embed"
