Artist,Title,Lyrics
404Billy,Oubliez-nous,"5 ContributorsOubliez-nous Lyrics[Intro]
Hey (hey), hey (hey)

[Couplet 1]
Faut qu'tu fasses gaffe, j'suis Titan déviant (hey), les puristes voudraient qu'je rappe comme à l'époque des francs (hey)
T'inspires personne, t'as pas d'enfant, t'es stérile, j'nage dans les soucis comme Michael Phelps, c'est terrible (wouh, wouh)
La vie n'est qu'une période d'essai (hey, hey), même un million d'euros pourraient pas m'dresser, sache-le (sache-le)
On va s'ranger un jour ou l'autre, lors d'la déconnexion, j'ai tellement d'connexions mais j'en fais collection car j'm'en sers pas
L'amour, à quoi ça sert, ça ?
J'entends pas, sont plus proches de Dieu, drôle de paradoxe
Culture Records bouffera tout, on payera pas la note
Il m'reste encore un peu d'sang, il m'reste des centilitres (zoin)
Quand j'n'étais plus amoureux d'elle, j'me suis senti libre (senti libre)
Fuck tout c'qui brille, ça nique mon esprit (fuck)
Pour paix intérieure, il faut que j'pardonne l'ennemi (ennemi)
Grandi sans le daron, cause de souffrance, est-ce lui ? (est-ce lui ?)
C'qui m'attire l'interdit (mort)
Vis ta vie sans avoir d'leader, vite, essuie tes pleurs
Moi, j'suis né pour écrire l'histoire, j'ai l'esprit compétiteur
Verre de 'sky posé sur nuage, vie n'est qu'un mirage
Protège-toi parce que pour souffrir, il n'y pas d'limite d'âge
J'vise encore le ciel (hey), faut qu'mon corps s'éteigne (hey), dans c'monde, il n'y pas d'place pour coeur en porcelaine (hey)
J'me retrouve en danger chaque fois qu'un porc se lève, hey
Je course encore mes rêves, hey

[Pont]
Zouin, hey
Petite ciste-ra voudrait m'voir au zoo, j'lis des livres saints donc j'y crois, j'vois pas les fantômes
J'aurai des souvenirs de toi que sur les photos, et même si tu comptes trop pour moi, j'durcis mes propos, hey
You might also like[Refrain]
On n'est pas comme vous, oubliez-nous, oubliez-nous, oubliez-nous (oubliez-nous)
Les vrais soldats ne finissent jamais à genoux (jamais, jamais)
Tire-moi dans la tête si tu veux pas que j'reste debout (paye, paye, paye, paye, paye)
J'attends toujours qu'cette putain d'chance me passe un coup d'fil
On n'est pas comme vous, oubliez-nous, oubliez-nous, oubliez-nous (oubliez-nous)
Les vrais soldats ne finissent jamais à genoux (jamais, jamais)
Tire-moi dans la tête si tu veux pas que j'reste debout (paye, paye)
J'attends toujours qu'cette putain d'chance me passe un coup d'fil (allô ?)

[Couplet 2]
Moi, j'étais là, j'ai tout vu, j'ai vu quand police tirait
Pour m'protéger, j'ai mis mon âme dans du polystyrene
J'm'éclipse au crépuscule, moi, j'suis né pour vivre de mon art, j'suis pas d'ceux qui postulent
Après quoi, tu cours, succès, amour, biff ou reconnaissance
Mais tout ça t'emmène en haut et t'laisse en convalescence
Je dis vrai, on tombe tous dedans, on veut être devant, en-d'ssous des lumières sauf dans l'Uber, vous n'êtes pas si différents
Sur les réseaux, tout l'monde veut être fame, moi, j'ai trop la flemme mais j'suis pas comme vous
J'suis normal donc il faute qu'on m'interne
Trop d'faux-semblants, trop d'mensonges, trop d'tyrans
On m'a parlé d'un monde meilleur donc je m'y rends, zoin

[Refrain]
On n'est pas comme vous (hey), oubliez-nous, oubliez-nous, oubliez-nous (oubliez-nous)
Les vrais soldats ne finissent jamais à genoux (jamais)
Tire-moi dans la tête si tu veux pas que j'reste debout (clique, clique, paye, paye)
J'attends toujours qu'cette putain d'chance me passe un coup d'fil (hey, hey, hey)
On n'est pas comme vous, oubliez-nous, oubliez-nous, oubliez-nous (oubliez-nous)
Les vrais soldats ne finissent jamais à genoux
Tire-moi dans la tête si tu veux pas que j'reste debout (paye, paye)
J'attends toujours qu'cette putain d'chance me passe un coup d'fil
[Outro]
Hey, hey
404Embed"
404Billy,Oxford,"4 ContributorsOxford Lyrics[Intro]
Dose
Hey, hey
Hey
Hey, hey
DST
V.L.B
Dose
Hey

[Couplet unique]
J'parlerai peut-être de grosses coupures
De bif, de flingues et d'Aventador
Rap se fait baiser derrière les stores
Il reste du sang sur cahier Oxford
Malgré l'effort, j'ai beaucoup d'ennemis
Trop noir pour être enfant d'la patrie
Blindé, j'pourrai survoler Paris
Les traîtres ne seront pas d'la partie
Seulement le cash attire ces sales hyènes
Le style est noir comme gens du gal-Sene
Quatre zéro quatre, atmosphère malsaine
Ton groupe se coupe les veines en backstage
Le négro est vénère, ça y est
Croyez pas j'vais vous baiser qui qu'vous soyez
J'ai connu la misère familiale, foyer
J'paierai le loyer de mon employé
Négro, dose
Univers sombre bien lasse-deg
Suce-moi c'est ta seule casse-ded'
Suis moi direction l'cosmos
Pas l'temps pour les négros faibles
Vulgaire, sombre est le gosse
Plus tard j'n'aurai pas d'boss
Dans l'rap j'aurai plein d'gosses
J'les aimerais de toutes mes forces
J'nage dans les eaux troubles
J'navigue dans les hautes sphères
Je sors de ma daronne mais j'rentre dans les autres mères
Ils ont beau prier, critiquer, boycotter, c'qui les attend c'est l'enfer
Contrairement à l'esprit, dis-toi qu'un homme s'enterre
DoseYou might also likeEmbed"
404Billy,Pandémonium,"2 ContributorsPandémonium Lyrics[Intro]
Suisse-France, Zoin
Aller Zoin

[Couplet de 404Billy]
Pandémonium, tout le mal qu'ils m'ont fait, je vais le redonner aux hommes. (Zoin)
On a tellement trimé, cette fois-ci c'est la bonne
Quand je la ken, je l'étrangle avec mon écharpe Moschino, (okay)
Elle se demande si c'est de la baise ou des prises de judo. (Tien)
Je suis un fantôme comme Patrick, Swayze (wow)
Il n'y un qu'un peintre, l'Capitole et les sept péchés capitaux
Les vrais sont épargnés, les autres seront pris dans le torrent
Tout ce que l'élite met en place, c'est interdit dans le coran. (Bizarre)
Pose-toi les bonnes questions, bonne vie, bonne carrière et bonne gestion
T'as jamais cru en nous, nique ta mère, retourne pas le veston. (Zoin)
Je crois qu'il y a ton corps dans l'coffre et des balles sur ta doudoune Horspist
J'peux pas dire que t'es mort en légende comme Koby ou [?]
Une femme peut te brûler tes hélices, et même prendre tout ton argent tah [?]
Si tu t'attaques à la famille, je t'assure qu'on va pas s'attarder sur l'ménisque
Fuck se mettre en couple ça va finir en Mr et Mme Smith
Je veux la richesse de la nation mais ça n'a rien à voir avec Adam Smith

[ 1ᵉʳ Couplet de Victor Besson]
Elle dit que son mec est pas jaloux, alors qu'il l'amène en vacances à Mykonos
Fidèle à mes principes comme Piccolo, première séance, j'ai fait pleurer ma psychologue
J'm'en fou du bonheur, tout ce qui m'importe, c'est d'être en paix
Tous les soirs, je la mets de côté, j'suis plus en manque de sommeil que d'elle
Mon honneur est dans mon doigt, si tu chopes la te-té, ça compte deux points
J'crois plus en ma musique qu'en l'amour depuis que j'ai fait Gueule de bois
Tu t'es présenté tellement fièrement que je comprends que maintenant t'ai honte de toi
J'suis à deux doigts de les mettre en toi, et complètement t'oublier comme le tiers-monde
You might also like[Refrain]
J'découpe jusqu'à pisser du sang, pour un couplet j'dois filtrer du son
L'enfer c'est près du sol, les marches du paradis sont très glissantes
L'argent te rend séduisante, le pouvoir aphrodisiaque
La déception c'est mon vice à force de vivre avec tant d'ambition

[2ᵈ Couplet]
J'suis roi sans couronne des temps moderne, si Mclemore a gagné un grammy dans ce cas-là, j'demande un Nobel
J'suis roi sans couronne des temps moderne, le succès d'estime remplissent que l'assiette des Top modèles
Jamais cé-su normal à force que mes sons n'aient aucun succès, à force d'être gentil on devient suspect
J'te fais trembler plus que Cassius Clay
Aussi protecteur que l'homéopathie, si je fais souffrir les gens c'est qu'en partie, je suis aussi sado-maso-qu'empathique
Sac aussi léger qu'Isabelle Caro, aucune émotion, gros je les taro
J'ai compris que l'amour emprisonne donc je t'écris que quand j'ai le barreau
Se taire dans toutes les langues, c'est pareil, le silence s'en fout de ce qui t'arrange
Je travaille tous les jours comme un taré, au point que j'arrive au filtre de la garo
Aussi peu étique que poétiques sont mes lyrics
J'ai le souci du détail pour tous les buts que je me suis fixé
Pour une qualité 4K, il faut soigner tous les pixels
Hey, Hey, Hey, Hey

[Refrain]
J'découpe jusqu'à pisser du sang, pour un couplet j'dois filtrer du son
L'enfer c'est près du sol, les marches du paradis sont très glissantes
L'argent te rend séduisante, le pouvoir aphrodisiaque
La déception c'est mon vice à force de vivre avec tant d'ambition
[Outro]
Y'a que des loups, zoin, 4-0-4
J'rentre pas dans vos cases bande d'enfoirés. (foirés, foirés, foirés.....)Embed"
404Billy,PAO,"2 ContributorsPAO Lyrics[Paroles de ""PAO""]

[Intro]
Le quatre
Zoin

[Refrain]
Tout est gang, tout est gang (gang)
Mais qui a dit qu'on irait pas haut (graah)
On va les laisser sur le carreau (graah)
Ils rendent pas les coups c'est des PAO (graah)
Tout est gang, tout est gang (gang)
Mais qui a dit qu'on irait pas haut (gang)
On va les laisser sur le carreau (zoin)
Ils rendent pas les coups c'est des PAO

[Post-refrain]
T'as reconnu le ""tou-tou-tou-touh"", le fusil je dégaine devant eux (tou-tou-tou-touh)
C'qui nous motive c'est la moula (ouais) c'qui nous motive c'est la moula (ouais)
T'as reconnu le ""tou-tou-tou-touh"", le fusil je dégaine devant eux (tou-tou-tou-touh)
C'qui nous motivе c'est la moula (ouais), c'qui nous motive c'est la moula (ouais)

[Couplet 1]
Boy, loup solitairе, pas de ""follow me"", il m'faut une meuf déjà blindée, ça m'fera faire des économies
Petit on m'a dit ""vas déposer l'sac et vérifie jamais ce qu'il y a dedans""
Pour les frérots sur les Yamaha (vroom), avant d'agir n'attendent pas longtemps
Chez nous, les employeurs c'est des fours, on t'té-ma bizarre si tu viens pas d'ici
Ceux qui assument ne rangent pas le fusil, ceux qui assument mélangent pas le whisky
Au dessus comme Vivendi (zoin), on arrive en Givenchy (zoin)
Business comme EPMD (ouais), fifty dans P.I.M.P (fort)
Faut ma Rolex, faut ma AP au poignet, que j'aille soudoyer tous les douaniers
Au lieu d'se demander si le négro est vrai, ils vont s'demander combien j'ai gagné
J'veux une Phillip Patek, pas une Fossil, j'veux une Phillip Patek, pas une Fossil
Pour ma paix intérieure, elle est nocive, quand j'la baise, elle a la voix de Boosie
You might also like[Refrain]
Tout est gang, tout est gang (gang)
Mais qui a dit qu'on irait pas haut (graah)
On va les laisser sur le carreau (graah)
Ils rendent pas les coups c'est des PAO (graah)
Tout est gang, tout est gang (gang)
Mais qui a dit qu'on irait pas haut (gang)
On va les laisser sur le carreau (zoin)
Ils rendent pas les coups c'est des PAO

[Post-refrain]
T'as reconnu le ""tou-tou-tou-touh"", le fusil je dégaine devant eux (tou-tou-tou-touh)
C'qui nous motive c'est la moula (ouais) c'qui nous motive c'est la moula (ouais)
T'as reconnu le ""tou-tou-tou-touh"", le fusil je dégaine devant eux (tou-tou-tou-touh)
C'qui nous motive c'est la moula (ouais), c'qui nous motive c'est la moula (ouais)

[Couplet 2]
À la recherche de billets mauves, ouais, j'ai traîné dans des sales histoires
Ils font trop les voyous tah les States, genre ils ont des guerres de territoire
Elle sait très bien que je n'suis pas riche mais elle voit très bien le potentiel
Si un rappeur fait le malin sur Internet, j'vais lui tirer d'ssus à Rock en Seine
On s'attrape à l'occas', ça veut dire jamais (jamais), on va s'attraper un jour, ça veut dire : quand t'auras grossi du cul
Pour l'avoir, j'fais des déclarations, quand je l'ai, j'mets fin de relation (zoin)
Si elle ne fait pas de fellation, j'la fais dormir sur le paillasson (fort)
Ma meuf est côté conducteur (vroom), qui vous a dit qu'c'est réducteur ? (Qui ?)
J'm'en bats les couilles, elle est soin, j'sais qu'tu la veux, allez, zoin (shit)
Un genre de Draco, ni des pirates, ni d'la marine
T'as pas d'argent, zéro charisme (zoin), t'as juste du blanc dans les narines
[Refrain]
Tout est gang, tout est gang (gang)
Mais qui a dit qu'on irait pas haut (graah)
On va les laisser sur le carreau (graah)
Ils rendent pas les coups c'est des PAO (graah)
Tout est gang, tout est gang (gang)
Mais qui a dit qu'on irait pas haut (gang)
On va les laisser sur le carreau (zoin)
Ils rendent pas les coups c'est des PAO

[Post-refrain]
T'as reconnu le ""tou-tou-tou-touh"", le fusil je dégaine devant eux (tou-tou-tou-touh)
C'qui nous motive c'est la moula (ouais) c'qui nous motive c'est la moula (ouais)
T'as reconnu le ""tou-tou-tou-touh"", le fusil je dégaine devant eux (tou-tou-tou-touh)
C'qui nous motive c'est la moula (ouais), c'qui nous motive c'est la moula (ouais)Embed"
404Billy,Pas de geste,"7 ContributorsPas de geste Lyrics[Paroles de ""Pas de geste""]

[Intro]
Hey

[Couplet 1]
Et si jamais j'te clashe (wesh), c'est que d'l'entertainement (t'inquiète)
T'as 600 followers, pour nous, tu n'existes pas vraiment (t'es qui ?)
À quoi ça sert de s'fight (hey) ? À quoi ça sert de s'fight (hey) ?
Un beau jour, on quittera l'hall (j'espère), sur la tête de ton père qui s'drogue (haha, haha)
Putain, faut des VVS (putain, faut des VVS)
Faut qu'ça brille car l'être humain change dès qu'il voit d'l'espèce (bande de chiens)
Wow (hey)
Y a des groupies en fosse (ouais) mais leurs poitrines sont fausses (ces putes)
On dirait toutes des clones
Honnête, tu finis pauvre (dommage), mauvais, tu finis riche (dommage)
J'te raquette comme le FISC, comme ça qu'j'habille mon fils (fort)
En plus d'être guez (hey), t'es un suceur de bites
Impact sur la vitre, wow, des vies se finissent vite (bang, bang)

[Refrain]
(surtout)
Pas d'geste brusque (hey)
Pas d'geste brusque (jamais)
Pas d'geste brusque (nan)
Pas d'geste brusque (jamais)
Pas d'geste (pas d'geste)
Pas d'geste brusque (hey)
Pas d'geste brusque (hey)
You might also like[Pont]
J'aime pas trop ton faciès, j'aime piquer dans l'assiette
Des gens, j'suis qu'un enculé, wesh
À défaut d'être excellent, je n'vis que l'instant
Croix sur mes antécédents

[Couplet 2]
Qui vivra verra mais très peu verront car j'vais tous les fumer (bang, bang)
Il m'faut mon auto, il m'faut ma Veyron, ils vont pas assumer (vroum, vroum)
Ne fais pas trop confiance, j'suis un genre de démon, j'éjacule du venin (ay, switch)
Arrête de jouer le voyou, t'es juste sur les réseaux, jamais sur le terrain (on sait très bien)
T'arrives trop tard (ouais), t'es pas dans les temps comme BlueFace (c'est mort)
Traîne pas trop dans mon square (nan), tard le soir, il s'passe plein d'dièses (ah ouais)
J'suis pas très bavard, des meufs enceintes, il n'y a que ça (c'est sombre)
J'demande la VAR (hey), j'ai pas craché dans ta tte-cha (j'te jure)

[Refrain]
(surtout)
Pas d'geste brusque (hey)
Pas d'geste brusque (jamais)
Pas d'geste brusque (nan)
Pas d'geste brusque (jamais)
Pas d'geste (pas d'geste)
Pas d'geste brusque
Pas d'geste brusqueEmbed"
404Billy,Pearl Harbor,"10 ContributorsPearl Harbor Lyrics[Couplet 1]
Dans ma tête, c'est Pearl Harbor
Regarde mon cœur, il n’y a plus personne à bord
Dans ma tête, c'est Pearl Harbor
Regarde mon cœur, il n'y a plus personne à bord
Mon âme n’est pas un trésor
À l'intérieur, il y a de la colère, pas de l'or
Je hais les hommes donc je ne vais plus trop dehors
Et pour pleurer, je dois m'cacher, baisser les stores

[Refrain]
J'suis mauvais alors dis-moi pourquoi tu m'aimes, bébé ?
J'suis mauvais alors dis-moi pourquoi tu m'aimes, bébé ?
Je ne mérite pas ton amour, tu devrais même céder
Les chansons d’amour et de haine sont dans le même CD
J’me rachète, j'me rachète, j’me rachète, j'me rachète
J'paie le prix, j'paie le prix, j’paie le prix, j'paie le prix
J'me rachète, j'me rachète, j'me rachète, j'me rachète
J'paie le prix, j'paie le prix, j'paie le prix, j'paie le prix

[Couplet 2]
Être incognito (hey), loin d'ces gros mythos (hey)
Si un tombe, tout l'monde tombe, effet domino
L'homme est faible, il s'fait diriger par sa libido
Loin des autres, je suis différent comme un indigo (hey hey hey)
Tu veux tout aussi tôt, tu tomberas aussitôt
Toujours au labo', j'essaye d'atteindre le haut niveau (j'essaye)
Je te la rentre toute entière, j'fais rien à demi mot
Esprit révolutionnaire, j'traîne qu'avec marginaux
You might also like[Refrain]
J'suis mauvais alors dis-moi pourquoi tu m'aimes, bébé ?
J'suis mauvais alors dis-moi pourquoi tu m'aimes, bébé ?
Je ne mérite pas ton amour, tu devrais même céder
Les chansons d'amour et de haine sont dans le même CD
J'me rachète, j'me rachète, j'me rachète, j'me rachète
J'paie le prix, j'paie le prix, j'paie le prix, j'paie le prix
J'me rachète, j'me rachète, j'me rachète, j'me rachète
J'paie le prix, j'paie le prix, j'paie le prix, j'paie le prix

[Outro]
Plus d'espoir, c'est mort je sais
Seul j'attends qu'le ciel s'éclaircisse
Plus d'espoir, c'est mort je sais
J'vais tout prendre sans leur dire merci1Embed"
404Billy,Picsou,"2 ContributorsPicsou Lyrics[Intro]
Hey

[Couplet unique]
On parle peu mais on vit tout, sentiments, j'suis comme Picsou
Tous les jours, j'ai envie d'sous, je marche seul la nuit, saoul
Tu veux voir les sept cieux ? Mais avant ça, enlève tes d'ssous
Tu t'trompes, j'suis pas tout doux, j'fais la guerre comme Sun Tzu
Je prends tout, pas de pincette, tu rappes comme sur les cassettes
Une fois qu'j'ai fini mon assiette, j'irai graille dans ton assiette
J'tire une balle dans tes fossettes, j'éjacule sur tes faux seins
J'égorge toi et tes poussins, j'suis trop sale pour Europe 1
On marche avec personne comme les deux frères de l'Essonne
Fais pas l'beau gosse comme Bryson ou ton visage, on façonne
Peu importe le nombre de Celsius, on regarde juste si t'es belle, suce
Dans dix ans, j'serai Crésus, j'attends ça depuis des lustres
Zouin

[Outro]
On arriveYou might also likeEmbed"
404Billy,PINOCCHIO EPEMBIA,"18 ContributorsPINOCCHIO EPEMBIA Lyrics[Paroles de ""PINOCCHIO EPEMBIA""]

[Intro]
Eppsmytho PINOCCHIO EPEMBIA
C'est quel genre de détraqué qui s'invente une histoire avec une meuf qu'il connaît même pas
Écoute, t'as plus de chances de baiser ta propre mère
Que d'baiser ma Baby Mama
Vas-y démarre
On s'est pas bien compris
Dans c'clash on n'a pas l'même rôle
Tu veux prouver qu'tu rappes bien ?
Non, moi j'veux prouver qu't'es une fraude
Zoin

[Couplet Unique]
Si t'as invité Eppsmytho, enlève ce fou d'ta mixtape
Poto si ta sextape еst vraie, alors défloute la sextapе
T'as jamais croisé mon ex, tu fantasmes hein
T'as jamais croisé mes gosses, tu fantasmes gros
T'es revenu pour mentir, j'ai cru que c'type ne vivait plus
Ton père est polygame, l'cul de ta mère suffisait plus
Sans toucher à Baby Mama, je t'envoie un genkidama
J'ai toujours grandi dans l'drama, authentique est Billy Sama
Parlons principe faut qu'tu m'expliques, j'vois qu'tu retournes ta veste vite
T'envoie un pique vers Alpha Wann pour ensuite lui d'mander un feat
Jamais eu d'femmes entre nous, et tes mensonges y en a plus d'un
Y a quelques mois, tu voulais qu'j'pose sur ton remix enfant d'putain
404King Push venu dévoiler, ton vice
Tu veux, cacher ton daron comme Drake, a caché son fils
Mais, dis moi pour quelle raison gros, je vois que tu y tiens
Alors, quoi ? T'assumes pas d'être le fils d'un politicien (De quoi ?)
Depuis tout c'temps, tu nous fais l'rappeur sinistre
Alors qu'en vrai t'es un genre de fils de ministre
T'es bien avantagé, t'as plein d'raccourcis
C'est plus Epps Chalgoumhi, c'est Epps Sarkozy
J'encule toi ta family, tu vaux trois frites un panini
Tu peux dire "" Billy t'as fini "" escroc comme Milli Vanilli
T'es comme Clarence dans 8 Mile, j'vais t'faire mal infernal flow
Hustle comme Chairman les crocs comme black doberman
T'es l'genre de negro qui s'vexe car j'l'ai pas reposté
Oumardinho t'a frappé, t'as même pas riposté
Il t'a frappé comme son p'tit, tu n'es pas revenu
Et puis maint'nant tu joues l'ancien tu mens sur mes revenus
On s'introduit, par les toits j'vais t'prendre normal, par les doigts
Les Gabonais mangent pas d'cailloux negro j'ai juste, parlé d'toi
Vous m'traitez d'homophobe, vous faites que d'le répéter
Mais ton grand frère a l'air d'accord sur le sujet LGBT (Bande de menteurs)
Ah ouais tu joues l'woke ? Ça la fout mal
Dans tes sons tu fais l'apologie des violences conjugales (Explique-nous)
À la place, frappe-toi l'torse comme King Kong
Comme tu l'as dit dans un d'tes sons tu frappes ta meuf comme Chris Brown
Tout ça c'est l'karma oui
Tu frappes ta meuf ? Dans c'cas là t'es pas Doumbé t'es Barnaoui (Tu t'es trompé)
Tu dis qu'tu baises des goes, mais respecte ton épouse
Tu t'vois comme Jay Z, j'te vois comme Papoose
Parle up j'suis arme Russe t'as plus d'fute prend par le uc'
Tu m'parles du Havre, tu plaisantes frérot t'habite à Bar le Duc
Ton clash c'est huit minutes d'imaginaire tu racontes rien t'aboie
4-5 jours la réponse est là j'ai pas besoin d'un mois
T'es atteint d'une malade, mythomanie, va voir un psy
Poto, t'as des pecs c'est des eins' wesh, c'est toi qui allaite ton p'tit (donne lui à boire)
T'es entouré, mais tu finis dans cabine seul
T'es arrivé en Westside Gun, pour repartir en Machine Gun
J'faisais d'la Drill, d'la Trap, j'ai pas honte de c'bordel (Non non)
Avant d'faire du Boom Bap, t'étais un genre de Corneille
J'réitère, j'réitère, moi je pense qu'il est maso'
Il dit qu'il signe pour six 0, ce negro pense qu'il est Gazo
Fais nous voir ton putain d'contrat
J'en ai marre d'tes manigances
T'es pas signé en distrib' menteur t'es signé en license
Tu m'parles du feat avec Dems', tu veux qu'on parle de tes invits' ?
T'as du mal à t'faire tout seul, dans ton top 5, y a trois feats (Dans ton top 5, y a trois feats?!)
C'est l'univers d'un rappeur gore
J't'ai fait rejoindre Tengo John dans le cimetière des rappeurs morts
Univers sombre j'suis dans la place, faudrait qu'tu t'regardes dans la glace
Quoi ? Tu croyais m'éteindre, avec des fausses fiches de la CAF
Indépendant j'prends plus que toi, car en c'moment j'stream plus que toi
Un fils de politique qui s'moque des pauvres c'est maladroit
Pour toi le succès est parti, j'ai vu qu'tu manques de répartie
Le rap c'est cuit dis à ton père de t'faire bosser dans son parti
Zoin
You might also like[Outro]
Eppsmytho
T'as tellement aucun dossier alors il t'a fallu huit minutes de mensonges
Tu es faible
Et la prochaine fois, mens bien au moins
Tu mets une sextape même avec le flou on voit qu'la meuf est plutôt blanche
Manque de pot la mère d'mes gosses est Haïtienne
Mais comme tu la connais pas, tu pouvais pas savoir
J't'ai vu seulement trois fois dans ma putain d'vie frérot
On t'connaît même pas
Ensuite, Universal ne m'a jamais rendu d'contrat
Pour la simple est bonne raison qu'Universal n'a jamais été mon patron
J'étais produit par Culture Records, qui eux, étaient en distrib' chez Universal
D'ailleurs, j'ai récupéré tous mes masters y a pas très longtemps
Comme tu peux l'constater
Alors t'as essayé, t'as échoué
Mais faut plus réessayer, comme le livre de ton frère
D'ailleurs lui, dis lui d'fermer sa grande gueule sur les réseaux
Qu'il aille faire l'entrepreneur à la Yomi Denzel et qu'il ferme sa grande machoire
Tes managers Kantax et Konako aussi, change d'équipe frérot, ils sont pas dignes
Tu t'es fait chiffonner dans un coin, y a même pas eu d'représailles
Un fils de politicien dans l'rap, t'es en mode Pierre Sarkozy
T'as confirmé c'que j'ai dit dans ma première disstrack
T'es un menteur, tricheur, manipulateur, Industry Plant
Dans ton clash, y a que mon nom ma ville et ma date de naissance qui sont réels
Et pour finir, ça fait trois morceaux qu'tu m'dis qu'tu connais mon adresse
Mais p'tite pédale, j't'ai jamais vu d'vant ma porte
Bonne continuation fils de chien
ZoinEmbed"
