Artist,Title,Lyrics
404Billy,404Savage,"5 Contributors404Savage Lyrics[Paroles de ""404Savage""]

[Couplet 1]
Sur le toit, boy, j'ai le sniper, gros, y a des shooters et des fighters
J'roule à 200 dans la Viper, j'ken les trois sœurs surtout Piper
Polo crocodile, elle kiffe, elle veut faire un tour dans le bendo
Elle est gée-char comme l'extendo, hey, no (extendo)
J'suis sur l'Macintosh, fin des temps approche
J'ai vu toutes les news, que c'est moche, veulеnt se mettre l'Afriquе dans la poche
J'ai crié, j'ai rodave que dans leur matrice, y a des putains d'failles
Fuck la paix, fuck l'amour, j'ai le cœur percé comme les tétons d'Shay
Ni East Side, ni West Side, mais plutôt Dark Side (Dark Side)
J'demande des nudes comme Martial, l'art est martial, l'éjac' est faciale (eh, eh)
J'ai le truc, j'ai la discipline, en années communes, en années bissextiles
J'suis frais, j'suis noir, j'suis comme Michael des années eighties
Qu'est-ce qu'alimente l'être-humain pour qu'il face autant d'dingueries ? (Oh, gang)
Des fois, je me demande de qui on vient pour qu'on fasse autant d'singeries (j'me demande)

[Refrain]
404Savage (ouh), 404Savage (hey), brutal tout l'temps, toujours seven sur seven (fouh)
404Savage (hey), 404Savage (ouh), brutal tout l'temps, toujours seven sur seven (tou-tou-tou-touh, hey)

[Couplet 2]
J'suis bien éduqué mais insolent, j'attends que la mort, gros, c'est trop lent
J'crois qu'j'ai fait l'tour comme Magellan, j'ai croisé la Faucheuse, elle m'a gué-lan
Tu m'ajoutes sur Snap', tu m'observes, j'accomplis quelque chose, t'as l'seum
J'crois qu't'es bipolaire, t'es comme Kanye, t'es pas trop stable, j'ai d'jà gagné
J'suis un bâtard, l'anti-héros qui gêne, notre relation est juste clitoridienne
J'ai bien envie d'investir en dizaines de K, okay
Biatch, dis-moi juste si tu baises, j'prends mes cliques et mes claques si tu blablates
Produit cellophané sous le canap', j'ai la rage de vaincre, j'ai le panache
J'pense à investir dans un FAMAS, j'viserai pas les jambes mais les ganaches
On prend notre oseille et on s'arrache, j'nettoie au Kalash' (grah), pas au car wash
Hallucination, tu m'as pas vu, j'pénètre que les chattes, pas les cavus
J'allume comme Taliban, j'ai mon talisman, le monde : une prison, les enfants aux arrivants (enfants aux arrivants)
Le monde : une prison, les enfants aux arrivants (arrivants, ouh)
You might also like[Refrain]
404Savage (ouh), 404Savage (hey), brutal tout l'temps, toujours seven sur seven (fouh)
404Savage (hey), 404Savage (ouh), brutal tout l'temps, toujours seven sur seven (tou-tou-tou-touh)

[Outro]
C'est sombre
C'est comment ? C'est sombre
400, le 4, tu connais déjàEmbed"
404Billy,44% (Oh Shit),"4 Contributors44% (Oh Shit) Lyrics[Paroles de ""44% (Oh Shit)""]

[Intro]
Zoo
Tou-tou-tou-touh
Go (go)
Sheesh (sheesh)
Le quatre (quatre)
Hey (hey)

[Refrain]
T'hallucines et tu signes, nous, c'est tout pour la win
Ils ont peur de mes G qui consomment la weed
J'ai pas l'temps pour les putes, j'aime pas l'temps pour les Kim
On s'ennuie dans le binks et ça commet des crimes
Oh shit (oh shit), ils essayent d'être sombres mais se prennent pour le quatre (ils se prennent pour le quatre)
J'suis du côté obscur, j'crois qu'j'ai passé un cap
T'hallucines et tu signеs, nous, c'est tout pour la win
Ils ont peur de mеs G qui consomment la weed
J'ai pas l'temps pour les putes, j'aime pas l'temps pour les Kim
On s'ennuie dans le binks et ça commet des crimes
Oh shit (oh shit), ils essayent d'être sombres mais se prennent pour le quatre (ils se prennent pour le quatre)
J'suis du côté obscur, j'crois qu'j'ai passé un cap

[Couplet 1]
J'avais l'cœur sur la main, puis, j'ai serré des mains donc ce dernier a fini écrasé
À leurs yeux, j'suis un bâtard, j'suis un chien parce que ma race est croisée
La putain d'destruction, moi, c'est ce que je veux, j'veux la carrière de Diam's et des cailloux de diams
T'as l'viseur sur le crâne, dis ""au revoir"" à ta tain-p', t'es tombé dans le trou, t'as le flow de Saddam
Rien n'est acquis, n'est acquis (acquis), j'ai le Haki, le Haki (ouh)
Jouent les Capo dei Capi (dei capi), c'est des Tayc de Tayc (tou-tou-tou-touh)
J'aimerai t'éliminer, voir ton visage en sang
J'ai le cœur d'un monster, le sourire d'un enfant, ça sent plutôt la mort, ça sent pas trop l'encens (shee)
You might also like[Refrain]
T'hallucines et tu signes, nous, c'est tout pour la win
Ils ont peur de mes G qui consomment la weed
J'ai pas l'temps pour les putes, j'aime pas l'temps pour les Kim
On s'ennuie dans le binks et ça commet des crimes
Oh shit (oh shit), ils essayent d'être sombres mais se prennent pour le quatre (ils se prennent pour le quatre)
J'suis du côté obscur, j'crois qu'j'ai passé un cap
T'hallucines et tu signes, nous, c'est tout pour la win
Ils ont peur de mes G qui consomment la weed
J'ai pas l'temps pour les putes, j'aime pas l'temps pour les Kim
On s'ennuie dans le binks et ça commet des crimes
Oh shit (oh shit), ils essayent d'être sombres mais se prennent pour le quatre (ils se prennent pour le quatre)
J'suis du côté obscur, j'crois qu'j'ai passé un cap

[Couplet 2]
J'ai l'aura meurtrière comme la police (police)
Fuck les (fuck les) groupies (groupies) qui veulent voir comment c'est dans les coulisses (ouh)
Même si t'as l'cul d'un chantier dans Foolish (ouh)
Allergique aux faux négros, pas au pollen (sheesh), tu pues ta mère, j't'arrose à l'eau d'Cologne (rah)
J'ai le poids d'mes péchés sur la colonne, j'ai la ppe-fra de l'attaquant d'Pologne
Pas besoin d'coop' pour me faire blow up, solo, j'serais à bord du Buggy
Quand j'te baise, j'préfère que t'enfiles le masque d'Anonymous si t'es trop ugly
Ils savent pas réfléchir, c'est des kodos, il faut qu'ma voix résonne dur dans les autos
J'regarde leurs clips et leurs armes, c'est des couteaux (rah), j'suis le maître du son, y a pas photo

[Refrain]
T'hallucines et tu signes, nous, c'est tout pour la win
Ils ont peur de mes G qui consomment la weed
J'ai pas l'temps pour les putes, j'aime pas l'temps pour les Kim
On s'ennuie dans le binks et ça commet des crimes
Oh shit (oh shit), ils essayent d'être sombres mais se prennent pour le quatre (ils se prennent pour le quatre)
J'suis du côté obscur, j'crois qu'j'ai passé un cap
T'hallucines et tu signes, nous, c'est tout pour la win
Ils ont peur de mes G qui consomment la weed
J'ai pas l'temps pour les putes, j'aime pas l'temps pour les Kim
On s'ennuie dans le binks et ça commet des crimes
Oh shit (oh shit), ils essayent d'être sombres mais se prennent pour le quatre (ils se prennent pour le quatre)
J'suis du côté obscur, j'crois qu'j'ai passé un capEmbed"
404Billy,55% (Mauvais présage),"6 Contributors55% (Mauvais présage) Lyrics[Paroles de ""55% (Mauvais présage)""]

[Intro : tag]
S-V4GE made this shit

[Couplet 1]
Faites-moi vos plates excuses ou j'tire dans chaque plexus, faut une black Lexus
Pas besoin d'Patek plus un gros bolide pour savoir que ces tasses-pé m'sucent
L'arrivage du drone est imminent comme Qassem qui sort de l'aéroport
Il faut plus que m'payer pour parler aux porcs (parler aux porcs, parler aux porcs)
Le style est grave si l'animal, quand y a plus à graille, on devient cannibale
Quand tu marches ou tu parles, on dirait qu'tu ravitailles toute la capitale
Prеnds du recul, t'es pas d'ma hauteur, t'еs assis sur une chaise
Avant trente ans, j'suis assis sur le siège, j'fais d'la trap en esquivant les pièges
Leurs vies, c'est du cinéma, c'est du pâté, société où c'est dur d'avoir l'ze-n épaté
On fait pas d'chrome, c'est pas Cofidis, tu fais toutes les pauses tah les trapézistes
Depuis Hostile, j'fais des cicatrices comme si ils avaient l'visage de Sig
J'recharge mes piles, tu marches le froc baissé, tu r'cherches un deal
Ils ont pas d'culture, avant d'rapper, ils trainaient au skate-park
Il suffit pas d'être dark pour moi, pour qu'ma carte soit black
C'est des fils de putes, c'est des fils de polythéistes
C'est trop noir, j'ramène les ténèbres dans les playlists et ils savent que c'est puissant

[Refrain]
T'as de la merde dans l'gosier, cours à la scelle pour pénave
À moi tout seul, j'suis un mauvais présage
T'as de la merde dans l'gosier, cours à la scelle pour pénave
À moi tout seul, j'suis un mauvais présage
You might also like[Couplet 2]
PDP, j'vais ramener la coupe (j'vais ramener la coupe) pour tous mes loups dans la vente
Pour tous mes loups dans le BTP, aucun cœur dans l'scanner
T'as cru qu'on allait s'vendre ? Allez, baise ta mère
On parle toujours français malgré toutes nos fautes de grammaire
Leurs succès sont bizarres, j'ai l'impression qu'ils pactisent
Rien de factice dans mes tactiques, on fréquente pas Iblis
J'aimerais être un black Leonidas pour les Ouïghours, les Rohingyas
L'être-humain n'est qu'une stat, vaut moins qu'une statue
Tout repose sur un seul homme comme au FC Barcelone
""Billy-sama"" comme ça qu'le gars se nomme, j'vois la vie que d'un seul œil
Tellement rare, mon cœur chevelu c'est du cœur véritable
Y a plus rien d'évitable, leurs châteaux, c'est du sable, ils vont pas m'faire, j'dors à côté du sabre
Le succès, c'est long, il y a plusieurs échelons mais pour m'upgrade, c'est che-lou
Même Bernard Arnault n'a aucune richesse si il n'croit pas au Très-Haut (sa destinée)
On s'est décidés pendant qu't'attends un signe, j'rappe pas pour ta pute sur l'siège pass'
À la fin, c'est un tir, y a pas d'clap, rideaux fermés, fin du spectacle, zoin

[Refrain]
T'as de la merde dans l'gosier, cours à la scelle pour pénave
À moi tout seul, j'suis un mauvais présage
T'as de la merde dans l'gosier, cours à la scelle pour pénave
À moi tout seul, j'suis un mauvais présageEmbed"
404Billy,66% (X1000),"4 Contributors66% (X1000) Lyrics[Paroles de ""66% (X1000)""]

[Intro]
Zoo, hey

[Couplet 1]
Laissons l'ego de côté, l'egotrip de côté
Ils disent que j'suis sous-coté, si j'perce, ils diront qu'j'ai d'la chatte
Cette année, on blague plus, c'est la guerre, il faut sortir les chars
C'est pas dur d'baiser cette life, en bas, y a déjà trop d'écart
Mon sin-c' m'appelle au téléphone (y a des terrains qu'faut acheter)
Avec les grands, j'traînais dans l'hall mais j'posais sur des phases B
J'suis devenu père à quinze piges, quinze ballets
À cette période, j'ratais les cours ou j'insultais les instit'
Alors, quand elle v'nue m'voir avec son ventre tout rond
Qu'est-c'tu voulais qu'j'réponde ? J'avais pas d'cerveau, pas un rond
Fallait qu'j'me donne au maximum, puis, les autres, tombés un à un
En prison pour mineurs, j'avais clairement pas c'truc-là dans l'viseur
Villiers, y avait quelques drah, c'était pas des flingues en plastique
Donc j'ai bien fait mon truc pour monter, pas rester statique
Mon père sorti du placard, on rattrape le temps avec quelques prières
Ouais, j'me dis qu'c'est jamais trop tard
J'suis fier de l'homme que j'deviens, j'suis même pas sûr d'être là demain
J'fais gaffe à mes fréquentations, mes mots, les interprétations
Quand j'ai commencé l'rap, c'était la passion, j'pensais pas au cash
Les types commencent le rap, ils pensent aux meufs, au luxe, aux marques de sapes
Ma mère blanche, dans son ventre, portait un gosse noir
Elle en a bavé, j'aimais pas l'monde avant d'le voir
Né en Normandie, v'nu sur Paris, élevé dans l'ghetto
Ils pensent que c'est l'contraire, c'est moi j'manie, c'est moi Geppeto
You might also like[Pont]
Ils nous demandent d'avoir un cœur mais qui a eu un cœur pour nous ?
La haine que tu nous donnes, on va t'la donner fois mille
La haine que tu nous donnes, on va t'la donner fois mille
Ils nous demandent d'avoir un cœur mais qui a eu un cœur pour nous ?
La haine que tu nous donnes, on va t'la donner fois mille
La haine que tu nous donnes, on va t'la donner fois mille

[Couplet 2]
Le talent attire les envieux, la religion attire les gens ieux-v
Il faut qu'j'm'éloigne des faux-culs, que j'fasse mon truc, que j'reste focus
Certains noirs sont des clowns, ils ont qu'à l'prendre comme une offense
C'est soit la guerre ou le silence, nous fais pas l'Black Panther de France
On sait qu'faire ça, courber l'échine, on s'est fait racheter par la Chine
Parce qu'on pense qu'à danser, chanter, depuis l'époque de Sex Machine
Alors pourquoi tu viens t'plaindre ? Ferme ta gueule et fais le job
Et si un mec t'insulte de sale noir, mon frère, nique-lui sa mère
Fuck les humains, fuck les scientifiques qui voudraient défier Dieu
Et tous les autres, ils font la révolution d'chez eux, boy
J'répète : la haine que tu nous donnes, on va t'la donner fois milleEmbed"
404Billy,6 Pierres,"15 Contributors6 Pierres Lyrics[Paroles de ""6 Pierres""]

[Intro]
BLKKKK Van Gogh 2
400 putain de 4
T'as reconnu la signature
ZoinGoinZoin

[Couplet Unique]
Vivre ici-bas c'est comme se baigner dans une flaque d'eau
Mouton noir, j'aime pas trop les troupeaux
Connaissent aps ni mes origines, ni ma plaque
J'viens enculer ton peuple comme l'arrivée du crack
J'ai quelques flashbacks, destiné à faire du sale
Depuis l'homme des cavernes grandit sur l'tarmac
J'rappe comme si j'venais d'avant, comme si on m'avait gelé
J'mangeais pas d'argent tout c'tеmps c'est comme si j'avais jeûné
T'еs qu'une merde donc j'te salue d'la main gauche
J'veux les six pierres comme Thanos, élever mon fils comme Kratos
J'ai vu les autres, délaisser leur art
Moi perso j'suis venu cracher mon dard, tant qu'le terrain est praticable
J'essaie de devenir un homme sage prier mes cinq fois
J'suis pas là par hasard, comme les lignes sur mes cinq doigts
Ton flow est à verser dans les WC
J'prends du recul y a pas de larmes versées lors des décès
J'comprends ap, les mecs se mettent à rapper
Mais ils sont déjà riches apparemment c'est des artistes
On passe le cap on gravit grave, on évolue on s'ravitaille
Ils sentent les secousses dans leurs jambes quand j'suis al
On s'plaint pour rien
Chez nous il pleut des gouttes, dans d'autres bleds il pleut des missiles
Parfois, j'suis un peu extrême comme Makala
Sur moi l'katana, l'aura d'Madara
Joue-t'il la comédie? Est-il fou? Est-il si cinglé?
Oublie pas Dieu, même si tu roules dans grosse cylindrée
Sois ouvert au monde ne fais pas le jeune chauvin
J'me vois à Memphis écoutant jeune Dauphin
J'pense à l'enfance, les cris les ceintures
J'peints des mots, j'écris des peintures
Faut qu'j'leur fasse c'que ces salopes méritent
J'les énerve mais l'niveau est stratosphérique
You might also like[Outro]
Ils peuvent rien faire
404
BLKKKK Van Gogh 2Embed"
404Billy,77% (SOS),"6 Contributors77% (SOS) Lyrics[Paroles de ""77% (SOS)"" ft. Guy2Bezbar]

[Intro : tag]
Oh my god

[Couplet 1 : Guy2Bezbar]
Ouh (hein, hein), hein, hein (hein, hein), c'est ton gars Coco Jojo, 404
J'sais qu'ils m'aiment pas mais j'me gare devant eux, ces fils de, flingueurs, sur Champs-Élysées qu'on s'coiffe (flingue)
Depuis qu'on est là, pas de flop, flop (nan), j'envoie texto (fort), mange au resto (han)
J'gare la Tesla (frais), j'fume un joint, joint, joint, couleur pesto (kush)
Et hop, hop, hop, majeur en l'air comme ses jambes (ah, han), fuck les cops, cops, cops (han)
En pétard, en pétard, en pétard, en pétard comme Ivar le Désossé (violеnt), avec que des OG's qu'on s'associе
Hein-hein, hein-hein, hein (ah, ah), hein-hein-hein, hein-hein-hein
On va casser la bouteille sur ta tête, enfoiré (pah), t'as l'air un peu trop costaud (t'as l'air un peu trop costaud, ouh, ouh)
T'as l'air un peu trop costaud, tout l'monde sait bien que partout, j'ai riposté (brrah)
J'en ai fait dormir à l'hosto (pah), on faisait peur à tous ceux qu'tu détestais (ah, ah, ah, ah)
Mythic ou my G, c'est ton gars Coco Jojo (Jo) et 404 (quatre)
Grosse réunion flingueur ici (pah), quand on tire, on vise pas les pattes (mmh, mmh)

[Refrain : Guy2Bezbar & 404Billy]
Quand j'aurais plus rien à gratter dans les rues, c'est que j'aurais fait le maximum d'oseille (mmh, mmh, mmh, mmh, mmh, mmh, mmh, mmh)
Si t'es réglo, tu finiras p't-être déçu, les soucis font que j'peux pas trouver le sommeil (mmh, mmh, mmh, mmh, mmh, mmh, mmh, mmh)
Han, tu cherches quoi ? Tu v'-esqui, t'attends quoi d'nous ? (Mmh, mmh, mmh, mmh)
Elle té-ma l'attitude, elle veut que j'lui mette son coup (mmh, mmh, mmh, mmh)
Ah, tu cherches quoi ? Tu v'-esqui, t'attends quoi d'nous ? (Mmh, mmh, mmh, mmh)
Elle té-ma l'attitude, elle veut que j'lui mette son coup (mmh, mmh, mmh, mmh)
You might also like[Couplet 2 : 404Billy]
On rêve de Rolls Royce, de VVS (VVS), la peau d'leurs culs sous mes BBS (ouh, ouh)
Tu dis qu'tu nous connais, on dit : ""Qui est-ce ?"", fais pas trop l'fan, j'suis pas BTS (non, non)
On connaît pas l'bénévolat, G, c'est comment ? (C'est comment my G ?)
J'arrive à Bezbar (oui), on leur laisse aucun espoir (hey, hey), Guy, c'est comment ?
Flex comme Weezy ou Jeezy, marathonien comme Nipsey, oui, oui
Moi, j'oublie rien, c'est physique, ici (hey), on m'a fouetté dans l'Mississipi
Vas-y, gare-toi d'vant eux, G (vroum, vroum), j'encule les envieux, gros, j'encule les envieux (j'encule les envieux, gros)
On encule les envieux (on encule les envieux, hey, hey, hey), le bruit d'la mort sort d'un silencieux (piou, piou, piou)
Et ça fait plaisir comme le sang d'un keuf (eh, eh), elle veut l'resto, j'l'emmène au 129 (fort)
Salope, choisis ton cheese (choisis ton cheese), salope, choisis ton cheese (ton cheese)
Je sais qu'le pain attire les mouettes (hein), au studio, p'tite bouteille de Moët (han, han)
On flingue, il n'y aura pas d'SOS (non, non), on flingue, il n'y aura pas d'SOS (non, non)

[Refrain : Guy2Bezbar & 404Billy]
Quand j'aurais plus rien à gratter dans les rues, c'est que j'aurais fait le maximum d'oseille (mmh, mmh, mmh, mmh, mmh, mmh, mmh, mmh)
Si t'es réglo, tu finiras p't-être déçu, les soucis font que j'peux pas trouver le sommeil (mmh, mmh, mmh, mmh, mmh, mmh, mmh, mmh)
Han, tu cherches quoi ? Tu v'-esqui, t'attends quoi d'nous ? (Mmh, mmh, mmh, mmh)
Elle té-ma l'attitude, elle veut que j'lui mette son coup (mmh, mmh, mmh, mmh)
Ah, tu cherches quoi ? Tu v'-esqui, t'attends quoi d'nous ? (Mmh, mmh, mmh, mmh)
Elle té-ma l'attitude, elle veut que j'lui mette son coup (mmh, mmh, mmh, mmh)

[Outro : Guy2Bezbar]
Mmh, mmh, mmh, mmh
Mmh, mmh, mmh, mmhEmbed"
404Billy,88% (Window),"10 Contributors88% (Window) Lyrics[Paroles de ""88% (Window)"" ft. Benjamin Epps]

[Intro : 404Billy]
Ju'-Ju'-Ju'-Ju'-Ju'-Ju'-Ju'
Hey, hey, hey

[Couplet 1 : 404Billy]
Tu peux remballer ton grec, j'veux le homard (zoin), j'suis avec le poto Epps mais pas Omar (sheesh)
Du génie, c'est du classique, c'est du Mozart, c'est du sale, c'est du noir, c'est la ZUP, pas les Beaux-Arts (gang)
Eppsito, on les attend dans les bureaux comme Vito (hey)
Tous les investissements sont vitaux (hey), faut leur dire qu'j'ai le doigt sur l'clito' (yeah)
Ils ont pas compris, là, c'est next level, gros, des billets d'banquе, moi, je sais c'qu'elles vеulent
J'suis CR7 chez les Red Devils, tu baises avec l'ennemi, t'es comme Faith Evans
J'allume deux-trois bouffons, j'm'endors auprès d'cette pute et puis, je pense à mon fils, négro
Quand mon père sort de taule, j'l'ai pas vu d'puis longtemps, j'le r'garde et j'me dis : ""C'est qui c'négro ?""
Les humains deviennent têtus, j'ai des sombres soupçons sur leur vécu (touh)
Le poto est v'nu du Gabon pour du sale (sale), je lui souhaite des belles meufs et des belles vues
Costard, j'te braque, le cigare au bout des lèvres et t'as tout d'suite le cigare au bord des lèvres
Dégaine d'mauvais élève, y a pas de quiproquo, le boy est grave céleste, j'attends qu'mon âme s'élève
Petit métisse, gal'-Séne, 'boula (eh), ils hallucinent, j'ai des pouvoirs (eh)
Petit, j'étais méchant sans le savoir (eh), j'rackettais des p'tits mecs dans les couloirs (eh, zoin)
On fait même des affaires sur Discord (vroum, vroum), j'aime les types qui cherchent pas la discorde (zoin)
C'est pas du rap, j'crois qu'ils font d'la disco' (non, non), ils sont ches-lou, ils ont l'swag à Cisco

[Refrain : 404Billy]
On passe par la window (on passe pas la window), on nous a donné l'go (grrah, grrah)
Tou-tou-tou-touh (tou-tou-tou-touh), on t'allume dans le dos (zoin, zoin)
On passe par la window (on passe pas la window), on nous a donné l'go (on nous a donné l'go)
Tou-tou-tou-touh (tou-tou-tou-touh), on t'allume dans le dos (on t'allume dans le dos)
You might also like[Post-refrain : Benjamin Epps & 404Billy]
J'ai les amis dans le club (j'ai les amis dans le club), on a reçu le dos' (zoin, zoin)
Donné le go (tou-tou-tou-touh), tiens-les au mot (hey, hey)
On passe par la window (zoin, zoin), ils ont donné le go (ils ont donné le go)
Tou-tou-tou-touh (tou-tou-tou-touh), on t'allume dans le dos (on t'allume dans le dos)

[Couplet 2 : Benjamin Epps]
Les maisons d'disques me donnent même pas dix pour cent, ils s'étonnent qu'les négros ne soient même pas à dix pour cent
Une musique correcte et y a v'là les jours sans, tu m'regardes de haut, j'te prends à califourchon
J'voulais pas le faire, on en a parlé pourtant, j'sais pas pour qui ils m'prennent, nigga
Doucement, j'deviens le boss donc j'suis comme Scarface pour ce game, nigga
Conscient qu'en playlist, ils vont pas nous rentrer, on va les braquer, arrêtez de parlementer (arrêtez de parlementer)
Ils sont partis, ils vont pas nous manquer (let's get it), et c'est pas des monkeys (okay)
Le jeu a besoin de soutien, j'vais le corser, ils me regardent comme si j'étais Condorcet
Personne te connaît, re-noi, t'es pas Morsay, tout l'monde s'en bat les couilles, arrête de forcer (hey, hey)
J'ai des trophées pour lesquels j'ai même pas encore fêté
Tes négros s'prennent pas pour d'la merde, ils ont même pas encore pété (wouh)
Donne-moi ma pièce (donne-moi ma pièce), salope, descend de ma caisse (salope, descend de ma caisse)
J'a-j'arrive en Benz, j'ai pété deux cent mille, la révolution de la tess (yeah)
Deux négros cannibales, voilà le thème, un million d'euros donc voilà le fame
Baggy et bandana à la Wu-Tang, tes gens sont tombés comme Saddam Hussein
Dis bonjour au bachelor ou je sors le métal comme Arcelor
Là, t'assistes au Real contre Barcelone et mes chaînes sont réelles, mon gars, c'est d'l'or, okay

[Refrain : 404Billy]
On passe par la window (on passe pas la window), on nous a donné l'go (grrah, grrah)
Tou-tou-tou-touh (tou-tou-tou-touh), on t'allume dans le dos (zoin, zoin)
On passe par la window (on passe pas la window), on nous a donné l'go (on nous a donné l'go)
Tou-tou-tou-touh (tou-tou-tou-touh), on t'allume dans le dos (on t'allume dans le dos)
[Post-refrain : Benjamin Epps & 404Billy]
J'ai les amis dans le club (j'ai les amis dans le club), on a reçu le dos' (zoin, zoin)
Donné le go (tou-tou-tou-touh), tiens-les au mot (hey, hey)
On passe par la window (zoin, zoin), ils ont donné le go (ils ont donné le go)
Tou-tou-tou-touh (tou-tou-tou-touh), on t'allume dans le dos, on t'allume dans le dos

[Outro : Benjamin Epps]
On t'allume dans le dos
Ju'-Ju'-Ju'-Ju'-Ju'-Ju'-Ju'Embed"
