Artist,Title,Lyrics
404Billy,Cœur fermé,"6 ContributorsCœur fermé Lyrics[Intro] **voix robotisée**
J'ai coeur fermé ? (J'ai coeur fermé ? x3)
J'ai coeur fermé ? (J'ai coeur fermé ? x3)

[Couplet 1]
Ma belle si j'te baise c'est pour eilaj mes peines
Tu m'auras pas comme mon ancêtre au jardin d'Éden
Tant qu'tu n'as pas d'MST, on continuera (continuera)
Tu t'demandes si j'vais te laisser, qui vivra verra
On refera nos vies comme t'as refait t'a poitrine
Quand tu t'endormira, j'irai baiser la voisine
Si j'ai pas d'chance j'te ferai des gosses, t'as fait, rouler ma bosse, bosser de neuf à cinq, rentrer, mater la boxe hey
J'm'enfonce et je réalise, dans l'instant présent, je rêve et j'idéalise
Dans mes plus beaux rêves, comme Paradis je privatise
Mais je vais peut-être finir, noyé dans la tise
Si j'perd mon temps (no), si j'ai pas de plan (no) je vais mal finir (no), posé d'vant l'écran (no)
J'crois tu m'ralenti, mais ça c'est qu'mon ressenti (hey), l'espoir retenti (hey), je dirais pas ""tant pis"" (no)

[Refrain]
J'ai comme l'impression qu'tu sert à rien (han)
T'es présente seulement, quand tout va bien (han)
Le temps c'est de l'argent et je le paye (wow)
T'es tellement acquise que je n'crains rien (han)
J'ai comme l'impression qu'tu sert à rien (han)
T'es présente seulement, quand tout va bien (han)
Le temps c'est de l'argent et je le paye (wow)
T'es tellement acquise que je n'crains rien (wou)
You might also like[Pont]
J'ai coeur fermé, j'ai coeur fermé, j'ai coeur fermé, j'ai coeur fermé, j'ai coeur fermé, j'ai coeur fermé (hey)

[Couplet 2]
J'me suis laissé envahir, par la routine, pourtant je sais que j't'aime pas mais je m'obstine
Foncer droit dans l'mur, c'est c'qu'on fait j'suis baisé complet, plein d'projet, j'avais, j'réaliserai, jamais
Relations bien entamée, mon cœur n'est plus enflammé
Sans âme, j'n'ai plus d'passion plus d'plaisir, même quand, j'te la met
On finira pas, en apothéose (no), à quoi ressemblera ta vie, à la ménopause
Tu te lasseras, tu t'taperas, un collègue (salope)
J'vais m'lasser, j'serai pris de colère (salope)
Qui nous comprendra mieux qu'nous, on va finir par être fou, l'habitude à pris l'dessus on va s'aimer par défaut
Tu m'suces mieux pour qu'je reste, merde plus je reste plus j'te blesse
J'me retourne pour mater fesses au-d'ssus d'mon coeur c'est l'Everest
Il faut qu'tu t'fasse à l'idée qu'serai jamais ton mari
Désolé mais j'dois t'quitter pour conquérir Paris (hey-yeah)

[Refrain]
J'ai comme l'impression qu'tu sert à rien (han)
T'es présente seulement, quand tout va bien (han)
Le temps c'est de l'argent et je le paye (han)
T'es tellement acquise que je n'crains rien (han)
J'ai comme l'impression qu'tu sert à rien (han)
T'es présente seulement, quand tout va bien (han)
Le temps c'est de l'argent et je le paye (han)
T'es tellement acquise que je n'crains rien (wou)
[Pont]
J'ai coeur fermé, j'ai coeur fermé, j'ai coeur fermé, j'ai coeur fermé, j'ai coeur fermé, j'ai coeur fermé (hey)

[Outro] **voix robotisée**
J'ai coeur fermé ? (J'ai coeur fermé ? x3)
J'ai coeur fermé ? (J'ai coeur fermé ? x3)Embed"
404Billy,Colonel,"8 ContributorsColonel Lyrics[Couplet 1]
Des fois, j'aimerais tellement avoir la rage du début
Et comme un con, j'me rappelle que j'suis toujours au début
J'préfère être dans les parages que disparaître
T'es en sueur quand les keufs t'arrêtent, alors qu'y'a rien dans ta mallette
Tout c'qui m'vient à l'esprit, prends tes sous, investis
J'me sens comme sous LSD quand j'prends le flow de Fifty
Petit corps, petite taille, mais un chemin je me suis frayé
Non, ta mère n'est pas une pute, quand j'la baise j'ai pas à payer
J'ai des meilleurs ennemis et puis j'ai des pire amis
Pas pour moi la vie d'famille car j'aime trop la tyrannie
J'suis l'mauvais élève de Villiers-le-Bel, double peine
J'kiffe pas de planche comme polonaise, moi j'suis l'futur colonel
J't'enverrais au bloc opératoire comme rat d'laboratoire
J'vais t'enculer et j'vais boire ta mère : c'est pas la mer à boire
J'suis l'futur j'le dis sans prétention mais t'as du mal à l'croire
Mon frérot encore sous détention donc j'en dors mal le soir

[Refrain]
T'as une arme en plastique, une erreur dans l'casting
Mes soldats au garde à vous, arrogant j'les pousse à bout
T'as une arme en plastique, une erreur dans l'casting
Mes soldats au garde à vous, arrogant j'les pousse à bout
Ta putain frôle l'overdose (tu captes ?)
Fais bellek à qui tu causes, car chez nous y'a que des loups
T'as une arme en plastique, une erreur dans l'casting
Mes soldats au garde à vous, arrogant j'les pousse à bout
You might also like[Couplet 2]
La misère, j'la connais, car j'l'ai vue toute mon enfance
Tu sers à r, comme une meuf qui rappe en France
Si j'dois mourir demain, j'emmène mes ennemis dans mes bagages
J'marche seul dans la ville, bats les couilles : j'ai v'la les palabres
J'respecte ni lui ni elle, j'ai peu d'amis fidèles
Organes sont en métaux, boycotté comme ghetto
Quand j'attaque comme Eto'o, j'ai le flow de Magnéto
Tu rappes trop à l'ancienne, j'regarde tes clips dans l'magnéto
J'suis tellement dans l'futur qu'j'ai oublié qu'il était tôt
J'suis tellement dans l'bre-som qu'j'ai oublié qu'il faisait beau
J'suis fêlé comme Trevor
Quand j'recherche le trésor
Trop d'fumée dans la pièce
Des souvenirs c'est tout ce qu'il me reste

[Refrain]
T'as une arme en plastique, une erreur dans l'casting
Mes soldats au garde à vous, arrogant j'les pousse à bout
T'as une arme en plastique, une erreur dans l'casting
Mes soldats au garde à vous, arrogant j'les pousse à bout
Ta putain frôle l'overdose (tu captes ?)
Fais bellek à qui tu causes, car chez nous y'a que des loups
T'as une arme en plastique, une erreur dans l'casting
Mes soldats au garde à vous, arrogant j'les pousse à bout
Hey
[Couplet 3]
Okay, hey, hey, zouin, zouin
Contre p'tit enculé, j'ai l'arsenal ils n'sont pas de taille
Je parle peu, j'suis silencieux, quand j'leur fais face j'laisse pas de faille
Jack Daniel, Hennessy, je n'bois pas d'teilles de Ballantines
Trop de putains veulent le butin, s'font discrets comme feu de paille
No no no, c'est trop tôt, j'ai c'qu'il faut pour les ken comme bonobo
Trop de weed à l'état j'obligeais d'voir vert comme écolo
N'attends pas ta bague, ça sert à rien j'serais très mauvais époux
Je vis comme si j'étais mort, ça sert à rien de prendre mon poulsEmbed"
404Billy,Crack,"9 ContributorsCrack Lyrics[Paroles de ""Crack""]

[Intro]
400 putain d'4
J'reviens me venger comme MF Doom
Bang, boom
Qu'est-ce que tu nous montres là ?
Fais voir ce que tu montres là
Fais voir, fais voir, fais voir

[Couplet 1]
Tu nous montres ton disque d'or mais montre-nous ton pourcentage
J'suis un gamin, j'ai douze ans d'âge ; indé : j'suis tout à coup sans cage
Pourquoi ce sont tous des suiveurs ? Ma réponse, tu vas adorer
George Floyd, c'est loin, y a plus personne aux manifs d'Assa Traoré
Sombre triche anti-sèche, téléphone rempli d'textes
J'me lève pas souvent du bon pied, j'ai envie d'être ambidextre
T'as peur du succès ? Mais frérot, rassure-toi
Même si tu sors un double album, tous les yeux ne s'ront pas sur toi
Toujours le style insolent, j'flingue tout l'monde dans mes paroles
Et si quelqu'un m'envoie un pique, j'préviens, j'insulte les daronnes
Qu'est-ce que j'm'en tape que mes pensées divisent
Ils préfèrent ceux qui divertissent à ceux qui pensent et qui disent
Ils veulent quand même qu'on sache des choses, c'est un étrange équilibre
Ils n'aiment pas trop les noirs qui lisent, préfèrent qu'ils dansent et qu'ils tisent (glou, glou, glou, glou)
Les grandes marques sont les véritables OG
Ils utilisent des idéologies pour mieux vendre leurs produits
You might also like[Refrain]
C'est l'arrivée du 4, c'est l'arrivée du crack
J'viens enculer ton peuple, comme l'arrivée du crack
Putain, t'es un baisé dans c'que tu dis, Billy
T'es un fou dans ta tête, t'es un baisé frère !
C'est l'arrivée du 4, c'est l'arrivée du crack
J'viens enculer ton peuple, comme l'arrivée du crack
Tu vas te faire boycotte, frère si ça continue comme ça
Attention, frérot, c'est chelou un peu

[Couplet 2]
La cancel culture est juste une dictature
Plus j'crois en Dieu et plus leurs menaces, j'les vois en miniature (en mini, mini)
Autant d'remords pour mes propos dans BLKKKK VAN GOGH, que Shay a écrit de textes dans sa carrière
Bizarre comme un pote qui vient pas au placard te voir
Comme un message qui dit ""Mmh, j'vais rentrer tard ce soir"" (ça sent la tromperie)
Les meufs blanches veulent avoir le teint des arabes
Les arabes veulent avoir les fesses des noires
Les meufs noires veulent avoir les cheveux des blanches
Y'a pas d'rimes, j'suis grave perdu dans tout c'merdier
J'vois le monde par ma fenêtre comme Zamdane
Avant la vie était plus belle comme Bagdad (zoin)
Droit comme épouvantail
J'suis à l'intérieur d'elle, elle a les pieds en éventail, j'lui laisse la chatte en emmental
Race humaine est robotisée, penser n'est plus autorisé
Rap français est boboïsé, on s'est fait lobotomiser
[Refrain]
C'est l'arrivée du 4, c'est l'arrivée du crack
J'viens enculer ton peuple, comme l'arrivée du crack
Wesh 404, tu vas pas manger en disant trop la vérité, faut que tu sois dans le top 50, faut que ton son passe en rotation
Tu vois faut que tu manges toi aussi frérot
C'est l'arrivée du 4, c'est l'arrivée du crack
J'viens enculer ton peuple, comme l'arrivée du crack

[Outro]
Mais Billy t'es conscient si tu dis des propos comme ça tu vas te faire boycotte des médias, ça va être chaud pour toi, tu vois le délire ?
Ferme ta gueule frèreEmbed"
404Billy,​​créativité.,"6 Contributors​​créativité. Lyrics[Paroles de ""créativité.""]

[Intro]
Mr.AAA : authenticité, art, argent
Car c'est tout c’qu'il a
ZoinGoinZoin
Le 4
Let's go, on va leur montrer un peu
Hey

[Couplet unique]
Nuit blanche, pensées noires
J’suis tenté d'boire, quand j'me mets à penser l'soir
J'science sur relation et finance en silence
Indépendant, freelance
J'ai repris mon cash sur Binance
J'cache bénéfice max en dessous du clic-clac
J'laisse de stigmates aux primates quand j’ai l’esprit de Pac
Si y a trop de rеgards, j'vais autre part
J’veux passer du hall dе gare à l'Audemars
404DOOM, super villain, KIDVILLAIN, Madvillain
C'est tout droit, y a pas d'dilemme
Dans mon lit, dans mes loges y’a pas de filles laides, pas de vilaines
Elles passent à la douane à chaque DM, zoin
404 partout sur les écriteaux
J'ai compris tôt, j'ai appris tôt, j'ai écrit tôt
J'me fais d'l'argent sans faire billets verts sales
Indépendant, sa mère Universal
Rappeur j'viens t'finir, faire oublier ton hit
Parle pas sur moi ou tu vas supprimer ton tweet
Dans l'cimetière d'mes connaissances, là où mes exs trainent
C'est dangereux, plus j'grandis, plus j'deviens extrême
J'arrête l'alcool, la fête, j'arrête les goes
J'suis l'Joker de Phoenix, t'es celui d'Jared Leto
Nouvelle folie entraine nouvelle connerie
Nouvelle money, faut qu'j'achète nouvelle Rollie
Ça d'vient lassant, tout le game s'prend pour N.I
J'aime mes gosses, j'emmène leur mère à Santorini
J'échoue, je prie, je pète le score, je prie
Même pour le Diable, nos âmes sont hors de prix
Tous tes ennemis s'maquillent en fidèles amis
Aucun fils de pute me dit comment vivre ma vie
J'ai des démons comme toi, j'dois les neutraliser
T'es avec nous ou contre nous, y'a pas de neutralité
You might also like[Outro]
Dans les choses fiables, mon capital j'mise
RIP MF DOOM, Capital Steez
Mr.AAA : authenticité, art, argent
Car c'est tout c'qu'il a
Zoin
La principale raison pour laquelle le respect dû à une personne peut diminuer, c'est sa disponibilité, l'excès de disponibilitéEmbed"
404Billy,Demain,"3 ContributorsDemain Lyrics[Refrain]
Si je crève demain, j'aurais vécu pour rien car j'n'ai pas d'oseille
Quand je me réveille, je pense déjà au lendemain
Je cherche le sommeil car j'en ai besoin
Et j'm’enfonce dans un trou noir sans dire au revoir, yeah

[Couplet unique]
Sombre mélodie, vérité se cache dans l'ironie
Tu veux d'l'amour ? T'auras qu'une sodomie
J'aurais aimé avoir d'autres vies
J'suis tellement fier, garde tes conseils, j'suis sourde oreille
Mets du HSE dans mon verre, j'pense que j'vais vider la bouteille

[Pont]
J'suis tellement fier, garde tes conseils, j'suis sourde oreille
Mets du HSE dans mon verre, j'pense que j'vais vider la bouteille

[Refrain]
Si je crève demain, j'aurais vécu pour rien car j'n'ai pas d'oseille
Quand je me réveille, je pense déjà au lendemain
Je cherche le sommeil car j'en ai besoin
Et j'm’enfonce dans un trou noir sans dire au revoir, yeah

[Outro]
Si je crève demain, j'aurais vécu pour rien car j'n'ai pas d'oseille
Quand je me réveille, je pense déjà au lendemain
Si je crève demainYou might also likeEmbed"
404Billy,Demande à ton père,"4 ContributorsDemande à ton père Lyrics[Intro]
Dose
C'est sombre

[Couplet unique]
J'étais petit, je n'comprenais rien
On m'avait dit qu'le monde était stone
Les rappeurs  sont plus fans de 2Pac
Les rappeurs jouent les Rolling Stones
Nettoyeur sur mon curriculum
J'ai compris que la misère tuait l'homme (hey), hey
En vainquant, les anges me raisonnent, wouh (wouh)
J'suis dans ta chatte, j'la visite bien (j'la visite bien)
P'tit banlieusard, t'es qu'un boloss
Tu t'fais dépouille par Philipp Plein (fuck)
Y a mes traces sur le crime
Sans remords, j'récidive (hey, hey)
Pas beaucoup d'vues ni de streams, mais j'suis le prince légitime
J'vais y arriver sans qu'personne me pousse (personne me pousse)
J'regarde les têtes d'affiche du game, j'suis meilleur qu'eux tous (ils le savent)
J'manque de respect à ta daronne, normal, j'ai pas ses valeurs (salope, salope)
J'ferai plus de clips en couleurs quand j'aurai soigné mes douleurs (hey hey)
Ne joue pas trop l'adorateur (hey), j'ai peu de collaborateurs (hey)
C'que j'te raconte, c'est c'que je vis (chiche)
Je suis l'acteur et l'narrateur (hey)
Réunis les Dragon Ball ou frotte la lampe pour m'invoquer
Ta meuf, c'est comme le monde, elle n'arrête pas d'tourner (pute)
Doigt d'honneur devant l'gendarme
Sans âme, matrixé j'suis comme Van Damme, au calme
Drapeau blanc est dans l'garage, au sale
Boycottage de la culture total
Qui de nous va réussir ?
Quelques cadavres, oh j'ai vu pire
Est-ce que Billy va s'en sortir ?
Demande à ton père, il va t'dire (demande)
Hey groupie, t'as la chatte mouillée (ouh)
Va en Enfer et attends qu'ça sèche (sale pute)
Méfie-toi, j'suis qu'un jeunot
J'suis loin d'la retraite et des dents d'sagesse
T'es plus à la mode comme négro de Châtelet
Mais tu forces sur Instagram
Dans ma rue, se vendent quelques grammes
Dans ma rue, se passent quelques drames (hey)
J'suis pas Dadju, j'suis pas Gentleman (ouh)
J'casse le cul de ses gentilles dames
Très instables sont mes états d'âme
J'préfère perdre plutôt qu'être un âne (hey)
J'ai pas leurs codes ni leur mentalité (dose)
Personne te calcule si t'es pas validé (dose)
Pas dans le move, j'ai sombre identité
J'suis pas humain, j'suis non-identifié (dose, dose)
You might also like[Outro]
404
Billy, Billy, hey
Allez zouin
Allez zouinEmbed"
404Billy,De temps en temps,"2 ContributorsDe temps en temps Lyrics[Intro]
Zoin zoin zoin zoin zoin
C'est comment, boy
C'est comment, tou-tou-tou-tou

[Couplet 1]
Kichta sur le bras comme Posh ST
Faut que je prenne rendez-vous chez l'psy
On est des diamants boy on est des vrais
Eux c'est des faux c'est des Fugazi
Elle veut nos liasses la follasse (wouh)
Elle veut nos liasses la follasse (la folle)
On est des lions comme Aulas (hey)
J'trimbale des ours comme Polak (PLK)
J'préfère l'attaque que la défense (hеy)
L'investissement quе la dépense (fort)
On agit toujours dans la méfiance
On fait gaffe, on fait gaffe (on fait gaffe)
Sa chatte est déjà en feu (tchou)
Y'a pas besoin de siège chauffant (oh)
Son tissage passe par le toit ouvrant (huh)
Merde

[Refrain]
J'aime bien les biatchs (j'aime bien les biatchs)
Mais de temps en temps (de temps en temps)
Posé dans l'carré VIP poser des bouteilles de temps en temps (de temps en temps)
Liker des gros cavus (liker des gros cavus)
De temps en temps (de temps en temps) J'suis quelqu'un de bien mais j'peux devenir un Sheitan en un rien d'temps (en rien d'temps)
J'aime bien les biatchs
Mais de temps en temps (de temps en temps)
Posé dans l'carré VIP poser des bouteilles de temps en temps (de temps en temps)
Liker des gros cavus
De temps en temps (de temps en temps) J'suis quelqu'un de bien mais j'peux devenir un Sheitan en un rien d'temps (en rien d'temps)
You might also like[Couplet 2]
Boy
Du prochain king j'ai les symptômes il faut qu'tu captes boy, il faut qu'ca cartonne (fort)
Dans la Nation pas de fuckboy, y'a que des véritables des gens tah Top Boy (boy)
Nouveau CEO (hey)
Tu mets les petits sur le terrain
Briques de billets s'emboîtent comme dans Tetris, on vient d'en bas donc on perd, rien (rien du tout)
T'as dis mon nom t'en as déjà trop dit (wouh)
Tous les OG's veulent être riches comme Roddy (tou-tou-tou-tou)
Faut qu'j'ai la science d'un mec d'ATL (hey)
Il m'faut une danseuse comme au KOD, comme au KOD, comme au KOD (KOD)
J'les vois en cafards, j'ai vision d'Oggy
Quand j'vais chez elle, j'suis en mission doggy, style

[Refrain]
J'aime bien les biatchs
Mais de temps en temps (de temps en temps)
Posé dans l'carré VIP poser des bouteilles de temps en temps (de temps en temps)
Liker des gros cavus
De temps en temps (de temps en temps) J'suis quelqu'un de bien mais j'peux devenir un Sheitan en un rien d'temps (en rien d'temps)
J'aime bien les biatchs
Mais de temps en temps (de temps en temps)
Posé dans l'carré VIP poser des bouteilles de temps en temps (de temps en temps)
Liker des gros cavus
De temps en temps (de temps en temps) J'suis quelqu'un de bien mais j'peux devenir un Sheitan en un rien d'temps (en rien d'temps)
[Couplet 3]
Doudoune Suprême, nouvelles Jordan
J'suis le type inabordable (toujours)
Pour te braquer y'a pas besoin d'port d'arme on est des voyous pas gendarmes (gang)
Plusieurs bad bitchs dans le i12 (hey)
""Ça sent l'vécu elles aiment les mecs crus""
Mon cousin m'dit à minuit douze
Il reste que des culs dans le RS (que des chattes)
On est pas méchants, pour une fin heureuse, on t'liquide au salon d'massage (braah)
J'pense à mon prochain, j'tue que les adultes, j'épargne les enfants en bas âge (braah)
Y'a pas de magie fais confiance à ton frère, et tu finis comme Mufasa
Vas faire des sous sinon reste à la casa (zoin, tou-tou-tou-tou)Embed"
404Billy,Dissidence,"3 ContributorsDissidence Lyrics[Intro]
Junior Alaprod, et nan, y a rien d'nouveau

[Couplet 1]
Le soir j'suis posé, ivre
Vaut mieux être pauvre et libre
La mort viendra m'chercher car elle est possessive
J'ai des cadavres dans l'coffre
""Mauvais élève"" dit l'prof
Que des sons d'merde dans l'top
Négro, j'refuse leurs offres
Leurs armes ne sont que des hashtags
Que de trouvailles dans mes recherches la nuit
J'suis seul-tout dans la batcave
Peu de personnes me correspondent
Chaque seconde, je quitte un peu ce monde
Face aux problèmes, l'être humain s’effondre et s'enfonce
Tout seul dans la pénombre
J'suis un rebelle, j'suis le régicide
Quand j'te verrai plus, je te ferai signe
Quand la gloire et l'argent se dessinent, l'homme se décide
C'est vrai, ils n'ont pas laissé d'chance
Ils n'ont pas m'né la danse
J'aime bien l'argent, j'préfère l'indépendance

[Refrain]
Tu restes en bas du bloc, tu crois qu't'as plus de chance
Les yeux vers le ciel, cette vie n'a plus de sens
Mais j'suis plus fort qu'ils ne l'pensent
J'baisse pas mon froc pour redevance
Un œil sur mes ennemis, négro, fuck l'indifférence
Ils nous couvrent de mépris donc je prône la dissidence
J'ai trop de blessures pour oublier
J'ai trop d'objectifs pour roupiller
You might also like[Couplet 2]
Plutôt mourir qu'obéir
Je n'entends plus tes ""je t'aime"", bruyants sont les tirs
Les politiques sont les pires, hey
Les gens du peuple sont les sbires, hey
Aussi passionnantes sont les mums, mums
Très nombreux seront les faux, oh
J'ai peu d'amis, j'ai fait le tri
Du succès, j'connais le prix
J'peux r'faire le monde avec des ""si""
L'être humain aime tout c'qui brille, hé ouais
C'est pour ça qu'ça part en vrille, hé ouais
Entre ciel et terre, je m'isole
Seul le Très-Haut reste mon idole

[Refrain]
Tu restes en bas du bloc, tu crois qu't'as plus de chance
Les yeux vers le ciel, cette vie n'a plus de sens
Mais j'suis plus fort qu'ils ne l'pensent
J'baisse pas mon froc pour redevance
Un œil sur mes ennemis, négro, fuck l'indifférence
Ils nous couvrent de mépris donc je prône la dissidence
J'ai trop de blessures pour oublier
J'ai trop d'objectifs pour roupillerEmbed"
404Billy,Docteur Vérité,"11 ContributorsDocteur Vérité Lyrics[Paroles de ""Docteur Vérité""]

[Intro]
Enchanté
Docteur Vérité
Le 4'
Il est temps

[Couplet 1]
Si j'les trouve pas j'vais les trouver chez eux
Le matin j'me lève j'fais des pompes et des œufs
J'ai trompé son cœur, j'ai trompé ses yeux
Elle m'en voudra pas j'ai la pilule bleue
Dans la vie y'a que deux côtés
Celui des chassés, celui des chasseurs
Renoi m'aime bien tant qu'j'suis toujours en dessous d'lui
Rebeu m'aime bien tant qu'j'veux pas marié sa sœur
Babtou m'aimе bien tant qu'j'continue d'obéir
On s'serrе la main mais c'est juste pour décorer
A la mosquée j'vois qu'tous nos pieds sont collés
L'argent les femmes les ont très vite décollés
Besoin d'alcool pour parler à cœur ouvert
Gucci Dior car on a tant souffert
Ils montrent tous, leur vacances à Dubaï Bali
Jamais leurs comptes à découvert
Tu veux faire du business?
Tu m'inspire pas trop, j'suis pas trop décidé
Y'a trois belles femmes, sur la banquette arrière
Et moi j'roule vite comme si j'voulais m'suicider
On fait les che-ri, on fait les Emir
On fait les che-ri, on fait les Emir
J'guette les snaps, d'Aya Nakamura
J'ai des pensées qui peuvent fâcher Vladimir
T'as niqué ta vie tout seul, accuse pas l'système
Tu te rassure en t'disant qu'c'est pas d'ta faute
Et qu'toute façon les francs maçons tirent les ficelles
Les mêmes raclo qui demandent des chromes
Toujours les mêmes racli michto dans les boites
A côté des carré, à côté des tables
Qui cherche un boug qui fait du foot ou qui rap
Ou qui débite des kil et des kil
Ou qui débite des kil et des kil
Ma meuf est blanche, mon flingue est noir et mes enfants sont métisses
J'aime pas les gens weak's
Les soit disant woke's
J'respect les gens riches
J'respect les gens broke's
You might also like[Pont]
Moi ce que je regrette particulièrement
C'est d'entendre tout le temps les gens se dire
"" Banlieue, banlieue, banlieue, la racaille en banlieue ""
Pourtant il y'a beaucoup d'enfants ici à Villiers-Le-Bel
Qui ont réussi...

[Couplet 2]
Autour d'un bol de riz, on partage à six
Mais quand ça parle d'argent on partage rien
En levrette, elle me dit ""j'ai un peu mal""
Mais moi j'continue car je pense qu'à mon bien
Est-ce que je suis mauvais?
Est-ce que j'suis égoïste?
Tu m'devais d'l'oseille
T'as sorti les violons, la flûte et les choristes, bouffon
On fait des gosses puis on laisse les mères seules
Parce que les putes sont plus divertissantes
La vie d'famille, c'est pas c'que tu croyais
Tu trouves rien d'attirant chez une femme au foyer
Miroir miroir, dis-moi, qui est l'escroc ?
Qui montre son argent qui roule en grosse voiture
Alors qu'sa daronne habite dans HLM
Des coupures d'eau chaudes, des cafards sur les murs

[Outro]
Docteur vérité
Au revoirEmbed"
