Artist,Title,Lyrics
Menelik,11'30 contre les lois racistes,"32 Contributors11'30 contre les lois racistes Lyrics[Intro : JF Richet & Madj]
- Lois Deffere, lois Jox, lois Pasqua ou Debre, une seule logique
- La chasse à l'immigré. Et n'oublie pas tous les décrets et circulaires
Nous ne pardonnerons jamais la barbarie de leurs lois inhumaines
- Un état raciste ne peut que créer des lois racistes
- Alors assez de l'anti-racisme folklorique et bon enfant dans l'euphorie des jours de fête
- Régularisation immédiate de tous les immigrés sans papiers et de leurs familles
- Abrogation de toutes les lois racistes régissant le séjour des immigrés en France
- Nous revendiquons l'émancipation de tous les exploités de ce pays
- Qu'ils soient Français ou immigrés. Et au fait, qu'est-ce que t'en penses toi ?

[Couplet 1: Rockin'Squat]
Je ne veux pas faire de politique, ma mission est artistique
Mais quand je vois tout le trafic, on ne peut pas rester pacifique
Les lois qu'ils veulent mettre en application corroborent mon accusation
Trop de mes semblables pètent les plombs pris dans le tourbillon de l'immigration
Tout pays au monde expulse ses immigrés clandestins
C'est vrai mais la France a une autre responsabilité entre les mains
Les faits sont historiques, le peuple français a fait couler son sang
Pour écrire noir sur blanc les bases d'une démocratie en Occident
Que les dirigeants s'en souviennent, attends, je les illumine
Droit d'asile pour les populations victimes
De la misère du globe
Combattre le racisme, le fascisme, le sexisme et toutes sortes de xénophobes
Sans papiers, donc sans droits, sans droits donc écrasés par les lois
La justice nique sa ""reumdava"" quand on voit ses desiderata
Au grand jour
Je reste lucide dans mon faubourg et garde un oeil sur les vautours
You might also like[Couplet 2: Akhenaton]
Plus d'excuses, les gens savent très bien pour qui ils votent
52% de fils de putes à Vitrolles une fois pour toutes, c'est clair
Idem pour ces ministres mielleux, fielleux
Votant des lois pour séduire ce type d'électorat
Rappelle-toi qui s'est battu pour la France
Couteau entre les dents, rampant, et rien dans la panse
Tu collaborais à l'époque, chien, un toutou docile
Heureux de voir les Arabes débouler pour libérer ta ville.
De Joxe à Debré, je traque les fafs en costard
La gauche caviar, la droite de la droite au pouvoir
Moyen Resistenza, effet Independenza
Tous égaux devant les lois, dixit Sentenza

[Couplet 3: Mystik et Arco]
Je suis comme un pionnier, je porte très haut le flambeau
J'en place une pour les frères au préau
Mes rêves d'autrefois disent au revoir
Trop longtemps écrasé, étouffé, assoiffé, je rêve de REVO
Je dévore
Je tacle l'obstacle, enflamme les consciences qui s'évaporent
Les porcs s'installent, s'étalent et tèjent le peuple sur une étroite bordure
Tout le monde sait que leur coeur est creux et plein d'ordures
Ne voyez-vous pas jusqu'aux pas de vos portes, je baise vos élites
Je me sens plus fort, je prends des grades
J'empoisonne avec le White Spirit la machine étatique
Le rouleau compresseur qui est sans passions contre vos passions
Je prends position, au micro je mets des coups de pressions
Les bâtards veulent me pousser dans l'impasse que mon ombre perde ma trace
Je reste dans la masse, l'arme efficace et je crame le système comme une charasse
Ne pète pas plus haut que ton cul si t'es membre des moins costauds
Mais dis-moi Mani tu déblatères, t'écrases tes frères comme des blattes à terre pour un drapeau
Devant la lumière, sombre sabre reste sobre
Pour l'octobre, dans les décombres
Réfléchis, jamais ne fléchis, dans l'ombre dénombre tes soldats
Qui ne tendent pas l'arme sur leurs tempes, n'est pas, y a pas
J'casse trop, je reste fidèle à moi-même
Trop de gens parlent, l'argent parle, les agents parlent
Procréent trop d'infidèles s'opposant, m'imposant
Pour Karl je reste fidèle
Même au bout d'une corde, miséricorde, j'casse trop
Moi, je fracasse est-ce une histoire de paperasse
Ou de couleur de peau, l'odeur de soufre de Méphisto
Les gens souffrent à cause des lois racistos
Galérianos signale les bastos
Les fréros poussés dans la Seine, trop de peine
Mi-d'or devant Vincennes je prends position
Car là où passent les bâtards c'est la désolation qu ils sèment
[Couplet 4: Soldafada et Ménélik]
Quoi que tu fasses, le melting pot français est ainsi fait
Renoi, Céfran, Rabza, Spanish, Toss
Portuguesh, Kung Fu, Macaroni
Dans une cité ou pas. L'Etat nous dit zeubi, drôle de démocratie
Ménélik, Soldafada sur la dalle, encaissent gauche, droite
La tension extrême, l'issue bouchée, la porte trop étroite, direct
Ils veulent nous manipuler comme des poupées
Nous couper l'herbe sous le pied
De façon à ce que les gens ne puissent plus respirer
Nous sommes comme des parasites, surtout pas raciste, moi
Donc, tes textes, tes lois, réécris-les c'est pas les bons j'crois
Nakk sent que ça sent le roussi pour ceux qu'ont un accent
Lois Debré ou de force et les droits de l'homme sont absents
- C'est ça la France -
Ici c'est dur d'entrer comme une forteresse
Dire qu'un cousin m'a dit, Nakk, la France c'est fort je reste
La marque de la bête, ici, en l'occurrence c'est l'étranger
Danger, danger, pour ceux qui par ce fait sont blasés, blasés

[Couplet 5: Yazid]
Celui que le facho appelle bicot prend le micro
Pour démentir les faux propos, stopper le complot
Je jette un œil sur le passé, vous pensiez l'effacer
Hélas l'histoire se répète, revient nous offenser, c'en est assez !
Ils jettent encore le discrédit sur mon ethnie
Sur tout ce qui est physiquement différent
Mais l'harbi monte au créneau, j'ai le droit de veto
Je serai le bourreau, je ferai front quoi qu'il advienne
Je ne mâcherai pas mes mots
La réapparition des vieux démons d'un passé pesant
Conforte l'idée que j'ai sur ce racisme latent, d'antan
Datant du temps des premières crises dans
Un pays qui dans un total désarroi prétend
Encore une fois que nous sommes la cause de ce marasme
Que c'est notre faute si la France est prise de crises d'asthme
Mais qu'ils sachent que je serai toujours sur la brèche, bref
Je combats le facho et tous ceux qui sont de mèche
[Couplet 5: Fabe]
Vigipirate, carte de résident en danger, délation
France aux Français. Guerre avec un grand G
Qu'est-ce que tu veux que je fasse face à ces panneaux
Qui sont tellement sales qu'ils me font penser à Brigitte Bardot
Qu'est-ce qu'il y a ? T'es choqué quand je dis ça ?
Ne bouge pas, j'ai pas fini, tu veux mon nom, c'est Befa
L'impertinent, celui qui écrit une lettre au Président
Que Skyrock, Fun et NRJ censurent impunément évidemment.
Personne se sent concerné surtout que dans le pire des cas
C'est mes enfants qui seront enfermés
Donc fermez-la une fois pour toutes, mon téléphone est sur
Écoute, pas de doute, je bosse pas pour les scouts de France
Je balance une idée révolutionnaire. Debré hors-la-loi
Si tu l'attrapes, mets-lui un coup pour moi
Un coup pour nous, un coup pour tout ce qu'ils nous ont fait
Un coup pour dire qu'un jour ils finiront par payer leurs méfaits
En effet, je l'ai fait, si tu veux me faire un procès
T'as droit qu'à un seul essai
Donc, essaie de laisser la vérité passer au sujet des Français
De ce qu'ils ont fait dans le passé à nos pères et à nos mères
C'est que quand je pense à ce que ta France a pris
À l'Afrique noire et à l'Algérie
De quoi tu nous paries aujourd'hui. 9-7
De quelle dette ? De quels droits ? De quels papiers ?
De quelles lois ? De quels immigrés ?

[Couplet 6: Rootsneg]
J'en' palé la dwoit
NOB con tout neg poté dread tchok les abus
Check le mike pok !
Bim an tet zot si zot kwé cé jé mè cé ki ca
Zafe l'eta ta la ki pa a fé piès bagaye
Ban piès moun toujou minm l'an ka pwofité
Ni sa ki, ni sa ki pa ni
Moin sé An neg man pa ni
Les fruits défendus j'aimerais tellement, tellement
Oh oui, tellement y goûter
Goûter ce luxe qui orne la vie paisible de ces enculés

Mais vers quel avenir allons-nous ?
Vers quelle société allons-nous ?
A cette vitesse, autant se tèj
Si le mot d'ordre est à la haine
Autant tout fracasser dès maintenant
Ces fachos m'ont fâchée, ce système d'enfoirés
Une fois de plus a semé la haine
Le racisme pourrit l'esprit faible
Qui ça gêne ? Surtout pas l'Etat, surtout pas Le Pen qui se démène
Ces fils de ... veulent la guerre pour mieux frapper l'étranger
Restons fiers, restons fiers

[Couplet 7: Djoloff]
Domou djoloff moye délloussie di Iene
Iatteli djeuf dji fi amone
N'dakheté sa ma khoie mo fessati
Mie kaddou you bonne yi maye
Dague téye thie sa ma khette
Thia fa gnouye wovve deuckou nassarane
Togone naye fi diamono 1945
Tirailleurs sénégalais, amone nagne
Fi n'Dame téye seni dame ack séni seute
Gnou l¿ne di torokhale di lene wowe immigrés fatté nagne
Dembeu ndéye sane fatté nagnou sou gnouye ahlale
Sou gnouye niack dérrétte guigne léne
Toureuione n'Dame guigne léne andilone
Thie diamonoye thiossane

[Couplet 8: Sleo]
Je porte le grade de colonel pour qu'ils m'identifient
À quand un matricule pour satisfaire toutes leurs envies
C'est comme un safari qu'on prépare sciemment consciemment
Une corde raide qu'on pend pour une pendaison d'antan
Pour le même coupable, celui qui a pas la couleur locale
Ils votent une loi, une deuxième loi
Puis on s'en mordra tous les doigts
Je veux pas que mes enfants grandissent comme moi dans le néant
Si on les laisse faire, ils nous préparent une troisième guerre
Je veux plus être l'antilope
Le lion qu'on chasse du bout de son canon
Droite, gauche, même son de clairon qui sonne faux
Si jamais ça pète, je deviendrai leur casse-tête
Camouflage tout-terrain, arme au poing
Comme dans une guerre de tranchées, déclenchée, orchestrée
Par l'hypocrite politique, cas typique d'une mise au point
Pour monter l'immigré contre son frère immigré
Coulé, noyé dans une vieille stratégie nase, grillée
Par les jeunes de ma génération qui gardent 1 oeil ouvert
Conscients de l'attitude de la France pendant la deuxième guerre
Nationale, radicale, faut que la réaction soit fatale, brutale
Pour pas qu'on ait à se plaindre, geindre sans voix
Face aux sales lois qu'on a laissé passer sans s'opposer
Rebellion organisée pour le 3 Majeur flow
Sleo encore une fois porte le drapeau

[Couplet 9:  Kabal]
Français. Tu dors !
C'est la fin, tes politiciens vont trop vite
Dès lors que des artistes s'unissent contre la fourberie et le vice
La piste suivie n'est plus strictement artistique, mais aussi politique
Soit les lois passent, quoi ?
Elles sont dissimulées comme de justes
10 ans après on s'étonne que les immigrés dégustent
Soit elles sont appliquées avant d'être votées
Et on s'étonne ensuite que certains
Ne voient plus l'atteinte à leur liberté
Ah ça ira, ça ira, ça ira, ça fait deux-cents ans qu'on attend ça
Je doute, je pense, donc je suis
Force est de constater à travers nos yeux de banlieusards éclairés
Que les avions charters tendent à remplacer les bateaux négriers
C'est un dilemme individuel
Ne pas se laisser abuser par le superficiel
J'ai vu, de mes yeux vu
Retourner au pays mon ami, lui qui n'en voulait plus
Méticuleusement, mais sûrement, les forces devraient s'unir
Pour aller de l'avant en sachant
Que ce qui n'est pas sous les feux
De leur actualité peut être révoltant
Les crimes d'octobre 61 sont un exemple hurlant
Émigration moins papiers plus prison égal double peine perdue
Français, tu dors !

[Couplet 9: Aze]
Pas un centime de sentiment
N'estime pas celui qui dit lutter pour la ce-Fran
Pas de logique, l'idéologie part en couilles
Mais pour analyser, personne ne se mouille
Tout le monde tripe sur son bulletin de vote
Trois mois après, allez hop, coup de botte
Tu t'es fait bé-bar, mais tu l'as bien cherché
Et par ta faute le blâme s'installe dans la face des immigrés
Cesse de participer au massacre de la conscience
Les partis politiques bidons rendent amère la douce France
Pense à tes enfants, l'avenir est déjà flou
Azé s'est posée, maintenant c'est à toi de gé-bou

[Couplet 10 : Radical Kicker]
Prends mes empreintes digitales, fiche-moi
Quand je vais et viens, je m'en fiche, moi, des fichiers
J'en ai déjà plein, c'est pas d'hier que je subis des humiliations
Les gouvernements changent mais il n'y a pas d'amélioration
Je rêve plus, mes ambitions sont interdites, mon futur s'effrite
Mes droits me quittent, vite fait
J'ai compris que l'éthique et l'équité
N'étaient pas les mêmes selon ta provenance et ta te-té
Ton compte en banque, ta culture, ton langage, ta religion
Tout ce qui nous divise est bon pour cette nation
Donc vois, voilà ce qu'il ne faut pas faire :
On se nique entre nous, l'Etat, lui, fait ses affaires
Il n'aime pas notre unité, il n'aime pas nos différences
Soyons tous différents et unis
Les conséquences se verront, ça paiera ou sinon ça pétera
De toute façon, réaction !
On ne peut plus baisser les bras comme ça, gars

[Pont: Passi]
Ouais, maintenant v'là le Freeman...

[Couplet 11: Freeman]
Assez sait, qui ne sait, si se taire sait
Toute extrémité est vice, frère
La lumière poursuit l'aveugle, destin amer
Je cherche le Bien mais je m'attends au Mal
Je flaire Lucifer sur terre
Ce que réserve le fou pour la fin
Le sage le passe en tête
Entêté
La vérité n'est pas montrée nue, mais en chemise
Plus on sait, moins on affirme
Pour te servir, Freeman avec sa firme

[Couplet 12: Stomy Bugsy et Passi]
Vos mères, vos mères, vos mères, vos mères...
Je commence quand la France défonce des églises à coups de hache
Leurs mères
Comment tu veux que je respecte tes lois, ton drapeau, ton État
Alors que tu ne respectes même pas Dieu !
Au sein du pays du pain, du vin, du Boursin, j'suis pas blond
Je nique la hala et j'ai pas les yeux bleus, non !
Mais comme eux je bouffe des pâtes, et j'éclate même leurs rates
Exact !
Certains diront je m'en fous de vos trucs, de vos lois
Contre-lois, manifestations. Bande de bidons !
C'est pas un morceau de rappeurs qui fera peur
Mais on peut quand même engrener, engrener, engrener
Allons enfants dans cette saloperie !
Bougez vos fions, question ! Ça parle de révolution
Prendras-tu des munitions ?
Beaucoup jouent les hardis, pardi
Et ne veulent pas mourir !
Alors, vas-y toi, dis-moi comment tu veux le paradis...7Embed"
Menelik,Bye Bye,"10 ContributorsBye Bye Lyrics[Intro]

[Imane D]
Où t'étais ?

[Ménélik]
Invité par des potes à une te-fê
On s'amusait bien, je n'ai pas vu l'heure qu'il était

[Imane D]
Ah ouais ?

[Ménélik]
C'est vrai !

[Imane D]
Je te connais par cœur
J'aimerais savoir pourquoi tu agis comme un voleur

[Ménélik]
Tu te fais des films
Je ne voulais pas te réveiller c'est tout
Arrête avec tes questions
Dis-moi plutôt à quoi tu joues

[Imane D]
Je joue à la fille qui en a marre de te voir rentrer tard
Tout ça parce que tu préfères traîner avec tes lascars
You might also like[Ménélik]
Il est tard chérie
Écoute baisse le ton tu fais trop de bruit
Ce ne sont pas des lascars, ce sont mes amis

[Imane D]
Amis ?
Et pourquoi m'appellent-ils quand tu n'es pas là ?
Sans doute par respect et déférence envers toi

[Ménélik]
Les bâtards !

[Imane D]
Ah bon ? Tu ne le savais pas ?
Tes potes ne se gênent pas pour me narrer tes exploits
Aussitôt le dos tourné, au téléphone ils me draguent
Ne fais pas l'innocent, tu as surpris le gars en flag'
[Refrain 1]
Tu es la seule qui m'aille, je te le dis sans faille
Reste cool bébé sinon j'te dirai bye bye
Tu es le seul qui m'aille, je te le dis sans faille
Reste cool bébé sinon j'te dirai bye bye
Tu es la seule qui m'aille, je te le dis sans faille
Reste cool bébé sinon j'te dirai bye bye
Tu es le seul qui m'aille, je te le dis sans faille
Reste cool gars sinon j'te dirai bye bye
[Ménélik]
C'est bon, c'est bon, tu peux prendre toutes tes affaires

[Imane D]
Ah ouais ! Et tu crois que je t'ai attendu pour le faire ?
Toi et ta horde de serpents
Je vous souhaite bien du bon temps
Je suis parti à présent
Ce sera l'orgie à plein temps
Tu souris encore ?
Même pas l'once d'un remords
Change d'attitude
Ou je sculpte un nouveau décor

[Ménélik]
Allez bye bye
Tu prends tes cliques, tes claques
Et tu te tailles
Ta mère avait raison (Ma mère ?)
Laisse-moi donc
Et ma pagaille
Tiens parlant d'elle
As-tu trouvé sa muselière ?

[Imane D]
Qu'a-t-elle à voir dans cette affaire ?
Ne touche pas à ma mère
[Ménélik]
Qui le voudrait ?
C'est vrai, c'est un vrai supplice de la voir
D'autant plus qu'elle s'invite ici à dîner tous les soirs

[Imane D]
Je n'ai jamais compris
Pourquoi tu affiches
Tant de mépris
Envers ma famille
Spécialement ceux qui t'apprécient

[Ménélik]
Elle m'apprécie ?
Moi, ou mon porte-monnaie ?
Peut-être les deux qui sait ?
Arrête s'il te plaît !

[Refrain 2]
Tu es le seul qui m'aille, je te le dis sans faille
Reste cool bébé sinon j'te dirai bye bye
Tu es la seule qui m'aille, je te le dis sans faille
Reste cool bébé sinon j'te dirai bye bye
Tu es le seul qui m'aille, je te le dis sans faille
Reste cool gars sinon j'te dirai bye bye
Tu es la seule qui m'aille, je te le dis sans faille
Reste cool bébé sinon j'te dirai bye bye

[Interlude : Ménélik & Imane D]
Non mais hé ! Franchement
Y a quelque chose qui va pas là
Ah ! T'as le chic pour tout gâcher
Arrête, arrête, arrête, non non non
C'est vrai que je suis un peu éméché mais bon !
Oh la la la la
Quoi oh la la ?

[Imane D]
Franchement !
Est-ce vraiment une heure pour rentrer chez soi ?
Tu t'inquiètes du bruit
Occupe-toi de ce qui se passe chez toi

[Ménélik]
Chez moi
Ça allait jusqu'à une certaine prise de tête
Ce qui me contrarie
C'est d'avoir trouvé la femme parfaite
Pas d'amis
Pas de sorties [Eh eh eh eh eh eh eh]
Pas de fille au lit
Pas d'envies
Et accessoirement
Pas de sexe aussi (Quoi ?)
Le bonheur !
Mais je rajouterais sur la notice
Il faudrait pouvoir dégonfler après service

[Imane D]
C'est un coup bas

[Ménélik]
OK ! Excuse-moi
Mais je t'en prie
Prends-moi donc dans tes bras (C'est trop facile !)
Excuse-moi !

[Imane D]
Je n'ai pas fini

[Ménélik]
Arrêtons ! (Non)
On va y passer le reste de la nuit

[Imane D]
Je me suis lassée
Je suis cassée
J'en ai plus qu'assez
L'ardoise est chargée
Fissa, tu ferais bien de l'effacer

[Refrain 3]
Tu es la seule qui m'aille, je te le dis sans faille
Reste cool bébé sinon j'te dirai bye bye
Tu es le seul qui m'aille, je te le dis sans faille
Reste cool bébé sinon j'te dirai bye bye
Tu es la seule qui m'aille, je te le dis sans faille
Reste cool bébé sinon j'te dirai bye bye
Tu es le seul qui m'aille, je te le dis sans faille
Reste cool gars sinon j'te dirai bye bye1Embed"
Menelik,L’NMIACCd’HTCK72KPDP,"27 ContributorsL’NMIACCd’HTCK72KPDP Lyrics[Intro]
Solaar, jazz dessus
Ménélik, jazz dessus
Soon E MC, jazz dessus
Beat De Boul', jazz dessus
Pigalle Boom Bass, jazz dessus
Philip Zdar, jazz dessus
Jimmy Jones, jazz dessus
Tandis que mon ami rap par dessous

[Ménélik]
Beau mâle a l'animal mais saches que je suis un renard
A force de boire, il a tout bu et oublie tous ses devoirs
Rester pur, surtout et considérer les gens de haut
Ses principes et idéaux lui viennent de la vidéo
Cassettes de capes et d'épées, donc dans tous les cas dépassé dans l'passé sans cesse ressassé, il s'est calfeutré
Il y édifie sa vie mais jamais ne se méfie et fait fi des avis de ses amis dont le fou se défie
Ménélik - l'homme qui tombe à pic
Qui pique comme un aspic et par le pique efface la réplique
Apparaît aux re-frès et de la folie l'extrait, le tire de la mélasse dans laquelle il se complaît
Le danger écarté MNLK peut s'éclipser
L'ennemi a cessé d'acheter ses cassettes de cape et d'épée

[Melopheelo]
Gars, ne pense pas que le Mélopheelohello du Sage Po
Doit sa place dans le jazz pour exprimer des phases naze à gogo
Le thème était précis : éliminer l'ennemi
Qui faisait du tort au Mélopheelo, le jazzy papy
C'est moi qui suis le mec, qui te plante le bec
Quand tu fais le pec, à l'intention des Sages Poètes
Une planque avec un Stamp
L'NMI qui n'ACCd'HTCK72KPDP décampe
Mélopheelomélo fait du Sage Po
Arrive en force tout en étant parti parti du zéro
Le son Philli Faggio, en hommage à mon pote CM laarSo
You might also like[Pont]
[?], jazz dessus
Soon E MC, jazz dessus
MC Solaar, jazz dessus
Ménélik, jazz dessus
Le fonky matériel, jazz dessus
La Funk Mob, jazz dessus
Dany Dan, jazz dessus
Mon ennemi me pirate, puis pars dessous

[MC Solaar]
Voici le signe avant coureur de l'antépénultième Avant garde
L'avant centre avançant au centre du terrain musical
Avant cette avancée, j'avançais
Face au vent, posté en avant poste dans la banlieue d'avant les plans
Alors allez vous faire fouhhhh, nan
Je préfère passer outre, et foutre un shoot aux poutres qui broute et loupe leur loops
Comme elle, la presse se book pressé et entre dans le press-ploup
De la parade de l'apparat en fait il copie Betty Boop
Ménélik, Soon E, Lar-s sont une sorte de Sciences Po
Au passage reste sage après le passage des Sages Po
Et prend une prune dans ta poire, si tu tombe dans les pommes c'est que j'ai la pêche
Alors range tes rimes banane et n'ramène pas ta fraise
L'esquive, rotative paralyse l'entreprise des Mc's dont la prose frise la crise de Oufh !
Souffle ! Don Diego de la Vega te pique avec le mic fleuret
L'NMIACCd'HTCK72KPDP
[Pont]
Melopheelo, jazz dessus
[?], jazz dessus
Melopheelo, jazz dessus
Mon ennemi me pirate, puis part dessous

[Dany Dan]
Micro-test : 1, 2, j'ai là dans la main l'un d'eux
Ces micros-test de main-de
Au matin j'aurai plein de,t out ce que les mecs impec' de ma rue veulent trouver
J'ai tant de tune que l'on pourrait m'appeler lové
Qui pourrait te parler pendant des heures, de l'amour et des rumeurs
De la mort ou bien des mœurs
Je colle cool au beat, mais je peux devenir bruyant
Quand le Soleil ne brille plus, appelle moi Tony Truand
S'il faut je fais le faux juste pour pointer les nymphos
Yo je me fais tant de touffes, que l'on pourrait m'appeler afro
Et le pirate qui duplique ma grammaire
Je le mate de si haut, que l'on m'appelle Gulliver

[Soon E MC]
Une touche et c'est touché coulé
Tâche d'enlever ta cagoule sache que le vengeur te démasquera
En garde, prend garde le voilà à cheval face au mal
Son dada c'est d'être à cheval sur les principes
En dolby stéréo il le fait savoir Philipps
See you soon je m'en vais cueillir la tulipe
Autrefois le Daredevil ne se prénommait-il pas Philippe ?
Enfin quelques liens de parenté mais c'était qu'une parenthèse
Direction le château hanté nous sommes en 93
Superstitieux non pas du tout je pars en toute confiance
Mais que cela ne soit pas considéré, comme un exploit
Vous n'aurez qu'a assister à la prochaine séance
Cela vous dit samedi soir, sans faire de cinéma vous verrez
Il n'est pas de taille, il ne fait même pas le poids
La bataille sera sûrement cérébrale mais dites moi
Cela/Solaar rime à quoi ?
[Zoxea]
Bat les pattes ! V'là le psychopathe !
Mate, comme il épate, chaque phrase est une claque !
Tu bloques le pirate, gratte pas mon son car tu ne t'appelles pas BB King
De toutes façons selon mes stats tu manques de feeling
Je flingue comme Lucky Luke, suis dingue comme Daffy Duck
Je blague comme Baffie, et sur l'amour ta fille j'éduque
Fais le filifou avec elle, pas le filifaux
Filou qui file tel Milou car moi je deale et squatte l'hôtel
Novotel, Sofitel, Motel, profite d'elle
Si la belle est modèle telle Noami Campbell
J'excelle sur le microphone, excite tel un Chippendale
Ces filles folles, qui aphones sont, quand le son est à fond
Que mon ton est bon, mon rap long, elles m'appellent mc champion
Qu'on se le dise pour de bon, le rap doit se développer
L'NMIACCd'HTCK72KPDP !!!

[Outro]
MC Solaar, jazz dessus
Beat De Boul', jazz dessus
Soon E MC, jazz dessus
Pigalle Boom Bass, jazz dessus
Philip Zdar, jazz dessus
[?], jazz dessus
[?], jazz dessus
Mon ennemi me pirate, puis part dessous1Embed"
Menelik,Tout baigne,"6 ContributorsTout baigne LyricsUne question se pose à moi, à savoir si j'ai le choix
Suivre le tempo ou pas je ne sais pas mais en tout cas
J'ai évacué pour la journée toute forme de soucis
Et je me la roule debout, disons plutôt assis
Dans la foule je perçois le rire d'une dame
Entre les gens je rame pour m'approcher de la femme
Ouah ! Est-ce que tu as vu, ai-je la berlue ?
Une telle beauté même voilée ne passerait pas inaperçue
Y a du monde dans la place ? Ouais
Cassez la voix, cassez la voix ? Ouais
Évidemment sans ces parties la vie n'a pas de sens
La tribu en formation toujours dans la transe
Laisse ton corps me parler et continuons l'ambiance
Honni soit qui mal y pense

[Refrain]
Le damier est dans la place : tout baigne !
Paris est dans la place : tout baigne !
New York est dans la place : tout baigne !
La té-ci est là aussi : tout baigne !
Nouméa est dans la place : tout baigne !
Marseille est dans la place : tout baigne !
Brighton est dans la place : tout baigne !
Tout baigne même pour les gens qui se plaignent

Aujourd'hui personne ne revendique dans le posse de Ménélik
De la vie à ce jour nous ne ferons aucune critique
Je glande sur la le-da s'il te plaît passe moi du coca
Non pas d'embrouille non je ne veux pas de cocard
Juste goûter de ce jus que jalousement tu conserves
Avec toi je converse afin qu'on se serve
Mettons donc de côté les dingues qui tiennent les flingues
Regarde donc ces beautés je t'invite à faire la bringue
Donc suis-moi on ira, on verra, on vaincra
Je ne sais pas où on va mais qui vivra verra
Oh non non non je suis pas une idole
Sur le damier de Paul tous les gars de Paul m'épaulent
Ainsi, nous voici partis, tranquille tu l'as dit l'ami
Accompagnés des bonnes fées que sur la piste on rallie
You might also like[Refrain]
