Artist,Title,Lyrics
MZ,Les princes,"69 ContributorsLes princes Lyrics[Paroles de ""Les princes"" ft. Nekfeu]

[Produit par Ekynoxx & Thomas André]
[Intro : Mallaury]
Je viens d'une ville où il n'y a plus de loi
Où il n'y a plus de roi
Je veux être le prince de la ville
[Couplet 1 : Hache-P]
Hey
J'suis au volant de ma caisse
Au feu rouge on m'demande une pièce
Paris connait aussi la hess
J'ai quelques trucs à régler dans la ville
Gyrophares, contrôle et j'repars, pourtant j'avais de la S
Et j'vois des paires de fesses sur l'trottoir
J'te raconte pas les histoires d'M.S.T
Quand t'as une dette, Paris n'est plus gigantesque
Donc marche avec un c-tru dans la veste (Yeah, hun)
Les embrouilles de schlags dans le bus de nuit (Yeah, hun)
Le soir y a de l'action, donc jamais j'm'ennuie (Yeah, hun)
J'vais chez l'épicier, j'viens d'prendre un flash
Le soir au tier-quar ça peut vite partir en clash

[Refrain : Jok'Air & Nekfeu]
Yeah, hun, la musique est sombre, le négro vient du fond
Hun, la musique est sombre, le blanco vient du fond
On rêve de briller comme Paris la nuit, sous ses lumières
J'ai traîné, j'ai erré, j'ai zoné et j'ai dormi toute la journée
Princes de la ville
On va tout faire pour devenir les princes de la ville
Tu seras ma princesse, on va devenir les princes de la ville
On rêve de briller comme Paris la nuit, sous ses lumières
J'ai traîné, j'ai erré, j'ai zoné et j'ai dormi toute la journée
You might also like[Couplet 2 : Dehmo]
Hun, 3 heures du mat' j'suis dans les p'tites gâteries
Bonbons sur bonbons, aujourd'hui c'est Halloween
J'ai pas attendu le côté obscur pour avoir le flow de Anakin
J'suis défoncé, toute l'année
À c'qu'il parait y'en a qui attendent le nouvel an
En vérité, ""abandonner"" n'est pas dans le vocabulaire
Déjà que ""tenter"" n'est pas suffisant
J'marche dans la ville, bonne est la weed
Quand il s'agit de mes billets bébé y a pas de sentiments
Guettes mes rétines, mes cicatrices
Comme le corps à Dhalsim mes histoires en disent long
Hier et aujourd'hui se ressemblent
Mais demain sera sûrement différent
Les erreurs font grandir, j'ai un cœur de géant

[Refrain : Jok'Air & Nekfeu]
Yeah, hun, la musique est sombre, le négro vient du fond
Hun, la musique est sombre, le blanco vient du fond
On rêve de briller comme Paris la nuit, sous ses lumières
J'ai traîné, j'ai erré, j'ai zoné et j'ai dormi toute la journée
Princes de la ville
On va tout faire pour devenir les princes de la ville
Tu seras ma princesse, on va devenir les princes de la ville
On rêve de briller comme Paris la nuit, sous ses lumières
J'ai traîné, j'ai erré, j'ai zoné et j'ai dormi toute la journée
[Couplet 3 : Nekfeu]
La nuit dans Paris Sud, je pense en grand
Sais-tu ce que ça coûte de vivre ?
Quand les gens s'endorment à travers la vitre
Je vois les feux ensanglanter les gouttes de pluie, et je pense
Yeah, hun, rien ne peut m'arriver, j'ai le cœur ensommeillé, hun
Mais cette nuit j'ai mal rêvé, la douleur m'a réveillé, hun
Faire le Pont de la Concorde et revenir à pied, hun
Et t'aimer au-delà d'ton corps, yeah
Penses-tu qu'un jour on ira mieux ?
Je rêvais d'avenir radieux, vu qu'on pensait finir à deux
Mais tire un trait, t'as tout raté
T'inquiète avant de dire adieu j'ai des prières à dire à Dieu
Je me tairai une fois enterré mais la Terre est irradiée, hun

[Couplet 4 : Jok'Air]
Yeah, un Noir tue un Noir tout au fond de ma rue
Bienvenue dans la ville où les témoins n'ont jamais rien vu
J'ai fait tapiner ma Marie dans tout Paris Sud
Y a mes empreintes sur pas mal de ces murs
Et mon ADN sur pas mal de ces culs
J'suis sorti de la maison sans dire au revoir à Maman
Et j'suis pas rentré de la semaine, j'ai perdu le sommeil
J'use mes semelles sur la route qui mène au sommet
La voix sort des cités HLM
Flow est sale, vient de l'afflux de la Seine
Rêve de briller comme Paris la nuit
Un spliff entre les lèvres, j'suis le prince de la ville
[Pont : Jok'Air & Nekfeu]
Paris Sud, Paris Sud la nuit
On est les princes de la ville
On est les princes de la ville
MZ, yeah, on est les princes de la ville
Seine Zoo, $-Crew boy
On est les princes de la ville

[Refrain : Jok'Air & Nekfeu]
Yeah, hun, la musique est sombre, le négro vient du fond
Hun, la musique est sombre, le blanco vient du fond
On rêve de briller comme Paris la nuit, sous ses lumières
J'ai traîné, j'ai erré, j'ai zoné et j'ai dormi toute la journée
Princes de la ville
On va tout faire pour devenir les princes de la ville
Tu seras ma princesse, on va devenir les princes de la ville
On rêve de briller comme Paris la nuit, sous ses lumières
J'ai traîné, j'ai erré, j'ai zoné et j'ai dormi toute la journée
[Outro : Mallaury]
Je viens d'une ville où il n'y a plus de loi
Où il n'y a plus de roi
Je veux être le prince de la ville30Embed"
MZ,Lune De FieL,"30 ContributorsLune De FieL Lyrics[Produit par Ekynoxxx]

[Couplet 1 : Hache-P]
De la zèb de la tise dans la bre-cham
Des bad bitches très alléchantes
Mes gavas seront désagréables et te niqueront ta soirée si tu commences à jouer la meuf chiante
Écoute ma belle on est toujours direct dans nos propos
Je sais que tu kiffes fais pas la mytho
Finis de fumer ce putain de bédo
Avant que je te mette ta part enlève-moi tous les nœuds que j'ai dans le dos
Tu sais, je suis pas là pour jacter, je veux juste te fumer
Dans le crâne une 'teille de Jack D
Dans mon délire je suis fonce-dé
Le voisinage t'entendra crier, grillés toute la soirée
Par contre tu casses tout le lire-dé quand tu veux faire du sérieux
[Refrain : Jok'Air]
Bébé, je t'attends... Non
Suis le son de ma voix rentre dans la chambre... Non
On fera rien de bien méchant
On va juste fumer, tiser, baiser
Fumer, tiser, baiser
Fumer, tiser, baiser
Fumer, tiser, baiser
Qu'est-ce que t'attends ? Non
Suis le son de ma voix rentre dans la chambre... Non
On fera rien de bien méchant
On va juste fumer, tiser, baiser
Fumer, tiser, baiser
Fumer, tiser, baiser
Rentre dans la chambre on va fumer, tiser, baiser
You might also like[Couplet 2 : Marlo]
On va juste fumer, tiser, baiser
Non d'abord tu vas me branl...
Et n'oublie même pas de me suc...
Ouais, t'inquiète, tu vas kiffer
Viens avec deux copines, je serai avec Jo et Pims
Il y aura du Sprite, de la codéine
On sera le meilleur coup de vos vies, sans doute
Bébé, vous serez plus en chaleur qu'en août
Pour le rap, pour le sexe t'as confiance en nous
Donc vous viendrez comme des chiennes en loup
On sera sous pillave, je sais que t'aimes ça, coquine !
Une soirée inoubliable que tu raconteras à ta fille

[Refrain : Jok'Air]
Bébé, je t'attends... Non
Suis le son de ma voix rentre dans la chambre... Non
On fera rien de bien méchant
On va juste fumer, tiser, baiser
Fumer, tiser, baiser
Fumer, tiser, baiser
Fumer, tiser, baiser
Qu'est-ce que t'attends ? Non
Suis le son de ma voix rentre dans la chambre... Non
On fera rien de bien méchant
On va juste fumer, tiser, baiser
Fumer, tiser, baiser
Fumer, tiser, baiser
Rentre dans la chambre on va fumer, tiser, baiser
[Couplet 3 : Dehmo]
J'veux juste chicher, tiser, prendre du plaisir (hmmm hmmm...)
J'emmerde ma conscience ma santé, j'sais que tu me désires (hmmm hmmm...)
J'veux que tu sois ma salope au lit
Et ta bouche la meilleure conseillère de mon zizi
J'suis fou, mais tu t'en fous
J'suis pas ton mec, ni ton ex, ni ton futur
Juste ton meilleur coup et j'te monte en l'air sans jamais que t'atterrisses
J'veux la baiser sans le besoin de dire ""bébé"" (hmmm hmmm...)
Et elle veut m'baiser jusqu'à ce que je crie ""Mayday"" (hmmm hmmm...)
Présent dans tes zones érogènes ou j'en serre une autre
Sûrement avec un plus gros dos
J'm'en bats les couilles, c'est pas de ma faute

[Couplet 4 : Jok'Air]
Bébé, j'suis fonce-dé... rejoins-moi
Accroche-toi car le Septième Ciel n'est pas loin
Ce soir sois ma Whitney, je ferais ton Bobby
Fumons, tisons, baisons toute la nuit
Vis cette nuit comme la dernière de ta vie
Mouille les draps du lit crie, réveille toute la ville
Je sens ton cœur qui bat vite
Tes paupières palpitent
T'es tombée accroc à ma... j'suis ton héroïne
Ce soir rien ne sert de trop parler, consomme-moi jusqu'à l'overdose
Tout ce qui ce passe dans cette piaule reste dans cette piaule
Vrai négro fait vraies choses
[Refrain : Jok'Air]
Bébé, je t'attends... Non
Suis le son de ma voix rentre dans la chambre... Non
On fera rien de bien méchant
On va juste fumer, tiser, baiser
Fumer, tiser, baiser
Fumer, tiser, baiser
Fumer, tiser, baiser
Qu'est-ce que t'attends ? Non
Suis le son de ma voix rentre dans la chambre... Non
On fera rien de bien méchant
On va juste fumer, tiser, baiser
Fumer, tiser, baiser
Fumer, tiser, baiser
Rentre dans la chambre on va fumer, tiser, baiser
[Refrain : Mallaury]
Bébé, je t'attends... Non
Suis le son de ma voix rentre dans la chambre... Non
On fera rien de bien méchant
On va juste fumer, tiser, baiser
Fumer, tiser, baiser
Fumer, tiser, baiser
Fumer, tiser, baiser
Qu'est-ce que t'attends ? Non
Suis le son de ma voix rentre dans la chambre... Non
On fera rien de bien méchant
On va juste fumer, tiser, baiser
Fumer, tiser, baiser
Fumer, tiser, baiser
Rentre dans la chambre on va fumer, tiser, baiser18Embed"
MZ,Toi sur moi,"21 ContributorsToi sur moi Lyrics[Paroles de ""Toi sur moi""]

[Produit par Ekynoxx]

[Couplet 1 - Jok'Air]
Jok'Air... Et j'ai chanté tout l'été
Je fus fort dépourvu quand la bise fut venue, mon bébé
Mets ta plus belle robe ce soir je t'emmène danser
N'rentrons pas à la maison avant d'être défoncé
Viens on *skurt* en état d'ivresse
Mais faisons belek à la Mercedes
J'ai laissé la caution d'la loc' en espèces
N'vomis pas dans la caisse
Cesse de m'prendre la tête
J'bosse pour gratter ma pièce, pas pour les paires de fesses
J'ai grandi dans la hess pour sortir de la tess
Dois-je te rappeler mon adresse ?
J'étais dans cette merde bien avant d'te connaître
Tu m'énerves quand tu laisses ton rouge à lèvres sur mon...
J'préfère qu'tu l'laisses sur ma verge
D'ailleurs, rentrons ma belle
Fais moins de bruit qu'avant hier car les voisins se plaignent
J'ai reçu une lettre du concierge

[Refrain - Jok'Air]
Han han han han, eh eh eh
J'suis au studio, bébé, je n'ai pas de réseau
Han han han han, eh eh eh
Moi sur toi ou toi sur moi ferait un joli morceau
Faire l'amour est une chose
Baiser en est une autre
Vu que nous sommes accros l'un de l'autre
Allons jusqu'à l'overdose
Faire l'amour est une chose
Baiser en est une autre
Vu que nous sommes accros l'un de l'autre
Allons jusqu'à l'overdose
You might also like[Couplet 2 - Dehmo]
Pour m'en sortir je ne connais que la merde
Les pochetons, les plastiques brulés, les lamelles
Pas de fiche de paye, la musique est belle
Couleur ébène, bébé, le négro ne gère pas les ""Je t'aime""
Je suis au studio, ah ouais, je n'ai pas de réseau
Et j'ai pas raison, j'ai juste mes raisons
Qui me permettent d'être content comme un idiot
Enfermé dans l'bunker et j'ai pas ce putain de réseau
J'ai pas de maison, j'ai quitté la zone
Corps et âme dans une histoire qui ne vole pas haut
Je suis au studio, bébé, le temps passe tellement vite
Rythmique et plaisir, il ne manquerait plus que nous
Avec du champagne et ce putain de lit
Je ne sors que pour prendre mon bif
Je ne sors que pour prendre mon bif

[Refrain - Jok'Air]
Han han han han, eh eh eh
J'suis au studio, bébé, je n'ai pas de réseau
Han han han han, eh eh eh
Moi sur toi ou toi sur moi ferait un joli morceau
Faire l'amour est une chose
Baiser en est une autre
Vu que nous sommes accros l'un de l'autre
Allons jusqu'à l'overdose
Faire l'amour est une chose
Baiser en est une autre
Vu que nous sommes accros l'un de l'autre
Allons jusqu'à l'overdose
[Couplet 3 - Hache-P]
Oh mi amor, j'sais que t'es love et qu'tu m'aimes à mort
Est-ce réciproque ? Moi je dis que ça viendra avec le temps
Oublie cette fille, je te l'ai déjà dit, c'était qu'une bitch
Oh j'ai compris, ton rêve est de lui casser les dents
T'inquiète t'es ma numéro uno
Même si des fois je me comporte comme un woulo
Tu veux rencontrer maman, mais c'est pas l'moment
T'inquiète on fera ça calmement

[Refrain - Jok'Air]
Han han han han, eh eh eh
J'suis au studio, bébé, je n'ai pas de réseau
Han han han han, eh eh eh
Moi sur toi ou toi sur moi ferait un joli morceau
Faire l'amour est une chose
Baiser en est une autre
Vu que nous sommes accros l'un de l'autre
Allons jusqu'à l'overdose
Faire l'amour est une chose
Baiser en est une autre
Vu que nous sommes accros l'un de l'autre
Allons jusqu'à l'overdose9Embed"
MZ,Fonceder,"15 ContributorsFonceder Lyrics[Refrain]
À la longue ça me fera du mal, mais bon, là ça me fait du bien
J'avale la pisse du Diable et je me renferme dans un joint
À la longue ça me fera du mal, mais bon, là ça me fait du bien
J'avale la pisse du Diable et je me renferme dans un joint

[Couplet 1 : Hache-P]
Un coup de fil me réveille, un ient-cli se gratte les veines
Virée nocturne, plan, meuf, teille-bou de whisky à la veille
Je passe un coup de fil à Dav', d'un coup je me mange une baffe
Maman me dit d'arrêter de glander et de me trouver du taff
Bon bref, je me barre au tièk, courir après l'oseille
Ça charbonne dans la street en attendant que le rap paye
Mes journées se ressemblent, toujours la même lère-ga
Vu qu'il y a rien a faire je crois que je vais passer chez rek-Ta

[Pré-refrain]
Je vais me fonceder

[Refrain]
À la longue ça me fera du mal, mais bon, là ça me fait du bien
J'avale la pisse du Diable et je me renferme dans un joint
À la longue ça me fera du mal, mais bon, là ça me fait du bien
J'avale la pisse du Diable et je me renferme dans un joint

[Couplet 2 : Jok'air]
Je viens d'avoir le bac, j'ai la daronne sur les pattes
Car le rap ne paie pas le loyer et que je n'irai pas à la fac
Ma petite amie du moment me plaque, pendant que les yeux de maman me braque
Je me sens mal, la porte je claque, le hall du bâtiment je squatte des clopes
Du eu-f, des yeufs une conss, ça va tirer
Je plane les pieds au sol par le vide, je me sens attiré
Deux-trois homies se ramènent avec de la vodka, du whisky, je vais me fonceder
Fais-moi la passe D, que je zappe tous mes soucis
You might also like[Pré-refrain]
Je vais me fonceder

[Refrain]
À la longue ça me fera du mal, mais bon, là ça me fait du bien
J'avale la pisse du Diable et je me renferme dans un joint
À la longue ça me fera du mal, mais bon, là ça me fait du bien
J'avale la pisse du Diable et je me renferme dans un joint

[Couplet 3 : Hache-P]
Je crois que je suis rré-bou, les gars je commence à plus tenir debout
Faut pas que je rentre à la baraque, il va falloir que je raque
Je veux boire mais y a plus de teille-bou

[Couplet 4 : Jok'air]
Passe passe le oinj, il y a du monde sur la corde à linge
Putain je crois que je deviens dingue, mes negros hurlent tous comme des singes
Je suis foncedé, foncedé, foncedé, foncedé
J'ai l'impression d'être possédé, j'ai mal
Les gars je suis foncedé, je plane

[Outro]
Je vais me fonceder18Embed"
MZ,3.5.7,"35 Contributors3.5.7 Lyrics[Paroles de ""3.5.7""]

[Couplet 1 : Jok'Air]
L'alcool, la drogue m'aident à méditer
J'suis venu rapper ma vérité
J'suis venu rapper la vie pas ordinaire
D'un jeune négro de cité
Qu'sa maman a bien éduqué
Qui déteste l'autorité
Qui a fait du mal par nécessité
Pas pour la street crédibilité
J'ai qu'la musique pour sortir de la merde
Pas l'choix, j'dois tout niquer
J'veux plus te vendre du shit
Ou aller les braquer, cagoulé, ganté, broliqué
J'bosse dur, hiver comme été
Avec Excalibur comme épée
Car si la hess vient m'refaire du pied
D'un coup d'lame j'vais l'amputer
Trop d'flow, trop d'niveau
Dans ce rap game j'suis l'plus redouté
Trop d'faux, trop d'mythos
Autour de moi m'ont fait trop douter
Trop d'négros m'ont dégoûté
Franchement si vous les écoutiez
Hier ils m'parlaient d'unité
Aujourd'hui ils parlent de vouloir m'buter
La vie est une chienne
Chaque soir j'pense à la ken
D'une manière dont t'as pas idée
Elle m'a trop eu, m'a privé d'dignité
Donc à mon tour j'dois pas l'éviter
J'compte la baiser avec brutalité
Ici, revancharde est la mentalité
Chich m'a dit d'pas paniquer
Et j'fume de la dope de qualité
You might also like[Refrain : Jok'Air]
J'suis entré armé d'un 3.5.7 (Oh, oh)
J'lui ai dit ""Vide-moi cette caisse"" (Oh, oh)
Avant qu'j'te pète la tête
Comme si j'allais le faire
J'ai investi dans la gue-dro (Oh, oh)
Ça s'passe comme ça dans mon ghetto (Oh, oh)
C'est la merde il faut des euros
Ouais il faut les faire
On s'était dit qu'on s'aimait
Tu voulais qu'j'te fasse un bébé
Et moi j'étais pas prêt
Avec un autre t'es allée le faire
J'suis toute ma vie en studio
J'traîne la nuit avec mes potos
Ils veulent pas d'nous dans leurs radios
T'inquiète un jour ça va le faire

[Couplet 2 : Dehmo]
Plus petit, j'te cache pas, j'te disais que la drogue j'y toucherais pas
Un peu plus tard, disons que j'me déplace pas pour moins d'cinquante balles
J'suis là, et j'te raconte c'que tes rappeurs n'vivaient pas
Au quartier, j'attends qu'ça passe, à la ceinture, mon Beretta
Quoiqu'on fasse, nous t'inquiète on s'laisse pas niquer par nos choix
Un clin d'œil à toute cette fumée que j'accumule tous les soirs
Et oui, c'est vrai, j'suis un gros mytho, quand tu m'donnes qu'envie de jouir
Bébé mon cœur n'a pas ton temps, là y'a ma haine qui chuine
Alors j'suis rentré au studio, vous m'avez aimé
Les inconvénients c'est qu'j'ai d'autres préoccupations
L'amour des billets, mes rimes, me fonceder tous les soirs
J'suis rentré au studio, j'en ai vu m'détester
Grâce à mon talent, gros, j'ai d'autres préoccupations
L'amour des billets, mes rimes, me fonceder tous les soirs
[Refrain : Jok'Air]
J'suis entré armé d'un 3.5.7 (Oh, oh)
J'lui ai dit ""Vide-moi cette caisse"" (Oh, oh)
Avant qu'j'te pète la tête
Comme si j'allais le faire
J'ai investi dans la gue-dro (Oh, oh)
Ça s'passe comme ça dans mon ghetto (Oh, oh)
C'est la merde il faut des euros
Ouais il faut les faire
On s'était dit qu'on s'aimait
Tu voulais qu'j'te fasse un bébé
Et moi j'étais pas prêt
Avec un autre t'es allée le faire
J'suis toute ma vie en studio
J'traîne la nuit avec mes potos
Ils veulent pas d'nous dans leurs radios
T'inquiète un jour ça va le faire

[Couplet 3 : Hache-P]
Vingt-deux balais, les études moi j'm'en bats les
Couilles, mais j'finirai pas avec un balais
Devenir footballer est-c'que tu t'en sou-viens ?
On terminera sur l'terrain, attendant qu'les sous viennent
Un petit job ? Nan nous on a préféré les plaquettes
Le temps passe vite et j'm'aperçois qu'des frères on perdu la tête
'Sky, weed, fonceder, faudrait qu'un jour on arrête
Oui j'ai fait du mal, faut qu'tu comprennes c'était la crise aux manettes
[Refrain : Jok'Air]
J'suis entré armé d'un 3.5.7 (Oh, oh)
J'lui ai dit ""Vide-moi cette caisse"" (Oh, oh)
Avant qu'j'te pète la tête
Comme si j'allais le faire
J'ai investi dans la gue-dro (Oh, oh)
Ça s'passe comme ça dans mon ghetto (Oh, oh)
C'est la merde il faut des euros
Ouais il faut les faire
On s'était dit qu'on s'aimait
Tu voulais qu'j'te fasse un bébé
Et moi j'étais pas prêt
Avec un autre t'es allée le faire
J'suis toute ma vie en studio
J'traîne la nuit avec mes potos
Ils veulent pas d'nous dans leurs radios
T'inquiète un jour ça va le faire8Embed"
MZ,Embrasse-moi,"33 ContributorsEmbrasse-moi Lyrics[Paroles de ""Embrasse-moi""]

[Prod. by Ekynoxxx]

[Refrain : Jok'Air]
(Tu t'imagines)
Rencontrer ma mère, rencontrer mes frères
Me faire de nombreux bébés
(Tu t'imagines)
Que j'te mette la bague à l'annulaire
Qu'j'te dise ""oui"" devant l'maire
Tout ça en week-end d'été
(Embrasse-moi) fort
Prends-moi sur l'moment
Vivons l'instant présent
Demain c'est loin mon bébé
(Embrasse-moi) fort, mon bébé
(Embrasse-moi) fort, mon bébé

[Couplet 1 : Jok'Air]
Yep, qu'allons-nous faire maintenant ?
Veux-tu qu'on perdre notre temps à parler d'nos sentiments ?
Veux-tu qu'j'te mente en disant c'que tu veux entendre ?
Déshabille-toi sans oublier tes sous-vêtements
Prends soin d'moi comme un bébé
Dehors c'est chaud y a que dans tes bras que j'me sens vraiment en paix
Entre tes hanches c'est wow !
J'perds la notion du danger
Si on m'tue, trois balles dans l'dos
Comme l'abeille iras-tu m'venger ?
Ensemble nous sommes mignons comme tout
On fume, on tise, on baise, ensemble on parle de tout
Sans parler d'amour, pas d'ça entre nous
De tout c'qui sort d'notre bouche, c'est le seul sujet tabou
Embrasse-moi fort, mon bébé, plus fort, mon bébé
Mets sur moi l'odeur de ton corps
Bébé vivons d'instants présents, encore et encore
Demain c'est loin et s'projeter demande trop d'efforts
Yeah
You might also like[Refrain : Jok'Air]
(Tu t'imagines)
Rencontrer ma mère, rencontrer mes frères
Me faire de nombreux bébés
(Tu t'imagines)
Que j'te mette la bague à l'annulaire
Qu'j'te dise ""oui"" devant l'maire
Tout ça en week-end d'été
(Embrasse-moi) fort
Prends-moi sur l'moment
Vivons l'instant présent
Demain c'est loin mon bébé
(Embrasse-moi) fort, mon bébé
(Embrasse-moi) fort, mon bébé

[Couplet 2 : Dehmo]
Ok on s'mettra ensemble parce que tu parles pas trop
Mais tu m'balances des ""Je t'aime"" dès que débute l'intro
Tu m'connais que du net apparemment tu m'aimes trop
Toi tu connais pas l'prénom, toi tu connais qu'Dehmo
On s'exilait aux toilettes lors des soirées potos
On t'entendait crier parce qu'il baise comme un taureau
J'rentre pas dans les détails toute façon c'est prouvé
Y a qu'elles qu'ont pas sucé qui peuvent désapprouver
J'love pour toi bébé, j'crois qu'au fond on est pareils
Et si t'as des doutes, appelle-moi qu'ils disparaissent
J'te l'ai jamais dis mais bientôt j'compte t'épouser
Et si tu crois ces conneries nan cocotte là j't'arrête
Prends bien tes pilules et ne m'parle pas de marmots
Et ne m'prends pas pour un con juste parce qu'on a taro
Et si tu m'gardes pour deux mois là j'te dirais bravo
J't'en veux de pas connaître le prénom car tu connais qu'Dehmo
[Refrain : Jok'Air]
(Tu t'imagines)
Rencontrer ma mère, rencontrer mes frères
Me faire de nombreux bébés
(Tu t'imagines)
Que j'te mette la bague à l'annulaire
Qu'j'te dise ""oui"" devant l'maire
Tout ça en week-end d'été
(Embrasse-moi) fort
Prends-moi sur l'moment
Vivons l'instant présent
Demain c'est loin mon bébé
(Embrasse-moi) fort, mon bébé
(Embrasse-moi) fort, mon bébé

[Couplet 3 : Hache-P]
Tu veux être avec moi ?
Est-c'que t'assumeras mon train de vie ?
Des fois j'rentrerai tard le soir
Avec les cheveux d'une autre fille
Tu t'imagines une vie de rêve
Mais moi je vise une vie de merde
En vrai j'rentrerai pas le soir
Toute seule en larmes dans ce pauvre lit
C'était juste pour le fun mais toi tu comprends pas
Arrête tes petits jeux, j'veux pas rencontrer tes rents-pa
Toi tu t'imagines trop de choses
Et puis p't-être que j'en aime une autre
Et puis vas dire à toutes tes copines qui te servent de radar
Que je les emmerde et que je suis un bâtard
En vrai j'ai pas besoin de love
D'abord faut qu'j'fasse rentrer plein d'loves
Embrasse-moi
[Refrain : Jok'Air]
(Tu t'imagines)
Rencontrer ma mère, rencontrer mes frères
Me faire de nombreux bébés
(Tu t'imagines)
Que j'te mette la bague à l'annulaire
Qu'j'te dise ""oui"" devant l'maire
Tout ça en week-end d'été
(Embrasse-moi) fort
Prends-moi sur l'moment
Vivons l'instant présent
Demain c'est loin mon bébé
(Embrasse-moi) fort, mon bébé
(Embrasse-moi) fort, mon bébé

[Outro]
(Tu t'imagines)
Rencontrer ta mère, rencontrer tes frères
Te faire de nombreux bébés
(Tu t'imagines)
(Embrasse-moi)
Prends-moi sur l'moment
Vivons l'instant présent
Demain c'est loin mon bébé
(Embrasse-moi, embrasse-moi)
Mon bébé, mon bébé, mon bébé18Embed"
