Artist,Title,Lyrics
MZ,Lady Gaga,"9 ContributorsLady Gaga Lyrics[Couplet 1: Jok'air]
T'es tombé sous son charme puis elle t'es passée sous le nez
Cette pute te veut du mal mais toi tu pourrais tout lui donner
Dans les ruelles de Paname elle ne cesse de racoler
Tout le monde la connait
A elle t'es collé
Pourtant elle ne cesse de se faire tourner
Tu vous t'es cocu, elle s'offre au plus offrant
Mais tu la désires toujours plus, toujours un peu plus forcement
Maintenant sur toi cette pute a usé de sa ruse
Tes potes te reconnaissent plus
Ta mère te reconnait plus
T'as dit je t'aime à cette chienne et cette salope s'est tue
Tes frères te reconnaissent plus
Ton père te reconnait plus
Pour elle tu t'endettes,tu t’entêtes et tu te tues
Oh Lady Gaga
Oh Lady Gaga
Oh Lady Gaga
Oh Lady Gaga
Elle te pète la tête et tu l'as dans le sang
Toi et elle en tête à tête tu n'fais pas semblant
Tu la *snif* direct pas la peine de perdre de temps
De toi elle s'en branle, elle préfère tes billets de banque
Elle a la couleur
Madonna ou Mylène Farmer
Avec elle tu vis la nuit
Avec elle tu vis la vie à 666km/h
You might also likeElle n'aurait jamais du te passer sous le nez
Tu ne serai jamais tombé love comme à cause de tous ces traits
Tu n'étais pas prêt vas y maintenant tires un trait

[Refrain]
Beaucoup de gens vivent grâce à la Lady Gaga
Oh Lady Gaga
Les frigos se remplissent grâce à la Lady Gaga
Oh Lady Gaga
Les prisons se surpeuplent à cause de la Lady Gaga
Oh Lady Gaga
Drôle est notre humeur à cause de la Lady Gaga
Oh Lady Gaga
Lady Gaga (x16)
Oh mon ptit bébé de grande valeur
Tu m'as rapporté tellement de malheurs
Hmm, oh mon ptit bébé de grande valeur
Tu m'as rapporté tellement de malheurs

[Couplet 2:Dehmo]
Pas de 09 moi elle était pourrie
Mais vas y passe mes 70 balles et j'ai le sourire
Oh mon ptit bébé de grande valeur
Egal ptit bébé de grands malheurs
Je reconnais les prétendants qui t'ont dans la peau
Et ceux qui te manipulent qui t'ont dans les poches
Oh ma Lady Gaga
Je suis pas un hagar
Sois bonne pour mes ien-cli et j'en serai gaga
Et si c'est la hess je t'emmènerai partout
Rencontrer des riches dans le milieu du show buisness
Une autre rupture elle date de plusieurs mois
Ça venait de moi
Maintenant j'ai essayé dans le rap de tess
Oh mon ptit bébé de grande valeur
Tu m'as rapporté tellement de malheurs
Un mal pour un bien je garde bon coeur
Je rap et je suis un pauvre qui vient d'ailleurs
Les kainri te glorifient, te plébiscitent, te trouvent magnifique
Ou maléfique
Quand le mal est fait
Capable de provoquer des guerres fratricides
Oh Lady Gaga
Oh Lady Gaga
Oh Lady Gaga
Oh Lady Gaga
Oh Lady Gaga
Oh Lady Gaga
Oh Lady Gaga
Wesh Tony Montana
Wesh Rihanna
Wesh Maradona
Wesh XXX

[Refrain]

[Couplet 3:Rod'k]
Eh Eh
Lady Gaga
Traîne dans les couilles des dealers et atterrit dans les soirées branchées
Lady Gaga
Peut te transformer la plus grande célébrité en plus gros des déchets
Certains se la procurent pour faire de l'oseille
D'autres pour leur plaisir perso se la foutent dans le zen
Avec elle ils se sentent plus chauds
Prêt à fumer un gars quand Lady Gaga coule dans ses veines
Si t'as la meilleurs Lady Gaga t’attisera la jalousie
Que des petits mange-pierres [?] voudront te finir au fusil
Ne la touche même pas
Ou viendront les soucis
Pète un plomb tu pourras finir ta vie en asile
Avec elle t'aura les liasses qui t'amèneront les tass
Ensuite s'amènera cette putain qu'on appelle la poisse
Gros, j'en ai bicrave je sais de quoi je te parle
En vrai Lady Gaga n'est qu'un pétasse
[Couplet 4:Hache-P]
Filoché par la poisse avant même de me mettre à détailler ma Lady Gaga
Elle a monté ma côte au prix des tracas
Mais je l'ai maquée , sans que jamais elle ne me hagar
Jamais baisser la garde face au charme de cette tshaga
Oui c'est moi qui la coache
Pas l'inverse coquine
Jeu de hanche gauche droite
Bise sur le pif des shlaga
Rest In Peace à mamzelle Winehouse qui l'a prise pour amie au point de son existence en raquer
Qu'est ce que tu veux ma salope est traîtresse, abuse de ta détresse
Elle traîne et danse avec la racaille
Bisexuelle, elle a rendu accro hommes et femmes en manque de sensations sur Beriz
Pas de couleur définie par ses esclaves
Mis à part le scénario noir dans le quel ils périssent

[Refrain]1Embed"
MZ,Lang vej,"1 Contributor5 AM LyricsBaby you got somethin on your mind
I know because you are tryna hide
Everything everything everything
Is gonna be alright
We just really gotta keep on tryin

VERSE 1
Sometimes I just can’t help myself
What you do to me is bad for my health
But you make me feel alive like no-one else
Take my breath away like a too tight belt

Remember when I felt stupid
Being next to you
I still do it
Working the brain like you doin
People wondering why you do me

Saying you are mine Sounds like music
If gods the trailer You are the movie
High definition you know im zoomin
Wanna live with you and don’t just be a roomie

We ́ve known
Each other for a long time
On the whole it has been so fine
They paintin pictures from you and I
They show we fit together like you and I
You might also likeChorus

Baby you got somethin on your mind
I know because you are tryna hide
Everything everything everything
Is gonna be alright
We just really gotta keep on tryin

Baby you got somethin on your mind
I know because you are tryna hide
Everything everything everything
Is gonna be alright
We just really gotta keep on tryin

VERSE 2

Yo Mz
Notice this
You are like magic
Hocus pocus i wanna focus
On you if life is work you the bonus
If you the streets im the homeless
Natural beauty don’t have to do anything for it
Gimme your hand and I hold it
With you on my side I feel like a grown kid

I say it one time one time
I want you to come by come by
And wake me up like the sunshine
If you are cocain you are my loveline


I say it one time one time
I want you to come by come by
And wake me up like the sunshine
If you are cocain you are my loveline

Chorus
Baby you got somethin on your mind
I know because you are tryna hide
Everything everything everything
Is gonna be alright1Embed"
MZ,Linge Sale,"13 ContributorsLinge Sale Lyrics[Refrain : Dehmo]
Bien sûr l'industrie va m'faire baisser mon froc
J'vais leur chier à la gueule
J'suis un loveur bébé t'adoreras me détester
En me suçant la queue
Sers moi un verre que je raconte mes emmerdes
J't'ai dit : sers moi un verre que je raconte mes emmerdes

[Couplet 1 : Dehmo]
J'écris les conneries de la jungle
Les femelles c'est dangereux, un coup de queue, un coup de cœur
Visite à six heures donc aujourd'hui pas d'Google
Ecoute la police quand ils te disent ferme ta gueule
Pour un négro la vie c'est pas facile
J'ai pas le temps, j'ai pas pour habitude d'être fragile
Ils pètent un plomb à force de fumer du vieux shit
Le rap c'est de l'eau, t'es noir, j't'explique
Tu bosseras trois fois plus pour faire trempette dans la piscine
Tu crois que ça se résume à baiser des bitchs
Le public raffole de tes suceurs de bites
J'viens de là où on attend pas le Père Noël
On attend plutôt celui qui aura le meilleur matos
Ils achètent leurs armes pour leurs clips
Nous plutôt pour sécuriser notre peau
Les grands médias te tournent le dos
T'as pas la gueule à Kev' Adams pour les prendre en levrette
Quand je dis des ""nique ta mère"" ça passe pas
Mais quand c'est des fils à pap... hm ça passe crème
Si le rap c'était mieux avant, ferme ta gueule
Fais ton deuil et qu'il repose en paix
Joue le jeu, c'est la MZ
Reconnaît dans toute la France ses supporters
J'aime la musique, je veux la révolutionner comme le docteur
Tellement d'escrocs, ça ne change pas depuis l'époque des Bone Thugs
Hélas, Bébé
Nan pétasse le rap c'est comme ta gueule c'est chelou sans make-up
You might also like[Refrain : Dehmo]
Bien sûr l'industrie va m'faire baisser mon froc
J'vais leur chier à la gueule
J'suis un loveur bébé t'adoreras me détester
En me suçant la queue
Sers moi un verre que je raconte mes emmerdes
J't'ai dit : sers moi un verre que je raconte mes emmerdes

[Couplet 2 : Hache-P]
Le jour où j'suis venu au monde, papa était en son-pri
Mentalité de revanchard, n'ont jamais compris
Pas là pour faire du mal mais pour récupérer tout ce qu'ils ont pris
C'est pour maman qu'j'vis, et ses putains de factures
Papa m'dit d'esquiver les lardus
Les petits ne connaissent pas encore les problèmes
Les pauvres n'savent pas comment cette vie est dure
P'tite merde
Déjà qu'j'm'en bats les couilles, j'suis pas là pour t'plaire
J'ai jamais compris la crise financière
Ils nous prennent pour des cons pendant qu'mon continent pleure
On s'en bat les couilles de qui t'es
On va sucer personne, allez quittez
On a des armes d'Antiquité
Seul maître de nos destins, aucun faibles d'esprit on est pas téléguidés
Wesh, belek à ton derch
Ton soi-disant poto peut changer pour du cash
Ton frère de sang peut changer pour une teuch
Ta propre femme peut te foutre en cage
On a visser dans ce putain de skate-park
Au début c'était que pour cette paire de sket-ba
Le vice du biff nous a menés au quette-pla
Car on voulait plus de grailles dans nos plats
J'déteste les suceurs de bites, j'les ai dans le viseur j'débite
J'veux que les p'tits frères débitent tout en étant loin d'ces putes
Très jeune j'ai jeté les cahiers, j'ai jamais voulu travailler
Des kilos, des kils de shit détaillés
C'est pas ta mère qui va payer mon loyer
Poto j'ai grandi au bled moi, j'veux jamais crié à l'aide moi
Car je sais faire des pépettes moi
T'inquiète j'ai remarqué ces fils de pute dans le quartier ou en dehors
Que des hypocrites et j'les ken moi
Si j'les ken XXX ces fils de pute crieront pour que je fasse un XXX
Me voir réussir leur font mal à la tête
On est pas inquiets les grigris viennent du bled
Négro j'ai la rage, ouais négro j'ai la rage
Ces fils de pute me foutent la rage
Casser la tête pour des futilités, j'ai plus l'âge
Le buzz est une pute, le public ingrat
Le temps passe vite et moi j'attends de crever
Wesh la concu', j'vous donne rendez-vous sur la ligne d'arrivée
[Couplet 3 : Jok'Air]
Depuis Bratatata, ils nous regardent de haut
Ma voix sort du bloc, elle résonne dans les halls
J'te montre ma vie, en Blu-ray et en V.O
Les mots sont dix fois plus explicites qu'une vidéo
J'viens te chanter ma B.O
J'dors peu la nuit, j'fume beaucoup de bédo
J'suis au studio, je n'ai pas de réseau
J'bosse pour transformer mes flows en euros
Notre affaire de famille est tombée à l'eau
Dur d'avancer quand t'es entouré de faux négros comme Zox' et Melopheelo
Tout le monde sait combien pour eux j'avais de l'estime
Tu n'as rien d'un king, arrêtons la mythologie
T'es qu'un imposteur qui veut graille sur ma musique
Vous m'avez bien eu
M'demande pas pourquoi j'lave mon linge sale en public
Si quand j't'appelle tu t'mets constamment sur messagerie
J'pourrais être ton fils donc arrête de prendre la fuite
Ma vie est triste, moi qui aurait voulu être un artiste
J'sais plus où j'mange car j'traîne où j'habite
J'traîne dans le bloc avec les mecs d'mon équipe
Parlons pas religion, parlons pas politique
Parlons pas devant les putes et devant la police
Le week-end j'suis fucked up dans le carré VIP
J'sors que quand mes couilles et les bouteilles sont vides
J'kicke et mes djandjous twerkent
Mes OG bougent leurs têtes
Maman tes enfants remboursent tes dettes
Grâce aux bénef' des concerts et mixtapes
J'viens de Chevaleret tout comme Marlo et Chich
Donc je me dois de faire du chiffre, et du chiffre, et du chiffre, et du chiffre, et du chiffre, et du chiffre
La vie est dure
Donc j'bosse comme Isma, j'bosse comme un boss
J'bosse comme Davidson
La dictature
Le régime qu'on instaurera au prochain albumEmbed"
MZ,Mafia,"6 ContributorsMafia Lyrics[Couplet 1 - Dehmo]
J'suis dans mon coin, je fais c'que j'ai à faire
Mais j'te cache pas que j'aime pas les paroles de tous tes putain d'prêcheurs
J'suis dans la réaction et l'action
J'suis plus dans la shneck à ta soeur, elle me rappelle qu'j'suis un mauvais pécheur
On est sur le même bateau, mais on n'a pas la même côte
On n'a pas bossé le même eldorado
Va t'faire enculer si t'as l'temps
Va t'faire enculer si tu tends la main comme un manchot
Et où sont passés mes négros ?
Mes négros qui, sous la ceinture, font caresser le fer aux abdos
Les feuilles tombent et les nuages pleurent
On est sur le ter-ter, on est déterminé comme Rambo
J'suis comme on n'en fait plus
J'lui donne toujours son bonbon même quand j'en peux plus
Jaloux j'me souviens pas d'ta gueule comme mon prépuce
Tu m'niques par wi-fi, j'te nique dans la vie
On ne m'en fait plus, ma p'tite Dehmo imite-moi mais t'as pas l'astuce
Ton game il pue la merde comme un pet qu'on propulse
J'te nique en musique, en Zeutrei Mafia

[Refrain : Dehmo]
Du quartier à la métropole, on tourne, on tourne, c'est bon, ouais
Blehni tu nous connais pas, on est la nouvelle sensation, ouais
On y va à fond pour nos billets et on fume la bonne, ouais
T'inquiète, on n'a pas touché ta meuf
Vu qu'elle est pas très bonne, ouais
On est comme on n'en fait plus
On est comme on n'en fait plus
On est comme on est, comme on est, comme on n'en fait plus
On est comme on n'en fait plus
On est comme on n'en fait plus
On est comme on est, comme on est, comme on est
Mafia, mafia, mafia, mafia
Mafia, mafia, mafia
On est comme on est, comme on est
[Couplet 2 : Jok'Air]
Mafia, j'ai perdu mon âme dans cette mafia
Où les enfants meurent dans les rues de Paname
Au bas-fond de Massillia
L'ambiance est invivable, les fondations d'nos murs sont peu fiables
L'amour est familiale
Résidu d'cocaïne sur mes billets d'banque
Les schlags et les putes sont en manque
De la planque au point d'vente, mais Big Daddy bosse pour s'remplir le ventre
À force de sucer t'as des croûtes sur les genoux
Gorge profonde ou pas, tu ne seras jamais comme nous
3 comme la MSN sur le terrain du Camp Nou
Ils savent qu'on a les mains sales mais qu'on est mignon comme tout
Mafia

[Refrain : Dehmo]
Du quartier à la métropole, on tourne, on tourne, c'est bon, ouais
Blehni tu nous connais pas, on est la nouvelle sensation, ouais
On y va à fond pour nos billets et on fume la bonne, ouais
T'inquiète, on n'a pas touché ta meuf
Vu qu'elle est pas très bonne, ouais
On est comme on n'en fait plus
On est comme on n'en fait plus
On est comme on est, comme on est, comme on n'en fait plus
On est comme on n'en fait plus
On est comme on n'en fait plus
On est comme on est, comme on est, comme on est
Mafia, mafia, mafia, mafia
Mafia, mafia, mafia
On est comme on est, comme on est
[Couplet 3 : Hache-P]
Mafia
J'prends l'coffre et j'me barre tel un fuyard
S'ta meuf parle de oim, gros méfie-toi
J'répète dans ma te-tê, c'est un gros foutoir
Elle a vu l'ke-tru, elle veut s'rier-ma
Elle a pas d'oseille, j'veux Rihanna
Tu cherches à t'montrer, j'veux Kalina
J'ai d'la gue-dro en l'stock, fuck leur malinois
J'suis avec Majestic dans la vago
Rien qu'on barode
J'suis fonce-dé, jnouné
Toi tu grattes des sticks, ça t'rend paro'
On a du bédo, ça roule des gros joints toute la journée
Ouais, et j'vois qu't'es vert
On est comme on est, tu vas rien faire
Paye-moi en liquide, j'dégaine le fer
Ivoirien dans l'sang, y'a pas plus fier

[Refrain : Dehmo]
Du quartier à la métropole, on tourne, on tourne, c'est bon, ouais
Blehni tu nous connais pas, on est la nouvelle sensation, ouais
On y va à fond pour nos billets et on fume la bonne, ouais
T'inquiète, on n'a pas touché ta meuf
Vu qu'elle est pas très bonne, ouais
On est comme on n'en fait plus
On est comme on n'en fait plus
On est comme on est, comme on est, comme on n'en fait plus
On est comme on n'en fait plus
On est comme on n'en fait plus
On est comme on est, comme on est, comme on est
Mafia, mafia, mafia, mafia
Mafia, mafia, mafia
On est comme on est, comme on estYou might also likeEmbed"
MZ,Między piekłem a niebem,"4 ContributorsSpóźnieni kochankowie Lyrics[Refren]
Ile razy to słyszysz?
Życie, samotność w ciszy
To czego sam się boję
Ja i Ty - spóźnieni kochankowie
Kiedy słowa nic nie znaczą
Kiedy anioły płaczą
Wpół otwarte oczy, między snem a czuwaniem
Pozory, nic już nie jest tym czym się wydaje

[Verse 1]
Ej kobitko, proszę, nie bądź taka smutna
Obiecuje, zapomnisz o mnie do jutra
To, co piękne już minęło, to co złe się zakończyło
Życie zabiło tą miłość, noc łka po cichu, tak jest tu
Miejsce w łóżku puste, ale ciepłe od Twojego snu
Milczenie, które tak dużo mówiło, nic już nam nie powie
Ja i Ty - spóźnieni kochankowie
Na Twojej buzi łzy, jak na niebie krople gwiazd
Nie zatrzymasz tego, zły wiatr wieje nam w twarz
Wilgotnych oczu blask, tego nie zmienia
Pocałunkami nie zmusisz mnie do milczenia
Daj mi spokój, zostaw, puść mnie
Nie potrafię odpowiadać uśmiechem na uśmiech
Wiem ta melodia zabija serca
Zobaczysz, zapomnisz, czas to morderca
You might also like
[Refren]
Ile razy to słyszysz?
To czego sam się boję
Kiedy słowa nic nie znaczą
Wpół otwarte oczy, między snem, a czuwaniem
Pozory, nic już nie jest tym czym się wydaje


[Verse 2]
Mój obraz w Twoich oczach powoli blaknie
Puls słabnie, krew krzepnie
Nie pasuje do Twojego świata, nie mogę być już tu
Chłopak z bloków, z innego kruszcu
Znam smak krwi, łez, potu
Moi przyjaciele na marginesie mroku
Deszcz mży wilgocią, żalem, smutkiem
Każdy z nas z niepewnym jutrem
Ulice dziś bezludne wypełnia szept słów
Księżyc rzuca mi twój cień do stóp
Wszystko już skończone jest między nami
Nie wymuszaj miłości, nie szantażuj łzami
Zapomnij o mnie, nie ma mnie od teraz
To rzeczywistość ten przymus wywiera
Wykasuj mój telefon, to proste jest, widzisz?
Wczoraj mnie kochałaś, dziś mnie znienawidzisz
[Refren]
Ile razy to słyszysz?
Życie, samotność w ciszy
To czego sam się boję
Ja i Ty, spóźnieni kochankowie
Kiedy słowa nic nie znaczą
Kiedy anioły płaczą
Wpół otwarte oczy, między snem a czuwaniem
Pozory, nic już nie jest tym czym się wydajeEmbed"
MZ,Mi Nena,"3 ContributorsHustle Lyrics[Hook: A.V.I.D]
Mmmh!
You know I hustle/
I hustle/
Haaard..
I hustle/
I hustle/
Haaaard..

[Verse 1: Fid Q]
Naongeza maujuzi ili nisichokwe na crown, Heeenh/
Usilete makuzi, Hamtaki nitoke na bounce, Heeenh/
Ni mzee mbuzi, SHIPAPI, Zitoke hizo blouse, Heeenh/
Take off the shoes when you walk in the house/
Na hurudi ndani kama futi ya fundi ukuta/
Nina bahati f'lani mamluki, Wazushi hunisusa/
Kesho sio spesho, ikiwa haifiki ka keshokutwa/
Na ni vyema depo usiwepo, ikiwa street we ni kuruta/
Na je mnaamini kwenye Get up and get it/
Au ndio mshalemazwa na ile sit down and see it/
Siri ikiwa ya wawili haiwi siri mtaji Snitch/
Na tajiri haukariri, Hauoni watabiri wana-switch/
Mko bize, Mnataka mniharibie nisitoke/
Njia yenu ina utelezi, Nije mnipatie matope??/
Mna upungufu wa umakini/
Mnahitaji rapture kama waefeso/
Luni ki nne kumi na saba/
Sometimes, Nakaa chini akilini najenga fikra/
Najiuliza lini mtashika madini ya hichi kichwa/
Ukauzu huu sio wa kufuga kama mzuzu wa Zavara/
Msi confuse Kung Fu na ile Lugha ya ishara/
Na flip hii game, kama Jaguar kwenye maonyesho ya sarakasi/
Kwa mademu mi zaidi ya viagra inayompa msaada bwana yake/
So.. Nikimwona mchizi, Anam kiss demu wangu wa zamani/
Kwenye Lips na ana enjoy nahisi atamu yule demu akinipa m... Sikojoi/
You might also like[Hook: A.V.I.D]
I hustle/
Haaard..
I hustle/
I hustle/
Haaaard..

[Verse 2: Fid Q]
I want some mother shit ka dudu kuwa kwenye tundu sio, Huuh??
Unaweza ukauwa ukawa na uchungu na kilio, Huuh??
Nachojua kiwe sure kiwe ndiyo, Huuh?
Tusiwe waoga unataka slogan?? ndiyo hio, Huuh?
Naona mnavyonifonza napoonja mafanikio/
Jeshi la mtu mmoja sitochoka, Sitotoka mbio/
Sitotoka na kiu ya mgonjwa aliyeponzwa na kauli mbiu hiyo/
Nakufa moyo nikikwama imani inakosa/
Kichwani zinatoka, Nani wa kumlaani haswa unanitosa/
Kwa sehemu husika ni vyema, Game linalipa mapema/
Ukizishika neema, Hunipa kwa fani ya kufoka/
Kisha unasema mlaji sio mchumi, Huunh??
Namvisha taji uvunaji unahitaji kanuni, Huunh??
Inakuwaje sina kumi wakati nina tisa/
Watanijuaje muhuni bila kusababisha/
Kama mapacha na DO ME, Au May Weather na ngumi??/
Juu ya meza au uvunguni, Bila kuwekeza hata thumni??/
Nachokieneza hakibumi, Haswa wakinipigisha bars wao huteleza/
Sio wakati wa R. Kelly wamwache Chris Breezy atishe/
Akiwa Lubumbashi au na hii chart na Ekotite, Eeeh?/
Anataka apite, Abaki kati ili bahati isimshike/
Asitambae na chaki mvute shati hisabati zimtishe/
Dharau ndio kilema nilichonacho/
Nawasahau mapema wadau walionitema kisha na hustle/
Na ninapiga bao, Vyema mbele yao/
Tena wakiwa macho, Nyamazisha wanao/
Nena kwa Neema nikivuja Jasho/
Mziki ni zaidi ya DO RE MI FA SOOO/
Na wapenda kiki ndio wanalowea mipashoo/
Na ninasikia siku hizi pesa inafanya upuuzi uwe ishu/
Kisa inalipa isiwe excuse kwa kila kitu/
[Hook: A.V.I.D]
I put my heart and soul, coz this all i know/
All I know is to hustle/
I hustle/
I hustle hard/
You know I hustle/
You know I hustle/
Haaard/

WaneneEmbed"
MZ,Mitraillette,"4 ContributorsMitraillette Lyrics[Couplet 1 : Rod-K]
Océan d'matière fécale, automatique, illicite comme XXX
Mains faites pour le diamant, j'pouvais pas les laisser dans le cambouis
Fils d'immigrants du tiers-monde à la débrouille, au bon-char, tant doué
XXX du thermos, chaleur humaine en chute quand vient le moment de se renflouer
Focalisés sur XXX, XXX XXX
Mothefuck ici la MZ, plus grand chose nous fait trembler
J'y tremperai pas par inadvertance, apercevoir ma réussite se cambrer
J'te raconterai pas des montagnes, ouais
J'arrache tout puis je me taille
Mentalité à finir écroué ou troué comme l'emmental, l'ami
Jamais de fausses notes dans mes écrits
Et ce jusqu'à ce que me sucent leurs hauts-placés qui nous méprisent

[Refrain : Hache-P]
Oh, posé au tièks, j'prépare mes dièzes
Je fais partie de ceux que les meufs biens ne fréquentent pas
J'fais mon business, les flics me guettent
J'm'en bats les steaks tant que je goûte pas au card-pla
Faut que j'évite le placard, faut que j'évite le placard
Faut que j'évite le placard, faut que je trouve un plan B hé hé
Faut que j'évite le placard, faut que j'évite le placard
Faut que j'évite le placard, faut que je trouve un plan B hé hé
B hé hé, B hé hé
J'ai besoin d'un plan, il me faut ce plan
Faut que je trouve un plan B hé hé
B hé hé, B hé hé
Faut pas que je tombe dedans, faut que je trouve ce plan
J'ai besoin d'un plan B hé hé
You might also like[Couplet 2 : Dehmo]
C'est que de prises de risque, fais pas le surpris sur des coups de vice
Tu vois que la poisse te piste, dans le biz le salaire n'est jamais fixe
Faudra te lever tôt, recharger du bon bédo
Fais pas l'imitation ghetto, zappe la cerise sur le gâteau
Trouve-toi 2-3 gars sûrs qui t'assurent jusqu'à ta soeur
On tombera tous un jour ou l'autre, renvoie-moi juste l'ascenseur
Bise aux petites sincères, vise la puissance frère
Les renois sont pas prêts, fuck du blé reste le fils de ton père
Toujours 2 coups d'avance, demande pas au bonobo comment faire des gosses
Quand t'es le 22 sur le terrain, personne te demandera c'est quoi ton poste
T'affiche pas comme les B2K
Et puis barbie n'est qu'une pute qui ken
1 pour le respect, 2 fais de l'oseille
Et arrête de t'astiquer la kékétte

[Refrain : Hache-P]

[Couplet 3 : Jok'Air]
Jeune focus, j'dois faire des thunes et faire des gros tubes
Même si parfois je suis distrait par des gros culs
Depuis que Papa n'est pas là, j'ai du épaulé la mama
J'veux faire un paquet de mula sans la même fin que Tony Montana
J'suis allé à l'école, j'ai vendu de la drogue
Résultat : j'ai vendu ma drogue sur le chemin de l'école
Et sachez que j'suis pas un bandit mais le reflet de là où j'ai grandi
Nos ennemis sont tellement proches que je compte dormir avec un brolique sous le lit
Oh, insoumis depuis l'abolition
Je rêve de faire l'amour à la vie depuis ma circoncision
J'traine dans les rues de ma ville avec les mecs de ma circonscription
Comme Mitraillette j'veux atteindre tous mes rêves sans exception
[Refrain : Hache-P]

[Outro]
Davidson Presents, KDBzik
Davidson Presents, KDBzik
Davidson Presents, KDBzik
Davidson Presents, KDBzikEmbed"
