Artist,Title,Lyrics
MZ,Coca N Bourbon,"6 ContributorsCoca N Bourbon Lyrics[Refrain : Jok'Air]
Si t'as peur du noir n'aies plus d'inquiétudes
J'illuminerai tes nuits de ma présence
On fera l'amour sous le clair de Lune
Avant qu'le soleil se lève et qu'les oiseaux chantent
Yeah, yeah
Attention ma belle, le négro peut t'faire tomber love
Dans l'son comme au pieu
Cocotte, je sais qu't'aimes quand j'innove
T'es bonne, bien roulée comme mon bédo
Tu m'trouves bon j'fonds dans ta bouche comme un bonbon
Laissons nos corps parler sans s'dire un mot
On s'mélange comme mon Coca et mon bourbon
Yeah, yeah
Attention ma belle le négro peut t'faire tomber love
Dans l'son comme au pieu
Cocotte, je sais qu't'aimes quand j'innove

[Couplet 1 : Dehmo]
J'm'en fous d'ta vie, quand on baise ensemble
C'est mieux que le cinéma
J'suis gentil dans l'fond mais sévère en surface
Pour pas qu't'imagines jusqu'au mariage
On s'met tellement bien
J'ai oublié qu'on a dépassé le troisième quart d'heure
Je suis pas venu pour toi, toi t'es gentille
Tu mérites qu'un d'ces putains d'lover
Attention, ma belle j'suis franc
Comme si j'avais tisé Jack D
J'emmerde tous tes problèmes de cœur
En c'moment j'suis à la recherche d'un tard-pé
Quand j'suis fonce-dé j't'appelle, miskina
J'crois qu'tu connais mon numéro par cœur
T'as vu la dégaine, tu t'es fiée
Je ne suis pas qu'un beau parleur
You might also like[Refrain : Jok'Air]
Si t'as peur du noir n'aies plus d'inquiétudes
J'illuminerai tes nuits de ma présence
On fera l'amour sous le clair de Lune
Avant qu'le soleil se lève et qu'les oiseaux chantent
Yeah, yeah
Attention ma belle, le négro peut t'faire tomber love
Dans l'son comme au pieu
Cocotte, je sais qu't'aimes quand j'innove
T'es bonne, bien roulée comme mon bédo
Tu m'trouves bon j'fonds dans ta bouche comme un bonbon
Laissons nos corps parler sans s'dire un mot
On s'mélange comme mon Coca et mon bourbon
Yeah, yeah
Attention ma belle le négro peut t'faire tomber love
Dans l'son comme au pieu
Cocotte, je sais qu't'aimes quand j'innove

[Couplet 2 : Jok'Air]
Attache ta ceinture ce soir car tu roules avec moi
Si t'as peur du noir t'inquiète bébé, moi je veillerai sur toi
L'amour tu n'y crois plus car des ex t'ont fait perdre la foi
Et plus j'te baise et plus tu m'aimes
Et ces mots tu me les sors à chaque fois
J'ai des nouvelles sucreries te faire goûter
J'ai des nouvelles huiles, de la nouvelle weed
Pour te faire passer des bons moments, tu sais qu'j'suis doué
On sent l'instant passionnément sous les draps qu'on va souiller
S'il te plaît bébé, t'attache pas aux liens qu'on a noués
Car si nous voir ensemble pour la vie est ton souhait
Sache que mon cœur n'est pas à prendre mais ma bite est à louer
[Refrain : Jok'Air]
Si t'as peur du noir n'aies plus d'inquiétudes
J'illuminerai tes nuits de ma présence
On fera l'amour sous le clair de Lune
Avant qu'le soleil se lève et qu'les oiseaux chantent
Yeah, yeah
Attention ma belle, le négro peut t'faire tomber love
Dans l'son comme au pieu
Cocotte, je sais qu't'aimes quand j'innove
T'es bonne, bien roulée comme mon bédo
Tu m'trouves bon j'fonds dans ta bouche comme un bonbon
Laissons nos corps parler sans s'dire un mot
On s'mélange comme mon Coca et mon bourbon
Yeah, yeah
Attention ma belle le négro peut t'faire tomber love
Dans l'son comme au pieu
Cocotte, je sais qu't'aimes quand j'innove

[Couplet 3 : Hache-P]
J'te dirai sûrement des mots d'amour juste pour te...
Un conseil ma chérie, évite les mecs comme moi
J'suis un gamin ne t'attache pas (Tu vas souffrir)
J'te répète ne t'attache pas (T'as des envies de mourir)
J'préfère te dire, j'ai plus de vice que toutes ces bitches
T'as beau pleurer des rivières
En toute sincérité j'm'en fiche
J'ai le truc qu'ils ont pas ma chérie
Qui pourra te faire tomber love
(Fais gaffe ma chérie tu peux tomber love)
[Refrain : Jok'Air]
Si t'as peur du noir n'aies plus d'inquiétudes
J'illuminerai tes nuits de ma présence
On fera l'amour sous le clair de Lune
Avant qu'le soleil se lève et qu'les oiseaux chantent
Yeah, yeah
Attention ma belle, le négro peut t'faire tomber love
Dans l'son comme au pieu
Cocotte, je sais qu't'aimes quand j'innove
T'es bonne, bien roulée comme mon bédo
Tu m'trouves bon j'fonds dans ta bouche comme un bonbon
Laissons nos corps parler sans s'dire un mot
On s'mélange comme mon Coca et mon bourbon
Yeah, yeah
Attention ma belle le négro peut t'faire tomber love
Dans l'son comme au pieu
Cocotte, je sais qu't'aimes quand j'innove4Embed"
MZ,Brrr,"15 ContributorsBrrr Lyrics[Couplet 1 - Dehmo]
J't'allume ta mère, petit, juste parce que j'ai la flemme de pousser
Fuck les gens qui me veulent du mal, j'ai pas besoin d'alcool pour me booster
Du prolifique, mets Kalina sur nous : ça va rapporter
Tu forces trop sur la street, rien que ça suce, les plans comme ça c'est bourbier
La MZ se résume à beuh, tise, nerfs et a des bombées
Miss, j'suis pas ton mec, j'crois qu'il a pas ce zizi qui pourrait te contenter
Content d'avoir fait ta connaissance, j'suis pas venu pour rester b-b-b-bander
L'oseille dans mon crâne, mes poches de gent-ar, j'espère voir tous tes potos écroués
J'suis pas venu pour prendre ce que j'ai le droit de prendre
Plutôt pour prendre ce que j'ai pas le droit de prendre
Mimi t'es bonne et moi j'suis poli, quand je dis fais doucement en me suçant j'suis poli
Ça dépend pour qui je suis un mauvais colis
On est dirigés par des alcooliques
Te prends pas la tête, sur moi j'ai plus de côte que tes fesses #torticolis

[Refrain - Hache P]
Dans les boîtes
Dans les putains d'blocks, dans les putains de bats
La 'zique est bad comme cette putain de dope qu'on vi-ser en bas
Dans les boîtes
Dans les putains d'blocks, dans les putains de bats
La 'zique est bad comme cette putain de dope qu'on vi-ser en bas
Brrr !
J'm'en bats les couilles, besoin de personne
KDBZik, besoin de personne
J'm'en bats les couilles, besoin de personne
Davidson Presents, besoin de personne
Brrr !
J'm'en bats les couilles, besoin de personne
KDBZik, besoin de personne
J'm'en bats les couilles, besoin de personne
Davidson Presents, besoin de personne
You might also like[Couplet 2 - Hache P]
Postichés au ssage- Pa
Entourés de bâcheliers et de SEGPA
Tu veux savoir d'où nous vient cette inspi
Sur la vie de mon flow, moi-même je sais pas
MZ volume 3 tah le magma
L'album sera pire que le magma
Tu donnes ton boule mais tu fais pas un sous, j'crois que ton producteur te matte mal
Mon flow aurait besoin d'un psychiatre, déterminés comme les p'tits du 24
MZ clique, en bas de ton bât depuis Lune De Fiel toutes ces putes pètent  un câble
J'vais reprendre le pilon ou j'vais en faire tapiner si on explose pas tous dans les charts
En attendant l'album, on les effraie tous comme cette pute qui pue de la chatte
La Zipette est pée-cou, les plaquettes sont pées-cou
Les potos sous écrou car les bigo sont sur écoute
Putain comment j'me marre quand j'vois tous ces rappeurs s'entretuer pendant que dans mon tier-quar on s'est serré les coudes
Tu vas blaguer sonne-per, vendre du rêve à sonne-per
Tout le tier-quar sait que tu roules en loc'
Tu fais peur à sonne-per, tu vas tirer sur sonne-per
Ma parole, tu peux ranger ton Glock

[Refrain - Hache P]

[Couplet 3 - Jok'Air]
Les concurrents veulent mes phases et mes flows
Tirer sur mon bédo, être dans le block, appréciés dans le ghetto
Baiser les mêmes gos, traîner dans ma bande
Pratiquer un gang-bang dans le bendo
J'ai la plume à Rimbaud, j'défouraille comme Rambo
Bratatata j'te fais une passoir dans le dos
J'ai ce qu'on appelle le ""bang bang flow""
Jok'Air est venu mettre un terme au bal des faux, négro (Brrr !)
'Bats les couilles, besoin de personne
Aucun de ces négros ne m'impressionne
J'suis venu ramasser les grosses sommes, ils se demandent qui nous sommes, les euros s'additionnent
Aucun de ces pelos je n'affectionne, l'ange de la mort en Smith & Wesson
Faire du sale c'est mon job, moi c'est Malekal John dit le fils du King de Boulogne
MZ est dans le building, j'sens la haine en eux
Parce qu'on est ces négros qui niquent le rap jeu
Ces jeunes négros qui rappent comme eux mais en mieux
Une pute à chaque porte parisien.n.e
J'l'a prends en leu-leu comme une chien.n.e
Cette salope trouve ma queue aussi bonne que ma beuh
Parce que les deux la défonce en moins de deux
[Refrain - Hache P]5Embed"
MZ,Jambes en l’air,"13 ContributorsJambes en l’air Lyrics[Intro - Dehmo]
Meuf, cash, Franco Ferre, frappe, teille-bav
Meuf, cash, Franco Ferre, frappe, teille-bav
Meuf, cash, Franco Ferre, frappe, teille-bav
Aïe aïe aïe j'prends mon pied là, les jambes en l'air

[Couplet 1 - Hache-P]
Le prix d'une plaquette de 100g aux ieps
'teille de JB XXX
Toujours le même, même si j'ai signé tu peux toujours me voir au tieks
Défoncé sous tise, on s'en bat les couilles de tes ragots
Ce que mes niaggas veulent c'est de la marchandise
Après les prises de risque et les charbonnages
Ce qu'on aime c'est le jour de paie
Gros dièse égale gros sous, sans oublier que ça rime avec grosse peine
C'quon aime c'est piner, toutes ces bitches dans le game nous parle pas de nausée
Maintenant les tasses-pé veulent se poser... hahaha, osé !
Petite virée sur Bériz avec mes niaggas ou une tasse au tel-hô
Faire du gros son comme on en a l'habitude sans sucer le moindre pélo
J'aime trop mon équipe, k'air-Jo, R.O.D, Dehmo
Davidson, Jeci-Jess, le Binôme, Zo', Melopheelo
Les putains de prods d'Ekynoxxx qu'on ne fait que fumer comme des vrais tox
J'crois qu'avec le volume 2 ils ont réellement compris qui sont les vrais boss
Avant de finir j'tenais à dire que j'aime ce qui nous soutiennent
J'aime aussi les meufs biens, on ne va pas aimer que les grosse chiennes
You might also like[Refrain - Dehmo]
Les gros billets, soirée fonce-dé, les gros fessiers (c'est ça qu'on aime)
On est pas d'accord mais n'appelle pas les policiers (non, fais pas ça)
Du nouveau ter, ça frappe et c'est pas cher
Aïe aïe aïe, j'prends mon pied là les jambes en l'air
Meuf, cash, Franco Ferre, frappe, teille-bav
Meuf, cash, Franco Ferre, frappe, teille-bav
Meuf, cash, Franco Ferre, frappe, teille-bav
Aïe aïe aïe j'prends mon pied là, les jambes en l'air

[Couplet 2 - Dehmo]
Fume ton calumet de la paix, j'fume ma chicha de la guerre
Arrête de nous dire que c'est la hass et bouge ton boule pour faire de l'oseille
Tu pues de la chatte, meuf, j'ai la haine
En fait tu respectes pas ma dégaine
Abracadabra, j'ouvre ma braguette et vois comme elle est magique ma baguette
J'fonce dans le tas, j'n'en fais qu'à ma tête
Vaut mieux avoir les couilles que v'là les pecs
Mes gars vendent des litrons, tu grattes des sticks et ta vie de nerveux on s'en bat les steaks
Vous parlez trop, moi je vous aime pas
Vos rappeurs falches, moi, j'adhère pas
C'est D.E.H, si le rap ne marche pas, j'reprendrais la vente de H
Faire la djao ouvrir ta bouche dans tout Paname c'est ça que t'aimes
Les femelles que tu convoites en faisant le canard, c'est ça que je gère
Elle est bonne, elle est discrète, elle m'fait du bien, c'est elle ma belle
Frappe un Bleu, ça fait plaisir mais devant la juge ça coûte très cher, cher, cher
Donc si ces bâtards meurent, j'm'en fous, j'leur dirais cheh, cheh, cheh
Moi et mes gars en boîte, fonce-dés rien que j'peux dead, dead, dead
Elle elle est moche, elle veut mon num, moi j'veux pas d'elle, d'elle, d'elle, non
C'est ça qu'on aime ow
[Refrain - Dehmo]

[Coupket 3 - Jok'Air]
J'aime les gros claps et les grosses basses
Les bonnes passes et les grosses liasses
Oui, j'aime aç, les soirées sous Henessy, vodka et herbe grasse
Les poufiasses, les pétasses, les chaudasses et les grosses 'tasses
Lorsque les schmitts dans nos tièks passent
Et que mes négros les caillasssent
Smoker de la peuf avec mes reufs
Fourrer des teuchs, faire la teuf
Les prendre en levrette, entend le claquement de mon bas-ventre contre leurs seufs
Fais pas la sainte-nitouche, au fond je sais que c'est ça que t'aimes
XXX j'rappe ma vie, violence, money, sexe : c'est ça le thème
J'rêve de la SACEM à Johnny, que ça rafale au uzi sur la police
De marcher comme un PIMP, comme une rockstar
Que des putes du showbiz me sucent dans les coulisses
Ejaculer sur des cheveux tous lisses4Embed"
MZ,Kalina,"9 ContributorsKalina Lyrics[Couplet 1 : Jok'Air]
Kalina, Kalina, t'as fait de nous des cannibales
On s'mange les uns les autres, ici l'instinct d'survie est animal
Kalina, Kalina, ne vois-tu pas comment ça va mal ?
Dans mon ghetto l'ambiance est triste comme dans une cathédrale
Kalina, Kalina, j't'ai couru après partout dans la capitale
T'avoir sur mes côtes, pour moi, est devenu vital
Même si une fin brutale est inévitable
Kalina, Kalina
Kalina m'impose des dilemmes délicats
J'ai laissé l'illégal au profit de ma force lyricale
Je suis tombé pour Kalina, ce soir c'est bon j'le dédicace

[Refrain : Dehmo]
Tes histoires on les connaît pas
Même moi dans ma tête j'ferais pleurer un télépathe
Y'a pas d'biff' : nous appelez pas
Bien que j'ai plus d'cardio
J'ai plus l'temps de faire les bras
Kalina, Kalina
Kalina, Kalina, Kalina, Kalina
Fuck les insignes et les clés de bras
T'es chaud, raconte
Mais faut qu'ça s'finisse à la Jacques Mesrine, Mesrine
Comme Tony Montana meurs, meurs à la Jacques Mesrine, Mesrine
Comme Manny qui meurt, meurs à la Jacques Mesrine, Mesrine
Comme Malcolm X meurs, meurs à la Jacques Mesrine, Mesrine
Et là j'serai impressionné
You might also like[Couplet 2 : Hache-P]
Toi Kalina, toi Kalina
À force de t'vouloir, j'ai fait pleurer Mama
À chaque fois qu'j't'ai conquis, oui
J'ai vu qu'du mal autour de moi, autour de moi
La jalousie, la poisse, les stups et leur malinois
Poto m'raconte pas ta vie
Moi aussi j'dois rendre des comptes à la fin du mois
Pas question d'mourir à la Jacques Mesrine
Car Maman compte fort sur son bébé chéri
J'suis toujours à la recherche d'un plan B
Fais belek pour Kalina, ça peut te plomber

[Refrain : Dehmo]
Tes histoires on les connaît pas
Même moi dans ma tête j'ferais pleurer un télépathe
Y'a pas d'biff' : nous appelez pas
Bien que j'ai plus d'cardio
J'ai plus l'temps de faire les bras
Kalina, Kalina
Kalina, Kalina, Kalina, Kalina
Fuck les insignes et les clés de bras
T'es chaud, raconte
Mais faut qu'ça s'finisse à la Jacques Mesrine, Mesrine
Comme Tony Montana meurs, meurs à la Jacques Mesrine, Mesrine
Comme Manny qui meurt, meurs à la Jacques Mesrine, Mesrine
Comme Malcolm X meurs, meurs à la Jacques Mesrine, Mesrine
Et là j'serai impressionné
[Couplet 3 : Dehmo]
Quand t'es vrai, mon gars, tu ne parles pas, tu prouves
Quand t'es chaud, mon pote, tu ne parles pas, tu bouges
Les gangsters se fondent dans la masse comme des bolosses
Les bolosses s'y fondent comme des gangsters
J'ai tourné, j'ai tourné
J'ai vu des carrures de lion avec les yeuks d'un hamster
Kalina, Kalina
Faut qu'tu leur apprennes à te faire
Ma mimi, j'pourrais pas te promettre la Lune
Mais j'suis partant pour bien chauffer c't hiver
Coucou, moi c'est la concu'
C'est fabuleux comment tous vos sons puent
C'est pas que j'en ai rien à foutre
Mais on a coupé le son en entendant ta réput'

[Refrain : Dehmo]
Tes histoires on les connaît pas
Même moi dans ma tête j'ferais pleurer un télépathe
Y'a pas d'biff' : nous appelez pas
Bien que j'ai plus d'cardio
J'ai plus l'temps de faire les bras
Kalina, Kalina
Kalina, Kalina, Kalina, Kalina
Fuck les insignes et les clés de bras
T'es chaud, raconte
Mais faut qu'ça s'finisse à la Jacques Mesrine, Mesrine
Comme Tony Montana meurs, meurs à la Jacques Mesrine, Mesrine
Comme Manny qui meurt, meurs à la Jacques Mesrine, Mesrine
Comme Malcolm X meurs, meurs à la Jacques Mesrine, Mesrine
Et là j'serai impressionné3Embed"
MZ,Lidl,"17 ContributorsLidl Lyrics[Paroles de ""Lidl""]

[Intro]
Hmm, hmm, hmm, hmm
Hmm brasse comme Lidl, hmm brasse comme Lidl
Hmm brasse comme Lidl, hmm brasse comme Lidl

[Couplet 1 : Hache-P]
Hey, hey, hey, hey
Je marche dans la ville, je me sens comme Johnny
Les bonbonnes sont calées, je suis bien loin de Tony
Ferme ta gueule, je vais rester poli
On sait que t'as rien vendu, donc arrête pauvre tho-my
Tu m'parles de ta fe-meu, j'te parle de chiffres
Le rap français va s'la prendre dans les fesses
L'objectif c'est faire du A, demande à Chich
Marlo y'a de la djandjou, donc on va se flex
Fais du papier, arrête de jacter, t'as la bouche pâteuse
T'compare pas, j'suis dans la ville en showcase
Je prends ton salaire en moins de deux
Je suis un vrai négro, fuck les Bounty
Chéri coco, bouge ton booty
MZ clique, c't'année on contrôle
La Dictature, Vladimir Poutine

[Refrain : Hache-P & Jok'Air]
J'ai les meilleurs ze-dou du tier-quar
Hmm brasse comme Lidl
Je suis plus convoité qu'Eden Hazard
Hmm brasse comme Lidl
Les boloss se plaignent de tes bouts (c'est trop lége)
T'es pas prêt, tu t'embrouilles pour des poules
Hmm brasse comme Lidl, hmm brasse comme Lidl
Rap Game, je lui sperme en pleine gueule
Nous on bosse pour être les leaders
Alors comme ça tu ne danses pas
Attends que je sorte le Desert Eagle
Négro, clic-clac paw, et tu bouges comme Kevin Lyttle
Hmm brasse comme Lidl, hmm brasse comme Lidl
Hmm brasse comme Lidl, hmm brasse comme Lidl
You might also like[Couplet 2 : Dehmo]
D'abord, j'en ai ras le bol que ces bouffons me haïssent
T'es pas le boss, parce que t'as pas le khalis
Brasse comme, brasse comme
Sebastien Vettel et sa putain de Ferrari
Approche-toi bébé, n'aie pas peur
Tu veux mon num' ou l'argent du beurre ?
J'ai du cœur, bitch, prends ma bite et lâche mon portefeuille
Faut que je sois partout comme Apple
Que je brasse comme Lidl
Comme ça je pourrais pas dire que je m'ennuie
J'ai pris le mic, baisé les MCs, fait des bébés
Ils ont les mêmes flows que moi, mais je les avais en 2010
T'es pas méchant, t'es gentil dans le fond
Mais bon, reste toi-même, t'es bof, t'es ce qu'on appelle bouffon
Je suis dans le bendo, je mélange coca'n'bourbon
Bitch, ton entreprise et la mienne vont faire fusion

[Refrain : Hache-P & Jok'Air]
J'ai les meilleurs ze-dou du tier-quar
Hmm brasse comme Lidl
Je suis plus convoité qu'Eden Hazard
Hmm brasse comme Lidl
Les boloss se plaignent de tes bouts (c'est trop lége)
T'es pas prêt, tu t'embrouilles pour des poules
Hmm brasse comme Lidl, hmm brasse comme Lidl
Rap Game, je lui sperme en pleine gueule
Nous on bosse pour être les leaders
Alors comme ça tu ne danses pas
Attends que je sorte le Desert Eagle
Négro, clic-clac paw, et tu bouges comme Kevin Lyttle
Hmm brasse comme Lidl, hmm brasse comme Lidl
Hmm brasse comme Lidl, hmm brasse comme Lidl
[Couplet 3 : Jok'Air]
Elle me trouve craquant comme un Pringles
Sucré comme un Skittles
J'leur donne toujours c'qu'elles veulent
Elles m'croquent comme la pomme de Apple
Aiment ma verge entre leurs lèvres
Je ne pense qu'à être le leader
Bitch, ma clique augmente le level
Ta mère nous kiffe comme les Beatles
Je me sens comme Kobe au Staples
À la grande époque des Lakers
Quand j'fume et tise ma liqueur
J'suis dans la bouche des haters
Ce sont des usurpateurs
Ces rappeurs sont des acteurs
Attends que j'sorte le Desert Eagle
Qu'ils dansent comme les Village People
On brasse comme Lidl

[Refrain : Hache-P & Jok'Air]
J'ai les meilleurs ze-dou du tier-quar
Hmm brasse comme Lidl
Je suis plus convoité qu'Eden Hazard
Hmm brasse comme Lidl
Les boloss se plaignent de tes bouts (c'est trop lége)
T'es pas prêt, tu t'embrouilles pour des poules
Hmm brasse comme Lidl, hmm brasse comme Lidl
Rap Game, je lui sperme en pleine gueule
Nous on bosse pour être les leaders
Alors comme ça tu ne danses pas
Attends que je sorte le Desert Eagle
Négro, clic-clac paw, et tu bouges comme Kevin Lyttle
Hmm brasse comme Lidl, hmm brasse comme Lidl
Hmm brasse comme Lidl, hmm brasse comme Lidl3Embed"
MZ,On shoot,"17 ContributorsOn shoot Lyrics[Refrain]
On shoot, on s'shoot
On shoot, on shoot
On shoot, on s'shoot
On shoot, on shoot
Et ça fait bratatata (hey)
Bratatata (hey), bratatata
Bratatata (hey), bratatata (hey), bratatata
On shoot, on s'shoot
On shoot, on shoot
On shoot, on s'shoot
On shoot, on shoot
Et ça fait bratatata (hey)
Bratatata (hey), bratatata
Bratatata (hey), bratatata (hey), bratatata

[Couplet 1 : Jok'Air]
Tout l'monde est Big Daddy, Big Daddy Jok'
Chaque jour de la semaine, c'est le week-end
L'occasion de sortir des bouteilles
Donc j'appelle Luc Bélaire
J'en commande une vingtaine
Sous rosé la vie est plus belle
Et on se shoot, on shoot
Ça fait bang bang
Du Madison Square Garden jusqu'à Clairefontaine
Hey, bratatata
J'suis le meilleur dans ce game
Je roule avec mon boys band
Pour ceux qui soutiennent : sachez que Big Daddy vous aime
Fonce-dé dans la Benz, je zoom zoom zang
Comme Joey Starr et Kool Shen
Je me shoot, je suis ouh, comme Kurt Cobain
Et je fais le Space Moutain
De Chevaleret à Avenue Montaigne
Je suis classique comme le Wu-Tang
You might also like[Refrain]
On shoot, on s'shoot
On shoot, on shoot
On shoot, on s'shoot
On shoot, on shoot
Et ça fait bratatata (hey)
Bratatata (hey), bratatata
Bratatata (hey), bratatata (hey), bratatata
On shoot, on s'shoot
On shoot, on shoot
On shoot, on s'shoot
On shoot, on shoot
Et ça fait bratatata (hey)
Bratatata (hey), bratatata
Bratatata (hey), bratatata (hey), bratatata

[Couplet 2 : Hache-P]
Un shot, j'te shoot
Je te choure ta fouffe
Elle kiff, le truc, moi-même, j'lui bouffe
Rappeur t'es drogué, arrête de jacter
En plus ton produit t'étouffe
Approche, t'inquiète, j'ai de la bonne
En un tour d'magie, tiens pouf
Ça fait bratatata, on a du bon teh'
Ramène les tei-teilles, wesh les tatas
Passe à la télé, suis-je toujours raté ?
Je suis plus fort que Neymar, j'ai tué Superman
Je fais que du sale, j'en ai marre
Je suis fonce-dé comme Gucci Mane
[Refrain]
On shoot, on s'shoot
On shoot, on shoot
On shoot, on s'shoot
On shoot, on shoot
Et ça fait bratatata (hey)
Bratatata (hey), bratatata
Bratatata (hey), bratatata (hey), bratatata
On shoot, on s'shoot
On shoot, on shoot
On shoot, on s'shoot
On shoot, on shoot
Et ça fait bratatata (hey)
Bratatata (hey), bratatata
Bratatata (hey), bratatata (hey), bratatata

[Couplet 3 : Dehmo]
J'arrive (il arrive)
Je suis frais (il est frais)
Comme d'hab' (comme d'hab')
Tu souffres (tu souffres)
J'esquive (il esquive)
Les flèches (les flèches)
Comme Jon Sn' (comme Jon Sn')
Chaque jour (chaque jour)
Elle est lourde (t'es lourde)
Elle est belle (t'es belle)
Pokéball (Pokéball)
Je la chope (je te chope)
Je suis chic (chic)
Je suis cher (cher)
Je suis chaud (chaud)
Je suis choc (choc)
On se baisse
On se baisse, on se baisse (on se tait)
On se baisse, on se baisse (chut)
On se baisse (tout le monde)
On se baisse, on se baisse (on se tait)
On se baisse, on se baisse (chut)
Il faut que tu chuchotes, les murs ont des oreilles
Après il faudra s'mettre à couvert
Joue la discret, comme 007
Et tu bratatata
[Refrain]
On shoot, on s'shoot
On shoot, on shoot
On shoot, on s'shoot
On shoot, on shoot
Et ça fait bratatata (hey)
Bratatata (hey), bratatata
Bratatata (hey), bratatata (hey), bratatata
On shoot, on s'shoot
On shoot, on shoot
On shoot, on s'shoot
On shoot, on shoot
Et ça fait bratatata (hey)
Bratatata (hey), bratatata
Bratatata (hey), bratatata (hey), bratatataEmbed"
