Artist,Title,Lyrics
MZ,Allumé,"13 ContributorsAllumé Lyrics[Intro]
Yeah, yeah
Yeah, yeah
Yeah, yeah

[Refrain : Barack Adama]
Allumé, allumé, allumé
Dans mon cerveau j'suis trop allumé
Allumé, allumé, allumé
À bout portant on m'a allumé
Je n'pense pas à m'éteindre mais à réduire le feu
Dans mon cerveau j'suis trop allumé
J'vais redescendre sur Terre tout en pensant aux cieux
Dans mon cerveau j'suis trop allumé

[Couplet 1 : Jok'Air]
L'système, l'État nous escroquent
Voilà c'qui pousse petite soeur à faire escort
Petit-frère lui importe et exporte toutes sortes de choses
On rêve d'autres choses, c'est dur mais faut qu'on s'en sorte
Bonheur s'trouve derrière cette porte
Et moi j'ai pas les clefs, les miens sont paniqués
J'avance bouteille d'essence, un pochon blanc et un briquet
Comme Johnny Halliday, le feu j'vais allumer, allumer

[Refrain : Barack Adama]
Allumé, allumé, allumé
Dans mon cerveau j'suis trop allumé
Allumé, allumé, allumé
À bout portant on m'a allumé
Je n'pense pas à m'éteindre mais à réduire le feu
Dans mon cerveau j'suis trop allumé
J'vais redescendre sur Terre tout en pensant aux cieux
Dans mon cerveau j'suis trop allumé
You might also like[Couplet 2 : Hache-P]
On est tous allumés
Toujours posés dans l'block avec nos bouteilles et nos calumets
Pourtant j'ai pris le relais
J'dois ramener les sous à la maison car Maman est fatiguée
Mais toi t'as pas idée
Tout l'mal qu'on serait prêts à faire à autrui pour de simples billets
Triste réalité
On a grandi dans la de-mer, dis-moi comment la quitter

[Couplet 3 : Dehmo]
J'ai voulu que des frères mais j'ai eu trop d'potes
On apprend d'ses erreurs, nous on a touché l'pactole
Regarder l'entourage péter un plomb à force d'allumer trop d'cônes
Disons qu'le ssite-gro déconne
On apprécie la paix quand on est dans la violence
En nous s'installe la haine quand on est en manque d'argent
Toute ma vie j'ai vu maman prier Dieu comme si elle parlait dans l'vent
Toujours Joh, Pims autour de moi et j'te garantis qu'c'est d'jà pas mal

[Refrain : Barack Adama]
Allumé, allumé, allumé
Dans mon cerveau j'suis trop allumé
Allumé, allumé, allumé
A bout portant on m'a allumé
Je n'pense pas à m'éteindre mais à réduire le feu
Dans mon cerveau j'suis trop allumé
J'vais redescendre sur terre tout en pensant aux cieux
Dans mon cerveau j'suis trop allumé
[Couplet 4 : Barack Adama]
J'ai l'impression qu'on est devenu dingue
C'est le cerveau d'nos parents qui maintenant trinque
À cette allure on a des chances d'être foutus
Le mode d'emploi d'nos vies, c'est devenu YouTube
Le manque de force, la haine depuis, nous caressent
Qu'est-ce que tu crois toi? C'est la hass, j'me détruis et on m'dit : ""Arrête""
""Arrête, arrête"" Putain, ils nous allègent pas
Obligé d'me justifier pour pas subir les messes basses
Nos cerveaux sont complètements retournés
J'pense à nos gosses et toutes les prochaines fournées
Je tourne autour, on tourne autour de moi-même
Et j'me dis...

[Refrain : Barack Adama]
Allumé, allumé, allumé
Dans mon cerveau j'suis trop allumé
Allumé, allumé, allumé
À bout portant on m'a allumé
Je n'pense pas à m'éteindre mais à réduire le feu
Dans mon cerveau j'suis trop allumé
J'vais redescendre sur terre tout en pensant aux cieux
Dans mon cerveau j'suis trop allumé

[Outro : Barack Adama]
Pour tous ceux qui sont du-per
Aux gens libres et ceux qui ont pris du ferme
Allumé, allumé, allumé, allumé
Yaye boy, Bava
La propagande a commencé
On s'dirige vers la Blackhouse
Bava
Adams au mic' pour les miens3Embed"
MZ,Attention,"13 ContributorsAttention Lyrics[Intro]
Attention, attention, attention
Attention, attention, attention
Attention, attention, attention
Attention, attention, attention

[Couplet 1 : Chich]
J'arrive comme les napolitains
Qui sont venus hagar tous les petits Africains
Trop classe pour demander du pain
Fais pas l'con, on est pas des 'ricains
J'ai baisé, baisé
Davidson Presents a.k.a. Diddy Diddy
En doggy, doggy
Tu vas enculer qui avec ton petit zizi ?
Les boules de Roland-Garros
Chich au microphone avec un gros gamos
Le prix des armes à la hausse
C'est pas grave, négro on t'arrose
Ta tchaga, tchaga qui vient me demander un verre de tchapa, tchapa-lo
J'ai l'pouvoir d'achat
Donc naturellement je fais le pacha, pacha, yo

[Couplet 2 : Hache-P]
J'arrive comme un Abidjanais
Machette à la main dans les rues d'Adjamé
Si on sort les trucs ces petites putes vont chialer
J'ai un éléphant sur le torse, vrai négro à jamais
Avec Chich, on est dans le bendo
Jack et Daniel se sont déjà faits descendre
Tous mes négros sont fonce-dé au bédo
On est fucked up de janvier à décembre
Du biff sur l'té-cô
C'est bon là, j'peux m'amuser, ramène des gos
C'est pas qu'j'suis flé-gon
Pas d'ma faute si j'vois des rappeurs en Lego
Ta meuf joue la bitch dans la tess'
Les tits-pe lui font ses fesses
En grande santé donc on est flex
Wesh tu connais l'adresse
You might also like[Refrain : Jok'Air]
Les meufs, je les aime bonnes et connes
Quand la beuh est sèche et quand le pilon colle
Quand la tête d'un ripoux se transforme en punching-ball
La voix du négro sort du block
Chaque jour que Dieu fait, j'suis dans la drogue et l'alcool
J'fais des mathématiques, ce n'est pas grâce à l'école
J'arrive en Big Daddy Jok'
Chich volume 2, c'est le nouvel album
J'arrive en Big Daddy Jok'
Chich volume 2, c'est le nouvel album
Tout le monde est Big Daddy
Supporté que par des Big Daddy
Même ma pute est Big Daddy
Moi-même j'suis Big Daddy

[Couplet 3 : Marlo]
J'arrive avec deux-trois putains
Les jaloux m'guettent car j'ai tout le butin
La flemme de mettre des coups de surin
Et paw, paw, paw, : deux-trois négros en moins
J'suis complètement flex
Un verre de Jack et elle présente sa schnek (pute)
J'ai mal à la tête
J'pose comme un dog pour pas connaître l'échec
J'débarque avec trop de style
A Chevaleret, c'est la terre hostile
Je fume de la Marlo Kush
On fait l'deux-deux quand ça voit les keufs
J'sais qu'tu m'envies
T'es une mauvaise personne mais j'te souhaite une longue vie
J'sais qu't'as du vice
T'es comme toutes ces petites connes qui méritent des coups d'gifles
[Couplet 4 : Dehmo]
Tiens, Gamin écoute
J'arrive comme ton beau-daron
J'baise ta mère et participe à ton éducation
C'est jamais moi qui ai commencé
J'suis toujours dans la finition
J'tire pas en l'air et j'tire pas à té-cô
Et quand j'm'emmerde, j'suis sous white widow
On s'en bat les couilles de toi et tes histoires palpitantes
Fous-les toi dans l'cul à en attraper un point d'té-cô
On est pas dans les ""oin, oin, oin, oin""
On bosse et on frappe plus que ton oin, oin, oin, oinj
J'préfère être perché et être loin, loin, loin, loin
Que courir après ton cul comme un coin, coin, coin, coin bitch
Comme Chich, j'ai pas dormi de la noche
Fuck ton trône en toc, j'vais m'poser sur une autre chaise
Même à 1 euro vos albums paraissent trop chers
Arrête avec tes ""meufs biens"" gros chien, grosse chienne (Bitch)

[Refrain : Jok'Air]
Les meufs, je les aime bonnes et connes
Quand la beuh est sèche et quand le pilon colle
Quand la tête d'un ripoux se transforme en punching-ball
La voix du négro sort du block
Chaque jour que Dieu fait, j'suis dans la drogue et l'alcool
J'fais des mathématiques, ce n'est pas grâce à l'école
J'arrive en Big Daddy Jok'
Chich volume 2, c'est le nouvel album
J'arrive en Big Daddy Jok'
Chich volume 2, c'est le nouvel album
Tout le monde est Big Daddy
Supporté que par des Big Daddy
Même ma pute est Big Daddy
Moi-même j'suis l'Big DaddyEmbed"
MZ,La cité des frères,"9 ContributorsLa cité des frères Lyrics[Intro : Hache-P]
Les kisdés sont à l'affût
Tiekson, ness-bi, rotte-ca ça s'fait mer-fu
Non, les kisdés sont à l'affût

[Refrain]
Les kisdés sont à l'affût
Tiekson, ness-bi, rotte-ca ça s'fait mer-fu
Des verres, des joints d'weed et mes négros n'ont pas d'wifi
Tiekson, ness-bi, rotte-ca ça s'fait mer-fu
(Pépère, au calme)

[Couplet 1 : Jok'Air]
J'suis posé dans l'block
Où la weed est trop bonne
Suis la fumée blanche qui sort de ma bouche
Négro, tu t'croirais à Kingston
Biatch suis le son de ma voix
Vas-y rentre dans la chambre
On va fumer, tiser, baiser toute la nuit bitch
Laisse tes sentiments devant la porte
Non négro j'ai tout essayé yeah yeah
Dans quelle merde j'ai pas chié ? yeah yeah yeah yeah
Mais la rue m'a charmé
Avant qu'j'me mette à chanter
J'espère qu'un jour ça va payer yeah yeah yeah yeah
J'ai le poids d'la mif' sur les épaules
Faut qu'je sorte Maman du ghetto, j'ai les crocs
Et j'ai pas d'plan B
Non négro j'ai tout essayé, yeah
Dans quelle merde j'ai pas chié ? yeah yeah yeah yeah
You might also like[Refrain]
Les kisdés sont à l'affût
Tiekson, ness-bi, rotte-ca ça s'fait mer-fu
Des verres, des joints d'weed et mes négros n'ont pas d'wifi
Tiekson, ness-bi, rotte-ca ça s'fait mer-fu
(Pépère, au calme)

[Couplet 2 : Hache-P]
C'est la course pour les lovés
Pas l'temps d'aller lover
On bauraude toute la nuit
On s'couche en voyant l'soleil se lever
On s'la pète comme ces tasses-pé
Si tu nous veux t'as qu'à casquer
Si t'as des plans fais des passes-dé
J'me lève à l'heure que j'veux
Parano j'dors chez ma tasse-pé du moment
Quand j'me dis que j'veux j'ves-qui les bleus
Imprévisible comme ce baqueux
On est arrivés et maintenant
Tu vas nous sentir comme un litron d'beuh
J'roule en Smart automatique
J'suis fonce-dé dans ma conduite
Ou au quartier avec les flics
Les bolosses et les indics
[Refrain]
Les kisdés sont à l'affût
Tiekson, ness-bi, rotte-ca ça s'fait mer-fu
Des verres, des joints d'weed et mes négros n'ont pas d'wifi
Tiekson, ness-bi, rotte-ca ça s'fait mer-fu
(Pépère, au calme)

[Couplet 3 : Dehmo]
Fallait qu'j'le dise
J'ai envie d'quitter la street
Pendant qu'toi tu forces avec cette bande de baltringues
Qui font les tueurs derrière toi
Ô Mimi, vas-y viens on s'finit
Viens on s'fait la guerre pour mieux s'faire l'amour
Peut-être que ce sera l'une des dernières fois
Et m'fait pas perdre mon time
Kalina m'attire plus que toutes les histoires de guns
Rappées par tous tes khatais
Tous les soirs hookah d'la guerre la beuh est bonne
Donc normal que je plane
Codéine dans l'sang
J'ai fumé, tisé, pas baisé
Alors où est ma wife ?
J'représente mes locos
Pas la vida loca
[Refrain]
Les kisdés sont à l'affût
Tiekson, ness-bi, rotte-ca ça s'fait mer-fu
Des verres, des joints d'weed et mes négros n'ont pas d'wifi
Tiekson, ness-bi, rotte-ca ça s'fait mer-fu
(Pépère, au calme)1Embed"
MZ,Fesses,"5 ContributorsFesses Lyrics[Refrain : Jok'Air]
On aime les fesses, fesses, fesses, fesses, fesses, fesses, fesses han
Fesses, fesses, fesses, fesses, fesses, fesses, fesses han
Fesses, fesses, fesses, fesses, fesses, fesses, fesses han
Fesses, fesses, fesses, fesses, fesses, fesses, fesses han
Dans son legging, dans son Levi's, dans sa jupe ou mini-short
Elle est chiante
Elle excite mes potes et les p'tis michtos l'escortent
Elle est chaude
J'lui ferai bien l'remake de la tape à Kardashian
Ce soir les Shakira des blocs s'transforment en J-Lo des Champs

[Couplet 2 : Hache-P]
J'aime trop tes fesses, fesses, fesses, fesses,  han
C'est bien beau mais faut qu'on baise, baise, baise, baise, baise han
Et les meufs trop skinny j'aime pas ça, j'trouve ça trop lèg'
Si t'as pas le boule à Nicki Minaj XXX, j'suis désolé ma belle on va t'tèj
J'sais pas moi, fais un truc pour me gonfler ce ul-c
Et j'veux aussi de jolies cuisses pour me remplir ce fut'
Et dis-le moi rect-di si tu t'sens incapable
J'suis désolé ma belle si mes vrais gars te calculent ap'
J'men bats les couilles d'ton âge
Mais tant qu'j'opère au kilo
S'te plait ne parle pas d'Paris Hilton, ça m'dit rien moi j'veux J-Lo
Les talons c'est d'la triche, celles qu'en portent comptent pour du beurre
Crois-moi que j'aurais pas le temps de chanter Black & Yellow devant le boule à Amber... Rose
You might also like[Refrain : Jok'Air]

[Couplet 2 : Jok'Air]
Comme tous les mecs j'aime les fesses, fesses, fesses han
Flasques ou bien fermes
Plus c'est balèse, plus ça m'fait de l'effet
J'aime les booty shake lorque le boule se baisse, baisse, baisse han
Puis se relève, rien qu'je peux dead pour mes Fatou Minaj
Rien à foutre que tu sois vilaine tant que t'as le boule qui faut, j'm'en fous
Pour pas voir ton visage, j'envisage la levrette pour te la foutre dans l'trou
J'me les cure avec vos gos toutes skinny
Parle moi d'chez Rocky, Kelly Star, [???] ou Pinky
Telles les pêches j'en ai tapé des mûres et des pas mûres
Si on te calcule pas c'est que t'es toute plate comme un mur
Comprends-moi, j'viens du bled du mapuka
XXX sur toutes les bobaraban, ne m'demande pas pourquoi
J'aime les grosses basses et les tailles basses
Amateur de big ass
Et les grosses liasses et les p'tites 'tasses
Munies d'un boule qui tabasse
Tous les soirs j'reve de Melancia dans ""Vai""
C'est l'une des seules qui m'aille et je le dit sans faille1Embed"
MZ,Aime cette musique,"10 ContributorsAime cette musique Lyrics[Couplet 1 : Jok'air]
Tu parles de comploter contre ma MZ Music
Ma paire de Nike te le dit, nigga : ""Just do it""
Si tu viens au contact de ma clique, c'est que t'es juste stupide
Tu pues la mouise, ton rap de merde nuit juste à mon ouïe
On n'est pas que des rappeurs et ça les vrais le savent
Et si on rappe c'est qu'on le fait bien, ça effraie tes shab
Ta tasse m'a connu dur, mais toi dis moi tu m'connais d'où ?
On n'a rien pris à César donc rendez-nous ce qui est à Mamadou
Tu peux faire du sroul, du vaudou, voir un marabout
Contrairement à vous, on lèche pas d'couilles donc on mourra debout
MZ Music le nom de ma clique hein
Ici y'a pas de suceurs, on croque les beats comme des pits hein
On peaufine notre réseau, le ghetto fait notre promo
Les dèks nous prennent en photo, MZ Click no homo
Jok'air, Hache-p, Dehmo, tu reconnais le pedigree
Je fais pas du rap français, je fais du rap de fils d'immigrés

[Refrain : Jok'Air] (x2)
MZ Music Mafia
On effrite, roule, fume ta click comme de la sensimillia
Ici, ça kill quand ça kick
Qu'ils viennent même à six milliards
Ou qu'ils restent mignons
Ca sent pas bon pour eux ici car il y a la...
You might also like[Pont]
MZ Music
(MZ MZ MZ MZ MZ)
MZ Music
(Music Music Music Music Music)

[Couplet 2 : Dehmo]
Le Bal des MCs, la relève des tocards
J'te jure quand tu les écoutes, leur compte en banque il carbure au crack
Sur 12 y'en a un qui parle bien, sur 12 y'en a un qui rappe bien
Sur 12, autrement dit, on va dire que y'en a 11 qui sucent bien
Laisse-nous faire, t'as pas à t'en faire, on a la main ferme
La chronique ça défraie, chacun son feu chacun son Enfer
Et je compte plaire comme le gros boule d'une tchaga
D'une main de fer, je vais te les gifler parle pas de garre-ba
Bériz ça gébou, ça s'étouffe vu que ça t'écoute
Je sais que les djao c'est pas nous
Ouais beaucoup de chattes s'épanouissent
Tout le monde est chaud, reste cool
T'en nique un, il en reste encore
T'oublies la pote-ca t'as fait le con, tire à blanc, la mort te cogne
Le rap c'est de la branlette, on voit la merde en Blu-Ray
Un truc de fils de pute comme voir son meilleur pote en bleu khey
Un renoi qui a chaud, c'est ça un visage pâle
J'ai pas racketté ton fils alors, sale pute, dévisage pas
[Refrain : Jok'Air] (x2)

[Couplet 3 : Hache-p]
Ah ouais, ouais, ouais
Je savais pas que dans le game il y avait autant de boloss
Trop de fils de pute se mettent à sucer des bites
Veulent nous barrer la route car pour eux on est trop dangerous
Oui, dangerous
Dans tous les cas dans peu de temps vont s'retrouver en string à 4 ttes-pa
Ils vont s'la prendre profonde dans ce game, les gavas, je crois qu'ils ne captent pas
On compte faire des gros dégâts
Ils peuvent pas dire qu'on dérange pas
On va pas se mentir le rap c'est de la compète, on s'mélange pas
Mz sic-Mu, crois-moi que certains vont chômer
On s'en bat les couilles, pas besoin de votre avis pour savoir qu'on est chants-mé
Vous allez sentir la tate-pa, nigga
Personne peut dire qu'on kick pas, nigga
Arrêtez de paniquer, c'est ris-Pa, nigga
On n'est pas dans le game, on joue pas, nigga
Hey, dis leur Dehmo, on sucera pas pour ter-mon
Si ça marche pas, j'continuerai à vendre de la daube ou j'irai taffer comme tout le monde
Mais bon on est les bests, trop lourds à la pesée
Les boycotteurs, niquez vos mères, allez tous vous faire baiser
Y a trop de rappeurs, on va les balayer
Je suis dans mon lire-dé, le reste, moi, je m'en bats les yeuks
[Refrain : Jok'Air] (x2)

[Outro]
MZ Music
(MZ MZ MZ MZ MZ)
MZ Music
(Music Music Music Music Music)Embed"
MZ,A ma place,"3 ContributorsA ma place Lyrics[Refrain- Jok'air]
J'peux mourir pour mes négros comme j'peux tuer pour mes négros
J'roule avec mes négros j'fais de la musique pour mes négros
J'guette les secondes, les minutes et les heures qui passent
Assis au fond de la classe, la Terre tourne mais je reste à ma place
J'reste à ma place pendant qu'le binôme arrive donc faites de la place
J'reste à ma place pendant qu'Jeci Jess arrive donc faites de la place
J'reste à ma place pendant qu'la MZ arrive donc faites de la place
Davidson Present, Davi-Davidson Present

[Pont-Jok'air]
Que Dieu nous protège de nos amis, on s'occupe de nos ennemis
Que Dieu nous protège de nos amis, on s'occupe de nos ennemis
Que Dieu nous protège de nos amis, on s'occupe de nos ennemis

[Couplet 1- Jok'air]
Aujourd'hui sera pareil qu'hier
Comme demain j'trouverais pas l'temps de faire mes prières
Pourtant j'ai rien à faire c'est les mêmes images qui sans cesse viennent, partent, reviennent
Toujours les mêmes scènes, la routine m'a comme emporté dans le courant de sa rivière
J'rentre à l'heure où maman part au taff
Un jour si Dieu veut j'pourrais lui dire n'compte plus sur les aides de la CAF
Viens on s'casse, fait tes bagages maman
Viens on déménage maintenant
Avant qu'la vraie vie m'rattrape et m'frappe en plein dans les dents
Rien j'cogite, prend les minutes, j'roule un joint d'shit
Ma tension chute, et le temps passe plus vite
J'baise que des putes, les relations sérieuses j'évite
Dans ma piaule seule la solitude a obtenu son permis de visite
L'amour m'esquive, m'évite
J'n'aime que moi et les mecs de ma clique avec qui je fais de la musique, du ness-bi, avec qui j'ai traîné dans la street
Si j'atteinds pas les sommets tu peux être sûr que j'essaierai
Comme R.O.C.H j'descends un flash et j'repense à toutes les tass' que j'ai serré
You might also like[Refrain- Jok'air]
J'peux mourir pour mes négros comme j'peux tuer pour mes négros
J'roule avec mes négros j'fais de la musique pour mes négros
J'guette les secondes, les minutes et les heures qui passent
Assis au fond de la classe, la Terre tourne mais je reste à ma place
J'reste à ma place pendant qu'le binôme arrive donc faites de la place
J'reste à ma place pendant qu'Jeci Jess arrive donc faites de la place
J'reste à ma place pendant qu'la MZ arrive donc faites de la place
Davidson Present, Davi-Davidson Present

[Pont-Jok'air]
Que Dieu nous protège de nos amis, on s'occupe de nos ennemis
Que Dieu nous protège de nos amis, on s'occupe de nos ennemis
Que Dieu nous protège de nos amis, on s'occupe de nos ennemis

[Couplet 2- Loka]
Encore un réveil à la bourre
Ce week-end tous bourrés
Et j'repense à mon parcours blindé car après un ballon rond j'courais
Les jours défilent et se ressemblent, demande à Jok'
Petit on était toujours ensemble, du gazon ou une graine de star [?]
Le blé divise, on sait qu'faire des sous
Des mauvaises ondes  diffusent
Gava, tu parts le temps, contraint s'cacher, car les balles dans le dos fusent
Pour [?] le flouz
Quitte à faire des guet-guets, aux mecs honnêtes
Ça s'était avant, maintenant on est beaucoup plus fière de c'qu'on est
Souvent sonné, par les coups du daron [?]
Car j'ai trop décollé, les G.A.V [?]
Mais y'avait pas que ça, les rêves du Barça
[?]
Pour lui je niaks, je baise à tout va
Respecte [?], Camer ça passe pas
Souvent comparé, à un mec carré, barré, qui est prêt à se barrer
Sache que c'est des tarés
Mais ça y est mon cerveau est taillé, j'suis prêt, au sage-pa calé
Souvent contre les lois
La juge m'a dit ""Barres toi et tiens toi à carreau""
A cause de ce que l'on mélange au garo
A la barre devant la daronne, égaré
[Refrain- Jok'air]
J'peux mourir pour mes négros comme j'peux tuer pour mes négros
J'roule avec mes négros j'fais de la musique pour mes négros
J'guette les secondes, les minutes et les heures qui passent
Assis au fond de la classe, la Terre tourne mais je reste à ma place
J'reste à ma place pendant qu'le binôme arrive donc faites de la place
J'reste à ma place pendant qu'Jeci Jess arrive donc faites de la place
J'reste à ma place pendant qu'la MZ arrive donc faites de la place
Davidson Present, Davi-Davidson Present

[Pont-Jok'air]
Que Dieu nous protège de nos amis, on s'occupe de nos ennemis
Que Dieu nous protège de nos amis, on s'occupe de nos ennemis
Que Dieu nous protège de nos amis, on s'occupe de nos ennemisEmbed"
MZ,Bad Boyz,"3 ContributorsBad Boyz Lyrics[Couplet 1 : Jok'Air]
MZ Music est dans le bendo
J'fais mon cash sans fiche de paye j'paye pas les impôts
Viens m'voir on a d'la bonne dope
Si j'te bute j'passe de Pololo à John Doe
Comme Craig Mack j'suis un bad boy
Comme Diddy et Biggie j'suis un bad boy
J'aime les meufs qui manient les uzis autant qu'les zizis
Sois ma Lil' Kim j'serai ton bad boy
Numéro 13 de Paname à Chi-Town
J'contrôle la raquette sur l'terrain comme Noah
XXX
J'suis international j'vous en XXX
Ouais négro j'suis un bad boy
Comme Diddy et Biggie j'suis un bad boy
Mon taga vient du Maroc, ma tchaga vient du Maroc
Comme French Montana j'suis un bad boy

[Pont : Jok'Air]
Chaque soir elle m'attend patiemment sous les draps comme Pénélope
J'traîne avec mes potes j'fais d'la moula j'traîne dans mon block
Deux-trois balles dans mon glock, deux-trois joints j'suis fucked up
Cette pute est tombée love du négro parce que j'suis un...

[Refrain : Jok'Air]
Bad boy, bad boy, bad boy
Mes négros d'Black Ink sont des bad boy, bad boy, bad boy
MZ Clique sont des bad boy, bad boy, bad boy
Davidson Present KDB Zik, bad boy, bad boy, bad boy
You might also like[Couplet 2 : Dehmo]
Que peux-tu m'apprendre que je n'connais pas ?
Tous les soirs j'suis fucked up dans un sale état
J'me dis que toutes ces putes me méritent pas
Flé-gon comme un d'ces cons qui bosse pour l'État
J'suis plus fort que vous j'vous baise et puis y'a rien
Vrais négros qui enculent tous les frères aryens
Click click parle, click click blabla, paw on perd un terrien
J'ai grandi peu à peu avant d'savoir que les cons c'est les bleus
J'ai vendu trop d'de-mer avant d'savoir que l'mieux c'est la beuh
Cet acteur vient d'apprendre que les gentils sont souvent nerveux
Elle vient d'flipper cette frimeuse et c'est maintenant qu'elle joue pas ma queue

[Refrain : Jok'Air]

[Couplet 3 : Hache-P]
Nous c'est MZ Clique, fuck ta clique
Nous appelle pas si y'a pas de rlic
Wesh les rappeurs que j'écoutait XXX de laisser la place aux tits-pe ça y est, c'est bon, vous êtes finis
Aucune langue de pute mais certains d'mes gars font des cunis
Pour les frères enfermés qu'on a XXX
T'as baisé deux-trois meufs, tiré deux-trois XXX deux-trois grammes ça y'est tu crois qu't'as tout XXX
J'suis toujours dans le bloc avec les potes le voisinage en a assez
Bloc sur bloc on ne pense qu'à brasser
Les mauvais payeurs finissent par se faire tabasser
Les poulets en purée XXX
Converti pour Doumsi, Doomam's et Zézé
Une meuf discrète sur l'té-cô pour m'apaiser
Des barres ils voyent le buzz et me parlent de s'caser
Des ""je t'aime"" des ""je t'aime"" pour toutes les baiser
[Pont : Jok'Air]

[Refrain : Jok'Air]3Embed"
