Artist,Title,Lyrics
Faf Larage,La trilogie - Le jugement (Chapitre 3),"21 ContributorsLa trilogie - Le jugement (Chapitre 3) Lyrics[Diam's]
Accusé, levez-vous, Monsieur Socrate (bip) dit Mac Tyer
Né à Aubervilliers, le 23 avril 79
Votre casier judiciaire porte mention de deux condamnations
Vol à main armée et séquestration
Vous êtes renvoyé d'vant la Cour d'Assises
Pour tentative d’assassinat sur Monsieur Mac Kregor né à Saint-Denis
Lors de l’instruction vous avez nié les faits
Expliquez-vous aujourd’hui sur ce qui vous est reproché

[Mac Tyer]
Bon Madame la juge, j’ai rien d’autre à vous dire
Cette histoire me dépasse, faut m'croire
Ce soir-là, c’est pas moi qu'est mal agi, j’n’ai pas tiré
Faites une requête à l’I.G.S pour enquêter sur l O.P.J

[Diam's]
Monsieur, arrêtez d’induire en erreur les enquêteurs

[Faf Larage]
Olah, attendez

[Diam's]
Oui, des questions Monsieur le procureur ?

[Faf Larage]
Madame la présidente :
Allons nous laisser l’accusé remettre en question le travail fait par les inspecteurs ?
You might also like[Diam's]
Surtout pas, je demande le premier témoin de l’affaire
Donc faites entrer à la barre, Monsieur le commissaire

[Kazkami]
Il devait être 22h30 quand l’appel radio nous a signalé
Une agression à main armée au 80 rue de l’Impasse
On était pas très loin parce qu’on était sur c'gars depuis 9 mois déjà
Pour des trafics de stup' on attendait juste
Le flagrant délit, un truc croquant à se mettre sous la dent
On avaient rien d'sérieux Madame la présidente

[Diam's]
Très bien, procureur des questions ? Non, bon
Maître, c’est à vous, des questions ?

[Kery James]
Monsieur le commissaire, vos états de service sont impressionnants
Vous ne comptez plus les arrestations, seulement
Une affaire fait tâche dans votre dossier
Accusation de corruption que l’I.G.S fini par classer
6 mois à filer mon client ?
Vous l'dites vous-même aucun résultat, rien à se mettre sous la dent
Peut-être que comme mon client l’indique
Il a mis fin à ses anciennes activités illicites
[Kazkami]
Mais ça à rien à voir là, de quoi vous m'parlez ?
C’est mon procès qu’on traite ou quoi ? J’vois pas pourquoi on secoue mon passé
On est venus comme je vous l’ai dit moi et mon collègue
Après avoir enfoncé la porte et ce qui s’est passé est écrit dans mon rapport

[Diam's]
Eh Monsieur le commissaire veuillez garder votre calme, éviter tout écart
J’vous rappelle vous êtes à la barre
Faites entrer monsieur Mac Kregor, témoin dans cette affaire
C’est à vous, s'il vous plaît, veuillez être clair

[Mac Kregor]
Madame la présidente pour être franc, ça fait une heure que je suis assis dans le box
J’écoute les conneries de l’autre flicaillon qui veut me faire passer pour un tox
C'soir-là, j'me rappelle pas trop des faits, juste que c’était pas drôle
Et que c’est pas So' qui m’a tiré dessus pour notre accro'

[Faf Larage]
Quelle éloquence Monsieur Mac Kregor
Mais nous ne sommes pas au théâtre et à la barre faut être fiable
Et le prochain témoin n’accuse pas, il donne des faits

[Diam's]
Donc faites-le appeler pour qu'il puisse témoigner
[Lino]
C'putain d'quartier a plus d’âme, ils sont tous atteints, ça pue l'drame
J’suis pas c'trou du cul d'concierge planqué derrière un judas
Loin d’être vierge : mon casier porte le poids d'mes erreurs
Comme ce gosse écrasé, des pleurs, du sang sur son bermuda
J’ai payé ma dette, j'roule droit, la taule m’a rassasié
J’étais cool avec ma môme quand j’ai vu l’arme et sa tête
Un brasier dans ses yeux, j’imagine la suite
Ça pète dans tous les sens, ça sent la poudre, les substances illicites

[Kery James]
Et en parlant de substance, êtes-vous toujours alcoolique ?

[Lino]
Désolé, ma dernière cuite, c’était en 98
Cet enfoiré nous a frôlé moi et la p'tite, il pissait la rage

[Diam's]
Oh vous êtes dans un tribunal, surveillez votre langage
Un nouveau témoin devrait intervenir
A la barre s'il vous plaît, je demande : Bachir

[Tunisiano]
Écoutez, moi j’ai tout vu, j’ai tout entendu
Je vous dis tout, pas d’malentendu, ces keufs sont des ripoux
Au départ de l’histoire, j’étais chez Mac Kregor
Pépère, il était tard et d’un coup ça frappe fort
Mon pote s’agite, s’excite, hésite à aller voir
Puis me suggère de me glisser dans l’armoire
Elle entrouvert, lui a ouvert
Le man est insolent, violent et muni d'un revolver
Mon compère s’explique, essaye de le calmer
Mais très vite le jeune homme a commencé à s’emporter
Puis soudain la porte claque, les policiers débarquent
Un keuf braque, il a le trac, les nerfs craquent : un coup part
L’homme se tient la tête, regrette ce qu’il vient de faire
Mac Tyer reste de fer et mon pote est par terre

[Faf Larage]
Attendez, attendez, un coup part
Vous l’avez vu, vous l’avez entendu, et tout ça du placard ?

[Tunisiano]
Eh je l‘ai vu et entendu comme je vous vois
Comme j’ai vu ce policier prendre le brolique à Mac Tyer
Je l’ai vu et entendu parler à petite voix
Parler de balistique et comploter pendant des heures

(embrouille générale)

[Diam's]
Merci
Bon nous allons poursuivre et passer aux réquisitions
À la barre Monsieur le procureur, c’est à vous

[Faf Larage]
Mesdames et Messieurs les jurés nous avons là une affaire simple
Une histoire de ghetto de plus qui vire au drame
Et aujourd’hui à la barre, la routine s’installe, que dire de plus ?
Un soir il devient fou, il sort avec une arme
Et un témoin l’a vu, vous l’avez entendu
À n’en pas douter vous y avez cru, l’accusé a été reconnu
Le témoin était là avec son enfant
Lorsqu’il croisa l’accusé armé d un revolver menaçant
Criant de venger la victime, peu d'temps avant le crime
Devant un père et sa fille, peu d'temps avant le crime
Mais l’accusé ne s’arrête pas la
Le commissaire vous l’a dit sous serment, il a tiré
Avec sa rage mortelle, il a tiré
L’accusé avait fermement l’intention de tuer
Il est coupable Mesdames et Messieurs les jurés
Laisser cette bombe à retardement dans les rues serait insensé
Et ne vous laissez pas abuser
Les témoins de la défense sont tous du même quartier
Ils jouent à l’arme à feu, drogue et j’en passe
C’est pourquoi leurs récits ne sont pas digne de foi
Et n’oubliez pas l’accusé est multi récidiviste
Agressif, un délinquant qui joue avec la justice
Afin de savoir vos enfants en toute sécurité
Cet homme se doit d’être enfermé
Madame la présidente, je requière une peine
De 8 ans d’emprisonnement et laisse la parole à la défense

[Kery James]
Liberté, égalité, fraternité, Messieurs les jurés
Pourquoi personne n’y croit plus dans nos cités ?
L'égalité des chances : une utopie
Car on ne mène pas la même vie du 16ème à Saint-Denis
Il faut l’avouer n’accentuons pas les injustices
Au nom d'la fraternité, refusons d’être complice
De l’assassinat d’une liberté
Le tout c’est d’admettre qu’un homme peut changer
Notre société ignore-t-elle le pardon ?
Peut-on condamner sur de simples présomptions ?
Notre police n’est pas infaillible
Dans cette affaire il me parait clair qu’il y a de la bavure dans l’air
Alors qui va t’on condamner :
Le vrai coupable, ou ce noir au lourd passé ?
Le dernier témoin est formel
Le crime n’a pas de couleur ni d’origine, vous êtes informés

[Diam's]
Merci Maître, maintenant passons à l’accusé
Si celui-ci a quelque chose à ajouter
Sachez qu’après nous délibérerons
Monsieur Socrate (bip) nous vous écoutons

[Mac Tyer]
Faites preuve d’indulgence, le commissaire vous a menti
T'en a gros sur le cœur quand tu n'éduques pas ta fille
Madame la présidente, j’avais 16 ans quand j’ai morflé
Quand je surfais sur des vagues où des frères se sont noyés
J’ai la musique pour évacuer ma rage de vivre
C’est ma psychanalyse, celle qui m’analyse quand je vais mal
Mme la juge je suis juste un bon coupable
Un repris de justice au casier redoutable
Madame, les rafales n’accouchent que des cadavres
Aux dires du procureur, j'suis trop menaçant pour qu’on me relâche
J’suis innocent Messieurs les jurés, s'il vous plaît, soyez clément
À cause de mon lourd passif, vous oubliez que les hommes changent

(délibérations)

[Diam's]
Monsieur Socrate (bip), après délibération
Pour tentative de meurtre avec préméditation
Sur la personne de Monsieur Mac Kregor, tout a été prouvé
Vous êtes reconnu coupable à l’unanimité
La cour vous a condamné à la peine de 5 ans de prison ferme
Sachez que vous avez 10 jours pour faire appel

[Mac Tyer]
Mais, mais qu’est-ce tu m'racontes là ?
Mais putain, là j’étais en train de m’en sortir
Mais va te faire foutre, c’est quoi cette justice de merde ?
Mais, mais fais quelque chose le baveux là
Mais … mais qu’est-ce qu’il y a ?2Embed"
Faf Larage,Pas le temps,"10 ContributorsPas le temps Lyrics[Paroles de ""Pas le temps""]

[Intro]
À chaque choix on parie contre le sort
Pas l'choix faut y'aller
Dis-leur que j'ai pas l'temps
On fait des plans pour s'en sortir
J'ai pas l'temps
Mon esprit glisse ailleurs

[Couplet 1]
À chaque nuit qui nous poursuit l'ombre vient effleurer nos songes et
La lutte garde en éveil alors je fonce et
Mon ciel est ouvert et mes pieds trop enracinés
Ma route est longue et trop de carrefours me font hésiter
Mon temps imparti, mon esprit glisse ailleurs
Au gré du vent, mes chances en quête de récepteurs
Dans la poussière, un écho
Et qui pourrait y croire si c'n'est moi à travers mes barreaux

[Refrain]
J'ai pas le temps (J'ai pas le temps)
Mon esprit glisse ailleurs (Pas le choix faut y'aller)
J'ai pas le temps (J'ai pas le temps)
Pour le fuir (J'fais de mon mieux)
Le meilleur (On fait des plans pour s'en sortir)
You might also like[Couplet 2]
Écoute ! Aussi loin que la lumière semble s'éteindre
Seule une étincelle au fond de moi peut l'atteindre
Au bout si ma foi les gens ressent et les limites
Mon but devenir libre me dicte ma ligne de conduite
Les dés sont jetés, rien n'est joué
Même le sort retient son souffle piégé dans un sablier
J'ai décidé de ne pas être prisonnier
J'n'ai que ma vie à offrir si jamais j'échouais
Pas le choix faut y'aller
Même si dans mon horizon les visages semblent trop résignés
J'dois le faire, mon but sans bruit ni adieu
J'ai brisé mes peurs et pour ma peine dis-leur que...

[Refrain]
J'ai pas le temps (J'ai pas le temps)
Mon esprit glisse ailleurs (Pas le choix faut y'aller)
J'ai pas le temps (J'ai pas le temps)
Pour le fuir (J'fais de mon mieux)
Le meilleur (On fait des plans pour s'en sortir)

[Couplet 3]
Écoute (écoute, écoute)
Ouais, à chaque choix on parie contre le sort
Ouais, et si les jeux sont faits, y'aura pas de remords
Ho, laissez la roue tourner, j'apprends à vivre
Yeah, à être libre, rester lucide
Yeah, non ! Je n'ai rien à perdre
Fixe mes règles, dans mon univers
Ho, et à chaque bouffée d'air, quoi ?
J'opère, comme si c'était la dernière
Il n'y aura pas de rédemption à venir
La volonté la clé de la réussite
Si je dois exceller, tout donner, prendre c'que j'peux
Si le monde m'appartient restez pas au milieu
Et si le sort est contre moi c'est tant pis
On fait des plans pour s'en sortir
Écoute
Pas l'choix faut y'aller

[Refrain]
J'ai pas le temps (J'ai pas le temps)
Mon esprit glisse ailleurs (Pas le choix faut y'aller)
J'ai pas le temps (J'ai pas le temps)
Pour le fuir (J'fais de mon mieux)
Le meilleur (On fait des plans pour s'en sortir)Embed"
Faf Larage,Le retour du Shit Squad,"27 ContributorsLe retour du Shit Squad Lyrics[Intro]
Le Parc et le Panier roulent avec le Shit Squad
Don't Sleep roule avec le Shit Squad
Le 3e œil et la FF roulent avec le Shit Squad

[Le rat Luciano]
Donne du bang, hé !
Je tombe dans la guette sans zigzaguer
Aux aguets, débonze et bien gai
Je suis délégué du Shit Squad, amigo bingo
Si tu tiens jusqu'à la fin du gong
Nous sommes tous des James Bond
Du Shit sous les ongles
Skunk au gong, ça laisse KO
Comme un coup du fusil à pompe
Et direct, on va haut...
Rat-man né Batman ami de Boss One
Et marié à la Marie-Jeanne
Luciano, réalise ton vœu
Si tu veux, enfume-toi la vie, mon vieux
Un peu de Marseillaise, et tu perds les cheveux
Shit Squad, Tonton et ses neveux pour les nerveux
Bienvenue dans Haschich City morveux
J'échange mes sticks seulement contre une femme
Style Néfertiti
Fais fumer la FF, Tonton j'ai fini
You might also like[K.RHYME LE ROI]
T'as pris ton paquet et ta femme avec toi
Marijuana bien roulée que tu tiens entre tes doigts
Quoi, l'atmosphère s'enfume
Fume le Shit Squad et pas de frime sur ça
La boumba si ça te dit
Prends ce choco de maxi, comme si
Une armada de fumeurs de gandja se disputent le contrat
Eh, batty boy, tu veux rouler avec le Squad
Ce n'est pas un fan-club de Ease
Mais un putain de Shit Squad
Roulé entre deux feuilles de Rizla Croix
Original bad boy pour l'esquisse, fils
Pas de paix en soirée avec les DJ, fais tourner

[SAT]
Tu veux toucher nos phases, vas-y, mets le prix
Je t'assure, c'est de la bombe
Elle monte comme des bambous
Le S* !# Squad tient le bon bout
Toujours dans les bons coups
En tout cas, on s'adonne pas à la para
Ici-bas, on décompresse comme on peut
La THC nous conduit tout droit aux septièmes cieux
Yo, pète ton joint de canna, à l'écoute des canailles
Sat rime pour tout défoncer comme la bouddha Thaï
Fume dans un studio ou dans un coffee-shop
Ambiance Hip Hop, à voir les yeux de mes potes
Pour eux, je finis en freestyle
Je lâche un fonky style, la FF, tous M'Ghetta au shit
M'Ghetta au shit
""Allez goute-moi ça mon fils""
M'Ghetta au shit
""Parfume l'air comme la marijuana""
M'Ghetta au shit
""Allez goute-moi ça mon fils""
M'Ghetta au shit
""Parfume l'air comme la marijuana""
[Sentenza]
Si gandja il y a chez toi, gringo
Elle sautera au nom du Père du Fils et du Sentenza
""Amen""
Je serai sec si tu n'es pas chaud
Prépare un bon space-gaspacho
Pour tous les sales muchachos de ma clique
Le Squad, escouade rascale
Et Tonton Pedro, Pascal
Tu prendras bien un spatial
Verre de mescal un poquito
Débarque avec un kilo pour les mythos
Lâché, donne, ¡No te muevas, cabróncito!
In situ, bratou kakou chez vous, y'a plus de sous
Attention le ladre prépare un mauvais coup
Un larcin, un truc de merde, un encas
Nada, tu connais Sentenza
Qui donc fait péter la banca ?
[DON CHOA]
Quand je te chope, quand je te bloque
Voilà les troupes de choc
Le Shit Squad de retour pour un smoke-tour
Armé de stocks lourds
Plat de jour : space-cake, calumets
Mèches allumées, atmosphère embrumée
FF, fais fumer
A fond défoncé à la sensi
C'est ça qui m'incite
Don Choa, Hannibal Smith, agence du Shit
Arrivage de choix
Ici on est à Marseille, mon frère
Sortis tout droit du conteneur
Le produit qui te met à l'envers
Tu flaires les joints
Mieux que les chiens de la douane volante
Fumes des mixtures à base boulettes brûlantes
Herbes collantes
Production Tonton Pedro, le gros bonnet
Tu connais l'effet
Je roule avec le Shit Squad et ses doigts de fée, bébé

[FAF LARAGE]
Faf Larage, fils, ne fume pas
Pedro, n'en déplaise, fume les cigarettes, le tabac à sec
Et là je suis bien, mec
Mes potos fument pour moi
Circuit lindo thaï skunk cesse devant moi
Eh, connard, j'ai pas à te dire ce qu'il faut faire
Pour entrer dans la partie
Fils, tu m'as bien compris
Tu crois qu'il y a des vapeurs, représente l'odeur
Premiers symptômes qui font sur moi
Speed, des lors j'suis d'humeur
On pourrait croire que j'intègre le Squad
Quand je conte mes histoires de fêtes
Ici à la Stormbringa
Ce que je dis, fils, ça veut rien dire
Mais sous l'emprise du Shit...
Le Squad, c'est un hit

M'Ghetta au shit
""Drink a little pastis, smoke a lot of trees""
M'Ghetta au shit
""Oh la gravité a frappé""
M'Ghetta au shit
""Drink a little pastis, smoke a lot of trees""
M'Ghetta au shit
""Yeah, je suis défoncé
A coup de bambous""

[FREEMAN]
Au sud, y'a du nouveau, fils
Le Squad refait surface, noyé dans le masse
Avec ses potos du micro, des mégots, amigo
Des barreaux, il en faut pour subvenir à nos besoins
Du matin au soir, plein
On a cuvé comme du bon vin
Le bon khéné en fait vilain
Veut niquer notre business
Que la guine l'a perdu
Tu fuse, gus si on te frappe
Comme un guerrier Hashashin
Frappé après un joint, tu charase
Colle tes oreilles devant tes baffles
Tu rêves pas, gringo
L'examen, c'est devenu l'impasse
Sans cesse, représente notre emblème
L'herbe épaisse, femme du Rat
La princesse pour l'honneur des troupes rebelles
Pour la fumette et les belles f...

[MENZO]
Daddy Mamadi, sur le mic, ça c'est acquis
Fais tourner l'herbe cosmique
Pour que la famille mette la panique
Un bandeau-pro avec tous les machos chauds
Et c'est parti pour le show
FF, freestyle pour représenter avec un joint d'gandja
Tu ne peux pas lutter
Fumes, fumes, fumes avant que la vie ne te fume
Aujourd'hui j'assume avec le Shit Squad
Kif-Kif Production, association banguée
Pour des fins de soirées, très fatigué
J'envoie ziguer les télés
Pour tous les frères avec qui j'ai calciné des bambous
Du Secteur au Café Julien
Les neveux ne craignent plus rien
Accrochés sur la locale comme des morts de faim
Shonga m'attend demain, ouais

[JO POPO]
Tu reconnais la voix du Padre, sorti du trece
Sur le mic, usé par le pollen et la sensi
Toujours d'attaque avec le Shit Squad
Mec, reste sur tes gardes
En attendant lyricalement que l'on bombarde
Balance nos cocktails de ferié néné
Si tu cherches la khemia
Y'a que chez nous que tu pourras la trouver
J'fais pas de topo
Je suis plein de popo
Demandes à mes potes
C'est un 16 S mec que j'ai sous le capot
Je pose toujours à mes répèts sans oublier mon matos
Un stylo, un micro, mon chocos
Et vatos portos
C'est comme ça que j'aime bosser
Je suis pas du genre à caler ou taper des blocages
Et vas-y, cesses de ricaner
Ouais, mon big, Jo Popo représente pour le 3e oeil
Mc j't'effrite dans mon deux-feuilles

[Boss One]
Je regarde mes potes, drôlement débonze
Tous guidés par le hachich comme par erreur
Haza plein de mimiques, ils sont chics
Regarde-moi droit dans les yeux, khô
T'y arrives pas, quel minable, ce gros
Dis-moi, c'est du shit que tu fumes?
Ou des pilules que tu gobes ?
Combien de gosses en voulant se la jouer grands se sont perdus
Je te l'avais dit de rester dans la sensi
En soirée bad boy, pompe un joint
Reste cool comme ton pote, l'ami, Ali, allez ha !
Je ne fume pas
Mais préfère voir des gens down avec le Shit Squad
Qu'être à Toxland à la CameSquadra
A croire que c'est un championnat
Où c'est le plus bête qui l'emportera
Avant d'appuyer sur play, t'aurais dû faire un petit
A la santé du Squad, Jo Popo, Luciano, Pedro
Mon z'ami, c'est la vie
C'est la vie qui veut ça
N.I.K, N.I.K
M'Ghetta au shitEmbed"
Faf Larage,Marvel,"2 ContributorsMarcel Murat Lyrics[Intro]
En 2003, dans les faubourgs de Montmartre
Une histoire d'amour, une tragédie, un destin brisé
Ça aurait pu être le fabuleux destin d'Amélie Poulain
Mais c'n'est que le fabuleux désastre de la vie de Marcel Murat

[Couplet 1: Faf La Rage aka Marcel Murat]
Salut Gomez, c'est moi Marcel, ton plus grand fan
Et j't'écris de la part de mon cousin Stan
J'habite en province, c'est bien loin
Mais je suis tes actions, tes chansons, tes refrains
J'ai toujours voulu être flic, mais ils disent que j'louche
Et ils ont enrôlé une femme et Mouss Diouf
En attendant on s'amuse chez nous à la campagne, on a un château
C'est privé, on chasse la bécasse et le négro
On est des pros, et t'es mon modèle, mon héros
De toi j'ai peint un tableau, en uniforme, t'es trop beau
J'tai envoyé ça et des paupiettes
Et j'ai ma femme qui comprend pas la passion qu'j'ai pour toi, mec, elle s'inquiète
Mais bon, moi j'suis pas une fiotte
La dernière fois qu'elle a parlé sur toi
J'l'ai un quart d'heure au fond des chiottes
Avec mon gamin Alain on a bien ri
« Vas-y P'pa, plus de javel »
Ça c'est bien mon p'tit
Gomez je t'invite chez nous à un barbecue magistral
Réponds-moi vite
Marcel, ton plus grand fan
You might also like[Refrain]
Laissez-moi vous conter l'histoire
Du fabuleux désastre de Marcel Murat

[Couplet 2: Eben aka Gomez]
Salut Marcel, ici Gomez, comment vas-tu ?
J'réponds à ta lettre, et quand j'l'ai lu, j'étais sur l'cul
Au fait, y a du blé à s'faire dans les champs quand t'es connu
Et à La Poste, y a pas moyen d'détourner des RMI
J'ai reçu tes paupiettes : dégueulasses
J'm'inquiète pour ta femme, c'que t'apelles tes parties d'chasse
Tu sais franchement, ton tableau est ressemblant, ouais mais
L'uniforme allemand et la croix gammée un peu gênant
Lescaut, c'est qu'une série noire pour TF1
Le type de trucs qui te harcèle le cerveau
Un peu comme Fan de l'samedi matin
T'as d'la chance toi, j'ai toujours rêvé d'avoir un fils
Pour qu'il écoule mon vieux stock de cannabis
J'm'en fous d'là où tu vis
Garde ta campagne et tes vaches folles
L'odeur du fumier, c'est comme les chiottes, c'est jamais drôle
En plus tu louches, au royaume des borgnes, Jean-Marie est roi
Donc ne m'écris plus, Gomez, oublie-moi

[Refrain]
Laissez-moi vous conter l'histoire
Du fabuleux désastre de Marcel Murat
[Couplet 3:  Faf La Rage aka Marcel Murat]
Gomez, j'ai reçu ta lettre, et ça l'fait pas
J'ai frappé ma femme, mon fils, et ça l'fait toujours pas
J'comprend pas ton humour sur la campagne et le foin
Chez moi ça craint, j'ai pas d'amis
Si tu m'lâches, c'est la fin
J'peux pas t'oublier, j'comprends, t'as plein d'problèmes
À Paname, les HLM, les Arabes, le système
Dis-moi, les immigrés, j'en ai jamais vu en vrai
Est-ce qu'ils parlent comme nous ?
Est-ce qu'ils mangent comme nous ?
Tavarez, c'est un noir, alors il est pas comme nous ?
Et le nouveau Dubois, j'espère qu'il est blanc comme nous
Et désolé pour les paupiettes, t'avais raison pour les chiottes
Et pour punir ma femme, ouais y'a rien de mieux que les clopes
Aussi, j'tenvoie du foie gras, j'compte venir chez toi
Je serai pas gênant, j'sais qu't'as des problèmes
Réponds-moi

[Eben aka Gomez]
J'ai aucun problème, t'es qu'un pauvre mec fini
Un bouseux de seconde zone qui m'envoie du foie gras pourri
Un fan comme toi, non merci
Et si, Marcel, tu montes à Paris
Moi, j't'assure, c'est la bavure garantie
Tes propos sur les immigrés m'navrent
Oui Tavarez est fier d'être noir
Et Dubois n'est pas un Scandinave
T'es prévenu, y'a pas un bouseux qui fasse long feu
Gomez, un homme nerveux, et en plus, qui t'en veux
PS: La mort ou la prison
En d'autres termes, quatre murs, ou quatre planches
[Refrain]
Laissez-moi vous conter l'histoire
Du fabuleux désastre de Marcel Murat

[Couplet 4: Faf La Rage aka Marcel Murat]
Finalement, t'es pas celui que j'croyais
T'as drôlement changé depuis ta célébrité
Le rap, c'est pour les voyous, les dégénérés et je l'sais
Gomez, t'es qu'un drogué, Gomez, t'es qu'un PD
Tu feras jamais d'argent dans ma poche, mec, tu m'as déçu
Tes planches, ça veut dire quoi, la prison ?
Quoi ? C'est toi le corrompu
Vendu, j'suis dans ma voiture à toute allure
J'ai pris une biture, écrasé une vache, un renard et une vielle pute
J'arrive à Paris
Tu seras pas tranquille, moi en vie
En ville, tu bois aussi, j'te l'dis
J'étais ton plus grand fan, ton meilleur ami
On aurait pu chasser ensemble
Je t'aurai volontiers prêté mon fusil
Mais j'm'en fous, tu m'as trahi
Et j'enregistre cette cassette de la part de Marcel, mec, ton pire ennemi

[Refrain]
Laissez-moi vous conter l'histoire
Du fabuleux désastre de Marcel Murat

[Outro]
Est-ce que Monsieur Murat est arrivé à bon port
Pour retrouver son bien-aimé ?
Ça, c'est une autre histoire

Gomez, j'aurai ta peau!!!Embed"
