Artist,Title,Lyrics
Faf Larage,Danse dessus,"1 ContributorDanse dessus Lyrics[Intro]
Ouais, faut qu'ils pigent les mecs
Faut qu'ils pigent ça
Musique et danse dessus
Tu vois c’que j’veux dire
Chat (?) danse dessus
La rage mec, on danse dessus
D'où tu viens, quoi qu'tu fasses

[Refrain]
Car des gars et des meufs mec ils dansent dessus
Même si c’est la misère, ils dansent dessus
Les villes et leurs cités dansent dessus
Ceux qui veulent du bon son qui tue, mec ils dansent dessus
Dansent dessus, dansent dessus
Dansent dessus

[Couplet 1]
Ok, c’est risqué, c’est poser
De parler danse sur un rythme swingué
C’est exprès de rapper, lancer des rimes sensées
T’faire bouger sans regretter les faits
Le rap qui danse, j’revendique si ça m’plaît, qu’ça nique, j’oublie
J’emmerde les clowns que ça gêne quand je kiffe
Les dancefloors ne se sont pas vidés en 86
Comme on disait, Funky Fresh fils, lâche tout c’que t’as fils
Ma ligne directrice direct fils et reste peace
À la fin de mes phrases et c’est ça qui s’manifeste fils
Mais reste correct, le collectif rectifie on rec à l’actif
On scande des putain d’titres
Certains osent pas, comment leur en vouloir
Certains critiquent mec, qu’ils aillent se faire voir
Genre j’suis hip-hop, me la fais pas, tu bouges dans les autres boîtes
Et si tu boudes ça, allez rentre chez toi
Et lâche-moi
Car des gars et des meufs, mec, ils dansent dessus
You might also like[Refrain]
Car des gars et des meufs, mec, ils dansent dessus
Même si c’est la misère, ils dansent dessus
Les villes et leurs cités dansent dessus
Ceux qui veulent du bon son qui tue qui dansent dessus
Des gars et des meufs, mec, qui dansent dessus
Même si c’est la misère, ils dansent dessus
Les villes et leurs cités dansent dessus
Ceux qui veulent du bon son qui tue mec qui...

[Couplet 2]
Dansent dessus, bougent dessus, foncent dessus
Défoncent la piste de danse dessus, déconnent dessus
Si on t’traite de trou du cul, insulte
Si on insiste celui qui pète, balayette et tu lui saute dessus
J’entends des poufs Larage il rappe dessus
Mais casse-toi, quand tu feras des concerts, t’apprécieras d’voir un public qui bouge dessus
Marre des hypocrites hardcorisés
J’donne un ""peace"" aux breakers, ceux qui savent encore s’amuser
Eh mec il y a un temps pour tout
Faut s’libérer chaque fois qu’on peut dans c’monde qui nous pousse à devenir fou
Y a assez d’endroits où on rentre pas
T’façon en général c’est naze, mec il m’faut du vrai son pour ça

[Refrain]
Danse dessus
Même si c’est la misère, ils dansent dessus
Les villes et leurs cités dansent dessus
Ceux qui veulent du bon son qui tue mec ils dansent dessus
Des gars et des meufs, mec, qui dansent dessus
Même si c’est la misère, ils dansent dessus
Les villes et leurs cités dansent dessus
Ceux qui veulent du bon son qui tue mec ils dansent dessus
[Pont (Taïro, Jalane et Nuttea)]
Et partout
Sur le dancefloor
Ici c’est One Shot

[Couplet 3]
Eh les meufs, faut pas être timides
Les mecs, faut pas être stupides, c’est le mix qui file
Suffit qu’le DJ déchire
Des fausses drogues artificielles genre chimiques, on s’en cogne
C’est mon cœur et mon cerveau qui verront si j’déconne
C’est ainsi mec, j’veux parler des bouffons qui pètent
Comme si je rentrais dans l'steak
Faf, t’as pas besoin d’faire ça
Aucun d'ces blaireaux savent que j’peux faire ça
Tu parles de tunes, je parle hip-hop, faut qu’ils pigent ça
Akos fait la zik et ça m'va ha ha ha
One Shot ma clique sur c'coup-là ha ha ha
Tous dans l’même taxi rimes nasty, artistiquement ça claque mec
Articule si tu critiques
Ton cœur bout parce que tu sais qu’le crew kicke
Sans tminik, real shit façon speed
Genre rien à foutre, on kiffe mec, on

[Refrain]
Danse dessus
Des gars et des meufs, mec, qui dansent dessus
Même si c’est la misère, ils dansent dessus
Les villes et leurs cités dansent dessus
Ceux qui veulent du bon son qui tue qui dansent dessus
One Shot, danse dessus
Même si c’est la misère, ils dansent dessus
Les villes et leurs cités dansent dessus
Ceux qui veulent du bon son qui tue qui dansent dessus
[Outro: Vasquez]
Ouais, c'est ça Faf
On continue à faire d’la bonne musique mec
Dire des choses vraies
C’qu’on pense, et ça fera trembler les sphères
Et ceux qui comprennent pas
On leur (on dit quoi)
On leur
Danse dessus
On leur
... dessusEmbed"
Faf Larage,Dans le Marécage,"4 ContributorsDans le Marécage Lyrics[Intro - voix off]
Dans le Hip Hop, le cave est une espèce répandue
Dans son milieu naturel, avec ses amis, il survit
Mais égaré, il est soumis à la dure loi de la prédation
Dès lors que les troublantes créatures du marécage le guettent
Ses chances de s'en sortir... sont bien maigres

[Couplet 1 - Bambi Cruz]
Je débarque, t'embarque dans ma barque, sois rassuré
Desserre ton fion, viens dans mon bastion dans les marais
Arrête de te marrer comme un taré, tout est carré mes mains sont palmées
Des nageoires me poussent à force d'être flow au micro
Calcule pas d'où je viens
Si tu ne veux pas chavirer calme-toi et tiens-toi bien
On se déplace en silence
Pas de bruit, de nuisance
Des coups de pagaie dans l'eau, on avance avec aisance
Pense qu'un endroit, hors-loi, sans Etat
Existe, rempli de miss, de bons films et de pera
Derrière ce brouillard à couper au couteau, choqué tu le seras plus tôt
Le rêve aux abords de cet îlot secret
Pour les ordures qui ont la dalle, une salle de torture
Où des milliards de moustiques te piquent jusqu'à usure
Ta peau séchée, on l'attend pour faire des kayaks
Tes os craquent, ton crâne sert à boire le cognac
Avec nous, les alligators crèvent de faim
On aime s'occuper à couper, découper les vauriens
You might also like[Interlude - voix off]
Le cave voit tout à coup son avenir fort compromis
A la vue d'une flotte de kayaks morbides
Les battements de son coeur s'accélèrent
Il comprend le risque...

[Couplet 2 - Shurik'N Chang-Ti]
Je reste dans mon marécage, sage, en méditation
A la gachon, je guette l'inspiration dans un silence de plomb
Concentration maximum, pas de distraction ou l'abortion pointe à l'horizon
Mais ça croasse dans le buisson
C'est la période nuptiale, les MC cherchent des micros
Mais pas vous, les chours, pas de reproduction pour les crapauds
De toute façon, ils sont là, à moi, rien que pour moi
Maître céans, décrête que l'endroit n'est pas fait pour toi
Trouve-toi un banjo, owo mets-toi au blues bayou
Kikou, entre nous, arrête de faire le voyou
Sois pas grippe-sou, un harmonica, ça vaut trois sous
Le Monstre des Marais coule les vases dans la vase
Aux caïmans les gueux, et compte pas sur Flipper pour te sauver
Voilà le message : je t'enverrai dans les cages de Faf La Rage
Si tu traînes dans mon marécage

[Interlude - voix off]
A ce moment-là, le cave est tiré sous l'eau
Sa seule chance ? La mythomanie
Mais ses vêtements sentent trop le neuf
Ils sentent trop la mauvaise video...
[Couplet 3 - Akhenaton]
Bienvenue dans le marécage où pas mal de MC jadis coulèrent
Car de là, mes potes bombardent des bons beats sur Studer
En place comme Nanard, de bon matin on y chasse du canard
Vire des brêles presto à coups de panard
Rembarque tes potes les bronques, tu fais le fous là
Ici on fume la buddha, pas importée du plat pays du gouda
Paye-toi un savon de Marseille, tu fais crépiter Geiger
Mon équipe sort des geysers
Des jets de mots, des jets de plume, des jets de pensée
Tu penses bien que si l'INSEE recensait les MC tu serais pas relancé
Romancé, je conterai ta fin avec l'accent, c'est le lycée
Sur cahier de texte, t'y es trop absent, le CPE Chill sans figure t'exclut
T'y a plus de classe, efface ton nom de bouchiasse
Las de voir les caves gratter leur part de fromage
Viens, je traîne un type sous le marécage

[Interlude - voix off]
Le cave est en apnée
Il ne devrait pas sourire à la vue de l'animal
Sinistrement majestueux qui s'avance vers lui
Et qui lui tend la main
Serait-ce un geste amical ?

[Couplet 4 - Faf La Rage]
T'as vu ? Autrefois, enfant, tu lisais les comics et
Appréciais la créature du marais
Balivernes !
Ferme les yeux, te fais pas prier
Je m'en vais, te faire visiter mes quartiers en vrai
Le Duc de la scène Hip Hop de Marseille s'est posé là
J'ai conquis, détruit, construit un palais et y ai mis
Des cachots pleins d'emcees maudits
On y torture et fouette les poufs qui pètent
Il y a même des spectres casqués, masqués, pour le surveiller
Des fois j'organise un tournoi de sélection mesquin
Prends le gagnant, et faux ! Il en reste encore un
Sors Stormbringer pour la bataille et là il réalise
Qu'il aurait bien mieux fait de perdre, fils
Le Marécage à l'image de Faf La Rage :
Cash avec les braves, pire avec les lâches
Fais le fou dehors mais si tu écoutes ce morceau, poto
Si tu es faux, souviens-toi du Duc, de son château du chaos, des cachots pour les blaireaux
Dans le Marécage
[Interlude - voix off]
Il arrive très rarement qu'un cave naïf s'échappe en rampant dans la vase
Blotti dans les roseaux, il cherche une porte vers la liberté

[Couplet 5 - Freeman]
L'espoir fait vivre, garçon
Dans mon bastion, tends ton oreille pour comprendre Freeman, fils du soleil
Sans oseille, je donne mes rimes, c'est [?], avec la rage quand je sors du marécage
Fils, à ce qui paraît, tu check tes pages
Fais gaffe à ton ménage, dans les deux cas c'est moi le veinard
Un fêtard de pétards pour fêter ma victoire
23 grillés combattant dans le noir
Buvard des textes [?]
Faux je peux encore me voir dans un miroir chaque matin
Face aux têtards qui pètent
Sept rimes suffisent pour provoquer l'invasion des sales mouettes
Dehors, dedans, c'est pareil, mon équipe veille, structurée
Rien n'est fait au hasard dans ce bazar, le marais
Le manimal doit s'affirmer
Poser la griffe, donner des gifles sur chaque son
Kill [?] pour les bêtes disciplinées
Cave, eh, garde la foi, où que tu sois
Dis-toi bien qu'on est là à guetter

[Outro - voix off]
Guetté, une fois rattrapé, le cave est fini
Le Marécage est vivement déconseillé, yoEmbed"
Faf Larage,Dans le viseur,"3 ContributorsDans le viseur Lyrics[Couplet 1 : Shurik'n]
Tous les jours tu te lèves et c'est reparti
Chaque fois la même course le même circuit
Chaque jour le même guichet la même file
Et chaque fois la même phrase ""faudra rev'nir""
Tous les jours le même sitcom à la télé
Des politiques gravement atteints de cécité
Et tous les jours le même scénar' à peine modifié
Celui qui t'rappelle qu'à la fin c'est toi qui va chialer
Et tous les jours le même spectacle aux infos
Guerres sanglantes, confusions et hausses des impôts
Tous les jours le même loup dans ton rétro
Parce que la vie y'a bien longtemps qu'elle ne fait plus de cadeau
Et tous les jours les même craintes et les même souhaits
Trouver des sous et tenir le coup jusqu'au jour d'après
Tous les jours les même crèvent et les même piqués
Les même polices les même tasers toujours les même gazés
Et tous les jours tu chutes et on te dit que tout va bien
On te fait voir qu'y'a pire qu'ailleurs pour que tu te sentes bien
Tous les jours la misère du monde est servie aux repas
Ton frigo vide c'est sur pendant c'temps là tu penses pas
Tous les jours les même regards les même soupçons
Les même idées à la con les même fantômes à l'horizon
Tous les jours y'a un poids de plus dans ton sac à dos
Et pas l'temps de l'arrêt sur une aire de repos
[Refrain](x2)
Pour payer leurs conneries t'es dans le viseur
Besoin de consommateurs t'es aussi dans le viseur
Le bouc émissaire le parfait coupable dans le viseur
Taffer plus pour gagner moins t'es encore dans le viseur

[Couplet 2 : Faf Larage]
Derrière la fenêtre tu regardes dehors
Appréhende quand tu sors pour affronter la mort
Les temps sont hard et la chance qui s'fait la malle
Tiser tout l'week-end amorti le mal
Le cash flotte au bout des bronzes sur des Yacht homie
Des biatchs en Gucci sur Youtube elles font même plus envie
Tu te maintiens dans la course par automatisme
Ce maudit chien qui vient et pisse sur le tapis
La pub te séduit la télé te l'dit
Un PV pour la nuit un CV pour l'ennui
L'hypnose est telle que leurs lois passent haut la main fils
Tes pokémons s'en branlent du lendemain fils
Un funambule entre deux fossés riche et pauvre tu trembles tu risques fort de finir dans le trou des ombres
Alors la majorité sur le fil voudrait
Sort de la routine et la famille peut se briser
Faut assumer le danger, être refait à la régulière sans coup de pouce tous les jours le genoux à terre
Tous les mois les compteurs à zéro, figer la progression trop minime à l'heure où les verrous doivent sauter
Dites aux kids que les comptes de fée sont killés
La survie parasite en paradis oublié
Khouya la mécanique est rouillée les héros de déçus sont blasés tous les jours fauchés par un train de vie au pied des sommets
[Refrain](x2)
Pour payer leurs conneries t'es dans le viseur
Besoin de consommateurs t'es aussi dans le viseur
Le bouc émissaire le parfait coupable dans le viseur
Taffer plus pour gagner moins t'es encore dans le viseurYou might also likeEmbed"
Faf Larage,Dans l’lard,"4 ContributorsDans l’lard LyricsDes thèmes trop durs pour l'esprit trop pur, c'est ça dans le lard
Un son qui frappe et laisse des blessures, c'est ça dans le lard

[Couplet 1 : Shurik'n]
Ça pouvait pas se passer sans nous, fallait qu'ils voient de quoi on est capables
Si fait entend ce rap sans palabre, sifflet comme sirène en temps de guerre
Si t'es prêt je le suis aussi autant pas se faire attendre
Tant de tympans se tendent autant se faire entendre et tendre
L'atmosphère, j'écris sur les nerfs quand le calme a la vie dure
Du coup les mains parlent ou tombent comme trop de volonté par balle clouée au mur
Un flux de pensée cure un flot de maux, un sombre flow pour une guerre
Sans couteaux, censée tirer vers le haut mais en haut
On me prête pas une oreille j'insiste et ça me tiens en éveil le sommeil
Facilite l'hypnose et sclérose à haute dose et le réveil
À la carte vermeil servira à rien ici y'a pas de Saints
Pour mon art c'est dans le lard que je taille mon chemin

Refrain (x2) :
Hey rho fous le son à fond dans la stéréo
C'est La Garde au micro et tu sais que c'est chaud
Quand ça rentre dans l'lard c'est parce qu'il le faut
Si le son est brut frérot

[Couplet 2 : Faf larage]
Analyse les nuances un flow qui se danse c'est insensé
Ni prudence ni style vont te sauver
Danse dessus, c'est ce que je préconise, fils c'est ma shit
C'est ma putain de vie Hip Hop ma devise
Et je rends hommage à ceux qui ont tenu le coup mec on sait qu'c'est
Pas toujours évident de percer, les dents acérées
Rho, DJ joue les bons titres que je kiffe
Ça a changé mon avenir aujourd'hui je mack
Comme un pimp de 7O ""Funky"" comme Biz
J'ai la rage dans le mic swing les assonances dans la partie
Avec speed l'ego trippin' j'ai trop de victimes
Fait effet caféine sur le public, c'est l'Enc
Et son son de dingue select, next c'est la guerre
Dans l'lard mes textes ma tête finit la fête mec
You might also likeRefrain
Hey rho fous le son à fond dans la stéréo
C'est La Garde au micro et tu sais que c'est chaud
Quand ça rentre dans l'lard c'est parce qu'il le faut
Si le son est brut frérot

[Couplet 3 : Shurik'n]
La Garde un toast porté à ceux qui l'on cru les bougres
Gesticulent entre les dents du temps qui a toujours les crocs
Diseur d'images sombres j’œuvre dans l'ombre telle une goutte d'eau
Sous des trombes d'encre j'inonde irrigue je remue ceux qui jettent leur ancre
Jusqu'au cou mais conscient même battu jusqu'au sang je tiens le coup
Mais bon sang dur de rester debout jusqu'au bout
Dans l'lard fils c'est comme ça qu'on fait sinon ils t'entendent pas
Ils te voient pas ils savent pas qui t'es faut que ça change ça

[Couplet 4 : Faf larage]
Ça, ça fait une paye qu'on représente et ça change quoi ?
Tout quand les potos dans les concerts Jump Jump sur ça
Foxafile quand chaque fois je rempile
""Te biles pas"" On se lasse pas Shurik'N Faf Larage
Dans l'lard c'est La Garde on meurt mais on se rend pas
Trop haut le niveau pour les MCs je kiffe pas
C'est ça dans l'lard, déblaye le terrain pour les braves
""Des lyrics qui taillent"" C'est ça dans l'lard !Embed"
Faf Larage,Délires en vrac,"2 ContributorsDélires en vrac Lyrics[Couplet 1]
OK mec c'est quoi tes ambitions? On s'en cogne!
Avoir du fric pour le dépenser chez ceux qui te contrôlent
On est des bœufs cherche pas
On peut pas refaire le monde
""C'est pas notre destinée"", on n'est pas fait pour ça
Alors c'est quoi?
Payer des factures, galérer dans la rue
Se prendre la tête sur nos sorts, c'qu'on endure
J'ai pas les couilles de m'investir si au bout y a pas de profit
68 c'est fini, 9-8 ce qui prime...
L'économie, l'ère des comptes en banque arrive
On te l'intègre chaque jour dans ta tête fils
Tu marches ou tu crèves, 9-9 des courbes exponentielles
Pour commenter la merde et les séquelles
C'est toujours les mêmes qui raquent
Toujours les mêmes qui crachent
Toujours les mêmes qui font en sorte que tu restes en bas
Des fois on sort la tête de l'eau et tant mieux
Moi j'ai ma musique, si on m'l'enlève je suis une merde sérieux
Mais l'flouze revient au même endroit, fils t'as rien à toi
Regarde ta vie faite de crédits et de prêts si t'as d'la chance
On croit s'en être sorti
Tellement que les mecs qui font la manche on les dégage avec le sourire
C'est pas qu'on les hait mais c'est trop proche de c'qu'on peut devenir
Ça rassure de voir qu'y a pire, alors vaut mieux en rire
J'aurais aimé être un leader, illusions
Les vrais leaders ils s'font tous buter à la fin, fils c'est pas bon
Toute façon j'ai envie de suivre personne, mais
Si j'me bats aujourd'hui, c'est clair c'est pas moi qui vais en profiter
La vie c'est le vier, j'essaie de m'raccrocher à quelques principes
Style ""vieux jeu"" sans m'faire bouffer
Trop cool? On t'bouffe!
Trop con? On t'bouffe!
Trop gentil? Trop fier? On t'bouffe! Alors...
You might also like[Refrain]
Délires en vrac
Délires en vrac
Délires...
Délires en vrac

[Couplet 2]
""Peace & Love"" on en rigole, c'est dire s'ils nous ont eus
J'suis pas fou, je veux ma part de rêve, on m'donne du fil à retordre
Casse tout, fout l'souk, et pour qu'on s'intéresse à nous
On braque le type du dessous
C'est pas la solution, mais on s'en fout pauv' con
Pas vu pas pris
Pour survivre faut des fonds
Y a des gens pas nets, des gens honnêtes
Des gens même qui s'prennent la tête, des gens bêtes
Et faut faire avec
Y a des gosses qui tirent pour le délire, c'est chaud
En taule ils s'rendent compte que c'est pas rigolo
Et c'est pas rigolo, non c'est pas rigolo
Quand quelqu'un se prend une balle ça n'a rien de réglo
Symptômes de la misère? Mal de vivre?
On n'est pas en guerre, si, mais faut pas s'tromper de cible
Si on s'livre, si on abandonne ils auront gagné
Mais qui? Ceux qui tiennent les rênes que tu vois jamais
On nous laisse croire que le remède c'est l'boulot
Mais la plupart des chômeurs jouent tous au Loto, vrai ou faux?
C'est n'importe quoi
Mais quand on voit les projets foireux de l'Etat
Putain du fric y en a
Y a pas d'fauteuil pour deux
T'façon j'ai pas envie de partager l'mien avec un bourge fier et péteux
Hors jeu, pas question de vendre mon cul pour être accepté
Pas question y a trop de cons qui l'font et c'est
Normal quand tu l'ouvres on te noie
À cause de cela y a plus personne qui se bat
Le sexe, un des rares moments
Où tu déconnectes vraiment
C'est simplement humain et encore j'reste sceptique
Y a trop d'maniaques, trop d'pourris
Trop de merdes qui viennent te gâcher ça aussi
On devient méfiant, égoïste, individualiste
Tout est programmé fils
C'est comme ça qu'ils nous fixent
Pose la question, le bout d'tout ça c'est pas net
Est-ce qu'on est là pour engraisser 5% d'la planète?
Tout le monde veut sa part du gâteau, à part tes scrupules
Ton âme, qu'est ce que t'as à perdre poto?
À quoi bon philosopher, y en a qui prévoient l'apocalypse
Je veux accomplir ma tâche avant le sinistre
[Refrain]Embed"
Faf Larage,Demande Pardon,"4 ContributorsDemande Pardon Lyrics[Refrain]
Dans ces chemins où on se perd, où beaucoup sont à la traîne
On en oublie l’essentiel sur cette Terre, demande pardon
Y a plus la place pour penser aux autres
Alors qui sera là pour les nôtres ?

[Couplet 1]
En 2007 les gens ont peur, les gens ont froid, en ont marre de la merde
Celle même que l'on continue à générer même
Si ça nous coûte, nous bouffe, y a plus de limites
On l'élève à un rang où revenir en arrière devient impossible
Le danger c'est l'homme et ses excès de conduite
J’en suis un alors ma conscience guide ma zik
Je demande pardon pour tout ce que j’ai fait de mauvais
Ce que j’ai pas fait quand il le fallait
Des notes non publiées et dans les cahiers de nos vies
Trop de ratures ont sévi, de larmes inassouvies
Je te connais pas, mais arrête, je sais qu'au fond de toi c'est pareil
Depuis l'enfance on apprend tous à vivre avec nos faiblesses
De l'autre côté du globe on se blesse
Nous on laisse, pardon pour ces gosses qui vivent le stress
La liberté au bout du canon, et pas question de sagesse
Au loin, le sang bout plus que de raison
Je te demande pardon sérieux pour les fois
Où devant mon écran je t'ai vu souffrir sans le son
Où dans la rue parmi les klaxons sans un rond
C'est nous qui devrions avoir honte pour de bon
You might also like[Refrain](x2)
Dans ces chemins où on se perd, où beaucoup sont à la traîne
On en oublie l’essentiel sur cette Terre, demande pardon
Y'a plus la place pour penser aux autres
Alors qui sera là pour les nôtres ?

[Couplet 2]
Il faut que tu nous excuses de n'être que des humains
Des machines paradoxales avec beaucoup de craintes
Je demande pardon pour nos cœurs de pierre
Quand la colère ronge le cerveau, prêt à faire mal, quitte à frôler l'Enfer
Quand les lames et les revolvers opèrent
Parce que dans la tête y a plus rien qui espère
Pour la misère de nos pères et nos mères
Dire si on les aime avant de quitter cette Terre
Pour les mauvais choix, les paroles en l'air
L'air de rien quand on méprise sans en avoir l'air
Tu le sais, j'ai pas le pouvoir de tout changer
Je fais pas la course au vote mais je suis en quête de vérité
Et pour ce que mon pays t'a fait, tu sais j'étais pas né
On en paye tous les conséquences, on va pas esquiver
Je te demande pardon pour leurs promesses
Pour leur commerce qu'ils t'infligent en mon nom
Ici on est trop occupés à se bouffer
Ils nous foutent dans la merde avec succès pour oublier
Pardon pour être là à regarder sans bouger, pire t'écraser pour exister
[Refrain](x2)
Dans ces chemins où on se perd, où beaucoup sont à la traîne
On en oublie l’essentiel sur cette Terre, demande pardon
Y'a plus la place pour penser aux autres
Alors qui sera là pour les nôtres ?Embed"
