Artist,Title,Lyrics
Faf Larage,Je vole,"3 ContributorsFreestyles - Mouv’ Rap Club NRV Lyrics[Paroles de ""Freestyles - Mouv' Rap Club NRV"" ft. Cenza, Tonio le Vakeso & San-Nom]

[Couplet 1 : Deadi]
J'suis dans un trip qui lui-même est dans un délire bien à lui
Dans un délire bien à lui mais bien à lui d'chez bien à lui
Et rien qu'à lui mais rien qu'à lui d'chez rien qu'à lui
C'qu'est pas rien d'chez pas rien qui nuit qu'à lui-même et qui luit même quand vient la nuit
À chacun sa voie, sa voix ou sa façon d'voir l'avenir
Pour moi, ce sera soit l'cannabis thérapeutique, soit l'asile
On n'a rien à voir, j'vois pas c'qu'on pourrait avoir à s'dire
Mis à part ""à plus"" et n'plus jamais s'parler par la suite
Y aura jamais plus de types à part qu'y a d'parasites
Y aura toujours plus de fils de putes qu'y a d'sacs plastiques
Que ceux qui s'y mеttent dans l'espoir de la mеttre à la zik'
Aillent se faire empaler par j'sais pas qui qu'aurait v'là la bite

[Couplet 2 : Cenza]
J'retourne parmi les miens, je m'alimente
Un minimum au maniement du mic, me munis de mon art
J'ai voulu faire une secte, à moi d'me sacrifier
Voir mes gars friqués agripper le billet qu'on aura fabriqué
J'ai voulu... sur les p'tits du maire, t'es vert
L'uZine avec un ""Z""

[Couplet 2 : Tonio le Vakeso]
Pourquoi faire du bruit si j'peux t'abattre avec un silencieux ?
Même les criminels, avant d'tuer, se mettent à prier Dieu
J'pousse un coup d'gueule quand j'suis bourré : Gérard Depardieu
[?] Zé Pequ' dans La Cité d'Dieu
J'ai la rage d'un paysan qui vient défendre son territoire
L'Histoire, on la fera, mais ça sans faire la pute sur le trottoir
J'ai repris le calumet car la douleur est trop intense
J'fais partie d'la résistance, de ceux qui peuvent cramer la France
Moi, ma France est colorée, mais la plupart ont l'choléra
Après vous avoir dérobés, on partira tous comme des rats
La vie, la vraie, c'est pas la Terre ; la liberté, c'est faire la guerre
Révolutionnaire comme un Black Panther
You might also like[Couplet 3 : Cenza]
J'retourne parmi les miens, je m'alimente
Un minimum au maniement du mic, me munis de mon art
J'ai voulu faire une secte, à moi d'me sacrifier
Voir mes gars friqués agripper le billet qu'on aura fabriqué
Putain d'sa grand-mère, j'me rappelle plus d'mon xte-te
J'm'en bats les couilles, tu vas t'exciter, j'vais t'laisser terre-par'

[Couplet 4 : Deadi]
Non seulement t'es marrant quand tu bad et badant quand tu cries
Mais t'as la sale gueule de Rémy quand tu ris, tu m'fais kiffer
Mais genre kiffer à un point qui ferait flipper n'importe qui
Au point d'enchaîner au moins six syncopes de suite et les kiffer
À chacun ses interdits, à chacun ses vérités
Auxquelles on croit comme pas permis et qu'on s'interdit d'vérifier
On a viré les chapeaux melons pour garder les bottes de cuir
Et s'piétiner si bien qu'la loi du plus fou domine l'échiquier
J'ai ni les idées si claires ni clairement très envie qu'elles le soient
Mes nuits s'résument à mettre en rimes le peu qu'il reste de moi
J'dois être le moins équilibré des types qu'Eklips ait imité
Privé d'prestation publique depuis qu'le pays est grippé
Les enfileurs pro' reprochent aux enfilés d'enfiler des gilets
Mais le fait est qu'la majorité kifferait les retirer
(Wow, qu'-qu'-qu'-qu'-qu'est-ce qu'il s'passe ?)

[Couplet 5 : San-Nom]
C'est sans jouer qu'j'vais gagner la bataille
J'suis un assassin sensible, sans cible comme un sale bâtard
Tout est surfait, j'préfère aller en enfer qu'aller à Zara
T-shirt, survêt', sans chemise, sans pantalon, comme Rika Zaraï
Toute ma vie, ni Dieu ni maître, mort aux vaches et no pasarán
Mais m'appelle pas ""poto"" ni ""frérot"", encore moins ""camarade""
Pas d'résolution, la révolution, avant d'la faire dans la rue
Il faut la faire dans la tête, c'est ça, l'adage
Je trace ma route pas à pas avant que je n'me carapate
J'fais du rap qui séduira mais j'le fais pour oim à la base
Eh, je vis pas pour les Hommes, je brille pas sous les ordres
J'écoute Brel de ""L'Amour est mort"", drive-by en caravane
Le black Jacques Brel, le fils de Jacques Mes', Rabakar
Amara, Katana, Loko et Tige la Rafale
J'écoute Triple S, La vie de rêve, j'écoute Agartha
J'écoute Requiem, j'trouve pas l'sommeil, j'écoute [?]
J'écoute que Faf Larage, j'écoute le A-K-H
Et celui qu'ça embarrasse, eh beh j'm'en bats la race
Eh, trop d'rimes, quand j'm'applique, j'suis pas avare
Cœur de Godric, mentalité Salazar
[Couplet 6 : Tonio le Vakeso]
Les cailleras sont d'sortie, bandes de bâtards
Du jour au lendemain, j'veux peser comme le Qatar
Avec l'atmosphère, j'suis en décalage
J'me sens bien quand j'ai un gros joint d'be-her et le 'sky dans mon verre
Dieu et Lucifer sont proches de nous
Mais, si tu dois payer, mon pote, tu marcheras sur l'genou
J'te l'dis qu'une fois, j'ai qu'une parole, fils de [?]
Le Z [?] s'enfuit comme l'ovni

[Couplet 7 : Cenza]
J'pète le migidi-mic en migidi-Nike, les MC tombent en siguidi-strike
Laisse les braves esquiver la BAC ; éternue, j't'ai vu sniffer la trace
Kicker la basse, vider la tasse, un coup d'marteau, j'viens briser la glace
Piquer la place, on résout pas l'problème en voulant astiquer la crasse
Fuck, migidi-man, mes rimes s'écoulent par six milligrammes
Prépare l'plan Vigipirate, tu sens l'odeur du vinyle qui crame
Baiser l'État, les scélérats, c'est fêlé, gars, baissez les bras
Même leur matraque télescopique n'suffira pas à dresser les rats
J'ai mal à la tête alors, chérie, parle à la bête
Y a pas d'""tralala, check"", déguste bien la banane à sec
T'as voulu faire le narvalo, mais c'est mort, j'suis venu tout saloper
Tu vas galoper, si t'as mal aux pieds, va t'suicider, t'as plus qu'à sauter
J'm'en bats les, les, les couilles, flow sans limite, tu voudrais pomper sur moi ?
Préparez les douilles mais, me checker, ça fait plus mal que tomber sur l'bras
J'ai écrit c'texte à la va-vite pour que t'écoutes les autres
Mon rap te bouffe les côtes, tu fourres les mômes, les rappeurs schnouffent l'héro'
Suce mon chibidi-chibre, j'fume mon chiguidi-shit
Sors ma diguidi-dick, peu importe l'instru', ma couille, tu sais c'est qui les kick
Fais pas l'narvalo, à tiser tout seul, tu chies dans ton froc
Tu t'replies dans ton bloc, à la moindre crari, tu dis qu'c'est ton pote
J'fais pas d'guiliguili, file d'ici, t'es tout riquiqui
Anti schmilblick, mini, veni, vidi, veni, vidi, vici
On fait des roulés boulés pour écouler, pour désaouler
T'as vu des fous débouler, chouravez mes CD si vous les voulez
J'biguidi-pète le beat, diguidi-tête de bite, beaf de diguidi-steak de rimes
Tsiguidi, tsiguidi, tsiguidi, sexes de films
J'digui-dis que d'la merde, j'biguidi-pète le biguidi-beat
Diguidi-tête de diguidi-bite, ma rime casse les canines d'un biguidi-pit'
J'vois tous ces pédés qui niquent, rien n'vaut une femme, même pas technique
En minikini, ma mini mignonne dans un parc pour un pique-nique
Tu veux qu'je sorte le flow qui botte le dos, qui craque les côtes et les os ?
Écoutez les autres, je fuck les faux, t'es fou, il faut évacuer le fauve
Aaah, j'arrive même plus à m'arrêter, v'là la pétée
Tu veux rapper ? Tu vas galérer, t'es trop petit, parle à mes pieds
Va t'entraîner
Seul dans tes rêves, tous endettés
[Couplet 8 : Deadi]
(Hey, wow, qu'-qu'-qu'-qu'est-ce qu'il s'passe ? Grand, hey)
NarvaLooney Tunes au côté fou si sous-coté qu'ç'en est douteux
Et doté d'un côté si doux qu'ç'en est fou, le bouffe
Que Dali déboule chez Mouv' et tout s'écroule, écoutez c'couplet sous beuh
Conçu pour tous ceux à qui on a dit qu'c'était pas fait pour eux
J'sors d'où on t'oublie bien avant d'te retrouver tout bleu
Amateur de jus d'vache aux airs de sacré bouseux
Force rouge est tout près, fin prêt à tous les découper sous peu
Wow, qu'-qu'-qu'-qu'-qu'est-ce qu'il s'passe ?

[Couplet 9 : San-Nom]
Deadi m'a appelé pour un freestyle, j'ai dit : ""Pourquoi pas ?""
J'ai regardé sous l'placard qui m'servait d'tête
Si j'avais des textes, j'en avais mais qu'avec des thèmes
Et j'étais avec des potes, on faisait des fléchettes
Peut-être que, pour vous, c'est l'échec
Mais, moi, j'étais content, j'passais du bon temps devant des mecs amers
Le rap m'a p't-être pas permis de rendre fière ma mère
Mais, être payé à faire d'la merde, c'est grave le bon plan
Bon, écrire quand t'as pas d'idée, c'est pas pratique
Là, j'avais autant d'inspiration qu'un asthmatique
Hun, mais comme, l'ego, c'est l'avenir
J'allais faire comme tout l'monde : j'allais raconter ma vie
Donc, hier m'est arrivé un truc étrange
Ma mère m'a dit qu'elle m'appelait cinq minutes, ça en a duré trente
Hun, j'ai fait l'amour y a exactement douze heures
C'est quand même beaucoup mieux quand j'le fais pas tout seul
Cet été, j'ai découvert de nouvelles métropoles
En c'moment, j'regarde Prison Break, c'est éclaté au sol
Mais j'continue, ça mérite un bon prix
J'viens d'lire la définition d'""métropole"", j'ai rien compris
Ah, ces derniers temps, j'ai moins d'mal à assumer qu'j'aime l'anal
Que Yves Duteil et Serge Lama
J'suis toujours dans mes pensées
La meilleure façon qu'j'ai trouvée pour faire d'la maille, c'est d'la dépenser
Demain, j'ai rendez-vous chez Sony pour parler stratégie
Ça m'intéresse autant qu'le sport avec des gens tétraplégiques
J'tourne un clip la semaine prochaine, j'ai pas trop d'idées
J'espère qu'le réalisateur sait improviser

[Couplet 10 : Deadi]
Vos raps à deux balles ont le même parfum, m'font taper des barres comme une hyène qu'a faim
Aussi condamné qu'un John Caffey, Deadi déraille à la vitesse d'un train
Pas b'soin d'médecin, d'tes soins, j'détiens à la fois la maladie et l'vaccin
Mon fléau fait l'effet d'un verre d'absinthe que tu bois cul-sec et digères moyen
Tu pourrais finir invalide, à faire le malin face à celui qu'le Malin valide
Assassin linguistique, stick à la main, cannabis, file
Mon côté schlague a pas pris d'ride, mérite une prime à la rime
Une visite à l'asile, oui, j'ai déjà l'sourire du Joker plaqué sur la face à l'idée qu'ça arrive
Oui, j'milite pour l'euthanasie de ceux qui aiment pas la vie, paralysés ou pas
La matrice est tout-par', alors pourquoi la fuir ? On sait déjà tous où tout ça va ni-f'
Grand, hey, on sait déjà tous où tout ça va ni-f'
Wow, qu'-qu'-qu'-qu'-qu'est-ce qu'il s'passe ?

[Couplet 11 : Cenza]
Déboulé tout droit de L'uZine, hallucine, le signe est un fait tatoué dans mon cerveau
Sur le beat, j'ai le swing, mais ma ville a le crime, ma gueule, demande à Jean-Pierre Pernaut
Sens-tu l'urine en bas de tous les bâtiments ?
[?] aussi rapidement
C'est là qu'ils t'perquis', quand les dés-kis' se déguisent, narvalo, t'y vois qu'du feu
C'est des pro' du jeu, prends-le comme tu veux ou comme une salope au bout d'une queue
Ces bâtards m'engrainent, m'entraînent, m'emmènent, m'assimilent sous les mers
En-d'ssous des pierres du ter-ter, autour d'mes frères, mais c'est pas c'que j'voulais faire
Vous êtes ""verts de rage"", j'en ai pas vu un me l'montrer
J'ai les mains dans la malle, et le mal a la mouille [?] laisse tomber [?]
Tous ces pédés dans le rap qui croyaient penser savoir kicker
C'est niqué, j'allume les mille manies en un coup d'briquet
Je crame l'âme, avale la vitesse, [?] dans la vie d'tess'
Mais la rue t'laisse sur le pavé, l'ami, mais les mots n'enlèveront pas toute les larmes de ma tristesse
Saigne au-d'ssus des [?] les politiques, les élus viennent, règnent
Demande à [?] et à [?] si j'les ai pas vus courir devant l'comico
Tendez la poutre car le rap est à pendre, c'est attendre et attendre pour remonter la pente
Car le vide assassine, petit à petit, les gars, il est quasi l'heure
Ma gueule, ma gueule, ne cherche, pas mon équipe a la voie d'la guerre
[?], vole un imper', il pleut des sabres, on n'a rien à perdre, c'est clair

[Couplet 12 : Tonio le Vakeso]
J'suis un délire [?] go-fast, j'ai le sourire à Frank Lucas
Rap de bâtard, rap de bâtard, comme un coup d'schlass dans un thorax
Faites pas les cons, le rap, c'est du ski de fond, j'rappe en direct des bas-fonds
J'vais les gifler, ces bouffons, j'vais leur gicler sur le front, ça fait plaisir comme avoir un plavon
C'est pas fini comme l'amour d'un mort, je sors la nuit quand les oiseaux dorment
Je n'ai qu'une vie, tout pour la daronne, nous, c'est L'uZine, le Z, on charbonne
Je vais t'briser la colonne, boisson vodka de Pologne
J'ai des potos, des givrés, sur la photo, on te rogne, j'ai des potos, des ivrognes
Le shit est bon, c'est du népalais, on fait le mal parce qu'il le fallait
Gros, fais belek, j'ai pas d'cran d'arrêt, j'veux pas finir en maison d'arrêt
À grailler des pâtes, rêver de chattes, j'vois qu'mes pensées qui s'échappent
J'veux plus de roro que l'pape, je n'partirai pas comme Fabe

[Couplet 13 : Deadi]
Participer n'a plus aucune importance, tout peut s'arrêter n'importe quand, la vie, c'est pas du cinéma
Te dis jamais qu'y aura d'autres plans, j'gratte comme transplante et puis l'ppé-ra comme j'plante, et la prod' prend cher
Non seulement, j'en suis pas mais j'ai pas votre temps, j'suis d'ceux qui font ça comme personne et aussi comme [?]
Ouais, toujours profondément plongé dans mon délire à la Ghostland

[Couplet 14 : San-Nom]
Évidemment qu'Deadi va m'graille mais c'est pas grave, ça parle, nous deux ensembles c'est la bataille de Wagram
Comme des matraques que ça tape ou ça crame sur de la drill, de la cloud ou d'la trap
Z'ont toujours pas compris qu'c'était du 4x4 et que ça changeait rien, l'rap sans nous, c'est l'porno sans les nains
Essayer d'nous avoir, ça serait comme d'essayer d'applaudir ou s'branler sans les mains
Pas assez l'âge pour m'comporter comme un homme, mais bien trop pour avoir les boules
Pour la mort d'Jackie Chan, j'ai pleuré comme un môme ; pour la mort de Johnny, j'ai repris deux fois des moules
Ça rime à rien mais ça rime v'là bien, j'arrive comme Céline au dîner du CRIF
En espérant qu'il m'arrivera rien, pour ça, je touche du bois comme Jésus Christ
On fait ça facile, pour nous, ça équivaut à jouer à la belotte
Enfin, même plus encore, j'ai jamais su comment on jouait à la belette
Mais, si, un putain d'jour, de ma vie, j'fais la vedette
Tire-moi la joue comme la meuf d'Eraserhead
C'est pas fini, ça va être un festival, ça va si vite, comme une voiture de keuf qui crame
J'aime le p'tit bruit que font leurs jolies têtes qui craquent, comme celui d'un vinyle ou d'une paire de fesses qui claque
Harakiri, j'suis sûr [?] en équilibre, on verra c'que t'esquivera
J'suis [?] et t'es [?], j'suis enfer en Tacchini, wow, Deadi, j'ai aucune idée d'c'qu'il s'passe

[Couplet 15 : Deadi]
Plutôt rester à la traîne que d'me faire traiter d'tre-traî ou même de traîner du côté d'où j'traîne
Tout c'qui m'adoucit rend ma douce vert, depuis l'jour où j'ai rencontré la Gelato, j'ai la toux d'Serge
L'héritier d'un San-Nom écarlate et la bouche sèche, plutôt [?] que d'écouter c'que t'écoutes
T'as les coups d'blues de Bernie, j'ai ses coups d'pelle et mets des coups d'batte à tous ceux qui jouent les clowns, bref
Vous êtes tous mal, solvable ou pas, tout s'paye, tout s'mêle, rouges ou pas, on finira tous pâles et tous raides
Good bye, pit' ou pas, tout s'brade, plutôt y passer que d'passer pour l'best
Prions pour que mon côté bat les couilles tienne, quitte à passer pour un taré où qu'j'aille
Quitte à [?] tienne, quitte à c'que mon côté bat les couilles gagne

[Couplet 16 : Cenza]
Ils veulent parler de rap ou de trap, ils ne feraient même pas la différence entre les deux
J'prends n'importe quel beat et j'le râpe, je t'ouvre le point vital entre les yeux
Peu importe le flow, il me correspond, la trap n'a rien inventé, oh, t'es con
Obligé de leur rappeler d'où viennent là, faites pas, j'ai haussé l'ton
J'emprunte le flow de Cleveland pour démarrer ce texte en beauté
Tous les styles de rap ont déjà existé, c'est juste qu'ils étaient démodés
Peu importe le flow, il m'envahit, le rythme est le rite, je prends partie
Seule la mélodie me rend actif, j'ai pas, je l'ai dans l'calcif
Donne-moi du flow, j'vais leur montrer, ils commencent à m'énerver à raconter
Que de la merde, ils n'y connaissent rien, on l'sait, mais quelle bonté pour moi de les faire tomber
Aucune limite ne pourrait exister à mon égard, j'touche tous les extrêmes opposés sans faire le grand écart
Pour moi, chaque note jouée est une percussion, j'fais danser les breakeurs même sans faire du son
Tu prétends qu'le BPM définit le revers de ma veste, j'vais t'prouver l'contraire
Si l'rap était seulement celui qu'tu connais ""mama"" j'pourrais être son père
Me faites pas croire qu'le rap à l'ancienne était plus conscient qu'le rap d'aujourd'hui
J'vais t'rappeler c'qui marchait et c'que, toi, t'écoutais, oui, bien avant qu'tu commences à faire crari1Embed"
Faf Larage,J’oublie pas,"18 ContributorsMon répertoire Lyrics[Intro]
Diam's
Qui veut m'enseigner mon art ?
Va te renseigner moi j'ai tout vu et entendu
Du haut de mon arbre
Le rap c'est mon art
Tu finiras par l'remarquer

[Couplet unique]
J'veux pas mentir au peuple, lui dire que pour moi ça roule
Mentir aux jeunes en disant que c'est cool quand ça défouraille
Va pas m'faire croire que le rap c'est de l'argent comptant
Faut m'croire avec une barre on est largement content
Dans ce milieu, j'aime ceux qui ne mentent à quiconque
Et toi pourquoi tu parles ? Vas-y ferme-la petit con
J'ai toujours la vibes dernier cri, des larmes dans mes écrits
Mais j'ai le sourire quand tu viens m'dire que tu m'apprécies
J'peux pas dire, que je rêve de vendre 1000 disques
Moi j'rêve de vendre mes disques à 1000 personnes puissance 10
C'est pas une vie des fois je gagne même pas le SMIC
Mais j'suis là t'as vue on s'bise toi et moi c'est show bizz
J'suis incomprise mais j'veux être trop prisée
Y'a que toi qui pourras faire en sorte que j'puisse tout briser
Viens viens dans mon monde je m'en fous d'connaître des re-sta
Moi je veux des mômes et du monde des MJC aux stades
A ce stade de ma vie j'veux juste qu'on me connaisse et qu'on m'kiffe
Pas qu'on m'test et qu'on m'kill
Moi c'est Diamant au cas ou tu saurais pas
T'aime plus l'rap ça t'soule donc tu m'appelles et je répare
J'peux pas t'en vouloir d'avoir sous-estimé mon flair
Faut pas me sous-estimer mon frère
Car j'veux tout briser ça fait trop long time que j'attends la gloire
J'veux qu'on m'aime à défaut qu'on taille
J'suis pas antisociale parce que j'aime pas la musique de merde
Moi j'suis ouverte big up à la musique d'outre-mer
Big up à toutes les chanteuses dans les refrains, big up aux foulex big up aux tubes
Je m'en bas les ff.... d'être rentrée dans le moule
Moi j'veux qu'on dise que j'suis d'la bombe
Big up a ceux qui on kiffé toute l'époque de Time Bomb
Rappelle-toi quand ça kickait sec à Paname
Je suis de l'école ou tu ne kick pas si tu n'as pas l'âme
Concours de flow, de phases, de balles, de larmes
2 Bal 2 Neg, Solo ou Solaar
Un truc de fou renoi 113 et Doudou Masta
L'époque où y'avait peu bizz du rap et basta
Nouveaux, anciens, zoulous, cailleras
Big up à L’Skadrille, Sniper et Kayna
Bercée à la Soul au Rap et à la Funk
Rappelle-toi l'époque où y'avait trop de mecs sapés à la punk
Le rap d'antan où y'avait même pas d'thème
Crois-moi ça a changé va écouter Tandem
Vendredi soir y'avait Disiz et ATK
Ce soir c'est freestyle (Ambiance scandale) vas-y préviens tes gars
Tout était dans l'style, le kiff et l'attitude
A 10 ans j'ai pris une grosse gifle avec Rapattitude
Puis ça défile, les rappeurs se succèdent
Qui aurait cru qu'un jour on aurait tous ce succès
Moi on m'a pas aidé, j'ai galéré t'as pas idée
Big up à la FF, Psy 4 De La Rime, KDD
J'fait pas la groupie, moi j'suis loin d'ça
Et des amis dans l'bizz ben crois-moi j'ai pas besoin d'ça
J'ai toujours eu la tête sur les épaules
Big up au Ménage à 3, La Cliqua, IV My People
J'étais sauvage j'avais le bic amer
Ma plus grosse référence ça reste les Nique Ta Mère
ConcertS blindés du feu et des pogos
J'étais opé moi j'connaissais par cœur les Sages Po (Pozoèzè !)
Toujours à la page dans le combat d'Idéal J
Different Teep, Les Petits Boss, Démocrates D et Daara J
Afro Jazz, Roots'neg et La Brigade
K-Special, Double Pact, Saïan Supa et Psykopat
Crois-moi j'connais l'histoire de ceux qui m'ont marquée
Le hip hop c'est mon art tu finiras par l'remarquer
Si tu veux on fait un quiz
J'te parlerai de Factor X, Kazkami, Triptik et Lagonz Viv'
J'oublie pas D.Abuz System, Ekoué, les Spécialistes
EJM, Express D, APM
Y’avait Saxo, Polo, Rocé
MIC, Daomen, Lady Laistee et Busta Flex pour toaster
Qui veut m’enseigner mon art ?
Vas te renseigner moi j’ai tout vu et entendu du haut de mon arbre
Big up à IAM, Neg’ Marrons, et Chiens De Paille
Kennedy, Karlito, Isïs, Rohff et Intouchable
Lionel D, 3ème Oeil et la Scred Connexion
Teemour, Driver, la Clinique et La Caution
A tous ceux qui bossent encore, qui ramènent du neuf
Carré Rouge, MASS, OSFA, Less' du 9
Ailleurs ou dans l’Essone, Assassin et Mystik
Beat de Boul, l’Agression Verbale et Futuristiq
La liste est longue, dur de pas zapper des blazes
Faf Larage, 147 Code et Boss of Scandalz
A tous ceux qui déroulent, qui défoncent et qui froissent
Arsenik, (tu sais), Sinik et Loz Monzas
Moi j'suis qu'une p’tite nana qui a voué ses vers à vous
Et faut avouer que j’vise le nirvana
Dans tous les genres, B-love, Matt Houston et Lion
Positive Black Soul, Destinée, Vibe dans mon album
J’oublie pas Fabe, K-reen et China
Jimmy Sissoko, Mafia Trece et Secteur Ä
Jalane, Wallen, La Mafia Underground
Coup Direkt, Assia, Kayliah, ETA et leur bande
Lord Ko, Raggasonic, Faya D et Nuttea
Tonton David, Soundkail et les Tiwony
J'manque de temps, si seulement j’pouvais placer
Ceux que j’connais pas mais qui vont tous nous déclasser
Aujourd’hui j’suis officielle demain je le serais p’t’être plus
Donc j’suis aussi celle qui dois défoncer l’actu
Moi c’est Diamant au cas où tu le saurais pas
T’aimes plus le rap tu m’appelles et je répare
You might also like[Outro]
Diam's Diamant qui veut m'enseigner mon art
J’sais pas si tu connais, compte en banque vidé
Sayd des Mureaux, j'sais pas si tu connais
91, Diamant, Diam’s comme tu veux
J’sais pas si tu connais

Paroles rédigées et expliquées par la communauté RapGenius FranceEmbed"
