Artist,Title,Lyrics
Iron Sy,Mon opinion,"6 ContributorsMon opinion Lyrics[Refrain]
J'donne ma vision, mon opinion
Jeune black en France, fan de pognon
Ma situation j'dois changer
La taule m'aguiche, elle veut me garder !

[Transition]
Eh non, non, non
J'vais me barrer
Vous pouvez chiner
Dis leur, Dis leur
Vas-y fait moi ça !
Ah bon, Ah bon
J'aime ça !

[Couplet 1]
Les soucis m'attaquent, j'les transforme en rimes
L'Etat m'doit beaucoup, je leur ai envoyé mon RIB
La justice a peur, ballon j'ai pris du bide
A force de trop dormir, la vache j'ai pris des rides
La rage mon kike, entre le shétane et le kiffe
Du shit dans mes chaussettes, j'avance l'esprit avide
J'rappe depuis longtemps ça m'abime
Un jour j'vais cher-la mais pour l'instant ça m'habite
Le biz traine comme nous on biz de la légalité
Me tente tant qu'il y aura un bon Dieu
J'suis le genre de mec qui vit dans le feu
Le shétane dort chez moi, oué sous mon pieu
J'ai tué mon temps, réellement je suis en deuil
J'ai buger, je me suis promener au fond d'une teille
Ma feuille subit, l'usure que je ressens
Inch'allah à présent la vérité je répends !
You might also like[Refrain]
J'donne ma vision, mon opinion
Jeune black en France, fan de pognon
Ma situation j'dois changer
La taule m'aguiche, elle veut me garder !
J'donne ma vision, mon opinion
J'kicke pour tous les vrais ghetto youth
Iron mon blaze, ma situation j'dois changer
La taule m'aguiche, elle veut me garder !

[Couplet 2]
Je tourne en rond comme si j'étais en promenade
J'veux dire que je galère, réellement j'ai que dalle
La rue mon adresse dans le 9.4, envoi moi des mail
J'vis là bas, là où les mecs rêvent que de maille oué
J'te le dis j'veux faire des thunes comme My Way
Mais jamais je me coucherais par terre comme Haïdi
Iron mon blaze, tu connais ma voix
Accroché à mon joint j'exprime rarement ma joie
J'suis le genre de type qui vit dans le vrai
Bien éduqué, chez nous on se fait pas de prêt
Ce que j'ai est à ma mille-fa
Mon job : crever pour eux, je suis le fils à Zakaria
J'ai la permission pour tous ken j't'assure
J'me donne aucune limite, mon stylo part c'est pure
Trop de feuilles s'répu', j'ai ken dur
Comme mes propos qui s'écoutent avec des pures
[Refrain]
J'donne ma vision, mon opinion
Jeune black en France, fan de pognon
Ma situation j'dois changer
La taule m'aguiche, elle veut me garder !
J'donne ma vision, mon opinion
J'kicke pour tous les vrais ghetto youth
Iron mon blaze, ma situation j'dois changer
La taule m'aguiche, elle veut me garder !

[Couplet 3]
Mon parcours sans tubes, enchaînes les beat sans pub
Y à que des inconnus dans mon skeud, refuse ma plume
J'viens prouver en solo puis prendre des thunes
La rue ça forge, OK, la rue ça tue
C'est, c'est le Far-West, les cow boy c'est nous
Le shérif peut rien faire sa femme pécho chez Doum'S
Je suis là per-ra mais j'aurais pu être para'
J'suis un guerrier, dans les tranchées j'suis imparable
Bien éduqué, j'ai grandi dans la modestie
J'attends mon bénéf', j'ai investie dans la vie
Mon coeur bat, Dieu merci je respire
Trop speed sur ce beat j'fais pas dans l'inertie !

[Refrain]
J'donne ma vision, mon opinion
Jeune black en France, fan de pognon
Ma situation j'dois changer
La taule m'aguiche, elle veut me garder !
J'donne ma vision, mon opinion
J'kicke pour tous les vrais ghetto youth
Iron mon blaze, ma situation j'dois changer
La taule m'aguiche, elle veut me garder !Embed"
Iron Sy,Mon vécu,"5 ContributorsMon vécu Lyrics[Couplet 1]
Ma plume n'a plus d'encre j'ai trop écrit ma R.A.G.E
À mon A.G.E. j'suis presque au bord de la prise d'O.T.A.G.E
J'ai tout à gérer portrait ingénieux
Donc une vie claquée m'a mis à genoux
J'suis au bout du bout j'ai perdu tout goût
J'ai une vie sans sous j'ai une vie de fou
Je t'avoue et l’État s'en fout
Faut qu'on crame des voiture pour que l’État s'secoue
Je veux être africain friqué pas africain fauché
Ni africain foutu, mais africain futé
Un africain juste lyricalement français
Inch'Allah, si j'ai l'khaliss j'vais au bled fonder
Pas de liquide donc une vie peu wicked
Pas trop d'étude donc, j'vis le frigo vide
J'suis en recherche de belle vie depuis kid
Mais où elle vit ? Je suis en manque d'argent j'suis trop speed

[Refrain : D.Dy]
Ma destinée c'est dans la rue
Là j'ai appris à tout piner sur instru
Je voulais que mon vécu
Soit reconnu, soutenu par tous les vrais

[Couplet 2]
Je viens d'la rue comme dans Clockers, mon sport esquive de Hooker
Mon taf : sponsor de smokeur
Mes diplômes : j'en ai pas, j'étais trop traîneur
Mon école : c'est un hall j'ai le Bac + 4 bédaveur
J'suis pas béni, j'suis pas né un 25 décembre
J'suis né ici dans la rue pour 25 G tu peux te faire descendre
J'suis né là où les keufs sont rarement sobre
Et rarement te sauvent, surtout quand t'es de couleur sombre
J'suis né là où Gynéco chante pas 2 secondes
Entre dealers et tours, au milieu des décombres
J'nique sur l'beat pour te parler d'où j'habite
Dans le 9.4 mon frère et comme ça on est en nombre
I.R.O.N (Sy) c'est moi ce grand black
Sans bla-bla tout black sans maille
Qui s'bat pour que sa famille graille en bas j'râle !
Sans repos ni répit j'baille j'braille sur un beat, c'est bad
You might also like[Refrain : D.Dy]
Ma destinée c'est dans la rue
Là j'ai appris à tout piner sur instru
Je voulais que mon vécu
Soit reconnu, soutenu par tous les vrais

[Couplet 3]
J'suis né pendant qu'mon père logeait comme il a pu
J'suis sûr dès que j'ai vu le jour il a plu
J'ai grandi avec pas grand chose et j'ai appris
Dans l'ghetto aujourd'hui je vis donc cru
J'ai pas le profil du mec clean, pas le langage d'un médecin
Pas les yeux d'un mec chic, ni la pipe du mec bien
Pour taffer pas assez albinos, j'vis misère sur misère
Donc je me venge mesure par mesure
J'râle jusqu'à c'que ma voix subit l'usure
J'rappe, j'ferme pas ma gueule moi j'pisse sur la censure
J'suis ici issu de l'endroit où tu sues
Pour gagner des sous sans donner ton cul t'as saisi !

[Refrain : D.Dy]
Ma destinée c'est dans la rue
Là j'ai appris à tout piner sur instru
Je voulais que mon vécu
Soit reconnu, soutenu par tous les vraisEmbed"
Iron Sy,Narcocorrido,"1 ContributorNarcocorrido Lyrics[Paroles de ""Narcocorrido""]

[Couplet unique]
L'argent est mon roi et mon flingue est ma reine
Je suis sur un trône qu'est au fond d'une ruelle
Je parle à des go's qu'est l'inverse des femen
Que tchaga charger je connais meme pas leurs name
Le danger arrive, je suis dans l'angle mort
Je vais les écraser comme mon garci mort
Espérance de vie comme à Baltimore
Je fais flipper les bourgs comme à Gare du Nord
Trop chaud pour eux, je ne compte plus les degrés
J'envoie des combos, je compte plus les dégâts
Après moi salope, ta tte-cha bégaye
J'veux toucher tout l'monde comme le Corona
Toujours, énervé comme dans les bouchons
J'ai planté cette graine donc j'veux la moitié
C'est l'heure de la paye l'heure de la moisson
Trop de rappeurs pratique le plus vieux métier
Ils ont tous signé chez le franc mâcon
Lyrics et gestu comme Alain Souchon
Sapés comme le clown Achille Zavatta
Quand ils viennent per-cho j'mets rien dans le pochon
Je ne suis pas dans les normes, demande a ta racli
Ouais ça sent la poudre et personne a rais-ti
J'ai goutté la zer, regarde dans mes rétines
J'ai été ce petit qui volait ta tétine
Je n'ai pas le temps de jouer, way, je n'ai pas le temps
Je veux palper de-spee, mais je n'ai pas le teint
Je dois grossir les traits, pour qu'on m'entende
Je dois virer du jeu, ce qui n'a pas le cran
Porter vos couilles on s'est trop fait baiser
L'Africain, vie trop dans la précarité
On a tous chez nous de l'or au karité
Mais combien de négro gère leur putain société
Que des mulâtres sur les publicités
Si tu es négro gay là, tu es plébiscité
Plébisciter, plébisciter
Il préfère Billal et le noir d'Eric Z
Applaudissez la futilité
Il passe chez nous en furtivité
Flow tai-chi je touche les poings vitaux
Je défends le vrai, car ont est limité
Nos vies sont chantées quand on tire le rideau
Que des baltringue parle au cocorico
Il chante nos vies
Narcocorrido, narcocorrido , narcocorrido
Il y aura du sang comme dans une corrida
Ils sont obsolètes, je suis venu les corriger
J'ai l'algorithme et les bons bou-mara
Narcocorrido , narcocorrido , narcocorridoYou might also likeEmbed"
Iron Sy,Pas Besoin,"3 ContributorsPas Besoin Lyrics[Refrain]
Pour bien rapper pas besoin de gros pecs
Pour bien rapper pas besoin de groupie
Pour bien rapper pas besoin de gros chèques
Pour bien rapper pas besoin de gros clips

[Couplet 1]
Pour bien rapper pas besoin de pompe, pas besoin de belles pompes
Pas besoin de fusil à pompe, pas besoin de péter un plomb
Pas besoin de tomber, pas besoin de plomber
Pas besoin de sécu', mytho, renoi prends ton blé
Je viens pper-ra parmi [?]
J'fais ça bien, j'fais ça bien, j'ai pas besoin de tes rails
J'viens d'en B.A.S sans B.A.C
Je fais bouger ta tête, ta tèce sans décalquer
Pour bien rapper pas besoin d'être un dépravé
J'viens prouver loin [?]
Pour bien rapper pas besoin de changer de face
Trop donnent leur tâte, bientôt pour hommes y aura des Tampax
Le temps passe de-spee comme un taf-taf
Je vais pas perdre mon temps comme avec ta 'tasse
Iron mon blaze, j'suis pas Snoop ou Nas
Anti-mec sous 'tasse, sous crack, sous cèce qu'embrase
Rappeur fashion-victim lâches l'affaire
Mon nom Iron, ok j'vais t'aider à fuir
You might also like[Refrain]
Pour bien rapper pas besoin de gros pecs
Pour bien rapper pas besoin de groupie
Pour bien rapper pas besoin de gros chèques
Pour bien rapper pas besoin de gros clips

[Couplet 2]
Pour bien rapper pas besoin de gros pét' ou de schnek collée au chèque
Pas besoin d'être tatoué [?]
Je veux être médecin comme Gandhi [?]
H24 soucis pourtant je pèse sur compact
J'arrive dans le rap sans lunettes de soleil
J'avance en Solex, sans violence mais en silence
Appelles-moi début de flamme, j'ai le flow silex
Ici Iron Sy de T.H.I.A.I.S
Chez nous les players on les B.L.A.I.S
Les flics je les baise sur place pas de pardon si je vexe
J'ai trop de trucs à faire, j'ai trop de trucs à dire
J'ai trop de trucs à prendre, pépère j'ai trop le temps
Je vois tout, Iron peu content
Si on me demande si j'aime 'argent, je dis ""oui, complétement""
Ça [?] ou d'idée bien portante
[?] à cette heure-là, la fuite me contente

[Refrain]
Pour bien rapper pas besoin de gros pecs
Pour bien rapper pas besoin de groupie
Pour bien rapper pas besoin de gros chèques
Pour bien rapper pas besoin de gros clips
[Couplet 3]
J'emmerde tous les rappeurs riches que dans leurs clips
Dans ma vidéo y aura que ma face et ma clique
J'kicke pas en marcel, en stard-co ou en slip
Mc pudique, je sors ma bite que quand je nique
Je fais pas mes comptes pour avoir un putain de morceau
Mc vautour quand je bouffe pas besoin de [?]
J'suis pas en concours, j'suis ici pour prendre l'euro
J'viens tout ken de Paris jusqu'à l'Hérault
T'es pas ce mec à la télé avec une cape
T'es pas Biggie, ni 2Pac, t'es pas moi, t'es pas lui
T'es pas ce mec, t'es une pute, t'as un mac
Tu suces pour 2-3 illets-bi, t'es pas, t'es pas lui
T'es pas ce mec dans Menace qui braque un nois-ch'
T'es ni Lino, ni Tony, t'es pas moi, t'es pas lui
T'es pas ce mec courageux, t'es un lâche
T'es pas mon frère, ni mon pote, t'es pas, t'es pas lui

[Refrain]
Pour bien rapper pas besoin de gros pecs
Pour bien rapper pas besoin de groupie
Pour bien rapper pas besoin de gros chèques
Pour bien rapper pas besoin de gros clipsEmbed"
Iron Sy,Plus D’Amour,"5 ContributorsPlus D’Amour Lyrics[Intro]
Plus d'amour
Plus rien
Juste ma foi en mon rap
Ma mi-fa, BOSS
Iron sy

[Refrain] x2
J'ai plus d'amor, plus d'love j'veux plus adorer
Trop de rancœur comme un black qui était adoré
J'ai plus d'amour, j'ai plus d'amour, j'ai plus d'amour

[Couplet 1]
J'ai plus d'amour quand j'vois l'Dass, plus d'amour quand j'vois une tass
À 16 ans tourner avec des mecs même pas pour l'cash
Plus d'amour pour les lâches, les fachos qui s'arrachent
Dans leurs campagnes et puis qu'ils aillent niquer leur race
Plus d'amour pour les condés ces fils de pute
Faut les plomber, les rendre dingues qu'ils aillent se suicider
Plus d'amour pour les mecs qui touchent à mes proches
Ma mille-fa c'est don't touch, gaffe aux gars qui s'approchent
Plus d'amour pour la justice, des frères tombent, sombrent
Sans voir l'ombre de son jeune fils
Plus d'amour pour un mec qui teste
J'ai tellement la rage qu'on pourrait m'inscrire au Ultimate Contest
Plus d'amour pour mon ami devenu mon pire ennemi
Tu m'as trahi balance pour d'la money
Plus d'amour pour un black, un blanc ou un beur
Peu importe la couleur, on est tous dans l'même sac à cette heure
Plus d'amour, niet, nada...
You might also like[Refrain] x2
J'ai plus d'amor, plus d'love j'veux plus adorer
Trop de rancœur comme un black qui était adoré
J'ai plus d'amour, j'ai plus d'amour, j'ai plus d'amour

[Couplet 2]
Où est l'amour dans cette vie merde ?
Où la maille est rare comme une meuf à 20 piges et encore vierge
Voir les riches rien qu'ça m'énerve
Rien qu'ils friment dans les chics et appellent ça une vie d'rêve
Et entre mecs se sucent la verge
Rien qu'des dep' ces mecs et leur femmes les trompent dans leur auberge
Fidèle à mon siège, la rue
Où ma rage éclate sur une feuille puis sur instru
Où j'ai cru, que j'suis entre crépus
On n'est pas haineux mais j'ai une liste de nom de reums corrompues
Avec l'amour j'ai rompu, j'ai trop rampé
Trop raqué de temps dans un amour raté
J'ai eu trop d'décés, trop déçu d'un amour que j'ai tèje dans les déchets
J'ai cessé d'ouvrir mon cœur, j'ai lâché les chagrins, les pleurs pour passer au stade supérieur
J'ai plus d'amor, j'peux plus adorer, j'ai trop d'rancœur comme un black qui était adoré...

[Refrain] x4
J'ai plus d'amor, plus d'love j'veux plus adorer
Trop de rancœur comme un black qui était adoré
J'ai plus d'amour, j'ai plus d'amour, j'ai plus d'amourEmbed"
Iron Sy,Pour les plus riches ?,"1 ContributorPour les plus riches ? Lyrics[Couplet 1]
J'préfère voir les larmes d'un lâches, que le sourire d'un ministre
Si t'as voté pour l'autre **** c'est qu'tu l'as pris dans l'orifice
Y'a que Dieu qui peut m'juger, donc j'ai pas besoin d'ta justice
Des fois j'parle à mes démons, mais jamais j'parle à la police
J'préfère courir vers le vide, plutôt qu'marcher vers ibliss
J'vais tout seul chercher mon bif, j'compte pas sur l'industrie du disque
J'préfère être le roi d'la rue, qu'être le chien d'la république
J'préfèrе mentir au procu' plutôt qu'mentir à mon public
Moi j'préfère la libеrté, mais j'ai grandi menotté
Affamé et débrouillard, mon casier m'donne pas l'droit d'voter
Pourtant j'vous ai moins volé que Balkany, Guéant ou Copé
UMP, Front d'Gauche, PS, tous se sont vautré
A leur place, à l'Extrême Droite, les fachos s'rasent la moustache
Ils ont plus besoin d'parler parce que c'est toi qui fait leur taf
Ouais c'est toi qui fait leur taf, toi l'rappeur du millénaire
A chaque fois qu'tu dis ""kalash"", tu rends les fachos millionnaires

...You might also likeEmbed"
Iron Sy,Président,"1 ContributorPrésident Lyrics[Intro]
Discours de Jacques Chirac

[Couplet 1]
J'ai pris mon stylo et ma page la plus propre
Pour t'écrire cette lettre qui voyagera sans enveloppe
Vu qu't'es presque sourd à mon avis t'entendras d'travers
Hé ! Président ! J'ai fait le maximum pour être clair
J't'écris car tu t'es bien foutu d'notre gueule
J'avoue, t'as bien escroqu', t'as braqué la France sans gun
Moi J'men bats, c'est ni mon bled, ni tes thunes
Mais putain Président t'as craché sur l'bitume
""Le bruit et L'odeur"" Personne n'a oublié vieux
Devant toute la France, tu nous a outragés vieux
Je sais pas si ce jour-là, t'avais vu Elstine
Mais devant nous Président, t'as perdu ton estime
Fais comme ta femme, collecte des centimes
Rachète-toi un **** ou colle-lui une grosse pine
Ou vire-le ! Il nous les casse comme Diam's
Chez nous personne l'écoute comme du Patricia Kaas
Mets-le dans les chiottes et tire la chasse
J'sais pas si ça peut t'arranger, ce con veut prendre ta place
Moi aussi d'ailleurs si j'avais les moyens
La France c'est un pays très facile à manier
La preuve, tu fais c'que tu veux même quand y a manif'
T'as même mis ton vieux pote en tant que Premier Ministre
C'est bien j'tassure mais j't'admire pas
Vieux crouton cette lettre, j'l'ai écrite au card-pla
Archi à jeun et conscient de c'que j'narrate
J'maintiens mes propos aussi sur que j'ken ma rate
T'es déguisé en rabbin, en vrai t'es un facho
Les Noirs et les arabes, tu les aimes qu'au cachot
Hé Président (x 4)
Hé Premier Français ! J'espère qu't'es pas fâché
C'est la vérité et j'peux pas la cacher
Assume t'es grillé comme Alfred Sirven
Dès qu'tout l'monde a té-sau, y a La Santé qui t'surveille
Mais comme ta ré-élection, elle est magique
T'as victimé les ****, j'ai plus besoin de les fuck dans ma 'sique
Mais y a sa fille qui rapplique cette grosse pute
Mais laisse j'm'en charge, j'vais botter son gros cul
Sinon hé dis à tes flics qu'ils nous font pas peur
On est pas dans la série ""Shériff fais-moi peur""
Et ce skin qui t'a raté ce con
On tue pas un cerf avec un fusil à pomb
Écoute ça Président, d'en bas j'suis résidant
Pas loin des résidus, j'tenvoie mes sentiments
T'es qu'un faux-cul, le chef des hypocrites
J'tenais à te le dire, c'est pas pour faire un titre
Hé Président (x 4)You might also likeEmbed"
Iron Sy,Résistant,"9 ContributorsRésistant Lyrics[Couplet 1]
On veut me formater artiste qui passe partout
On veut que je fasse des singles sur des beats de cartoon
On veut que je ferme ma gueule en bref, monte, on casse tout
Mais on laisse parler les trav' et les caves-pou
Je changerai pas, c'est comme voir Bush avec un chapelet
C'est comme voir mon frère Doums trainer à Châtelet
Impossible qu'Iron devient une saleté
Audiovisuelle comme les trois quarts du rap français

[Refrain]
Je suis un résistant, résistant, résistant
Quoi ? Un résistant, résistant, résistant
Quoi ? Un résistant, résistant, résistant
Quoi ? Un militant devant la foule, j'hésite pas

[Couplet 2]
Je suis fiancé à la rue mais je vais pas l'épouser
Je vais me barrer de cette vie, je pense à te faire danser
Mon rap une cure, une douche de vérité
Je sais ce que j'écris et j'évite de m'emporter
J'ai tué personne comme Michel Fourniret
Y a pas de serial killer qui traine dans mon quartier
Trop de rappeurs ont chié sur le hip hop
Le cul mal lavé, ces bâtards bossent à Skyrock
You might also like[Refrain]
Je suis un résistant, résistant, résistant
Raconter de la merde à des millions de gens
Résistant, résistant, résistant
En plus ça sert à rien et y a personne qui vend

[Couplet 3]
Dans le rap çais-fran, aucun n'est millionnaire
Y a que des frimeurs qui rappent pour des faits mineurs
Tous ont des traces de gifles sur les lombaires
Baisés par les majeurs friands des petites carrières
Les médias s'approprient notre culture urbaine
La culture française elle est morte, je l'ai mis dans la benne
Avec les lois, les flics et l’œil à Le Pen
La taule, le fisc et la double peine
On peut pas me changer, c'est comme raser Ben Laden
Je narrate ce que je vois, ce que je vis, je touche à tout thème
Je lutte pour qu'on m'écoute pas pour qu'on me suce le zguègue
Et le jour où je tourne ma veste, moi-même je me coupe les veines

[Refrain]
Je suis un résistant, résistant, résistant
Quoi ? Un résistant, résistant, résistant
Quoi ? Un résistant, résistant, résistant
Quoi ? Un militant devant la foule, j'hésite pas
[Couplet 4]
Mon but c'est de marquer la conscience des gens
Mon album un vre-li qui se lit avec les tympans
Je suis un résistant, devant la foule j'hésite pas
Pour cracher mes phrases écrites sous zetla
Vous êtes qui ? Je viens mer-cra tous ceux qui ont menti
Iron l'élu je me fais suck par Trinity
Je chie sur la célébrité
Je conduis mon rap en état d'ébriété
Joko sur joko, j'écris la vérité
Je vis dans le ghetto depuis ma première récré
J'ai jamais rien dit dans la recherche, j'avoue
Trop jouent les voyous et après passent aux aveux

[Refrain]
Je suis un résistant, résistant, résistant
Quoi ? Un résistant, résistant, résistant
Quoi ? Un résistant, résistant, résistant
Quoi ? Un militant devant la foule, j'hésite pas

[Couplet 5]
Moi j'aime la vie, je la tise et savoure
Devant un drive-bu, comme tout le monde je cours
Trop de frac, tu fais pas de fric
C'est pas en titubant que je vais rentrer en Afrique
J'ai pas la clé donc je démarre au cric
Sans stress je pars, mais pas de cri, j'ai la trique
Je suis pas mort comme une brique sous drogue
Surcharge vocale même si je suis en dog
[Refrain]
Je suis un militant, militant, militant
Quoi ? Un militant, militant, militant
Je suis Un résistant, résistant, résistant
Quoi ? Un résistant, résistant, résistant
Quoi ? Un résistant, résistant, résistant
Quoi ? Un militant devant la foule, j'hésite pas3Embed"
Iron Sy,Silex Experience,"2 ContributorsSilex Experience Lyrics[Refrain]
Sylexperience sylexemple
Sylexperience sylexemple
Sylexperience sylexemple
Sylexperience sylexemple

[Couplet 1]
La conduite de l'émotion est une conduite à l'échec
Je viens toucher les gens et aussi toucher mon chèque
Jе convoite et je prеnds puis disparais comme un spectre
Entouré de ma famille nous on s'isole comme une secte
J'ai caché mes sentiments là où personne pourra chercher
Sur le ciment on passe nos vies à se baisser
Comme souvent on frappe sans regretter
Toujours sur nos gardes quand ils passent faut pas guetter
...You might also likeEmbed"
Iron Sy,Tirailleur Trahi,"1 ContributorTirailleur Trahi Lyrics[Intro]
Yéné diambaré, yé !
Tirailleur, tirailleur
Diambaré yé !

[Couplet 1]
J'ai le cou sur une corde et les jambes dans le vide
J'ai volé à bouffer, j'avais l'cerveau dans l'bide
J'ai tendu la main, j'ai grandi les yeux humides
La langue sèche, ma bouche un désert aride
Sans guide, j'avance sur une terre que j'connais pas
Pourtant j'ai fait la guerre comme nos pères qu'on connait pas
La couleur ébène, j'fais mes courses dans une poubelle
J'dine avec des rats et un chien avec qui j'traine
Les gens m'ignorent depuis 20 ans j'suis à demi-mort
Le corps souillé, cette patrie m'a mis au port
J'suis malade, sur un bout de tissu j'm'endors
Et rêve d'un miracle, genre que Dieu me porte
La douleur m'appelle, j'ai mal dès qu'elle m'aborde
En plus l’État me martèle, ils envoient les forces de l'ordre
Je gêne les honnêtes gens d'après eux
Moi tout c'que j'voulais c'est rentrer dans mon pays

[Refrain]
Tirailleurs sunu diambaré yé
Trahi par le système colonial
Tirailleurs sénégalais
Trahi par le système colonial
Mame bauye, mame bauye
You might also like[Pont : Aumar]
Setoume tirailleurs yé thia bitime
Rew bougnou faté séni diambaré yé
Ngouroum toubab bi
Warou bayi fi setoub tirailleur
Mouille sona fi
Déret gui tourou fi
Boungne co faté ti
Na léne dimbeum ti
Ba gnou téki fi

[Couplet 2]
J'vis comme un oiseau mort, ma tombe c'est la chasse
Souvent j'me revois sur mes terres vivant d'la chasse
Ici j'ai pas ma place, j'habite sur la crasse
Déçu j'ai vu la traitrise en face, j'traine la patte
La gangrène m'estompe, on me prend pour une plaque
On veut m'voir sous une pompe, des fois j'craque
J'me cache, j'ai honte, j'crois qu'c'est de ma faute
J'ai pris les armes pour un autre
Chagriné dans mon coin, rarement j'me montre
À part pour mendier et assouvir mon ventre
Chaque jour les regards volent mes espoirs
Les enfants m'dénigrent, ils connaissent pas mon histoire
À chaque soupir, mon cœur se tord dans ma poitrine
J'suis inconsolable, ma vie l'inverse d'un comptine
Le sang coule de mes yeux, j'suis sur une chaise électrique
Condamné à mourir, j'peux pas construire, j'ai pas de prix
[Refrain]
Tirailleurs sunu diambaré yé
Trahi par le système colonial
Tirailleurs sénégalais
Trahi par le système colonial
Mame bauye, mame bauye

[Outro]
J'vis comme un oiseau mort, ma tombe c'est la chasse
Souvent j'me revois sur mes terres vivant d'la chasse
Ici j'ai pas ma place, j'habite sur la crasse
Déçu j'ai vu la traitrise en face

[Refrain]
Tirailleurs sunu diambaré yé
Trahi par le système colonial
Tirailleurs sénégalais
Trahi par le système colonial
Mame bauye, mame bauyeEmbed"
Iron Sy,Vida Local,"2 ContributorsVida Local Lyrics[Couplet unique]
Ouais
Moi j'pisse sur vos millions, leurs morts, j'irai fêter
Mes yeux sous lacrymo', mon job manifester
À deux pas d'la prison, à six pieds d'la piété
La dalle ou le pilon, mon choix il est vite fait
Moi j'veux l'vivre à [?], de la kush dans l'bocal
Ouais, j'fume près du butane et j'cane près du bitume
Toujours dans les stons-ba, citatrices et coquards
Weed, whisky coca, cocktail molotar
Ouais, criblé c'est trop tard pour [?]
Ton âme fera l'trottoir, comme Pasqua ou Giscard
Bang bang en bécane, mort par un frérot
T'en avais dans l'[?], armé comme à Bagdad
J'vends sans la couper, rappeur fait la poupée
Ta femme, c'est ma tasse-pé depuis mon premier couplet
J'mets ma queue dans l'rap, j'casse ta nuque, ça craque
Clic clic, ça claque, clic clac, neuf quatre
Moi, j'compte pas sur la chance car la chance me compte pas
Moi, j'danse avec les loups jusqu'au prochain combat
Ambition comme jamais, une balle me stoppa
Bang bang chaudasse, j'perds ma vida locaYou might also like1Embed"
