Artist,Title,Lyrics
Iron Sy,Instinct Criminel,"1 ContributorInstinct Criminel Lyrics[Couplet 1]
J'ai noyé ma liberté dans une mare de sang
C'était dans mon foyer sous les yeux d'mes enfants
Ma femme, celle que j'ai épousé y'a 10 ans
Vient m'tromper chez moi, sur mon lit, mon divan
Avant que je la crève, cette pute me disait :
« Arrête c'est mon cousin » putain c'est abusé !
M'enculer en plus me prendre pour un con
Je lui ai mis une tate-pa et cette pute je l'ai fini sous plomb
Et c't'enfoiré il a voulu s'interposer Bang bang !
T'avais qu'à savoir qui baiser
À cause d'elle, je purge ma peine
J'aurais du la tèj, ça m'a coûté 10 piges
Mais le pire, le pire, c'est mes mômes
Voir leur mère morte et voir leur père en taule

[Refrain]
J'ai l'instinct criminel
J'suis un criminel

[Couplet 2]
Après les coups d'feu, y'avait du sang tout-par
10 minutes après les keufs, me cueillent en bas
Ils m'ont pris pour un dingue du genre à la Chanal
Sans remords à part voir mes mômes chialer
Menotté, emmené puis enfermé
Pris en flag, mon taf c'était d'la fermer
Interrogé, déféré puis jugé
J'ai pris 20 piges, j'ai vengé ma dignité
Mon premier jour de taule, c'était à mes frais
J'étais dans la même cellule qu'un pédophile
Dès l'deuxième jour, j'ai voulu le crever
Le troisième jour, j'ai vengé la p'tite fille
Quatrième jour, j'ai été rejuger
Cinquième jour, un psychiatre m'a parlé
Sixième jour, j'ai goûté l'tard-mi
Septime jour, c'était encore l'tard-mi
Pendant deux trois semaines
J'me remets en question mais est-ce que j'suis moi-même ?
Je sais, c'est sheitan qui t'appelle
« Ouais viens viens, t'es un criminel »
You might also like[Refrain]
J'ai l'instinct criminel
J'suis un criminel

[Couplet 3]
3 piges après, j'ai l'impression que ma vie ils ont pris
Dans ce monde je connais qu'une chose : la son-pri
J'ai pas souri quand on m'a confirmé ma sortie
Le nouveau monde, je veux pas en faire partie
J'ai stagné dans l'passé à cause de cette connasse
Maintenant dehors la taule m'a rendu coriace
Ça m'a pas dressé, j'suis blessé bien au contraire
J'ai appris à tuer d'au moins 50 manières
J'ai ni toit, ni amis, ni famille
Mes marmots depuis longtemps m'ont banni
L’État m'a absenté tout c'temps heureusement
J'aurais pu m'tuer ou tuer des gens
J'suis un criminel d'après leur jugement
Le psychiatre a dit j'ai ça dans le sang
Ça s'trouve car j'ai envie d'killer
Rien que des juges, ma liberté s'est fait piner

[Refrain]
J'ai l'instinct criminel
J'suis un criminel1Embed"
Iron Sy,Je suis le talent faché,"2 ContributorsJe suis le talent faché Lyrics[Intro]
Yeaaaaaaah
Iron Sy
9.4.320
T-H-I-A-I-S
Vécu de scard-la
Hé hé
Mixtape Talents Gachés
Maintenant c’est les Talents Fachés
Prêts, prêts à décharger

[Couplet 1]
Il y a trop d'contrôles, palpations
Insultes puis rébellion
Gazeuse, coups de matraque, menottes puis dans le camion
Chaque soir c’est la même
Et tu crois qu'on va s'calmer
Chiffon, toi et tes lois anciennes on vient te cramer
Contrôle tes pulsions sale décon impuissant
Fils d'inceste homo, depuis la naissance
Devant tous les commicos
Ça pue l'essence
J'aime sentir le porc brûler
Et c’est rare en France
J'viens prendre l'euro, black et en CFA
Franchement tu vois Iron Sy au Sénat
Non non, c’est comme revoir Ayrton Senna
J'vais ken mes élus comme Richard Durn, te-ma
Sur le beat flow de brolick
Ecoute ça sale flic
Pète un bloc
J'te mets en chien
Mange ton frolic
Ta femme j'viens violer
Ta vie j'viens frôler
J'm'amène trop violent
M'écoute pas au volant
You might also like[Refrain]
Ici le talent fâché
Dolce Gabba Caché
Charge charge
J'pars (BAM) buter le rap français
J'traine tard
Le 94 j'viens représenter ra ta ta ta ta
Les tasses-pé j'vais amputer

Ici le talent fâché
Dolce Gabba Caché
Charge charge
J'pars (BAM) buter le rap français
J'traine tard
Le 94 j'viens représenter, ra ta ta ta ta
Les caves-pou j'vais amputer

[Couplet 2]
J'taf pas, je dors pas
J'ai des pensées dures
J'm'en bat des schtars, decs
Et d'leurs procédures
Si j’me posais, pure comme la jaune
Vie dure comme ma part
Et brute comme une morsure
Mon nom Iron
Face à vous j'enfile l'treillis
Vous voulez la guerre
Sauf que moi j'suis pas Tony
J'viens t'remettre, t’traumat’, te ken d'après les gorilles
Style j’dénote, j’démonte
Franchement j'avoue c'était long
Pour passer à la radio j'ai oublié d'être poli
Pour passer à la télé j'ai oublié d'être connu
Oh les médias arrêtez d'boycotter
Surveillez vos colis
Il y a d'l'anthrax dans vos ttres-lé
Iron mon nom pète, escroc comme Rocancourt
Iron viens mettre ta schneck
Sans faire la cour
J'fume mon sbir
C’est Amadou j'attends mon tour
Laisse parler quand tes homo
En bas des tours
[Refrain]
Ici le talent fâché
Dolce Gabba Caché
Charge charge
J'pars (BAM) buter le rap français
J'traine tard
Le 94 j'viens représenter ra ta ta ta ta
Les tasses-pé j'vais amputer

Ici le talent fâché
Dolce Gabba Caché
Charge charge
J'pars (BAM) buter le rap français
J'traine tard
Le 94 j'viens représenter, ra ta ta ta ta
Les caves-pou j'vais amputer

[Outro]
94, Okay, héEmbed"
Iron Sy,J’pardonne rien,"6 ContributorsJ’pardonne rien Lyrics[Couplet unique]
Je vous pardonne rien, vous savez c'que vous faîtes
Vous enfermez nos frères et les privent de nos fêtes
Coupable en 5 minutes comme un vulgaire insecte
Écrasé sur ce sol en quête de miettes infectes
Je vous pardonne rien, même devant un gros chèque
L'argent achète des êtres mais n'achète pas les siècles
Jugés les yeux fermés, on nous traite d'inhumains
On nous trouve trop bizarre comme un canard sans bec
Je vous pardonne que dalle, même si le procu' chiale
Le passé reste gravé dans nos cœurs dans nos crânes
Situation en panne, salam on purge notre peine
On dit qu'on est coupable on utilise pas l'même peigne
Je vous pardonne que dalle, vous nous avez fait trop mal
Certains avalent des lames, ils ont laissé leurs femmes
Leurs mômes, leur taf, bêtement on nous condamne
Les chaussures sans lacet on nous traîne au tribunal
Je vous pardonne nada, vous nous avez pas aidés
Ici on perd notre temps, comme un rappeur blindé
La liberté d'après vous, nous on la mérite pas
Le visage figé, on pleure pas, on rit pas
Je vous pardonne rien, vous savez c'que vous faîtes
Vous acquittez ce prêtre qu'a violé 2 fillettes
La peine de mort n'est plus, heureusement pour sa tête
Laissez nous l'castrer ou donnez lui perpet'
Je vous pardonne rien, vous nous prenez trop la tête
Chez nous on fume des pets, et chez vous c'est les amphét'
Chaque jour on nous drogue le corps avec du poison
Glissé dans la bouffe, dans les clopes et dans les boissons
Je vous pardonne rien, vous fatiguez ma mère
H24 au boulot, à torcher vos grands-pères
Torturés moralement, très tôt on les perd
L'État n'peut pas l'nier, ils exploitent nos pères
Je vous pardonne que dalle, vous nous donnez trop la dalle
Des milliards sur ta touche et nous pour rien on fait mal
On s'canne, on s'tape pour même pas 50e
On est prêts à t'quer-bra juste pour un join d'beuh
Je vous pardonne rien, vous nous avez ficha
Le banlieusard ennemi d'État comme Colonna
À cause de TF1 le FN prend des voies
La télé donne raison à ces putains d'cistes-ra
Je vous pardonne rien, vous nous donnez pas d'taf
À mes frères au bled, vous leur donnez pas d'faf'
La France terre d'acceuil d'après certains
Alors pourquoi on nous vire attachés en charter
Je vous pardonne nada, vous nous donnez pas d'appart'
Vous nous mettez à l'écart comme à l'époque de Rosa Parks
Vois, j'suis pas un singe j'crie pas à la râper
Garde tes fouets pour ta femme, j'suis pas à Kounta Kinté
Je vous pardonne rien, vous avez torturé
La guerre d'Algérie, grosse erreur de l'état français
La perversion d'l'armée, aggrée des sans remords
C'est d'votre faute si on a retrouvé des curés morts
Je vous pardonne que dalle, vous salissez l'Islam
Vous mélangez Saddam, le pétrole et le Coran
Vous êtes complètement fou, Dieu il est au courant
De la promo qu'vous faîtes à tous nos frères musulmans
Je vous pardonnerai quand, je redeviendrai enfant
C'est à dire jamais comme le retour du franc
J'pardonne rien, et sur ce son j'le répète 14 fois
J'espère qu'on s'est compris, j'parle à vous tous au SénatYou might also likeEmbed"
Iron Sy,J’Suis Le Talent Faché,"2 ContributorsJ’Suis Le Talent Faché Lyrics[Intro]
Yeaaaaaaah
Iron Sy
9.4.320
T-H-I-A-I-S
Vécu de scard-la
Hé hé
Mixtape Talents Gachés
Maintenant c’est les Talents Fachés
Prêts, prêts à décharger

[Couplet 1]
Il y a trop d'contrôles, palpations, insultes puis rébellion
Gazeuse, coups de matraque, menottes puis dans le camion
Chaque soir c’est la même et tu crois qu'on va s'calmer
Chiffon, toi et tes lois anciennes on vient te cramer
Contrôle tes pulsions sale décon impuissant
Fils d'inceste homo, depuis la naissance
Devant tous les commicos ça pue l'essence
J'aime sentir le porc brûler et c’est rare en France
J'viens prendre l'euro, black et en CFA
Franchement tu vois Iron Sy au Sénat
Non non, c’est comme revoir Ayrton Senna
J'vais ken mes élus comme Richard Durn, te-ma
Sur le beat flow de brolick écoute ça sale flic
Pète un bloc j'te mets en chien mange ton frolic
Ta femme j'viens violer ta vie j'viens frôler
J'm'amène trop violent m'écoute pas au volant
You might also like[Refrain]
Ici le talent fâché Dolce Gabba Caché
Charge charge j'pars (BAM) buter le rap français
J'traine tard le 94 j'viens représenter
Ra ta ta ta ta les tasses-pé j'vais amputer
Ici le talent fâché Dolce Gabba Caché
Charge charge j'pars (BAM) buter le rap français
J'traine tard le 94 j'viens représenter
Ra ta ta ta ta les caves-pou j'vais amputer

[Couplet 2]
J'taf pas, je dors pas j'ai des pensées dures
J'm'en bat des schtars, decs et d'leurs procédures
Si j’me posais, pure comme la jaune
Vie dure comme ma part et brute comme une morsure
Mon nom Iron face à vous j'enfile l'treillis
Vous voulez la guerre sauf que moi j'suis pas Tony
J'viens t'remettre, t’traumat’, te ken d'après les gorilles
Style j’dénote, j’démonte franchement j'avoue c'était long
Pour passer à la radio j'ai oublié d'être poli
Pour passer à la télé j'ai oublié d'être connu
Oh les médias arrêtez d'boycotter
Surveillez vos colis il y a d'l'anthrax dans vos ttres-lé
Iron mon nom pète, escroc comme Rocancourt
Iron viens mettre ta schneck sans faire la cour
J'fume mon sbir c’est Amadou j'attends mon tour
Laisse parler quand tes homo en bas des tours
[Refrain]
Ici le talent fâché Dolce Gabba Caché
Charge charge j'pars (BAM) buter le rap français
J'traine tard le 94 j'viens représenter
Ra ta ta ta ta les tasses-pé j'vais amputer
Ici le talent fâché Dolce Gabba Caché
Charge charge j'pars (BAM) buter le rap français
J'traine tard le 94 j'viens représenter
Ra ta ta ta ta les caves-pou j'vais amputer

[Outro]
94, Okay, héEmbed"
Iron Sy,J’suis Pas Chez Moi,"2 ContributorsJ’suis Pas Chez Moi Lyrics[Refrain]
Eh laissez-moi ! Oh lâchez-moi !
Ok, j'avoue ! J'suis pas chez moi !
Les flics m'aiment pas, l’État m'aime pas
Ok, j'avoue ! J'suis pas chez moi !
Tu m'embauches pas, tu me reçois pas
Ok, j'avoue ! J'suis pas chez moi !
Et toi ! Chez moi, t'es pas chez toi
Donc casse-toi si t'as pas tes papiers légales

[Couplet 1]
J'peux pas partir tant que j'suis là ancré
Parmi [?] touchés par pauvreté
[?], on veut que je vote pour untel
Mais ça arrange pas mon cas en bas avec ma 'teille
Rien dans le bide dès le matin
Et comme ça depuis la veille donc je gueule avant tout refrain
Avec mes re-frè, on a faim
[?] j'parle sérieux sans accent
Âne bâté, pas ici pour me faire embarqué
J'viens marquer sur onde, j'suis un MC
J'viens barber ce qu'on nous a barbé
[?] la monnaie, j'aime, dans mon baggy
[?] j'ai un compte vide
Y a de la place pour tous illet-bi, j'ai un parking
On veut que je me barre, moi je me marre, je veux des barres
J'suis trimard depuis le départ
You might also like[Refrain]
Eh laissez-moi ! Oh lâchez-moi !
Ok, j'avoue ! J'suis pas chez moi !
Les flics m'aiment pas, l’État m'aime pas
Ok, j'avoue ! J'suis pas chez moi !
Tu m'embauches pas, tu me reçois pas
Ok, j'avoue ! J'suis pas chez moi !
Et toi ! Chez moi, t'es pas chez toi
Donc casse-toi si t'as pas tes papiers légales

[Couplet 2]
J'suis africain, fricain, fricain, fricain, fricain
Depuis mon premier oint-j de l'hyia j'ai craint
Couleur terne, nique sa mère ici ça craint
On dit que chez le noir et maghrébin, ça pue et ça crie
Les magistrats peuvent pas nous saquer
Ils veulent nous voir chacun chez soi, c'est l'Apartheid
Jean-Marie Le Pen presque Président
Bientôt un flic par pipe dans le quartier résidu
[?] résident, ma culture ""la rue""
Black et banlieusard, c'est évident depuis le début
Ma culture blesse comme un black ministre
Et pour qu'on pratique pas, il lâchera pas de milice
Ma face d’asocial n'est pas inoffensive
Dès que j'ai à faire à l’État, je suis sur la défensive
Mon passé judiciaire me suit comme ***
Je suis né coupable depuis le CP, j'ai une fiche
[Refrain]
Eh laissez-moi ! Oh lâchez-moi !
Ok, j'avoue ! J'suis pas chez moi !
Les flics m'aiment pas, l’État m'aime pas
Ok, j'avoue ! J'suis pas chez moi !
Tu m'embauches pas, tu me reçois pas
Ok, j'avoue ! J'suis pas chez moi !
Et toi ! Chez moi, t'es pas chez toi
Donc casse-toi si t'as pas tes papiers légales

[Couplet 3]
On veut me faire comprendre que je suis pas invité
On peut pas me virer, on me tient en captivité
Mon droit d'exister, je viens revendiquer
Vu que je suis né ici, je suis pas prêt d'abdiquer
Le jeune de tèce, on peut pas le voir
S'il a un casier, c'est sûr, on va pas le croire
La loi du silence, on pratique même victime
Dans ce plan de facho, inutile de perdre un style
Je sais, je suis pas chez moi
Y a pas eu de black viking, ni de bamboula
Jamais tu verras un pak-pak dans l'armée de Chine
C'est comme voir Iron faire de la médecine
Écoute ! J'ai mes fafs, je suis né ici, rien à foutre !
On est en démocratie, je dis ce que je veux, rien à foutre !
De ce que pense l'opinion public
Amadou Malik je m'appelle et je viens d'Afrique
[Refrain]
Eh laissez-moi ! Oh lâchez-moi !
Ok, j'avoue ! J'suis pas chez moi !
Les flics m'aiment pas, l’État m'aime pas
Ok, j'avoue ! J'suis pas chez moi !
Tu m'embauches pas, tu me reçois pas
Ok, j'avoue ! J'suis pas chez moi !
Et toi ! Chez moi, t'es pas chez toi
Donc casse-toi si t'as pas tes papiers légalesEmbed"
Iron Sy,La faucheuse,"2 ContributorsLa faucheuse Lyrics[Intro]
Non j'veux pas, non j'veux pas!
Non, non, non j'veux pas
Non
J'suis trop jeune, j'suis trop jeune
Laisse-moi, laisse-moi, laisse-moi

[Refrain]
Non j'veux pas mourir
J'ai à construire
La vie, je l'aime je vais pas t'mentir
Non j'veux pas mourir
J'ai à fonder
Ma vie j'l'ai pas encore donnée
Trop jeune pour mourir
J'suis là, martyr
En-bas à essayer d'gagner
Laisse-moi revenir
Sors-moi d'ce noir
J't'en prie
J'ai pas eu l'temps d'accomplir

[Couplet 1]
Iron c'est ton heure
J'me présente, la Faucheuse
Mais non c'est pas mon heure
C'était pas moi le chauffard
Désolé j'ai même pris ta compagne
J'l'ai ramenée devant Dieu
Et toi tu l'accompagnes
Comment ça?
En plus elle était en cloque
J'ai jamais tué violé
C'est quoi ce destin en toc
Eh ouais mon pote
T'es là, cliniquement mort
Pour toi c'est la fin
Maintenant boy subis ton sort
Mon sort?
Tu t'fous d'qui, la ferme
Sors-moi d'ce noir
Donne-moi mon corps, mon âme
Hé y a pas moyen
Franchement j'ai pas les moyens
Gamins ou doyens j'emmène tous citoyens
Moi j'fais mon taf
J'te ramène là où on m'dit
Dès qu'tu perds la vie
Appelle-moi Joe l'taxi
Pour toi c'est l'enfer
Et ta femme le paradis
Personnellement pour l'enfer boy j'ai un raccourci
Quoi? En enfer?
J'ai rien fait, j'vais cuire
Tout l'monde dit ça
Tu pars en charbon cure
Attends attends, j'suis sûr qu'tu t'es trompé
Vas-y regarde-moi bien
J'suis trop jeune pour caner
You might also like[Refrain]
Non j'veux pas mourir
J'ai à construire
La vie, je l'aime je vais pas t'mentir
Non j'veux pas mourir
J'ai à fonder
Ma vie j'l'ai pas encore donnée
Trop jeune pour mourir
J'suis là, martyr
En-bas à essayer d'gagner
Laisse-moi revenir
Sors-moi d'ce noir
J't'en prie
J'ai pas eu l'temps d'accomplir

[Couplet 2]
Iron ha ha ha!
Tu sais qui j'suis?
Le sheitan, le diable, Satan
T'es chez moi ici
Aux abymes, en enfer fils
Moi j'aime les cris, les os qui craquent
Les hommes qui brûlent, c'est bien ici
T'as fait l'con
Maintenant j'suis ton patron
PAr pas d'douze, Ok man c'est ta maison
T'as rien d'autre à faire à part brûler, fils
Si t'as rien à faire t'as qu'à pleurer, fils
Sur Terre j't'ai piégé, t'as péché, pas prié
Trompé, volé, menti, fils, t'es là pour payer
Tu vas cramer, ça m'fait marrer, ha ha ha ha!
Sur terre j' te voyais plein d'promesses plein d'projets
En plein progrès dans ta vie active
Mais souvent sous degrés, t'es ici grâce à la tise
Alors vise ton nouveau monde
Vois, écarte les yeux et constate
Que c'est l'enfer ton toit
[Refrain]
Non j'veux pas mourir
J'ai à construire
La vie, je l'aime je vais pas t'mentir
Non j'veux pas mourir
J'ai à fonder
Ma vie j'l'ai pas encore donnée
Trop jeune pour mourir
J'suis là, martyr
En-bas à essayer d'gagner
Laisse-moi revenir
Sors-moi d'ce noir
J't'en prie
J'ai pas eu l'temps d'accomplir

[Couplet 3]
Trop jeune pour caner, c'est c'que j'croyais
La mort touche tous les foyers
Trop jeune pour cramer, j'ai pas prié
Mon sort faire l'impasse sans crier
Non j'veux pas mourir, j'veux pas périr, j'veux pas souffrir, j'veux pas pourrir
Dans ces flammes
À être à côté du Sheitan
Non faut pas, non j'veux pas
C'est sûr, la mort personne la cé-su
Une maladie, une balle ou un ton-car
Ça sert à ça, partir sans dire salut
[Refrain]
Non j'veux pas mourir
J'ai à construire
La vie, je l'aime je vais pas t'mentir
Non j'veux pas mourir
J'ai à fonder
Ma vie j'l'ai pas encore donnée
Trop jeune pour mourir
J'suis là, martyr
En-bas à essayer d'gagner
Laisse-moi revenir
Sors-moi d'ce noir
J't'en prie
J'ai pas eu l'temps d'accomplirEmbed"
Iron Sy,Les médias,"1 ContributorLes médias Lyrics[Couplet 1]
Mon nom Iron, face à vous, j'enfile l'treillis
Vous voulez la guerre, sauf que moi j'suis pas Tony
J'viens t'remettre, traumat', tout ken d'après les cauris
Style ténor, j'témon, franchement j'avoue c'était long
Pour passer à la radio, j'ai oublié d'être poli
Pour passer à la télé, j'ai oublié d'être connu
Oh, les médias, arrêtez d'boycotter
Surveillez vos colis, y a d'l'anthrax dans vos tres-le
Iron, mon nom d'bête, escroc comme Rocancourt
Iron, viens leck ta schneck sans faire la cour
J'fume mon sbire, cement-dou j'attends mon tour
Laisse pas les condés homos en bas des tours
Né pour carna, l'oseille rend parano
Né grâce à Allah, esprit à Tarantino
Sans tumeur, trimard, violent sur bloc sténo
Ma couleur XXX j'm'en bats, boy, j'viens té-mon

[Refrain: Iron/Uman (*2)]
Faut faire tourner le son boycotté
Sound system guérilla
On vient pour représenter
Sound system vendetta
Ceux qu'on n'veut pas écouter
Sound system mafia
Mafia, mafia, mafia
You might also like[Couplet 2]
J'ai esquivé la taule et la mort jusqu'à là
J'crache mon album pour les miens et les vrais scars-la
Anti-(sss) qu'à cause d'eux on peut plus parler
Anti-kisdés, à cause d'eux on veut plus s'calmer
Gamin avide, hargneux dans ma zik
Anti-tards-bâ, mon Bic aime pas les indics
XXX sur ta schneck, physique loin d'être lass-dég
J'bibi qu'mes ceaux-mor, j'ai plaqué les plaquettes
Iron, mon nom, anti-dep comme mon oncle
En rogne, j'te l'montre, papapam, papapapapam
J'raconte mon vécu ici noir et crépu
J'raconte sans dico, sans mytho, sans sil-fu

[Refrain: Iron/Uman (*2)]
Faut faire tourner le son boycotté
Sound system guérilla
On vient pour représenter
Sound system vendetta
Ceux qu'on n'veut pas écouter
Sound system mafia
Mafia, mafia, mafia

[Couplet 3]
J'suis militant comme Biko, sur l'bitume tu m'nais-co
Iron, les capos, les cafards matent et comptent
Iron du ghetto, en fer, viens pas m'quer-cro
Non, j'veux pas mourir de faim comme un chard-clo
Les flics chargent et charclent pour nous ramener en charter
Ils peuvent pas nous voir crânes sés-ra et en starter
Les flics passent, tabassent tout typé réfractaire
Ils peuvent pas nous voir en bas, bien vi-ser
[Refrain: Iron/Uman (*2)]
Faut faire tourner le son boycotté
Sound system guérilla
On vient pour représenter
Sound system vendetta
Ceux qu'on n'veut pas écouter
Sound system mafia
Mafia, mafia, mafia

[Outro]
Ha ha
Iron et Uman
Boss of Scandalz
Ha ha
Anti-médias
Eh, les médias
Fuck youEmbed"
Iron Sy,Ma Routine,"2 ContributorsMa Routine Lyrics[Refrain]
La routine m'abîme
La routine m'abîme
La routine m'abîme
Elle me tue, elle me kill

[Couplet 1]
J'viens saigner l'industrie, Iron mon blase dans ce ness-bi
J'ai trimé pour écrire, ma vie sur putain d'sque-di
J'ai trop d'trucs à dire sans jamais tho-my
Ma voix sur bandes dit la té-véri
Viens filmer où j'habite, tu verras qu'j'suis pas che-ri
La sère-mi j'côtoie chaque jour, j'déconne de rater les cours
J'aurais pu être dans une cour, avocat, comme Mansour
J'ai préféré picolé, qu'-arna, bédave, racoler
Défié ces putains d'poulets, résultat : enfermé
Comme Mummia Abu Jamal, l'autorité veut nous traumat'
On est tous filoche comme Truman
Du trou d'balle au p'tit doigt, c'est pas facile de vivre sans vail-tra
Tout s'mérite ouai mais tout s'qu'-arna
J'ai fait un choix, le mien c'est ppé-ra
La routine d'Iron Sy, moi ce grand black sans taf sans mômes
Dieu merci pas seul au monde, grace aux miens j'fais pas l'aumône
Grâce à vous, j'danse dans l'ombre
J'garde mon âme, mon art, mon nom, S-Y face aux colons
J'viens reprendre mon dû mon trône
Face aux dec', j'pète mon cône
You might also like[Refrain]
La routine m'abîme
La routine m'abîme
La routine m'abîme
Elle me tue, elle me kill

[Couplet 2]
Iron Iron S.Y aime pas la cèce et les fillettes
J'préfère raquer ou la pougnette
Jusqu'ici j'bouffe pas de miettes, j'rappe pas pour serrer des chicken
Merci à mes rent-p's j'ai une bonne dégaine
Jamais j'me déguise pour qu'-en
Moi le gal-Sén' j'ai dix chiennes là-bas qui m'attendent au bled
Ainsi qu'ma tombe et mon bête, mes frères mes sœurs et mon sort
Si je vesqui c'est en scrèd', accompagné d'ma daronne
Ma mille-fa mon entourage, 100% né dans l'courage
Nous on est noirs sans cirage
Marre d'en bas, j'veux être en haut
Marre des halls où y a trop de tours-vau, la routine m'a trop qué-cro
Faut qu'j'men sorte sans cer-su
Iron Sy, Iron Sy, archi archi hétéro
On ** comme mes cailles, chez nous on se fait pas taro
Iron Sy, Iron Sy, ainsi j'me nomme mon frérot
Iron Sy, Iron Sy, moi j'suis vrai depuis l'préau

[Refrain]
La routine m'abîme
La routine m'abîme
La routine m'abîme
Elle me tue, elle me killEmbed"
Iron Sy,Même si,"3 ContributorsMême si Lyrics[Couplet 1 : Kaaris]
Lyrical front kick pour tous et les putes cherchent leur ...
J'suis venu seul j'ai fait le tour et je compte repartir seul
Carabine et drogue c'est le seul tracé de mon destin
... quand je parasite les prods
Je transite entre le bien et le mal dans un angle acharné
Je prends vite un ton hivernal parce que ma sortie s'amorce
Blеssante dure et strеssante comme un ongle incarné
Depuis le début muni d'un franc parler
Parce qu'entre la vie et la mort y'a qu'un cran d'arrêt
J'suis qu'un grand taré du droit chemin un peu plus écarté
Ma vie interdiction ... des cuisses écartées avec un gland barré
Et elle est belle ce que les autres mesurent
Avant que l'infini éteigne l'étoile de ma rage éternelle
J'suis venu pour démesurer ce que les autres mesurent

[Couplet 2 : Iron Sy]
À m'entendre vrai ouais ça rassure à fond
Mais en vrai je me morfonds à écrire des morceaux
...
Ça pue et ça fouette comme Pascal Obispo

[Refrain : Kaaris]
Même si nos thèmes tergiversent même si nos haines restent diverses
Les opposés s'attirent les opposants ça tue
...
Mon petit doigt me dit toujours quand lever le grand
Même si nos thèmes tergiversent même si nos haines restent diverses
Les opposés s'attirent les opposants ça tue
...
Mon petit doigt me dit toujours quand lever le grand
You might also like[Couplet 3 : Eben]
Tu sais j'avance même si c'est la merde en France
...

[Couplet 4 : Kaaris]
Parce qu'y'a rien de vrai rien de faux beaucoup de virages et juste des reflets
Je m'estime pas être brave juste une basse grave
Reufré écoute ça le fait
Parce que trompeurs sont nos rappels comme le visage ...
Avant d'entendre chut ... enfant de pute
C'est pas du rap que je te vends c'est un front kick avec des pansements
Chaud devant y'a une mine antipersonnelle avec des prothèses dedans
Négro il faut que tu protèges tes dents ...
Je t'avais prévenu que je serai plus dangereux que prévu
Fresh sur l'ampli

[Refrain : Kaaris]
Même si nos thèmes tergiversent même si nos haines restent diverses
Les opposés s'attirent les opposants ça tue
...
Mon petit doigt me dit toujours de ne pas lever le grand
Même si nos thèmes tergiversent même si nos haines restent diverses
Les opposés s'attirent les opposants ça tue
...
Mon petit doigt me dit toujours de ne pas lever le grand
[Couplet 5 : Iron Sy]
...
De résine chargée je tire pas je vide mon chargeur
Je viens poser high high

[Couplet 6 : Eben]
J'ai la rage j'suis un bonhomme
...
Ferme ta gueule Niroshima relève ton zgegEmbed"
