Artist,Title,Lyrics
Jamal Thioune,Oh yeah,"19 ContributorsOh yeah Lyrics[Intro]
Hey hey
Ah gars

[Couplet 1]
Moi, j'vis ma vie comme une rockstar (hey)
Passe a Répu', c'est un drugstore (slay)
J'serai le pire de tes cauchemars (ouh)
Toi, tu fais l'plug mais tu comates
À c'qui parait t'aimes pas mais tu commentes (hey)
Tu rages si le textile est en camo
Ah gars, baise ta mère
Petit, j'vendais mon teh dans des espaces verts
J'connais aucun négro qui se laissera faire
Fuck tes messes basses, t'es qué-blo dans les starters
J'vais coké la pogo, j'écrase les pheners
Faut j'reste peace sinon j'vais trop accélérer
Rembourse vite tu dépasses le délai
J'arrive pas à vivre en buvant que de l'eau
T'es un faux négro, j'sais qu'tu vends que dalle
J'manque de cash, j'crois qu'j'vais drop la tape (ah gars)
Faut qu'j'arrête de lean si j'veux pas die à 27
Ça fait 10 ans qu'tu rappes, t'as pas avancé

[Refrain]
Ah gars, ah gars, ouh
J'suis dans l'aqua, j'ai mon taga, j'roule
Ça fait longtemps que je flex
Zéro message dans mes textes, oh yeah
Mets en beaucoup dans le space cake
J'la calcule que pour ses fesses, oh yeah
20 Phenergan dans la 'teille, hey
Toute le semaine j'suis en week-end, oh yeah
J'les vois parler pour du Bape, hey
Invaincu toute la compet', oh yeah
You might also like[Pont]
J'ai d'la bonne drogue, ouais, j'suis fucked-up
J'ai d'la bonne drogue, ouais, j'suis fucked-up
J'ai d'la bonne drogue, ouais, j'suis fucked-up
J'ai d'la bonne drogue, ouais, j'suis fucked-up

[Couplet 2]
J'pète un teh, j'tire dessus
J'les fume, je change de cible (pwu pwu)
T'es l'dernier d'mes soucis, j'te crois pas quand tu nies (nan, nan)
J'prépare tout en soum-soum, c'est moi dans la cuisine
J'suis partout dans deux piges, pour l'instant on survit, slay, slay
Dans ma banane tout mes outils, Sharingané comme un Uchiha
Couteau d'cuisine dans l'bout d'shit, hey
J'arrête que quand j'suis full Gucci, yah
Elle veut que j'bousille sa pussy, hey
Elle a craqué premier d'coup d'fil, yah
Petit, j'étais fan de Tunechi
Aujourd'hui les petits sont fans de Youv Dee (ah gars)
On va péter, tout défoncer sous tequila (slay)
Sous le sap t'as reconnu l'autocollant (ah gars)
C'est l'cartel de Met du lean, nan, c'est pas Cali (hey)
Toute la journée, j'fais que fumer du chocolat (hey)
J'ai l'meilleur équipage, on va tous les couler (hey)
J'veux des pétasses, des billets de toutes les couleurs (hey)
Y'a les médicaments qui coulent par le goulot (slay)
T'es au courant, maintenant va te faire enculer (ah gars)
[Refrain]
Ça fait longtemps que je flex
Zéro message dans mes textes, oh yeah
Mets en beaucoup dans le space cake
J'la calcule que pour ses fesses, oh yeah
20 Phenergan dans la 'teille, hey
Toute le semaine j'suis en week-end, oh yeah
J'les vois parler pour du Bape, hey
Invaincu toute la compet', oh yeah
Ça fait longtemps que je flex
Zéro message dans mes textes, oh yeah
Mets en beaucoup dans le space cake
J'la calcule que pour ses fesses, oh yeah
20 Phernergan dans la 'teille, hey
Toute le semaine j'suis en week-end, oh yeah
J'les vois parler pour du Bape, hey
Invaincu toute la compet', oh yeah

[Pont]
J'ai d'la bonne drogue, ouais, j'suis fucked-up
J'ai d'la bonne drogue, ouais, j'suis fucked-up
J'ai d'la bonne drogue, ouais, j'suis fucked-up
J'ai d'la bonne drogue, ouais, j'suis fucked-upEmbed"
Jamal Thioune,Ok Hey !,"9 ContributorsOk Hey ! Lyrics[Intro]
Olda
Slay, slay
Eyyy
Ah gars, ah gars
Ah gars, ah gars
Ah gars, ah gars
Slay slay, hey, let go

[Pré-refrain]
J'suis dans mes bails, j’ai pas changé pour du buzz
Tous tes rappeurs, ils bluffent
Ils sont tous die, y'a que Youv Dee qui fait d'la peuf
Personne va prendre ma place
Hood story, tous les jours, j’suis sous shit
Tous les jours, j'suis sous kush
Bébé sorry, j'suis focus sur mon biff
J'suis focus sur ma maille

[Refrain]
Ok hey
J'les vois copier Monkey, hey
Despi, j'call le banquier, hey
Gucci ou Versace, hey
Du biff, j'en veux beaucoup, hey
J'suis dans mon bendo, j’attends la paye
J’dois faire des euros, des dollars hey
J'suis dans mon bendo, j’attends la paye
J'dois faire des euros, des dollars hey
You might also like[Couplet 1]
J'suis dans mon bendo, j'attends la paye
J’dois faire des euros, des dollars hey
Ils ont pas TT la première tape
Ils ont enfin compris que j'allais les ken
J'suis dans mon bendo avec le gang
J'ai vicé la dernière collab, hey
Négro, j'suis un Super Saiyan, hey
J'suis bien plus fort que ces connards hey
J'crois que la pute veux sexe now
Elle a kiffé sur le face tat
Fausse vu faux comme fake stats
Ils veulent ma peau comme 6ix9ine
J'suis pas comme eux, j'suis spécial
Poto guette comment tu t'sappes
Encore une prod et j'tue ça
Tu fais crari, t'es pas trixma hey
Que des actrices dans c'truc là hey
Suce mais faux, tu maîtrises pas
J'mets des tempêtes comme Chrysler
J'mets trois points comme Chris Bosh
Que du vrais, ici, on triche pas
On s'croise, y'a ta go qui s'tord
Doucement, on met la distance
Dans l'rap, je sème la discorde
[Pré-refrain]
J'suis dans mes bails, j'ai pas changé pour du buzz
Tous tes rappeurs, ils bluffent
Ils sont tous die, y'a que Youv Dee qui fait d'la peuf
Personne va prendre ma place
Hood story, tous les jours, j'suis sous shit
Tous les jours, j'suis sous kush
Bébé sorry, j'suis focus sur mon biff
J'suis focus sur ma maille

[Refrain]
Ok hey
J'les vois copier Monkey, hey
Despi, j'call le banquier, hey
Gucci ou Versace, hey
Du biff, j'en veux beaucoup, hey
J'suis dans mon bendo, j'attends la paye
J'dois faire des euros, des dollars hey
J'suis dans mon bendo, j'attends la paye
J'dois faire des euros, des dollars hey
J'les vois copier Monkey, hey
Despi, j'call le banquier, hey
Gucci ou Versace, hey
Du biff, j'en veux beaucoup, hey
J'suis dans mon bendo, j'attends la paye
J'dois faire des euros, des dollars hey
J'suis dans mon bendo, j'attends la paye
J'dois faire des euros, des dollars hey
[Couplet 2]
J'ai pas l'souvenir de mes rêves
J'donne ma confiance qu'à mes khey
2k pour me booker, j'mets 1k dans une nouvelle paire
Viens pas ici pour gratter la fame
Viens pas ici pour faire copain, hey
Viens pas sucer, viens pas faire pareil
On a tous rodav la copie
J'suis sur le côté, ma bite et mon couteau
Concu' accroupie, j'suis pas sous côté
Nan j'suis pas sur l'côté, j'suis dans tes écouteurs
Et dans ceux d'une groupie, poto j'ai compris hey
J'fais les sous escompté
Vêtements coûteux, pute laisse tomber, pourquoi t'oppresses mon tel ?
J'pète mon teh, tout est carré, j'enfume l'hôtel
J'suis sur Paris sans prise de tête
Gros, j'suis préparé depuis longtemps
Ok hey, viens pas parachute dans mes diez
Fais pas crari tu connais hey
Bientôt les carats sont sur les dents

[Pré-refrain]
J'suis dans mes bails, j'ai pas changé pour du buzz
Tous tes rappeurs, ils bluffent
Ils sont tous die, y'a que Youv Dee qui fait d'la peuf
Personne va prendre ma place
Hood story, tous les jours, j'suis sous shit
Tous les jours, j'suis sous kush
Bébé sorry, j'suis focus sur mon biff
J'suis focus sur ma maille

[Refrain]
Ok hey
J'les vois copier Monkey, hey
Despi, j'call le banquier, hey
Gucci ou Versace, hey
Du biff, j'en veux beaucoup, hey
J'suis dans mon bendo, j'attends la paye
J'dois faire des euros, des dollars hey
J'suis dans mon bendo, j'attends la paye
J'dois faire des euros, des dollars hey
J'les vois copier Monkey, hey
Despi, j'call le banquier, hey
Gucci ou Versace, hey
Du biff, j'en veux beaucoup, hey
J'suis dans mon bendo, j'attends la paye
J'dois faire des euros, des dollars hey
J'suis dans mon bendo, j'attends la paye
J'dois faire des euros, des dollars heyEmbed"
Jamal Thioune,Opening,"29 ContributorsOpening Lyrics[Paroles de ""Opening""]

[Intro]
Slay, hey
Ah gars
Slay, slay, slay
ODP, Youv Dee, Gear second

[Refrain]
J'suis dans mon bendo
Pas de semi, dans mon bedo, oh yeah
Prends ta semoule, prends ta salade, prends ton sirop, oh yeah
Je bois peu d'eau, j'suis un peu lean, que d'la guedro, oh yeah
Je vois personne devant, aucune concu' négro, oh yeah
J'suis dans mon bendo
Pas de semi, dans mon bedo, oh yeah
Prends ta semoule, prends ta salade, prends ton sirop, oh yeah
Je bois peu d'eau, j'suis un peu lean, que d'la guedro, oh yeah
Je vois personne devant, aucune concu' négro, oh yeah

[Couplet 1]
J'suis différent, Monkey D. Luffy
Tu sais que Youv Dee, c'est le pire
On sait quand t'as découvert l'Euphon
Les tits-pe maintenant veulent faire les fous
J'devrais faire la mala au lieu d'faire les sous
Tu fais que mentir sur les réseaux
Tout devient noir quand je crache le feu
Black Itachi Amaterasu
Fuck vos vues, j'fuck le jeu (hey)
Moi j'bosse mon truc, j'sais c'que j'veux, boy
J'serais jamais dans leurs mauvais bails
Petit, j'savais qu'j'allais faire du sale
J'fume le shit, j'fume la beuh
Ah gars, trop de de-spee, j'suis dangereux
C'est pas pareil, ne nous compare pas
On les connait en vrai, c'est mieux qu'on parle peu
Gucci, Gucci, Gucci, Gucci
Elle veut le Dee dans sa pussy (ya)
Que du vrai, nous pas du crari
J'crois qu'elle me prend pour un cain-ri ay
J'suis impatient, j'veux tout tout d'suite
Doubler l'argent ou faire le triple
Bientôt, c'est cuit, j'vais drop la tape
Tire sur mon joint, tu vas bad-trip (ay)
You might also like[Pont]
Gear, second, ay (slay)
Gear, second, ay (slay)
Gear, second, ay (slay)

[Refrain]
J'suis dans mon bendo
Pas de semi, dans mon bedo, oh yeah
Prends ta semoule, prends ta salade, prends ton sirop, oh yeah
Je bois peu d'eau, j'suis un peu lin, que d'la guedro, oh yeah
Je vois personne devant, aucune concu' négro, oh yeah
J'suis dans mon bendo
Pas de semi, dans mon bedo, oh yeah
Prends ta semoule, prends ta salade, prends ton sirop, oh yeah
Je bois peu d'eau, j'suis un peu lin, que d'la guedro, oh yeah
Je vois personne devant, aucune concu' négro, oh yeah

[Couplet 2]
Hey
J'tape une mission avec Zoro et Brook
Que des rageux, tout tes potos sont broke
O.D.P, j'sais que tu connais mon groupe
Si tu connais pas, demande à ta pute
Si tu connais pas, demande à tes potes
À peine debout, j'roule un joint, j'me la bute
Dans tous les cas, je dois finir au top
Donc tout les soirs j'dois finir au stud'
Gaddem, ça pogote sale
J'ramène ma po-po, ay
J'appelle le sang, le squad
Ça met la nitro, hm
Captain de l'équipage
Sarcelles, S-B on sait
À peine je fais un bail
Ça veut d'jà sucer, slay
Youv Dee, Donatello, bientôt dans ta télé
J'dois te le rappeller, ay
On fait des pogos nous, on fait des photos mais c'est même pas calculé, ay
J'crois que mes potos, moi, j'crois que mes fréros, moi, j'crois ma family, ay, ay
Frappe dans le bédo, j'ai tout dans mon joggo, il faut qu'on rentabilise, ay
O-D, O-D, O-D, O.D.P
T'inquiètes pas, on en est qu'au début
Tout va bien ici tant qu'ça débite
Tu veux quelqu'chose, passes à Répu'
Promis bientôt, j'envoie les missiles
J't'ai rodave de loin, t'es comme les vils-ci
Tu rappes mais ton flow n'est pas legit
Moi, j'en connais beaucoup qui ne parlent plus
[Pont]
Gear, second, ay (slay)
Gear, second, ay (slay)
Gear, second, ay3Embed"
Jamal Thioune,Pas d’Accord !,"4 ContributorsPas d’Accord ! Lyrics[Paroles de ""Pas d'Accord !""]

[Couplet 1]
Chaque soir, je fais le même rêve
D'espoir, de héros de shonen
L'histoire toujours se répète
Pourquoi j'ai que les mêmes problèmes ?
Tu veux la vérité ?
Mais qui détient la vérité vraie
C'est dur à vérifier
Tout l'monde a ses idées, tout l'monde se veut l'héritier

[Pré-refrain]
J'espère que tu m'en veux pas
En vrai, j'ai rien d'exceptionnel
J'suis chelou, un peu bizarre
Je sais, normal

[Refrain]
Parce que j'suis pas d'accord, pas d'accord, pas d'accord, pas d'accord
Pas d'accord, pas d'accord avec eux
Parce que j'suis pas d'accord, pas d'accord, pas d'accord, pas d'accord
Pas d'accord, pas d'accord avec eux

[Couplet 2]
Bébé j'vais pas t'faire un dessin
J'ai vu la couleur dans tes yeux
J'aime quand tu montes et tu descends
Quand on va visiter les cieux à deux
Une belle inconnue, d'un coup, m'interpelle
De la cocaïne, dans un sac Chanel
Du coup j'ai ghosté la première et next
J'aurais préféré vivre sans Internet
You might also like[Pré-refrain]
J'espère que tu m'en veux pas
En vrai, j'ai rien d'exceptionnel
J'suis chelou, un peu bizarre
Je sais, normal

[Refrain]
Parce que j'suis pas d'accord, pas d'accord, pas d'accord, pas d'accord
Pas d'accord, pas d'accord avec eux
Parce que j'suis pas d'accord, pas d'accord, pas d'accord, pas d'accord
Pas d'accord, pas d'accord avec euxEmbed"
Jamal Thioune,Pas le time,"4 ContributorsPas le time Lyrics[Couplet 1]
J'connais les dièses sur moi, tu vas pas gratter du buzz
J'finis d'les baiser bébé, après j'peux faire une pause
J'consomme que les meilleurs pilons et les meilleures kushs
Parti de rien mais bien parti pour finir en boss
J'ai pas le choix de les fuck, j'crois qu'j'me suis trompé d'époque
J'suis bon qu'à rapper et encaisser des chèques, j'suis bon qu'à rouler du shit
Tout tes projets condamnés à l'échec, monnaie, monnaie, monnaie chaque jour
Nouveau flow et nouveau track, donc nouveau projet coffré dans l'four
Plus rien à faire dans la street
Là, j'suis à Paris, j'fais mon fric
Y'a que mes vrais dans ma clique, ils vont inventer des vies
Poto c'est automatique, tu vois la montée des vues
Donc tu vois la montée des haineux, Monkey D. Youv, il est béni
J'vais tous les baiser sans peine, j'suis dans mes trucs, hey
Non on fait pas la même trap, hey (yah)
Pas les mêmes vies, pas les même buts, pas les même raps, hey

[Pré-refrain]
Et j'suis toujours dans mes bails, j'vois personne qu'est de taille
Non, personne qu'est de taille
Elle voudrait qu'on se capte, mais j'ai studio ce soir
Non, j'n'aurai pas le time, non, j'n'aurai pas le time

[Refrain]
Et j'n'aurai pas le time, non, j'n'aurai pas le time
J'n'aurai pas le time, non, j'n'aurai pas le time
J'n'aurai pas le time, j'n'aurai pas le time
Non, j'n'aurai pas le time, non, j'n'aurai pas le time
Et j'n'aurai pas le time, non, j'n'aurai pas le time
Et j'n'aurai pas le time, non, j'n'aurai pas le time
J'n'aurai pas le time, j'n'aurai pas le time
Non, j'n'aurai pas le time, non, j'n'aurai pas le time
You might also like[Couplet 2]
Y'a ceux qui parlent, y'a ceux qui font,y'a ceux qui maillent, y'a ceux qui tombent
Y'a ceux qui taillent, y'a ceux qui montent, y'a ceux qui innovent et y'a ceux qui pompent
Y'a ceux qui graillent, y'a ceux qui comptent, y'a ceux qui die, y'a ceux qui montrent
Et puis, y'a ceux qui cachent, y'a ceux qui roulent, y'a ceux qui calcinent, et y'a ceux qui pioncent
Y'a ceux qui ont et y'a ceux qui mentent, y'a ceux qui passent et  y'a ceux qui restent
Moi, j'suis dans la course et j'suis en avance, j'peux re-sortir tous mes sons d'avant
Y'a ceux qui streament, y'a ceux qui flop et puis, y'a ceux qui trichent, y'a ceux qui job
Et puis, y'a ceux qui snitch, y'a ceux qui copient mais on sait qu'ils kiffent, hey (ah gars)

[Pré-refrain]
Et j'suis toujours dans mes bails, j'vois personne qu'est de taille
Non, personne qu'est de taille
Elle voudrait qu'on se capte, mais j'ai studio ce soir
Non, j'n'aurai pas le time, non, j'n'aurai pas le time

[Refrain]
Et j'n'aurai pas le time, non, j'n'aurai pas le time
J'n'aurai pas le time, non, j'n'aurai pas le time
J'n'aurai pas le time, j'n'aurai pas le time
Non, j'n'aurai pas le time, non, j'n'aurai pas le time
Et j'n'aurai pas le time, non, j'n'aurai pas le time
Et j'n'aurai pas le time, non, j'n'aurai pas le time
J'n'aurai pas le time, j'n'aurai pas le time
Non, j'n'aurai pas le time, non, j'n'aurai pas le timeEmbed"
Jamal Thioune,Personne,"15 ContributorsPersonne Lyrics[Paroles de ""Personne""]

[Intro]
Youv Dee, Mem's
On veut La Vie De Luxe

[Couplet  1]
Encore un matin j’ai la pâteuse, nan des comme moi y en a pas deux
On m'a dit l'or fait pas de cadeau, j’ai du diriger le bateau
On le fait, on oublie le monde, respiration est saccadée
Réussir les objectifs à temps, pas freiner pendant la montée
J'suis pas ton poto, crois pas, j't'ai que follow
Maint'nant ça finit pas avec ses fogos
Tu m'verras jamais refuser des photos
Tu m'verras jamais en concert sans pogos
Yeah, j'suis obligé dе le faire
J’étais petit quand j’ai vеs-qui les barreaux
Elle monte sur moi pour me donner la parole
Elle kiffe venir dans mon appart' à Paris
On fait les grosses sommes donc on consomme et on respecte plus les consignes
Elle veut qu’on zone, elle veut qu'on s'aime mais moi j'aime bien quand c’est concis
Tu veux parler de moi, parler de nous, parler en mal
Moi je suis loin, moi je suis Youv, roi des pirates

[Pré-refrain]
J'suis obligé-bligé-bligé de le faire
Sinon personne, personne, personne pourra, yeah
J'suis obligé-bligé-bligé de le faire
Sinon personne, personne, personne pourra, yeah
You might also like[Refrain]
Personne, personne
J'ai besoin de personne, personne
Je dois faire de belles sommes, belles sommes
J'ai besoin de personne, personne
Personne, personne
J'ai besoin de personne, personne
Je dois faire de belles sommes, belles sommes
J'ai besoin de personne, personne

[Couplet 2]
Deux, trois rres-ve, j'sens plus la fatigue, tellement de choses qu'on a pas dit
La gloire et l'argent dans un caddie, j'vais faire les caisses automatiques
C'est plus comme avant, on a grandi, on a des quittances de loyer
Pourquoi j'vais te dire que j'ai vendu ? La daronne écoute les projets
Au final t'as compris que c'était trop chaud
Personne viendra parasiter mon trajet
Force à Sheldon et aux anciens du dojo
On a beaucoup trop d'objectifs à cocher, hey
Tu m'verras jamais mentir
J'ai que des bons et des vrais qui m'entourent
Bientôt c'est bon, j'crois que j'ai fait le tour
Bientôt c'est bon, j'fais le tour de la Terre
J'suis encore fonce-dé, j'ai des visions où j'fais des sous et des milliers
J'suis dans ma tête, dans mon vaisseau avec l'alcool dans la vessie
Tu peux avoir le mort, j'm'en bat les couilles totalement
J'suis dans le game et j'fais des sous et je vis bien
[Pré-refrain]
J'suis obligé-bligé-bligé de le faire
Sinon personne, personne, personne pourra, yeah
J'suis obligé-bligé-bligé de le faire
Sinon personne, personne, personne pourra, yeah
Personne, personne
J'ai besoin de personne, personne
Personne, personne
J'ai besoin de personne, personne

[Refrain]
Personne, personne
J'ai besoin de personne, personne
Je dois faire de belles sommes, belles sommes
J'ai besoin de personne, personne
Personne, personne
J'ai besoin de personne, personne
Je dois faire de belles sommes, belles sommes
J'ai besoin de personne, personne

[Outro]
On veut La Vie De Luxe
C'est chaud bâtard
Youv Dee, slayEmbed"
Jamal Thioune,Petit à petit,"6 ContributorsPetit à petit Lyrics[Paroles de ""Petit à petit""]

[Intro]
Skuna boi

[Couplet 1]
J'ai pas changé, moi, j'suis comme à l'ancienne, j'avais deux-trois bails en tête (tête)
Voir autres choses que le tieks (tieks), j'vais pas m'contenter des miettes (miettes)
J'suis dans ma chrysalide et bientôt, j'allume la dynamite
Fais pas genre que c'est une nouveauté, on l'a fait bien avant qu't'y arrives
Tu veux m'égaler, c'est niet, on m'a désigné
Quelqu'un a égaré les bêtes, j'dois revenir pour les guider
J'suis sur le chemin de ma quête et j'en arrive au terme
Ouais entre nous, ça peut coller, les messa' entre parenthèses

[Pré-refrain]
Toi, tu veux tenir le guidon, faire des bêtises dans les buissons
T'es pas la même quand je suis là, j'descends la bouteille de Ruinart
Tu sais, les autres, c'est des pigeons, tu sais que nous, c'est les pirates
C'est pire que Dupont et Dupond, si tu me kiffes, ne le dis pas

[Refrain]
On arrive petit à petit, j'prends le gâteau, bon appétit
Elle veut voir personne à part moi, avec moi, c'est pas d'la parlote
Wesh, elle m'a pris pour sa tétine, t'aimes quand l'amour est synthétique
Et tout ça t'a rendu parano, tu penses à ça même en dormant
On arrive petit à petit, j'prends le gâteau, bon appétit
Elle veut voir personne à part moi, avec moi, c'est pas d'la parlote
Wesh, elle m'a pris pour sa tétine, t'aimes quand l'amour est synthétique
Et tout ça t'a rendu parano, tu penses à ça même en dormant
You might also like[Couplet 2]
J'dors pas, j'assimile, j'fume que d'la semoule
Que du bon te-shi, tout mou et tout jaune
J'ai de grands projets pour mes deux poignets
Une Rolex à dix mille, une Audemars à quarante
J'ai taffé, comblé mes carences, j'viens te chercher dans un carrosse
J'sens la douceur de tes caresses mais des fois, la vie, c'est pas rose
J'suis le meilleur à c'qu'il parait, c'est aussi c'que disent mes parents
Tu fais que parler, faut qu't'arrêtes

[Pré-refrain]
Toi, tu veux tenir le guidon, faire des bêtises dans les buissons
T'es pas la même quand je suis là, j'descends la bouteille de Ruinart
Tu sais, les autres, c'est des pigeons, tu sais que nous, c'est les pirates
C'est pire que Dupont et Dupond, si tu me kiffes, ne le dis pas

[Refrain]
On arrive petit à petit, j'prends le gâteau, bon appétit
Elle veut voir personne à part moi, avec moi, c'est pas d'la parlote
Wesh, elle m'a pris pour sa tétine, t'aimes quand l'amour est synthétique
Et tout ça t'a rendu parano, tu penses à ça même en dormant
On arrive petit à petit, j'prends le gâteau, bon appétit
Elle veut voir personne à part moi, avec moi, c'est pas d'la parlote
Wesh, elle m'a pris pour sa tétine, t'aimes quand l'amour est synthétique
Et tout ça t'a rendu parano, tu penses à ça même en dormant
[Outro]
On arrive petit à petit, j'prends le gâteau, bon appétit
Elle veut voir personne à part moi, avec moi, c'est pas d'la parlote
Wesh, elle m'a pris pour sa tétine, t'aimes quand l'amour est synthétique
Et tout ça t'a rendu parano, tu penses à ça même en dormantEmbed"
Jamal Thioune,Pocket,"5 ContributorsPocket Lyrics[Paroles de ""Pocket""]

[Intro]
Ah gars
Yeah, yeah, hey

[Pré-Refrain]
J'perds le contrôle de ma folie, t'es un ancien modèle, j'suis un bolide
Arrache ta mère, j'suis impoli, attends j'reçois d'la ppe-fra par colis
Vivre et mourir pour la money, j'ai un nouveau contrat je dis ""Oh oui""
Encore un connard qui m'envie, tu m'as cassé les couilles, j'te laisse en vu

[Refrain]
J'ai une liasse de billets dans ma pocket, bébé y a que mes sous que je protège
Personne ici était ok, j'ai du rentrer dans le rap sans toquer
J'ai une liasse de billets dans ma pocket, bébé y a que mes sous que je protège
Personne ici était ok, j'ai du rentrer dans le rap sans toquer

[Couplet unique]
Poto, c'est fini les conneries, que la miff only
Me compare pas à ces thos-my, j'ai pas changé pour devenir connu
Elle attend même pas qu'on se mette au lit, putain quel ennui
J'ai un avion à péter à Orly, j'vais gratter sur du Skuna, du Tommy
J'me sentais pas bien j'ai vidé tout l'shop, j'fais le tour de la terre grâce à mon job
Trop différent, ça leur fout l'mort, à chaque fois que j'reviens, le retour choque
J'prends le temps, j'vais les effacer doucement, en vrai ça fait longtemps, j'les ai tous fuck
Désolé de la place qu'on prend mais j'vais m'arrêter que quand j'ai tout smoke
Hey, baisse d'un ton, connard, pourquoi t'as des face tattoos ?
Fais pas crari t'es la Gestapo, on sait qu'en vrai toi, tu pèses pas trop
Qu'est-c't'as ? Tu perds patience, si on le fait nous, c'est par passion
J'raconterai pas mes arrestations et si j'veux, moi j'y vais à fond
You might also like[Pré-Refrain]
J'perds le contrôle de ma folie, t'es un ancien modèle, j'suis un bolide
Arrache ta mère, j'suis impoli, attends j'reçois d'la ppe-fra par colis
Vivre et mourir pour la money, j'ai un nouveau contrat je dis ""Oh oui""
Encore un connard qui m'envie, tu m'as cassé les couilles, j'te laisse en vu

[Refrain]
J'ai une liasse de billets dans ma pocket, bébé y a que mes sous que je protège
Personne ici était ok, j'ai du rentrer dans le rap sans toquer
J'ai une liasse de billets dans ma pocket, bébé y a que mes sous que je protège
Personne ici était ok, j'ai du rentrer dans le rap sans toquer

[Outro]
Yeah, yeah
Yeah, yeah
Yeah, yeahEmbed"
