Artist,Title,Lyrics
Jamal Thioune,E-Girl,"1 ContributorE-Girl Lyrics[Refrain]
Yeah yeah yeah
J'veux une E-Girl qui fait des stream sur lol ouais
E-Girl qui fait des TikTok drôles
J'veux une E-Girl qui as des oreilles de chat
J'veux une E-Girl qui as des cosplay d'Ochaco

[Couplet]
La vie de ma mère j'veux ma E-Girl pour la night
Baby mama j'veux ma E-Girl pour la life
Bebe j'vais manger ton petit coeur j'ai la dalle
J'entends le mien qui fait ""Boum Boum"" j'dis ""Slay Slay Slay Slay!""

Baby mama j'suis comme Denzel, j'ai la dégaine oh yeah yeah
Babe j'ai tous les ustеnsiles, ouais j'ai tout sur moi yeah yeah
Toutе l'année j'sais pas trop ou donner de la te-té
J'devrais déconnecter

[Refrain]
J'veux une E-Girl qui fait des stream sur lol ouais
E-Girl qui fait des TikTok drôles
J'veux une E-Girl qui as des oreilles de chat
J'veux une E-Girl qui as des cosplay d'Ochaco
E-Girl qui fait des stream sur lol ouais
J'veux une E-Girl qui fait des TikTok drôles ouais
E-Girl qui as des oreilles de chat
J'veux une E-Girl qui as des cosplay d'OchacoYou might also likeEmbed"
Jamal Thioune,Ending,"12 ContributorsEnding Lyrics[Intro]
Hey, hey, slay
Hey, hey, hey
Ah gars, ah gars
Dans c'truc, j'suis à se-lai

[Couplet 1 : Youv Dee]
Dans c'truc, j'suis à se-lai
Grosse barre sur mon pilon
J'regarde par la fenêtre
Y'a les shtars, mauvais bilan
Elle veut qu'j'la bourre, j'ai dit non parce que elle veut d'l'amour aussi ouais
Range tes atouts, des meufs comme toi, y'en a partout dans l'village
J'suis prêt à tout, fuck ton parcours
Tu t'étouffes avec ton backwoods
Moi, mon cartel est pire qu'un four
Balle dans la tête sur le carrefour
Chez nous la fête, c'est tout les jours
Rappelle-toi quand tu doutais d'ODP
T'es sur les réseaux, tu fais l'fou
Tu mérites missile, tête, homicide
J'visite tes orifices
Miskine je sais que j'leur fou la haine
Ici, le week-end, c'est toute la semaine
Youv Dee, j'fais la diff
J'mets le coco, j'veux la nitro
J'suis bien, j'fuck leur thérapie
J'en ai mis trop dans la popo comme d'hab, chaque jour j'fais ma lean
You might also like[Refrain : Youv Dee]
Que des vrais G dans l'équipe
Dix Phernergan dans le cup
Rend nous l'argent, on est quitte
J'vois pas ma vie sans liquide
Que des vrais G dans l'équipe
Dix Phernergan dans le cup
Rend nous l'argent, on est quitte
J'vois pas ma vie sans liquide

[Couplet 2 : Arsn]
Gras shit dans la massa mec
J'vais faire le biff et l'oseille
Bad bitch sur la maya, ouais
Ça pipe dans la mafia, ouais
Rapide comme la McLaren
J'vais faire le biff et l'oseille
Ça tise dans un appart'
Ça tire dans ta face
Navigue dans la voie lactée, ça lean sur la paille
Traduis quand j'ai pas la tête
J'veux ta miss sur l'matelas
Gratuit nan, c'est pas la fête
J'suis khalass pour le caramel mais j'attise le mal gars
La tactique se maintient
J'veux la rrari', la scuderia
Que t'analyse mes couplets
Fume le haschich et [?]
T'es pas rapides, j't'ai doublé
J'ai le gras shit les boulettes
Tu parles musique, tu parles amical
Mais j'veux qu'le febi, les zoulettes (ouais)
Grosse amnésie, j'fume la sativa
[Refrain : Youv Dee]
Que des vrais G dans l'équipe
Dix Phernergan dans le cup
Rend nous l'argent, on est quitte
J'vois pas ma vie sans liquide
Que des vrais G dans l'équipe
Dix Phernergan dans le cup
Rend nous l'argent, on est quitte
J'vois pas ma vie sans liquide
Que des vrais G dans l'équipe
Dix Phernergan dans le cup
Rend nous l'argent, on est quitte
J'vois pas ma vie sans liquide
Que des vrais G dans l'équipe
Dix Phernergan dans le cup
Rend nous l'argent, on est quitte
J'vois pas ma vie sans liquide

[Couplet 3 : Sirap]
J'reste loin d'eux mais j'suis tout près
Un pied dans l'van, un pied dans l'rêve
Viens on s'échappe, oui pour cette nuit, j'rêve de calme et d'tranquillité
J'suis défoncé, j'sais pas quoi faire
J'sais pas pourquoi tu m'prends la tête
J'sais pas pourquoi je perds mon temps alors casse-toi et puis arrête
Faut j'fasse le tour du Minnesota, j'prie tous les jours pour les billets
J'préfère quand ma reuss viendra m'voir sur une de mes tournées
Pour l'instant, je n'fais qu'roupiller
J'fais écouter dernières maquettes
J'fais d'la musique sans m'prendre la tête
J'prie tous les jours pour les billets
J'ai mal au crâne, j'ai 20 cachets je paie pas aux dames mais j'suis rentable
Le réseau grandi d'jour en jour, l'objectif, c'est d'se faire d'la main
J'suis bien parti pour réussir
J'suis bien parti pour tout niquer
Mes objectifs, mes projets d'vie, c'est d'oublier tout ses papiers, hey
[Refrain : Youv Dee]
Que des vrais G dans l'équipe
Dix Phernergan dans le cup
Rend nous l'argent, on est quitte
J'vois pas ma vie sans liquide
Que des vrais G dans l'équipe
Dix Phernergan dans le cup
Rend nous l'argent, on est quitte
J'vois pas ma vie sans liquide
Que des vrais G dans l'équipe
Dix Phernergan dans le cup
Rend nous l'argent, on est quitte
J'vois pas ma vie sans liquide
Que des vrais G dans l'équipe
Dix Phernergan dans le cup
Rend nous l'argent, on est quitte
J'vois pas ma vie sans liquide
Que des vrais G dans l'équipe
Dix Phernergan dans le cup
Rend nous l'argent, on est quitte
J'vois pas ma vie sans liquide1Embed"
Jamal Thioune,Enfer et paradis,"6 ContributorsEnfer et paradis Lyrics[Paroles de ""Enfer et paradis""]

[Intro]
Hmm, c'est ça, Youv Dee, hey
On veut la vie de luxe, Skuna
Yeah yeah, oh

[Refrain]
Tu m'attends du lundi au lundi
J'suis devant l'Enfer et le Paradis
J'crois qu'j'ai enfin deviné ce que tu penses mais
J'suis un gars occupé, j'serais pas ton pansement
Donc tu m'attends du lundi au lundi

[Couplet 1]
Baby mama me répète que j'suis son genre
Elle veut pas voir ses potes, m'appelle tous les jours
Dès qu'j'me réveille, j'suis concentré sur mon job
Et d'toute façon, moi, j'suis mauvais en amour (yeah, yeah)
J'crois qu'j'ai enfin deviné ce que tu penses mais
Faut devenir riche avant de devenir poussière
J'suis comme un virus pour eux, différent, j'suis toxique
J'ai pas envie de faire comme eux pour qu'on me boost, yeah
J'ai cherché les réponses (hmm)
À toutes les questions que j'me suis posé
En fumant la beuh et en sipant la potion
J'crois qu'mon cerveau mérite juste une pause
Oseille est devenue mon obsession
Ose me dire que j'ai pas d'avance
Ils font d'la musique mais sans émotion
J'étais p't-être pas fait pour la France (mmh)
You might also like[Refrain]
Tu m'attends du lundi au lundi
J'suis devant l'Enfer et le Paradis
J'crois qu'j'ai enfin deviné ce que tu penses mais
J'suis un gars occupé, j'serais pas ton pansement
Donc tu m'attends du lundi au lundi

[Couplet 2]
Enfer et Paradis, le ciel ou le sol ?
Personne va me gratter, j'me suis fait tout seul
Mourir de maladie, mourir sur la scène
Tant que j'économise, tant que j'fais des sommes
Si tu me donnes ton corps, ne me donne pas ton cœur avec
J'ai pas le temps, tocard, on avance pas avec la haine
Négro, j'suis dans l'contrôle, tu verras pas grossir ma tête
Vas-y, reste dans ton rôle, vas-y, reste dans ton hall
J'suis un business nigga, avec moi, ils ont problèmes d’ego
J'crache le feu, je les ai cramé au deuxième degré
Avant-gardiste on est, ils qualifient ça de problèmes de goût
Mais c'est la vie qu'on mène, mais c'est la vie qu'on aime

[Refrain]
Tu m'attends du lundi au lundi
J'suis devant l'Enfer et le Paradis
J'crois qu'j'ai enfin deviné ce que tu penses mais
J'suis un gars occupé, j'serais pas ton pansement
Donc tu m'attends du lundi au lundiEmbed"
Jamal Thioune,Euros,"7 ContributorsEuros Lyrics[Intro : Youv Dee]
Slay slay, hey
Slay slay, hey
Slay slay, hey
Heyyy

[Refrain : Youv Dee]
J'pète mon teh, j’vais pas t'mentir, j'attends mon tour, j’attends mon heure
Et j'suis le pire, j'leur fais peur, j'suis fait pour faire des euros
J'pète mon teh, j'vais pas t'mentir, j'attends mon tour, j’attends mon heure
Et j’suis le pire, j'leur fais peur, j’suis fait pour faire des euros faire des sous
Faire des euros, faire des sous, faire des euros, faire des sous
Faire des euros, faire des sous, faire des euros, faire des sous
Faire des euros, faire des sous, faire des euros, faire des sous
Faire des euros, faire des sous

[Couplet 1 : Diddi Trix]
J'pense qu'à faire l'argent mon gars, j’suis tous les jours dans l'illégal
Il m'faut du bif dans l'immédiat, aujourd'hui, j'ai fumé dix mégas
T'sais déjà c'est qui qui vient faire des dégâts, eux ? Oh putain qu'est c'qu'ils m'agacent
Ils sont carrément nuls, ils sont carrément nazes
J'ai toujours un bédo au bec, wo, toujours postiche chez mon pote
Toujours un bédo au bec, wo, j'ai la recette pour faire ce fric
Tout baiser c'est devenu mon tic, en plus de ça, c'est aussi dev'nu mon kiff
J'suis dans la trap, j'ai la maitrise, wo, tu cavales quand ça part en vrille, wo
J'suis fais pour faire des euros et mes fans, j'les rends heureux
Donc forcément, j'ai des haineux, big up à eux, je les aime
J'suis plutôt shiton mais ça veut pas dire qu'j'aime pas la beuh
Sors une clope et une masa, t'inquiètes même pas poto j'te fais P2
You might also like[Refrain : Youv Dee]
J'pète mon teh, j'vais pas t'mentir, j'attends mon tour, j'attends mon heure
Et j'suis le pire, j'leur fais peur, j'suis fait pour faire des euros
J'pète mon teh, j'vais pas t'mentir, j'attends mon tour, j'attends mon heure
Et j'suis le pire, j'leur fais peur, j'suis fait pour faire des euros faire des sous
Faire des euros, faire des sous, faire des euros, faire des sous
Faire des euros, faire des sous, faire des euros, faire des sous
Faire des euros, faire des sous, faire des euros, faire des sous
Faire des euros, faire des sous

[Couplet 2 : Laskiiz]
Je n'vis que pour ça, c'est l'oseille que j'poursuis
Endurant à 100%, autour de moi, aucun froussard
Que des négros cramés aux yeux défoncés, tes sourcils, tu peux les froncer
Y'a top 1, on va défoncer, tout pour le geu-ar pris pour cible
J'fais que d'y passer, dans la street jamais dispensé
J'serais le meilleur ce coup-ci, les jaloux vont maigrir comme Gucci
Sur la route du succès, ils ont sucé pour prendre des raccourcis
On te flingue et j'ai le coup de six, dans ma clique y'a pas de pussy
Nos arrestations sont musclés donc on n'a pas besoin d'pousser
J'ai reçu d'la beuh en gros, j'roule un joint avec la poussière
Ta daronne, j'la pécho dans le four, le plus choquant, c'est que t'es dans la poussette
J'suis fait pour faire des euros, j'suis fait pour faire du flouze
Ça bicrave fort, il m'faut une liasse de fou

[Refrain : Youv Dee]
J'pète mon teh, j'vais pas t'mentir, j'attends mon tour, j'attends mon heure
Et j'suis le pire, j'leur fais peur, j'suis fait pour faire des euros
J'pète mon teh, j'vais pas t'mentir, j'attends mon tour, j'attends mon heure
Et j'suis le pire, j'leur fais peur, j'suis fait pour faire des euros faire des sous
Faire des euros, faire des sous, faire des euros, faire des sous
Faire des euros, faire des sous, faire des euros, faire des sous
Faire des euros, faire des sous, faire des euros, faire des sous
Faire des euros, faire des sous
[Couplet 3 : Youv Dee]
Faire des euros faire des sous, j'dois faire des euros, faire des dollars
J'suis pas heureux, j'suis en colère, faire des euros faire des sous
Encore une qui m'traite de connard, j'suis au stud', j'dois faire mon travail
Faire des euros, faire des sous, faire des euros, faire des sous
J'dois faire des dollars, brasser ouh, la peufra dans la masa, j'tire
Tu parlais beaucoup, t'es passé où ? Avant le million, j'veux pas partir
J'ai mon teh, j'attends mon tour, j'vais tous les faire négro, j'suis plus fort
Jamais j'vais m'taire concu' j'la plie, concu' j'la r'tourne,' concu' j'la tords
Slay, j'suis posé dans l'airport, pillon avant et après les r'pas
J'suis sur Répu', j'ai rodave les porcs, j'me suis promis qu'ils m'attraperaient pas, hey
Renoi pourquoi t'es pâle ? Nous en veux pas si on bat les r'cords
Tu fais crari, on te tolère pas, négro, c'est pas la peine d'venir parler fortEmbed"
Jamal Thioune,Fallait Pas,"7 ContributorsFallait Pas Lyrics[Paroles de ""Fallait Pas""]

[Couplet 1]
Tu penses à, quoi ?
Moi je pense à nous deux, mais parlons bien parlons peu
Dis-moi si tu penses à, moi ?
En fait dis rien c'est mieux, sans toi je me sens perdu
Comme, paumé dans le système solaire
Mais j’avoue que je kiffe cette douleur
Pourquoi y a si peu d'choses que j'tolère ?
Elle voulait que j’écrive des poèmes

[Refrain]
Et fallait pas faire c'que j'pense
Ouais, fallait pas aller à contre-sens
Il fallait pas dire que j'avais raison
Pourquoi j'ai pas fait ""téléphone maison"" ?
Mais j'crois qu'il fallait pas, la-la-la
Il fallait pas mais bon, j'suis là-là-là-là
Il fallait pas, la-la-la
Il fallait pas mais bon, j’suis là-là-là-là

[Couplet 2]
Il fallait pas, mais c’est trop tard
Trois heures du matin j'suis épave, sur le comptoir
Encore des questions mais j’ai pas, les réponses
Tu penses que tu sais mieux que moi, j'te les pose pas
Ouais j'te les pose sur la gratte, j'tourne les potards
Six heures du matin j’suis épave, sur le trottoir
Promis que c'est le dernier joint, que je consomme
On n'a pas choisi la vie tranquille en costard, yeah
You might also like[Refrain]
Et fallait pas faire c'que j'pense
Ouais, fallait pas aller à contre-sens
Il fallait pas dire que j'avais raison
Pourquoi j'ai pas fait ""téléphone maison"" ?
Mais j'crois qu'il fallait pas, la-la-la
Il fallait pas mais bon, j'suis là-là-là-là
Il fallait pas, la-la-la
Il fallait pas mais bon, j'suis là-là-là-là

[Post-Refrain]
Il fallait pas faire c'que j'pense
Ouais, fallait pas aller à contre-sens
Il fallait pas dire que j'avais raison
Pourquoi j'ai pas fait ""téléphone maison"" ?
Mais j'crois qu'il fallait pas, la-la-la
Il fallait pas mais bon, j'suis là-là-là-là
Il fallait pas, la-la-la
Il fallait pas mais bon, j'suis là-là-là-là

[Outro]
Il fallait pas
Il fallait pas, la-la-la
Il fallait pas
Il fallait pas, la-la-la
Il fallait pas, la-la-la
Il fallait pas
Il fallait pas, la-la-la
Il fallait pas1Embed"
Jamal Thioune,Feeling,"6 ContributorsFeeling Lyrics[Paroles de ""Feeling""]

[Intro]
Oh, oh-oh
Oh, oh-oh
Oh, oh-oh
Oh, oh-oh

[Couplet 1]
C'est si dur de ne pas, en abuser
Qui peux me dire pourquoi ? Personne je crois
Endolori, tétanisé, j'ai froid
Si j'tends la main, dans le noir, ils viendront pour m'la couper
J'me sens vraiment seul, pas humain, carrément j'me sens d'ailleurs

[Pré-refrain]
J'y repense en tombant des cieux, j'y repense en fermant les yeux
Ce serait si dommage, j'veux pas perdre cе feeling
J'me sens bien pеndant des heures, ça change rien, j'me sens si seul
Moi j'aime le bonheur, j'veux pas perdre ce feeling
J'veux pas perdre ce feeling ( Oh )

[Refrain]
J'veux pas perdre ce feeling ( Oh )
J'veux pas perdre ce feeling ( Oh )
J'veux pas perdre ce feeling ( Oh )
J'veux pas perdre ce feeling
You might also like[Couplet 2]
Pourquoi j'sature et j'en reviens toujours au même point
Pourquoi c'qui tue me fait du bien ? J'sombre à mes dépends
J'veux pas perdre ce feeling, tout ça, ça va si vite
Et moi je minimise tout l'temps
J'ai un avantage de baisé, j'vois mon taf sans limites
J'dois viser l'infini, comprends

[Pré-refrain]
J'y repense en tombant des cieux, j'y repense en fermant les yeux
Ce serait si dommage, j'veux pas perdre ce feeling
J'me sens bien pendant des heures, ça change rien, j'me sens si seul
Moi j'aime le bonheur, j'veux pas perdre ce feeling
J'veux pas perdre ce feeling ( Oh )

[Refrain]
J'veux pas perdre ce feeling ( Oh )
J'veux pas perdre ce feeling ( Oh )
J'veux pas perdre ce feeling ( Oh )
J'veux pas perdre ce feeling

[Post-refrain]
J'y repense en tombant des cieux, j'y repense en fermant les yeux
( J'veux pas perdre ce feeling )
Ce serait si dommage, j'veux pas perdre ce feeling
( J'veux pas perdre ce feeling )
J'me sens bien pendant des heures, ça change rien, j'me sens si seul
( J'veux pas perdre ce feeling )
Moi j'aime le bonheur, j'veux pas perdre ce feeling
J'veux pas perdre ce feeling
[Outro]
J'veux pas perdre ce feeling
J'veux pas perdre ce feelingEmbed"
