Artist,Title,Lyrics
Jamal Thioune,La vie de luxe,"15 ContributorsLa vie de luxe Lyrics[Paroles de ""La vie de luxe""]

[Intro]
Mais dit moi qui va me modifier moi ?
J'suis comme un don du ciel
Mes pensées mécaniques, dans ma tête c'est comme un logiciel
T'inquiètes on connaît le goût du sol
Comme on connaît le goût du sel
Plus rien pour m'épanouir, ni l'argent, ni les meufs à domicile, hey

[Couplet 1]
Demande pas c'qui s'passe, écoute seulement
J'ai préféré prendre mes distances, j'aime l'isolement
J'vise platine et diamant et le bénéficе monte avec le tеmps
J'ai pas venté mes mérites mais j'mérite salement
J'ai la même équipe mec, depuis 5 ans
Nique leur avis à mort, j'suis dans la maîtrise depuis ma naissance
J'en vois qui sont là que pour porter l'œil, Universal veut que je sois dans les délais
Putain d'sa mère mes pensées emmêlées font que des fois j'me souviens plus de ma mélo
Deux, trois galères, des concerts annulés mais t'inquiètes pas moi je fais ça comme un démon
Elle m'invite à diner, elle m'invite à ter-mon, veut m'voir tout les dia, veut m'voir toute la journée
J'ai zéro pistons, pas d'agents ni d'grands
C'est que le charbon moi j'suis jamais quille-tran
En vrai c'est bidon, j'écoute pas c'qu'ils pensent
Y paraît qu'tu pèses, il faut que tu rembourses
J'connais le business, ça donne la migraine
Enfant d'immigrés, mes parents ont souffert
Y a le temps qui passe, les souvenirs qui restent
Et bon j'me lasse vite, j'voulais pas te brusquer
You might also like[Pont]
Qui va me modifier moi ?
J'suis comme un don du ciel
Mes pensées mécaniques, dans ma tête c'est comme un logiciel
T'inquiètes on connaît le goût du sol
Comme on connaît le goût du sel
Plus rien pour m'épanouir, ni l'argent, ni les meufs à domicile

[Refrain]
Quoiqu'il en soit j'suis dans le noir, j'parle à mon autre moi
As-tu déjà pensé à comprendre ce monde autrement ?
Tu ne sais pas ce que c'est d'être attendu au tournant
Toi tu me vois, tu m'idolâtres mais m'connais-tu vraiment ?
Donc on veut la vie de luxe (À mort)
Donc on veut la vie de luxe (J'avoue)
Donc on veut la vie de luxe, que mes enfants soient des gosses de riches (Ah bon)
Donc on veut la vie de luxe (À mort)
Donc on veut la vie de luxe (J'avoue)
Donc on veut la vie de luxe, que mes enfants soient des gosses de riches (Ah bon, bah ouais)

[Couplet 2]
Hey, c'est l'oseille avant les sentiments
Plus j'grandis et moins j'me sens humain
J'avance et j'le vis comme un châtiment
Là pour finir comme un monument, j'suis pas le mouvement, tant mieux si vous m'aimez
J'ai fait de la musique tout l'été, au fond c'est que pour mon argent que vous m'aidez
J'suis dans un truc plutôt communautaire
Dans l'équipe on n'laisse pas de place aux menteurs
J'suis là tant que j'aurais pas vécu mon reuf
J'ai la dalle que, petit, m'a inculqué mon père
J'pense qu'on a assez attendu notre heure mais ces fils de cons veulent me prouver le contraire
Ça fait longtemps, nitro dans le moteur, j'vais pas encore refaire les mêmes gestuelles que Dex
J'ai mis la distance, médias le disent pas
Mais bon le truc qui faut, j'ai les gens, dispose
J'l'ai fait en despi, malgré la discorde
Les potos disent papi, venez on tise fort
Depuis ODP, certains le confirment : ""Belek à Youv Dee, négro il arrive fort""
Tu verras c'qui s'passe, tu verras c'qui sort
Tu verras qui transforme, tu verras qui dort
[Pont]
Qui va me modifier moi ?
J'suis comme un don du ciel
Mes pensées mécaniques, dans ma tête c'est comme un logiciel
T'inquiètes on connaît le goût du sol
Comme on connaît le goût du sel
Plus rien pour m'épanouir, ni l'argent, ni les meufs à domicile

[Refrain]
Quoiqu'il en soit j'suis dans le noir, j'parle à mon autre moi
As-tu déjà pensé à comprendre ce monde autrement ?
Tu ne sais pas ce que c'est d'être attendu au tournant
Toi tu me vois, tu m'idolâtres mais m'connais-tu vraiment ?
Donc on veut la vie de luxe (À mort)
Donc on veut la vie de luxe (J'avoue)
Donc on veut la vie de luxe, que mes enfants soient des gosses de riches (Ah bon)
Donc on veut la vie de luxe (À mort)
Donc on veut la vie de luxe (J'avoue)
Donc on veut la vie de luxe, que mes enfants soient des gosses de riches (Ah bon, bah ouais)2Embed"
Jamal Thioune,Lego,"10 ContributorsLego Lyrics[Paroles de ""Lego""]

[Intro]
Hey, ah gars ah gars, ah gars ah gars
Ah gars ah gars, hey, slay slay
Han han, Skunaboi
Slay slay, hey, hey

[Couplet 1]
Nouvelle pétasse que j'ai zappée, hum, des comme il faut, y en a si peu, hey
Deux jours pour dépenser ta paye, hum,  fume pas ta clope ici, ça pue, hey
J'ai d'la moula donc j'suis sappé comme un chinois qui vient claquer sur Paris, hey
J'suis avec Brook Ussop et Zoro, ça té-ma nouvelles séries
Si j'suis sérieux, ils vont flairer, trop fort pour eux, j'dois les fourrer
Plus de Berry, plus de score, j’claque leur salaire, j’suis sur l’périph'
Dans un Uber avec cette bitch qui veux d’la bite, qu'on baise fort, hey
Faut recharger les stocks, hey, ils ont profité mais stop, slay

[Refrain]
J’les écrase tous comme des mégots, j’vois tes rappeurs qui s'emboîtent comme des Lego (hey)
J'suis dans la trap comme Migos, à fond dans la chop lego
J’les écrase tous comme des mégots, j’vois tes rappeurs qui s'emboîtent comme des Lego (hey)
J'suis dans la trap comme Migos, à fond dans la chop Lego
Lego, Lego à fond dans la chop, Lego
Lego, Lego à fond dans la chop, Lego
You might also like[Couplet 2]
Lego, Lego, la moula, les concerts et les gows (hey)
J'écoute leur pe-ra, c'est léger (hey), si ça c'est fort, moi, je comprends pas tes goûts, hey (ah gars)
La pétasse flatte mon égo, hey, nouveau showcase, on négocie (hey)
Si t’es déter', tout est possible (hey), nouveau contrat dans le dossier
J'suis dans mon bendo, hey, avec le Banger, slay
Beaucoup de haineux oui mais j'ai plus d'adversaires (hey)

[Refrain]
J’les écrase tous comme des mégots, j’vois tous tes rappeurs qui s'emboîtent comme des Lego
J'suis dans la trap comme Migos, à fond dans la chop lego (yah)
J’les écrase tous comme des mégots, j’vois tous tes rappeurs qui s'emboîtent comme des Lego
J'suis dans la trap comme Migos (hey), à fond dans la chop lego (ah gars)
Lego, Lego à fond dans la chop, Lego
Lego, Lego à fond dans la chop, LegoEmbed"
Jamal Thioune,Les démons les anges,"3 ContributorsLes démons les anges Lyrics[Paroles de ""Les démons les anges""]

[Couplet unique]
J'suis trop complexe pour simplifier
Mon cerveau tourne comme scientifique
Quelques fois j'me suis senti vivre
Le bruit d'la foule qui m'faisait vibrer
Moi j'fais partie d'ces gens timides
Combien d'équipes se sont divisées?
Ils sont partout les gens qui trichent
J'laisserai personne nous vampiriser

[Pré-refrain]
Demain, j'partirai vers les démons, les anges
Si demain, j'pars, hé-hé, j'connais que trop les enjeux
Dеmain, j'partirai vers les démons, les angеs
Si demain, j'pars, hé-hé, j'connais que trop les enjeux

[Refrain]
Demain, j'partirai vers les démons, les anges
Si demain, j'pars, hé-hé, j'connais que trop les enjeux
Demain, j'partirai vers les démons, les anges
Si demain, j'pars, hé-hé, j'connais que trop les enjeuxYou might also like1Embed"
Jamal Thioune,Les sous,"16 ContributorsLes sous Lyrics[Paroles de ""Les sous""]

[Intro]
Slay, slay
C'est encore moi, on veut La vie de luxe
Hey ay, putain, slay
Ay

[Couplet 1]
Là, j'ai pas l'temps, j'te dis maintenant, j'fais mon show, j'me casse et puis basta
Toi t'es costaud, moi j'ai plein d'gens, on sait d'où on vient, mec on parle peu
Depuis Gear 2, on veut m'assister mais c'est bidon, arrête d'insister, dégage
J'ai pas signé, j'vais pas signer, toi tu veux m'douiller, j'vais pas signer
Oseille en poche, tu m'vois sur Clémeanceau, rien qu'elle mouille sa culotte, j'ai même pas commencé
J'suis à la mode donc ça copie mon flow et ça croit sérieusement que personne a cramé
Avec des signes, nous on a fait des sous, après quelques essais, j'deviens AC/DC
Vingt-ans d'avance, moi, j'viens d'une autre époque et j'suis venu ici pour tout vous annoncer, ay

[Pré-refrain]
Beaucoup d'euros sur ma tête, j'attends, j'fais monter la prime
Des fois, j'reçois des DM de top modèles ou d'actrices
Ils veulent rentrer dans le gang, ils veulent rentrer dans ma vie
J'sais même pas choisir laquelle, la sérieuse ou bien la bitch

[Refrain]
On fait les sous, on fait du sale, j'ai la combinaison, j'connais le code
J'men bats les couilles de finir seul, nous on sait où trouver la maille
On fait les sous, on fait du sale, j'ai la combinaison, j'connais le code
J'men bats les couilles de finir seul, nous on sait où trouver la maille, ay
You might also like[Couplet 2]
J'ai investi, j'fais des calculs, pour la belle vie, vacances à Cancun
J'vendais du shit, c'était casse-gueule, mais plus bénef que d'aller en cours
Dans l'industrie, j'suis un shiny, donc normal ils viennent me chiner, dégage
So stylish, té-ma la degz donc normal ils veulent me signer
Un dans la paire, et deux dans la sacoches, j'ai dépensé des K, bats les couilles de ton gars
Y a que ma mère, ma famille et mes proches, pour le reste, parle à Rayane si c'est délicat
J'ai mal dosé, c'est bizarre dans ma tête, y a mes yeux qui tournent à mort comme un hélico'
J'me suis fait attrapé par les feukeus, ils m'ont dit : ""tu fumes quoi ?"", j'ai dit : ""c'est médical""

[Pré-refrain]
Beaucoup d'euros sur ma tête, j'attends, j'fais monter la prime
Des fois, j'reçois des DM de top modèles ou d'actrices
Ils veulent rentrer dans le gang, ils veulent rentrer dans ma vie
J'sais même pas choisir laquelle, la sérieuse ou bien la bitch

[Refrain]
On fait les sous, on fait du sale, j'ai la combinaison, j'connais le code
J'men bats les couilles de finir seul, nous on sait où trouver la maille
On fait les sous, on fait du sale, j'ai la combinaison, j'connais le code
J'men bats les couilles de finir seul, nous on sait où trouver la maille, ay
Ah gars!Embed"
Jamal Thioune,L’homme de ta vie,"14 ContributorsL’homme de ta vie Lyrics[Paroles de ""L'homme de ta vie""]

[Intro]
Elle pense qu'à me charbonner
Cigarettes et Chardonnay
J'crois qu'elle est accro à moi

[Couplet 1]
Elle pense qu'à me charbonner
Cigarettes et Chardonnay
J'crois qu'elle est accro à moi
Mais moi j'ai déjà donné
Tu veux passer tous les soirs
Tu veux dormir dans mon lit
Mais bon t'as même pas mon num
Et tu crois t'es abonnée
J'vais t'faire du mal si je te fais du bien
Elle me dit : ""S'il te plait, mets-y du tien""
Mais j'arrive pas, je lui met que mon bois
Pourquoi nagеr dans la désillusion ?
Désolé mais tu sais pas d'où je viens
Désolé mais tu sais pas je vis quoi
Papa m'a dit : ""T'as dе l'or dans les mains
T'en sers pas que pour toucher des nichons""
Pourquoi tu m'guettes comme si j'étais un steak ?
Pourquoi tu m'questionnes plus que l'inspecteur ?
Pourquoi tu stresses ? Pourquoi t'es inquiète ?
Pourquoi tu m'plais plus quand je t'ai ken ?
J'suis à la traîne sur les feelings
Et je dois viser l'infini
Entre nous ça va pas si vite
Ouais j'ai du poser des limites
You might also like[Refrain]
Elle veut un bad boy
Elle veut un bad boy
Elle veut les enfants, la maison, le chien
Mais elle a pas compris que j'en suis un
Elle veut un bad boy
Elle veut un bad boy
Si je disparais me dit pas ""reviens""
Bébé nan j'suis pas l'homme de ta vie
Nan j'suis pas l'homme de ta vie
Si c'est pas moi ce s'ra lui
Nan j'suis pas l'homme de ta vie
Nan j'suis pas l'homme de ta vie (De ta vie, de ta vie)
Nan j'suis pas l'homme de ta vie (De ta vie, de ta vie)
Si c'est pas moi ce s'ra lui (Ce s'ra lui, ce s'ra lui)
Nan j'suis pas l'homme de ta vie (De ta vie, de ta vie)

[Couplet 2]
La balle elle était dans ton camp
Il fallait rester dans ton coin
T'as pas la valeur de ton corps
T'avales, tu kiffes et tu bois
T'as badé, t'as badé, t'as vu
Cavalé, t'as ramé pour rien
Il fallait pas donner ton cul
Il fallait pas donner ta main
T'es un sac Birkin dans un Tim Burton
Et si ça t'suffit, vis le film comme t'aimes
Nan y a pas d'victimes, si y a pas mort d'hommes
Tu viens sur mes cuisses, j'retourne mon phone-tél
Si tu lâches du fric, y aura pas d'retour
Si tu lâches ton fric, t'auras pas d'fortune
Des fois j'suis aigri, des fois j'suis fonce-dé
Des fois j'suis llé-gri j'peux pas riposter, yeah
Elle veut un bad boy pour la tenir
Elle veut habiter dans ma tanière
J'dirige le bateau vers l'avenir
Elle me demande quand elle peut venir
J'veux que le gâteau, t'es la cerise
Désolé, pardon, si t'es vénère
Yeah yeah
[Refrain]
Elle veut un bad boy
Elle veut un bad boy
Elle veut les enfants, la maison, le chien
Mais elle a pas compris que j'en suis un
Elle veut un bad boy
Elle veut un bad boy
Si je disparais me dit pas ""reviens""
Bébé nan j'suis pas l'homme de ta vie (Nan j'suis pas l'homme de ta vie)
Nan j'suis pas l'homme de ta vie (Nan j'suis pas l'homme de ta vie)
Si c'est pas moi ce s'ra lui (Si c'est pas moi ce s'ra lui)
Nan j'suis pas l'homme de ta vie (Nan j'suis pas l'homme de ta vie)
Nan j'suis pas l'homme de ta vie (Nan j'suis pas l'homme de ta vie)
Nan j'suis pas l'homme de ta vie (Nan j'suis pas l'homme de ta vie)
Si c'est pas moi ce s'ra lui (Si c'est pas moi ce s'ra lui)
Nan j'suis pas l'homme de ta vie (Nan j'suis pas l'homme de ta vie, hey)1Embed"
Jamal Thioune,Longtime,"4 ContributorsLongtime Lyrics[Paroles de ""Longtime""]

[Intro]
J’ai pas connu ça depuis longtime, ouais longtime
D’habitude tout passe après mon taf, ouais mon taf
Et pour toi j'déplaçais des montagnes, des montagnes
Pourquoi c’est moi-même qui nous condamne ?

[Couplet 1]
C’est mon destin ma babe, j’ai la tête dans les nuages
On me souhaite mon anniv', je le fête pas j'ves-qui ça
J’en ai marre de râler, je vois tout en blanc et noir
Comme un film de Chaplin, mais comment faire ?
Arrête moi, si tu me vois, encore drogué comme un con
C’est mon devoir, tu comprends pas, je le répète dans mes sons
À mes yeux y a, que la moula, ouais y’a que l’argent qui compte
J’parle de toi, j’parle de moi, j’parle que de mes relations, hey

[Refrain]
J’ai pas connu ça depuis longtime, ouais longtime
D’habitude tout passe après mon taf, ouais mon taf
Et pour toi j'déplaçais des montagnes, des montagnes
Pourquoi c’est moi même qui nous condamne ?
Oh yeah, yeah, oh yeah, yeah
Oh yeah, yeah, oh yeah, yeah
Oh yeah, yeah, oh yeah, yeah
Oh yeah, yeah, oh yeah, yeah
You might also like[Couplet 2]
Là j’deviens fou, j'suis trop cinglé, j'suis trop cinglé, j’suis à fond dans ça
‘Teille dans le crâne, teh dans la mano
Des fois je craque, des fois j’suis mal, ouais
Des fois j’suis là, des fois j’suis absent
Des fois j’suis à jeun, non j’avoue là j'mens
Des fois j’suis cute, des fois j’suis pas beau
Des fois j’suis Youv, des fois James
Des fois j’déteste, des fois j’aime
Des fois j’suis là en pleine forme
J’ai le cerveau en désordre, là j'vomis dans les toilettes
J’voudrais couvrir mes poignets, de bijoux d’argent et d’or
Faire le biff avant d’être mort, j’veux pas vivre pour nettoyer

[Refrain]
J’ai pas connu ça depuis longtime, ouais longtime
D’habitude tout passe après mon taf, ouais mon taf
Et pour toi j'déplaçais des montagnes, des montagnes
Pourquoi c’est moi même qui nous condamne ?
Oh yeah, yeah, oh yeah, yeah
Oh yeah, yeah, oh yeah, yeah
Oh yeah, yeah, oh yeah, yeah
Oh yeah, yeah, oh yeah, yeahEmbed"
Jamal Thioune,Love,"14 ContributorsLove Lyrics[Refrain]
La pétasse veut du love, love, love
Moi, j'dois faire des lovés
Un peu d'lean, tout est mauve, mauve, mauve
J'crois qu'j'en deviens mauvais
Elle veut que j'l'emmène au resto, hmm
Elle veut que j'l'emmène au ciné, hey
Elle veut que j'arrête le bédo, hmm
Elle veut me voir toute la semaine, hey
J'crois qu'elle veut du love, love, love
Mais moi j'dois faire des lovés

[Couplet 1]
Elle veut me voir après son taff
J'fais R, elle enlève son soutif'
Elle voudrait qu'on reste en contact
Message perdu dans mes notifs
Pétasse connait bien la chanson
Elle veut le Dee dans sa pussy
Mets les pheners dans la potion
Youv Dee veut claquer dans Gucci
J'fais plus d'argent, j'le veux tout d'suite
Young Money comme Weezy
J'suis partout comme wi-fi, Babe
Ça fait longtemps que j'suis sous Bape
Tu veux gouter O.D.P, bae
En avance de dix piges, mec
J'te dis direct
Y'en a beaucoup qui veulent m'imiter
You might also like[Refrain]
La pétasse veut du love, love, love
Moi, j'dois faire des lovés
Un peu d'lean, tout est mauve, mauve, mauve
J'crois qu'j'en deviens mauvais
Elle veut que j'l'emmène au resto, hmm
Elle veut que j'l'emmène au ciné, hey
Elle veut que j'arrête le bédo, hmm
Elle veut me voir toute la semaine, hey
J'crois qu'elle veut du love, love, love
Mais moi, j'dois faire des lovés

[Couplet 2]
Elle voudrait qu'on habite ensemble, hmm
Elle veut manger chez les darons
Moi, j'veux la ken et puis comater
Demain, j'rentre à la colloc
Mélange la cod' et le cool-al
Ils sont à côté, c'est dommage
Dix ans d'avance sur eux, dommage
Tu parles de bibi pour dix meujes
J'ai ves-qui la prison à 19
Désolé, j'ai l'emprise sur ta 'tite meuf
O.D.P, c'est l'empire qu'on bâtit reuf
Prise d'élan, on va pas feater
J'veux des sous sans activités
Que des fous ici, faut les éviter
Zéro poésie, que des vérités
Et Youv Dee aura c'qu'il a mérité
[Refrain]
La pétasse veut du love, love, love
Moi, j'dois faire des lovés
Un peu d'lean, tout est mauve, mauve, mauve
J'crois qu'j'en deviens mauvais
Elle veut que j'l'emmène au resto, hmm
Elle veut que j'l'emmène au ciné, hey
Elle veut que j'arrête le bédo, hmm
Elle veut me voir toute la semaine, hey
J'crois qu'elle veut du love, love, love
Mais moi, j'dois faire des lovésEmbed"
Jamal Thioune,Love Story,"5 ContributorsLove Story LyricsParoles issues d'un extrait

[Refrain]
Woh-oh, laisse tomber
J'suis dans une love story avec le cash money
Woh-oh, laisse tomber
C'est pas la même, j'le fais parce que j'ai pas sommeil
Woh-oh, laisse tomber
J'suis dans une love story avec le cash money
Woh-oh, laisse tomber
C'est pas la même, j'le fais parce que j'ai pas sommeil

[Couplet 1]
Je prends ton cœur en otage, faire des photos des montages
[?] la mer, la montagne, c'est peut-être tôt à notre âge
Mais j'suis sous la pluie, sous l'orage, l'impression d'être à la plage
Je vois la vie qui me nargue [?]
Putain si tu savais, j'fais partie du naufrage
Nan j'ai plus [?], je me suis bien trop assagi
J'prends la mort, j’me sens vivant
J'me sens fort, j'me sens titan
Demain, si je die [?]
Demain, si je die [?]
Tant d'avance mais je prends sur moi, ils comprennent pas, comme souvent

[Refrain]
Woh-oh, laisse tomber
J'suis dans une love story avec le cash money
Woh-oh, laisse tomber
C'est pas la même, j'le fais parce que j'ai pas sommeil
Woh-oh, laisse tomber
J'suis dans une love story avec le cash money
Woh-oh, laisse tomber
C'est pas la même, j'le fais parce que j'ai pas sommeil
You might also like[Post-Refrain]
Woh-oh-oh, oh-oh, woh-oh-oh, oh-oh
Woh-oh-oh, oh-oh, woh-oh-oh, yeah, yeah, yeah
Woh-oh-oh, oh-oh, woh-oh-oh, oh-oh
Woh-oh-oh, oh-oh, woh-oh-oh, yeah, yeah, yeah

[Couplet 2]
J'suis pas bien, baisse de moral, viens pas pour me faire la morale
Tu connais mes principes, ma morale
Oh no, no-no, oh no, no-no
[?], [?] un toi, un obstacle
[?], oh no, no-no, oh-oh
[?]
[?]
[?]
[?]
[?]
[?]
Tant de gens qui comptent sur moi, [?]

[Refrain]
Woh-oh, laisse tomber
J'suis dans une love story avec le cash money
Woh-oh, laisse tomber
C'est pas la même, j'le fais même si j'ai pas sommeil
Woh-oh, laisse tomber
J'suis dans une love story avec le cash money
Woh-oh, laisse tomber
C'est pas la même, j'le fais même si j'ai pas sommeil
[Post-Refrain]
Woh-oh-oh, oh-oh, woh-oh-oh, oh-oh
Woh-oh-oh, oh-oh, woh-oh-oh, yeah, yeah, yeah
Woh-oh-oh, oh-oh, woh-oh-oh, oh-oh
Woh-oh-oh, oh-oh, woh-oh-oh, yeah, yeah, yeahEmbed"
Jamal Thioune,Ma belle,"5 ContributorsMa belle Lyrics[Paroles de ""Ma belle""]

[Couplet 1]
Tous les jours on essaie, on essaie
Aucun de nous voulait blesser, ouais blesser
T’es la seule qui me fait effet, ouais effet
Puissant comme amour de lycée, de lycée
Mais si je reste auprès de toi, auprès de toi
J’pourrais faire plus que te décevoir, te décevoir
Du coup j’suis seul j'fais des monologues, des monologues
Devant l'ordi seul avec les chats, avec les chats

[Refrain]
Ma belle c'est chaud, j'ai trop de mal
Ma belle c'est chaud, j'ai trop de mal
Ma belle c’est chaud, j’ai peur de moi-même
De moi-même, de moi
Ma belle c'est chaud, j'ai trop de mal
Ma belle c'est chaud, j'ai trop de mal
Ma belle c’est chaud, j’ai peur de moi-même
De moi-même, de moi

[Couplet 2]
Le dernier qui s'perd, un amour discret
On se sent bien, on regarde le dernier Disney
Le dernier qui s'tait, tu veux me distraire
Faut que j’me casse, faut qu'je taff mon dernier disque, hey
Le dernier qui s'perd, un amour discret
On se sent bien, on regarde le dernier Disney
Le dernier qui s'tait, tu veux me distraire
Faut que j’me casse, que j’me casse
You might also like[Refrain]
Ma belle c'est chaud, j'ai trop de mal
Ma belle c'est chaud, j'ai trop de mal
Ma belle c’est chaud, j’ai peur de moi-même
De moi-même, de moi
Ma belle c'est chaud, j'ai trop de mal
Ma belle c'est chaud, j'ai trop de mal
Ma belle c’est chaud, j’ai peur de moi-même
De moi-même, de moi

[Outro]
Putain, j’ai trop de mal
Parce que j’ai peur de moi même
Putain, j’ai trop de mal
Parce que j’ai peur de moi même
Putain, j’ai trop de mal
Parce que j’ai peur de moi même
Putain, j’ai trop de mal
Parce que j’ai peur de moi mêmeEmbed"
Jamal Thioune,Madame,"9 ContributorsMadame Lyrics[Intro]
Yeah, yeah, slay
La vie de luxe
Yeah, yeah
Yeah, yeah, hey

[Refrain]
Pourquoi veux-tu me voir ? Mais que veux-tu de moi ?
Ne m'appelle plus le soir pour faire ton cinéma
J'agis impunément, que le minimum
Bébé, dans tous les cas, j'sais déjà tu veux quoi
Madame, madame, madame (yeah, yeah)
Madame, madame, madame (yeah, yeah, hey)
Pourquoi veux-tu me voir ? Mais que veux-tu de moi ?
Ne m'appelle plus le soir pour faire ton cinéma
J'agis impunément, que le minimum
Bébé, dans tous les cas, j'sais déjà tu veux quoi
Madame, madame, madame (yeah, yeah)
Madame, madame, madame (yeah, yeah)

[Couplet unique]
J'sais déjà tu veux quoi
Attirée par le danger quand tu le vois (yeah)
Pour finir à me cracher que j'suis le diable (hey)
Pour une relation qu'en vrai je voulais pas (yeah)
Cerveau en implosion, perché sur les toits (hey)
Mais j'ai du talent donc je suis sur de croître
Et j'ai frôlé la mort bien plus d'une fois
Être bon dans ce monde fait de toi une proie, hey
Sorry pour les dégâts, mais les histoires de go
C'est une perte de temps, sauf quand on fait les bails
J'avoue c'est délicat, toi tu me parles de quand
Entre nous c'était bien, mais bon c'était nouveau
Bébé j'suis pas ton gars, désolé adios
Je pense à la moula, j'suis sur mon camino
Non m'appelle pas le soir, retiens c'que j't'ai dit (ah gars)
Oh oui, j'ai peut être tort, j'suis peut être idiot (ah gars)
You might also like[Pont]
Madame vit dans les pêchés
Veut un homme qu'en a plein dans les poches
J'ai pas d'âme, ouais l'ange est déchu
J'ai mes cheveux pour cacher mes cornes
Tadam, encore du cash, j'recompte l'oseille avant d'me coucher
À table, c'est l'heure de manger
Elle a faim, elle fait que de me toucher, hey

[Refrain]
Pourquoi veux-tu me voir ? Mais que veux-tu de moi ?
Ne m'appelle plus le soir pour faire ton cinéma
J'agis impunément, que le minimum
Bébé, dans tous les cas, j'sais déjà tu veux quoi
Madame, madame, madame (yeah, yeah)
Madame, madame, madame (yeah, yeah, hey)
Pourquoi veux-tu me voir ? Mais que veux-tu de moi ?
Ne m'appelle plus le soir pour faire ton cinéma
J'agis impunément, que le minimum
Bébé, dans tous les cas, j'sais déjà tu veux quoi
Madame, madame, madame (yeah, yeah)
Madame, madame, madame (yeah, yeah)Embed"
