Artist,Title,Lyrics
Joe Lucazz,Knight Rider,"6 ContributorsKnight Rider Lyrics[Intro : Alpha Wann]
Yeah
Don Dada, Philly Phaal
Joe Lucazz, Lucazzi, Lucaze
What'up ?

[Couplet 1 : Joe Lucazz]
Money, money, money
Oui l'argent pourrit les gens mais les nourrit
La ville m'attend, mon argent, c'est l'argent d'autrui
Mimile, j'en ai des fourmis dans les jambes, j'arrive, j'arrive
Personne me drive, mesures que j'applique depuis plus d'vingt ans
Dieu nous donne le volant et l'diable nous fournit l'essence
Vroum-vroum, la nuit tombe et j'me sens puissant
Genre le bras gauche de Nadal, vos histoires de riders flingués
No gracias, de nada et quand j'rentre à la baraque sans she-ca
J'frôle l'alerte cardiaque
Mes démons tamponnent la nuit, la retamponnent, carjack

[Refrain : Alpha Wann]
Knight rider, on ride la ville jusqu'à pas d'heure
Les rodeurs rodent, les tapins tapinent
Le matin, c'est quand j'me lève
Ambiance façon Los Angeles, Pointe-à-Pitre
Knight rider, on ride la ville jusqu'à pas d'heure
Les rodeurs rodent, les tapins tapinent
Le matin, c'est quand j'me lève
Ambiance façon Los Angeles, Pointe-à-Pitre
You might also like[Couplet 2 : Joe Lucazz]
Plus que du rap, c'est l'générique de Paris Dernière
Me suivre dans la ville lumière, haut risque, haut risque
Espérer voir l'aube à jeun et en vie, un colossal défi
Oui, j'aime me mettre en périple, nuit noire, mon étoile brille
Où est Goliath que je le David ?
Nègre affranchi, sur compteur : trois ffres-chi
9 dans la tête, je ride, je ride
Gobelet rouge, Sprite et trop de codéine
Du coup, je compte mes billets au ralenti
Extrème dans les excès, ça c'est mon style de vie
Je rentre dans l'club, passe plus de temps dans les chiottes que dans le carré VIP

[Refrain : Alpha Wann]
Knight rider, on ride la ville jusqu'à pas d'heure
Les rodeurs rodent, les tapins tapinent
Le matin, c'est quand j'me lève
Ambiance façon Los Angeles, Pointe-à-Pitre
Knight rider, on ride la ville jusqu'à pas d'heure
Les rodeurs rodent, les tapins tapinent
Le matin, c'est quand j'me lève
Ambiance façon Los Angeles, Pointe-à-Pitre

[Couplet 3 : Alpha Wann]
On rode dans la ville lumière, on veut juste notre part du gâteau
Salam, shalom, slalome entre juifs, muslims, barbus, cathos
Dans la Rue de la Roquette, elle brûle la croquette
Fume la moquette dans la brume, belle brune marocaine
Elle croit qu'elle et moi, c'est pour la vie
Prend un ticket, va au bout d'la file
Moi, j'veux juste faire le tour d'la ville à pieds
Faut l'assurance tout risque, peu importe l’heure ça cogne
J'vois des touristes courir, des blédards ont rotte-ca leurs sacoches
Personne court aussi vite, mais sont suivis, ils ont les cops au cul
Bah ouais, tu connais, y'a toujours des civils dans les Ford Focus
Ils veulent poser des questions, moi le soir j'm'en pose aucune
Kho, j'm'occupe soit d'un texte soit d'un trop gros uc, Don Dada
[Refrain : Alpha Wann]
Knight rider, on ride la ville jusqu'à pas d'heure
Les rodeurs rodent, les tapins tapinent
Le matin, c'est quand j'me lève
Ambiance façon Los Angeles, Pointe-à-Pitre
Knight rider, on ride la ville jusqu'à pas d'heure
Les rodeurs rodent, les tapins tapinent
Le matin, c'est quand j'me lève
Ambiance façon Los Angeles, Pointe-à-PitreEmbed"
Joe Lucazz,Kurt Cobain,"6 ContributorsKurt Cobain Lyrics[Couplet 1]
Dans l'ventre de chaque future maman y'a un ange
L'auréole tient bon de 0 à 1 an
Elle disparaît une fois qu'le môme sait dire : ""Papa, maman""
Les cornes poussent dès qu'il sait compter de zéro à cent
C'est comme ça dans nos quartiers, anti-quartiers où y'a zéro accent
D'où j'viens les balles sont des boomerangs
La vengeance a trop souvent un métro d'avance
Et l'ambulance un train d'retard, Dieu merci j'suis vivant
Ma scolarité s'résume à ""bon en français""
Contrôle, absence, le foot, la fume, l'amiante
Écran noir et blanc, comme toujours
Papa peu présent, maman devant les feux d'l'amour
Pas d'exemple, même pas 12 piges de soufflées
L'air d'ce monde m'étouffe la pneumonie m'a presque bouffé
En pleine journée j'vois qu'des hiboux
La nuit que des ripoux, il disait vrai l'marabout

[Refrain] x2
J'suis différent
J'suis pas vraiment gentil mais j'ai un cœur quand même
J'suis pas vraiment méchant mais j'ai un gun quand même
Cette vie je la trouve moche mais j'f'rai pas l'Kurt Cobain

[Couplet 2]
J'vous aime tous mais j'me préfère
11-43 c'est l'âge de pierre
De l'arme de poing on est passé à l'arme d'épaule l'arme de guerre
On n'aura plus jamais de Michel Colluci, ni d'Abbé Pierre
Prémonitions : sur l'Niger, des putains d'frappes aériennes
De la blanche l'hiver dans l'museau des collégiennes
On est bien loin du p'tit frère d'AKH
Du cartable dépasse la Kalash
L'individualisme touche plus d'un milliard d'êtres
De plus en plus de milliardaires
Donc une hausse de housses mortuaires design
Et pour les deux trois milliards de pauvres : humanitaire désastre
[Refrain] x2
J'suis différent
J'suis pas vraiment gentil mais j'ai un cœur quand même
J'suis pas vraiment méchant mais j'ai un gun quand même
Cette vie je la trouve moche mais j'f'rai pas l'Kurt Cobain

[Couplet 3]
C'est à travers mes poumons que Paris respire
À 13 piges fume mon premier spliff, normal que la ville soit grise
Il faut rendre à Joe ce qui appartient à Lucazzi
Aucun nom d'esclave mon vrai nom c'est Aladji
De mon vélib je crache sur ton câble
Les démons vivent mais comme moi ils craignent A.L.L.A.H
Méfie-toi de la vengeance, c'est comme la police
Ou la lumière blanche on n'sait jamais quand elle arrive
J'suis c'négro, né pauvre, qui a aimé jouer les nouveaux riches
Puis pauvre à nouveau, j'cultive comme un British
Le fighting spirit, ouais Mimile

[Refrain]
J'suis différent
J'suis pas vraiment gentil mais j'ai un cœur quand même
J'suis pas vraiment méchant mais j'ai un gun quand même
Cette vie je la trouve moche mais j'f'rai pas l'Kurt CobainYou might also like1Embed"
Joe Lucazz,Kurt Cobain (Remix),"10 ContributorsKurt Cobain (Remix) Lyrics[Couplet 1 - Dixon]
Un Lexomil et la terre tremble
Quant à moi ça passe, quant à Bertrand ça casse sur du Supertramp
J'vous ai vus dus-per, han
Certes, j'vais finir la soirée à rapper torse nu comme le DRH d'Air France
Le cul bordé de pâtes LiDL, j't'explique que je n'ai pas d'leader sous pâle liqueur
Starfoullah on m'dit qu'il est devenu fat Bieber
Arrête de m'demander de faire du Madlib
J'suis à la fois la peste, syphilis, scorbut
Foutez-moi la paix, j'suis distordu, foutez-moi la...
Merde j'sais pas où m'foutre, j'dérive, j'dors plus
J'sais pas où m'foutre comme le bracelet électronique de Pistorius
Disquettes j'te déblatère, j'te mens, j'te Sepp Blatter
Mais dis-moi que j'te manque, et je te cède la Terre
Cherche un gilet fluo dans un fouillis d'calibres
J'ai l'air autant détaché qu'les mains d'Coulibaly

[Refrain - Joe Lucazz] (x2)
J'suis différent
J'suis pas vraiment gentil mais j'ai un cœur quand même
J'suis pas vraiment méchant mais j'ai un gun quand même
Cette vie je la trouve moche mais j'f'rai pas l'Kurt Cobain
Kurt Cobain

[Couplet 2 - Joe Lucazz]
Sont à propos de qui est Charlie, qui ne l'est pas
J'suis à propos de survie, d'biff, kils de me-ca
Chaque jour j'me réinvente et chaque nuit je me suicide
Dieu merci j'ai mes 5 sens, quelque part j'suis béni
Troisième oeil grand ouvert, vision pénible
Depuis 4 siècles, j'traîne au fond de l'Atlantique
J't'apprends rien, que tchi plus pourri qu'un flic ? Deux flics, aigle de nuit
Éteindre vos étoiles, ma règle de vie
Et au-dessus d'ma feuille planent Audiard père, grand père, Cobain et Biggie
Ivre, j'survole Paris, et vapeurs d'écaille, pisse, se dégagent de l'hémicycle
You might also like[Refrain - Joe Lucazz] (x2)
J'suis différent
J'suis pas vraiment gentil mais j'ai un cœur quand même
J'suis pas vraiment méchant mais j'ai un gun quand même
Cette vie je la trouve moche mais j'f'rai pas l'Kurt Cobain
Kurt Cobain

[Couplet 3 - Nakk Mendosa]
Alcool, teuf, tèss : j'ai stoppé les trois
Tu m'nnais-co, moi j'suis un lion y'a qu'chez l'véto qu'j'ai les droits droits
En parlant d'droits, putain la SACEM de Goldman
Il m'a dit dans l'rap, tu cours à ta perte pauvre Nakk
Ibrahim, Mamadou, face à Pierre, Paul Jacques
Mes gosses écoutent mes raps, donc la chatte à personne, man
Paie tes dettes, fais pas ton beurre, man
Repose-toi, fais pas ton burnout, on veut une France Black Blanc Beur now
Esprit bulletproof, les tèss bourrées d'poudre
Vous êtes oufs, quand ça parle de sous je pèse l'pour et l'pour
J'rigole pas avec mes soces comme Phillipe Etchebest
Mon cœur c'est le best des best, les miens tu les baises, j'te baise
Ton rap et le mien, le vrai foot et FIFA
Le rap français à la santé, celle de Boutheflika
Eh, fuck ton tiercé même si c'est dans l'ordre
C'est injuste, tes mains sont faites pour la merde mais elles sont dans l'or

[Refrain - Joe Lucazz] (x2)
J'suis différent
J'suis pas vraiment gentil mais j'ai un cœur quand même
J'suis pas vraiment méchant mais j'ai un gun quand même
Cette vie je la trouve moche mais j'f'rai pas l'Kurt Cobain
Kurt CobainEmbed"
Joe Lucazz,La guerre de l’opium,"4 ContributorsLa guerre de l’opium Lyrics[Couplet 1]
Gringalet au sourire blanc, bout d'franc
Fourbe avec des fourbes, j’suis un brin charrieur, Mimile
Un vrai charmeur, disent-elles et par dessus-tout je hais la bêtise
Être distrait, c'est l'billet avant tout
Une vie d’merde avant l'four, t'imagines, bref
Tout porte à croire que vos nègres disent vrai
Qu'ils sont tous sincères mais dans l'chemin d'la vérité
Je les ai tous croisé et on prenait des chemins inverses
Qui est dans l'vrai ? J'sais pas mais dans l’doute, je préfère croire Lucazz
Croire en ma lumière, nouveau roi de Lutèce
On m’croise aux quatre coins de la ville Lumière
J'ride, filoché par l’astre lunaire
On a survécu à l'âge des glaces
Bienvenue dans l'ère nucléaire
Chez nous, les affaires, c'est l’argent des autres
Et on n'badine pas avec
Rebelle du Nord-Est, 9-3, 20ème, DKR ADN
Une terrasse, une clope, un demi, nan un crème
J'parle fort, Paris, j't'aime
J'aime les défauts des personnes que j'aime
Et j'aime les qualités des personnes que je hais
Les connaissances viennent du XXX, du Caire ou d'ailleurs, alien

[Refrain]
Au charbon H-48, c'est nous Mimile
Le million by any means, c'est nous Mimile
Près du nombril, Wesson Smith, c'est nous Mimile
On brûle nos vies
Le canon près d'la gencive, c'est vous Mimile
Big booty avant money, c'est vous Mimile
La veine sur l'front, ça charbonne, c'est nous Mimile
D'la bouche d'égout au rooftop, c'est nous Mimile
You might also like[Sample : Thomas Sankara]

[Couplet 2]
L'humour est métis, british et nègre
L'humeur est ukrainienne, j'me laisse pas faire
Et où j'traîne, le peso perfore la boîte crânienne
Le bando : très peu en sortent heureux, indemnes
J'vois plus de guetteurs que de Karim Benzo
J'te l'ai dit un peu plus haut, très peu s'en sortent
Et parmi ceux qui y arrivent, certains arrivent à s'faire racketter par d'autres
J'dis ça, j'dis niet, zéro, Lucazze
J'sais qu'j'horrifie mes ancêtres à glorifier italian gangsters
Et m'appeler Joe Lucazz
Égyptien par le mystère, trop calme donc j'ai une migraine
Constamment au taquet, pressé, stressé, parisien par l'caractère
AK-47 en Nike Air, effrayé par le bonheur
Un autre moi dans l'excès, XXX
Dans la recherche du couloir noir, lumière blanche
C'qui y a après la vie, six zéros, aucun placement
Sans aucun doute, il s'agit d'nous
Trop d'MC s'disent puristes, old school
Car ils n'ont aucun talent
Excuse me ? Génération club de Corbeille, capuche, kaki
J'ai dit j't'aime, c'est jusqu'à la mort
JFK, Jackie, le sérieux de Bruce Lee
Plus le second degré de Chan Jackie
Grand boulevard, dis à tes purples bifs que j'arrive
Ouais j'arrive, Mimile
[Refrain]
Au charbon H-48, c'est nous Mimile
Le million by any means, c'est nous Mimile
Près du nombril, Wesson Smith, c'est nous Mimile
On brûle nos vies
Le canon près d'la gencive, c'est vous Mimile
Big booty avant money, c'est vous Mimile
La veine sur l'front, ça charbonne, c'est nous Mimile
D'la bouche d'égout au rooftop, c'est nous MimileEmbed"
Joe Lucazz,La légende de Batlling Siki,"5 ContributorsLa légende de Batlling Siki LyricsMenotté ou pas, faut que tu m'comprennes
Résultat est le même, je n’ai rien vu rien entendu my men
Et à chaque interpell' c'est ma mère que je tue un peu plus, et j’ai encore la chance de l'avoir

Depuis quand l'argent réunit? T'as lu ça ou? c'est un fake. La monnaie est triplée frère
Et force est de constater que ton équipe est faible, d'ailleurs mal parler de moi sans réellement me connaitre
Évite s'il te plait au nom de Dieu

Ce que je tiens nest pas une réplique, .357 Mag égérie
J'représente partout, j’suis le drapeau de l’Algérie. Génération Jordan versus Pat Ewing

Entre ma bouche et le nombril est calé le Smith & Wess, et autour de ma bouche de nègre, le gras des Chicken Wings
Hors de l'underground mimile, bien en dessous de la bouche d’égouts, C'est là que mes textes prennent vie

Tu peux changer de plastique ou de tenue vestimentaire. L'intérieur reste identique, le même
Si tu es mauvais, tu es mauvais. Coeur noir, vente de blanche j'suis métis marron foncé, bleu nuit

Au dessus de mon Bob plane le spectre de Battling Siki, celui de la récidive, l’ex de Jane Birkin, l'ancienne Égypte
Mon style de vie reste spectaculaire comme vos récits bibliques

Quoi, vous, faire de la musique? Un instant que je me marre
Chaque fois que je prends le bic, encre noire

Vous vivez un instant de grâce, aussi furtif qu'un coup de lame ou le bonheur, donc j'en profite
Mes gueules, faites-en de même. Dans cet Éden jardin factice, « plus de biff » est le nom du venin
You might also likeEt j'suis entouré d'couleuvres de toutes les couleurs. D'ailleurs grace à TV en couleur
Le fake s'est installé en douceur. 6 fois 6, Quai des Orfèvres sur une jambe, aucune douleur aucune crampe

2 fois 24 heures que je mens
Inspecteurs tournent en rond. 2 fois 24 heures du Mans

Faire du fric et affecter les cellules souches du papier sur le quel j'écris et chez moi maladie chronique
Oui je souffre et ne veut aucunement guérir
Y'a rien d'ironique, les effets secondaires: une rime d'origine criminelle

Menotté ou pas, faut que tu m'comprennes
Résultat est le même, je n'ai rien vu rien entendu my men

Et à chaque interpell' c'est ma mère que je tue un peu plus, et j'ai encore la chance de l'avoir
J'en peux plus2Embed"
Joe Lucazz,La Nuit Me Parle,"3 ContributorsLa Nuit Me Parle Lyrics[Intro : Jean Baptiste]
Lucazzi Joe, Jean Bapt
Bim badabadaboum, han

[Couplet 1 : Jean Baptiste]
J'ai un gros cœur tendre, pourtant joue l'dur, dur d'la feuille
J'en ai plein l'buvard, un poil connard
Super rancunier sur l'ACAB, la bonne espérance pour cap
Le bonheur pour capital, satané mea culpa
Je crèverais charognard, un d'ces vilains soirs
J'attends l'express, qui mènera vers la félicité ou vers le feu
J'dois réciter sans faute, j'termine ce texte puis la fête est finie
J'mets l'eau d'vie dans mon vin, mon quartier est rempli d'pairs
Le vent souffle fort sur la côte normande, j'ai peur
D'méchamment changer en bon ou pas
Trop d'questions m'taraudent, je reste planté là
J'arrose mes mauvaises graines, j'fais pousser mes décibels
J'attends que l'printemps passe, j'suis décidé
Avant qu'la mort m'appelle, je rêve sous cognac
Les yeux rendus vitreux, à cœur ouvert, j'deviens insomniaque
La nuit est belle, j'rallume un machin
Puis doucement, j'me rapproche d'elle
Puis doucement, j'me rapproche
Oui doucement oui doucement

[Refrain : Jean-Baptiste]
La nuit me dit : ""Allez chante un p'tit bout""
La vie me dit : ""Allez chante un p'tit blues""
La démence me dit : ""Fracasse tout""
Ma conscience me dit ""Pisse un coup et ferme ta gueule""
La nuit me dit : ""Allez chante un p'tit bout""
La vie me dit : ""Allez chante un p'tit blues""
La démence me dit : ""Fracasse tout""
Ma conscience me dit ""Pisse un coup et ferme ta gueule""
You might also like[Couplet 2 : Joe Lucazz]
J'arrive sans artifices et fais vœu
Oreilles sensibles, bien les ouvrir
L'homme est brisable mais pas l'mental, Abou Diaby
Mes meilleurs ennemis : la traîtrise, la défaite et l'compromis
Chose promise, chose dûe, comme promis, dope pure
Vatican : obscur, pratiquant, ordure
Sur la tempe : dorure, conscient qu'mort fuck le sud, je hais l'aube
Chemise hawaïenne en plein hiver, j'ai le calme d'un homme d'affaires
Et m'concernant, tout compte fait, j'ai tout lui et son contraire
La nuit, t'as tout vu ? Moi c'est l'contraire !
Je me réveille, gueule de bois mais je me réveille, donc j'suis béni
Souvent j'le dis mais pas assez, j'suis toujours pas lassé
La nuit, du fric, j'en fais, toujours pas assez

[Refrain : Jean-Baptiste]
La nuit me dit : ""Allez chante un p'tit bout""
La vie me dit : ""Allez chante un p'tit blues""
La démence me dit : ""Fracasse tout""
Ma conscience me dit ""Pisse un coup et ferme ta gueule""
La nuit me dit : ""Allez chante un p'tit bout""
La vie me dit : ""Allez chante un p'tit blues""
La démence me dit : ""Fracasse tout""
Ma conscience me dit ""Pisse un coup et ferme ta gueule""Embed"
Joe Lucazz,La Pureté,"3 ContributorsLa Pureté Lyrics[Couplet 1 : Cross (Lupino)]
On apprend à marcher un pas après l'autre
Mais un dollar plus un dollar, à la fin, ça fait un tas pas très haut
Un pot d'vin après l'autre, à la fin, ça fait un bras assez long
On m'appelle Cross, c'est pas pour rien, mais c'est pas mon vrai nom
Les pieds sur terre, c'est pas mon truc, nan, c'est pas mon créneau
J'suis dans la Lune depuis le préau et j'suis bien en l'air
Mais je reste prudent car même athée, je crains le Très-Haut
En bas, c'est cool, il fait chaud, donc j'redescends pour pécho
C'est trop tentant de pécher et j'ai un penchant pour tomber dedans, pourtant les pièges sont fléchés
On peut en parler cent ans, ça va rien empêcher
Quand j'suis bien éméché, j'suis pas méchant, nan j'suis juste un pêcheur
Qui parle bien mais l'écoute pas, lui, c'est juste un lécheur
La crosse sous le t-shirt, c'est juste un teaser
Tout s'achète, c'est vrai mais tout est très cher, sauf ta vie

[Refrain : Eloquence]
Et la souffrance est belle
Et la souffrance est belle
Et la souffrance est belle
Et la souffrance est belle

[Couplet 2 : Joe Lucazz]
Quand la plupart excelle dans la distribution de mensonges
Le temps n'a aucune emprise sur mon son
Lumineusement XXX, que l'Tout-Puissant m'entende
J'caresse aucune ambition, numéro un deux trois
Tu peux aller jusqu'à cent, j'veux juste qu'on m'entende
J'n'ai plus l'âge de m'aplatir, mon gars, tant qu'tu m'applaudis
J'ai tordu l'cou à cette bouteille d'écossais whisky et bien ivre
J'me dis qu'y a qu'en enfer que j'serai sorti d'l'auberge
Mimile, je fais joujou avec ma vie et avec la tienne
En décrochage scolaire, on finit par s'agripper à ce foutu corner
Par s'habituer aux obsèques et à la traitrise
J'ai donc fermé les frontières, transparence totale sur l'origine de ma colère
Quatre siècles que j'suis mort, que je plane
Que je repose en guerre, le cœur de ma musique pointe exclusivement ce mal-être
Yeah
You might also like[Refrain : Eloquence]
Et la souffrance est belle
Et la souffrance est belle
Et la souffrance est belle
Et la souffrance est belle

[Couplet 3 : Eloquence]
Papa tu sais, je t'aime, Maman tu sais, je t'aime
J'ai peur pour mon p'tit frère Junior, pour toi je pourrais dead
Mes deux nièces sont la prunelle de mes yeux
Je vendrais mon âme au Sheitan pour qu'elles puissent finir aux cieux
La famille c'est comme mes burnes, organe inséparable
La vengeance par la vendetta sans faire de palabres
Tonton est parti à cause de la fumée, d'la tise
J'suis sur la même route, on verra, j'encule la Boite Six
J'ai quitté le rap game, trop d'blahni, de négros softs
Mon compteur SACEM dans le rouge, j'essaie d'changer d'hustle
La politique de la liasse, son odeur, son épaisseur
J'connais qu'ça, Trill MC, de Paris jusqu'au Texas
Ma skinny bitch m'envoie des nudes quand j'lui manque
Trop khabat pour répondre, complote avec mon gang, yeah
PLC, All Star, une moitié au placard, l'autre moitié sur le boulevard
Les chiens aboient, la caravane passe
Posté dans la peinture à la Hakim, à la XXX
J'fais doubler ma monnaie, au Parions Sport ou sur un canasson
J'me fais sé-uc sans les mains, gorge profondeEmbed"
Joe Lucazz,La Recette,"3 ContributorsLa Recette Lyrics[Intro : Eloquence]
Ok, celle-là c'est pour Strauss, roulez

[Couplet 1 : Eloquence]
Rien qu'des barbus à la Harden
Rêvent du million avant la quarantaine
Péché mignon, on appelait marocaines
Fuck ton rap game, j'suis dans l'poker, pas les kilos d'herbe
Positif à l'éthylotest
Faut voir pour la p'tite hôtesse
Finit à pachave dans un p'tit hôtel
Gâteries sans les préliminaires
Petit billet pour les guetteurs mineurs
Ici, on bosse à la chaîne
Cagoulé entre deux étages
En l'air : la tête dans les nuages
On refait le monde dans la ture-voi
Déja sur le rrain-té, quand AKH dansait l'mia
Mais que pasa ?
Tous les jours, la même merde
Y a que la couleur du pécu qui change
Bicarbonate dans ma dope
Pour mettre carbone sur mes jantes

[Refrain : Eloquence]
Casserole, récipient, dope
Remue, rajoute des glaçons, mon crack est servi chaud
J'ai dit : casserole, récipient, dope
Remue, rajoute des glaçons, mon crack est servi chaud
J'ai dit : casserole, récipient, dope
Remue, remue, dis psahtek au cuistot
You might also like[Couplet 2 : Joe Lucazz]
Oui j'remue, je remue
Pris entre la blanche plus ma négritude
Mon côté frenchie et mon africaine attitude
Un chapelet dans une main et le Diable sous la capuche
C'qui donne vie à mon neuf causera ma perte, ma chute : c'est la rue
Je l'aime comme du jamais vu
Célèbre ou pas mais pour sûr
Je n'suis qu'un indigène, Black Roschdy Zem
Finit mon thiéboudienne, écaille poissonnier
Billaye, l'produit est frais
Police a juré qu'j'allais crever avant Rocky 7
Touche là à 20, revends là à 7
Chérie, jette tout dans les chiottes avant que police vienne
Issa Doumbia en dope, j'écoule tout ça en une semaine
Vu qu'l'argent n'est pas un game, pas de fair-play

[Refrain : Eloquence]
Casserole, récipient, dope
Remue, rajoute des glaçons, mon crack est servi chaud
J'ai dit : casserole, récipient, dope
Remue, rajoute des glaçons, mon crack est servi chaud
J'ai dit : casserole, récipient, dope
Remue, remue, dis psahtek au cuistot

[Couplet 2 : Eloquence]
Bolivienne à chaque couplet
Et j'garde mes ennemis près de moi comme un chapelet
À deux millimètres des assiettes
Le vécu sur le faciès
Bosse à la téc' sans cassette
Blanches baskets, semelles sales
Nous tester : suicide
SuicideEmbed"
Joe Lucazz,La tête dans les étoiles,"3 ContributorsLa tête dans les étoiles Lyrics[Couplet 1 : Hype]
La tête dans les étoiles, je flambe comme le prix du gas-oil
Y'a longtemps que j'ai fait tapis et poser les cartes sur la table
Jeune arabe insoumis, y'a deux options si tu nous insultes
Soit on tue, soit on te sourit, ma violence je la catapulte
En traversant la chaussée, la vie ne met pas que des chassés
Des coups de têtes, des coups de coudes
Elle peut te faire smacker le pavé
Et ça, faudra t'y faire, Paris n'a pas froid qu'en Hiver
A 50 euros le flocon, c'est tous les jours Val d'Isère
T'as ton pass pour les remontées mécaniques
Dans le plan, un coup de canif si on croise la brigade canine
Métaphoriquement, la transhumance est à l'envers
C'est aux vaches de France que d'Hollande on ramène l'herbe
Si t'as compris t'es un bon
Mon rap est un martien, mon stylo vit sur Pluton
Heuresement que Saza me contient, sinon je pèterais les plombs
Sinon je dirais des noms, les ferais danser avec le Démon

[...]You might also likeEmbed"
