Artist,Title,Lyrics
Joe Lucazz,On fait nos bails,"3 ContributorsOn fait nos bails Lyrics[Paroles de ""On fait nos bails"" ft. Alkpote & Nakk Mendosa]

[Intro : Alkpote et Yonea]
- Vas-y sors sors
- Laissez le près de moi
- Nan, nan enregistre pas, enregistre pas tant qu'il est la
- J'fais pas d'bruits, j'suis déjà venu ici
- Nan sors, j'men bat les couilles
- Ah ouais, pourquoi ?
- Parce que c'est lui qui décide. Arrête de faire le clodo. Eh, maintenant reste dans l'escalier et arrête de faire le con hein

[Couplet 1 : Alkpote]
Gros, Néochrome U2F, mon groupe de légende
Opé par le passé, dans le futur, ou le présent
Ecoute j'représente
Pour mes pirates, j'cours jeter l'ancre
J'ai l'amour de mes gens
Si mes cous' te dérangent, suce nos boules de pétanque
Et goûte le mélange, pour te détendre
Effectue moultes dépenses
Faut qu'jdouble les grands
Qu'la qualité booste mes ventes
Moi je souffre vraiment
J'trouble les fientes
Dans c'rap jeu, j'suis trop dégeulasse, trop crasseux
Après une dizaine d'gardes à vues
J'veux grossir comme Michel Galabru
Officiel gars d'la rue
J'offre le p'tit déj, à ta pute de bon coeur
On saute sans parachute, c'est och, on séquestre les pompeurs
Dix ans de rap au compteur
On t'emmène dans les profondeurs des ténèbres
Toute façon, faut qu'on meurt, putain !
You might also like[Refrain : Alkpote, Joe Lucazz & Nakk]
On fait nos bails dans nos zones en restant vaillants
Mes racailles vendent des sapes venant de Thaïlande
Leur triple système est plus que terrifiant
Nos faits divers sont devenus divertissement
On fait nos bails dans nos zones en restant vaillants
Mes racailles vendent des sapes venant de Thaïlande
Les frères, mettent des baffes aux psychologues
Et des tâches de mafé, sur le drapeau tricolore

[Couplet 2 : Nakk]
Ils font tellement de lovés
Veulent plus en vendre, ils veulent en consommer
Frère, on vise le sommet, eux ils visent le cochonnet
Tu feras pas le poids
Les mc's s'en foutent du sacre de Sarko
Du moment qu'il ferme pas les boites
C'est leur [?], c'est leur désastre
J'taille, autre chose à faire moi
A dix heures déjà
Jamais à la traîne nous
Pas le genre à dire ""attendez-nous""
Si vous jouissez quand on est à genoux
Attendez-vous à bandez mou
Mon côté pyromane
A, cramé votre plan
J'suis un volcan
J'suis pas dans votre camp des ciste-ras, un vote blanc
J'ai perdu des litres, de larmes
Rien d'idyllique, c'est comme a-ç comme le coma est éthylique
Avec les frères, j'reste prudent tu sais
Ca les tuerait de voir mon cul dans le Q7
Je vous emmerde vous tous
Qu'est-ce tu fais chier, la roue tourne
Un ancien braqueur peut finir caissier
[Refrain : Alkpote, Joe Lucazz & Nakk]
On fait nos bails dans nos zones en restant vaillants
Mes racailles vendent des sapes venant de Thaïlande
Leur triple système est plus que terrifiant
Nos faits divers sont devenus divertissement
On fait nos bails dans nos zones en restant vaillants
Mes racailles vendent des sapes venant de Thaïlande
Les frères, mettent des baffes aux psychologues
Et des tâches de mafé, sur le drapeau tricolore

[Couplet 3 : Joe Lucazz]
[?]
Ayez un peu de respect
Vu que les 2/3 de mes frères, mes collègues, mes cabrones
Mon sang, mon oxygène
Ont évolué en France mais sous le seuil de pauvreté
L'imbécile qui pense qu'il n'y a pas de sous métier
Bah qu'il vienne essuyer la merde sous mes pieds
Enfin la merde sous mes Prada s'il vous plait
Moi je vends la merde sous vos nez
Bref, c'est plus une dent qu'on a contre l'État
C'est la rage, rage
Tellement de douleurs qu'avant [?], le dentiste [?]
S'arrache les mollaires tout seul
Si si, l'oseille a une couleur
C'est le violet, Joe Lucazzi
Le rap c'est mon terrain
40 mètres, ammorti poitrine
Reprise de volée, but
J'ai vu l'avenir comme Isaac Mendez
C'est foutu, foutu
Tout Paris sous héro, tout l'monde plane
Que des super héros sous cess' pure
[Transition : Alkpote]
Néochrome bande de putains

[Refrain : Alkpote, Joe Lucazz & Nakk]
On fait nos bails dans nos zones en restant vaillants
Mes racailles vendent des sapes venant de Thaïlande
Leur triple système est plus que terrifiant
Nos faits divers sont devenus divertissement
On fait nos bails dans nos zones en restant vaillants
Mes racailles vendent des sapes venant de Thaïlande
Les frères, mettent des baffes aux psychologues
Et des tâches de mafé, sur le drapeau tricoloreEmbed"
Joe Lucazz,On l’a fait,"5 ContributorsOn l’a fait Lyrics[Couplet 1 : Flynt]
""La gloire est éphémère comme un squat""
La mine de cette ancienne vedette m'a dit ça
Je veux quand même plus de pepperoni sur ma pizza
J'aime quand le ciel est couleur Visa, quand les nuits sont courtes
Quand j'me fous d'combien ça coûte
Les bagages en soute, un beat en boucle
La plus haute marche sous mes pompes
Chemisette et braguette ouverte sur le mont
La musique c'est ma blanche : j'en consomme, j'en vends
C'que j'en pense c'est qu'j'ai encore pas réellement eu ma chance
J'suis motivé comme JJ
Et check ça pour soulever la coupe j'ai sorti mes plus belles claquettes comme Gianluigi (Buffon)
MC c'est l'alphabet qui nous sépare, qui rappe comme nous ici ?
Flynt Larry, gros gabarit, sors tes quinze balles quand j'arrive
Le rap, j'en vis par période
Sur une toute petite partie du globe
J'veux du love et des euros pour mes couplets
Que le hip hop français exauce mon souhait

[Refrain : Flynt & Joe Lucazz]
Charbonner au bas d'l'échelle, on l'a fait, on l'a fait
Raconter c'putain d'réel, on l'a fait, on l'a fait
Plus frais qu'eux vingt ans après, on l'a fait, on l'a fait
Influencer, représenter, forcer le respect, on l'a fait, on l'a fait
You might also like[Couplets 2 : Joe Lucazz]
Près d'un million et d'mi d'ennemis à mettre un million et d'mi sur ma défaite, mon squelette
Mimile, j'parie tout c'que j'ai
Tous réunis, le milli, ils ne l'ont pas
Dieu avant l'Diable, vieux avant l'âge
Le maigrichon prend d'la place
Donc, sur l'podium, ils n'iront pas
Micro dans la mimine, même les gros racistes m'applaudissent
Car, vos meilleurs nègres, je les pends comme Mississippi
L'amitié en dents d'scie, autant couper court mimile
Flynt Larry Joe Lucazzi, ça fait maintenant plus d'quinze piges
La Fatiha, grand sourire, devant quinze P.38
Ribambelle d'apprentis G's, plein le caleçon Dim
Nan nan, j'suis pas un d'ces nègres dans G.O.T
Toujours en noir comme Thierry mais j'suis plus Baffie
Négro, tout est possible, merci qui ? Merci Barack et chelle-Mi, crari

[Refrain : Flynt & Joe Lucazz]
Charbonner au bas d'l'échelle, on l'a fait, on l'a fait
Raconter c'putain d'réel, on l'a fait, on l'a fait
Plus frais qu'eux vingt ans après, on l'a fait, on l'a fait
Influencer, représenter, forcer le respect, on l'a fait, on l'a fait
Charbonner au bas d'l'échelle, on l'a fait
Raconter c'putain d'réel, on l'a fait
Plus frais qu'eux vingt ans après, on l'a fait
Influencer, représenter, forcer le respect, on l'a fait, on l'a faitEmbed"
Joe Lucazz,Open bar,"3 ContributorsOpen bar Lyrics[Couplet 1 : Joe Lucazz]
L'alcool, j'suis tombé dedans quand t'es tombé dans l'sport
J'me suis arrêté un an ou deux et j'suis retombé dedans
Faible donc j'ai besoin d'alcool fort
Mais pas besoin d'ta drogue, boy
J'fume mon chocolate, j'dis trop souvent salute
Et j'pisse du champ's
Mi-homme, mi-bouteille, les yeux mi-ouverts
Seul problème : j'sais plus où j'ai mis mon verre

[Couplet 2 : Cross]
J'me sens chez moi, à l'aise, quand c'est open mic
Les pieds sur la table quand c'est open bar
J'suis pâle, j'fais tâche comme un noir à Copenhague
J'm'installe entre 2 jeunes femmes
J'me sers dans l'canap'
J'me ressers et Joe c'est pas l'genre à m'dire : ""Déconne pas""
J'me ressers encore, j'suis fait, ça m'étonne pas
Les jeunes s'arment de flashs, Absolute Vodka
Whisky dissout dans l'jus ou l'Coca

[Refrain : Joe Lucazz]
C'est les mêmes qu'on croise à jouer aux cartes, accoudés au bar
Cross & Joe Lucazz, j'suis pas dans mon état normal
Et j'mets l'peura dans tous ses états
J'insulte le barman et j'laisse un pourboire
Si y'a bagarre, t'es mon flingue, j'suis ton pare-balle
Cross, t'es mon flingue, j'suis ton pare-balle
A chaque grosse cuite, j'crie : ""Demain, j'arrête tout""
La bière, Label 5, Jack Daniel's et tout
[Couplet 3 : Joe Lucazz]
50 ans d'âge mental
J'redescends à 30 après une bouteille de 12 ans d'âge
Grand, j'nique ma vie comme Naceri dans La mentale
Du champagne pour fêter une naissance
Du whisky quand un frère part
Dès qu'y'a open bar, tu peux sûrement croiser Joe Lucazz
Si ça finit en bagarre c'est qu'y'avait vraiment Joe Lucazz
Des connards et d'la vodka, moi j'vote pas
C'est comme l'eau plate : ça m'intéresse pas
Ceux d'la politique et moi, notre seul point commun : on est alcooliques
J'bois, on dirait qu'j'en ai marre de vivre
J'sais qu'ça m'détruit, ça m'déprime donc envoie l'pack de 6
J'ai jamais vu autant d'bouteilles vides devant l'épicier
Dieu, aie pitié d'nous, la folie est trop près d'nous

[Refrain : Cross]
C'est les mêmes qu'on croise à jouer aux cartes, accoudés au bar
Cross & Joe Lucazz, j'suis pas dans mon état normal
Et j'mets l'peura dans tous ses états
J'insulte le barman et j'laisse un pourboire
Si y'a bagarre, t'es mon flingue, j'suis ton pare-balle
Joe, t'es mon flingue, j'suis ton pare-balle
A chaque grosse cuite, j'crie : ""Demain, j'arrête tout""
La bière, Label 5, Jack Daniel's et tout
[Couplet 4 : Cross]
On dit qu'j'suis frais comme le champ's
Traître comme le champ's, on m'appelle Cross Cristal
Quand j'suis sec j'suis plutôt whisky, verre en plastique, pas en cristal
Un gobelet, un gros pet et j'pars en freestyle
J'ai une meilleure mine quand j'fume
Une meilleure vue quand j'fuis mon état normal
Ok, j'tise car j'flippe quand j'suis dans mon état normal
Ok, j'aime mes drogues et l'alcool m'aide
2 grammes dans l'sang, 300 dans mes grolles, mec
2 paires d'Air Force, celles qui m'ramènent quand j'suis trop dead
Oh, tu connais l'proverbe :
Qui vole un œuf, vole un qui boit un verre ? vide la bouteille
Oh, j'ai l'droit de boire vu que j'conduis pas
Quand j'suis ivre j'ai l'droit d'dire des choses qu'on dit pas
Mais shoote-moi si je parle de choses qu'on vit pas
Ou si devant ta famille j'me conduis mal

[Refrain : Joe Lucazz]
C'est les mêmes qu'on croise à jouer aux cartes, accoudés au bar
Cross & Joe Lucazz, j'suis pas dans mon état normal
Et j'mets l'peura dans tous ses états
J'insulte le barman et j'laisse un pourboire
Si y'a bagarre, t'es mon flingue, j'suis ton pare-balle
Cross, t'es mon flingue, j'suis ton pare-balle
A chaque grosse cuite, j'crie : ""Demain, j'arrête tout""
La bière, Label 5, Jack Daniel's et tout
Cross & Joe
Joe & Cross
[bruit d'une vitre brisée]You might also likeEmbed"
Joe Lucazz,Origines,"5 ContributorsOrigines Lyrics[Couplet 1]
Trop souvent, le manque d'euros a eu raison d'nous
Mes jnouns m'assurent qu'j'ai raison
Comparaître en tant qu'poucave, on connaît pas du tout
Autant commettre l'irréparable, fuck Frank Lucas
Moi c'est Joe, un tas d'ennemis tués à la came
Ça m'empêche pas d'dormir et j'rêve sans pare-balles
Ouais mimile, si j'dois partir je pars klhass
Regard acéré, j'attends l'grand départ, ta life dans le Grand Journal
Ancré dans l'vrai, j'vois clairement qu't'es englué dans l'fake
T'es dans une vraie merde, focus sur les gens qu'j'aime
J'ai dit focus comme le Ford l'est derrière nos culs d'nègres
Dans c'grand bordel, j'm'amuse à mettre en lumière
Les recoins les plus obscurs de l'âme humaine

[Refrain]
Seule ma mère peut prouver qu'j'suis l'même qu'à l'origine
Ma sincérité a foudroyé ma carotide
J'ai pas vraiment l'temps d'cogite sur mes calories
Mon côté bon citoyen, j'crois bien qu'j'l'ai aboli
Seule ma mère peut prouver qu'j'suis l'même qu'à l'origine
Seule ma mère peut prouver qu'j'suis l'même qu'à l'origine
J'ai pas vraiment l'temps d'cogite sur mes calories
Mon côté bon citoyen, j'crois bien qu'j'l'ai aboli

[Couplet 2]
Suivre les traces de Moïse, j'aimerais bien
Mais aussi celles de Pablo, avant sa fin
Moi j'me sens vieux mimile, comprends Marlo dernière scène, saison cinq
On sait tous très bien qu'à vivre par le flingue on meurt d'une rafale
Bang, pourquoi sortir l'machin ?
Dans la main, juste dans la mienne
Enchanté frangin, mimile ou mamen
Te connaître, un vrai honneur
J'suis qu'un personnage simple haut en couleur ébène
Qui n'arrête pas de prendre de la hauteur
Terrifié par l'bonheur, mais ça, comme tout un chacun je le cache bien
Et si tu connais pas la vraie douleur, c'est qu'finalement tu n'connais pas l'homme de couleur
Du coup frangin enchanté, à une prochaine c'fut un honneur (ciao)
Derrière ce flow nonchalant s'cache une histoire très prenante et très banale en même temps
Celle d'un jeune nègre ou d'une jeunesse déroutante
Avec en fond pleins phares et lignes blanches : un Paris la nuit éprouvant
You might also like[Refrain]
Seule ma mère peut prouver qu'j'suis l'même qu'à l'origine
Ma sincérité a foudroyé ma carotide
J'ai pas vraiment l'temps d'cogite sur mes calories
Mon côté bon citoyen, j'crois bien qu'j'l'ai aboli
Seule ma mère peut prouver qu'j'suis l'même qu'à l'origine
Seule ma mère peut prouver qu'j'suis l'même qu'à l'origine
J'ai pas vraiment l'temps d'cogite sur mes calories
Mon côté bon citoyen, j'crois bien qu'j'l'ai aboli

[Couplet 3]
Seul moi-même peut prouver qu'j'étais sur l'lieu du crime
Ma simplicité va foudroyer tout leur bling-bling
Plus vraiment l'temps d'cogite sur qui est vrai, mimile
Mon côté bon citoyen, pour sûr j'l'ai aboli
La vie tu n'l'apprends ni à l'école ni à la faculté
Dehors, on comprend vite qu'il n'y a aucune difficulté
À prendre la vie, et grâce à Dieu je jouis de toutes mes facultés mentales
Amine, mentalité...

[Refrain]
Seule ma mère peut prouver qu'j'suis l'même qu'à l'origine
Ma sincérité a foudroyé ma carotide
J'ai pas vraiment l'temps d'cogite sur mes calories
Mon côté bon citoyen, j'crois bien qu'j'l'ai aboli
Seule ma mère peut prouver qu'j'suis l'même qu'à l'origine
Seule ma mère peut prouver qu'j'suis l'même qu'à l'origine
J'ai pas vraiment l'temps d'cogite sur mes calories
Mon côté bon citoyen, j'crois bien qu'j'l'ai aboliEmbed"
Joe Lucazz,Paris,"7 ContributorsParis Lyrics[Intro]
Néochrome Paris
Ouais Mimille
Monsieur Lucazzi

[Couplet 1]
L'œil très  vif d'un pako vendeur d'maïs Chateau Landon
Faux Marlboro, j'sais mais j'achète, j'soutiens mes deux-trois clandos
Clin d'œil Barbès, bisous j't'aime et une centaine de monstres
Dans le 8ème, veulent revenir au temps de Django
Ils sont Scènes de ménage, moi la saison 4 de Narcos
Rive droite : deux tchoins, rive gauche : trois milfs ivres
Je brunche sous un tas d'drones
Attend que me-ca sorte du cargo, que deux-trois go-fast vident le ffre-co
Que deux-trois d'mes gars sortent du cachot
Et que l'pays de Riner Teddy défie toutes sortes d'embargos
Trois kilos de white pure dans ce luxueux sac de re-spo
Tranquille, je prends un Heetch, j'suis chez nous à gare du Re-No
Dixit ta cougar Morano, je ride

[Refrain]
J'ressens l'manque quand j'pars d'ici
Comme une paire de fesses, j'veux la r'voir très vite
Dieu que j'aime cette ville
J'y passe du rire franc aux larmes d'Hennessy, j'y ai un tas d'ennemis
J'ressens l'manque quand j'pars d'ici
Comme une paire de fesses, j'veux la r'voir très vite
Dieu que j'aime cette ville
J'y passe du rire franc aux larmes d'Hennessy, j'y ai un tas d'ennemis
You might also like[Couplet 2]
Trop l'moral dans les chaussettes et trop les ondes pleines de dope
Paris est magique mais tellement strict négro
Nanzi à Ancelotti Carlo, c'qu'articule ma boca, que du fuego
J'parle le bon çais-fran, Audiard père, et maîtrise l'argot
J'fais l'fric en verlan, le peso
Et j'prie en arabe, boit l'Château Margaux
Charlotte, prépare les pochons, Margaux répond au phone
Casanova parisien macho yayo
Elle fait des pailles avec la note du resto, chienne, shit
Y'a erreur sur la personne, je les aime toutes ces folles
J'suis à la recherche d'une lionne
J'ai aimé beaucoup d'Roths
Oui, j'en profite car Dieu pardonne
Gloire à ma mère, petit, et à toutes les autres
Mais qui suis-je pour juger qui est qui ?

[Refrain]
J'ressens l'manque quand j'pars d'ici
Comme une paire de fesses, j'veux la r'voir très vite
Dieu que j'aime cette ville
J'y passe du rire franc aux larmes d'Hennessy, j'y ai un tas d'ennemis
J'ressens l'manque quand j'pars d'ici
Comme une paire de fesses, j'veux la r'voir très vite
Dieu que j'aime cette ville
J'y passe du rire franc aux larmes d'Hennessy, j'y ai un tas d'ennemis
[Couplet 3]
Dans tes plus grands restos, le cuistot est indien, sri lankais, malien
À chaque feu rouge, mendie famille d'roumains
Postichés en syriens, la plus belle avenue aux Qataris elle appartient
De bon matin, Irish coffee, trop ivre, j'suis un grand gamin
J'parle au fantôme du vrai Lino, critique le vrai Jean Gabin
Loin d'Paris, j'me sens pas bien

[Refrain]
J'ressens l'manque quand j'pars d'ici
Comme une paire de fesses, j'veux la r'voir très vite
Dieu que j'aime cette ville
J'y passe du rire franc aux larmes d'Hennessy, j'y ai un tas d'ennemis
J'ressens l'manque quand j'pars d'ici
Comme une paire de fesses, j'veux la r'voir très vite
Dieu que j'aime cette ville
J'y passe du rire franc aux larmes d'Hennessy, j'y ai un tas d'ennemis

[Outro]
Yeah, M'sieur Lucazzi, GG parisien
75021, c'est chez moi mimille
Passe me voir frangin
GG parisien, yeah, m'sieur Lucazzi
Néochrome ParisEmbed"
Joe Lucazz,Paris Dernière,"3 ContributorsParis Dernière Lyrics[Couplet 1 : Char]
J'ai vu des schtars bicrave' d'la verte
Des schlags qui braquent la quête
J'ai entendu plus d'histoires bizarres qu'un prêtre
J'ai vu grimper le prix d'la plaquette
J'viens d'où même ton pote pourrait te fuck
Et prendre ta go pour une bouteille de Yop
Pendant que les tafs de merde butent nos daronnes
Des mecs du FN brûlent nos bagnoles
C'est pas un jeu, crois pas que [?] t'offre une vie
Dehors c'est la guerre [?] joue à Call of Duty
A l'école de la rue les contrôles sont abusifs
Mes crapules ont Bac+6
Donc quand est-ce qu'on palpe du bif
Comme les comptables du CRIF
Pas d'poudreuse, j'connais que les montagnes du Rif
Ma gourmandise veut que j'parte au casse-pipe
Mais mon auréole me sert d'anneau gastrique
Donc t'étonnes pas qu'mes orphelins morts de faim
T'mordent le sein, ou qu'les petits t'sortent l'aiguille de la botte de foin

[Refrain x 2]
Paris dernière, une ambiance si particulière
Paris dernière, le côté sombre de la ville lumière
Est-ce le jour qui se lève ou bien la nuit qui tombe ?
Paris dernière, le temps ramasse à la petite cuillère
You might also like[Couplet 2 : Joe Lucazz]
Quand la nuit tombe dans le centre
J'deviens président, mon jnoun premier ministre
Une étoile noire qui scintille à midi pile, ou j'traine
Un atout n'est qu'une crari, une victime
Tout comme madre agit toujours à l'usine
Promis j'n'étais pas sur les lieux du crime
T'façon une MILF connue me servira d'alibi
Rien d'éternel, c'est horrible
Regarde Angelina et Brad Pitt
Attention Mimile, Mr. Smith n'est pas une réplique
Malheureusement, comme Gucci la rue réplique
Quand sur mes caries l'ivoire et l'or s'entrechoquent
J'ai du diamant dans la réplique
Paranoïaque oui tu peux le dire
On dort avec le Desert
Rêve du dernier Eagle
Physique de jeune thug
Mental de OG
Gigi Parisien
Quand il s'agit d'biff
On à déjà les fins
Addiction à l'absinthe
J'aime cette vie, Mimile

[Refrain x 2]
[Couplet 3 : Char &   Joe Lucazz ]
Pur produit de Paris et de sa proche banlieue
De Corbeil à Porte d'Italie j'puise ma force en Dieu
Pur produit d'la ville, la poche pleine de E
De Rosny à Porte de Clichy, j'teste ma foi en Dieu
Air pollué, y a pas de joli ciel azur
Des mères préoccupées par les policières bavures
Crépuscule arrive, y'a rien de funny j't'assure
Que des frères trop occupés à rentrer les petites coupures
Nan je n'rappe pas si je ne trouve pas la rime ultime
Donc si j'ai plus d'inspi tu n'verras pas à la suite du film
J'arrête [?] quand Paname s'illumine
Capsule d'eau d'la piscine pour analyse d'urine
Non j'parle pas quand j'me retrouve d'face et d'profil
J'suis plus un petit, parfait opposé de l'indic
Triste devant tant d'hypocrisie
J'abuse de l'eau de vie, meurs près de Rivoli

[Refrain x 2]Embed"
Joe Lucazz,Paris je t’aime,"3 ContributorsParis je t’aime Lyrics[Couplet unique]
Paris, belle gosse et féroce, une vraie lionne, j't'aime fort, te dompter ou pire, te tromper ?
Au-d'ssus d'mes forces mais je ne reste qu'un homme, polygame marié à la banlieue en seconde noces
Et quand chaude est la nuit
Dans certaines de tes artères poussé à l'extrême ça tire
La ville lumière, plus un nègre sombre sombre, égal les extrêmes s'attirent
Fin seventies, notre première rencontre, c'est maintenant qu'j'réalise Bériz, t'es la plus belle du monde
Fier, je te raconte mieux que Klapisch et depuis l'ère qatari, on parle de toi comme d'une bitch
J'ai dû vite revêtir ma tenue de pimp, Slick Rick, Ménilmontant, 18
Ton thé à la menthe m'émoustille
Révolution chatouille l'ouïe fine
21 arrondissements, j'ai créé l'nouveau Belleville
Tes cellules de dégrisement, easy
Chaque nuit, j'me détruis et chaque matin, j'te french kiss
Suicidaire idylle, GG parisien, sénégalo-malien
C'est dans tes bars kabyles que prennent vie mes putains d'refrains, j'ressuscite B.I.G., redonne vie à Brassens
C'est comme Ferré, j'suis friand d'ton quartier latin, encore plus de mafé dans appart' haussmannien
Ivre, dans une cave à vins, je déguste la vraie absinthe
Tu m'croises à minuit moins cinq, prie pour moi frangin que je revois Paris d'main matinYou might also likeEmbed"
Joe Lucazz,Paris je te hais,"3 ContributorsParis je te hais Lyrics[Couplet unique]
Paris, vraie folle, de belles formes, t'es énorme, je te hais fort
Te switcher ou mieux te quitter au-dessus d'mes forces
Mais je ne reste qu'un homme
Qu'une seule femme, marié à l'Africa en premières noces
Et quand froide est la nuit dans certaines de tes artères, junkies ont élu domicile
La ville obscure plus un nègre brillant égale une rupture drôlissime
2018, notre dernière rencontre, c'est trop tard qu'j'réalise
Bérize, t'es la plus laide du monde
J'raconte tes dessous mieux qu'un film X
Et depuis l'ère qatari, à leurs yeux tu n'es qu'une victime
J'ai dû vite retirer mon costume de G'
Big L, quartier huppé, 10ème
Ton Château Pétrus, j'le vomis
Révolution Place République, trop bobo, j'ai des relents de mai 68
Tes cellules de dégrisement fini !
Chaque nuit tu m'détruis et chaque matin je t'esquive
Fusionnel idylle, ex-titi parisien, du monde entier, citoyen
Dans tes bars auvergnats se meurent mes putains d'refrains, j'ressuscite ODB, redonne vie à Dassin
Et comme frustré, j'suis client d'ton quartier tapin
Encore plus du magret dans HLM parisien
Sobre, je parle au divin, je m'excuse, j'arrête de m'plaindre
Tu m'croises à minuit plus cinq, prie pour moi frangin, que je ne revois plus Paris d'main matinYou might also likeEmbed"
