Artist,Title,Lyrics
Joe Lucazz,Demain N’existe Pas,"3 ContributorsDemain N’existe Pas Lyrics[Intro]
Sur mon fridge cainri y'a écrit ""va chercher l'million"" sur un million d'post-it
Le million, le million, le million
Joe Lucazzi

[Couplet 1]
Apparition d'une comète, mes parents s'inquiètent
Maman stresse et hop, premier octobre, j'vois l'jour dans le douzième (hello, hello)
Sous les sandalettes de madre, j'entraperçois l'paradis
Sous les Weston du padre, je peux voir le regard d'Iblis (hello, hello)
J'pardonne mais j'n'oublie rien, que tchi
Mon corps pendu à un arbre d'eau recouvert de graffitis
Bah ouais mimile, j'suis dans la drogue, rime bien avant l'wifi
Du caramel du Riff au produit phare du Cartel de Cali
J'entends les pleurs de mes ancêtres : ""Aladji, qu'est-ce qu'il t'a pris ?""
J'déforme c'magazine, cherche mon patronyme, billaye qu'est-ce qu'il m'arrive ?
L'or de Kinshasa sur mes canines
Qui me mord me rappelle que j'ai des canines (grrr)

[Refrain] x2
Tu m'vois, tu m'croises mais on n'se connait pas
Tu m'hates : érection du troisième doigt
Tu m'scrutes, me juges, on dirait les schtars
Mimile, demain n'existe pas

[Couplet 2]
J'suis frais sa mère comme produit frais au marché d'Rungis
J'suis jeune, j'suis beau, j'suis Gatsby donc j'suis magnifique
Orange serait mon costume si j'étais né à Brooklyn
Dieu a design ma vie, mimile, j'suis une fashion victime
Seul Dieu tient ses promesses
J'évite toutes sortes de crédit, mimile, tu n'es pas Rocky, niet
J'suis pas fils de Crib alors easy
Coincé entre toit du building et c'putain d'ciel gris
J'suis la liaison entre bar très chic et épicerie
Joe Lucazzi, paranoïa à son paroxysme
V'là où j'en suis : je prie L'unique avec des gants d'légiste
L'fusil n'est pas très loin car ces fils de lâche, ces fils de tshoin j'en connais très très bien
You might also like[Refrain] x2
Tu m'vois, tu m'croises mais on n'se connait pas
Tu m'hates : érection du troisième doigt
Tu m'scrutes, me juges, on dirait les schtars
Mimile, demain n'existe pas

[Couplet 3]
Ils m'dressent des louanges et ma tête les dérange
Plus qu'un produit d'mon environnement
J'suis un pur fruit de ce continent
Qui s'est construit uniquement sur la vente
Machine à remonter l'temps : le Franc, tonton Mitterrand
J'voulais être un Drummond, j'rêvais d'être un gangst'
On n'voyait pas d'argent et j'croisais peu d'blancs
Innocent et naïf, j'pensais même qu'l'argent était blanc
Pas si naïf finalement, plus tard je me suis mis dans la blanche
Et fais-moi confiance
Quand l'produit est bavon, pas d'heure d'affluence
Paris, on m'a crucifié sur mon lieu d'naissance

[Refrain] x2
Tu m'vois, tu m'croises mais on n'se connait pas
Tu m'hates : érection du troisième doigt
Tu m'scrutes, me juges, on dirait les schtars
Mimile, demain n'existe pasEmbed"
Joe Lucazz,Désolé M’man,"6 ContributorsDésolé M’man Lyrics[Couplet 1]
Hello motherfuck, bande de fakes Joe c'est mon boss
Lucazzi mon big boss, mi-homme, mi-machine
J'suis Smith, j'suis Wesson, lavé au village
J'suis propre, j'suis big, j'suis comme Pac
Et ça c'est c'qu'ils disent quand Joe come back
C'est flow flingue Phillies métis j'suis crips j'suis blood
Une vie une mort tu fais l'Yéti de suite j'te Glock
J'suis noir, bandeau blanc j'suis Corse
J'suis l'Rat Luciano, j'suis Flynt et j'suis Bors'
T'es marteau j'suis Thor
Y a 4 siècles j'suis mort, j'ressuscite j'suis sport
J'suis Or, j'cours sur l'eau j'suis Bolt
J'suis sobre j'suis fucked up, enfermé, locked up
Dehors j'brûle à p'tit feu l'Enfer j'arrive j'suis Torche
I Shot the Sheriff j'suis Bob
Vous n'êtes pas ma pointure, niet, tu fais semblant, fake

[Refrain]
J'ai le cuir noir, blue jean, T-shirt blanc
J'ai la fureur de vivre et en même temps
J'attends la divine furie la fureur des éléments
Désolé m'man, désolé m'man
J'ai le cuir noir, blue jean, T-shirt blanc
J'ai la fureur de vivre et en même temps
Incorrigible jusqu'à pieds d'vant
Désolé m'man, désolé m'man
[Couplet 2]
Ma présence aspire l'air de tout ton hall
J'reste 18 s'condes et il d'vient une des zones
Les plus criminogènes de l'Hexagone
Des briques dans la tête, du ciment dans les atomes
J'suis têtu j'suis un mur j'suis la chose
Enlève ta main d'ma poche j'suis ton arthrose
J'ai dit à la hass ne m'adresse plus un traître mot
J't'ai jamais aimé, chienne, j't'ai trompée avec l'Euro
Pieds nus dans l'Dîn j'suis au max
Reebok dans le h'ram, j'suis au calme
J'fais mon khaliss en souriant à pleines chicos
Dans l'boxer Dim produit exotique bio
Moi et ma be-dau association d'malfaiteurs en binôme
Bientôt ma vie sur HBO, drogue, cash et bimbos
Nan c'est cash, drogue et bimbos
J'baise trop d'anonymes, par dépit j'baise des peoples

[Refrain]

[Couplet 3]
Sauf le respect que je vous doit
Le respect je me l'octroie, on a presque l'même game
Mais j'suis auteur-roi, si nomination aux Thug Awards
J'ai croqué l'fruit interdit c'était l'boul de Awa
Giflé l'marabout, brisé la boule de cristal
Qui sont mes héros ? J'n'en ai qu'un
Le négro dans l'miroir
J'suis Dakar, j'suis Bamako, N'Diaye, Sissoko
Diego Bombara-donna mais surtout j'suis
Il es où l'fric, il est où, depuis Gorée
J'm'étais juré, ils le paieront et plein pot
TU pensais être vif mais ton inspi vient tout droit de mon pochon
L'écriture fait frémir RG, fait gémir PJ
Pris à mon propre jeu, piégé
Un je tire, deux je prie
Incorrigible jusqu'à pieds d'vant, corps rigide
Armoire frigorifique
[Refrain]You might also like1Embed"
Joe Lucazz,Double Whopper,"7 ContributorsDouble Whopper Lyrics[Intro]
Yeah yo
C'est monsieur J.O.E
Neochrome Puro
La main de Diego
Yeah
J.O.E

[Couplet 1]
Je parle le Frances, l'ingles, un poco le verlan et l'Euromillion
Je suis donc quadrilingue, souvent on m'appelle Lucchese
Parfois Jo-Jo ou chaud comme la braise
Parfois froid comme Kremlin
Dans des histoires compliquées, un brin enfantin
Genre on m'doit de l'argent ou j'en dois, mauvais garçon
Drogue, hauts talons, je ne suis qu'un citadin
Mon CV peut tenir sur un timbre
Bientôt ma dope dans les guides Michelins
Vos menaces n'allongent pas le canon de vos petits flingues
3.5.7 Mag', beaucoup trop lourd pour vos petites mains
De pianiste ou de petites tchoins
Crête, dreads, ou boule à Z
Un tir de sommation et je vise là où sont les six points de Krilin
Si mes racailles brillent c'est que l'écaille brille sur le terrain

[Refrain] x2
La dope ça porte malheur, Quoi ?
J'ai rien entendu ma p'tite gueule, khaliss égale power
Purple liasse d'une véritable épaisseur
Double Whopper, Double Whopper
[Couplet 2]
Mais trop de money, trop de problèmes
Et pas de money, plus de problèmes
Si t'as entendu que jeune je fus pauvre
Ce n'était pas une rumeur, alcool Bentley mauve
Vroom vroom, que j'arrive piano piano
Ou qu'j'mette une vitesse j'fais toujours l'même effet
Une craie neuve sur le tableau
Une crête jaune sur la chimio, blood diamond sur la chicot amigo
C'est aux urgences qu'on reconnait le Très-Haut
Dans l'urgence qu'on commet la faute
Dans l'argent qu'on connait la taule
Dorénavant prenons notre temps, parlons d'abord de business plans
De business blanche et d'auto
Ma bave est purple et mes mots sont kakis
Moi être aveugle mais moi tirer dans le mille
Mon troisième œil ne voit en toi qu'une crari
J'espère le meilleur et me complaîte dans le pire

[Refrain] x2

[Couplet 3]
Nan mimil, ce n'est pas une info
T'as le regard froid et un cœur d'artichaut
Gardons nos distances genre, toi en bas moi là-haut
Un peu comme les points cardinaux N-S
Esprit criminel, j'touche tout à prix de gros
J'écris ma musique à Quantico
Gros mollard sur qu'en dira l'autre
Je ride ma parano comme De Niro dans son taxi jaune
[Refrain] x2You might also like2Embed"
Joe Lucazz,Doutes,"2 ContributorsDoutes Lyrics[Couplet 1]

J'suis entouré de frères mais si tonight
J'fais une dinguerie qui m'retiendras ?
D'ou j'viens, seul rabbin, prêtre ou Imam
Pense que le crime ne paie pas
Fuck tes grandes écoles !
Fuck tes prépa !
Ils sont à propos de qui est Charlie et qui ne l'est pas
Je suis a propos de couguar, biff, milf
Kil de me-ca, arrête de faire le six gros, gros
Tu n'a deal que deux me-gra
Front incliné en direction de Mecca
Que dieu me pardonne j'ai prié le million
J'ai prié le milliard en che-ca
Marre d'entendre Joe steuplai une dernière ligne !
Une dernière ce-tra
Vu mon train train de vie j'en suis quasi sûr flic me tuera
Wallaye ! (bang bang)
Crise j'connais pas, près des couilles : peu-fra
Merde une patrouille ! J'évite leur regard
Maitrise le bicar, méprise la hagra
L'oeil du tigre ! J'flégi Adrian
La salade m'empèche de vriller ? Ils veulent briser mon éclat
M'empêcher d'briller
S'appellerait-il Ray Ban ?
Dieu merci je vois en eux j'suis ni Gilbert ni Ray Charles
You might also like[Refrain]

Grande classe mais pieds nus
Vivre mais désoeuvré
Je décois, j'ai décu, j'décevrai
Du kecra, d'la repu, mes refrè
Grands boulevards (grandes avenues) p'tites ruelles
J'te vois pas t'es aujourd'hui j'suis après
Princes de la ville, j'suis Karim, j'suis AP
Futur dans l'rétro j'te comprends pas j'suis navré (un navire)
J'ressens plus tes coups de fouet

[Couplet 2]

C'est pour mes Sony K, Bamba Rapple
Mandya Jola, pointure 45
Genre la deuxième guerre, magnum, ou paire de Jordan
Plus gentil que Lucazzi , le Christ
Plus pourri qu'un flic, deux flics, trois flics
Bilaye j'suis un mec peace
Comme la mienne est positive
Si j'sors le Klizy shit, c'est qu'j'n'avais pas l'choix
Dix grammes par ci, dix grammes par la
Ce soir je vise, dans l'dos d'la traitrise
J'suis croyant donc please
Va la bas !
Un tas d'ennemis je vous aime, Hamdoullah
Lucazz, A.k.a David, mon étoile scintille oui Goliath
Pro black, moi ? Non (?)
Mais j'trouve pas ma place ni ma couleur dans votre sainte Bible
Une teille de St James, malsain liquide
Purple est la money, malsain liquide
(?) jardin j'arrive vite, enfer éternel
J'arive ptètre mais finalement seul Dieu décide
[Refrain]Embed"
Joe Lucazz,Drogue et crime,"5 ContributorsDrogue et crime Lyrics[Couplet 1]
Frérot, le fait d'être négrillon n'a rien d'un stigmate
Pourtant les doigts pointent dans ma direction
Ne t'fie pas à 2/3 exceptions, les flics ne t'aiment pas
XXX une fois cette vérité mise à nue
Habille-toi, remonte le zip et dis bonjour à la ville (hello)
Tes seuls objectifs ? Rentrer vivant, rentrer plus que la veille
Chérir la vieille, si elle est encore en vie
D'abord le Che, maintenant Chavez, bientôt Lucazzi
Oh, négro, même si tu portes un masque et baisses la tête
Tu restes la bête alors r'lève ton masque de fake et relève la tête
Cramé de Lille à Aix, de Brest à Metz
Ça dure d'puis un moment frère et c'est toujours d'actualité
Comme règlement d'comptes sur l'Île de Beauté
Ils le paieront, j'm'étais juré, sur l'île de Gorée
Négro attends, attends, j'arrive, j'vais t'raconter

[Refrain] x2
C'est apéritif après apéritif
Le pouvoir exécutif boit et la rue trinque, révoltante
Le rire du Diable est communicatif
De Matignon j'les entends

[Couplet 2]
Ce monde j'le comprends, mais qu'à moitié
Attends un peu, j'vais t'raconter
Parfois, un bruit familier, un son qu'on aime ou qu'on apprécie, peut nous effrayer
Comme tard la nuit, la voix inquiète de madre
Ou, en pleine journée, le bruit du TMax qui ralentit à mes côtés
L'appel de la salade, dès qu'j'me barre charbonner
D'ailleurs dehors et moi, quel doux mélange
On a toujours fait bon ménage, rhum orange
Et puis non, vodka pure sans glace, pas d'mélange
Emmett Till ? Lynché pour avoir sifflé une blanche
Je reconnais cet air démoniaque sur lequel l'Elysée aime remuer les hanches
[Pont]
C'est notre p'tite histoire : drogue et crime
C'est ma p'tite histoire : drogue et crime
C'est notre p'tite histoire : drogue et crime

[Refrain] x2

[Couplet 3]
Négro, attends attends, j'arrive, j'vais t'raconter
Sous la houlette du diable, ils veulent nous désamorcer
Que du vent, j'ai grandi, ri et pleuré
Accompagné de miss pauvreté et ses deux fidèles domestiques : drogue et crime
Pour la p'tite histoire, Joe Lucazzi c'est : dépêche-toi d'vivre et meurs jeune
Ton cadavre aura encore une belle gueule

[Refrain] x2You might also likeEmbed"
Joe Lucazz,Faire du gent-ar,"11 ContributorsFaire du gent-ar Lyrics[Intro : Alkpote]
Neochrome
Les Mazter Chefs
La boulangerie française
2014
Alk-putain-de-pote
Joe-putain-de-Lucazz
DJ Weedim

[Refrain : Alkpote]
On démarre en fanfare, escalade les remparts
Faut pas qu'on arrive en retard, pose ton joint dans l'cendar
Vaniteux et vantard, Neochrome l'étendard
On va t'rentrer dans l'lard, à la fête tu prends part
On doit faire du gent-ar, on doit faire du gent-ar
On doit faire du gent-ar, salope, on doit faire du gent-ar
On doit faire du gent-ar, on doit faire du gent-ar
On doit faire du gent-ar, salope, on doit faire du gent-ar

[Couplet 1 : Alkpote]
Dès qu'le micro j'm'en empare, je vous offre du grand art
J'suis cette perle vraiment rare, le diable m'a filé un rencard
Dans une cave ou un hangar, j'ai esquivé tellement d'shtars
Z'ont voulu m'arrêter devant l'bar, j'passerai jamais sur Fréquence Star
J'me suis sapé tout en noir, j'm'accroche à des lianes comme zan-Tar
Hélicoptère, sous-marin, lance-roquettes, tank, char
Alk' est gé-char comme Bianca et Bernard
J'fais pas trop d'écart, pour l'instant j'suis veinard
J'fume d'la beuh des Pays-Bas dans des putains d'Cohiba
J'vais pas faire profil bas, j'suis l'taureau dans la corrida
Ne va pas pécho l'SIDA avec une putain d'Lolita
Une Alizée qui va t'paralyser comme cet enfoiré de Tony Jaa
J'calcule pas Taubira, encore moins François Hollande
Tu peux venir voir nos ninjas pour passer commande
Le savoir est une arme, vive Bachar El-Assad
Le charas, la salade, les barrages j'escalade
You might also like[Refrain : Alkpote]
On démarre en fanfare, escalade les remparts
Faut pas qu'on arrive en retard, pose ton joint dans l'cendar
Vaniteux et vantard, Neochrome l'étendard
On va t'rentrer dans l'lard, à la fête tu prends part
On doit faire du gent-ar, on doit faire du gent-ar
On doit faire du gent-ar, salope, on doit faire du gent-ar
On doit faire du gent-ar, on doit faire du gent-ar
On doit faire du gent-ar, salope, on doit faire du gent-ar

[Couplet 2 : Joe Lucazz]
J'suis la raison pour laquelle ils serrent les menottes à fond
J'suis la raison pour laquelle on trouve d'la coke sur tous les biftons
Alk', Joe Lucazz, Joe Lucazz, Alk'
Persona non grata parce que personne nous drive
Pose de la came, une pelle, une pesette que j'creuse mon ile dom' fiscal
Sois très bref sur mon portable, j'sais pas moi, code ton message
Ou bien j'ai mieux : ne m'appelle pas, tout Paris la veut wAllah
Che-blan dans l'pochon noir, peufra tah Paul Pogba
Frère, me calmer à quoi bon ?
J'n'ai pas encore touché mon premier M, premier million
J'ai l'euro migraine gros, grosse somme comme somnifère
Seule une pile d'oseille peut domestiquer ma colère
M'encule pas frère, opé sur tous les ter'
Joe de La Villardière, le roi d'la poudrière
Le nez plein d'Val d'Isère, bitch arrête tes petites manières
Ici c'est charbon everyday
[Refrain : Alkpote]
On démarre en fanfare, escalade les remparts
Faut pas qu'on arrive en retard, pose ton joint dans l'cendar
Vaniteux et vantard, Neochrome l'étendard
On va t'rentrer dans l'lard, à la fête tu prends part
On doit faire du gent-ar, on doit faire du gent-ar
On doit faire du gent-ar, salope, on doit faire du gent-ar
On doit faire du gent-ar, on doit faire du gent-ar
On doit faire du gent-ar, salope, on doit faire du gent-ar

[Couplet 3 : Alkpote]
J'veux pas finir sur un brancard, j't'avoue que j'en ai souvent marre
Ma frappe c'est du Carambar, toi tu fumes du shit standard
Alkpote et Joe Lucazz, Joe Lucazz et Alkpote
Un magnifique ange à ma droite, un maléfique ange à ma gauche
Je dois faire du khalis et n'plus faire de bêtises
Je dois faire mes valises pour m'éloigner d'Beriz
Je dois faire des dinars, je dois faire des dollars
Je dois faire d'la monnaie, salope, je dois faire des billetsEmbed"
Joe Lucazz,Fast Life,"2 ContributorsFast Life Lyrics[Paroles de ""Fast Life"" ]

[Intro : Joe Lucazz]
Yeah

[Couplet 1 : Joe Lucazz]
Du négrier navire au voilier plein d'came, j'ai l'sourire d'Alicia
Noblesse bambara héritage, Double Whopper : taille d'la kichta
Sept, ffre-chi, Huit, il s'agit d'ça
Fast Life, il vient d'ailleurs : Igor, Grichka
Guidé par l'fantôme de Pablo Gaviria
Sept, ffre-chi, Huit : ça suffit pas
J'côtoie fille de magistrate, fille de magistrate
J'côtoie sicaria comme [?], bounce
Depuis les cojones du padre, j'ai la grinta
J'suis dans le violet comme Prince
RIP Akira

[Pont : Eloquence]
Soldat et général
Ma mentalе et mes dix doigts
Si t'es parti, nе reviens pas
Moi j'suis trop loin : cour des miracles
Soldat et général
Ma mentale et mes dix doigts
Si t'es parti, ne reviens pas
Moi j'suis trop loin : cour des miracles
You might also like[Refrain : Eloquence]
Fast Life
Parler, toucher, pas de FaceTime
Fast Life
On vient, on arrose, oui, on hydrate
Fast Life
Parler, toucher, pas de FaceTime
Fast Life

[Couplet 2 : Siegel]
La trahison laisse des cicatrices
Pourquoi elle m'deale autant le sang ?
Vérité s'trouve peut-être dans un livre
Certains en cherchent encore le sens
Incompressible est la peine
Douleur intense dans la tête
J'ai vu l'bonheur s'faire la belle
Soit t'es l'élève, soit le maître
Fast Life
L'asphalte, le bitume sous la semelle
Reflet des lumières dans la Seine
La mère d'la princesse, on la serre
Polaire est le froid qui m'encercle
En manque de sommeil toute la semaine
Fumé comme le verre d'mes lunettes
Ce soir, j'vois la Lune qui est pleine
Ce soir, j'vois la Lune qui est pleine
Blessés, on s'attaque à la bête
On s'bute tous les soirs à la verte
En espérant qu'ce soit mieux que la veille
Mais si tu changes rien, c'sera la même qu'hier
Parce que l'humain, c'est rempli d'faiblesses
T'es sur le terrain ou dans l'vestiaire
Ils pensent que plus haut, y aura d'l'oxygène
Veulent toquer à la porte de l'architecte
[Pont : Eloquence]
Soldat et général
Ma mentale et mes dix doigts
Si t'es parti, ne reviens pas
Moi j'suis trop loin : cour des miracles
Soldat et général
Ma mentale et mes dix doigts
Si t'es parti, ne reviens pas
Moi j'suis trop loin : cour des miracles

[Couplet 3 : Eloquence]
On a croqué la pomme à Val Pépin
Pour le prix d'un Birkin, on te festin
J'me lèche les babines en y pensant
Never Broke Again : des flaques de sang
Billet de keusdi en liasses de cent
Victoires et échecs se ressemblent
C'est l'Homme qui a peur de son ombre
Comme des aides dans la verte et la blanche
Joue cartes sur table : on apprend pas à nager aux squales
Marty dans Ozark, tout pour la famille, trop d'cordes à mon arc
Le bail est deep pour les profanes
Sucré, salé sur le palais
Arrière-goût d'la vie qu'j'ai mené
[?] comme fleur fanée
Surface de nous fait ricochetEmbed"
Joe Lucazz,Flingues Et Roses,"1 ContributorFlingues Et Roses Lyrics[Premier Couplet: Ichi]
J'fais du bruit partout, j'suis Radio Raheem (Raheem's)
C'est des Éric & Ramzy, nous des Eric & Rakim (Rakim)
J'ai failli m'faire avoir mais j'ai pas fini la thérapie (j'ai pas fini)
Si j'étais un rappeur de merde, j'aurais dit j'veux la Ferrari, non (haha)
J'veux la deux-ch'vaux, deuzio, j'veux qu'Traouré affronte Macron d'ses deux yeux (d'ses deux yeux), puis Putin
Faut pas s'mentir, il est un peu vieux
Incha'Allah, après l'pèt', y s'portera un peu mieux (incha'Allah)
Fuck un raciste, fuck un Champollion (on vous emmerde)
Boivent du Champomy, nous du Champagne de champion
J'déconne, plutôt grande bière de campagne et champignons
Grand ter', des grandes dames et ganglions
Gonflés à la fin d'la semaine, tellement nous nous enquillons
Tranquillement entre les Grottes et la Jonction
Roule sur skate, bike et rien d'autre
On est 13, on sait pas qui c'est Jésus, tous des apôtres (tous des apôtres)
Tous des apôtres, merde

[Deuxième Couplet: Joe Lucazz]
Deux mains, deux crosses, deux flingues, deux glocks
Main gauche, j'suis faible, main droite, trop forte
Sur la crosse du Wesson
Rose-noir, rose-rouge, c'est mon côté Rock'N'Roll
Mon côté glamour
Thug Life for life, mon côté Shakur
Corner alimente ma bile
Mon côté Rat Luc'
Pour chaque bouche qui jalouse
J'ai un grand calibre dans chaque joue
Ta fierté n'est pas un pare-balle, pas du tout
Super OG, un gravand pour le coup
Nous c'est famille avant vous, prière avant l'four
Khaliss avant tout
J'suis qu'à propos d'ça et c'est non-négociable, écoute
Y'a ceux qui entendent, ceux qui écoutent
Ceux qui la vendent, ceux qui la goûtent
Ceux qui le vivent, ceux qui le voient
Ceux qui voient double, ceux qui voient flou
Tu vois c'qu'j'veux dire ou pas?
You might also like[Troisième Couplet: Cosy]
Belle rose pour le 'tit, celle de tous les jours
Couleur verte toute pleine, verte de sang d'amour
Coin qui brûle encore, toute seule pleine dans l'hood
Haschich bloc tu sens, ça deviens d'la poudre
Laisse mémoire le jour, rose de tous les jours
Couteau sous l'survet', ensemble un p'tit four
Haschich devient poudre, rues sont pleines de roses
Roses de tous les jours, rose le matin s'ouvre
Fleur, je pré-dispose, haschich devient poudre
C'est dans les roses, que poussent XXX

[Quatrième Couplet: Ankerboy]
Et tout baigne tant qu'mon corps flotte pas dans la Seine (ouais)
J'aboutis l'acte et poursuis sur prochaine scène
Celui qui fouettait, ainsi qu'le XXX
Il aura fallut qu'ça sorte pour comparer la XXX
J'vis normalement mais touche pas encore le bizz'
Sous produit, les courbes se ternissent
J'agit encore d'la sorte, crois pas en ceux d'M6
Depuis Mahmoud, thème du monde trois fois six
Besoin d'choses simples, comme une pause de tise
Des bras longs, des bigs beuj', j'suis sur pilotis
Cette ville de chiffes molles tue comme l'hypocrisie
Rendez-moi mon or et mon foutu grizzli (cash)
J'ai encore mon honneur avec ses pièces jaunes
J'ai encore mon honneur mais dans p'tite geôle
Jme souviens d'ma p'tite chambre quand j'étais môme
Plus j'grandis, moins dans futilités vois l'beau (ouais)Embed"
Joe Lucazz,Gatsby,"4 ContributorsGatsby Lyrics[Couplet unique]
C'n'est pas une ligne mais bien un kilo qui nous sépare
Derrière chaque grand Homme, y'a toujours une femme
Derrière toi, qu'une pute Bulgare
Derrière mon blaze y a plus qu'un nom y a une mental'
C'n'est pas une fille mais bien un harem qui nous sépare
Derrière chaque grand homme, y'a toujours une femme
Derrière toi j'vois qu'un routard
J'suis toujours dans l'dernier carré comme la Manschafft
Quand brûlent les selfies de vos ministres
Dans la fumée j'entraperçois le visage d'Iblis
Tu m'comprends pas, bah autant pour moi, Mimile
J'viens de l'espace, Gravity, j'vieillis ta face, appelle-moi Calvitie
J'suis un mec en or, black Gatsby le Magnifique
Ta musique n'a rien d'addictive
C'n'est pas d'la peu-fra, l'effet est inverse : ça m'fatigue vite
J'suis dans la soie, eux dans l'acrylique
Mais tranquille, j'suis pacifiste, pas si vite
J'ai pas dit qu'j'étais un Green Peace activiste, croyant et animiste
Rest In Peace Ali, Bakary, Laurent, Ilan Halimi
J'fais c'que j'veux comme Vladimir, feuille de coca ma carte de visite
Deux-trois lyrics j'laisse le game dans un état critique
Hip hop avant d'connaître Pac et Biggie
Un peu d'shit et j'me mets à rapper l'inadmissible
J'dis c'que j'veux, j'pense c'que j'veux
J'fais c'que j'veux j'ai mes deux feux braqués sur euxYou might also likeEmbed"
