Artist,Title,Lyrics
Kalash l'Afro,Musique salvatrice,"2 ContributorsMusique salvatrice Lyrics[Couplet 1 : Kalash l'Afro]
Musique forgée dans l'épreuve
Prévenez le pays, l'avenir s'appelle Arkana Keny
Marseille, pas de génie, que du sale, que du sale !
Faut que tu saches qu'on veut que ça paie vu qu'ici c'est pas
L'Arménie
Musique salvatrice, pourquoi tu gémis ?
Je te cause de tout ce que j'aime, de tout ce que je prends et tout ce
Que j'ai mis !
C'est le seul truc qui m'aide à esquiver leur sale matrice !
Comme dit Lorenz, avis aux amateurs et amatrices !

[Couplet 2 : Keny Arkana]
Fier de notre art, notre rage et notre arme, c'est notre heure
Note que tu vas savoir, pourquoi les notres râlent !
T'façon, on a juste notre rap, notre trou, c'est ça le son
Notre but, remettre un peu d'espoir dans les regards sombres
Ma haine s'égare sans cette plume, autour c'est malsain
Marseille, les miens se serrent car la chance est mince
Dehors, c'est l'asile, on a que la zic contre la crise de nerfs
Alors on rappe en s'foutant des critères de leur biz de merde !


[Refrain : Kalash l'Afro & Keny Arkana]
Musique salvatrice
Lâche moi les basques, j'ai un seize à écrire
Laisse tourner l'instru dans le casque, vaut mieux ça qu'un crime
Loin de leur sale matrice
Pas des stars, des marginaux, on est en marche et nos rimes reflètent
Bien
Qu'on en a marre de chez nous !
Musique salvatrice
C'est du rap à l'étalage, gros, 1.3., Keny Arkana et Kalash L'Afro !
Yeah, nous on est fier, tant qu'on fait tourner nos phases
Pas encore tirer d'affaire, va pas détourner nos phrases !
You might also like[Couplet 3 : Keny Arkana]
Nerfs, musique salvatrice, elle seule calme ma crise
Ca m'attriste, comme Kalash, j'ai failli faillir dans leur sale
Matrice
J'étais cette gosse trop vive pour les études
Toujours guettée par les indics et foutue selon les éducs
J'ai pris la plume pour vider mes nerfs, leurs idées m'énervent
Je conteste, peu à peu, j'ai quitté mes nerfs
Guider mes rêves, une revanche, nommée R.A.P.,
Un simple stylo pour retracer la ligne d'un chemin raté
Sans rien gratter, à part des pages, une larme à chaque rime écrivant
Chaque crime de mon malheur ou de mon cœur chagriné
Une déprime enragée devenant un moteur
Des années, à taffer dans l'ombre pour ramener un truc à la hauteur
Simple auteur, interprète, rien de plus, mais c'est tout ce que j'ai

Tout ce qu'on a, donc cherche pas à nous barrer la route
On continue le combat, en attendant que tourne la roue

Kalash L'Afro:
Fallait que nos rimes bombardent, en attendant de retourner là haut


[Refrain : Kalash l'Afro & Keny Arkana]
Musique salvatrice
Lâche moi les basques, j'ai un seize à écrire
Laisse tourner l'instru dans le casque, vaut mieux ça qu'un crime
Loin de leur sale matrice
Pas des stars, des marginaux, on est en marche et nos rimes reflètent
Bien
Qu'on en a marre de chez nous !
Musique salvatrice
C'est du rap à l'étalage, gros, 1.3., Keny Arkana et Kalash L'Afro !
Yeah, nous on est fier, tant qu'on fait tourner nos phases
Pas encore tirer d'affaire, va pas détourner nos phrases !
[Couplet 4 : Kalash L'Afro]
Première prise de mic' en 97, pour être sincère
J'm'en battais la race, j' pensais rien qu'à m'éclater la rate !
J'avais l' zehaf et trop de choses à dire, capable du meilleur comme
Du pire
Toujours impulsif au démarrage
La zic m'a dit : « on débarrasse, viens taper dans le sale, laisse
Tourner la basse
C'est la Merde, y à autre chose à faire ! »
Le système gère, j'le baise à coup de grosses caisses
Conteste, faut qu'on prospère, qu'on baise, laisse tourner la rage !
Y a pas de grosses têtes que des survivants de la zone
Avec plus ou moins de vices, tout dépend de la somme
C'est ce qu'ont dit les gens, y'a pas mort d'hommes
Vas y juge, moi j'me donne, j'suis coupable que d'avoir dit les
Choses
À ceux qui mènent des vies atroces, fuyez !
J'suis venu cracher ma p'tite révolte à la veille de leur 14 juillet
!

Keny Arkana:
Redoublant d'efforts pour voir notre rap briller !
Le berretta est chargé de pleins de vérités dans le barillet !!


[Refrain : Kalash l'Afro & Keny Arkana] (X2)
Musique salvatrice
Lâche moi les basques, j'ai un seize à écrire
Laisse tourner l'instru dans le casque, vaut mieux ça qu'un crime
Loin de leur sale matrice
Pas des stars, des marginaux, on est en marche et nos rimes reflètent
Bien
Qu'on en a marre de chez nous !
Musique salvatrice
C'est du rap à l'étalage, gros, 1.3., Keny Arkana et Kalash L'Afro !
Yeah, nous on est fier, tant qu'on fait tourner nos phases
Pas encore tirer d'affaire, va pas détourner nos phrases !Embed"
Kalash l'Afro,On se connaît,"7 ContributorsOn se connaît Lyrics[Couplet 1 : Sheïr]
On est dans le binks on fait le bénéf, on fait le pain les jaloux chenef
On fait le cash express on consomme la somme importe peu, la cuenta n'effraie plus personne
La petite aime quand le bolide fait vroum que le profil est louche que le CV est lourd
Les petits ont des couilles, la petite a du gout, Chanel Gucci semelle rouge
Le four tourne midi minuit non-stop, drogue store veni vidi block story
Grosse douille les gosses tourne en I8, grosses couilles on règle tout avant minuit

[Couplet 2 : Kalash l'Afro]
Tu les écoutes y a tout qui s'écroule, ils m'dégoutent respect aux vrais couz' comme Jul tes couilles faut tout j'découpe
Chaud comme Sampaoli on a fait cent fois Holine, on vit des temps chaotiques beaucoup de cents pas hors line
C'est le grand Classico bienvenue au hazi rho, on a c'qui faut
Que du sale niveau pour les tchikita et les carlito
Y a Stone Black Sheïr As Gambino La MG grosse frappe Ryad Mahrez on pilote l'AMG
Aketo Naps Aladin Kalsh l'Afro couplet tar sahr à la fin tu tires l'chapeau

[Refrain : Stone Black & Aladin 135]
Même si j'en ai trop fait, les courses pour la daronne, les cents pas dans la zone
Marseille je te connais t'as pris mon corazon, j'vois les frères qui charbonnent
Arrah y a les condés, dans le tieks ça klaxonne ça fait passer la tonne
Et tout ça ouais on connait, Paris on se connait
Je traverse le temps je veux revenir à l'époque, quand on était des mômes là c'est plus comme avant

[Couplet 3 : Stone Black]
Les affaires vont pas trop mal, j'dois recompter la moula
Grosse comme la Taj Maal j'sais pas quoi faire
Cambrée comme la bécane la petite veut le Macan
Les DM sur Instagram j'sais pas quoi faire
You might also like[Couplet 4 : Aketo]
On se connait on se comprend, mon collègue mon sang du Nord vient la puissance carré rouge flip ça fait nuit blanche
Petite chaise pliante petite cliente t'as fait le browhing et la petite frange
Sur la XXX on me confond avec le Naps, la rue c'est sombre on danse avec le diable
Et l'état pour la vendetta, j'fais les tasses pour la grande mi-fa
Kiffe-nous le zin fais caler le joint, tu m'vois dans la joie mais la street c'est la jungle
Merci le J mc's j'suis pas à jeun merci le bon Dieu je sais que j'suis pas à plaindre

[Refrain : Stone Black & Aladin 135]
Même si j'en ai trop fait, les courses pour la daronne, les cents pas dans la zone
Marseille je te connais t'as pris mon corazon, j'vois les frères qui charbonnent
Arrah y a les condés, dans le tieks ça klaxonne ça fait passer la tonne
Et tout ça ouais on connait, Paris on se connait
Je veux traverser le temps je veux revenir à l'époque, quand on était des mômes là c'est plus comme avant

[Couplet 5 : Naps]
J'ai soti le berrta je sais pas si tu comprends, c'est l'époque carré rouge l'époque tar l'Afgan
Et moi je suis un sniper on a tout vu du balcon, j'suis avec la chica elle a le sourire des balcans
Sur moi j'ai de la popo, on a jamais fait les totos, va dire au gendarme y'a son fiston qui veut une photo
Toi j'tavais cala mais en fait t'as la boco, dans la merde t'étais pas là quand je dormais dans la clio
Et ça fait mal au cœur t'es plus le sang on se croise de temps en temps
Comme le brinks à côté de Font vert j'écoutais Puissance Nord, retour dans le temps

[Couplet 6: As]
L'humain a quadrillé le secteur caméras projecteurs l'équipe est chaude organisée c'est le danger
Derrière nous y a que des braqueurs des dealers et des gratteurs y a que des gros tu vois le mzé c'est mélangé
Ouais comme le J, on parle pas, on agit, on dort, t'imagine, on perd pas la magie
On m'a dit pourquoi tu perces pas, à ton avis cherche pas c'est la vie mais j'reste dans l'anthologie
T'as vu le hebs, y a trop de serpents crocodiles ne sers pas j'te le dis tu sors quand vendredi
Y a les khos qui m'attendent, j'traine pas mon ami, gauche, droite ça va vite bang, bang
[Refrain : Stone Black & Aladin 135]
Même si j'en ai trop fait, les courses pour la daronne les cents pas dans la zone
Marseille je te connais t'as pris mon corazon, j'vois les frères qui charbonnent
Arrah y a les condés, dans le tieks ça klaxonne ça fait passer la tonne
Et tout ça ouais on connait, Paris on se connait
Je veux traverser le temps je veux revenir à l'époque, quand on était des mômes là c'est plus comme avant

[Couplet 7 :Aladin 135]
J'suis dans le RS non-man, je l'intéresse la nuit on fait nos vies on va peut-être mourir à l'adresse
J'suis dans le film y a le reflet dans ses yeux, ils sont plus là ceux qui disent que hier c'était mieux
Ça danse le mia dans la calle c'est ma jolie, elle sourit, elle donne du bonheur même au bord de l'agonie
Malgrès les cicatrices elle sort avec le dos nu, elle fume le filtre et la peufra de Lucas tony
Elle m'a tué elle m'a réanimé la rue toute seule nous a contaminé
Ils me disent comment comme si c'était inné, j'suis seul dans le noir mon âme est abîmée

[Couplet 8 : Gambino LaMG]
On se connait depuis l'époque du bas à sable, du coup aujourd'hui il boude il voulait gratter la Sacem
Ce projet va péter de Marseille à Paname et dans les rues de Felix piat y'a GDR en KTM
Je compte pas de la même façon que Jean de La Fontaine, ma chérie accroupie toi j'ai pas l'habitude de dire je t'aime
J'ai dû faire le chouf pour mes premiers TN, sur la bonbonne je voulais pas laisser d'ADN
La juge l'a condamné il est bé-tom pour port d'arme, elle a même trouvé des photos dans son portable
Force aux frères enfermés aux Baumettes ou à Bois d'Ar', même après des années ils mendient pas les mandats

[Refrain : Stone Black & Naps]
Même si j'en ai trop fait, les courses pour la daronne les cents pas dans la zone
Marseille je te connais t'as pris mon corazon, j'vois les frères qui charbonnent
Arrah y a les condés, dans le tieks ça klaxonne ça fait passer la tonne
Et tout ça ouais on connait, Paris on se connait
Je veux traverser le temps je veux revenir à l'époque, quand on était des mômes là c'est plus comme avantEmbed"
Kalash l'Afro,On s’obstine,"1 ContributorOn s’obstine Lyrics[Refrain: Sat (*2)]
On s'obstine, on tue la routine
Avec du gros son dans la tire et des barreaux d'shit dans nos blue jeans
Et si on tire sur beaucoup d'spliffs
C'est qu'on a aussi nos coups d'speed et nos coups d'spleen

[Couplet 1: Sat]
Attends j't'explique, tout me casse les couilles ou presque
Appelle la balistique pour récolter les douilles qui vont tomber d'mon texte
C'est pas du Montesquieu, c'est pas du Montaigne
Pas plus du Tony Montana, ma seule vie c'est mon putain d'thème
J'veux faire mon truc avant qu'on m'enterre, avant qu'il soit trop tard
Avant qu'on m'identifie grâce à mes broches dentaires
J'prône pas la violence, les drogues, les armes, la fesse
C'est cramé, de Palma l'a déjà fait dans Scarface
Mauvais perdants, on veut tous finir vainqueurs
Mais nos faiblesses nous perdront comme une balle qui se loge en plein cœur
La vie c'est une bitch, j'fais des journées d'vingt-cinq heures
C'est soit ça, soit j'suis bon pour aller vendre des hamburgers
Les murs portent encore les traces de mon dos, les bancs celles de mon cul
Vends pas ma peau avant d'm'avoir vaincu
Personne ne croit en moi comme j'peux le faire
J'ai perdu des batailles mais pas la guerre

[Refrain: Sat (*2)]
On s'obstine, on tue la routine
Avec du gros son dans la tire et des barreaux d'shit dans nos blue jeans
Et si on tire sur beaucoup d'spliffs
C'est qu'on a aussi nos coups d'speed et nos coups d'spleen
You might also like[Couplet 2: Kalash l'Afro]
Faudra nous passer sur le corps pour espérer qu'on lâche l'affaire
Pas encore assez sur le compte, chez nous y a qu'ça qui gâche la fête
Faudrait qu'j'creuse un peu l'écart, que l'État efface ma dette
Comme dit le kho R.E.D.K, faut qu'l'auditeur s'arrache la tête
Pertes et fracas sur le parcours, tracas depuis l'départ, cours
On s'barre tous d'en-bas, on s'battra même si on en bave
La vie a fait de nous des barbouzes, des chargeurs et des cartouches
Comme un dernier rempart dans un business qui pue la partouze
Et c'est comme partout, un jour tu gagnes un jour tu perds
L'épreuve est dans la tête, on s'en souvient qu'à un retour du bled
Marqué par le fer, la chute réveille la cicatrice
Te pousse au meurtre, niquer la matrice au pire en psychiatrie
Opé, le doute ça mérite pas une place
Quand j'partirai, j'espère pouvoir laisser une trace, pas une casse
C'est pour ça, les frères, qu'on s'obstine
Qu'on restera hostiles, qu'on mettra trop d'rimes et trop d'style

[Refrain: Sat (*2)]
On s'obstine, on tue la routine
Avec du gros son dans la tire et des barreaux d'shit dans nos blue jeans
Et si on tire sur beaucoup d'spliffs
C'est qu'on a aussi nos coups d'speed et nos coups d'spleen

[Couplet 3: Alonzo]
Comment veux-tu qu'j'm'arrête, j'roule en musique volée
Que je vends pièce par pièce en concert ou en CD
Un peu dans les blocs, dans les shops, dans les récrés
Le biz des Temps modernes, jusqu'à qu'j'me fasse niquer
Que devant l'échec j'pourrai plus nier
Prier, pour que les affaires fonctionnent
J'suis le quartier, la descente je la connais
Les critiques font pas mes joies ni mes peines, non
Je vis ma vie et celle de mon père mort
Tu l'saisis le faux que j'ignore, qui il est pour que j'honore
À qui j'pourais donner les marques de mon corps pour pas les perdre, cousin
Je m'obstine à croire que la famille c'est l'oxygène
Je m'obstine à croire que l'or a moins de valeur qu'le pain
On pense comme des gagnants
On prendra pas la médaille de consolation si on sort perdant
On vient de loin, obstinés obstinés
Je chante ma liberté à la jeunesse opprimée, opprimée
[Refrain: Sat (*2)]
On s'obstine, on tue la routine
Avec du gros son dans la tire et des barreaux d'shit dans nos blue jeans
Et si on tire sur beaucoup d'spliffs
C'est qu'on a aussi nos coups d'speed et nos coups d'spleenEmbed"
Kalash l'Afro,Pour Existe,"2 ContributorsPour Existe Lyrics[Intro : M-Flya]
Ahah...
Ahah...
Eh oh ! (Eh oh, eh oh !)
Eh oh ! (Eh oh, eh oh !)
Eh oh ! (Eh oh, eh oh !)
Eh oh !

[Refrain : M-Flya]
J'ai demandé au ciel de me donner la force
De me donner des ailes, de pardonner mes fautes
J'ai dû trouvé les mots ohohohohoh pour exister
Ohohohohohoh pour exister
Fier donné par mes efforts
La limite c'est le ciel, j'me dois d'être toujours au top
J'ai choisi de viser haut ohohohohoh pour exister
Ohohohohohoh pour exister

[Couplet 1 : Kalash l'Afro]

[Refrain : M-Flya]
J'ai demandé au ciel de me donner la force
De me donner des ailes, de pardonner mes fautes
J'ai dû trouvé les mots ohohohohoh pour exister
Ohohohohohoh pour exister
Fier donné par mes efforts
La limite c'est le ciel, j'me dois d'être toujours au top
J'ai choisi de viser haut ohohohohoh pour exister
Ohohohohohoh pour exister
You might also like[Couplet 2 : Kalash l'Afro]

[Refrain : M-Flya]
J'ai demandé au ciel de me donner la force
De me donner des ailes, de pardonner mes fautes
J'ai dû trouvé les mots ohohohohoh pour exister
Ohohohohohoh pour exister
Fier donné par mes efforts
La limite c'est le ciel, j'me dois d'être toujours au top
J'ai choisi de viser haut ohohohohoh pour exister
Ohohohohohoh pour exister

[Pont : Kalash l'Afro]
J'ai demandé au ciel de me donner la force
De me donner des ailes, de pardonner mes fautes
J'ai dû trouvé les mots pour exister
C'est trop pour exister, c'est trop pour exister !

[Refrain : M-Flya]
J'ai demandé au ciel de me donner la force
De me donner des ailes, de pardonner mes fautes
J'ai dû trouvé les mots ohohohohoh pour exister
Ohohohohohoh pour exister
Fier donné par mes efforts
La limite c'est le ciel, j'me dois d'être toujours au top
J'ai choisi de viser haut ohohohohoh pour exister
Ohohohohohoh pour exister
[Outro : M-Flya]
Eh oh ! (Eh oh, eh oh !)
Eh oh ! (Eh oh, eh oh !)
Eh oh ! (Eh oh, eh oh !)
Eh oh ! (Eh oh, eh oh...!)Embed"
Kalash l'Afro,R.A.S.,"2 ContributorsR.A.S. Lyrics[Refrain]
Laisse-moi faire, j'suis venu te parler d'l'époque, c'est grave
Y a d'plus en plus de flingues et d'plus en plus de drames
Partout ça parle de grammes, de GAV, de gratter d'grailler
Partout les frères s'abattent y a qu'des larmes sur nos cahiers
Laisse-moi faire, j'suis venu te parler d'l'époque, c'est grave
Y a d'plus en plus de flingues et d'plus en plus de drames
Partout ça parle de grammes, de GAV, de gratter d'grailler
Partout les guerres éclatent, à part ça y a rien à signaler

[Couplet 1]
La plume ensanglantée, j'avance à la vitesse d'un corbillard
Scrute le territoire et vois encore le même décor qu'hier
Ça rêve de treize milliards, éparpillés ou à part
On pourra pas répondre de ceux qui finissent par piller
Les hommes s'façonnent selon comme on les conditionne
Comme on les auditionne
Comme on leur parle et comme on s'positionne
Système érigé dans les fautes
Pour mieux écraser les faibles et pour mieux sucer les forts
Tout c'qui compte, c'est l'effort, ça manque à leur cérémonial
Mon pote, les fruits d'leur paradis sont démoniaques
J'compose, j'consomme le rap à l'overdose
Tue mes cauchemars à la prose
Vaus mieux ça qu'défendre une mauvaise cause
J'dis pas qu'la nôtre est la meilleure, loin d'là
Mais suffirait qu'on rende les armes pour qu'ces ânes jouent les balayeurs
Au bod du gouffre, on n'a pas d'fierté à ravaler
Nos quartiers souffrent, à part ça y a rien à signaler
You might also like[Refrain]
Laisse-moi faire, j'suis venu te parler d'l'époque, c'est grave
Y a d'plus en plus de flingues et d'plus en plus de drames
Partout ça parle de grammes, de GAV, de gratter d'grailler
Partout les frères s'abattent y a qu'des larmes sur nos cahiers
Laisse-moi faire, j'suis venu te parler d'l'époque, c'est grave
Y a d'plus en plus de flingues et d'plus en plus de drames
Partout ça parle de grammes, de GAV, de gratter d'grailler
Partout les guerres éclatent, à part ça y a rien à signaler

[Couplet 2]
Pris par l'âge à l'heure où les grands frères assistent au p'tit carnage
Décor écarlate, c'est trop tard vu qu'on est pris par l'acte
À réfléchir entre les intérims ou l'braquage
Dis-leur qu'on a enterré nos rêves alors on saccage
On rime façon plaquage, on met l'passé au placard
Le crime a fait des otages, des frères au placard
Ça fait plaisir aux bâtards confortés par leurs pourcentages
C'est ma génération qu'ils ont pris par chantage
Et ils s'demandent pourquoi on traîne toujours au même endroit
Depuis qu'les profs cassaient les couilles avec leurs thèmes en bois
Parce qu'on n'y croit pas, à la première occase on s'tire
Mais laisse-nous dans notre enfer si ton affaire c'est pire
Ma seule chance, sortir un putain d'album
Carboniser les ondes, plus brûler mon temps à l'alcool
Fallait que j'l'ouvre, moi j'ai pas de fierté à ravaler
Mon peuple souffre, à part ça y a rien à signaler
[Refrain]
Laisse-moi faire, j'suis venu te parler d'l'époque, c'est grave
Y a d'plus en plus de flingues et d'plus en plus de drames
Partout ça parle de grammes, de GAV, de gratter d'grailler
Partout les frères s'abattent y a qu'des larmes sur nos cahiers
Laisse-moi faire, j'suis venu te parler d'l'époque, c'est grave
Y a d'plus en plus de flingues et d'plus en plus de drames
Partout ça parle de grammes, de GAV, de gratter d'grailler
Partout les guerres éclatent, à part ça y a rien à signaler

[Couplet 3]
Partout les hommes s'abattent pour du fric
Partout les guerres éclatent, moi j'suis venu cracher l'verdict
J'préfére t'avertir, monde perverti, c'est l'vertige
J'suis sûr qu'on n'est pas nés pour faire pire
Ma plume sauvera pas l'monde
Toujours les pieds sur l'bitume, fier de mon statut d'sale môme
C'est Berreta l'chrome, Kalash l'Afro sur les ondes
Sec sec, laisse-moi faire saigner l'microphone

[Refrain]
Laisse-moi faire, j'suis venu te parler d'l'époque, c'est grave
Y a d'plus en plus de flingues et d'plus en plus de drames
Partout ça parle de grammes, de GAV, de gratter d'grailler
Partout les frères s'abattent y a qu'des larmes sur nos cahiers
Laisse-moi faire, j'suis venu te parler d'l'époque, c'est grave
Y a d'plus en plus de flingues et d'plus en plus de drames
Partout ça parle de grammes, de GAV, de gratter d'grailler
Partout les guerres éclatent, à part ça y a rien à signalerEmbed"
Kalash l'Afro,Retour à la base,"2 ContributorsRetour à la base Lyrics[Couplet 1]
Une dernière virée dans les rues d'Marseille, on vient placer nos prods
Chaud comme Nasri qui tire sur l'frein à main au Vélodrome
Speed, micro bolide, accroché à l'asphalte, solide
On va t'faire visiter du Panier à la Solid'
Mon rap c'est la folie, appelle toujours la BRB
On veut tous faire du bléà balle comme le braquo d'la PRP à Monaco
VRP, prêts à représenter les blocs
Marquer l'époque, refaire le monde avec nos CAP
Imagine qu'ils nous sortent les armes, tirent dans tous les sens
Tu grandis où l'Sheitan te charme, triste adolescence
J'suis venu pour un putain d'vacarme, cramer comme l'essence
Avec du cœur, du sang et des larmes à tous les gonz' de France
Pensée sincère, faut juste viser l'essentiel
S'mettre en selle, tracer sa route, passer en boîte séquentielle
Moteur, action, la BO c'est Taxi 4
Retour à la base, j'arrive au taquet comme les Psy4

[Refrain (*2)]
Imagine qu'ils nous sortent les armes, tirent dans tous les sens
Tu grandis où l'Sheitan te charme, triste adolescence
J'suis venu pour un putain d'vacarme, cramer comme l'essence
Avec du cœur, du sang et des larmes pour les blocs de France

[Couplet 2]
L'histoire d'ce commissaire qui pète les plombs
Ces jeunes qui jettent l'éponge, qui reflètent l'époque
Veulent tous être des millionnaires précoces
Avec l'école on perd au score alors avertissons
Paraît qu'chez nous c'est à l'ancienne, obligé d'faire un dirty son
La fierté pour itinéraire (frère), j'suis né à Tunis, faut pas qu'j'me perde
Lâche-moi les clés, j'te laisse le tuning
Surine pour les puristes, rookie, j'rappe la furie
Mets l'son dans l'tacot, fais goûter l'produit aux touristes
Courir, vivre et mourir, s'nourrir, rire et souffrir
Protéger les siens, sans s'compromettre avec les pourris
Dur, parce que souvent ça vire au drame ou à la comédie
Paraît qu'certains ont vu des flammes dans tout c'qu'on aurait dit
You might also like[Refrain (*2)]
Imagine qu'ils nous sortent les armes, tirent dans tous les sens
Tu grandis où l'Sheitan te charme, triste adolescence
J'suis venu pour un putain d'vacarme, cramer comme l'essence
Avec du cœur, du sang et des larmes pour les blocs de France

[Couplet 3]
OK, pour Finest Music y a que du sah cousine
Qu'on rende les armes, c'est comme dire qu'on votera Sarkozy
L'avenir en pleins phares, infâme, goûte mon rap nocif
J'ai trop la dalle, j'compte ramasser l'plus de barres possible
Faut qu'ça arrache comme la fusée Ariane
Toujours aussi à l'aise qu'un chtar qui tire un pétard au commissariat
Kalash l'Afro, j'ai l'son qui fait recette
Berreta aux starting-blocks, que du lourd en zéro-zéro-sept

[Refrain (*2)]
Imagine qu'ils nous sortent les armes, tirent dans tous les sens
Tu grandis où l'Sheitan te charme, triste adolescence
J'suis venu pour un putain d'vacarme, cramer comme l'essence
Avec du cœur, du sang et des larmes pour les blocs de France

[Outro]
Yeah
Trois-cents-treize
Kalash l'Afro
Berre l'Estaque, c'est la base
Berreta, c'est là-bas
2007 que du lourd pour les blocs de France
Finest Music, ohEmbed"
