Artist,Title,Lyrics
Kalash l'Afro,Cracheur de flammes,"2 ContributorsCracheur de flammes Lyrics[Couplet 1]
J'rappe le fusil sur la tempe, chante pour ceux qui sont au champ d'bataille
Pour ceux qui triment dans le système où y a tellement de hatays
Laisse les faire, j'ai l'flow qui intéresse les fiers
Versets mercenaires, moi tu m'blesses quand tu blesses mes frères
Je connais mon boulot, c'qui rappe c'est pas l'baggy
Cracheur de flammes chacal, j'ai pas l'style à Shaggy
J'suis pas là pour les chagasses moi j'parle de c'qui m'agace
J'suis pas né dans un palace, comprends d'quoi il s'agit
Musique du peuple, on voit déjà les fauves qui s'agitent
Mon frère y a pas de magie, chez nous l'espoir est fragile
Fallait qu'on gueule, fallait qu'nos raps soient fédérateurs
Qu'on mette une claque à leurs ministres et autres sénateurs
Lyrics détonateurs j'crache quoi qu'il en coûte
J'suis venu frapper un grand coup, pas d'ceux qui rêvent de Cancun
Qu'on fasse halla ou banqueroute dans l'opulence ou dans l'drame
J'aurai toujours assez d'essence pour cracher des flammes

[Refrain]
J'écris l'espoir de ma génération
Entre vacarme et quart d'heure de gloire
La vie normale d'un gratteur de pages
Mon rap conteste, souvent dans l'même contexte
Moi j'lève le poing d'mon texte
Mon job c'est cracheur de flammes
J'suis dans les décombres, planté dans l'décor
Le diable est dans les écoles, nos sciences gravées dans les époques
On reste fiers, cracheurs de flammes quoi qu'il en coûte
La foule réclame, faut qu'on crache tout
You might also like[Couplet 2]
Question d'principe, toujours parler la langue de braise
Leu dire qu'dès qu'y a manque de pèze, le crime incite
Prouver qu'y a pas d'barrage quand y a tout l'poids d'la rage
Et qu'c'est la même dans une cave ou une putain d'suite
Cracheur de flammes, phrasé sec, né dans l'Ténéré
Là où ça fait déjà longtemps qu'ça a dégénéré
Moi j'aime la caille sans la vénérer
Paraît qu'l'Afrique c'est qu'un détail, j'crache le feu qu'ça a généré
J'remonte la source, le hip-hop né dans la douleur
C'qui compte c'est pas sa couleur ni son quota en bourse
Tous poussés dans la course et tu voudrais qu'j'y fasse quoi?
J'suis comme Alonz', moi j'm'en bats les couilles d'la place one
Honneur aux vaillants, croyants, peuple voyant
Qui s'bat tout en sachant qu'l'arsenal est trop défaillant
Si toutes les flammes s'allient, sûr qu'y aura plus d'salissures
A ceux qui veulent pas la fermer même en s'noyant

[Refrain]

[Couplet 3]
J'me fais une place au cœur du brasier, ébruite le discours du bloc
Ça parle toujours de tout niquer dans cette putain d'époque
Les silences pèsent, les finances blessent
Les jeunes rêvent de guerre civile, tous les flics et les dirigeants stressent
J'parle à cœur ouvert, j'incite personne à foutre sa vie en l'air
Sœur ou frère, faut garder les pieds sur terre
Le cerveau brûlé au 13ème degré, acculé au désir de fraîche
J'traîne là où tu vois la haine de près
C'est ça mon job mon pote, tenir mon kop mon poste
Brûler ton poste inspiré sur c'que les frères composent
A mon échelle j'fracasse l'empire
J'lève les yeux au Ciel face à la menace qui empire
Y a trop de superficiel vu qu'on nous enchaîne dans nos libertés
Moi j'suis venu cracher des flammes, rien à regretter
Sec sec
[Refrain (*2)]Embed"
Kalash l'Afro,Destination sunshine,"2 ContributorsDestination sunshine Lyrics[Refrain]
Tu sauras jamais c'que la vie t’réserve
Le monde est vaste, on rêve de marcher sur une île déserte
Destination Sunshine
Emmener les proches, laisser les soucis derrière soi
Garder l'esprit clair jusqu'à son dernier soir
Destination Sunshine
Charge pas les valises, là-bas y a tout c’qu'il faut
Laisse aussi les trucs qui brillent, tout est faux
Destination Sunshine
J'suis en partance, direction la vie est cool
On m'a dit t'auras qu'une chance, n'oublie pas qu'la vie est courte

[Couplet 1]
On rêve tous d’aller voir ailleurs, tenir le mur ça nique les jambes
Le monde est grand comme disent les gens, laisse-moi écrire ma petite légende
Imagine-toi la valise pleine, embarquement porte numéro 5
Un aller sans retour, les ailes du zinc pleines de kérosène
Atterrissage au bout de la Terre, chapeau sur la tête
Zik à fond dans l’poste, oubie les huissiers et les dettes
À Singapour ou Marrakech, c'est la même tant qu’la liasse régale
Et bats les couilles de Las Vegas ou d'leur Chivas Regal
Ici le bitume et le stress nous mettent à l'agonie
Grimpe dans l'train express, on s’taille au bled ou en Patagonie
J'ai le passeport vert cousin, on peut pas s'refaire
Laissez passer, ouvrez les frontières comme dit Jah Fakoly
J'ai envie d'voir mes gosses pousser sur une terre fertile
Permettre aux miens d'avoir une chance, pourquoi s'en interdire
Pendant qu'on roule à contresens, qu'on squatte les faits-divers
Comme dit Sheir, on fait le tour du globe sans quitter le périmètre
You might also like[Refrain]
Tu sauras jamais c'que la vie t'réserve
Le monde est vaste, on rêve de marcher sur une île déserte
Destination Sunshine
Emmener les proches, laisser les soucis derrière soi
Garder l'esprit clair jusqu'à son dernier soir
Destination Sunshine
Charge pas les valises, là-bas y a tout c'qu'il faut
Laisse aussi les trucs qui brillent, tout est faux
Destination Sunshine
J'suis en partance, direction la vie est cool
On m'a dit t'auras qu'une chance, n'oublie pas qu'la vie est courte

[Couplet 2]
Je me verrais bien avec mes potos et ma belle, on met les voiles
Allumer un feu au bord d'la mer, on dort tous à la belle étoile
Casse pas la tête, on fait du troc, j'ai pas pris mon carnet d'chèques
Un pollen de Marseille contre une chicha à Charm-el-Cheikh
Loin des soucis, loin du bruit et d'l'odeur d'la métropole
Plein les poches et plein l'cœur, t'inquiète on sera jamais trop pauvres
Eb bas ça met trop d'temps, la vie est traître
Après l'métier qu'on t'apprend, ça sera la casse ou la retraite
Les gens lassés par le stress ne voient l'monde que sur écran
Consommateurs avertis, putain d'culture étrange
La routine moi ça m'lasse frère, société casse-tête
On passe sa vie à la perdre, j'ai pas trouvé ma place frère
Les jeunes zigzaguent entre la rue et la taule, noient leurs soucis à l'alcool
Ils croient même plus c'qu'on leur apprend à l'école
Lâche-moi mon pèze, faut qu'j'me taille
J'vous laisse la gloire, le beurre et même l'argent du beurre
J'quitte le chant de bataille
[Refrain]
Tu sauras jamais c'que la vie t'réserve
Le monde est vaste, on rêve de marcher sur une île déserte
Destination Sunshine
Emmener les proches, laisser les soucis derrière soi
Garder l'esprit clair jusqu'à son dernier soir
Destination Sunshine
Charge pas les valises, là-bas y a tout c'qu'il faut
Laisse aussi les trucs qui brillent, tout est faux
Destination Sunshine
J'suis en partance, direction la vie est cool
On m'a dit t'auras qu'une chance, n'oublie pas qu'la vie est courte

[Couplet 3]
Crois en tes rêves, à part le ciel y a pas d'limites
C'est jamais fini même quand la chance fait la timide
On garde le feeling, un sourire sur le visage
Ici l'ambiance est bizarre, vite, lâche-moi mon visa
Destination Sunshine, histoire de prendre l'air
Les khos, il faut qu'on se casse d'ici, on a tous frôlé l'asphyxie
Pas une question d'matos, question d'mental
Pour l'heure j'prépare les bagages, j'm'évade sur instrumental

[Refrain]
Tu sauras jamais c'que la vie t'réserve
Le monde est vaste, on rêve de marcher sur une île déserte
Destination Sunshine
Emmener les proches, laisser les soucis derrière soi
Garder l'esprit clair jusqu'à son dernier soir
Destination Sunshine
Charge pas les valises, là-bas y a tout c'qu'il faut
Laisse aussi les trucs qui brillent, tout est faux
Destination Sunshine
J'suis en partance, direction la vie est cool
On m'a dit t'auras qu'une chance, n'oublie pas que la vie est courte
Destination Sunshine
Destination Sunshine
Destination Sunshine
Destination SunshineEmbed"
Kalash l'Afro,Ecoute la rue Marianne,"3 ContributorsEcoute la rue Marianne Lyrics[Intro]
Marianne
Écoute la rue Marianne
Écoute la rue Marianne
Écoute la rue Marianne
Marseille
C'est Kalash-nikov (sec-sec)
Lucian-Uzi, Killa Saï
T'entends
Hey yo Marianne écoute cette putain d'rue
Ça vient d'Marseille, 1-3

[Couplet 1: Lil' Saï]
Versailles recouvert de sang, les droits de l'homme sont bafoués
Marianne s'est faite violer, trop de crimes restent inavoués
L'État est corrompu, diabolique, hypocrite, sale
Raciste, fasciste, qu'est-ce que tu dis d'ça (check ça)
Du régime de Vichy à la loi XXX
Jean Moulin est mort, Sarko multiplie ses attaques en traître
Les directeurs d'écoles et préfets
Deviennent des collabos, délateurs
Les parents d'élèves sans-papiers sont dénoncés
Expulsés, reconduits à la frontière militairement
Par une police FN majoritairement
Nouvelles manières de faire, les trains à bestiaux d'hier
Sont remplacés par des charters Air Sarko
C'est l'ère Kärcher, political cartel
Immigration choisie (question)
Mais son père clandestin, l'aurait-on choisi? (ben non)
Élections infernales, leurs meetings tournent au dîner d'cons
Depuis qu'Nicolas vogue avec Steevy et Gynéco
Johnny me donne le blues
Tout ça m'écœure comme ces bus qui brûlent et TF1 qui en veut toujours plus
Armé d'ma plume, j'incite au vote
À la révolte, au caillassage de la connerie humaine (Lil Saï)
Le guet-apens est mental
You might also like[Refrain]
Écoute la rue Marianne
Écoute la rue Marianne
Écoute la rue Marianne
Écoute la rue Marianne

[Couplet 2: Kalash l'Afro]
Au nom des gens qui mènent une simple vie
Des jeunes qui squattent les tours, nique les politiques
Vu qu'ces hypocrites s'en battent les couilles
Marche avec eux tu finis vite maqué
Ils ont du pouvoir et du fric, le boss des flics s'prend pour Vic Mackey
D'où vient l'envie d'braquer, d'allumer l'hafia
L'envie d'se révolter face à leur mafia
Sûrement qu'y a plus grand-chose à perdre
On opère, fiers pour honorer nos pères sans compter nos pertes
On est venus cracher dans l'caviar
On sait qu'la loi des hommes atteindra jamais celle du très haut
On veut qu'nos voix résonnent sur un gratte-ciel ou sous un préau
Le diable est dans les écoles, qui sème le feu le récolte
Forgés parce que tous gosses, ils ont d'jà flingué nos idéaux
Maintenant on veut des réponses, du sah
Pas des trucs du genre ""crève si y a pas d'taf
T'es un clebs alors il faut qu'tu charges"" (non)
Tends pas la main, t'auras ton bulletin d'vote
On fera barrage, et si ça foire ils feront croire qu'c'est d'notre putain d'faute
Rodés à l'échec, dur de grimper à l'échelle
Attirés par la richesse, Marseille c'est pas les Seychelles
Dehors la vie c'est trop cher
Viens voir ici comme ça subit
Désespérant comme dans une file d'attente aux Assedic
On nous serine que ça va changer
Dis-leur qu'à notre époque, y en a encore qui ont pas à manger
J'emmmerde Marianne, Sec sec ouais j'emmerde Marianne
[Refrain]
Écoute la rue Marianne
Écoute la rue Marianne
Écoute la rue Marianne
Écoute la rue Marianne

[Couplet 3: Le Rat Luciano]
Parce que Dieu le veut bien, on est parce qu'on naît
Méprisés par la France à Le Pen
Vie d'rue, tout c'qu'on connaît, le futur d'la nation promet
Faut aider pour être aidé
Pour recevoir faut donner, faut aimer pour être aimé
Tout est en nous-mêmes, nos principes pas à vendre
Arrêtez les promesses, des regrets on en a à revendre
Mauvaises sont les nouvelles, les blessures restent ouvertes
L'égalité des droits n'est plus priorité des gens qui nous gouvernent
On descend pas qu'des singes
L'Histoire, l'Histoire a ses lois comme la France a les siennes
Leur vision d'nous, pas très saine, ils ne pensent qu'à réprimer
L'État n'entends plus la détresse de l'opprimé
Ils ne font que masquer les problèmes
C'est la discorde qu'ils sèment
Il n'y a jamais eu autant d'riches, de pauvres et d'cœurs qui saignent
Social déséquilibre, les crocs rayent les parquets
Gouvernement en chute libre, le manque d'opportunités pousse à braquer
On n'est ni des mauvais ni des justes
Tous faits d'eau et d'argile, tous oppressés par un système d'injustes
Voter ouais mais pour qui, la méprise ou l'insulte
Une pensée pour nos anciens, victimes de tant d'injure
C'est l'respect, M'sieur, qu'on nous a inculqué
Pas éduqués, non, c'est juste qu'on n'a pas écouté
Écoutez, on refuse de vendre notre âme pour exister
Le système un brise-cœur, un brise-vie, mille manières de résister
[Refrain]
Écoute la rue Marianne
Écoute la rue Marianne
Écoute la rue Marianne
Écoute la rue Marianne

[Outro]
Marseille, Marseille
Écoute la rue Marianne
La grande cité des rêves
Écoute la rue Marianne
Un pour les bases fondamentales
Écoute la rue Marianne
Deux pour c'qui ont à la Montagne
Écoute la rue Marianne
Trois pour les frères aux conditions d'vie lamentables
Yeah, yeah
Notre histoire n'est dans aucun livre d'Histoire
Laisse-nous être, laisse-nous juste y croire
Laisse-nous vivre au rythme que la rue joue, celui de la victoire
Yeah, laisse-nous tailler les murs d'l'injustice en diamants de l'espoir
Afin que nos frères voient plus loin que c'qu'ils nous laissent voir
Une spéciale pour Narbé, Argenteuil et la ZUP Star
Yeah
(clic clic… pa!)Embed"
