Artist,Title,Lyrics
Karim Fall,De rien du tout au sommet,"7 ContributorsDe rien du tout au sommet Lyrics[Freestyle 1]
Rien à foutre moi je veux que les vrais m'entendent
Nique ceux qui font les durs alors qu'ils sont vraiment tendre
Assonance que du sang neuf des styles pas comme les autres
Des idées pas connes entre les vres-lè pas de cône
2005 peut à peut le niveau disparaît
Tout les mecs disent pareil mais mes soldats sont tous parés
A ce qu'il parait la vague c'est pour 2006
L'arrivé de la sexion avec des flows en guise de missiles
Rien à foutre de tes peut être que le rap est dead
On va tout faire péter malgré le peut d'aide
Matte les espions veulent savoir tout ce qu'il se passe
Guette comment se déroulent nos sessions, putain lâchez nous les baskets (?)
Un regard glacial pour un monde qui s'avère bouillant
Rien qu'avec du brouillon on nous trouve déjà beaucoup trop bruyant
Ça s'embrouille on veut savoir qui est le plus brillant
Qui sera sur le trône qui se ridiculisera comme Brian

[Freestyle 2]
3ème Pro' l'esprit d'équipe règne
On se fout des wack et des flows qu'ils prennent, qu'ils soient connu over booké ou qu'ils traînent
On daba la prod attend faut que l'ingé s'en remette
On tape à la porte du succès mais le videur cogne comme mormeck
C'est mort mec le talent ça suffit ap'
On se fit à notre instinct on fonce et ça sans Fiat
Faudrait que les Mc s’affolent
Qu'ils prennent leurs bic leurs claire-fontaine ou leurs dictaphones
Ok Sexion on plie a-ç, dis aux autres qu'il y a plus de place
Le but c'est pas les liasses, man ça c'est pour la Petite Place
Les p'tits clashs, prennent de la taille AD l'a dit man
J'te le dis cash, ça va ter-sau' comme à Tel Aviv
Ahki, on froisse ça, le disque d'or on fera ça
D'la France à kar-Da, mes soss' ont les sourcils froncés
You might also like[Freestyle 3]
Téma, l'état nous balance toute sorte de disquettes
Ils veulent qu'on ralentisse guette, comme sur nos comptes ils discutent
Ils disent que les bavures doivent être un peu plus discrètes
Et si j'gratte, je peux retourner l'industrie du disque
Je vise que le sommet il est pas si loin qu'ça
Tu risques de soûler avec tes histoires de Wanksta
De l'ouest à l'est tous recherchent le leust
Les vestes, les Festina et les maillots d'Manchester
Tu sais s'taire c'est pas facile avec tout c'qui s'passe
Vas-y balance un 16 dénonce et surtout t'excuse pas
La concurrence pour nous t'as vu c'est pas un obstacle
Par contre on a constaté que dans l'rap les autres s'taclent
Oui c est la course mon pote faut pas trop se promener
Il s'agit d'être le premier parce-qu'être le patron ça promet
Y'a des pros mais y'a aussi pas mal de débutants
Si t'étais parmi les meilleurs maintenant qu'on est àl t'es pu d'dans

[Freestyle 4]
Moi j'veux ma part mais pas maintenant dans l'au delà
Alors tu vois j'm'en fous de la fortune de l'autre là
Multiples sont les plaisirs de ce bas monde
La foule qui t'acclame, t'es devant le podium, on te dit : ""bah monte""
Sexion d'Assaut, après avoir passé tant d'étapes
On arrive plus tôt que prévu, c'est la gifle que t'attendais ap
Tant qu't'es apte à tenir le coup, ben vas-y
Si tu veux qu'on en bave, si tu savais c'est pas facile
C'est pas la zizanie de Zazi mais c'est l'bordel
Le seum d'un tsunami l'ami, ma Sexion est hors d'elle
Du sensé à l'ego-trip, allez go on se lance
3éme prototype à té-cô Assonance
On dérange on nique la déco
Quitte la t'es con ou quoi on kick la tête haute
T'as peut être honte on t'a ficha devant tes invités
Sessionner avec la Sexion ce genre de chose évitez
[Freestyle 5]
Tchek, le 75 en nocturne c'est bouillant comme sur Mars
Tise, bédo, cachetons les geuchs gobent tout ça comme des Smarties
Les ruelles, les impasses, les tain-p' qui t'proposent des passes
Les mecs d'la BAC qui s'impatientent tout ça ça me dépasse
Ça s'prend pour Zepekenio ou Manu le Coq
Pendant que ça pète au Kenya, ici ça manie la coke sin-cou
Un tox', un coup d'couteau et t'as l'dass
Bellek, y'a pas qu'à galle-pi qu'y'a un tas de tass'
Les mecs, c'est pour la jet et ceux qu'ont pas d'classe
Les bêtes, qu'ont déjà redoublé un tas d'classes
Les becs, sur ton visage laisse un tas d'traces
Les tech', de free fight nique un tas d'race
Au oinl un tas d'reus sur la tête un tas d'tresses
Des mecs qu'ont pas d'adresses, des mecs que l'état stresse
Les petites zoulous qu'agressent, pendant qu'un tas d'gars brassent
Les keufs ont pas de respect donc nique leur paperasse

[Freestyle 6]
Poto j'ai même pas le permis j'avoue c'est pas terrible
Mais gros je porterais pas le béret de l'armée je veux pas périr
Et puis j'ai même pas de crédit pour tchek mon pote Jerryzoos
Mais bon je vais pas pleurer car pour l'instant j'écris aç akhi
La vie c'est re-du dans les che-po zéro tunes
A genou devant la routine jusqu'à s'en mer-fu les rotules
Fais né-tour la roue de la fortune j'suis à bout là
Ça s'est trop dégradé gros je vais devoir faire la boule à'
J'ai vu trop de bitume de briques et de verres
Mais c'est peut être pour ça qu'aujourd'hui plier le beat j'sais le faire
Je veux pas finir mes jours en ien-ch à 4 pattes
Quand la richesse tente de nous phone ici on capte pas akhi
Je vais pas rigoler tu me connais j'aime trop déconner mais là
Cette zik c'est pour Idrissa Koné si tu le connais mets la
En tout cas tu connais mes gars j'crois, tu connais l'écart
Qu'y'a entre nous et la concu', donc laisse tomber si t'es cardiaque akhi
Je fais pas de carjacking
Je connais les cascades pourtant poto je suis pas Jackie
A paname je naquis sur nos tables y'a pas de knackis
C'est la bande à qui ? Pull Wati B capuches et bas de kaki
[Freestyle 7]
3ème Pro numéro un les gens savent et l'admettent
Ne jure pas sur la Mecque un jour tu vas nous la mettre
Nos flows viennent d'une autre planête comment veux-tu les copier?
Nan nan tu ne nous arrives pas à la cheville mais qu'au pied
Cousin, je te conseille de t'connecter si t'as le net
Renseigne toi les gens te diront quand on dame on laisse pas d'miettes
Ferme ta gueule si t'as niet on perdra beaucoup moins d'time
Je shoot dans tes castagnettes c'est violent comme le muay thai
Comment tu veux nous concurrencer toi t'es pas net
On t'a déjà washé mais on peut remettre ça comme Danette
Là c'est le Renouveau on rend les gens verts comme sur Namek
On arpente les rues d'Paris aux pieds des paires de Nike mec attends
Laisse moi 2 secondes le temps de plier la maquette
Ça va trop deus pour toi tu te demandes si j'ai pris de la ket'

[Freestyle 8]
Moi sur la jet set je ssep, akhi j'te l'dis sec
Cette putain d'époque m’excède, les gamines au sexe cèdent
Depuis le temps qui passe sale, les petits sont toujours pas stables
Té-ma leurs bastons, ils se tuent comme Dirty Bastard
Poursuites et cascades, ça pour quelques pascals
Mais y'a toujours pas de taff, comment leur dire de pas s'tape ?
Je compte plus les castagnes pour des gos genre Casta
Des fois on te casse ta gueule pour un simple ""qu'est-ce t'as ?""
Pour un simple kefta, ça crie comme la Castafiore
Et si te tu casses t'as pas ta part du casse-dale
Détends-toi, tu bouges trop, de ton équipe t'es que le bouche-trou
Si tu veux des ouss gros, c'est que t'étais pas fais pour ce groupe
Moi je concocte pas de plan, tout ce qu'est pe-stu qu'j'suis pas dedans
J'ai même pas le bac blanc mais je crois que ça me dérange pas tant
Si je fais tout ce trajet, c'est pas pour un court traj-mé

[Couplet 9]
Ici ça pose dur, ça técla' les enceintes
Pas de gue-bla j'passe 5ème vitesse, largue les anciens
Tu voulais du sang ? Tiens, l'équipe sait faire ça
Tu t'es fait roué de coups y'a pas eu de vice et versa
Le vice/biz les ffairza, on veut plus d'ça depuis des lustres
Et nique la vie de luxe, c'est dans l'Paradis qu'on déguste
Des gus ? J'en ai croisé 100 dans ma carrière
Ils sont trop lents, j'leurs met des queues d'poissons en marche arrière
Du son pour la fourrière, il n'y a qu'ça autour de moi
Puis ça m'fait mal au crâne, comme de niakser tout le mois
Vas-y double-moi, sinon reste à l'arrière
Dans la boîte moi j'suis le PDG, toi t'es qu'salarié
Sale arrière... goût dans la bouche
T'as pas digéré, le fait qu'on t'ait dit ""couz' de là, bouge""
Tu te crois trop beau pauvre type mais il n'y a qu'ça dans tes textes
C'est l'3ème Prototype, c'est pour l'écrasement de tête

[Freestyle 10]
La tête dans les nuages parce que sur Terre c'est trop glauque, poto
Le mariage est démodé, les petites se foutent en cloque trop tôt
Ils veulent tous faire le tour de la planète comme les globes-trotters
Manque de pot y'a pas de sous donc en attendant c'est drogue, poppers
Stressant comme de prendre le train sans billet
Comme d'apprendre que tes poumons ressemblent à un cendrier
Comme se déshabiller pour le bloc opératoire
Man si t'as déjà prié rajoute des surérogatoires, akhi !
Y'a pas tant qu'ça d'ici à k-new-yor
Même procédé dans la façon dont ils accueillent les Noirs
À quoi ça sert d'être enterré dans un cercueil en or ?
Tu sais mon frère, ça dure pas plus de 3 jours quand les gens pleurent un mort
Toujours les mêmes qui sont visés
Les mêmes sur qui on envoie les mêmes p'tits cons d'huissiers
Les mêmes qui visent l'estrade, les mêmes qui visent les strass
Les mêmes qui visent les grosses fesses dans les vis-Lé Strauss

[Freestyle 11]
Te déchire pas le son nous on s'en fout tu sais
On court pas derrière les radios ni ces foutues scènes
C'est clair que pour les rageux on doit en foutre du seum
Ils ont l'air bête comme un mec qui tape un foot tout seul
Akhi ça va faire les gros titres c'est le 3ème prototype
Ça tape des pas robotiques quand mes potos kickent
Tu te demandes c'est quoi l'équipe qu'est ce qu'ils boient les types ?
Anti teck et toutes les modes qui foutent à poil les petites
On joue en D1 les autres ont la dalle en DH
Normal qu'est ce que tu veux faire avec un talent téache ?
Ils ont demandé si nos flows coûtaient cher
T'imagines la réponse ils sont trop goûtedés cheh
Trop d'MC's ne valent rien sans le pét' tu crois que je mens peut-être ?
3ème pro sans déc' c'est l'écrasement de tête
Akhi c'est lourd c'est normal c'est nous
Toi balance moi juste le contrat puis dis moi je signe où

[Freestyle 12]
Poto c'est chaud ce qui se passe y'a même des os qui se cassent
Dis à tes gosses qu'ils se cassent
Y'a des coups de genou des coups de coude dans nos couplets
Puis des coups de tête des coups de bouteille et beaucoup de plaies
On te l'a dit ce qu'on vise nous c'est le disque de cristal
Pas besoin de vice ni de piston la concu pique une crise d'asthme
Oorh Sexion d'Assaut on peut tout plier d'une main
Toi t'auras beau quettema des tubes on va t'oublier demain
Dans le rap on se mélange pas trop tah les portoricains
Jusqu'à la inf je changerai pas de maillot j'en porterai qu'un
Nos sons tournent dans les portables comme les puces Orange
Ça va plus loin tu peux même entendre notre bus au ranch
Akhi y'a du mouvement comme dans le Transporteur
Et même nos concurrents sont en fait de grands supporters
Vas y reste par terre fais pas l'imbécile
J'ai prévenu les autres ils arrivent ils sont pas loin d'ici
On pratique depuis l'époque des films en noir et blanc
Pour péter faut du talent il suffit pas d'avoir les plans
Dans le son t'as l'air fragile comme si t'avais les os de verre
Si t'as pas les épaules poto bah laisse les autres faire
Depuis les premières pompes à scratch ça gratte et ça péra
J'suis pas venu jouer les cracks mais je crois que ça paiera
J'répète Sexion d'Assaut on peut tout plier d'une main
Toi t'auras beau quettema des tubes on va t'oublier demain

[Freestyle 13]
J'ai envie d'dire ""Salam"" au rap, il est sale à mon goût
J'veux pas dépendre d'un mec qui sur son bureau m'dit ""ça m'a l'air good""
J'me vois plutôt être dans les annales, et tout
Qu'les MC's m'craignent comme les goals craignent Samuel Eto'o
J'passe l'salam aux zinc du bled qui d'là-bas m'écoutent
Et à ceux qui rendent les coups quand les gars d'la BAC les goument
Aux échecs scolaires, tombés en panne à l'école
Aux ex-loux-ja qui maintenant disent ""wallah l'bum-al est cool""
Salam aux taulards, bés-tom pour quelques dollars
Les keufs se croient dans un polar, heureusement qu'j'ai connu tôt l'art
Salam au fous du ballon rond
Le mec qui s'en bat les reins de tout, tant qu'il rate pas l'euro
Salam à ceux qu'ont tés-ache le street bum-al
Et qui... l'écoutent en boucle, et j'vois que blancs, noirs, chin', peau mâte
Akhi

[Freestyle 14]
Moi sur la jet set je ssep, akhi j'te l'dis sec
Cette putain d'époque m’excède, les gamines au sexe cèdent
Depuis le temps qui passe sale, les petits sont toujours pas stables
Té-ma leurs bastons, ils se tuent comme Dirty Bastard
Poursuites et cascades, ça pour quelques pascals
Mais y'a toujours pas de taff, comment leur dire de pas s'tape ?
Je compte plus les castagnes pour des gos genre Casta
Des fois on te casse ta gueule pour un simple ""qu'est-ce t'as ?""
Pour un simple kefta, ça crie comme la Castafiore
Et si te tu casses t'as pas ta part du casse-dalle
Détends-toi, tu bouges trop, de ton équipe t'es que le bouche-trou
Si tu veux des ouss gros, c'est que t'étais pas fait pour ce groupe
Moi je concocte pas de plan, tout ce qu'est pe-stu qu'j'suis pas dedans
J'ai même pas le bac blanc mais je crois que ça me dérange pas tant
Si je fais tout ce trajet, c'est pas pour un court traj-mé
C'est pas dans la soupe que je crache mais ils me prennent pour un fou de l'HP
Le CD coûte pas cher les mecs c'est à vous de l'acheter
Un putain de coup de karcher les MC's sont tous fachés
Et toi le grand moustachu ta voix devient douce t'as chaud
Vous voulez tous la chute du seul groupe qui pousse la chose
Cette bande de poufs m'attaquent je les attends les coups de matraque
Vont pleuvoir à toute patate jusqu'à pas d'heure ou pas d'acte
Je te préviens si ça pète faudra pas dire il se la pète
Si t'as du vice t'as peut-être une chance mais moi je vise la tête

[Freestyle 15]
Akhi, j’arrive, j’ai la dalle d’un loup qu'on 'ché-la'
Dans la foule, les 'ches-lâ' foutent le camp, prennent le 'ge-lar'
Mets ta ceinture, tu l’as senti, ça tire pour des centimes
Gros, ici, c’est sans 'tié-p', les mecs sans thunes veulent faire des sous sans l'Dîn
Ici, c’est Paname, on trouve banal que quelqu'un n’ait pas d’âme
Si t’as pas d’ami, qu't’es pas d’la mif' mais qu'tu vis, c’est déjà pas mal
T’étais pas là quand la hass m’a dit : ""Vas-y, mets toi là
P’tit, tu vois les toilettes qui sont là ? Ben, dépêche-toi, nettoie les""
L’Etat m'a qu'-arna, y’a eu vice de procédure
Déjà qu'Iblis veut nous séduire, j’vois que, viser haut, c’est dur
Quoi qu'on dise, on nous bloque ; nos potes, de peines, écopent
Mais, si j’trouais le proc', les cops trouveraient le brolic
Ils veulent nous faire bouffer des Frolic, on va leur faire bouffer Les Chroniques
On est 'ssifs-ma' comme les alcooliques ou les doses que les accrocs niquent
Mais laisse-moi monter mon comité avec deux/trois acolytes
Que j'puisse lutter contre l’autorité, comme Tiken Jah Fakoly, mais
Mais vise les dégâts qu'on pourrait faire si c'était légal
Les pédophiles, j’les tuerais pas, j’me contenterais d’viser les cannes

[Freestyle 16]
Dans le rap, j'suis comme un tueur qui met même plus ses gants
La dernière fois que j'ai fait du lèg', je sais même plus c'est quand
J'me présente, Lefa, aka
Celui qui montre pas ses ieus, et qui est
Efficace, vite classe moi dans les types classes
Ceux qui placent leur thune plutôt que d'la jeter dans des p'tites tasses
Ok, vous l'aurais voulu un stre-mon est né
Surtout l'approchez ap il est extrêmement haineux
Ce son, si tu veux te noyer dans tes excréments mets le
Mais viens pas m’emmerder sinon ma Sexion s'en mêle
Soir ce, on n'est pas couchés
Ceux qui sont pas pour, on les envoie tous chier
Comment veux tu qu'on coule ? On n'est pas touchés
Pourquoi j'allais pas en cours ? Parce qu'un jour ou l'autre tout se sait
Me demandez pas de tousser, j'ai rien ché-ca dans les seufs
J'ai rien de dangereux sur moi, à part ce qui est ché-ca dans mes se-pha

[Freestyle 17]
Akhi, on n’est pas la pour faire les gosses
Redoutés comme Amin Dada le dernier roi d'Ecosse
On sort tout droit de l'école des PV
Avec la dalle d'un blédar qui veut dégommer le préfet
Akhi, la prod' on la ménage pas
C'est violent comme les indiens d'époque face aux visages pâles
Mes collègues c'est des dingues
Formés dans la street à pper-ra jusqu'à ce que toutes les lumières soient éteintes
Mais dans la lumière ou les ténèbres
Y'a toujours quelqu'un pour venir me dire : ""Oui, mais t'es nègre""
J'ai pas le temps d’me balader, quand j'avance j'tape pas la démarche
J’me prends pas la tête, fuck you bataradé
J'pé-ra, t'es qué-o-ch comme quand tu t'manges des vérités
C'est parce que j'cascade printemps, automne, hiver, été
Vas-y pose ton verre et tes lunettes sur le comptoir
Je t’envoie JR et sa baffe d'ours, t'as trop fait le con ce soir
C'est le Wati B donc ça kicke façon sale
Explique-moi c'que vont faire des couteaux suisses face aux sabres (akhi)
Moi j’pé-fra dans les points vitaux
J’suis l'désert : qu’est-ce tu vas faire avec ta teille d’un litre d’eau ? (akhi)
On va pas s'mytho t’as pas l’étoffe
Cette fois-ci j'te l'dis les élèves rattraperont pas les profs

[Freestyle 18]
Amène un tièpe j'le défonce, j'ai les crocs
Vu mon gab' j'ai pas peur de finir, chez les gros
Frangin, j'suis un drôle d'engin
J'arrive comme un retour de flamme sur celui qui laisse ses potes en chien
Ok Sexion d'Assaut si t'es chaud vas-y combat-les
Mais t'étonne pas si tes dents s'plantent dans ton palais
Et puis si t'acquiesce pas teste des boules Quies
C'est d'la boucherie j'laisse la pièce pleine de bouts d'graisse
J'arrive j'suis déterminé, en mode terminé
Ca fait un bail, une éternité, que j'voulais faire taire les mythos
C'est le W.A.T.I. B, attends j'mets replay
Quoi ? Tu dis quoi, t'as rippé ? Avant d'arriver ?
On s'dirige vers l'Apogée même si dans le cac' on patogeait
Jusqu'à ce qu'on soit sous les projecteurs on a pas lâché le projet
Ca se passe près des caniveaux, du bitume sale
C'est là que j'ai commencé mais comme j'étais petit tu me zappais
Depuis avec l'équipe on a rempli plus d'une salle, mais
On touche pas encore de putain de sommes, akhi
Laisse-nous faire notre parcours sans nous jalouser
Ça nous té-je tellement l’œil que certains commencent à loucher

[Freestyle 19]
Ok pousse toi je déboule vitesse grand V
Pas besoin de préciser que ton col en V faut l'enlever
C'est le débit que tous les rappeurs envient
Enfin ceux qui sont encore en vie
Bref pour beaucoup de gens on est gênant
On prend trop de place parce qu'on est géant
Merde on les empêche peut-être de géman ?
Ooh tout le monde n'a pas la chance d'être excellent
Là je me célan c'est mort je vais te salir
Le rap céfran souffre et rêve qu'on s'allie
La capitale s'allume à chaque fois que je slalome
Sur une grosse prod salée de Stan Stan-E shut upEmbed"
Karim Fall,Dernier arrêt,"11 ContributorsDernier arrêt Lyrics[Intro : Lefa]
Dernier des derniers, petits pas, petits pas
Dernier des derniers, petits pas, petits pas

[Couplet 1 : Lefa]
Localisé, on t'a localisé, on va te traumatiser
Pas l'habitude de rater quand nous ka viser
Petits pas synchronisés (petits pas), petits pas sans s'alcooliser (petits pas, petits pas)
Sur sol mouillé, derniers souliers pour pas glisser
Dernier arrêt, dernier des derniers, donc fais marche arrière
Descends sinon c'est la fin d'ta carrière (quitte là), c'est la fin d'ta carrière (descends)
Dernier arrêt, dernier des derniers, donc fais marche arrière
Descends sinon c'est la fin d'ta carrière (quitte là), c'est la fin d'ta carrière
[Pré-refrain : Dadju]
Arrête un peu de paniquer, respire
Prends ta place sans dire merci
Fais-nous voir ce que tu vaux
Montre-nous c'que tu proposes
Ou descends (descends), descends (descends)
Descends (descends), dernier arrêt donc
Descends (descends), descends (quitte là)
Tu n'peux pas tenir

[Refrain : Lefa (& Abou Debeing)]
Dernier arrêt (ouh, le dernier)
Si tu n'es pas prêt pour ça, descends (ah, quitte là)
Dernier arrêt (le dernier des derniers)
Tu n'es pas prêt pour ça, descends (quitte là)
Dernier arrêt (ouh, le dernier)
Si tu n'es pas prêt pour ça, descends (descends)
Dernier arrêt (le dernier des derniers)
Tu n'es pas prêt pour ça, descends
You might also like[Couplt 2 : Abou Debeing]
Viens si tu veux d'l'ambiance
J'ai dit : ""Viens si tu veux d'l'ambiance""
Tout dans l'mouv, tout dans l'apparence
Elle veut mon nom : c'est la Beingance
Enchanté, j'suis de bonne humeur
Ce soir, j'ai pas l'temps pour les rumeurs
Tu m'analyses depuis une heure
Pourquoi tu t'figes ? Faut pas qu't'aies peur
J'ai l'dernier flow, les dernières sappes
En vérité, j'suis le dernier gars
On m'voit casser le dernier pas
Regarde-moi, c'est p't-être la dernière fois (Eh eh)

[Pré-refrain : Dadju]
Arrête un peu de paniquer, respire
Prends ta place sans dire merci
Fais-nous voir ce que tu vaux
Montre-nous c'que tu proposes
Ou descends (descends), descends (descends)
Descends (descends), dernier arrêt donc
Descends (descends), descends (quitte là)
Tu n'peux pas tenir

[Refrain : Lefa (& Abou Debeing)]
Dernier arrêt (ouh, le dernier)
Si tu n'es pas prêt pour ça, descends (ah, quitte là)
Dernier arrêt (le dernier des derniers)
Tu n'es pas prêt pour ça, descends (quitte là)
Dernier arrêt (ouh, le dernier)
Si tu n'es pas prêt pour ça, descends (descends)
Dernier arrêt (le dernier des derniers)
Tu n'es pas prêt pour ça, descends (ah, quitte là)
[Couplet 3 : Lefa]
Organisés, on est organisés
Cazalisés, chemisés, oui, la coupe est égalisée (oui monsieur)
Petits pas synchronisés (petits pas), petits pas sans s'alcooliser (petits pas, petits pas)
Tout en douceur comme si c'était légalisé
Dernier arrêt, dernier des derniers, donc fais pas d'erreur
Si tu n'es pas prêt, ressors pas derrière (quitte là), petits pas, petits pas

[Refrain : Lefa (& Abou Debeing)]
Dernier arrêt (ouh, le dernier)
Si tu n'es pas prêt pour ça, descends (ah, quitte là)
Dernier arrêt (le dernier des derniers)
Tu n'es pas prêt pour ça, descends (quitte là)
Dernier arrêt (ouh, le dernier)
Si tu n'es pas prêt pour ça, descends (descends)
Dernier arrêt (le dernier des derniers)
Tu n'es pas prêt pour ça, descends (quitte là)

[Outro : Dadju (& Lefa)]
Nous, on y go, nous, on y go, t'es prêt ou pas ?
Nous, on y go (petits pas, petits pas), nous, on y go, t'es prêt pour ça ?
Nous, on y go, t'es prêt ou pas ? Nous, on y go
Hein hein, nous, on y go, dernier arrêt
Si t'es pas prêt pour ça, descends
(Dernier des derniers)
(Petits pas, petits pas)
(Dernier des derniers des derniers)
(Petits pas, petits pas)
(Dernier des derniers...)
Nous, on y go
(... des derniers)
Si t'es pas prêt pour ça, descends2Embed"
