Artist,Title,Lyrics
Karim Fall,Rêves de môme,"12 ContributorsRêves de môme Lyrics[Couplet 1]
J'suis dans les hauteurs, j'guette la city, l'Homme est toujours aussi p'tit
Si p'tit et pourtant si gourmand qu'il veut l'monde à ses pieds
L'avenir est susceptible, j'te mens pas, j'suis sceptique
D'après les signaux, c'est p't-être bientôt la fin, faut l'accepter
J'suis pas fou, j'suis lucide, j'regarde la vérité dans l'blanc des yeux
Pendant qu't'hallucines, tu noies l'poisson dans un verre de cidre
Eh mec, au fond, c'est toi qui décides, tu fais tes choix, tu les assumes
Les mauvais reviennent et t'pètent à la gueule comme une attaque à l'acide
À force de stagner, j'm'enracine, j'veux disparaître casser ma sim
J'suis contraint d'rester à mon poste, comme le guetteur à l'entrée d'la cité
D'l'encre noire pour noyer mes peines, du temps pour soigner mes plaies
Comme calmants, j'ai quelques bons souvenirs en tête que j'me passe en replay

[Refrain]
Abîmé par le temps, j'suis plus le même qu'avant
J'ai plus les mêmes attentes que quand j'étais môme
J'ai fini par comprendre que j'changerai pas le monde
En enfilant ma cape comme un super-héros
Abîmé par le temps, j'suis plus le même qu'avant
J'ai plus les mêmes attentes que quand j'étais môme
J'ai fini par comprendre que j'changerai pas le monde
En enfilant ma cape comme un super-héros

[Couplet 2]
Faut dire qu'la vie perd d'la valeur depuis l'invention d'la poudre à canon
Mais j'préfère mourir d'une balle que d'me jeter sous les roues d'un camion
Gagnons du time, épargnons-nous les formules de politesse, non, vraiment
Mon cœur est noir comme les traces que les bolides laissent en freinant
Effrayant, j'avance en m'frayant
Un chemin parmi des gens qui pensent que l'bonheur est payant
J'les ai regardés droit dans les yeuz, j'ai cru voir le néant
Hypnotisés par l'matériel comme les moustiques par les néons
J'suis Néo dans Matrix, j'y vois clair, ça m'attriste
Pendant qu'les gosses passent leur temps devant la plus grande oratrice
Dès l'plus jeune âge, sujets aux pulsions consommatrices
Pour finir dans les entrailles de la Terre qu'on traumatise
You might also like[Refrain]
Abîmé par le temps, j'suis plus le même qu'avant
J'ai plus les mêmes attentes que quand j'étais môme
J'ai fini par comprendre que j'changerai pas le monde
En enfilant ma cape comme un super-héros
Abîmé par le temps, j'suis plus le même qu'avant
J'ai plus les mêmes attentes que quand j'étais môme
J'ai fini par comprendre que j'changerai pas le monde
En enfilant ma cape comme un super-héros
Abîmé par le temps, j'suis plus le même qu'avant
J'ai plus les mêmes attentes que quand j'étais môme
J'ai fini par comprendre que j'changerai pas le monde
En enfilant ma cape comme un super-héros1Embed"
Karim Fall,Roddy Ricch,"9 ContributorsRoddy Ricch Lyrics[Paroles de ""Roddy Ricch""]

[Intro]
Ouais, ouais, ouais, ouais, ouais
Ouais, ouais, ouais, ouais, ouais
Ouais, ouais, ouais, ouais, ouais
Ouais, ouais, ouais, ouais, ouais

[Pré-refrain]
J'croyais qu'elle m'aimait ; tout c'qu'elle veut, c'est ma money, bitch (money)
Elle m'fait des menaces, elle veut m'faire chanter comme Roddy Ricch (Roddy)
Ouh-ouh, ouh-ouh, money, bitch
Elle m'fait des menaces, elle veut m'faire chanter comme Roddy Ricch

[Refrain]
Ouais, ouais, ouais, ouais (Roddy)
Ouais, ouais, ouais, ouais, ouais (Roddy Ricch)
Ouais, ouais, ouais, ouais, ouais (ouais)
Ouais, ouais, ouais, ouais, ouais (ouais, ouais, hey, hey)

[Couplet 1]
Elle veut d'la maille, elle a déjà oublié les cadeaux (les cadeaux, les cadeaux)
Ellе va rien cher-lâ tant qu'ellе a pas sa part du gâteau (elle va rien cher-lâ)
Elle renvoie des messages, elle renvoie des messages, elle renvoie des piques (elle vise le cœur)
Ça m'atteint pas, j'ai déjà donné mon cœur à quelqu'un d'autre (ça m'atteint pas)
Pour surmonter ses 'blèmes, j'lui f'sais la courte échelle (courte échelle)
Maintenant qu'c'est fini, elle ose me dire : ""Ça va t'coûter cher"" (ah, ah)
Amnésie (amnésie)
J'regrette pas d'l'lui avoir dit : ""Ciao"" (oh)
Elle a mal, elle veut que je paye, elle veut m'faire la peau
Je lui parle, mais elle voudra jamais admettre qu'elle a tort (boum-boum, boum-boum)
Elle me tire dessus de loin, elle me tire dessus de loin (elle me tire), ouais, ouais
Elle me tire dessus de loin (piou-piou, piou-piou)
You might also like[Refrain]
Ouais, ouais, ouais, ouais (Roddy)
Ouais, ouais, ouais, ouais, ouais (Roddy Ricch)
Ouais, ouais, ouais, ouais, ouais (ouais)
Ouais, ouais, ouais, ouais, ouais (ouais, ouais, hey, hey)

[Couplet 2]
Elle m'envoie des messages, elle parle mal, elle insulte la madre (elle insulte la daronne)
Moi j'réponds pas, mais si c'était un man, j'te l'aurais marbré
Oui, plus j'l'ignore et plus elle prend le mort, elle sait qu'c'est fini, c'est plus pareil, hmm
Elle sait qu'y a quelqu'un d'autre qui dort la nuit sur mon torse, et ça la rend tarée (hmm)
Elle essaye encore de m'atteindre avec un boy choisi sur le tas
Oui, au fond, elle espère encore me voir revenir, elle compte sur le temps (le temps)
Elle pensait vraiment qu'en m'quittant elle aurait (bitch) au moins la moitié (au moins la moitié)
Mais c'est mort, j'vais même pas lui donner (c'est mort) mon amitié (mon amitié)

[Pré-refrain]
J'croyais qu'elle m'aimait ; tout c'qu'elle veut, c'est ma money, bitch (money)
Elle m'fait des menaces, elle veut m'faire chanter comme Roddy Ricch (Roddy)
Ouh-ouh, ouh-ouh, money, bitch (money)
Elle m'fait des menaces, elle veut m'faire chanter comme Roddy Ricch (Roddy, hé)

[Refrain]
Ouais, ouais, ouais, ouais (Roddy)
Ouais, ouais, ouais, ouais, ouais (Roddy Ricch)
Ouais, ouais, ouais, ouais, ouais (ouais)
Ouais, ouais, ouais, ouais, ouais (ouais, ouais, hey, hey)Embed"
Karim Fall,Rouler,"13 ContributorsRouler Lyrics[Refrain : Lefa]
Laisse-moi rouler loin des ennuis
Passer la cinquième et transformer nos vies
La roue va tourner, ça va trop vite
L'avenir est fragile mais le cœur est solide
Laisse-moi rouler, rouler, rouler, rouler
Laisse-moi rouler, rouler, rouler, rouler
Laisse-moi rouler, rouler, rouler, rouler
Laisse-moi rouler, rouler, rouler, rouler (laisse-moi piloter)

[Couplet 1 : Lefa]
Ok, c'genre de son, c'est totalement ma came
J'me vois d'jà en live, la foule en feu comme mon concert à Dakar
Le binôme ressort du placard, j'veux l'faire rêver
Restau' classe, on est d'accord, prends c'que tu veux sur la carte
Ouais j'ai charbonné, prépare ton sac, on va voyager
Première classe, hôtel de luxe, dans piscine chauffée, tu vas nager
On va pas jouer ngatie, on va snapper fort, tuer la 4G
Pas question qu'tu retournes en cachette voir la proc', va pas tout gâcher
J'veux plus entendre parler de bracelet, peine aménagée
C'est derrière toi, c'est du passé, wesh wesh on a quel âge ?
Eh, gros, c'est l'moment de brasser, ouais ouais, l'moment de brasser
Pas laisser passer madame la thune sans l'embrasser

[Refrain : Lefa]
Laisse-moi rouler loin des ennuis
Passer la cinquième et transformer nos vies
La roue va tourner, ça va trop vite
L'avenir est fragile mais le cœur est solide
Laisse-moi rouler, rouler, rouler, rouler
Laisse-moi rouler, rouler, rouler, rouler
Laisse-moi rouler, rouler, rouler, rouler
Laisse-moi rouler, rouler, rouler, rouler (laisse-moi piloter)
[Couplet 2 : S.Pri Noir]
Rouler, laisse moi-rouler
J'me bats contre mon destin, j'reste en vie
Envoie les clés du globe, celles de l'espace
Fuck ces petits bâtards qui n'cessent de nous envier
Fuck l'applaudimètre, fuck les messes basses
C'qui m'importe, c'est faire le cash de janvier à janvier
Je fais le tour d'ma ville, je ne veux plus danser
Au son du reggaeton, l'son résonne dans l'Audi
Avec ma bande de potes, on ne veut plus penser
On veut seulement rouler, partir loin des ennuis
Ouais, laisse-moi rouler, laisse-moi rouler
Du gramme à la tonne de fougère, de quoi la tourner
Envie d'me faire une banque avec les mains gantées
Envie de faire le tour du monde tant qu'on a la santé
Je veux faire le tour de ma planète
Faire le tour de ma planète, laisse-moi rouler

[Refrain : Lefa]
Laisse-moi rouler loin des ennuis
Passer la cinquième et transformer nos vies
La roue va tourner, ça va trop vite
L'avenir est fragile mais le cœur est solide
Laisse-moi rouler, rouler, rouler, rouler
Laisse-moi rouler, rouler, rouler, rouler
Laisse-moi rouler, rouler, rouler, rouler
Laisse-moi rouler, rouler, rouler, rouler (laisse-moi piloter)
[Couplet 3 : Lefa]
Yeah, j'ai d'la qualité, on va vendre en gros comme en détail
Ouais, j'sors du lot, les autres sont tous marqués au fer comme du bétail
On va prendre la coupe, pas besoin d'leurs vulgaires médailles
J'suis violent comme un choc d'boîte crânienne versus barre en métal
Laisse-moi trois minutes, j'vais t'faire prendre du level
J'vais mettre la barre haute comme au réveil
Oui, maman, c'est bien ton fils à la télé
Ouais, j'ai pris des risques, ça a payé
Et j'ai du monde à porter
Quand j't'appelle pas, m'fais pas la gueule, c'est qu'j'suis débordé
Ouais, tous mes potes pensent que j'peux apporter
Quelque chose, ouvrir des portes mais le monde l'a emporté

[Refrain : Lefa]
Laisse-moi rouler loin des ennuis
Passer la cinquième et transformer nos vies
La roue va tourner, ça va trop vite
L'avenir est fragile mais le cœur est solide
Laisse-moi rouler, rouler, rouler, rouler
Laisse-moi rouler, rouler, rouler, rouler
Laisse-moi rouler, rouler, rouler, rouler
Laisse-moi rouler, rouler, rouler, rouler (laisse-moi piloter)

[Outro : Lefa & S.Pri Noir]
Rouler, laisse-moi rouler (laisse moi piloter)
Laisse-moi (laisse-moi piloter)You might also like3Embed"
Karim Fall,Sang-froid,"19 ContributorsSang-froid Lyrics[Couplet 1]
Tu crois m'connaître par cœur, mais connais-tu vraiment Fall ?
Si tu veux pas qu'elles fanent, me jette pas d'fleurs
Me mets pas dans ton répertoire, j'suis sur écoute
Apparemment, les 'bus-bar', c'est leur bête noire
J'suis pas Molière, j'dis les choses à ma manière, j'parle
Les molaires serrées, j'parle avec mes nerfs, j'parle
Sans faire de grand geste, sans faire de grande thèse
Ouais, j'parle cash sans faire de parenthèse
Des fois, j'ai pas les mots, mais c'est qu'un détail
La preuve : la vérité sort d'la bouche des mômes, ouais
Une seule langue, deux oreilles
Pour avoir deux fois plus de chance d'entendre les conseils de son khey
Parce qu’on s'fait pas seul, on s'fait pas seul
Difficile d's'en rappeler quand tes pieds touchent plus le sol
Difficile d's'en rappeler quand t'es sur l'devant d'la scène
Mais faut pas être prêt à tout pour l'argent quelle que soit la somme
Ouais, creuser, creuser, faire son trou
Je sais qui sont mes frérots, pour le reste, j'les laisse entre eux
Que ce soit pour une bataille ou pour la guerre, mec, on s'entraide
Les chiens aboient mais l'convoi reste concentré

[Refrain]
Si tu veux la paix, ouais, yeah, yeah
Faut faire la guerre ou faut la payer, yeah, yeah
On dort debout, on dort éveillé, yeah, yeah
Plus grand-chose peut nous effrayer, yeah, yeah, yeah, yeah
Yeah, yeah, yeah, yeah
Yeah, yeah, yeah, yeah
Yeah, yeah, yeah, yeah
Yeah, yeah, yeah, yeah
You might also like[Couplet 2]
Fais gaffe à qui tu tournes le dos, ouais
Ceux qu'tu vois pas venir dans l'rétro
Fais gaffe à ceux qui parlent mais qui tournent autour du pot
Fais gaffe à ceux qui ont des grands projets mais qui dorment trop
Ouais, bouger, bouger, faire du blé
Ouais, bouger, faire du blé sauf si tu peux l'faire d'où t'es
Bien choisir ses associés pour éviter d'se faire doubler
Mettre sur le côté tout c'qui pourrait t'faire douter
Ouais, faut pas jouer toutes ses cartes
Faut pas forcer la gloire, c'est chacun son quart d'heure
Poser les premières briques et monter la garde
Y'a ceux qui passent à l'acte et ceux qui regardent
Difficile de résister quand l'illicite te drague
L'argent facile est une michto qui tient par la braguette
Ouais, une meuf qui te drague et puis te braque
Tu veux lui passer la bague au doigt, t'as craqué
Ouais, caresser dans l'sens du poil
C'est caresser son ego, ouais, c'est lui faire prendre du poids
T'as pas besoin d'ça quand t'es déjà quelqu'un qu'on montre du doigt
Celui qui tombe du premier n'est pas comme celui qui tombe du toit
On t'a gonflé, gonflé, gonflé les fesses comme c'est pas permis
Il va t'falloir plus que des squats si tu veux les raffermir
Et tu sais très bien qu'tout c'qui monte est voué à redescendre
Quand le vent tourne, comment renaître de ses cendres ?
Ramasser les pots cassés et recoller les morceaux
T'as montré ton visage, t'as montré tes dorsaux
T'as clairement confondu les serviettes et les torchons
T'as tué la confiance, le corps est encore chaud
[Refrain]
Si tu veux la paix, ouais, yeah, yeah
Faut faire la guerre ou faut la payer, yeah, yeah
On dort debout, on dort éveillé, yeah, yeah
Plus grand-chose peut nous effrayer, yeah, yeah, yeah, yeah
Yeah, yeah, yeah, yeah
Yeah, yeah, yeah, yeah
Yeah, yeah, yeah, yeah
Yeah, yeah, yeah, yeah5Embed"
Karim Fall,Sans prise de tête,"8 ContributorsSans prise de tête Lyrics[Paroles de ""Sans prise de tête""]

[Couplet 1]
J'ai besoin d’recul, j'ai l'cerveau en brasier (Ouais)
À trop chercher la perfection, j’vais plus rien apprécier
Attends (Attends), j'me retourne, wow, j'ai fait un long trajet (Wow)
J'ai eu mes coups d'éclats, j'ai eu mes périodes ombragées (Wow)
Une voix dans ma tête me rappelle qu'y'a des chiffres à faire (Des chiffres)
Qu’la concurrence dort pas, qu’y'a d’plus en plus de mecs qui frappent fort
Paraît qu'faut qu'je ponde un tube (Un hit), un truc plus radiophonique (Ah ouais ?)
Une strat' marketing, genre faire un buzz avec un faux leak (Ah ouais ?)
Du coup, j’convoque le staff, j'ai un nouveau mindset à instaurer (Ouais)
Les autres, c'est les autres ; moi, c'est moi, chacun sa story (Chacun sa story)
J'ai plus envie d'faire des trucs qui m'ressemblent pas pour être en tendances (En tendances, oh)
Qui va dire quoi ? (Qui ?) J'm'en branle, vive l'indépendance (vive l'indépendance)

[Refrain]
Mon bigo sonne, qui m'emmerde ? (Qui ?)
Dites-leur de m'laisser en paix (Laisser en paix), yeah
Mon bigo sonne, qui m'emmerde ? (Qui ?)
Dites-leur de m'laisser en paix (Laisser en paix), yeah
(Oh-oh, oh-oh, oh-oh) Sans prise de tête
(Oh-oh, oh-oh, oh-oh) Sans prise de tête
(Oh-oh, oh-oh, oh-oh) Sans prise de tête
(Oh-oh, oh-oh, oh-oh) Sans prise de tête
You might also like[Couplet 2]
Nouvel album sort (Ok), c'est plus d'mon ressort (Hun, hun-hun)
C'est pas moi qui vais dire aux gens c'qu'il faut qu'ils ressentent (Hun, hun-hun)
J'ai pas envie d'le vendre pendant des heures comme un putain d'commercial (Non)
J'lis quelques com' pour le plaisir, les retours sont bons, j'suis apaisé
C'est des mois d'taf et des sacrifices de plus (Ouais), focus
Comme un joueur sur l'terrain, même quand ça crie : ""Fils de pute"" (Wow)
J'vais pas jeter tout ça aux chiottes (non) après une semaine d'exploitation
Pour une histoire de tops et d'classements ou parce qu'une radio n'y prête pas attention (Hun-hun, on les baise)
J'laisse mon public prendre mes patins (Patins)
J'laisse mon public (Ouais) prendre mes patins même si, au fond, j'leur en demande pas tant
Putain, j'te jure que ça m'épate (J'te jure que ça m'épate), vous venez d'partout (Partout)
Rendez-vous au Zénith (Oui), j'vous mérite pas si j'vous donne pas tout

[Refrain]
Mon bigo sonne, qui m'emmerde ? (Qui ?)
Dites-leur de m'laisser en paix (Laisser en paix), yeah
Mon bigo sonne, qui m'emmerde ? (Qui ?)
Dites-leur de m'laisser en paix (Laisser en paix), yeah
(Oh-oh, oh-oh, oh-oh) Sans prise de tête
(Oh-oh, oh-oh, oh-oh) Sans prise de tête
(Oh-oh, oh-oh, oh-oh) Sans prise de tête
(Oh-oh, oh-oh, oh-oh) Sans prise de tête

[Outro]
(Oh-oh, oh-oh, oh-oh)
(Oh-oh, oh-oh, oh-oh) Sans prise de tête
(Oh-oh, oh-oh, oh-oh)
(Oh-oh, oh-oh, oh-oh) Sans prise de têteEmbed"
Karim Fall,Santé,"11 ContributorsSanté Lyrics[Intro]
Hey, des verres se lèvent, j'crois qu'ça veut boire à ma santé
D'après mes fans, j'aurais jamais dû m'absenter
J'prends l'volant, l'game y voit flou comme sous absinthe

[Couplet 1]
Hey, chaque œil à domicile distribue correction
J'cherche mes couplets comme des putains d'pièces de collection
T'entends l''on-s' en noir et blanc, c'est mon côté sombre
J'suis visionnaire, j'peux t'dire qu'ta carrière s'arrête en décembre
L'Homme est plus sage avec un Colt au fond du gosier
T'à l'heure, t'étais grossier ; là, tu veux négocier
Certifié 'bre-som', tu peux vérifier mon dossier
Aucun témoin n'se présente au cours d'mon procès

[Refrain]
Des verres se lèvent, j'crois qu'ça veut boire à ma santé
D'après mes fans, j'aurais jamais dû m'absenter
J'prends l'volant, l'game y voit flou comme sous absinthe
Est-ce que j'ai besoin d'préciser qu'j'veux voir tout l'monde sauter ?

[Couplet 2]
Le game est trop p'tit, j'trouve personne pour me bluffer
J'm'y sens trop à l’étroit, ma tête touche le plafond
T'es sous les flashs et, l'instant d'après, c'est l'trou noir
Tu peux sortir, la retraite attend dans l'couloir
Ta tête laissait passer l'air, comme une porte battante
T'es plus sage avec un Colt posé sur la tempe
La scène d'après, c'est des bouts d'cervelle contre la vitre
Pour capter l'attention, faut d'la violence gratuite
You might also like[Refrain]
Des verres se lèvent, j'crois qu'ça veut boire à ma santé
D'après mes fans, j'aurais jamais dû m'absenter
J'prends l'volant, l'game y voit flou comme sous absinthe, hein
Est-ce que j'ai besoin d'préciser qu'j'veux voir tout l'monde sauter ?

[Pont]
Sauter, ça veut boire à ma santé
Sauter, santé
Santé

[Refrain]
Des verres se lèvent, j'crois qu'ça veut boire à ma santé
D'après mes fans, j'aurais jamais dû m'absenter
J'prends l'volant, l'game y voit flou comme sous absinthe, hein
Est-ce que j'ai besoin d'préciser qu'j'veux voir tout l'monde sauter ?

[Outro]
Sauter, santé
Sauter
Santé1Embed"
Karim Fall,Seul,"26 ContributorsSeul Lyrics[Refrain]
Seul comme si j'étais moche et méchant
Comme, comme si j'dérangeais des gens
En attendant d'être élevé au rang des légendes
J'fête mes victoires en silence sans faire péter l'champ'
En avance sur ma génération comme un présu'
Pour pas les brusquer, j'y allais mollo jusqu'à présent
Et pour leur laisser l'temps d'cicatriser d'leurs blessures
J'tournerai dans la capitale comme dans la cour d'une prison

[Couplet unique]
Les années passent comme des mois, j'suis témoin
Le temps dessine sur ton visage et sur tes mains
Des albums entiers enregistrés dans des souterrains
À chercher d'l'or dans un monde où, sans les sous, t'es rien
On t'regardera même pas, on t’adressera même pas la parole
Même pas pour t'indiquer ton chemin ; wesh, il est complètement paro
Celui qui a dit que toutes les routes, toutes les routes mènent à Rome
Si la fin justifie l'moyen, elle a pas toujours l'même arôme
Alors, petite, remets ta robe, t'es pas prête
Pour la perversion de l'Homme, mais si couleur sang
Sont les semelles de tes talons, t'étonne pas
Si le loup a les dents longues et la face cachée dans l'ombre
Tous une part d'animosité, la capacité
D'assister sans rien faire aux pires atrocités
Aveuglés par la luminosité
Non pas d'nos idées mais d'nos écrans de marque déjà trop citées
Ouais, jette-toi par la fenêtre
Tu cherches l'amour en 2.18, y'a très peu d'meufs honnêtes
Tu cherches du taf en 2.18, putain, faut des connex'
Et y'a des mecs qu'ont des connex' mais, gros, faut les connaître
Moi, j'attends pas qu'ça tombe du ciel, frérot, j'suis travailleur
C'est pas méchant mais j'suis en guerre, va parler d'trêve ailleurs
Beaucoup d'gens sont schizophrènes, bipolaires
Quand tu perceras, tu compteras plus le nombre de pipes à l'heure
Ouais, j'suis qu'un homme, j'suis rempli d'contradictions
'Du-per' entre mes principes et mes addictions
J'ai dit qu'j'arrêtais, mais j'ai repris l'son
Merde, cette saloperie me donne des frissons
Cette saloperie m'a rendu ivre comme un alcoolique
Dans mon ivresse, j'ai sûrement perdu quelques acolytes
Toutes les nuits, l'oreiller s’aplatit sous l'poids d'la cogite
On a remplacé les 'keu-gré' par les restaurants gastro' chics
Tu m'feras pas dire qu'on peut rire de tout, j'suis pas stupide
Si tu peux l'faire, c'est qu't'as pas d'cœur ou pas peur du bide
Moi, y'a beaucoup d'choses qui m'font pas rire
Mais, calme-toi, ça veut pas dire qu'j'vais ouvrir le feu dans Paris
Même insulté par les caricatures, j'm'appelle Abdel Karim
Mais, dans une dictature intellectuelle, j'serais pris pour un taré
Quand j'donnerai mon avis, on m'dira : ""Tu sais où tu peux l'carrer
Là, tu dépasses complètement les bornes, oublie tous tes plans d'carrière""
You might also like[Refrain]
Seul comme si j'étais moche et méchant
Comme, comme si j'dérangeais des gens
En attendant d'être élevé au rang des légendes
J'fête mes victoires en silence sans faire péter l'champ'
En avance sur ma génération comme un présu'
Pour pas les brusquer, j'y allais mollo jusqu'à présent
Et pour leur laisser l'temps d'cicatriser d'leurs blessures
J'tournerai dans la capitale comme dans la cour d'une prison12Embed"
Karim Fall,Smile,"27 ContributorsSmile Lyrics[Paroles de ""Smile"" ft. SCH]

[Intro : Lefa]
Smile, smile, forever
Smile, smile, forever
Pardonne-moi, allez, pardonne-moi
Je n'suis qu'un homme, je n'suis qu'un homme
Pardonne-moi, allez, pardonne-moi
Je n'suis qu'un homme, yeah, je n'suis qu'un homme, yeah

[Pré-refrain : Lefa]
C'est quoi les news ? Est-c'que j'ai raté quelqu'chose ?
J'préfère quand tu m'parles en douceur, en douceur, tout paraît plus simple
Yeah, c'est quoi les news ? Est-c'que j'ai raté quelqu'chose ?
J'me sentais à l'abri d'tout ça, c'est qu'j't'écoutais pas sur l'coussin

[Refrain : Lefa]
Merde, smile (Smile), où est ton smile ? (Smile)
Ça fait longtime, ça fait longtime, yeah
Smile (Smile), où est ton smile ? (Smile)
Ça fait longtime, longtime

[Couplet 1 : Lefa]
Ça fait longtemps, dis-moi, que t'as plus d'sentiment, ouais
Me dis même pas qu'tu m'aimes, j'le ressens quand tu mens, ouais
On n'a plus les mêmes liens, ça, tu peux pas l'nier, nan
(Peux pas l'nier, nan, skuh, skuh)
J'te demande pas d'crier dans tout le bâtiment, nan
J'aimerais comprendre, ouais, donne-moi des arguments, yeah
Toi qui voulais qu'j'te donne mon amour entièrement
(Mon amour entièrement, skuh, skuh, skuh, skuh)
Eh ouais, c'est la loi du sablier (Yeah), t'as plus le même regard qu'hier (Nan)
Si mes sentiments s'habillaient (Yeah), ils porteraient les mêmes vêtements qu'hier (Yeah)
J'aurais dû figer l'temps quand tu m'regardais fièrement (Fièrement)
You might also like[Pré-refrain : Lefa]
Yeah, c'est quoi les news ? Est-c'que j'ai raté quelqu'chose ?
J'préfère quand tu m'parles en douceur, en douceur, tout paraît plus simple
Yeah, c'est quoi les news ? Est-c'que j'ai raté quelqu'chose ?
J'me sentais à l'abri d'tout ça, c'est qu'j't'écoutais pas sur l'coussin

[Refrain : Lefa]
Merde, smile (Smile), où est ton smile ? (Smile)
Ça fait longtime, ça fait longtime, yeah
Smile (Smile), où est ton smile ? (Smile)
Ça fait longtime, longtime

[Couplet 2 : SCH]
Où est ton sourire ? Baby, pense à ceux qui n'ont rien
Si on prenait l'temps d'comparer, j'pourrais garantir qu'on va bien
Avant que les gosses mûrissent, faudrait qu'on grandisse un jour
Avant que les arbres fleurissent, on va braver l'automne dans l'four
J'vais leur souhaiter la santé, ceux qui rêveraient d'me voir flancher (Yeah)
J'ai affronté droit d'puis enfant, on r'garde vers l'écran, on comprend
J'vais leur souhaiter la santé, ceux qui rêveraient d'me voir flancher
J'crois qu'ils ont raté quelque chose si tu crois qu'un lourd va m'changer
Mais dis-moi, c'est quoi les news ? Dis-moi, c'est quoi les news ?
Dis-moi c'qu'on s'rait devenus si on n'avait pas fait du flouze ?
H-24 indécis, beaucoup trop d'seum dans les veines
Quand tu m'regardes dans les yeux, tout paraît plus simple
[Pré-refrain : Lefa & ensemble]
Yeah, c'est quoi les news ? Est-c'que j'ai raté quelqu'chose ?
J'préfère quand tu m'parles en douceur, en douceur, tout paraît plus simple
Yeah, c'est quoi les news ? Est-c'que j'ai raté quelqu'chose ?
J'me sentais à l'abri d'tout ça, c'est qu'j't'écoutais pas sur l'coussin

[Refrain : Lefa & ensemble]
Merde, smile (Smile), où est ton smile ? (Smile)
Ça fait longtime, ça fait longtime, yeah
Smile (Smile), où est ton smile ? (Smile)
Ça fait longtime, longtime

[Outro : Lefa]
Smile, smile, forever2Embed"
