Artist,Title,Lyrics
Kévin Valleray,Friendzone,"15 ContributorsFriendzone Lyrics[Couplet 1 : Still Fresh]
Dans le cœur, y'a BKO
Mon cerveau, c'est le chaos
Dans ma paume, y'a des euros
As de pique et de carreau
J'ai pas l'time pour le cœur d'une fille
Elle réclame beaucoup plus qu'une nuit
Elle voudrait un nouveau sac Gucci
J'vais me l'offrir, pour y foutre tout ce fric
Oui

[Couplet 2 : Kalash]
Elle survit dans la Friendzone
Elle veut qu'on soit plus qu'amis
Elle aime l’esclave du bando
Je ne vois clair que la nuit
Elle voudrait d'un Drake, se prend pour Rihanna
Je vis entre pirate et piranha
Vu comment je fonctionne
Elle ne tiendra pas une nuit
Oui

[Pré-refrain : Still Fresh]
Elle veut croire que je lui donnerais ma life
Elle rêve le soir de devenir ma wife
Au bord de la mer dans une villa nice
Notre amour verra pas l'jour, je vis la night
You might also like[Refrain : Still Fresh et  Kalash]
Elle nous voit loin mais je l’arrête ici
Rien a commencé, tout est fini pour elle
Dans ma tête que le milli, milli, yeah
La mula m'a dit vini, vini
Vini, vini, vini (vini)
Vini, vini, vini (vini)
Tout est fini, fini, fini (fini)
Fini, fini, fini

[Couplet 3 : Kalash]
Ce monde est cruel, rempli de coups bas
Sombre ruelle, vie comme à Cuba
J'suis sur écoute, pour ça que je parle tout bas
Toi et moi dans une autre vie, ok
Mais ici c'est tuba, kidnapping
Devrait charger le fer, écraser mon Cohiba
Dans le silence de la ville
Ils entendraient ton cœur qui bat
C'est pas une vie, mamie
Mon visage sous un foulard, camouflé sous le kévlar
Non, ce n'est pas une vie
Recherché par policiers, loubards

[Pré-refrain : Still Fresh]
Elle veut croire que je lui donnerais ma life
Elle rêve le soir de devenir ma wife
Au bord de la mer dans une villa nice
Notre amour verra pas l'jour, je vis la night
[Refrain : Still Fresh et  Kalash]
Elle nous voit loin mais je l’arrête ici
Rien a commencé, tout est fini pour elle
Dans ma tête que le milli, milli, yeah
La mula m'a dit vini, vini
Vini, vini, vini (vini)
Vini, vini, vini (vini)
Tout est fini, fini, fini (fini)
Fini, fini, fini

[Couplet 4 : Still Fresh]
Ouais la go est dans la Friendzone
Moi je suis dans la Benzo
On est frais, fais du seill-o
Pour le crier sur les toits, on est trop hauts
Elle a vu l'train de vie, elle a liké
Entre LV, paires de Nike
Ennemi, j'bois à ta santé
T'es totalement tuba, t'es dead
On prend nos couilles, on s'prend pas la tête
Chez nous c'est violent même quand on fait la fête
Le Soleil est bre-som dans nos ruelles
Oui

[Refrain : Still Fresh et  Kalash]
Elle nous voit loin mais je l’arrête ici
Rien a commencé, tout est fini pour elle
Dans ma tête que le milli, milli, yeah
La mula m'a dit vini, vini
Vini, vini, vini (vini)
Vini, vini, vini (vini)
Tout est fini, fini, fini (fini)
Fini, fini, fini
[Refrain : Still Fresh et  Kalash]
Elle nous voit loin mais je l’arrête ici
Rien a commencé, tout est fini pour elle
Dans ma tête que le milli, milli, yeah
La mula m'a dit vini, vini
Vini, vini, vini (vini)
Vini, vini, vini (vini)
Tout est fini, fini, fini (fini)
Fini, fini, fini1Embed"
Kévin Valleray,Ghetto Life,"5 ContributorsGhetto Life Lyrics[Intro]
Talk me mine
Tout'ghetto youth lé rivé soti adan sal man
Ayen pa jamin rivé an moun ki rété adan kabann (sufferrer)
Kon Martin Luté mi have a dream
Man lé wé tout' sufferrer shine and leave
Ghetto life, Ghetto life

[Refrain]
Bad boy ni pou ay pli lwen, ay pli lwen
Ancèt nou fè twop chimen, pou nou rété fémen
Fo pa nou moli an maille
Bétché'a ja pran twop anlé nou
Ki tan nou kéy lévé ko nou

[Couplet 1]
Telman maléré ka viv maldon
Plein belle pensée mé vié action
Nèg kont nèg ki ka fuck nomn
Yo pa sav ke i ni en bondié adan chak nomn
Yo ja fé en travay sé babylonn
Rété pri adan sé sa ka fonctionn
Lé en nèg tué en nèg anlot nèg lajol
Yann de moins ka arranjé policeman
Man lass di RIP, man lass kryé free
Ni twop destiné ka pati dans l'oubli
Es ou ja rimatjé ke a chak crim
Minist' la ka trappé an prim' (cash money)
Viv an assistanat sé sa yo lé ba nou
An nèg ka attann lajan yo sé an nèg a jounou
Sacrifice la cho mé si ou pran'y rèd
Victwa la kèy dé fwa pli bel
Ghetto youth
You might also like[Refrain]
Bad boy ni pou ay pli lwen, ay pli lwen
Ancèt nou fè twop chimen, pou nou rété fémen
Fo pa nou moli an maille
Bétché'a za pran twop anlé nou
Ki tan nou kéy lévé ko nou

[Couplet 2]
Lè en nég lé ouvé en comès
Fok i goumin twa fwa pliss ki an lot
E deyè do'y yo pa ka bay pon èd
Yo ka mandé gratuité konsi i pa sérious
Mentalité nou ni an réel pwoblem
Histwa nou telman récen nou pa ka realize
Ke chak nèg ki ka poté manèv
Komfronté a propre frè'y pou y ouvé zyé ay
Ghetto youth

[Refrain]
Bad boy ni pou ay pli lwen, ay pli lwen
Ancèt nou fè twop chimen, pou nou rété fémen
Fo pa nou moli an maille
Bétché'a za pran twop anlé nou
Ki tan nou kéy lévé ko nouEmbed"
Kévin Valleray,G.O.A.T,"7 ContributorsG.O.A.T Lyrics[Intro]
Yo té ka révé mwen man pa domi
Yo di yo aidé mwen sé kalomni
An di vérité, yo di salopri
Sa mwen mérité bah sé sa mwen ni
An tcho disque d'or et an tcho money
Yo té ka révé mwen man pa domi

[Refrain]
Big boss nou pa ka palé an lo
Dictature comme à l'époque de Death Row (Yessaï)
Beaucoup de moutons, un seul GOAT (Bê-ehr-ehr-ehr)
Say no more

[Couplet 1]
J'suis toujours le même qu'avant
Juste avec plus de bijoux
Et depuis un bon moment, j'vois tous les vautours qui tournent
Big K numéro uno, comment fait-il sans les radios ?
Big K numéro uno (Bê-ehr-ehr-ehr)
Qui sont les vrais et qui sont les faux ?
Qui tend la main et qui est manchot ?
Fuck la vieille vie dans le bando
Le cœur en miettes comme Huncho
Heureux celui qui connait ses défauts (Hin, hin)
Heureux celui qui connait ses défauts
Pour ça qu'j'suis le GOAT
You might also like[Refrain]
Big boss nou pa ka palé an lo
Dictature comme à l'époque de Death Row (Yessaï)
Beaucoup de moutons, un seul GOAT (Bê-ehr-ehr-ehr)
Say no more

[Couplet 2]
Cœur rempli de cicatrices
Comme le dos de Cyparis
J'ai dû maquiller mon mal-à-vivre
Euthanasié au cannabis
Ethan mon fils, remplis ta valise
J'finirai pas ma vie à Paris
Toi et tes soeurs, j'vous veux à l'abri
Tant de tralalas et tant de tralalis
Entre les procès et maladies
Ya que le fond du cœur qui compte dans la mise
Car on achète pas le paradis
Ya que le fond du cœur qui compte dans la mise
Car on achète pas le paradis
C'est la vérité pas ""on m'a dit""
C'est moi le GOAT, c'est moi le ... (Bê-ehr-ehr)

[Refrain]
Big boss nou pa ka palé an lo
Dictature comme à l'époque de Death Row (Yessaï)
Beaucoup de moutons, un seul GOAT (Bê-ehr-ehr-ehr)
Say no more (Say no more, say no more)
[Outro]
Say no more (Say no more, say no more)
Say no more (Say no more, say no more), (Bê-ehr-ehr-ehr)Embed"
Kévin Valleray,God Knows,"11 ContributorsGod Knows Lyrics[Intro : Kalash & Mavado]
Mwaka boss, Gully god, Gully god
Ouh, Stephen, ouh
Not evil, yeah
Ayen pa ka fèt pou ayen (God knows, hey)
Y ka véyé fô ba kô aw mwayen (God knows)
Hey

[Couplet 1 : Kalash & Mavado]
Mandé papa la foss' pou rivé (haha)
Ennemi ka fè tout' pou dérivé (and dat u say)
I ni an pa tchè nonm' ki palé nou fonctionn'
I ni mwens' lov' i ni pliss gang
Chimin'an nou pran pani rigrè
Dlo paka monté monn'

[Refrain : Kalash]
Léssé dyab la paradé (yeah)
Yo pa ka rentré an paradis
Ouuuh, la vi nou sakadé
Sirène ka chanté mé fô pa ou gadé, yeah
Chak swa ni dé million ka pran nonm, yeah
Bondyé ka ba mwen lanmin

[Couplet 2 : Mavado]
You cyan neva stop fight from you born inna struggle (born inna struggle)
Neva born with a gold spoon but mi hustle hard with the shovel (hustle hard)
What the fuck you cyan tell me bout my life, it ain't easy (watch out)
From nothing to something we no need you for believe me (real talk)
First thing me need God me no need nobody, listen this
Work hard, sacrifice cause mi kids dem need dem daddy
People too evil
You might also like[Refrain : Kalash]
Léssé dyab la paradé (yeah)
Yo pa ka rentré an paradis
Ouuuh, la vi nou sakadé
Sirène ka chanté mé fô pa ou gadé, yeah
Chak swa ni dé million ka pran nonm, yeah
Bondyé ka ba mwen lanmin
Gangsta for life

[Couplet 3 : Kalash & Mavado]
An pa ka travay ba evil, bondyé kon idole
Pli puissant ki Steven Seagal
David mi name so me spiritual
Me and di devil couldn't equal
Mwen rété fidèle é fô douvan lanmô, yeah
An ka priyé maladman
Watch now
Jah a mi king, thunder and lightning
Yo paka bat' dèyè, pa djokô
Fô rété fo my people
Jah know a so it go
Jah know a so it go
Gully god

[Refrain : Kalash & Mavado]
Léssé dyab la paradé (yeah)
Yo pa ka rentré an paradis (yeah)
Ouuuh, la vi nou sakadé (sakadé)
Sirène ka chanté mé fô pa ou gadé (pa gadééé)
Chak swa ni dé million ka pran nonm (pa gadééé)
Bondyé ka ba mwen lanmin
Léssé dyab la paradé (yeah)
Yo pa ka rantré an paradis
Ouuuh, la vi nou sakadé (yeah)
Sirène ka chanté mé fô pa ou gadé, yeah
Chak swa ni dé million ka pran nonm, yeah
Madinina, Gwada
Bondyé ka ba mwen lanmin
Gansta for life
[Outro : Kalash]
Thank you God
You are my everything, (Gully God)
Ouuuh (yeah)
Même adan on soufrans', man paka ladjé lanminw papa, never
La vi tala intense, é gadé la fwa tchébé an tout' sens
Sick, yeah man1Embed"
Kévin Valleray,Grimey,"7 ContributorsGrimey Lyrics[Intro: Kalash & Skillibeng]
Grimey, grimey
Skilli-Skillibeng
Evi (Evi)
Eastsyde, suh sih?

[Refrain: Kalash]
C'est fou
Comme la vie aime nous jouer des tours
On dirait que le karma est saoul
J'ai des shottas qui détestent les discours
Et tous les jours j'esquive la police
Dans la vie j'suis pas novice
Dans la rue j'suis pas ton fils
C'est trop facile, comme avocat commis d'office
Y'a que des gros bonnets
Y'a que des gros bonnets, aux alentours

[Couplet 1: Kalash & Skillibeng]
On dit que j'ai fait sacrifices (Yeah)
Mais c'est eux qui ont tué le père еt le fils
Que Dieu lеs punisse, eux et tous leurs maléfices
C'est maléfique, mais mon âme est magnifique
La solitude est mon grand hobby
J'garde le sourire comme Kobe
Enterrement plein de tho-my
J'ai parlé à mon glock, il m'dit qu'il veut shoot
Trop d'ennemis, j'ai tourné pendant des années
Eclairé des endroits damnés
Des bouquets ont déjà fanés
Ancré à ma rue comme Fanny
J'suis malheureux toujours armé
Succès est une salope qui m'amène au four
Serais-je condamné ?
Oh
Le sang de la veine a connu ma douleur du pallier
Les gens s'adaptent à la couleur du papier
Plus j'en perds et plus je me dis qu'ça va aller
You might also like[Refrain: Kalash]
Et tous les jours j'esquive la police
Dans la vie j'suis pas novice
Dans la rue j'suis pas ton fils
T'es trop facile, comme avocat commis d'office
Y'a que des gros bonnets
Y'a que des gros bonnets, aux alentours

[Couplet 2: Skillibeng]
Them wouldn't mind police lock me up
[?] come from bullet
Thanks fi the prayer them mummy
None of them pussy them nuh know [?]
Can't take me sound and bully me
'Cause me no cold like Philly (Yeah)
Low proximity
Unuh badness lilly
The boy them a badmind me
Act like me
A try fi chat like me
That's why me a style the chop
While me nah try fi a rise the Glock and key
You no bad than me
Boy where your loyalty?
Them borrow my style
'Member a my style you thief fi turn a artist
But me new style bad and neat
'Member the flow factory don't use no gasoline
Karma is just one bitch
Though you no fuck her yet you think you brawling and she oversleep
Try convince your thought yah small powers big fi go in front a me
[?] the 'mount a thing keep weekly just fi take over this
[Refrain: Kalash]
C'est fou
Comme la vie aime nous jouer des tours
On dirait que le karma est saoul
J'ai des shottas qui détestent les discours
Et tous les jours j'esquive la police
Dans la vie j'suis pas novice
Dans la rue j'suis pas ton fils
C'est trop facile, comme avocat commis d'office
Y'a que des gros bonnets
Y'a que des gros bonnets, aux alentours

[Outro: Skillibeng & Kalash]
Can't stop the greatest, so make dem gwan talk
Talking villein, run dancehall
In a me lane yah like Usain them, you hate me?
Me return the hatred
Skillibeng, Mwaka Boss, Eastsyde
Irie CrewEmbed"
Kévin Valleray,Guapa,"2 ContributorsGuapa Lyrics[Intro]
Hey russian
Ba ta la man ni an program
Minnin'y pli loin ki taiwan
Ah aaahh

Wine up me baby mété mwen higth
Dévasté mwen kon larmé
Tsunamiiiiii
Women me love song

[Refrain]
Aaaaaaaaaah everything nice
Sonata et columbiaaaaaaa
Bad gyal ke fè mwen plané
Kon amnésiaaaaaaaa
One in a million one in a million
Guapa
An nou fly seniorita

[Couplet 1]
Sé tan ta la ou ni mové mine
Léssé mwen swanyéw mizik codeïne
Mwen sé on artis mwen ké baw on
Volé rime
Minninw médéline girl
Mwaka animal kon on féline
Es ou ja ay si la line
Vini ped tout stress
An allé pauline tout copine
Ou ja diw fok ou follow in
Girl follow me mem adan bando
Sa douce sa clean
You might also like[Refrain]
Aaaaaaah everything nice
Sonata et columbiaaaaaaa
Bad gyal ka fè mwen plané kon
Amnésiaaaaaaa
One in a million one in a million
Guapa
An nou fly seniorita

[Couplet 2]
Love you body, girl love you body girl
A pein lévé lé bon matin
Ou beautiful
An ka metew si pié d'estalle
Desann kartier gana san escale
Ou di mwen women tala sé an danjé
La viw pa té facil sa ké chanjé
Man pa ka van rev baw an sériéé
Démin ou pas bisoin méfié

[Refrain]
Aaaaaaah everything nice
Sonata et columbiaaaaaaa
Bad gyal ka fè mwen plané kon
Amnésiaaaaaaa
One in a million one in a million
Guapa
An nou fly seniorita
[Couplet 3]
Tala soti kay russian
Wine up me baby mété mwen higth
Dévasté mwen kon larmé
Tsunamiiiiiii
Woman me love song

[Refrain]
Aaaaaaah everything nice
Sonata et columbiaaaaaaa
Bad gyal ka fè mwen plané kon
Amnésiaaaaaaa
One in a million one in a million
Guapa
An nou fly seniorita

[Outro]
Kaaaaaalaaashnikov!!Embed"
Kévin Valleray,Gun Man,"3 ContributorsGun Man Lyrics[Intro]
Now wid de badman!
We no run anway
[?]
[?] man a badma!
Woah-woah! Let me see dat-Let me see dat!
[?]

[Pré-refrain]
Lè gunman décidé pété kon kann
An nonm sé an nonm
Yo ka kouri, caché kon ravèt ki pran baygon
Pran lavol
Pa fè wol
Lè bal pété kon kann

[Refrain]
Badman et police ka joué à cache-cache
Pa fè mwen komprann an patat'
Lè bal ka pété police ka fè moonwalk
La pa rété Superman
Fizi ka tombé kon lapli Bagdad, (oh ah woy)
Manman ka vinn' pou rikonèt kadav'

[Couplet 1]
38 pété
Yo pa ka raté
An lodè lapoud' adan l'atmosphère
Tou sa ki rété
Ka pran bal pèdi
Paradi la ka tounin an enfer
Lè gun ka pété papa ka kouri bo chimin an
L'instin'y paternel ka fèy senti ki moun yo pran
Oh no, no, no, no, no
Another one people died
An lot la ba ka cry
You might also like[Refrain]
Badman et police ka joué à cache-cache
Pa fè mwen komprann an patat'
Lè bal ka pété police ka fè moonwalk (Hihi)
La pa rété Superman
Fizi ka tombé kon lapli Bagdad
Manman ka vinn' pou rikonèt kadav', woooy

[Couplet 2]
Manman fè tou sa'y té pé
Lang' fanmi ka prié long time i pé
Tou sèl ka goumin adan société
Ou sav an ka pasé ba an mové
I ni trop' salopeté
Ki pé rivé
Lè an débat sé jéness la ka dévié
Toujou ni pli bad kiw, pa jin oublié
Lè bal ka mété moun atè, la pa ni superman

[Pré-refrain]
Lè gunman décidé pété kon kann
An nonm sé an nonm
Yo ka kouri, caché kon ravèt ki pran baygon
Pran lavol
Pa fè wol
Lè bal pété kon kann
[Refrain]
Badman et police ka joué à cache-cache
Pa fè mwen komprann an patat'
Lè bal ka pété police ka fè moonwalk
La pa rété Superman
Fizi ka tombé kon lapli Bagdad (oh ha woy)
Manman ka vinn' pou rikonèt kadav' (real gunna boss)

[Outro]
38 pété
Yeah
Général K
Yeah DJ
Wa gwan
Yeah
Pa fè mwen komprann an patat'
I'm outEmbed"
Kévin Valleray,Gwan Gou,"7 ContributorsGwan Gou Lyrics[Paroles de ""Gwan Gou"" ft. Jkevlar]

[Intro : Kalash]
Yeah yeah yeah yeah yeah
Gang gang gang gang gang
Dj Wiwi’x going hard for the gang, man

[Refrain : Kalash]
Mwen ni an dout' adan pwochen mwen
Lajan la rantré, yo lé fè an twou adan poch an mwen (Adan poch an mwen)
Ni yen ki lou alantou an mwen, alantou an mwen
Yo pann an kou é anba boul an mwen, ban kagoul an mwen
Yo ni gwan gou, yo lé bwè san an mwen, san an mwen
Mè tou pa tou man ni Glock an mwen, adan fwok an mwen
Man ja pwan kou adan vi an mwen, bondié kon témwen
Soufwans la lou si zépol an mwen, anba kouwonn an mwen (Yeah)
Man ka fly yo bizwen zèl an mwen, yo fou (gang gang gang gangshit)
Mété kontra asi mwen, yo fou (ouh ouh)

[Couplet 1 : Kalash]
Man ka ba yo cho kon Section Krim (dur), kon sex san clim
Asi yon dé an ja mèt an prim', éliminer la vermine
Yo lé wè mwen an mové min', pété chevrotine
An tjo adrénaline, pété an ba la lin'
Mwen lévé adan an mové mood
Mwen ka véyé tout' moun
Fo sav lè nou an wout', yo ka kryé oscou
Arme d'assaut automatik, tala soti Moscou
Fè lanm koulé si jou
You might also like[Refrain : Kalash]
Mwen ni an dout' adan pwochen mwen
Lajan la rantré, yo lé fè an twou adan poch an mwen (Adan poch an mwen)
Ni yen ki lou alantou an mwen, alantou an mwen
Yo pann an kou é anba boul an mwen, ban kagoul an mwen
Yo ni gwan gou, yo lé bwè san an mwen, san an mwen
Mè tou pa tou man ni Glock an mwen, adan fwok an mwen
Man ja pwan kou adan vi an mwen, bondié kon témwen
Soufwans la lou si zépol an mwen, anba kouwonn an mwen (Yeah)
Man ka fly yo bizwen zèl an mwen, yo fou (gang gang shit)
Mété kontra asi mwen, yo fou (ouh ouh ouh ouh ouuuh)

[Couplet 2 : Jkevlar]
Si ou wè man pa asiz Champigny, sé paskè man anba block la
Sa fasil sousé lè ou pa ni, yo prèmyé douvan lapot la
Jodi'a nou ka bwè, nou ka ri, démen sa pé finn an post' la
Lajol ka aprann tryé zanmi, sèl fanmi ki ké baw fos la
É la vi mwen sé an vré bowdel, gadé pou fè ko mwen tou sel
OPJ a lé détrui mwen, an bal an tèt pa ni témwen
Ki moun ki ké foutéw lanmen, simen gadé pou pé sa viv byen
Fosé ko mwen ka fè lé choz byen, ni konbyen fo ki ja trahi mwen
Konbyen fwa yo ja fè mwen pèd gain
Man simen maché épi Glock mwen
Nou fiè di di kè nou lévé pov, kè tou lé jou sé an konba
Koupé zèb bo la ri : manque de respect, man simen prany si block la
Sé a wou di wè si ou lé pri, man ké disparèt à chak fwa
Car polis ké vini si terrain, an guetteur ka anonsé la lwa
Man pozé épi an démuni, ka sonjé mizèr' a pèp la
I di mwen yo ké pri, yo pèd an crédit, an fen kont nou parèy
An fen kont nou parèy, an fen kont nou parèy
[Refrain : Kalash]
Mwen ni an dout' adan pwochen mwen
Lajan la rantré, yo lé fè an twou adan poch an mwen (Adan poch an mwen)
Ni yen ki lou alantou an mwen, alantou an mwen
Yo pann an kou é anba boul an mwen, ban kagoul an mwen
Yo ni gwan gou, yo lé bwè san an mwen, san an mwen
Mè tou pa tou man ni Glock an mwen, adan fwok an mwen
Man ja pwan kou adan vi an mwen, bondié kon témwen
Soufwans la lou si zépol an mwen, anba kouwonn an mwen (Yeah)
Man ka fly yo bizwen zèl an mwen, yo fou (gang gang gangshit)
Mété kontra asi mwen, yo fou (ouh ouh ouh ouh ouuuh)

[Outro : Kalash]
Oh oh (ay)
Oh oh
Oh oh
Oh
Gang gang gang gang gangEmbed"
Kévin Valleray,Gwo Model,"5 ContributorsGwo Model Lyrics[Intro]
Ouh la la Shaz
(Touche à la prod, elle va te tuer)
Mété kow byen, shaz, mété kow byen
Mété kow byen, mété kow byen, mété kow byen
Shaz, mété kow byen

[Couplet 1]
Drog épi fizil yeah, bay la ja easy atann
Adan an boit à gant an zouti sans permis
Sa pwop sa nèf sa k vinn demonté lé i sevi

[Refrain]
Ou cho daprew few kouri
Kon Usain Bolt dépassé Usain Bolt
Kon Usain Bolt dépassé Usain Bolt
Few kouri
Ou la ka bat djol ou kon lambis
Es ou ja tjimbé fanm ki solid
Dé gwo model yenki dé gwo model
Dé gwo model yenki dé gwo model

[Couplet 2]
Sa djab sa djab kon di ma-Ki
Koké fanm ou ba mwen sé an hobby
Si ou ka vinn, vinn bien ti chien
Sa toujou anlé mwen meme épi ich mwen
Ou sav sa bien
Man ni dé pot' colombien ou bien lucian
En ni di mwen tin
La mem ou key tenn action
You might also like[Refrain]
Ou cho daprew few kouri
Kon Usain Bolt dépassé Usain Bolt
Kon Usain Bolt dépassé Usain Bolt
Few kouri
Ou la ka bat djol ou kon lambis
Es ou ja tjimbé fanm ki solid
Dé gwo model yenki dé gwo model
Dé gwo model yenki dé gwo modelEmbed"
Kévin Valleray,Gyal you affi move,"1 ContributorGyal you affi move Lyrics[Intro]
Hey gyal
Mi gyal
Mi gya-a-a-a-l
Kalashnikov!!
Let me tell U dis

[Pont]
...

[Refrain]
Gyal you affi move when stop, stop
[?]

[Couplet 1]
...

[Refrain]
Gyal you affi move when stop, stop
[?]

[Couplet 2]
...

[Refrain]
Gyal you affi move when stop, stop
[?]
You might also like[Pont]×2
...

[Refrain]
Gyal you affi move when stop, stop
[?]

[Outro]
[?]
Kalashnikov!!
[?]Embed"
Kévin Valleray,Gyal Yuh Body Hot,"1 ContributorGyal Yuh Body Hot Lyrics[Intro]
Romeich Entertainment
Gyal yuh body hot, gyal yuh body hot, hein
Hein, gyal yuh body hot, gyal yuh body hot
Yeah
Gyal yuh body hot, lemme see yo pum-pum

[Pont 1]
Gyal yuh body hot, lemme see yo pum pum-pum-pum-pum
Hey Romeich, hey

[Couplet 1]
Hey, gyal yuh body hot, lemme see yo pum pum
Fè sa pété sek, fè sa pété boom boom
Mwen ja démaré moto mwen fè sa kriyé vroom vroom
Sé boug bima la la kriyé tou-toum toum
Yo' pum pum so fat, you know dat
Mi nuh need no zoom zoom
Sa pa ni pon corona, non, sa pa ni pon *tousse* *tousse*
Jamaica people call dat a pum pum but a Madinina we say ""coucoune""

[Refrain]
It sound like a doom doom doom doom doom doom doom
Fè sa fè dézod, menfou a moun
Fè tèt sé boug a monté wo jis Mwaka Moon
Bad gyal pa ka distribyé backshot ba clown
It sound like a doom doom doom doom doom doom doom
You might also like[Couplet 2]
Yo' body sweet, mwen bizwen rentré inna
An sav an sé on dog, pa bizwen vétérina
Kok la ja kosto, pa bizwen pwoteina
Ou vé sav ki gwoséy, gadé bwa Popeye la
Attendez, please, un peu de Don Pérignon
S'il vous plaît, pas de merde de codéïna
Un peu de kush ou de Kalash OG des Pays-Bas
Nou an tchè péyi a, an nou fuck ici a

[Refrain]
Like a doom doom doom doom doom doom doom
Fè sa fè dézod, menfou a moun
Fè tèt sé boug a monté wo jis Mwaka Moon
Bad gyal pa ka distribyé backshot ba clown
It sound like a doom doom doom doom doom doom doom
Fè sa fè dézod, menfou a moun
Fè tèt sé boug a monté wo jis Mwaka Moon
Bad gyal pa ka distribyé backshot ba clown

[Pont 2]
Gyal yuh body hot, lemme see yo pum-pum
Hey Romeich
Gyal yuh body hot, lemme see yo pum-pum
Yaddie rich
[Couplet 3]
Gyal yuh body hot, lemme see yo pum pum
Fè sa pété sek, fè sa pété boom boom
Mwen ja démaré moto mwen fè sa kriyé vroom vroom
Sé boug bima la la kriyé tou-toum toum
Yo' pum pum so fat, you know dat
Mi nuh need no zoom zoom
Sa pa ni pon corona, non, sa pa ni pon *tousse* *tousse*
Jamaica people call dat a pum pum but a Madinina we say ""coucoune""

[Refrain]
It sound like a doom doom doom doom doom doom doom
Fè sa fè dézod, menfou a moun
Fè tèt sé boug a monté wo jis Mwaka Moon
Bad gyal pa ka distribyé backshot ba clown
It sound like a doom doom doom doom doom doom doom

[Couplet 4]
Yo' body sweet, mwen bizwen rentré inna
An sav an sé on dog, pa bizwen vétérina
Kok la ja kosto, pa bizwen pwoteina
Ou vé sav ki gwoséy, gadé bwa Popeye la
Attendez, please, un peu de Don Pérignon
S'il vous plaît, pas de merde de codéïna
Un peu de kush ou de Kalash OG des Pays-Bas
Nou an tchè péyi a, an nou fuck ici a
[Refrain]
Like a doom doom doom doom doom doom doom
Fè sa fè dézod, menfou a moun
Fè tèt sé boug a monté wo jis Mwaka Moon
Bad gyal pa ka distribyé backshot ba clown
It sound like a doom doom doom doom doom doom doom
Fè sa fè dézod, menfou a moun
Fè tèt sé boug a monté wo jis Mwaka Moon
Bad gyal pa ka distribyé backshot ba clown

[Pont 2]
Gyal yuh body hot, lemme see yo pum-pum
Hey Romeich
Gyal yuh body hot, lemme see yo pum-pum
Yaddie rich

[Outro]
Gyal yuh body hot, lemme see yo pum-pum
I'm outEmbed"
Kévin Valleray,Habibi,"9 ContributorsHabibi Lyrics[Paroles de ""Habibi""]

[Intro]
Oh ah
Ah ah, ah ah, ah ah
Oh, oh ah
Ah ah ah
DJ Wiwi'x going hard for the gang man

[Couplet 1]
Toute ma vie est un combat
Je vis la nuit mais la journée, je rêve de toi
J'me demande si on n'serait pas mieux là-bas
Loin des on dit, j'suis bien trop haut pour les coups bas

[Refrain]
Habibi, le ciel est gris, prenons le large
Habibi, tout est écrit, tournons la page
Habibi, quittons vite ici avant l'orage
Mon alibi, mon alibi

[Couplet 2]
Plus besoin d'se lever tôt
Adieu, la valeur des métaux
Lion idomptable à la Eto'o
Même dans ghetto à Soweto
J'te donnerai amour yo te amo
Donner d'Ia viе, ça, c'est bientôt
Oublie lеs gens, c'est des flokos
J'te donne mon coeur et du coco
You might also like[Pont]
J'ai essuyé tes larmes
Ah-ah-ah, la vie est dure mais tellement plus douce avec toi
Ah-ah-ah, ah-ah-ah, ah

[Refrain]
Habibi, le ciel est gris, prenons le large
Habibi, tout est écrit, tournons la page
Habibi, quittons vite ici avant l'orage
Mon alibi, mon alibi
Mon alibi, mon alibi

[Outro]
Habibi, habibi
Habibi, habibi
Habibi, habibi, habibi
Habibi, oh yeah, ahEmbed"
