Artist,Title,Lyrics
Kévin Valleray,Pirate,"5 ContributorsPirate Lyrics[Couplet 1]
Tu m'as dit que tu me tuerais, si je tombais sur tes draps
A part Dieu, je ne crois que ce que je vois
Ce n'est qu'une fois dévêtus qu'on saura qui fait la loi
Darling, mi coming, yeah
J'ai imaginé la scène plus d'une fois
Viens partager le trône, sois la reine du roi
Jeu de reins, jeu de vilains
Oui j'te baiserai jusqu'à demain
Baby

[Refrain]
Oh baby, baby, baby, baby, baby
Je t'emmène
Oh baby, baby, baby, baby, baby
Je t'emmène
Ça m'obsède baby, mille et une nuits ne passent
Sans que je rêve de ce sensuel face à face
Oh oui, oh oui, oh oui, oh oui, oh baby
Je t'emmène

[Couplet 2]
Oh baby, sois ma chienne et sois ma go
Ce soir rend moi hommage
J'aime ça, j'en parle beaucoup
Trop easy, la plume est sauvage
Donnes moi tout ce que t'as, c'est entre nous
T'es stressée, viens j'te soulage
Annulons tous nos rendez-vous
Se rater serait dommage
Pas de problème [XXX]
Faisons l'amour ou fuckons la haine
Si ça en vaut la peine
Baby
Comme la cocaïne, tu me montes à la tête
Allons nous en, partons du village, la nuit nous appelle
[Refrain]
Oh baby, baby, baby, baby, baby
Je t'emmène
Oh baby, baby, baby, baby, baby
Je t'emmène
Ça m'obsède baby, mille et une nuits ne passent
Sans que je rêve de ce sensuel face à face
Oh oui, oh oui, oh oui, oh oui, oh baby
Je t'emmèneYou might also like1Embed"
Kévin Valleray,Plastik,"4 ContributorsPlastik Lyrics[Intro]
Talk dem a talk, real djol
Yo ka bat pon dem, deh a dem a talk pon dem
Talk dem a talk, yo ka débat' a chak pwoblem
Oh let me bust an anthem
Gal, gal...

[Refrain]
Fanm tala full plastik
I chanjé, sa magik
Kay pété si ou ba'y pik
Ka fè dézod Matinik
Tout moun bizin palé bay
Pou sav si sa ka alé
Poukwa zot bizin détay
Chak moun ka fè sa i lé
Relax

[Couplet 1]
Enemy simen, hmm, vinn an finéray
Lè on fanm pa byen i pé fè vyè bagay
An mélanjé adan sa ki ni an didan'y
Oh mi gal, oh mi gal
On bon fanm pé décidé custom
Chanjé sa i pa enmé pou y senti'y pli en fowm
Okipé dè zafè'w ti bolonm, ay bat dous si on dot moun
You might also like[Refrain]
Fanm tala full plastik
I chanjé, sa magik
Kay pété si ou ba'y pik
Ka fè dézod Matinik
Tout moun bizin palé bay
Pou sav si sa ka alé
Poukwa zot bizin détay
Chak moun ka fè sa i lé
Relax

[Couplet 2]
I mété fo fess, i mèt fo tété
I ralonjé tress, i modifié né'y
Ou ka disrespect, ou ka déliré
Komprann ou en mèt mè [?]
Ou hypokrit épi zanmi ou, distan épi fanmi ou
Ou ka snifé plin farine, pale vampire
Kité fanm la viv ti pédal
San ou pa sav, kay pasé'w timal

[Refrain]
Fanm tala full plastik
I chanjé, sa magik
Kay pété si ou ba'y pik
Ka fè dézod Matinik
Tout moun bizin palé bay
Pou sav si sa ka alé
Poukwa zot bizin détay
Chak moun ka fè sa i lé
Relax
[Couplet 3]
Nou ka palé dè fanm, makrélé yo kon espyônn
Mè ni on dot bagay é mwen la ka kestionn
Nonm ka fè kon pitin an lè an tèl-phone
Pèd virilité yo pou trapé plis comm'
Posté foto makoumè épi dé statu makoumè
Palé mal si an dot fwè pou trapé an volpone
Pwoblem nou sé kè nou ni twop pwoblem
Adan boul moun fô depenn
Gaspiyé saliv, ouvè vyé liv
Jalouzé Jean-Yves paskè i ni plis pwestij
Nonm la ka fè kon kanibal, yeah
Okipé'w dè zafè'w timal

[Refrain]
Fanm tala full plastik
I chanjé, sa magik
Kay pété si ou ba'y pik
Ka fè dézod Matinik
Tout moun bizin palé bay
Pou sav si sa ka alé
Poukwa zot bizin détay
Chak moun ka fè sa i lé

[Outro]
Fanm tala full plastik
I chanjé, sa magik
Full plastik, full... Yeah
Haha...
Gal..
Gal.. Gal... General
GuillermoEmbed"
Kévin Valleray,Plézi,"7 ContributorsPlézi Lyrics[Intro]
Hé gyal, tonight fo ou fè'an plézi
Hmm, Général Crew
Hmm, Général Crew
Yes boy
Hmmm Hmmm

[Couplet 1]
Lésé mwen chuchoté'w
Hello honey, ou sav o swè la nou pa kay domi
An ka observé wine
Dans les moindres détails
Adan zyé'w an ka wè foli
An feeling sovaj kon Amazoni
Palpitasyon taï
Baby wayy
Yes boy

[Refrain 1]
Fè'm plézi, fè'm plézi
Baby es ou vlé fè mwen plézi, fè mwen plézi
She says Yes boy, yes boy, plézi mwen sé dé fè'w plézi
She says Yes boy, yes boy, plézi mwen sé dé fè'w plézi

[Couplet 2]
Thank you baby, c'est très gentil
An pa ka fè sinkop si la dézièm partie
Ou ka mèt mwen high
Pli douss ki marijane
Yo sé di ou ka pran plézi gadé mwen pran plézi
Chak koud bass
Ko aw ka fè poézi
Mets-toi à l'aise, vas-y
Fo pa'w di mwen « Ca y est, c'est fini », Non
You might also like[Refrain 1]
Fè'm plézi, fè'm plézi
Baby es ou vlé fè mwen plézi, fè mwen plézi
She says Yes boy, yes boy, plézi mwen sé dé fè'w plézi
She says Yes boy, yes boy, plézi mwen sé dé fè'w plézi

[Couplet 3]
Lady
Chalè ka monté si mwen woman
Lè an ka gadé'w ka rimé
Ou ka pran pié aw, ka fè mwen mal gyal
E an sav an pé pa touché
Tèt mwen ja cho, ginger wine and scotch
Alé pari finn baby whine and kotch
Anni mété kow la sé a mwen de fèw plézi
Sensiwol poézi, I di mwen...

[Refrain 2]
Fè'm plézi, fè'm plézi
I di mwen... Fè'm plézi, fè'm plézi
Yes gyal, yes gyal, o'swè la an ka fè'w gémit (Yes boy)
Yes gyal, yes gyal..

[Outro]
Han han han han, yeah
Han han han han, yeah
Mèt vou ay
Eclat rose kon di Willaye
Yeah
KALASH'NIKOV
Lady
Ah, ah
Yeah !
Général crew
Yeah1Embed"
Kévin Valleray,Plus de love,"10 ContributorsPlus de love Lyrics[Intro : Kalash]
Plus de love (bley)
Plus de love (ayin pas chanjé)
Plus de love (vrai Sparta tibéy)
Plus de love

[Refrain : Kalash]
Je n'ai plus de love
Ils ont tout dépouillé (god know)
Que mes enfants, ma bataille (Ieva, Ethan)
Ils t'aiment mais voudraient te voir couler (huh)
Scruter au moindre détail (watch, watch, watch)
Et j'ai l'amour pour ma wife
Elle sait ce que j'ai commis
Papa ne croît plus en Jésus, mais je sais qu'il pray for me
Ma liberté dans les mains d'une personne qui m'a pas connu (rrrr)
A côté de mon oreiller une bible et un calibre

[Couplet 1 : Kalash]
A bout de souffle deux mains de keuf
Je tourne de l'œil
Devenue riche maman m'avait dit que c'était risqué
Je n'ai rien fait de si grave mais ces bitchs ont voulu me faire (bitch)
Deux fils de pute de flic m'ont fait généraliser
Je n'ai plus de love
J'ai appris que j'étais plus le bienvenu à mes dépens
Rester ici me fera devenir un démon
Ils ont frotté leurs mains en pensant que j'allais m'étendre
You might also like[Refrain : Kalash]
No, je n'ai plus de love
Ils ont tout dépouillé (god know)
Que mes enfants, ma bataille
Ils t'aiment mais voudraient te voir couler
Scruter au moindre détail (watch, watch, watch)
Et j'ai l'amour pour ma wife
Elle sait ce que j'ai commis
Papa ne croit plus en Jésus, mais je sais qu'il pray for me
Ma liberté dans les mains d'une personne qui ne m'a pas connu
À côté de mon oreiller une bible et un calibre

[Couplet 2 : Tiitof]
Je sais qu'il aimerait bien que maman verse une larme
Et la moitié des cancans de l'île finissent en drame
(bley, bley, bley)
J'ai les flics au cul ils veulent savoir combien je gagne
J'ai des bons frangins qu'ont fini en trafiquant d'armes (en vrai)
No love mon petit coeur est cassé
J'ai pas encore le million t'façon
J'ai pas encore fini de brasser
Yo pa sa fey donk yo fâché
On connait la rue de A à Z (on connait la rue de A à Z)
Toujours au même endroit, je suis assis
On te fait travailler si t'es malin (sparta)
On sait qu'on vient d'en bas au fond du bât'
Y'a tout qui se vend
L'équipe est pas sortable
Mais quand on sort c'est sous mon ventre
Maman disait court pas, tout ça viendra, fils prends ton temps (en vrai)
J'entends que ça parle de moi mais je sais même pas qui sont ces gens
[Refrain : Kalash]
No, je n'ai plus de love
Ils ont tout dépouillé (god know)
Que mes enfants, ma bataille
Ils t'aiment mais veulent te voir couler
Scruter au moindre détail (watch, watch, watch)
Et j'ai l'amour pour ma wife
Elle sait ce que j'ai commis
Papa ne croît plus en Jésus, mais je sais qu'il pray for me
Ma liberté dans les mains d'une personne qui ne m'a pas connu
À côté de mon oreiller une

[Pont : Kalash]
An vag lajan kon tsunami
Ca ramène beaucoup trop d'envie
Je m'étais dit que c'était pour la vie
J'ai perdu tellement de faux amis
Pour une go, ton pote peut t'enculer-y
Devant la juge c'est le premier qui a reculé-y
Mais il voudrait que tu l'aimes beaucoup plus que tes bébés-y
Je trouve pas ça gang
Je suis un vrai doggy

[Refrain : Kalash]
No, je n'ai plus de love
Ils ont tout dépouillé
Que mes enfants, ma bataille
Ils t'aiment mais veulent te voir couler
Scruter au moindre détail
Et j'ai l'amour pour ma wife
Elle sait ce que j'ai commis
Papa ne croît plus en Jésus, mais je sais qu'il pray for me
Ma liberté dans les mains d'une personne qui ne m'a pas connu
À côté de mon oreiller une bible et un calibre
[Outro : Kalash & Tiitof]
Oui
Yah, yah
Sparta (bley, bley)
Kalash NikovEmbed"
Kévin Valleray,Plus de Love (FR),"2 ContributorsPlus de Love (FR) Lyrics[Kalash]
Plus de love (Plek)
Plus de love (Ayin pas chanjé)
Plus de love (Vrai Sparta tibéy)
Plus de love

[Kalash]
Je n'ai plus de love
Ils ont tout dépouillé (God know)
Que mes enfants, ma bataille (Ieva, Ethan)
Ils t'aiment mais voudraient te voir couler (huh)
Scruter au moindre détail (Watch, Watch, Watch)
Et j'ai l'amour pour ma wife
Elle sait ce que j'ai commis
Papa ne croît plus en Jésus, mais je sais qu'il Pray For Me
Ma liberté dans les mains d'une personne qui m'a pas connu (Rrrr)
A côté de mon oreiller une bible et un calibre

[Kalash]
A bout de souffle deux mains de keuf
Je tourne de l'œil
Devenue riche maman m'avait dit que c'était risqué
Je n'ai rien fait de si grave mais ces bitchs ont voulu me faire (bitch)
Deux fils de pute de flic m'ont fait généraliser
Je n'ai plus de love
J'ai appris que j'étais plus le bienvenu à mes dépens
Rester ici me fera devenir un démon
Ils ont frotté leurs mains en pensant que j'allais m'étendre
You might also like[Kalash]
No, je n'ai plus de love
Ils ont tout dépouillé (God know)
Que mes enfants, ma bataille
Ils t'aiment mais voudraient te voir couler
Scruter au moindre détail (Watch, Watch, Watch)
Et j'ai l'amour pour ma wife
Elle sait ce que j'ai commis
Papa ne croit plus en Jésus, mais je sais qu'il Pray for Me
Ma liberté dans les mains d'une personne qui ne m'a pas connu
À côté de mon oreiller une bible et un calibre

[Tiitof]
Je sais qu'il aimerait bien que maman verse une larme
Et la moitié des cancans de l'île finissent en drame
(plek, plek, plek)
J'ai les flics au cul ils veulent savoir combien je gagne
J'ai des bons frangins qu'ont fini en trafiquant d'armes
(En vrai)
No love mon petit coeur est cassé
J'ai pas encore le million t'façon
J'ai pas encore fini de brasser
Yo pa sa fey donk yo fâché
On connait la rue de A à Z
(On connait la rue de A à Z)
Toujours au même endroit, je suis assis
On te fait travailler si t'es malin (Sparta)
On sait qu'on vient d'en bas au fond du bât'
Y'a tout qui se vend
L'équipe est pas sortable
Mais quand on sort c'est sous mon ventre
Maman disait court pas, tout ça viendra, fils prends ton temps
(En vrai)
J'entends que ça parle de moi mais je sais même pas qui sont ces gens
[Kalash]
No, je n'ai plus de love
Ils ont tout dépouillé (God know)
Que mes enfants, ma bataille
Ils t'aiment mais veulent te voir couler
Scruter au moindre détail (Watch, Watch, Watch)
Et j'ai l'amour pour ma wife
Elle sait ce que j'ai commis
Papa ne croît plus en Jésus, mais je sais qu'il Pray for Me
Ma liberté dans les mains d'une personne qui ne m'a pas connu
À côté de mon oreiller une…

[Kalash]
An vag lajan kon tsunami
Ca ramène beaucoup trop d'envie
Je m'étais dit que c'était pour la vie
J'ai perdu tellement de faux amis
Pour une go, ton pote peut t'enculer-y
Devant la juge c'est le premier qui a reculé-y
Mais il voudrait que tu l'aimes beaucoup plus que tes bébés-y
Je trouve pas ça gang
Je suis un vrai doggy

[Kalash]
No, je n'ai plus de love
Ils ont tout dépouillé
Que mes enfants, ma bataille
Ils t'aiment mais veulent te voir couler
Scruter au moindre détail
Et j'ai l'amour pour ma wife
Elle sait ce que j'ai commis
Papa ne croît plus en Jésus, mais je sais qu'il Pray for Me
Ma liberté dans les mains d'une personne qui ne m'a pas connu
À côté de mon oreiller une bible et un calibre
[Kalash, Tiitof]
Ouiiiiii
Yah yah
Sparta (Plek Plek)
Kalash NikovEmbed"
Kévin Valleray,Plus haut,"2 ContributorsPlus haut Lyrics[Refrain]
Jusqu'à la fin de la guerre
Les ratpis tiendront la capitale, sans préfet
On verra la fin, de toute manière
Crâne humain sur la bannière (han)

Plus haut (oh oh oh oh)
Hisser le drapeau pirate
Plus haut (oh oh oh oh)
J'partirai finir mes jours là-bas (ah ah ah)
J'finis pas tuba (ah ah ah ah ah)

[Couplet 1]
La chaîne a changé de couleur
Accroché à schéma nostalgique
Entre espoir et douleur
Chez moi, pas de petits sauts
Sont rapides comme des coureurs
J'pense à la Guyane ou banké
Sentez-vous la sueur ?
Payez-moi dans l'heure, j'rigole pas
Piraterie ne change pas
C'est marche ou crève, fais pas confiance
S'entube des gav-gav, faux rouleurs (hm hm)

Aux armes, d'emblée
Embrassez femme et enfants avant d'y aller
(Que la night)
You might also like[Refrain]
Jusqu'à la fin de la guerre
Les ratpis tiendront la capitale, sans préfet
On verra la fin, de toute manière
Crâne humain sur la bannière (han)

Plus haut (oh oh oh oh)
Hisser le drapeau pirate
Plus haut (oh oh oh oh)
J'partirai finir mes jours là-bas (ah ah ah)
J'finis pas tuba (ah ah ah ah ah)

[...]Embed"
Kévin Valleray,Polémique,"25 ContributorsPolémique Lyrics[Intro : Kalash]
Liberté, égalité, fraterni-
Ah (oh)

[Couplet 1 : Kalash]
Foutaise gastronomique (mytho)
Impôts astronomiques (pute)
Paris, c’est beau, c’est chic (oh)
Négro en Porsche, qu’est-c'que ça pique (y a quoi ici ?)
Les keufs en ont marre, se suicident (uh)
La banlieue pleure donc on est quittes (cheh)
Soit t’aimes cette France, soit tu la quittes (bienvenue en France)
Benzema n’est plus dans l’équipe (hasta luego)
Les vrais gars sont en fuite
Les poucaves font des clips
De la merde dans le top ‘sique
Depuis qu’la musique vaut un clic (streams, streams, streams, streams)

[Refrain : Kalash & Kalash Criminel]
Beaucoup d’risques dans ma musique (gang gang)
Malpolies sont mes polémiques (yah yah, woaw)
C’est perqui, voilà les flics (shot shot shot)
Ils veulent me faire craquer, que c’est comique (gang)
Ici, y a rien de touristique (sauvage, sauvagerie)
Le prix du billet, c’est un SMIC (woaw, woaw)
Armes de guerre, gros broliques (tah, tah, tah )
Y a plus de balles que d’eau en Afrique (eh)
You might also like[Couplet 2 : Kalash Criminel]
L’Occident tue l’Afrique
Le Pen veut pas qu’je baise sa petite fille (Marion Maréchal, Marion Maréchal)
J’dis ça de façon ironique
Personne d'vient millionnaire en touchant l’SMIC (gang)
Viens pas nous faire croire qu’on est tous égaux, pendant que d’autres ont des paradis fiscaux
Mortenol, Boissard, Guyane Chicago, Fort-de-France, gangsta, Sevran hood ghetto (sauvage)
Chez nous, c’est les armes qui répliquent (bon courage, tah, tah, tah)
Si ton rappeur préféré lance des pics
Y a quoi ici (Kalash) ? Négro, y a quoi ici ?
Keba na moundouki (tah, tah, tah), Oyoki, j’espère qu’on Oyoki
Mes sauvages de Haïti, Haïti, Haïti (sauvagerie)
On est tous de passage (woaw)
Y a que Dieu qui est éternel (Dieu est grand)

[Refrain : Kalash & Kalash Criminel]
Beaucoup d’risques dans ma musique (gang gang)
Malpolies sont mes polémiques (yah yah, woaw)
C’est perqui, voilà les flics (shot shot shot)
Ils veulent que j'craque, que c’est comique (gang)
Ici, y a rien de touristique (sauvage, sauvagerie)
Le prix du billet vaut un SMIC (woaw, woaw)
Armes de guerre, gros broliques (tah, tah, tah )
Y a plus de balles que d’eau en Afrique (eh)

[Couplet 3 : Kalash]
Le racisme est bénéfique
Éric Zemmour se fait du fric (n'est ce pas ?)
Cette planète est illogique (han)
C’est la guerre dans l’océan pacifique
L’amitié peut finir vite
Demande au cadavre à Kadhafi (Sarko')
Ce pays est sodomite
Une élection égale une bite (quenelle)
Une érection d’la République
Les rebelles tués par les schmitts (Dieudo')
Cocaïne et politique
Souvent ensemble dans le même type (meilleur ient-cli)
[Refrain : Kalash]
Beaucoup d’risques dans ma musique
Malpolies sont mes polémiques
C’est perqui, voilà les flics (wouh, wouh, wouh)
Ils veulent me faire craquer, que c’est comique
Ici, y a rien de touristique (bang)
Le prix du billet, c’est un SMIC (mama)
Armes de guerre, gros brolique
Y a plus de balles que d’eau en Afrique1Embed"
Kévin Valleray,Politichien,"1 ContributorPolitichien Lyrics[Intro]
...

[Pont]
...

[Refrain]
...

[Couplet 1]
...

[Refrain]
...

[Couplet 2]
...

[Refrain]
...

[Pont]×2
...

[Outro]
...You might also likeEmbed"
Kévin Valleray,Praising,"8 ContributorsPraising Lyrics[Paroles de ""Praising""]

[Intro]
Jah know
Alhamdoulilah
Ouh

[Refrain]
Let dem know we are di real ting closest to di highest, for me
Everywhere a go dey shot the praise, dey shout the prayers
This the hardest, for me
Real love don't make dem care for me
Mi say mi love you and mi empty
Mi love you but you don't feel me

[Couplet 1]
Mi say I love you, but you don't love me the way I love
I feel them pain in chest when I see them fight for life
This time enough
Dem get nothing right in dem eyes, everything wrong
I feel pain in my chest when dem [?], when dem take a lot

[Pont]
Mi save some light from Jah
And everytime he save me from the dark, mi see
Mi say take my life in your hands, Alhamdoulilah
You might also like[Refrain]
Let dem know we are di real ting closest to di highest, for me
Everywhere a go [?] the prayers is the hardest, for me
Real love don't make dem care for me
Mi say mi love you and mi empty
Mi love you but you don't feel me

[Couplet 2]
Dem never see the cloudy nights
I wanna thank God
My severance [?] I'll never loose that
No longer feel love
How can you love what you can see
How can you hate what you can't feel

[Pont]
Mi save some light from Jah
And everytime he save me from the dark, mi see
Mi say take my life in your hands, Alhamdoulilah

[Refrain]
Let dem know we are di real ting closest to di highest, for me
Everywhere a go [?] the prayers is the hardest, for me
Real love don't make dem care for me
Mi say mi love you and mi empty
Mi love you but you don't feel meEmbed"
Kévin Valleray,Praliné,"35 ContributorsPraliné Lyrics[Paroles de ""Praliné"" ft. Damso]

[Intro : Kalash]
Ouh, ouh, ouh, ouh, ouh, ouh
Michto' lova, lova

[Couplet 1 : Kalash]
À la tienne, j'ai le gosier, aussi vierge que mon casier
Ouais, c'est bon, ouais, c'est bon
Doux visage pour me blesser, bien trop bonne, j't'ai signalée
Ouais, c'est bon, ouais, c'est bon
Les boloss à ta table font du bruit quand je fais du sale
Tout donner pour attirer, mon regard sur ton fessier
Sois gentille, ne fais pas ça, j'te ferai boîter sur du Kassav
C'est comme ça, j'peux rien y faire, comment faire pour m'en défaire ?

[Refrain : Kalash]
Leave me alone, ah, ah
Leave me alone, oh, oh, oh
Leave me alone, ouh, ouh
Leave me alone, ouais, ouais, ouais

[Pont 1 : Damso]
Oh, oh
Oh ouais, oh
Dems
Eh
You might also like[Couplet 2 : Damso]
Jus de testicules au praliné (Yeah)
Fukushima dans son ul-c, j'plante pas d'graine
Elle est bonne mais pas à marier (Non)
Vie en rouge, du Christian, qu'elle me demande sans gêne
Préviens ta copine, ce s'ra plus possible (Non, non)
J'suis dans le coffee, j'fume sans nicotine (Ouais, ouais)
J'la prends dans ture-voi comme dans Grand Theft Auto (Sale)
J't'aime du bout des doigts même si j'm'arrête trop tôt (Nan)

[Pont 2 : Damso]
Elles n'arrêtent pas d'dire qu'j'suis pas l'mec qu'il faut (Nan)
Mais grattent une guest-list pour revenir à chaque show (Ouais)
Michto' lova, lova m'aime de toute ma moula (Moula)
Michto' lova, lova m'aime de toute ma moula (Moula)
Elles n'arrêtent pas d'dire qu'j'suis pas l'mec qu'il faut (Nan)
Mais grattent une guest-list pour revenir à chaque show (Ouais)
Michto' lova, lova m'aime de toute ma moula (Moula)
Michto' lova, lova m'aime de toute ma moula (Moula)
Leave me alone

[Refrain : Kalash]
Ouais, ouais
Leave me alone, oh, oh, oh
Leave me alone, ouh, ouh
Leave me alone
Mais dis-moi, pourquoi tu m'as pas follow back ?
Vous faites quoi après l'show ?
[Pont 3 : Kalash]
Elles m'attaquent en solo, viennent même en armée
Une de perdue, j'envoie une autre s'armer
Michto lova m'aime de toute ma SACEM
Michto lova m'aime de toute ma SACEM
Comment ça tu fais rien mais t'as une belle auto ?
Passe ton phone que je joue au Loto
Michto lova, lova m'aime de toute ma moula
Michto lova, lova m'aime de toute ma moula

[Outro : Kalash]
Please don't make me lose my time (Alone, alone)
Make me lose my time
Oh, oh, ohEmbed"
Kévin Valleray,Pran pié,"4 ContributorsPran pié Lyrics[Intro : Kalash & Lieutenant]
Badman boum, poum, boom, poum, boom, poum, tell dem c'est boom
Badman boom, kaboom, boom, kaboom, boom, kaboom, boom
Badman boum, poum, boom, poum, boom, poum, tell dem c'est boom
Badman boom, kaboom, boom, kaboom, boom, kaboom, boom

[Refrain : Kalash & Lieutenant]
Rudeboy nou vini pran pié nou pran pié nou pran pié nou (boom boom boom)
Fo pa yo vini pompé nou
Dj mash up di place cauz we are like dat
Dopé nou dopé, okay nou okay
Pran pié nou pran pié nou pran pié nou (boom boom boom)
Fo pa yo vini pompé nou
Dj mash up di place cauz we are like dat
Dopé nou dopé, okay

[Couplet 1 : Kalash & Lieutenant]
Boy no diss man we no kiss man sa ki ka ba sé plis gyal anlé pis la
Dot ka vini a dis man mé sa tris man pas la ja ni plis man ki ni plis gun ki policeman
Damn! dé-di-dé-di-dead, talk fi dead tout (bolhead!) ki vini la pou fouté bordel, dead
Damn! dé-di-dé-di-dead, talk fi dead tout (bolhead!) ki vini la pou

[Pont : Lieutenant]
Ba'aye la sé pran pié nou épi tout ko
Menm si yo koumansé sans nou
Dépi ou ka métrizé tchad ou
Nou té ké rantré devan jou
You might also like[Refrain : Kalash & Lieutenant]
Nou vini pou pran pié nou pran pié nou pran pié nou (boom boom boom)
Fo pa yo vini pompé nou
Dj mash up di place cauz we are like dat
Dopé nou dopé, okay nou okay
Pran pié nou pran pié nou pran pié nou (boom boom boom)
Fo pa yo vini pompé nou
Dj mash up di place cauz we are like dat
Dopé nou dopé, okay

[Couplet 2 : Lieutenant]
Si ou ka vini tcheck, nou menm pa ka ni tchak
Si ou lé joué le jak, nou menm pa ka ni tchek
Ba'aye la sé piscine-party gadé fitché an létchèt
Si ou vlé gadé an kay la tout moun an ka bréné tèt
Ke ou allemand ou tchad
Ba mwen sé pa an
Ou pé vini an sandalette, ou pé vini an short
Pli vite ki discotek moune ka rentré par 7
Ba'aye la sé san violans pa ni koutla pa ni pitjet (boy)

[Post-refrain : Kalash & Lieutenant]
Yowyow, Lieutenant, Krrhrrr
(Bim, bim)
Rudeboy wyne, pussy gyal wyne c'est le bor-bordel time
Sa sé an spésial dédikas ba tou sa ki pa kochonni
[Refrain : Kalash & Lieutenant]
Pran pié nou pran pié nou pran pié nou (Boum, boum, boum)
Fo pa yo vini pompé nou
Dj mash up di place cauz we are like dat
Dopé nou dopé, okay nou okay
Pran pié nou pran pié nou pran pié nou (Boum, boum, boum)
Fo pa yo vini pompé nou
Dj mash up di place cauz we are like dat
Dopé nou dopé, okay

[Couplet 3 : Kalash & Lieutenant]
Rudeboy tjenbé pumpum pa ni pom pom
La pa ni piès nonm ka bow an ba foul moun
Nou ka poté rispek-la ba tout moune
Kalashnikov et lieutenant, a bullet tune

[Pont : Lieutenant]
Ba'aye la sé pran pié nou épi tout ko nou
Menm si yo commencé sans nou
Depi ou ka matrisé tchad ou
Nou té ké rentré devant ou an jou'

[Pré-refrain : Lieutenant]
Nou vini pou pé sa danser à la base
Ki a lé a reggae ki lé a baddaz
Tant pis ba tout sa ki lé rété a caz
Même si nou rantré bo la kay nou bien naze
[Refrain : Kalash & Lieutenant]
Pran pié nou pran pié nou pran pié nou (boom boom boom)
Fo pa yo vini pompé nou
Dj mash up di place cauz we are like dat
Dopé nou dopé, okay nou okay
Pran pié nou pran pié nou pran pié nou (boom boom boom)
Fo pa yo vini pompé nou
Dj mash up di place cauz we are like dat
Dopé nou dopé, okay

[Outro : Kalash & Lieutenant]
Coda
Boum Krrr Ah ah
Lieutenant
Kalashnikov han han
Lieutenant
Boom boom boom bomm
DJ Blue
Han HanEmbed"
