Artist,Title,Lyrics
Kévin Valleray,Mada,"19 ContributorsMada Lyrics[Intro]
Kombyen moto volé ki la osi ?
Kombyen moto san lasirans, kombyen moto moun pa ni permi pou monté sa ?
Épi kombyen moun nowmalman ki dot rechewché pa la polis, kombyen moun ki awmé adan bagay tala ?
Kombyen moun ka fimé jwen alo kè yo ka condui moto, kombyen moun ki ni dwog anlè yo
Tout sé kestyon tala, sé dé kestyon de, de, de... vwayou
É sé pa nowmal, Kalash, nou sav tous kè fwékentasiyon misié sé pa bon fwékentasiyon
Mè gadé sé moun ki a lantou'y la, i ni twa moun an konèt adan'y nou ni labitid lité épi sé messié, sé dé trafikan dè dwog, sé dé gwo volè, é sé mesié adan clip boug la, yo ka cosiyoné sa donc j'veux dire pour l'truc, je les emmerde, là franchement, demain si Dieu veut fera jour, man kay aplé Morreau, man ka foutéy on modèl dè savon, man ka di zot sa, i kay pwen baton, zo' ké tann palé di sa, pas man kay rentré an tchou'y

[Refrain]
Je suis un négro de Mada
Là où les balles pleuvent comme les mamas
Et tous les jours, je ride for my nigga
Can die for my nigga du hood au placard
Et la police n'est pas comme à Paname
Ici la po-po a des badman
Et la cocaïna prend Air Caraïbes dans la soute parmi les bagages (Mule)

[Couplet 1]
Fizi pété oh no à une moto, boum boum oh ho
Les négros font, font de la money (brr) monte la money (brr brr)
Pauvre (brr) font de la money
Mes potos ont la dalle, énervés dès le plus jeune âge
Inégalité te fout la rage, se jeter du 20e étage
La suite fait faire des bêtises, et l'envie, elle est le pire des vices
La jalousie, l'hypocrisie, la trahison
Tout le monde pense avoir raison
You might also like[Pont]
J'ai coupé mes chaînes, m'élever sans m'éloigner des miens
Que la police me craigne
Essuyé les larmes de ma terre et asséché la peine
Maudit celui qui nourrit le scandale, quand le démon l’amène
Car sa peine est ma peine

[Refrain]
Je suis un négro de Mada
Là où les balles pleuvent comme les mamas
Et tous les jours, je ride for my nigga
Can die for my nigga du hood au placard
Et la police n'est pas comme à Paname
Ici la po-po a des badman
Et la cocaïna prend Air Caraïbes dans la soute parmi les bagages (Mule)

[Couplet 2]
Pas de main a main, no, ici pas de Jet Li
Les chargeurs sont pleins, rapide comme un jet-ski
Sur la vie d'mon filleul, tout le monde sait qui est-ce qui a tué qui (Pookie)
Les poucaves de Whats'App sont meilleurs que les meilleurs des flics
Yeah, alcool et weed dans ma folie, instabilité familiale mélangée à douleur et cris
C'est chaud, c'est violent, ça fait mal
On dit que tout ça est écrit
Personne ne sait ce que t'as
Mais tout le monde te dit que t'as grossi (Bitch)
Asé bat djel ou san sav
[Refrain]
Je suis un négro de Mada
Là où les balles pleuvent comme les mamas
Et tous les jours, je ride for my nigga
Can die for my nigga du hood au placard
Et la police n'est pas comme à Paname
Ici la po-po a des badman
Et la cocaïna prend Air Caraïbes dans la soute parmi les bagages (Mule)

[Pont]
J'ai coupé mes chaînes, m'élever sans m'éloigner des miens
Que la police me craigne
Essuyé les larmes de ma terre, et asséché la peine
Maudit celui qui nourrit le scandale, quand le démon l’amène
Car sa peine est ma peine

[Outro]
Car ma peine sera la tienne
Car ma peine sera la tienne
Mwaka boss, i'm out
...Embed"
Kévin Valleray,Malpolis,"27 ContributorsMalpolis Lyrics[Paroles de ""Malpolis"" ft. Damso]

[Intro : Damso]
Oh la la

[Couplet 1 : Damso]
Je porte des œillères, fuyant le monde, évitant le regard des gens
Né dans le rouge, forcément, recherche le feu vert pour partir à temps
Kilos de me-sper, beaucoup de descendants périrent dans grosses ch*** ensanglantées
Beaucoup d'enfants, la moula, la moula, j'ai fait, j'suis dans l'business, un truc du genre (Genre)
Merci à mes ennemis qui parlеnt de moi sans me côtoyer
Jе fais des économies, je vis dans leurs têtes sans payer de loyer (Loyer, loyer)
Si j'devais mettre fin à mes jours, j'commencerais par le jour où j't'ai rencontré (Rencontré)
Dans le quartier, le four, nombreux allers-retours rouges et bleu foncé (On n'aime pas les bleus)

[Pont : Damso]
J'ignore pourquoi la drogue me soulage (Eh), mon sommeil en d’vient paro, sauf quand elle est inhalée (Je fume trop de beuh)
Concours de : ""Je t'aime"", trop de : ""Te amo, te amo"" pour qu'elle fasse la pute pour tout l'restant de l'année (Nique ta mère, allez)
Je scroll et j'vois la vie des gens, c'est mieux (Eh-eh-eh-eh)
Selfie sur la plage, mer bleue (Oh-oh-oh)
J'm'en fous si j'suis pas vraiment heureux (Nan, nan, nan, nan)
Selfie sur la plage, mer bleue (Ouh-ouh, ouh-ouh, ouais)

[Couplet 2 : Damso]
Évidemment que j'n'ai pas le temps de concevoir une vie de rêve car j'ai des putains de 'blèmes sur l'tas (Ouh)
Précipitamment, j'ai fait des choix, des choix que mon passé regrette entraînant des putains de 'blèmes sur l'tas (Oh, oh, oh, oh, oh, oh)
Ma chérie, j'ai r'connu l'inconnu, un : ""Je t'aime"" en soirée, je connais le tarot
You might also like[Couplet 3 : Kalash]
Okay, je meurs ma vie car je vis à mort (Ouh)
J'ai fait mon testament, j'aime trop la vitesse, ne monte pas à bord
Comme un conquistador, j'suis jamais là mais mon fils m'adore
Je pense à Ethan, tu penses à Lior
Tant de jalousies et de mauvais sorts
Le ciel me réconforte, balle en argent dans fusil en or, c'est comme ça qu'on s'en sort
J'ai le cœur bleu, tant de beuh, les poumons en feu, d'la peine dans les yeux, on fait comme on peut

[Refrain : Damso & Kalash]
Okay
On ne parle pas bien, on est très malpolis
On a sorti le machin : la mort fait pas mal de bruit (Shuu)
""Ra-ta-ta-ta-ta, piouh, piouh, piouh, piouh"", gang, gang (Sale, sale)
On a sorti le machin : la mort fait pas mal de bruit (Boum)
On ne parle pas bien, on est très malpolis (Mmh-mmh, mmh-mmh)
On a sorti le machin : la mort fait pas mal de bruit (Boum)
""Ra-ta-ta-ta-ta, piouh, piouh, piouh, piouh"", gang, gang (Boum)
On a sorti le machin : la mort fait pas mal de bruit (Okay)

[Outro : Damso & Kalash]
Mmh-mmh, mmh-mmh, mmh-mmh, mmh
Mmh-mmh, mmh-mmh, mmh-mmh, mmh
Mmh-mmh, mmh-mmh, mmh-mmh, mmh
On a sorti le machin : la mort fait pas mal de bruit
Na-na-na-na
On a sorti le machin : la mort fait pas mal de bruit4Embed"
Kévin Valleray,Mama,"3 ContributorsMama Lyrics[Couplet 1]
Ooh hé yow big mama
Mwen la ka réfléchi
Ou tro solide
Combien vie adan la vie ou ja sèvi
Temps ka passé mè ou pa ka viyéi
lanmouw ka grandi
Affection clean
Pa janmin pran ride
Son ta la sé baw mim'
Inspiration ka coulé
Pass ou toujou ka rété di'm
Lè dlo coulé an ziéw
Ou pa janmin ka di

[Refrain]
Manman, douvan pwoblèm
Ou toujou di mwen tchimbé fô
Mè ou la ka fatigué kow
Sa sé pa éfow enco
Ou pa plié, pa janmin cassé
Ou di mwen i bon , dépi i passé
Anh anh ahn......
Mè ba nou, nou ja fè assé

[Couplet 2]
Padon'nin ou padon'nin mwen
Ou pa ladjé mwen
Lè ou wè mwen fè patché mwen
Ou pa ka maché adan mwen
Ou ka cléré chimin mwen
Ou pa ka faché lè yo diw
Koté yo ja wè mwen, yo tchimbé mwen
Police ka vin'n ou ka pran ba mwen
Ou di mwen jodi'a sé ta yo
Demain sé ta mwen
Mwen sav bien ke ou ka souffè
Mè pa pè
Pass rou'a ka toun'nin
Et pas à peu près
[Refrain]
Manman, douvan pwoblèm
Ou toujou di mwen tchimbé fô
Mè ou la ka fatigué kow
Sa sé pa éfow enco
Ou pa plié, pa janmin cassé
Ou di mwen i bon , dépi i passé
Anh anh ahn......
Mè ba nou, nou ja fè assé

[Couplet 3]
Sé love mwen ni baw
Pièss fanm pa mérité'y
Tou lé jou bon dié fè
Mwen ka médité
Té ké lé ou bô mwen pour l'éternité
Sé love mwen ni baw
Pièss fanm pa méritééé'y
Tou lé jou mwen ka méditééé
Pran mwen pour l'éternité
Tou lé jou bondié fè
Mwen lé ou souri
Trop moun ou ja nouri
Ou té couri
Premié fois ou tan'n mwen crié BOOLIT''
Lè pwoblèm atéri ou pa té ri
Jôdi jou mwen muri
Mwen lé fèw wè la vie
Voyagé adan bon péyi
Ou ka égalisé yan'n dé mythes
Présence ou bénéfik
Cn si sa pé kriyé an dlo bénite
Manman manman
Pwoblèm ou kay effacé
Djos' kité temps passé
[Refrain]
Manman, douvan pwoblèm
Ou toujou di mwen tchimbé fô
Mè ou la ka fatigué kow
Sa sé pa éfow enco
Ou pa plié, pa janmin cassé
Ou di mwen i bon , dépi i passé
Anh anh ahn......
Mè ba nou, nou ja fè assé

[Outro]
Kalashnikov
Manman manman manman
Manamn manman
Kalashnikov
Yè big up mamaEmbed"
Kévin Valleray,Maria,"4 ContributorsMaria Lyrics[Paroles de ""Maria""]

[Couplet 1]
On dit qu’on récolte tout ce que l’on sème
Que poussera t’il donc s’il pleut de la haine ?
Est-ce dans l'ère du temps ou bien dans les gênes
Que plus l’on s’aime et plus on saigne, saigne, saigne ?
C’est la vida loca qu’on mène, de couleur ont changé les chaînes
Et quand l’un de nous est en peine, c’est tout le reste qui se déchaîne

[Refrain]
Oh, Maria, regarde nous, regarde nous
Dis-moi, si espoir, il y a pour nous
Oh, Maria, regarde nous, regarde nous
Dis-moi, si espoir, il y a pour nous

[Couplet 2]
Les démons ne sont pas forcément cachés dans le noir
Les mots d'amour ne sont pas forcément bons à croire
Il se raconte de biens étranges histoires, certains n’ont plus de reflet dans le miroir
Donné, j'ai donné du temps mais ils ont voulu tuer le mien
Jamais on ne s’attend à s’faire enculer par les siens
Coupe le bras alors que j'leur tendais juste la main
Pourquoi ferais-je donc le bien ?

[Refrain]
Oh, Maria, regarde nous, regarde nous
Dis-moi, si espoir, il y a pour nous
Oh, Maria, regarde nous, regarde nous
Dis-moi, si espoir, il y a pour nous
You might also like[Couplet 3]
Mais qui peut jeter la première pierre ?
On s'acharne comme des rapaces sur un cadavre
J'pense à mes enfants après, que feront-ils dans tout ça ?
Quel monde de merde, aimer la guerre c'est comme brûler la neige
Ça veut rien dire, en vrai pourquoi on s'emmerde ?
Je lui ai dit : ""Je t’aime"", elle m’a dit : ""Abrège""
Pourquoi je perds mon temps ? Devrais-je donc la tèj ? (Après l'avoir ken)

[Refrain]
Oh, Maria, regarde nous, regarde nous
Dis-moi, si espoir, il y a pour nous
Oh, Maria, regarde nous, regarde nous
Dis-moi, si espoir, il y a pour nous

[Outro]
Oh, Maria, regarde nous, regarde nous (Santa Maria)
Dis-moi, si espoir, il y a, regarde2Embed"
Kévin Valleray,Masterclass,"11 ContributorsMasterclass Lyrics[Paroles de ""Masterclass""]

[Intro]
J'ai plus de Xanax que d'amis
J'ai plus de Xanax que d'amis, yeah

[Couplet 1]
C'est fou comme la vie est trop laide dans la ville
La mort est belle une fois sur la colline
T'as beau aimer les gens
Mais pour les diamants, t'oublies qui est mort dans la mine
(Brr, oh ouais)
Ça t'rappelle un flow, c'est normal, j'suis un rate-pi (des caraïbes)
Dieu est plus fort que Messi, que des lucarnes, son tir est précis
J'suis 9.7.2, j'ai des amis dans l'7.5
Ça fume la beuh, ça boit du rhum sec
Jе prie Jésus, Jéhovah, Allah mais pas Buddha
J'dis pas qu'c'est mieux, c'еst juste que j'connais pas
Ils viennent chez moi chercher esclaves et cocaïne
Tu payes pas, j'te refais l'visage à l'acide
Chaque femme est belle, j'ai pas compté Marine
Nique sa mère, son père, sa soeur et tous ceux qui la suivent

[Refrain]
Ouh ouh ouh ouh (yeah)
Elles m'ont dégouté, j'dis plus ""I love you"", yeah
Tu passes trop d'temps sur Youtube
Peu importe s'ils me vaccinent mais sache que moi j'resterai un malade à vie
Ouh ouh ouh ouh (yeah)
Ouh ouh ouh ouh (yeah)
Ouh ouh, ouh-ouh (yeaah)
(Oh ouais, oh ouais)
You might also like[Couplet 2]
Ils diraient qu'ce son est une masterclass si y'avait un Kopp ou Dem's
Mais j'suis juste un blédard, à leur yeux j'suis d'une autre espèce (mwaka)
C'est vrai mais j'mérite mon succès
Mwaka Moon, j'ai fait bugger la SNEP
J'aime ma Clara, c'est quoi l'problème, ta mère la pute ?
Elle est blanche, y'a quoi ? J'mets du noir sous son fute
J'suis un prophète mais mon avis
N'est pas si important, j'n'ai aucun pouvoir sur la vie
J'suis pas chrétien, j'suis pas athée
J'crois en une force qui m'empêche d'être un raté
Judas a tué Jésus après bisou
Regarde-moi dans les yeux, quand tu me dis bonjour
Yeah

[Refrain]
Ouh ouh ouh ouh (yeah)
Elles m'ont dégouté, j'dis plus ""I love you"", yeah
Ouh ouh ouh ouh (yeah)
(Ah ouais ouais ouais, ouais)
Ouh ouh ouh ouh (yeah)
Ouh ouh ouuh-ouuh
Ouh ouh ouh ouh (yeah)
Ou ja konet tu comprends bien que j'n'ai pas d'amis

[Outro]
Yeah
Tellement de Xanax, très peu d'amis
Yeah
Inh inh
EhEmbed"
Kévin Valleray,Mechop,"9 ContributorsMechop Lyrics[Intro]
Mechop
And ayanay, lespri ou mèt dog
Secteur PTZ
One family (TommyOnTheTrack)
Bad boï, ouh

[Pont]
Konbyen frè nou ja alé
Nou ja lass kriyé anmwè
Poukwa, poukwa, turn up, turn up

[Refrain]
Turn up anh, an ka fè son tout' tan an pé, yeah
De tan an tan nou ka évadé kon nou pé, yeah
Nou ja pèd dé frè nou ja pèd konbyen best friend
Jodi nou byen démin matin nou an pèn
Manman di mwen chak jou an lévé sé foss a bondyé (foss a bondyé)
Foss a bondyé (foss a bondyé), foss a bondyé
Man ka sonjé Mechop é sa ka fè mwen mal
Pa di mwen ke mô si jen', tout à fait normal

[Couplet 1]
Vi la kout, telman kout, ou pa sav ki manyè nou ja soufè kon si nou té ni laj a Kassav
Mwen ka wé fré mwen pati, lanmô paka voyé mesaj
Ou ka anni mo kon l'autonm, sa ka fè vit kon papa saj
An ja pléré telman pléré, larmes de rage
Poukwa sé li, fuck lanmô y pa jen saj
Gadé'w kouché adan cercueil fout sa bizar (landjèt manman sa, man paka rivé kwè sa)
You might also like[Refrain]
Turn up anh, an ka fè son tout' tan an pé, yeah
De tan an tan nou ka évadé kon nou pé, yeah
Nou ja pèd dé frè nou ja pèd konbyen best friend
Jodi nou byen démin matin nou an pèn
Manman di mwen chak jou an lévé sé foss a bondyé (foss a bondyé)
Foss a bondyé (foss a bondyé), foss a bondyé
Man ka sonjé Mechop é sa ka fè mwen mal
Pa di mwen ke mô si jen', tout à fait normal

[Couplet 2]
Garga kriyé mwen, ka di mwen Mechop alé
Man tombé vini vwè, non man pa rivé palé
Sa violan violan, an mandé bondyé
Poukwa poukwa on frè ka alé
Nou ja pèd frè nou ja maché (déyè corbilla nou ja ni asé)
À pènn trente an nou ravajé (lanmô ka pasé, alè y ka alé)
Sa ka fè mwen médité, nou konprann nou immortel passaj nou ja déterminé
Man ni la foi pou soulajé mwen, an ka pran bondyé pou témoin
Si sa fèt c'est que sa té ja maké minm si sa ka dégouté mwen
Ou sé frè mwen pou lavi, piraterie pa jen fini
Ou sé frè mwen pou lavi, minm apwè lanmô
And ayanay, PTZ

[Refrain]
Turn up anh, an ka fè son tout' tan an pé, yeah
De tan an tan nou ka évadé kon nou pé, yeah
Nou ja pèd dé frè nou ja pèd konbyen best friend
Jodi nou byen démin matin nou an pèn
Manman di mwen chak jou an lévé sé foss a bondyé (foss a bondyé)
Foss a bondyé (foss a bondyé), foss a bondyé
Man ka sonjé Mechop é sa ka fè mwen mal
Pa di mwen ké mô si jen', tout à fait normal
[Outro]
Mechop, We miss you, Lélé, Safé (aaah)
Secteur PTZ, FLG (hinhiiin)
We miss you, real dog (trop' frè ka alé)
Miss you dog (an ja lass pléré)
And ayanay
I'm outEmbed"
Kévin Valleray,Médicaments,"6 ContributorsMédicaments Lyrics[Paroles de ""Médicaments"" ft. Kima]

[Intro : Kalash & Kima]
Gang
Ouais blood, ouais blood
Gang
Gang, gang (ah)
Gang, gang

[Couplet 1 : Kalash & Kima]
J'suis le même gars qu'au départ, j'sais pas, mon gars
La vie du tier-quar, ça paye pas, c'est là
Maintenant, j'prends tous vos Paypal
Même dans les galères, j'm'en fais pas
J'ai jamais changé, j'suis resté le même, c'est danger
C'est comment les bails ? Me parle pas d'plan B
J'suis toujours resté, j'ai jamais flanché
Tu sais, je t'aimais bien quand même
Gang, si c'était que fictif, si c'était que p'tit kiff
Ne parle pas de p'tites mises mais plutôt de six chiffres
Sois pas craintif même si j'insiste
Y'a pas de plan fixe, ma belle, sois pas triste
Ces faux, ils sont tous à la bourre, ils sont paumés
Tu sais, j'ai tout fait pour l'argent, tu me connais
J'suis parti solo à la chasse d'un chromé
J'étais à deux doigts de la paix
Et vas-y, je t'emmène
Non bébé, n'aie pas de peine
Et vas-y, je t'emmène et bien évidemment
You might also like[Refrain : Kalash & Kima]
J'suis le docteur sans médicaments
Des comme moi, y'en a pas tellement
Baby, j'te fais le serrement
Donc, ne t'en va pas bêtement
J'suis le docteur sans médicaments
Des comme moi, y'en a pas tellement
Baby, j'te fais le serrement
Donc, ne t'en va pas bêtement (skrr)

[Couplet 2]
J'suis dans l'biz, y'a pas d'Tiktok, bébé, dose
Vas-y, tic, tac, kalash, clic, clac, j'te prends sur le clic-clac
Ton cul fait clap, clap, gros comme un Big Mac
Drill, chill, en mode bip bap
Tu sais que j'vais faire ça flip flop
Bébé, dose, tic, tac, appelle-moi Big Bop
J'suis dans le 4x4, téma la kichta

[Refrain : Kalash & Kima]
J'suis le docteur sans médicaments
Des comme moi, y'en a pas tellement
Baby, j'te fais le serrement
Donc, ne t'en va pas bêtement
J'suis le docteur sans médicaments
Des comme moi, y'en a pas tellement
Baby, j'te fais le serrement
Donc, ne t'en va pas bêtement
[Couplet 2 : Kalash & Kima]
Des voyous, des soucis, de la dope
J'ai du rhum dans le cop' et le coffre plein de fusils
Fais des rêves plein de maléfices, des tatouages et des cicatrices
C'est chant-mé, t'es mon plan A, mon plan B
Kima t'a dit : « t'en va pas bêtement »
Y'a mon odeur sur tes vêtements
(SD Squad nou an wout' mon frère)
J'suis le même gars qu'au départ, j'sais pas, mon gars
La vie du tier-quar, ça paye pas, c'est là
Maintenant, j'prends tous vos Paypal
Même dans les galères, j'm'en fais pas
J'ai jamais changé, j'suis resté le même, c'est danger
Parle moi de motiver, parle-moi d'plan B
J'suis toujours resté, j'ai jamais changé
Tu sais, je t'aimais bien quand même, gang

[Outro : Kalash]
SD Squad nou an wout' mon frère
Kima
Kalashnikov'
Sa malad'
AhEmbed"
Kévin Valleray,Mode avion,"16 ContributorsMode avion Lyrics[Intro]
Please make sure that all seats are on the upright position
And trays are put away
Please make sur that your seatbelt is fasten
Thank you and enjoy your flight
Fly crew, please prepare for take off
Stephen
Di Genius

[Pré-refrain]
Je passerai pas la nuit dehors (non)
Je dois bosser, c'est quoi ton truc encore
À chaque fois, je pense partir en paix
Tu maudis, me jette des sorts

[Pont]
Pourquoi te donner tant de mal, m'envoyer des phrases hardcore
J'attendrai que tu sois calme pour revenir masser ton corps
C'est la même à chaque fois, tu me demandes pardon
J'étais au studio, je pensais à toi en mode avion

[Refrain]
Oh baby gyal, il est temps de realize
On aurait dit que quelqu'un t'a payé, c'est pas possible t'adores les embrouilles
Oh my gyal, réinsulte-moi en face
Soulage-toi et arrête de me faire chier
You might also like[Couplet 1]
Quand je m'absente gyal, it's a problem
Je rigole cinq fois, it's a problem
Quand je pars à l'eglise, it's a problem
Mon ex m'a fait la bise, it's a wicked problem
Pas de bisous chez ma maman, it's a problem
Je suis plus soigné qu'avant, it's a problem
Je vais chercher des médicaments, it's a problem
Quand j’vais mourir sur le divan, problem

[Pont]
Pourquoi te donner tant de mal, m'envoyer des phrases hardcore
J'attendrai que tu sois calme pour revenir masser ton corps
C'est la même à chaque fois, tu me demandes pardon
J'étais au studio, je pensais à toi en mode avion (baby)

[Refrain]
Oh baby gyal, il est temps de realize
On aurait dit que quelqu'un t'a payé, c'est pas possible t'adores les embrouilles
Oh my gyal, réinsulte-moi en face
Soulage-toi et arrête de me faire chier

[Couplet 2]
T'étais mignonne et douce gamine
Tu m'as manipulée vous êtes toutes malines (malines)
""Ferme ta gueule de puta minable""
Tu m'as sorti ça devant toute ma mi-fa
C'est pas la peine jouer la poule Dalida
Je sais que t'es veinarde, t'as bu plein de stamina
Aussi violente que Medellin
Derrière ta jolie mine, se cache la plus folle de toutes les Nina
J'essaye d’éviter tous les ""pwoblems""
Tu vas me tuer pour une histoire de poubelle
Il est temps de se calmer
Tu feras un AVC, quand je serai caché dans les WC
[Refrain]
Oh baby gyal, il est temps de realize
On aurait dit que quelqu'un t'a payé, c'est pas possible t'adores les embrouilles
Oh my gyal, réinsulte moi en face
Soulage-toi et arrête de me faire chier
Oh baby gyal, il est temps de realize
On aurait dit que quelqu'un t'a payé, c'est pas possible t'adores les embrouilles
Oh my gyal, réinsulte-moi en face
Soulage-toi et arrête de me faire chier

[Outro]
D'ailleurs, tu m'enquiquines tout le temps gyal
""Rhum toujou""
Tu me casses les couilles, tu me casses les couilles
Stephen
I'm out
Medeline1Embed"
Kévin Valleray,Moments gâchés,"12 ContributorsMoments gâchés Lyrics[Intro : Kalash & Satori]
(Hey boy I like you) Baby
(Boy I like you) Ouh ouh
(Boy I like...) Hey yeah
(Hey Rvssian)

[Couplet 1 : Kalash]
Tout ce qu‘on s’était promis
Quand on est tombé love gyal
Des nuits de folies avec ou sans argent
Si je sors le flingue tu souris en chargeant
Pas d'honneur aux ennemis que j’ai tort ou raison
Je tomberai pour toi tout en restant confiant
Quelques mois ça va mais dix ans c’est du temps (Mais gyal)

[Pré-refrain : Kalash]
Caché dans tes bras je me demande
Pourrais-tu lâcher ma main pour un autre monde
J’ai dû gâcher tous tes rêves de colombe
J’suis déjà chelou que serais-je si tu m’abandonnes
Tu m’as dit de toujours avoir confiance en toi
Ce n’est pas qu'je doute mais y’a quand même des fois
J’m’imagine que tu méritais mieux que tout ça

[Pont : Kalash]
Et même si on se sépare
J’aimerais croire
Je survivrai à tous les tourments si tu m'donnes espoir
Mais le temps est compté
Moments gâchés
Je sais ô combien d’années tu m’as donné
You might also like[Refrain : Satori]
But boy I love you
And boy I trust you
Boy I lo lo lo lo love you
But boy I love you
And boy I trust you
Boy I lo-lo-lo-lo-love you

[Couplet 2 : Satori]
Mon amour pour toi est sans fin
I can’t love without your love in
My love for you is endless
Boy you know you give me breathless
Garde-moi, je suis à toi
I’ll be waiting for your touch
Until I’m right back in your arms
You have all my love (ouh ouh)
Ho hou my love, you have all my love (ouh ouh)
Ouh my love my love my love my love my love boy

[Pré-refrain : Kalash]
Caché dans tes bras je me demande
Pourrais-tu lâcher ma main pour un autre monde
J’ai dû gâcher tous tes rêves de colombe
J’suis déjà chelou que serais-je si tu m’abandonnes
Tu m’as dit de toujours avoir confiance en toi
Ce n'est pas qu'je doute mais y’a quand même des fois
J’m’imagine que tu méritais mieux que tout ça
[Pont : Kalash]
Et même si on se sépare
J’aimerais croire
Je survivrai à tous les tourments si tu m'donnes espoir
Mais le temps est compté
Moments gâchés
Je sais ô combien d’années tu m’as donné

[Refrain : Satori]
But boy I love you (tell me again)
And boy I trust you (tell that again)
Boy I lo lo lo lo love you (and I love you too)
But boy I love you (tell me again)
And boy I trust you (tell that again)
Boy I lo-lo-lo-lo-love you (darling)

[Couplet 3 : Kalash]
Chaque minute et chaque seconde
Les yeux sur toi, la main sur le magnum
Retrouveras-tu un autre homme
Qui saura te faire venir en 9 secondes
Smoke weed buss gun
Ils disent que je ferai de toi une vagabonde
T’es la seule t’es la bonne
Marche avec moi dans les rues de Kingston (rangdang)
[Pré-refrain : Kalash]
Caché dans tes bras je me demande
Pourrais-tu lâcher ma main pour un autre monde
J’ai dû gâcher tous tes rêves de colombe
J’suis déjà chelou que serais-je si tu m’abandonnes
Tu m’as dit de toujours avoir confiance en toi
Ce n'est pas qu'je doute mais y’a quand même des fois
J’m’imagine que tu méritais mieux que tout ça

[Pont : Kalash]
Et même si on se sépare
J’aimerais croire
Je survivrai à tous les tourments si tu m'donnes espoir
Mais le temps est compté
Moments gâchés
Je sais ô combien d’années tu m’as donné

[Refrain : Satori]
But boy I love you
And boy I trust you
Boy I lo lo lo lo love you
But boy I love you
And boy I trust you
Boy I lo-lo-lo-lo-love youEmbed"
