Artist,Title,Lyrics
Lyonzon,0 Prometh,"15 Contributors0 Prometh Lyrics[Paroles de ""Zero prometh""]

[Couplet 1 : Kpri]
Tu t'branles, y en a qui bossent, mets l'808, mets la basse
C'est quoi tes losses sous taz, tais-toi, fume et passe
Tu perds la tête pour l'pes, tu perds la tête pour des hoes
On voit pas tout en rose, on les malmène, t'inquiète, on les arrose
J'suis explicite, j'fais pas d'charade, le caisson bat à la chamade
J'les vois, ils tracent leur chemin, ils tracent, ils rasent les façades
On arrive, ils vont déguerpir, c'est quoi l'pire ? Ils fument du tamien à vomir
Ta go t'fait des câlins, mais pendant c'temps, elle m'fait des sourires
J'suis toujours sur FIFA 17, j'soulève pas d'gos qui s'tapent comme C-18
Même pour dormir, j'porte l'amulette, avec mes dents, j'arrache sa nuisette
Pour percer l'ouverture, avec mes chicos, j'arrache sa nuisette
J'remets mon survêt et mes chaussures, puis j'me barre en scred' par la f'nêtre

[Couplet 2 : Mazoo]
Ferme ta gueule si t'es pas le bienvenu ici, on va tout péter ensemble, on parlera pas deux langues
La gue-dro, les billets, le service est donné, on t'pointe à la lame, t'as qu'à donner l'alarme
Maintenant, on parle à voix haute, attends, discret jusqu'au bout on va réussir sans leur dos
C'est du lean, pas lactose, y a du pain galactique, y en a plein qu'ont la trique, uh
Envoie la monnaie, on fait danser tout l'monde comme sur ""Arab Money""
Ta pétasse en monoï, j'ai piné la mono et miné la route, Lyonzon va dîner la croûte
Pour le bordel, fais de la proue à la poupe, ton crew a du toupet, stop
Méfiez-vous, on arrive cheatés, sous lean et toujours sous shit
Mon crew dans l'business, d'autres parlent, cause pas qu'on nous laisse faire
Crois pas qu'on est distraits, hein, j'en vois dix comme nous qui s'dispersent
Faut mater nos bails, après, c'est sûr tu vas t'angoisse, j'embrasse ma lean couleur framboise
Elle reste câline pour l'contrat, woh
You might also like[Couplet 3 : Ashe]
Il joue l'méchant comme Trevor, avec toi, j'y vais très fort
Gars, j'suis en pleine forme, j'fais mes 10k sans effort
J'veux qu'tu t'arraches, tu forces, y a les keufs dans les parages
J'veux 812 dans l'garage et des garants pour l'palace, ha
P'tit, t'as pas l'âge, y a qu'dans ma ville qu'j'me balade
Faut jamais s'fier à l'emballage, t'es un gnou, moi j'suis l'impala, woah
Si ils t'demandent, dis-leur qu'j'suis pas là, ha
C'est l'État qui m'rend malade, woh, attends qu'j'te balafre
Et j'consomme beaucoup, beaucoup à cause des problèmes
Dans l'sip', j'me promène, c'est mon zeub, j'te promets (grave)
Beaucoup d'sirop, wah, ouais, beaucoup d'prometh', ah1Embed"
Lyonzon,2050,"11 Contributors2050 Lyrics[Couplet 1: Ashe 22]
J'perfore les salopes, tire à vue ces petits galopent
J'bombarde dans la loc' bitch, j'remonte la peuf du maroc, bitch
Tu crois qu'on joue, qu'on est marrant, à 16 ans j'visserais tes parents
Faut pas parler avec moi longtemps, si tu veux pas que je fasse monter les montants
A Barca, narco tourisme, j'snap que du gaz dans les storys
J'vise ton pied comme Lanez Tory, la concu tapine comme les bitchs en Estonie
J'veux 600K sur le chèque tu pеux le dire à Sony
Ya la police, tеmpête à la Sonic
J'rafale la prod sa mère la putain et j'essaie de bien la tâcher
J'm'allume tous les jours comme mes cous' au bled qui sont sous cachets
RS elle veut té-mon j'lui dis de s'attacher
Petit, fais pas comme nous ta vie essaie de pas la gâcher

[Refrain: Mini & Gouap]
Sah j'aime trop fumer de la kush, faire du sale, la piner dans la douche
Téma le monde qui pars en couilles, 2050 les pélos vont accouch'
Sah j'aime trop fumer de la gelato ice o'lator dans le congélateur
Téma la go parle comme un boy fais trop la belle nique sa mère on la couche
Sah j'aime trop fumer de la kush
Sah j'aime trop fumer Gelato
Sah j'aime trop fumer de la kush ice o'lator  dans le congélateur
Sah j'aime trop fumer de la kush
Sah j'aime trop fumer Gelato

[Couplet 2: Noma]
Ramène ta teuch plus souvent et, fais pas la meuf qui sort de couvent et
Là pour S.U.V. toit ouvrant et, Lyonzon c'est mouvementé
Meilleur shit meilleure beuh, bosse dûr sont meilleurs qu'eux
Veulent tout savoir sont trop curieux, jfume du filtré qui sort de Turin
Attrape des bretz et des curlys, tartine la wax comme du coulis
Meuf attaquante dans le lobby
Gros fumigène dans le gourbi, euphon, tosen' se dégoupille
Faites pas les fans ni les groupies
Et ce qu'ils font cest pas ouf, charbonneur livreur en roof
Si t'es le sang je te couvre, et ma cachette ils ont trouvé
D'la Bruce Banner tout, tout vert, ils l'ont fait donc je peux le faire
On t'a hagar j'en suis pas fier, toute l'équipe à sali sa paire
You might also like[Refrain: Mini & Gouap]
Sah j'aime trop fumer de la kush, faire du sale, la piner dans la douche
Téma le monde qui pars en couilles, 2050 les pélos vont accouch'
Sah j'aime trop fumer de la gelato ice o'lator  dans le congélateur
Téma la go parle comme un boy fais trop la belle nique sa mère on la couche
Sah j'aime trop fumer de la kush
Sah j'aime trop fumer Gelato
Sah j'aime trop fumer de la kush ice o'lator  dans le congélateur
Sah j'aime trop fumer de la kush
Sah j'aime trop fumer Gelato

[Couplet 3: BU$HI]
Ta baby mama te mens elle sait bien j'suis qui, j'te sers la main après j'm'esssuie
Bu$hi faut qu't'arrêtes de fumer du shit, jamais on s'arrêtera de flairer le fric
Vole comme Kobe, j'les jette c'est des déchets, pas de Beethoven sur le piano là c'est GG
Crois-moi je suis pressé d'engraisser mes poches, d'enrichir mes proches, là j'suis lowkey à Foch
Cette salope me texte, j'lui ai lâché un next si j'la baise elle va croire que c'est mon ex
Elle va dire à ses potes que j'ai claqué ses fesses, mon négro
Y'a que la thune qui fait danser mon égo
Ca veut graille ils ont déjà rempli le frigo, elle veut qu'on s'emboîte comme des Lego
Y'a le RTT faut que tu roules ton teh, j'suis sur Saturne, j'suis pas sur la terre
Et ils font comme nous poto j'descends le faire pour l'argent je suis comme un chien j'ai du flair
Y'a le RTT faut que tu roules ton teh, j'suis sur Saturne, j'suis pas sur la terre
Et ils font comme nous poto j'descends le faire pour l'argent je suis comme un chien j'ai du flairEmbed"
Lyonzon,32 dents,"5 Contributors32 dents Lyrics[Paroles de ""Trente-deux dents""]

[Intro : Gouap]
Les valeurs avant tout, j'ai trop d'amour pour mes frères

[Couplet 1 : Gouap]
Les valeurs avant tout, j'ai trop d'amour pour mes frères
Mon lobby, tu l'loges, tu l'déplaces, tu paies les frais
Non, salope, c'est pas cher, quand tu parles, respecte-nous
Salope, c'est beaucoup mieux quand tu me suces à genoux
J'suis dans la maisonnette avec Bu$hi et Mano
Mettez-la en veilleuse, vous, vous êtes bons qu'à boucham
Elle me demande j'ai combien d'cordes à mon arc
Combien d'flèches à tirer, si par l'succès j'suis attiré
Et vu qu'rien n'me fait peur, elle connaît mes textes par cœur
J'vais la baffer, elle a mis mon cup par terre
J'vais pas fumer sur ton joint, toi tu connais pas l'teh
Pour t'faire des prods, non, falafel, j'ai pas l'temps

[Refrain : Mano]
Lyonzon trop présent, t'offre ça comme présent
Pogo 32 dents, vend la came sans faire de don
C'qu'on fait, c'est pas ton dos, sache, petit, j'ai pas ton temps
Mental de Vegeta, tous mes potes sont pas contents

[Couplet 2 : Mano]
Démarre au start and stop, passe pas d'rapports
Elle cherche un rappeur pour sexuel rapport
La tape fait du bruit, c'que les médias rapportent
Au rap game, fraîcheur on apporte
Deux doigts, l'entrée d'sa chatte j'tapote
[?]
T'attends, t'écartes, la tape, tu cop
Piraterie, pas d'autre méthode
J'téma les hommes, plus rien n'm'étonne
Elle fait du charme juste pour consomme
Sous hasch, sous purpp, plus rien n'fonctionne
Des skelay shits, j'en chie des tonnes
You might also like[Refrain : Mano]
Lyonzon trop présent, t'offre ça comme présent
Pogo 32 dents, vend la came sans faire de don
C'qu'on fait, c'est pas ton dos, sache, petit, j'ai pas ton temps
Mental de Vegeta, tous mes potes sont pas contents

[Couplet 3 : BU$HI]
Pull up sur ces négros, ils sont faibles, il savent pas rapper
C'est pas l'heure pour se laisser faire aux States, j't'aurais pas loupé
On sait qu'il faut tirer, que ça fait mal, je le fais mieux qu'toi
Toi, habille ta putain en Puma, yeah
J'écoute du Ruki, je cons', yeah, mon négro, j'suis l'roi des ronces, yeah
J'ai vu des crânes qui tombent, yeah, coup d'machette dans sa tronche, yeah
J'aime bien ma meuf, mais j'veux asiat' qui dit : ""ni hao""
Quand j'sors de sa fouf, j'dis qu'c'est une pouffe, en vrai, j'suis un cow-boy, j'crie : ""yeehaw !""
Toujours ce négro des îles, sauf que maintenant j'suis dans la ville
Sale raciste, ouais, j'suis dans ta fille, t'auras plein d'enfants métisses
[?] chez toi mais en vrai, tu les kiffes, pas vrai ?
Plus fort que toi donc c'est mieux que tu disparais

[Refrain : Mano]
Lyonzon trop présent, t'offre ça comme présent
Pogo 32 dents, vend la came sans faire de don
C'qu'on fait, c'est pas ton dos, sache, petit, j'ai pas ton temps
Mental de Vegeta, tous mes potes sont pas contents
Lyonzon trop présent, t'offre ça comme présent
Pogo 32 dents, vend la came sans faire de don
C'qu'on fait, c'est pas ton dos, sache, petit, j'ai pas ton temps
Mental de Vegeta, tous mes potes sont pas contents
Lyonzon trop présent, t'offre ça comme présent
Pogo 32 dents, vend la came sans faire de don
C'qu'on fait, c'est pas ton dos, sache, petit, j'ai pas ton temps
Mental de Vegeta, tous mes potes sont pas contentsEmbed"
Lyonzon,4x4,"2 Contributors4x4 Lyrics[Intro : Samourai]
Yah, yah (woh), woh
Gouap, Samourai, woh, Lyonzon, Lyonzon (sur le 808)
Sur le 808 (Lyonzon, Lyonzon, Lyonzon, woh, woh)

[Couplet unique : Samourai & Gouap]
Sur le 808, y a ma voix qui se pose
On s'ressemble pas tout nous oppose, woh
Sur l'808, sur la prod à Gouapo
Oui c'est rhall, Lyonzon déboule, met la dose, woh, (oh)
Y avait les condés dans la rue, du coup j'm'en vais rouler aux Pièces
J'croise Sama So sur l'baby, Samourai qui renseigne des cli'
Parle pas vintage avec nous, des quais du Rhône à Sans-Souç'
Elle a pas d'âme, bouffe pas la fouffe de cette rousse
J'me sens comme Gouap, cons' dans les doigts
J'me sens comme Touareg ou comme Gorgeous sans durag
Et on a les plugs pour ceux qui veulent, tu connais l'entourage
Tu suces pour pop, c'est vraiment dommage (eh)
Beaucoup nous sucent (oh), je comprends (eh)
Mais je sais que tu n'es qu'un charlatan
Que ça pop pour mes potes, c'que j'attends
J'suis dans Maisonnette et j'fourre ta tante (yah, yah, yah)
25 titres, pour nous, c'est trop easy
Lyonzon, pas d'flemme, on a grave l'envie, ride comme Atlantis
Tu veux choper la technique, oui, attends deu-spi
On va piner ta petite, on va piner ta petite
Pour conclure, j'dirais juste qu'on est au-dessus
J'suis dans la sip et j'leur laisse leur eau d'vie
Eh, oh, ah, eh, oh (skelay)
T'y arriv'ras p't'être dans une autre vie, pan (skelay)You might also likeEmbed"
Lyonzon,669,"74 Contributors669 Lyrics[Paroles de ""669"" ft. 667]

[Intro: Mini]
Lyonzon, RTT, 667, eh
(Lyonzon, RTT, 667, eh)

[Couplet 1 : Mini]
Ratio toujours dans le positif
Ça m'a fané qu'tu m'suces, j'change de position
J'veux plus d'une pute possessive
La faire à la zeub, c'est la solution
Prépare bien les apéritifs
Et t'inquiète, j'm'occupe de la finition
Fuck ceux qui retournent leur veston
Sans pitié, les falas j'laisse tomb'
La beuh, le teh comme sédatifs
T'es pas le sang, t'as l'sida type
Remballe ton com, ta synthétique
Petit cli' veut pas d'fume mais d'la cocaïne
Téma tous ces types (types), sah, c'est pathétique (tique)
Si c'est pas skelay shit, tu connais, pélo, j'écoute pas ces p'tits

[Couplet 2 : Slim C]
667 avec le RT gro-né
Pop solo où sont nos RT gro-né ?
J'suis pas hautain mais j'suis perché gro-né
Fuck le RG, fuck le clergé gro-né
Pourquoi tu flex si vous perdez gro-né ?
Caca d'chameau avec la Philippe Mo'
Gouttes sur le beat, y a genre six litres d'eau
J'viens pour un mini-temps, chop, tise puis on quitte illico
Bitch, j'ai une armée, pute, elle est armée
Chop est affamé, faut qu'il jeûne, peut pas nous charmer
Direct du stud', bitch, bendo stud', bitch
Fuck tous ces fufu, sont tous faux, c'est pour ça qu'ils chutent vite
You might also like[Couplet 3 : Ashe]
J'suis avec deux-trois potos (potes)
J'suis avec deux-trois pétasses
Toute la journée, tu parles de s'mi-auto
Négro, vas-y, décale
Tu sais bien qu'nous et toi, c'est pas égal
Putain, dégage de là
Tout va bien si y a du sirop
Ramène ton cul, j'lui fais danser l'C-Walk
La beuh, j'la pèse
Ta go la pute, jamais j'la baise
J'en roule deux qui m'apaisent
Viens au contact t'faire gonfler tes trapèzes, boy
Si t'écoutes LY, monte un peu le volume
J'évolue dans un monde de 'loss, c'est pas moi qui l'a voulu, woh

[Couplet 4 : Doc OVG]
667, Lyonzon, 4-4-2 dans la maison piège
Full de juice dans la boisson, j'deviens slow à cause du Euphon, frère
Pas l'temps pour les falas, j'sors le SCAR-H, j'change les paramètres
OVG Doc dans l'vaisseau, faut les pesos, y en a trop à faire, eh
Si j'te gifle, tu d'viens pâle, main d'maçon, ça fait mal
OV Doc, j'ai la dalle, toujours furtif avec la balle
Tu sais pas pilot' en première, tu cales
Tu t'prends revers, la bastos fait mal
Libérez Ralo, libérez Nine
Remplis l'cargo, remplis la malle, 667
[Couplet 5 : Gouap]
Venez, bande de salopes, j'tape un tac' escalope
Arah, fufu galope, Nina l'zizi galoche
J'suis dans la sip', non, j'suis pas galant, backwoods pendant l'gala
Sur l'terrain, tu perds ton talon quand j'te tacle comme Gallas
Ça fait des rotations, charge avant la location
Fais un bisou d'ma part à ta mère à l'occasion, eh
Skelaygang, marche avec la secte
C'est nous les stars du Cloud, arah, Lyonzon, le 667

[Couplet 6 : Kpri]
Sous pasta jaune, ton daron est sous pastis
Protégé, j'porte le talisman
C'qui m'colle aux doigts, c'est pas du réglisse
C'qui t'colle aux dents, c'est pas ma pisse
Mano met la beuh dans l'backwoods
Y a des miettes de beuh dans l'hoodie
Laisse-les, c'est des rookies
J'veux mon blaze sous ma paire comme Woody
Fessées sur sa croupe, sirop dans la coupe, le lin m'inonde
Cerveau fracassé comme ton pare-brise pendant la coupe du monde
Lyonzon, 667, la pute la gobe comme une sucette
On pense pas au succès, on transfère le lin dans des éprouvettes

[Couplet 7 : Freeze Corleone]
Négro, dès qu'j'pull up à Lyonzon : ""brr brr, allô Gouapato""
Fonscar dans l'lin, j'vois pas trop, 667, RTT, trop d'flow, négro, il t'faut trois bateaux
J'cons' v'la d'carburant, négro, j'ai les régimes aux Pontiac
Tous les jours, j'pop v'la d'médoc comme si j'étais hypocondriaque
Ekip, à propos des chiffres, négro, comme des banquiers suisses
Tout pour la famille, pour qu'mes enfants vivent comme des rentiers juifs
Négro, j'arrive tatoué comme un membre de la MS-18
Killu à vie, nique un franc, négro, nique un missile SS-18
EKIP
[Couplet 8 : Mano]
Le délire est sérieux, leur envoie des séries (boom boom boom)
J'ai la beuh, le sérum quand tu tournes au rhum
On est beaucoup, on t'a pas dit, envoie mapé', wari
Casse les couilles, j'suis rhalli, 5-45 sur la ligne
Lyonzon gang, tu valides, plusieurs techniques on manie
La folie de Tony et le charme de Manny
Cambrure hydraulique, ses cheveux sentent honey
J'la pull up au tel-hô, elle crie à l'agonie5Embed"
Lyonzon,6x3x4,"2 Contributors6x3x4 Lyrics[Couplet 1 : Jolly]
Fumo non stop, sono fucked up
Se corro dietro i soldi, dietro avrò i cops
Sognavo lambo figa in una villa come in candy shop
Farò di tutto per avere la guardia come ?

[Couplet 2 : Noma]
J'voulais plus, elle dit non, comportement en dit long
[?], t'es surpris, p'tit con (hein)
Sur l'terrain, mets p'tit pont, m'en tape de c'qu'ils font
J'ai la beuh, le pilon, cherche le meilleur filon

[Couplet 3 : Gouap]
J'fais une prod sur Instagram en live, j'like pas des culs
Me demande pas en feat frère si t'as pas d'écu, frère
Raconte moi pas ta vie, fala, j'sais qu't'as pas l'vécu
Fala, éloigne-toi d'nos regards si ta bouche à merde pue du cul

[Couplet 4 : Vitolo]
J'arrive en Nike fit serré au niveau de la ceinture
Mon fute je le baisse pas
Vito tireur d'élite précis, vise au-dessus de la ceinture
Même avec le temps, ma vie ne baisse pas

[Couplet 5 : Mini]
Eh, attache tes lacets, attache ton string
Dans l'turn up, c'est impossible d'calmer mes singes
Des p'tits cli' d'CC, maintenant c'est la sip
Le g à 30, imagine quand j'en vends 15
You might also like[Couplet 6 : Gorgeous]
On s'en fout d'ton buzz, on s'en font d'ton beurre
On explose la basse pendant qu'ta meuf enchaîne les passes
On s'en fout d'ta peuf, on s'en fout d'sa fouffe
Remballe vite ta gueule ou nous on t'la fait à la fou

[Couplet 7 : Jolly]
Spendo tempo juice, casse moi pas les couilles
Si vede che non sei un uomo da come fumi
Oddio sono groovy, la nostra vita è un movie
Scrivo e mi circondò di verde come cookie

[Couplet 8 : Noma]
Tape l'Euphon, réveil tête dans l'fion
Contrôle la zone et ses environs
Quand ça va pop, ils verront bien
De gas fais le plein, j'me plains pas tant qu'j'fais mon pain

[Couplet 9 : Gouap]
Et la péniche n'atteint jamais le port
J'te laisse couler, que Lyonzon dans l'bateau d'sauvetage
T'avais un rêve dans ta vie, t'as abandonné, c'est dommage
Moi j'aime ma vie tous les jours, à l'état sauvage

[Couplet 10 : Vitolo]
Gouapo/Rolla tous les jours de la semaine
Lyonzon en concert, c'est savage
Parler à Dieu, y a qu'ça qui m'aide
[?] puissance 10 000 dans les backstages
[Couplet 11 : Mini]
Bénéf' max, m'endormir sur mon biff
T'es pas le sang, fils de, tout l'temps tu fais la passe
Venez, venez [?] si y a la tise
Si t'as le kit, si t'as la lean

[Couplet 12 : Gorgeous]
Devant les Pièces, posé comme un gangster
Reste dans ton stress, Lyonzon bientôt sur les posters
Tourne la page vite, c'est fini vos rappeurs au même flow
Attends qu'la pièce soit vide ou viens dans l'allée, fais pas l'pelo

[Couplet 13 : Jolly]
L'apparenza inganna, i G dentro la stanza
Una ne gira l'altra, in giro troppo blabla
Finire X, racconto la mia rabbia
Racconto la mia rabbia, racconto la mia rabbia

[Couplet 14 : Noma]
Dillué, dillué, le lean est dillué (skelay)
J'suis dans l'appart, j'sais plus où m'situer
Tu m'tends ta patte, me demande qui tu es
On m'a volé ma flamme, me demande qui tu es

[Couplet 15 : Gouap]
[?]
J'me sens comme Mini quand j'dis à la pute : ""[?]""
Mon petit, pour tout savoir, j'ai l'Draco ou l'Kalash
Mais ne loupe pas [?], j'vais devoir exploser sa ganache
[Couplet 16 : Vitolo]
J'arrive drip comme la baleine, concu' balaye, le reste balec
Grosse peuf comme Ballack
J'arrive drip comme un squale, t'as pas ta place mais tu squattes
J'fais des sourires, j'ai des scars (p'tite meuf qui fait des squats)

[Couplet 17 : Mini]
Viens pas enquille, on est déjà 14 sur la file
Nique ta mère si tu viens parler que pour d'la fume
T'as d'la kick, mon numéro jamais j'te l'file
Jamais d'la vie, [?] ta fille

[Couplet 18 : Gorgeous]
Lyonzon te fait peur, Lyonzon te fait peur
Lyonzon te fait bugger, on viens sur tes terres, on est chez ton père
Je peux fucked up ton papa, [?] et finir mon teh
Finir fucked up, Lyonzon te fait peur, han, Lyonzon te fait peur

[Outro : Gorgeous]
Lyonzon te fait peur, han, Lyonzon te fait peur
Lyonzon te fait peur, han, Lyonzon te fait peur
Lyonzon te fait peur, han, Lyonzon te fait peur
Lyonzon te fait peur, han, Lyonzon te fait peurEmbed"
Lyonzon,Action Man,"5 ContributorsAction Man Lyrics[Paroles de ""Action Man""]

[Couplet 1 : Jolly]
A retranscrire

[Couplet 2 : Vitolo]
On va pas sampler Pokemon juste pour faire plaisir à ces faux garçon,(eh)
T'emporte mais vous rappez pas trop comme des garçons
J'vous écoute à peine comme un ""pardon""
J'suis un rital, le tacle est rude, moi j'ai pas peur de prendre un carton
T-Toi toi tu sort du lycée, direct parle de charbon
Toi t'es refoulé même de la part de tes potes, gros t'es un pelo en carton
Et je peux pas me dikave ses actions sont amovibles comme Action Man
Nous provoque un rire et puis de la peine, un fou rire, j'en dors pas de la semaine
Un sacré contrôle sa mère, je l'avais pas mit dans la semaine
[?] il fume un teh
Deux semi je vois la scène
Parle pas trop chin' ça se sent
Laisse le temps faire, tout se sait
Et nos sons faut que tu les saignes
Lyonzon le gang

[Couplet 3 : Gouap]
On reçoit des colis,(eh)
Le genre de colis qui te font coller
J'aime pas l'alcool, j'suis dans la sip' , j'suis dans la dro-gue
Tu connais la [?]
Nina ferme-là, fais pas ta folle
Le xan' et la lean;
C'est au dessus de ma [?] que je vole
J'vois le bien, le mal
Ces mecs en chien ont trop la dalle
Fala avale, (eh)
C'est sur le cul de Nina que j'm'affale. (eh)
You might also like[Couplet 4 : Noma]
J'veux le marron ou la verte, il s'avère que j'ai les deux
Après qu'elle est finie son flash, cette pute fera pas long feu
Et j'suis pas de ceux qui trahissent leurs potes pour me faire de [?]
J'ai pas besoin de ça, dans sa chatte je sors j'vais faire du sale
C'est entretenu
Elle fait des squats, j'suis a la salle ou dans le square
Les gars m’appellent, ""Qu'est ce que ça fait ce soir ?""
Ça va pilonner, plein de lean on met, plein dans la cup on met
Bois pas de Champomy (nan)
Livraison colis avec l'acolyte
Coup de [?]
Teh c'est de la crème, ma wax fait couler
Il me restait un peu, bats les c' j'ai tout mit1Embed"
Lyonzon,Adriana Lima,"1 ContributorAdriana Lima Lyrics[Paroles de ""Adriana Lima""]

[Intro : Mazoo]
Han, han ,yeah, yeah
Han, hmm, yeah

[Couplet 1 : Mazoo]
On s'alimente, on arrive t'es dispensé
En s'allumant, t'éviteras d'te disperser
J'en vois 10 comme lui en plus s'habille en fille la nuit
La fume un gros budget, mon but c'est d'être le boss
[?] par la tête mais qu'est ce tu fous ?
On se drogue, pas d'mal, qu'est ce tu joues
Sortir que le jour, coloc' sombre c'est comme un four
Du pouvoir pour les faibles d'esprit
On est cozy, toi t'es sale [?] la prod
Ton rap il pue sa mère fuck
J'veux pas d'taudis, ni d'ton Audi, là j'suis focus dans la drogue
Mets pas d'dollars dans la merde, mets pas ton nez dans la neige
C'est pas un polar, connard

[Coupet 2 : Gouap]
Oh, hey
Lui c'était mon ami (lui c'était mon ami)
Hier, aujourd'hui c'te pute porte l'œil, oh
J'espère qu'elles atteignent le ciel nos prières
J'peux pas savoir la deuxième date qu'y'aura sur mon cercuei, oh
J'compterai jamais sur un fils de pute
Si ça pop, l'argent hram [?] les putes, hey
Lyonzon, lobby, gang, gang
Amis, non, dans l'jeu c'est que des putes, oh
Et là, j'fais un baby aux Pièces
J'essaie foulard Hermès, vintage est l'polo Hermès
Oh, hey, font la mala, la molly
Oh, hey, pour la péniche les mollets
You might also like[Couplet 3 : Gorjuice]
Ça déboule vif à 4 heure 42
Pendant qu'tu rêves d'Adriana Lima
Tu crois t'as l'pouvoir parce que t'as un schlass
Il cherche des failles comme si c'était un jeu
Gouapo, Mazoo, Gorjuice dans la vibe
Ganja dans la poche ça roule un bail, oh, yo
Ça fait yo, ho, monter dessus yo, hey
C'est la mission, pull up du sud à Clio, hey
Slide, sur gla-glace vif comme Sub-Zero, hey, yah
Tu forces t'as pris, du sucre, zéro pop héro', hey
Ganja yo, wah, j'pose mon cuir j'suis yo, hey
Ganja yo, wah, j'pose mon cuir j'suis yo, heyEmbed"
