Artist,Title,Lyrics
Lyonzon,Perdu Mon Shit,"10 ContributorsPerdu Mon Shit Lyrics[Paroles de ""Perdu Mon Shit"" ft. Dil]

[Couplet 1 : So Sama]
Wow, laissez passer, laissez passer, bande de salopes
J'ai pas l'temps pour les allocs, collectionne les beaux objets
Toujours partant, Lyonzon dans ta party
C'est fini pour la concu', t'as un gros cul mais c'est pas assez
Tu t'fais chasser, ta peau s'fait dépecer
J'viens dépuceler vos pussys, depuis, l'temps est passé
Niquer des mères, c'est la base, tu fais l'dingue, on t'sort la batte
[?] à 500 barres, fuck, ça finit khabat
""Sama So, comment fais-tu pour être aussi fluide ?""
J'mange ta chatte, des légumes et cinq ou six fruits
Toute notre gloire est collective, Lyonzon sur tes collègues tire
V'la les tchoins sont connectées, j'me rappelle des palettes hier

[Refrain : Mazoo]
Putain d'merde, j'ai perdu mon shit
Putain d'merde, j'ai perdu mon shit
Putain d'merde, j'ai perdu mon shit
Putain d'merde, j'ai perdu mon shit

[Couplet 2 : Mazoo]
D'plus en plus de faggets, j'en vois partout, sa mère
""Qu'est-ce tu fait dans la ive ?"" J'fait tout pour pas être toi
J'fais du zéro à huit, contrôle tous les navires
J'vois ta pétasse ravie d'arriver, j'lui pète son cavu
Ah, j'sais pas si ta vu, ici personne f'ra la passe
Tu fais crari des vues mais t'achètes pas plus qu'un tacos
T'es pas dans l'beat, c'est pas possible
Faudra bien plus que l'argent pour combler ton manque de talent
Mets des baffes à tes parents et ta pute j'lui donnerai pas rencard
Rien à foutre d’être marrant car elle sucera pas mes potes ensuite
J'suis dans la suite, mes textes vexent ta pétasse blanche, oh
Tu prend la fuite déter', next ton visage d'ange, oh
You might also like[Refrain : Mazoo]
Putain d'merde, j'ai perdu mon shit
Putain d'merde, j'ai perdu mon shit
Putain d'merde, j'ai perdu mon shit
Putain d'merde, j'ai perdu mon shit

[Couplet 3 : Dil]
J'aime beaucoup les animaux mais pas cette chienne, on n'est pas les mêmes
J'ai d'la bonne drogue donc j'me fucked up comme mes gars du tieks
D'toute façon, j'me défonce tout les jours, les poulets tournent
Claque devant la bouche et son cul il bouge
Pour une bouchée dans un double-cheese
J'suis dans mon block avec mes potes, fils de pute, ta mère l'escorte
J'garde plus de psychotropes que les Télétubbies
Fuck la télé, sur scène, fauche, c'est la mêlée
J'mets d'la couleur dans mes cheveux, mamie croit qu'j'suis fêlé
Putain d'merde, j'ai perdu mon shit
Ta mère la pute tricote pas qu'des pulls en cachemire
La vie c'est dur comme ma bite le matin

[Refrain : Mazoo]
Putain d'merde, j'ai perdu mon shit
Putain d'merde, j'ai perdu mon shit
Putain d'merde, j'ai perdu mon shit
Putain d'merde, j'ai perdu mon shit
[Couplet 4 : Kpri]
Clopes-feuilles chez le pak', clopes-feuilles chez le pak'
Clopes-feuilles chez le pak', clopes-feuilles chez le pak'
Tu veux t'dépuceler ? Viens, j'te tacle
J'rentre dans la classe, cons' dans l'sac
La Marquise beau-, la Marquise, beaucoup sur scène, fait bouger l'paquebot
La Guillo', j'sors du métro, à cinq, j'achète un paco
Cette pute m'a fait suer, son mac la fait sucer
Ta go kiffe me choyer, j'ai mon lean et mes blunts pour festoyer
Reste loyal quand on t'pousse sur scène et qu'tu tombe comme une merde
Piétiné par toute une foule comme un nerd
Pendant la nuit, smoke la verte et j'allume un teh à la gare
Putain d'merde, j'ai perdu mon shleh

[Pont : Kpri]
Perdu mon shit (perdu mon shit), eh, eh
Perdu mon shit, eh
J'ai perdu mon shit (j'ai perdu mon shit)
Perdu mon shit, eh

[Refrain : Mazoo, Kpri & So Sama]
Putain d'merde, j'ai perdu mon shit (perdu mon shit)
Putain d'merde, j'ai perdu mon shit (perdu mon shit)
Putain d'merde, j'ai perdu mon shit (perdu mon shit)
Putain d'merde, j'ai perdu mon shit (il est où mon shit ?)
Putain d'merde, j'ai perdu mon shit
Putain d'merde, j'ai perdu mon shit (putain d'merde)
Putain d'merde, j'ai perdu mon shit (vas-y, il est où ?)
Putain d'merde, j'ai perdu mon shit
[Outro : Dil]
Putain d'merde, j'ai perdu mon shit
Perdu mon shit, j'ai, j'ai perdu mon shit
Putain d'merde, j'ai perdu mon shit
Perdu mon shit, j'ai, j'ai perdu mon shit2Embed"
Lyonzon,Petite fée,"3 ContributorsPetite fée Lyrics[Couplet 1 : Mazoo]

Tu t'rappelles de toi, t'es dynamique
J'ai les yeux fermés encore
On mériterait encore un tour
Même si j'ai l'air court
Si j'élève laisser l'épidémie de nouveaux kickers
Savent pas s'écouter, c'est dommage
Pas dommage, j'tourne la page
Ça ça vous arrivera par la suite
Tu n'es qu'un ? si t'achète de la beuh sur des sites
Et t'as l'air sur et si t'es allé faire souffrir
Ou me faire sourire
T'essaie d'paraître toi ou comparer à qui c'est pas possible
On a du quitter des te-pus qui tapine
Me barrer en loucedé, j'ai plié les machines
Fait briller la magie comme une petite fée
On aura pas sucé

[Refrain :Mazoo ]
Manie la magie
Comme une petite fée
On aura pas sucé
On aura pas sucé
Manie la magie
Comme une petite fée
On aura pas sucé
On aura pas sucé
You might also like[Couplet 2 : Jolly]
Hola, Bitch Hola
Ho mollato scuola
Dietro i soldi e la droga
Fai uno squillo, sono in zona
Mi chiama dopo l'ora, so cio' l'erba troppo buona
Parli troppo dai veddiamo, siamo sei vestiamo camo
I tuoi occhi sulla ferragamo
Davanti alla squadra, fai il bravo *nah nah, nah nah*
Mi scopo l'amica di lala
La tua tipa quanto blabla
Fumo questa cioccolata
Resto solo con la fafa
[?] proprio come questa kush
Senza [?]

[Refrain : Mazoo]
Manie la magie
Comme une petite fée
On aura pas sucé
On aura pas sucé
Manie la magie
Comme une petite fée
On aura pas sucé
On aura pas sucé
Manie la magie
Comme une petite fée
Comme une petite fée
On aura pas sucé
Lyonzon Lyonzon
Manie la magie
Comme une petite fée
On aura pas sucéEmbed"
Lyonzon,Picore,2 ContributorsPicore Lyrics[à retranscrire]You might also likeEmbed
Lyonzon,Plan Data,"2 ContributorsPlan Data Lyrics[Intro: BU$HI]
Yeah-ah
J'me sens à Hollywood, yeah-ah
Ah-ah, yeah-ah-ah
Yeah-ah

[Couplet 1: BU$HI]
Qui c'est qui frappe à la porte ?
Le succès, le biffton, la côte monte
Les salopes, le champagne, la drogue, aussi (la drogue aussi)
Han, le profil est plus beau c'est possible, sache
Qu'un téléphone ne donnera jamais la vraie odeur ni la vraie couleur d'sa pussy, han
Hmm, donc pour moi c'est poussière (pour moi c'est poussière)
Toi t'as 25 piges, t'attends qu'la collégienne elle poussе pour pouvoir l'épouser (pour pouvoir l'épouser)
J'aime pas lеs gens (j'aime pas les gens), j'aime bien les blanches (j'aime bien les blanches)
J'aime pas les grosses (j'aime pas les grosses), mais j'veux qu'elles dansent (mais j'veux qu'elles dansent), ha ha
J'ai d'la drogue, yeah, j'me sens à Hollywood
T'y as un bisou sur la joue, pour un centième rendez-vous, yeah
Rendez-vous compte que Lyonzon arrive fort
Pour les blondes, les asiat' et les femmes fortes, han-an (hehe)

[Pont: Mazoo]
Yeah, yeah
Yeah, yeah
Yeah (yeah)
You might also like[Couplet 2: Mazoo]
Maintenant j'pense à mon équipe (à mon équipe), et à moi (et à moi)
Tu veux piquer ce qu'on a, tu n'as pas ton art
C'est naze, ouais, t'es naze
Dans ta pute je nage, grosse tâche on s'fache
Eh Maz dans tes phases , tu vas pas mentir à tous ces gens
De manière intelligente, on a verte dans l'sang
On s'réunit, un plan d'attaque, [pas d'aventure parentale ?]
Han, yeah yeah, yeah
Les parasites m'intéressent plus, tu veux gratter dans mon stud'
Comment oses-tu ? Ca c'est posthume
Dans la voiture on t'a [?], et là c'est tout, on la consomme
Maintenant c'qu'on veut c'est la somme (hein)Embed"
Lyonzon,Police,"8 ContributorsPolice Lyrics[Paroles de ""Police""]

[Couplet 1, Kpri]
J'sers un verre nan c'est pas du label
Booska j'réponds toujours à l'appel
On marque du premier coup pas de revanche ni la belle
Chefs des longueurs du voit c'est laquelle
Depuis qu'elle monte, t'sais qu'on pète la table
On a presque répliqué s'qui faut sur la table
Ceinture en ce moment j'suis de moins en moins matinal
Il nous fait le têtu il verra bien au final
J'descends en Espagne sur l'trajet j'tue la miel
Il retient les leçons que quand ça finis mal
Ils sont capables de tout, ils nous ont confinés
Ils savent que [?] médias et presse
24/7 on zone chargés sans stress
En état d'ivresse

[Refrain, Gouap]
Rushner comme Flamenco
J'souris comme Doflamingo
Como los rigos
Des tempêtes comme au Rodrigo
Ici y'a rien à manger que des fanta dans le frigo
Trop d'amour pour mes frères, bien plus que pour le fric
Encore un nouveau traite, encore un négro parti
J't'adresse même pas un regard
Si de ma vie j'tai rayé
En tchop on choppe à chaque fois c'est le choc
En tchop on choppe le frozen dans le froc
You might also like[Couplet 2, Mini]
Lyonzon faut paraître carré
Dans la go annonce comme anotari
J'parle français j'écoute jamais de cain-ri
Mais dans le piège bloqué à la Alan karrich
Épuisé tous les jours c'est le rush
C'est des lâche que ils tchoup que ils lèchent
On hésite le miel, la verdure ou la hash
Roule un teh devant la mère sans la hech’
Dormir c'est pour les riches
S/o à tous ceux qui m'écoute quand je dors
Tu va te blesser revite mais du crip
Le vaccin pour la grippe il fait deuh, il fait peur
LZ venu  de remettre de l'ordre
Nouvelle saison, nouvel arc
L'ambiance en mode Flamenco
Ambiance caliente fenevelas

[Refrain, Gouap]
Rushener comme Flamenco
J'souri comme Doflamingo
Como los rigos
Des tempêtes comme au Rodrigo
Ici y'a rien à manger que des fanta dans le frigo
Trop d'amour pour mes frères, bien plus que pour le fric
Encore un nouveau traite, encore un négro parti
J't'adresse même pas un regard
Si de ma vie j'tai rayé
En tchop on choppe à chaque fois c'est le choc
En tchop on choppe le frozen dans le froc
[Couplet 3 : ASHE 22]
Comment tu veux qu'il soit comme nous
Si son daron c'est un flic, (Bitch)
Bitch vrai de vrai depuis longtemps
Moi j'ai jamais écouté Lil Peep
Pour l'argent ils font des petites pipes
Trafic le Wickr bip bip
LZ, la seule équipe type
Hamoush Makab sibsib
Tu sais qu'avec les bleus j'suis impoli
Et que j'ai aucun respect pour la police
J'suis avec une bitch elle a la peau lisse
J'me, j'me balade que dans des bolides
Si tu continue sur toi ça va mettre all-in
Purp, xans, big molly
Une douille à vide tu finis au lit
Kpri, Mini, Gouap, jolly

[Refrain, Gouap]
Cochener comme Flamenco
J'souris comme Doflamingo
Como los rigos
Des tempêtes comme au Rodrigo
Ici y'a rien à manger que des fanta dans le frigo
Trop d'amour pour mes frères, bien plus que pour le fric
Encore un nouveau traite, encore un négro parti
J't'adresse même pas un regard
Si de ma vie j'tai rayer
En tchop on choppe à chaque fois c'est le choc
En tchop on choppe le frozen dans le froc
[Couplet 4 Jolly]
[?]
Plus jamais j'pourrais te faire confianceEmbed"
Lyonzon,Ponce La Cons’,4 ContributorsPonce La Cons’ Lyrics[à retranscrire]You might also likeEmbed
Lyonzon,Psykokwak,"1 ContributorPsykokwak Lyrics[Paroles de ""Psykokwak""]

[Couplet 1 : Samourai]
Cons' la lean, fonce dans la ville, j'suis constant (wouh)
Cons' la lean, fonce dans la ville, toujours conscient (skrrt)
Cons' la lean, fonce dans la ville, j'suis constant (woh, woh woh)
Cons' la lean, fonce dans la ville, toujours conscient (rrah, rrah, rrah, rrah, skrrt)
J'suis tout seul dans la pièce (woh), y a plein d'bitchs dans la pièce (oh yeah)
En vrai j'assure, en vrai j'assure, woh, yeah
On va pas vous rassurer, mais pourquoi tu forces ?
On l'fait sans efforts, le temps bientôt écoulé
On l'fait et puis c'est tout, on s'pose pas d'questions
Toi tu veux des réponses, faut qu'tu t'calmes à présent
Même plus b'soin d'te présenter, on fait c'truc et c'est rentable
Dans la rue, les gens parlent bien (wah), wah

[Refrain : Gorgeous]
Psykokwak attaque
Psykokwak attaque
Psykokwak attaque

[Couplet 2 : Gouap]
Faut qu'j'arrête de cons', j'respire de plus en plus fort (la cons')
Dix piges dans l'teh (teh), cinq dans le lean (lean, lean)
Nina fait des trucs de plus en plus gore (Nina)
Elle m'envoie vidéos quand elles se touche dans son bain, eh
J'prépare bain-marie pour waxer
M'envoie pas tes sons, fala, sont nuls à chier (fala, fala)
Samourai, Gorgeous, harr sur la Gouapo type
On t'fait mal comme [?], il est 17, là faut qu'on s'taille, eh
J'ai perdu mon flow dans un cul, j'ressors de l'eau comme Psykokwak
Sur scène, fout l'feu comme SuperWak, eh
On t'rentre dedans, tu fais l'haka
Toujours faya, j'suis dans la trap comme Walka Sauce
You might also like[Refrain : Gorgeous]
Psykokwak attaque
Psykokwak attaque
Psykokwak attaque

[Couplet 3 : Gorgeous]
J'pose mon goum, stop, et je me demande : ""mais pourquoi t'étais dans ma ive ?""
J'pose mon goum, stop, et je me demande : ""mais pourquoi t'étais si naïve ?""
J'pose mon goum, stop, et je me demande : ""mais pourquoi t'étais dans ma ive ?""
J'pose mon goum, yeah, et je me demande : ""mais pourquoi t'étais si naïve ?"" (eh)
Pose pas d'questions, quand j'suis là, [?] (eh)
Pose pas de questions quand [?], bouffon
Psykokwak attaque, Choc Mental, shoot cette wax (wax)
Psycho Mantis, dernier boss dans Metal Gear Solid (psh, psh)
Solide, j'l'ai défoncée sur le lit (oh yeah)
C'était chaud comme [?]
Elle veut le chocolat, elle sait très bien que c'est harr (harr)
Permission d'écart, j'suis comme un shotta, j'suis comme à Pattaya (psh, psh)Embed"
Lyonzon,Purple Bottle,"4 ContributorsPurple Bottle Lyrics[Paroles ""Purple Bottle"" ft. Lord Fass]

[Intro : Gouap]
Hey, oh, pan pan
Rolla Shit, ahh
Hey, oh
Hey

[Couplet 1 : Gouap]
J'suis faya à la mais', y a plus d'lattes sur le canapé
Cette Nina fait la folle, cette Nina va s'faire kidnapper
Petit [?] veut la drogue, dans ton esprit ça ouvre des portes
J'veux, un kilo d'cali, j'préfère vivre dans la piraterie
Arah, c'est trop marrant, d'voir ces falas faire du shit
Arah, comme ça m'désole  de voir des négros faire les putes (hey)
J'suis sur [?], ma bitch sippin' coconut (hey)
Nina préfère un cachet qu'un [?] (han)
Fait voler la foule, toutes les péniches on les coulent
J'suis plein d'marie-jeanne et j'm'enfume comme un baba cool
Toi, fala tu t'la colle, j'suis frais comme Kiss cool
Dans la sippin' pas d'alcool, y a deux Nina qui [?]
On a les biberons rouges, et le caca doré
Oh, hey, doré, oh, hey
Les bonbons roses, et la kush de Cali

[Couplet 2 : Mazoo]
Yeah, yeah, yeah
J'vais pas t'expliquer deux fois, classique
Vrai gars, hein, j'les calcine (yeah)
Et elle veut nous sucer
J'espère, qu't'es, prêt, on va pas à Disney (nan pétasse)
Lis ça, j'paraîs dans la file, hélàs, pas loin d'être moins honnête
Mon [?] j'vous entends tous (ohh)
J'me défends, juste, ou on descend tous (wooh woh)
C'est même plus des coups d'épée, c'est, trop d'écoutes et tu décèdes
Tu dégoutes et tu fais gêne
C'est pas l'paradis sur terre, comme des parasites au pair
Mon débarras vit ton père (yeah)
Bouge [?], Lyonzon dans la pièce
Toujours dans la pierre (yeah)
Lyonzon dans la pièce (yeah)
You might also like[Couple 3 : Lord Fass]
Si j'suis à genoux c'est qu'j'fais mon lacet gros
Chaud comme brasero, l'écrire comme 3 zéros, les bluff comme Placebo
Au dessus d'leur tête comme une kippa, dans la maison piège comme dans [?]
Pratique kickage comme dans Kick ass, pétasse
Sache que l'équipe est efficace
Khaliss, j'donne pas mon âme pour du khaliss
Même si le vote est unanime, j'mettrai ma lean dans le calice
J'suis du bon coté du calibre (yeah)
J'gravite, j'arrive en [?] comme canif
J'vois tous ces pd qui balise, haschich planqué dans l'fond de la valise (ooh)

[Couplet 4 : Mini]
Dans c'putain d'game j'vais tout baiser
J'suis dans la street sah [?] t'es pd
Nique sa grand-mère d'crier Mayday, vends des casquettes, des t-shirts, des DVD
Trop de potos qui sont bé-tom, sah trop de potos sont décédés
Pine ta besta, et j'baise, tous tes rappeurs préférés
Trop de bâtards dans le club, j'arrête la fumée, j'ai pas, stoppé la clope
Plein de pétasse dans le pub, faut que tu gobes et pas que le, bout de la teub'
Pas encore pop, mais j'sais déjà mes sons ont fait l'tour d'la Terre
Remballe ta [?], ton com', demande aux clients, vends pas d'un teh
C'est R-T-T, pelo roule ton shleh
Change de flow comme change de teh-teh-teh (roule ton teh)
Le double M c'est la meilleure paire-paire-paire
Mini c'est l'sang, Mano c'est l'nerf-nerf-nerfEmbed"
Lyonzon,Range ton tah,"9 ContributorsRange ton tah Lyrics[Paroles de ""Range ton tah""]

[Intro : Azur]
(Harr)
Yeah, yeah, hun, yeah

[Couplet 1 : Azur]
J'veux le yen, j'veux le dollar, j'vais pas parler mandarin
Lyonzon école, fuck ton blunt, faut qu'on t'mette au parfum
Ici c'est trap shit, yeah, tu racontes que des bullshits
Semaine pro en concert dans ta ville, ça devient toxique
Hôtel quatre étoiles, j'me réveille comme dans Kick-Ass, c'est fantastique
Quand j'allume mon phone, j'vois qu'des pétasses remplies d'plastique
Yeah, yeah, hun, à la Guill' comme dans la zone
Tu kiffes, tu cliques, tu t'abonnes, la frappe, c'est ma clique qui la donne
Ah, j'kiffe pas cette pute, c'est pas la bonne
Elle m'a kiffé pour la fame donc j'la prends pour une conne
Ah, j'kiffe pas cette pute, c'est pas la bonne
Elle m'a kiffé pour la fame donc j'la prends pour une conne

[Refrain : Mini]
Tout pété dans l'aqua, fils de, j'pêche pas des thons mais des p'tites chatounes, chatoune, allez, range ton pét'
Dans l'tien, y a qu'du tabac, dans l'mien, le bon, le doux, le goût il chatouille la gorge
Eh, mets tout ça dans l'que-sa, batârd, on est bon qu'à ça, fala
C'est pour ton para qu'tu m'verras prendre des p'tites massa
Là-bas, fais les pesos, regarde, ici c'est moche
Quand j'fais du sale, on m'dit que c'est propre pourtant, pélo, j'écris d'la gauche
You might also like[Couplet 2 : Gouap]
Même de loin, tu vois qu'ici y a zéro falas
Là, j'attrape Nina, Mano passe téléphoner
C'est avec Fanta Citron qu'j'préfère téléphoner
Tu fais qu'raconter tes histoires, j'en ai rien à foutre, fala
En attendant la popance, le Lyonzon maille
Ça fait plus de cash pour moi, j'm'en fous qu'tu t'en ailles
J'tolère plus aucune faille
Un truc de fou comment j'suis allergique aux faibles
Un truc de fou, ta go t'a snitch
P'tit fils de pute qui claque ses alloc' dans des bitchs
Fais cet argent pour la daronne
Fais attention à tes actes pour que Dieu t'pardonne

[Refrain : Mini]
Tout pété dans l'aqua, fils de, j'pêche pas des thons mais des p'tites chatounes, chatoune, allez, range ton pét'
Dans l'tien, y a qu'du tabac, dans l'mien, le bon, le doux, le goût il chatouille la gorge
Eh, mets tout ça dans l'que-sa, batârd, on est bon qu'à ça, fala
C'est pour ton para qu'tu m'verras prendre des p'tites massa
Là-bas, fais les pesos, regarde, ici c'est moche
Quand j'fais du sale, on m'dit que c'est propre pourtant, pélo, j'écris d'la gauche

[Couplet 3 : Mano]
T'veux la guerre, on va t'la faire
T'veux les ous', bitch ass, bah va taffer
Verse tout dans l'gobelet, s'c'était à r'faire, bah, j'le referais
Le Fanta au frais, j'bouge que pour mes re-frés
J'suis dans la ville, j'me pavane, l'ensemble est jdid
Le renoi fait tricker deux-trois tantines
Mais j'ai pas l'temps, bae, j'suis chargé dans le jean
Elle veut être intime, retire même son intima cup
J'vais lui faire du sale, lui souiller tout son make up
Moi j'suis toujours cap, les falas, putos, j'recadre
T'inquiète, y a le jab si ta meuf [?]
T'inquiète, y a le jab si ta meuf [?]
[Refrain : Mini]
Tout pété dans l'aqua, fils de, j'pêche pas des thons mais des p'tites chatounes, chatoune, allez, range ton pét'
Dans l'tien, y a qu'du tabac, dans l'mien, le bon, le doux, le goût il chatouille la gorge
Eh, mets tout ça dans l'que-sa, batârd, on est bon qu'à ça, fala
C'est pour ton para qu'tu m'verras prendre des p'tites massa
Là-bas, fais les pesos, regarde, ici c'est moche
Quand j'fais du sale, on m'dit que c'est propre pourtant, pélo, j'écris d'la gaucheEmbed"
Lyonzon,Recette,3 ContributorsRecette Lyrics[à retranscrire]You might also likeEmbed
Lyonzon,Respect P. Diddy,"4 ContributorsRespect P. Diddy Lyrics[Paroles de ""Respect P. Diddy""]

[Intro : Gouap]
Eyh oh Eyh
Ouuuuaaaaahhh

[Couplet 1 : Gouap]
Parle en cash avec nous
D'ici deux piges tu pourras plus prendre des photos d'mon lobby
Pour l'instant tu peux m'voir dans l'bus
J'suis plus faya à force de la consomm' tous les jours
J'ai des plugs qui passent à la mais'
Toi tu fais [?] dans le four
Hey pan hey pan laylay pan
Dans la soirée Nina des zizis [?] elle en gobe 30
J'suis sur ma propre prod je m'amuse beaucoup
Fala parle mal, fala graille un coup d'coude
Coupé décalé comme Douk Saga
Free Gouap tu suis la saga
Summum Roule Ton Teh Nouvelle Cons'
Sur tes oreilles abordage
Ils sont fanés fala
L'faire à notre place il fallait
Pour mon lobby des palaces
Tous ces falas des [baleines ?]
You might also like[Couplet 2 : JMK$]
J'veux le biff depuis 10 piges
J'graille toujours après midi
J'veux me barr' aux îles Fidji
J'y vais soon j'ai mes billets
J'vois qu'tu l'ouvres
J'vois qu'tu chies vite
Moi j'ai l'mouv'
On te charcute
[???]
Comme une bavure
Pas le temps pour ces bêtises
Plus le temps pour ces bitches
Qui tapinent derrière vitrine
Bling bling paw
J'ai un [?]
J'veux appart' déco rustique
4 garages avec aussi Mazeratti
Pas de goofys
Vos moustiques dans vis-à-vis
Tard la nuit croise moi bourré
Fourre pas d'folles
[?] essouflée
[?] comme traces pour coke
Elle veut ma cock depuis qu'je rappe
J'veux ma drogue et m'en échapper
J'vais te charcler pour t'appater
Vêtu de gants une écharpe
J'prends un glock et je le charge
[Couplet 3 : Mazoo]
Dans la cuisine toujours du monde la maisonnette est remplie
Comment vous pouvez nous faire la morale mais ma parole
[?] Carole
On médite pas j'veux pas d'histoire
Oh mistinguette tu prendras cher
Facilement là j'vais danser, j'vais m'la raconter
Commence par passer sans m'regarder
Ouais c'est l'heure, roule un gros tas d'shit
Trop tard on t'a ciblé, Rolla B au ciné
Comment t'explique qu' j'ai l'mojo j'suis dans l'dojo
T'as ri mais on a cru qu'cétait quelque chose
Mais deuspi rien qu'il passe dans des costumes
Laissez vous bercez par la voix d'mes g
S/o Vito et mes djinns
Lyonzon les ken viteEmbed"
Lyonzon,Richargeur,"3 ContributorsRichargeur Lyrics[Paroles de ""Richargeur"" ft. Dalienski]

[Intro : Mazoo]
Yeah, yeah, wow han yeah

[Couplet 1 : Mazoo]
On veut chiller dans des beaux apparts, yeah
Que du passe-temps et aucune économie, han
J'me sens île et colon vices, roi du vice, please miss brise pas l'juice
Comment l'rap j'vois ? Un coup d'état, on va pas s'en tirer, comment tu t'étales, han
Wow, parait qu'jamais tu gé-char, parait qu'ta pute est gée-char
Parait qu'jamais tu gé-char han
Faut pas mentir, hey grosse tâche
Tu deviens trop déter', niquer ton staff
Fais pas la belle, ton équipе est dans la dèche
Mon odyssée еst dans la sphère, wow

[Couplet 2 : Gouap]
J'suis sur la Rolla shit, et j'oublie mes courbatures
Toi ta chatte quand y a du Lyonzon dans la voiture
Pas d'amour pour fala, oh, plein d'amour pour les miens, hey
J'peux plus taper Nina, Gouap est dans la droiture
Sous ma toiture, il s'en passe tant
Si y a pas d'teh, mon lobby n'est pas partant
Passé soixante ans, il est un peu gras son cul
Elle est bonne qu'à s'faire taper vu son QI, hey, ah
J'recharge le ki comme Vegeta
Skelay shit j'en fais des tonnes, pour les allocs j'compte sur l'État (Ba-ba-ba-ba)
Elle est taquine, j'fais trou d'boulette sur l'Tacchini, j'suis trop tactique
Lyonzon, popance c'est pas fini
You might also like[Couplet 3 : Mini]
J'écris des textes trop sales, mais j'sais pas dessiner
La blanche, la verte, le noir, mais pas ton dos pour décider
J'fume des teh, tous les soirs, bientôt dix ans j'suis lessivé
J'crois j'vais finir comme, Biggie, Tupac, quand j'vendrai des CDs
Elle font les belles, elles font les tops, la vie d'ma, j'suis excédé
Fais pas le beau, fais pas de ""J'suis un gros"" si t'habites à Aix-les-Bains
Nous c'est l'Rhône, Lyon c'est l'zoo, sah j'men tape de ta cité
Ça fait les gros, ça fait les pleins, mais quand j'parle cash, ça fait les pinces
Tu veux le million dans la main mais sale bâtard tu fais qu'boucham'
Arrête de t'plaindre, ouais, c'est normal si ça bouchonne
Tu veux le million dans la main, là, petit conseil, il faut faire du sale
Faut faire du sale, faut faire du sale, pour faire des sommes

[Couplet 4 : Dalienski]
À la base, à la base, à la base, j'rappais déjà t'étais à la masse
Tu peux rien fumer, t'as pas la masse, tout s'passe bien, j'ai pas la classe
Même assis, j'te remets à ta place, ils veulent plus kicker mais ça passe me-crè à la base
Quelques secrets à la cas', là je tise prends pas la 'taz
Ton flow rouillé à la casse, le mien du kick à la basse
Dali a le FAS, m'en fous si racli a pas les fesses
Je suis pas là pour elle à la base, dans mon flow, tu bois la tasse
Non je calcule pas la presse, aucune pression à la base
Quelques hosties à la messe, quelques bouts d'shit à la tess
Rolla, RTT, Gorjuice et ya Maz' (À la base)
[Couplet 5 : Noma]
La gue-dro, on connait, on vend la monnaie et on parle pas beaucoup
Ta meuf a un vrai dos, c'est son seul atout
Planque mon teh dans ta 'foune, y a R, pourquoi tu t'affoles ?
Lyonzon dans la ne-zo, ils f'ront pas d'vieux os
Dès qu'y a l'biff, change de fuseau
La frappe est diffusée, nan, j'ai pas d'dulcinée
J'ai juste besoin d'pesos, c'est pas du ciné
La péniche est noyée, donne ton corps pour payer l'loyer
Ient-cli veut cop, gros, y a plus d'thé
Rupture de stock, j'dois recharger
Ient-cli veut cop, gros, y a plus d'thé
Rupture de stock, j'dois rechargerEmbed"
Lyonzon,Rutube,3 ContributorsRutube Lyrics[à retranscrire]You might also likeEmbed
