Artist,Title,Lyrics
Lyonzon,En 69 Nina En 69,"10 ContributorsEn 69 Nina En 69 Lyrics[Couplet 1 : Mini]
Elle demande si mon zeub il est louable
Elle demande si mon zeub il est louable (ha ha ha)
J'lui dit non madame t'es trop dégueulasse
Elle voulait du Chanel, Dior ou Mac Douglas, mais c'qu'elle sait pas c'est que j'vais jamais lui khalass, khlass
Bouge, ton produit il est dégueu
Même pas khabat si j'met un méga, si j'en met deux
Même pas khapta khabat (Même pas khapta khabat)
On a pas l'habiude d'fumer du pneu
Accroc à la frappe tah les monsieurs
Pardon messieurs mais vos reuss, mais vos reum j'vais les baiser
Fuck les blues, nous c'est Lyonzoo, Lyonzon, Lyon sah
J'suis le best, on est les best et on les baise
Fuck ces fils de, nous c'est Lyonzon city, gang gang
Lyonzon city gang gang, gang gang, gang gang

[Refrain : Gouap]
Ça revient à 59, avec mon Lyonzon j'arrive
Dans l'bus 59 j'ramène mes 40 reufs et Nina est de la partie
On les prends en 69, Nina en 69 dans le 69
69 dans le 69, Nina en 69 dans le 69
69 dans le 69

[Couplet 2 : Vito]
Un peu bizarre depuis la conception
Mi Autobot et mi Decepticon
En une heure je t'ai mis de côté avec cette déception
J'suis à la passe et à la réception
Touch down comme les Seahawks
J'suis violet comme mon sirop, on est OG comme le c-walk
J'ai le sérum froid dans le sang, fréquence zéro souterraine
Oublie jamais qu'on te chassera pour tes ailes
J'oublie pas que le daron a dû renoncer à tous ses rêves
Je m'en tape de savoir si tu m'aimes si je vois pas qu'tu m'aides
C'est l'humain avant le rap, oui c'est ""t'es qui"" avant la trap ?
Et la trap on la fait mieux qu'eux quand même
Même quand j'écris sans thème y a des couleurs et des contrastes
Y a des roses, des chrysanthèmes
Des enfants encore dans leurs chrysalides
A la vue du monde extérieur gros ça crie à l'aide
J'veux finir sous cryogène, y'as comme un plus dans nos gènes
On voit très bien qu'on les gène
Des enfants encore dans leurs chrysalides
A la vue du monde extérieur gros ça crie à l'aide
Moi j'veux finir sous cryogène, y'as comme un plus nos gènes
On voit très bien qu'on les gène
You might also like[Refrain : Gouap]
Ça revient à 59, avec mon Lyonzon j'arrive
Dans l'bus 59 j'ramène mes 40 reufs et Nina est de la partie
On les prends en 69, Nina en 69 dans le 69
69 dans le 69, Nina en 69 dans le 69
69 dans le 69

[Couplet 3 : Kpri]
Sip pas dans l'cup fils, non c'est pas du cassis
Sip pas dans l'cup fils, non c'est pas du cassis
On tape des vrais putes toi tu t'branles sur des cassettes
En 30 minutes on écrit nos classiques
Kpri n'a pas de CB quand on rentre en Uber c'est elle qui khalass
Plus tard j'veux tout mon Lyonzon dans un, un palace
Nina en 69 c'est elle qui ramasse
Le cuistot a tous les ingrédients sur la paillase
3 phener pour ta dose, parle pas fala
Gouapo qui conduit l'auto
On est dans de la vraie verte qualitée des Pays-Bas
En France toi tu cop la ou les prix sont plus haut, la ou les prix sont plus haut

[Refrain : Gouap]
Ça revient à 59, avec mon Lyonzon j'arrive
Dans l'bus 59 j'ramène mes 40 reufs et Nina est de la partie
On les prends en 69, Nina en 69 dans le 69
69 dans le 69, Nina en 69 dans le 69
69 dans le 69Embed"
Lyonzon,Encore et toujours,"3 ContributorsEncore et toujours Lyrics[Intro : Mazoo]
Hu-hu-hum

[Couplet 1 : Mazoo]
Yeah, yeah, pas là-bas
Elle me veut pour de vrai, pas une fois
Et à force, on s'y plaît
La vie d'moi, ces p'tits cons s'y perdent
Yeah, j'pas b'soin d'savoir la tête d'c'lui qui sort, on amasse, uh
Dis-moi la vérité sur toi, yeah, mets pas d'masque
Elle veut savoir si, ça y est, j'ai pop
Même si ça change R avec tous mes potes, on la choke
Ah, les mains dans les poches, j'fais des strophes
Ah, de la MG, on va réfléchir à t'virer du game
J'veux le bolid'zer, j'suis pas poli, t'sais
Lyonzon, promis, frère, dans les bolides beiges

[Refrain : Vitolo]
La différence, il l'a fait pas entre un vieux plug et un vrai plavon
Deux-trois conneries, ça glisse dans sa ge-gor comme du savon
J'en ai dans la tête, sur les épaules et dans l'caleçon
J'ai les couilles comme la braise et j'l'cœur comme un glaçon

[Couplet 2 : Gouap]
Dis-moi, toi, t'as quoi de spécial ?
J'shoote du milieu d'terrain comme Michael dans Space Jam
Oh, eh
Là j'suis tout plein d'[?], fala, je sens [?]
Nouvelle année, Lyonzon, c'est nous, les autres, sucez-nous
Hier, tu parlais mal, aujourd'hui, t'es à genoux
Gros, j'ai l'impression qu't'as du mal à comprendre
Si ça tenait qu'à moi, tous ces falas se feraient pendre
J'ai mis le cul d'Nina à vendre
Une bonne affaire, plaisir garanti pour une heure
Oh, eh, oh, ils ont mon âge
Ça m'dégoûte, j'les vois triquer sur des mineures
You might also like[Refrain : Vitolo]
La différence, il l'a fait pas entre un vieux plug et un vrai plavon
Deux-trois conneries, ça glisse dans sa ge-gor comme du savon
J'en ai dans la tête, sur les épaules et dans l'caleçon
J'ai les couilles comme la braise et j'l'cœur comme un glaçon

[Couplet 3 : Jolly]
À retranscrire

[Refrain : Vitolo] x2
La différence, il l'a fait pas entre un vieux plug et un vrai plavon
Deux-trois conneries, ça glisse dans sa ge-gor comme du savon
J'en ai dans la tête, sur les épaules et dans l'caleçon
J'ai les couilles comme la braise et j'l'cœur comme un glaçonEmbed"
Lyonzon,Euhon,"4 ContributorsEuhon Lyrics[Paroles de ""Euhon""]

[Couplet 1 : Vitolo]
Ils voudraient qu'on chuchote, qu'on leur cache la vérité
Oh putain j'hallu' comme c'est fastoche, gros tout ça c'est mérité
Ils voudraient qu'on fasse moins d'bruit, ils nous préfèrent pas debout
On l'a remarqué depuis, t'es là, rien qu'tu suces des zboubs
T'es là, tu fais l'falch, Lyonzon s'tue à la tâche
Plus de waves que dans sa te-ch', toi c'est mieux tu restes en touche
C'est mieux tu restes sur le bench, bientôt Lyonzon trademark
C'est mieux tu restes sur le bench, hiver glacial comme au Danemark

[Couplet 2 : Mazoo]
Aucun mensonges, c'est ma nation
Toujours dans une élévation
Mes rivaux diront qu'on est pleins, sans doute
J'vais faire l'con de partout, si j'y vais c'est pas par politesse
Roule un backwood dans la maison, j'vais pas parler plus fort
Y a pas qu'la nuit qu'on voit des uniformes
Et tu tends une oreille, et tu colles
J'veux pop mais j'vais pas, bande de folles
Allez, c'est pour eux cette année, nous on bosse t'sais
C'est l'bordel, c'est propre
J'vais pas rider ces tops, hop, c'est dans mon ressort
Toi t'as qu'à danser, quand tu penses à moi
You might also like[Couplet 3 : Jolly]
À retranscrire

[Couplet 4 : Gouap]
J'vais m'acheter du Parur, cette salope fait pas rire
J'te vois, t'as fière allure, quand t'allumes ton teh, ça pue la [?]
Me dit pas que ça vient de vos sangs, toi t'es qu'un loss'
Ne me ment pas, j'suis expert dans l'teh
Gamos, dans la fête, viens prendre une baffe gratos
J'connais pas Los Angeles, mais [?] CJ sur Los Santos
Calme ta Nina, aussi, pour, l'instant j'ai pas un
En plus de ça, chab la re-pu qu'on t'as collé
Crois pas en moi j'suis un lossa
Elle croit j'suis sérieux, alors que j'fais que l'affolerEmbed"
Lyonzon,Euro Dollars,"2 ContributorsEuro Dollars Lyrics[Intro]
Shout-out my nigga C4 the plug

[Refrain : Ashe]
T'inquiète, on va l'faire
LZ, affaires, pour toi, pas b'soin d'sortir le fer
T'inquiète, on va l'faire
Dans la pocket, la beuh et les billets sont verts
Euro, dollars, billets, billets, y a qu'à ça qu'on peut s'fier
Euro, dollars, billets, billets, rien à foutre de briller

[Couplet 1 : Gouap]
Eh, j'me colle que des maxis
J'suis dans Punto, falafel, pas b'soin d'prendre un taxi
Les certifications d'Zazie, l'capital du CAC 40
C'est c'que j'veux dans ma chambre, c'est c'que j'veux sur le compte en banque
Oui, on est ambitieux, pas pieux, l'condé veut mes papiers
Ne vois pas trop grand, viens pas nager où t'as pas pied
Viens pas nager où on flotte, trop large pour passer la glotte
J'reviens avec, c'fils de pute me dit : ""que caches-tu dans ton froc ?""
Nique un poulet, nique un franc-maçon tous les jours
Si tu vois pas qu'ils nous baisent, c'est qu'ta vue t'joue des tours
J'le fais sans efforts, la lean fait trop d'effet
Et Manolo s'endort quand j'me tue sur FL

[Refrain : Ashe]
T'inquiète, on va l'faire
LZ, affaires, pour toi, pas b'soin d'sortir le fer
T'inquiète, on va l'faire
Dans la pocket, la beuh et les billets sont verts
Euro, dollars, billets, billets, y a qu'à ça qu'on peut s'fier
Euro, dollars, billets, billets, rien à foutre de briller
You might also likeA retranscrireEmbed"
Lyonzon,Fala En One One,"6 ContributorsFala En One One Lyrics[Paroles de ""Fala en One one""]

[Couplet 1 : Mazoo]
Wow, wow
J'suis censé me taire, j'suis censé me taire
Du sang sur la seine, j'ai donné ma personne
Conduite en Fala en One One (yeah)
Et j'suis grave mort
J'conduirai pas la formule 1
Faudra la formule et j'm'émanciperai comme Mulan
Au lycée communale j'faisais domino
J'aurais pû être bon en philo
Tu veux d'la cons' ? J't'en file
T'es comme dans Constantine
Non j'fais pas d'la grosse tantine (wow)
Le rap c'est la cantine et on bouffera au self'
Doucement on pique la recette
C'est la goutte d'eau et j'suis débordé
C'est violent, ton rap j'ai décortiqué
Viens pas m'parler d'rap
Vous savez que faire de la trap
On prend tes types on les frappe
Je veux des rôles kitsch dans des sitcoms
T'auras qu'à prendre la fuite
Ton malheur on allège, on prends les rennes
On assume, peut-être aussi parce qu'on assure
Bien-sûr
J'te jure qu'on peut tous vous rassur'
You might also like[Couplet 2 : Samouraï]
On va t'spammer (spammer, spammer)
Ta go' pas mal (pas mal, pas mal)
Elle tombe dans les dm (pew)
J'prélève son ADN (skew)
Joue pas ta starlette (starlette, no)
Je fuck une scarlette (fuck une scarlette)
Joue pas ta starlette no
Je fuck une scarlette
Elle veut pop
Toi tu veux pop (toi tu veux pop)
Elle veux pop des choses
Ouais, là c'est glauque (là c'est glauque)
T'entends le clic, boum
Les aiguilles du compte à rebours
J't'envoie en mission, là j't'envoie le missile
Ouais c'est mieux tu bouges
Avant tu découvres l'homicide
Ah ouais c'est triste
Toutes ces bad-bitch's sont matérialistes
Nous on monte juste l'empire
On en investi pour la suite
Et dans l'hôtel j'veux la suite
On investi pour la suite
Et dans l'hôtel j'veux la suite
[Couplet 3 : Noma]
Tise, opiacés
J'vais lui placer
Elle veut s'caser (boum boum)
J'aime pas trop causer
La lean me tape, j'vais m'reposer
Un truc de baisé j'vais leur faire (faire faire)
Tous capte dans la chop
4 dans l'fer (dans l'fer)
Personne n'a de temps é perdre
Hamzoul, Haja, Igo, à paine
Ta beaucoup d'fume, t'sais pas où la mettre
T'es plein d'blabla
T'es plein d'mala mec
Trouve moi au QG ou à Maisonnette (skalay)
Trouve moi au QG ou à Maisonnette (gang)
Des sons inexistants pour eux
La popance aura un goût savoureux
J'te laisse dans tes galères, et tes soirées douteuses
J'te laisse dans tes galères, et tes soirées douteusesEmbed"
Lyonzon,Fanbase,"4 ContributorsFanbase Lyrics[Paroles de ""Fanbase""]

[Intro : Gouap]
Pouuulouu
Pah, pah
Eh, oh

[Couplet 1 : Gouap]
J'suis pas comme eux, j'm'en bats les couilles d'une fanbase
Et c'falafel s'est mis dans l'jeu parce que les fans baisent
[?] d'une Nina, moi j'veux que l'argent
Et l'jour où ça pop, j'serai encore plus proche de mon clan, oh
Manolo, Gouapo, sur l'teh, on est incollables
Si t'aimes le com', nan, j'peux pas être ton collègue
Lobby solitaire, pour la boisson, ça collec'
Tu crois vraiment que j'vais tout claquer chez Colette ?
Fais pas l'founana, habille-toi qu'chez les Pièces
Me prends pas au sérieux quand j'glisse des pièces, oh
Face à eux, que le sarcasme
Si elle veut l'faire chez moi, c'est parce qu'elle sait comme j'la casse

[Interlude]
Nani?!
Real trap shit
Plu-Plu-Plu-Plugg!
You might also like[Couplet 2 : Noma]
Belek des lards, ça c'est sûr, t'sais comment marche le processus
Bosse dur pendant qu'ces pédés sucent, igo, j'suis dans ma zone
J'pense au bénéf', au bénéf', j'ai trop dormi, trop nehess
Amène le wari, et qu'ça presse, on d'vient vite paro
Chez Gouapo Labo, j'ai ma substance, j'ai la beuh
Le client voulait en prendre deux, avec la sauce [?]
Tu fumes du com' pas fameux, là j'me barre, elle m'a fané
J'voulais être posé, calé, falas m'ont fait décaler
Pute est en nuisette, piégée dans une épuisette
Elle boit l'Jack cul sec, qu'est-ce qu'elle f'rait pas pour voir du 'zeille
Pute est en nuisette, piégée dans une épuisette
Elle boit l'Jack cul sec, qu'est-ce qu'elle f'rait pas pour voir du 'zeilleEmbed"
Lyonzon,Fanta,"7 ContributorsFanta Lyrics[Paroles de ""Fanta""]

[Couplet 1 : ASHE 22]
LZ, que des flip-flap (shh) quand l'équipe rappe (2.2)
Rayane, sur le beat, frappe, j'la coupe avec du jus d’grappe
West Coast ou big trap (hey), le feu, au mic', j'crache (2.2)
Mélonou boombap, j'sais qu'ça va devenir trash (shh)
Dans la planque avec le Kpri, j'en fais un (ouais, j'en fais un)
Les p'tits sont prêts à t'crever pour une paire de TN
Zéro travelo dans mon équipe, tu sais qu'on joue pas en D1 (big bitch)
Tu connais, 2.2, du sang 3arbi dans l’ADN (shh)

[Couplet 2 : Jolly]
[?]
Porque soy king
[?]

[Couplet 3 : Mini RTTClan]
Air Max, survêt', pas d'bombers (Air Max, survêt', Air Max, survêt')
J'ai les techniques pour faire du bon beurre (j'ai les tеchniques de té-cô)
24/7, trap banger (24/7 avеc mon gars)
Qu'est-ce t'as fait d'ton liquide ? Eux, c'est des bombeurs (c'est des gros suceurs)
Impossible que j'roule un teh à la menthole (plus de pain que chez Paul)
Personne me fera bouger de mon poste (quand tu m'jactes, j'mets direct les Air Pod)
Sors pas ta mini-jupe, leurs iPhones (que ça phone)
Elle s'demande pourquoi j'ai deux phones
Pour monter les niveaux, rafaler femmes
Après là tie-par, pelo, j'suis en pleine forme
You might also like[Refrain : Kpri, Gouap]
Coffré dans un monde, j'pense au cash comme chaque hiver (han-han-han)
L'été, j'pense qu'à recompter, faudra s'y faire (han-han-han)
Eux et nous, c'est pas l'même monde, ils suivent Lucifer (han-han-han)
Liasses sous élastiques dans l'jean, cherche-moi un bol d'air
Y a le sirop dans mon Fanta qui splashe
Nina dans la bre-cham qui s'lâche (s'lâche)
Trop d'amour pour mes frères, j'peux pas abandonner (j'peux pas)
Quand on arrive, y a des fils de tains-p' qui s'cachent (cachent)
Coffré dans un monde, j'pense au cash comme chaque hiver (han-han-han)
L'été, j'pense qu'à recompter, faudra s'y faire (han-han-han)
Eux et nous, c'est pas l'même monde, ils suivent Lucifer (han-han-han)
Liasses sous élastiques dans l'jean, cherche-moi un bol d'air
Y a le sirop dans mon Fanta qui splashe
Nina dans la bre-cham qui s'lâche (s'lâche)
Trop d'amour pour mes frères, j'peux pas abandonner (j'peux pas)
Quand on arrive, y a des fils de tains-p' qui s'cachent (cachent)Embed"
Lyonzon,Far On Lean,"10 ContributorsFar On Lean Lyrics[Paroles de ""Far On Lean""]

[Couplet 1 : Gouap]
Si je change pas, c'est qu'elle aime cette manière de faire
Si je parle pas beaucoup, c'est qu'on m'a appris à m'taire
J'craque mon teh, oh, sans stress sur Terreaux
À chaque occasion, j'suis dangereux comme un péno
Ton plug pue sa mère, j'rentre pas dans l'panneau
Toi t'es fané, tu t'tapes 2000, sale pédo
Deux ans que j'dis plus bendo, quatre que j'dis plus bédo
T'aimerais nous la mettre mais, falafel, t'es baisé
J'suis chez Benibla, ça m'file des survêt'
Des t-shirts, des bananes et une casquette
Tu-Tu-Tu— Tu connais Gouapo dans ses claquettes
Salope, j't'ai claquée, j'suis tout puissant comme Clark Kent, hey
J'suis tout-puissant comme Bruce Wayne
Mon lobby t'fout la frousse, ouais
Lyonzon sur la scène, on casse tout
J'aime nos p'tits, fala, hey, sont des casse-cous

[Refrain : Jolly]
E perdo il controllo e non la sai
Sei nei social attento a dove vai
La mia vita è una bitch la fotto e vai
Resto con i bro tutta la night
E perdo il controllo e non la sai
Sei nei social attento a dove vai
La mia vita è una bitch la fotto e vai
Resto con i bro tutta la night
You might also like[Couplet 2 : Samurai]
J'dois le faire vite, je dois partir (sku, sku, sku)
De plus en plus de bitchs dans la carte SIM
Comme Mazoo-san, j'deviens fou
Tout ces wack MC rendent fou
Lyonzon Lyonzon, d'quoi t'faire perdre la raison (sku, sku)
Tous défoncés dans la maison, j'fais même plus attention
Dans l'double cup, là j'suis sous lean (j'suis sous lean, bruh)
Et d'tes histoires, j'm'en bats les reins
J'suis fucked up, j'suis high, bro
J'ai juste envie qu'cette bitch, elle danse sur oim, gros
Elle m'demande pas là si en vrai, j'suis sah, gros
Toute la semaine défoncé, fuck ton samedi soir, oh

[Refrain : Jolly]
E perdo il controllo e non la sai
Sei nei social attento a dove vai
La mia vita è una bitch la fotto e vai
Resto con i bro tutta la night
E perdo il controllo e non la sai
Sei nei social attento a dove vai
La mia vita è una bitch la fotto e vai
Resto con i bro tutta la night

[Couplet 3 : Mazoo]
Mes gars dans le lean, on met dans le mille
Là, c'est plus mon terrain, j'ai pas peur, on ira
J'ai cassé la pills avec ta copine
Lyonzon dans l'virage, Lyonzon, pas un mirage
Plus le temps maintenant, toi t'es con, va-t'en
Attends, attends, reviens, minot
On fait même plus attention, far on lean
Poker tapis au lit, j'mets ta te-pu au lit
J'arrive pas à dormir cette nuit
J'vais finir au cinéma à draguer cette fille
Plus qu'un selfie, j'prends ma bouffe au self
Lyonzon : beaucoup s'taisent, woh
[Refrain : Jolly]
E perdo il controllo e non la sai
Sei nei social attento a dove vai
La mia vita è una bitch la fotto e vai
Resto con i bro tutta la night
E perdo il controllo e non la sai
Sei nei social attento a dove vai
La mia vita è una bitch la fotto e vai
Resto con i bro tutta la nightEmbed"
Lyonzon,Faux fake,"11 ContributorsFaux fake Lyrics[Paroles de ""Faux fake"" ft. JMK$]

[Intro : tag]
Harr

[Couplet 1 : Ashe]
Réveil 19, j'roule un maxi, j'ai un cli', j’appelle le taxi
J’m'extirpe, s/o Brexit, j'sais y en a plus d'une que j'excite
Putain, vieux rappeur qui persiste, j'sip, j'demande si j'existe
Essaye pas d'comprendre mon lexique, boy, j'deal d'la pure du Mexique
J'fume d'la beuh, exquis, dans ma tête, j'dessine une exquise
Dans sa teuch comme au ski, gars t'as l'gab' d'un moustique
Moi j'veux des langoustines, tu vas voir, boy, on est hostiles
Plus d'une dette sur le post-it, c'est tous des fautifs
J'vois comment ils sont, ça motive, moi j'suis inventif
J'ai d'plus en plus de notifs, plus en plus de notifs
Bitch, arrête ta bouche à m', arrête toutes tes sottises
LZ pop, de plus en plus de notifs

[Refrain : Jolly]
Hey, fuck fake bitch, fuck fake bitch, fuck fake bitch
Prendo la tua vita e non lo sai
Fuck fake, fuck fake bitch, fuck fake bitch, hun
Prendo la tua vita e non lo sai

[Couplet 2 : JMK$]
J'fais du patin sur les ports en no stress, fourrer d'la chica d'la noblesse
Fourrure et chaîne en diamant, quand mes pupilles s'dilatent, j'me reposes sur ses grosses fesses
J'rafale un opps dans la foulée, .44 pour les troubler
Jamais je tape dans la grosse folle et jamais je tape dans la Kate Moss
S/o Henny, Cali avec Juni, t'as ap plus stocké dans le colis
Trois grammes de plus dans le swisher et tu poses pas tes lèvres de michto
J'fume 40 teh par semaine et j'ai quatre MC sous ma semelle Nike, en bref
Homicide volontaire garanti, pas comme le fer, on te tartine ta mère
Indépendant, on le fait, qui est le plus chaud ? On le sait
Qui sont les faux ? On les ken, j'remue le couteau dans la plaie
8.848, c'est le gang, bitch, bouge ton kwer, bouge ton bang, bitch
Mets ton move, fais-le bien, bitch, j'ai le groove, j'ai le bien riche
You might also like[Refrain : Jolly]
Hey, fuck fake bitch, fuck fake bitch, fuck fake bitch
Prendo la tua vita e non lo sai
Fuck fake, fuck fake bitch, fuck fake bitch, hun
Prendo la tua vita e non lo sai

[Couplet 3 : Gouap]
Et j'fume le doré, sur Spotify, j'écoute ""Corée""
J'suis avec Nina, j'lui mets dans l'mauvais, là, j'me suis gourré
Y a zéro falas, tu peux chercher, tu vas pas trouver
Lyonzon, la popance en indé, j'ai plus rien à prouver
J'suis avec Parlemo', salope, dis-nous c'est quoi ton blème-pro
J'ai plus d'20 jet-pro et sur Lyonzon, personne te nnaît-co
Arrête de ller-co, avec ton sang, j'refais la déco
J'collectionne que les têtes, mon lobby finit pas ex-aequo
Arah dans l'jeu, beaucoup d'pétasses, mala après les pesetas
La vie c'est pas la fame, la drogue, la pillave et baiser 'tasses
Arah dans l'jeu, beaucoup d'pétasses, mala après les pesetas
La vie c'est pas la fame, la drogue, la pillave et baiser 'tasses

[Refrain : Jolly]
Hey, fuck fake bitch, fuck fake bitch, fuck fake bitch
Prendo la tua vita e non lo sai
Fuck fake, fuck fake bitch, fuck fake bitch, hun
Prendo la tua vita e non lo sai
Hey, fuck fake bitch, fuck fake bitch, fuck fake bitch
Prendo la tua vita e non lo sai
Fuck fake, fuck fake bitch, fuck fake bitch, hun
Prendo la tua vita e non lo saiEmbed"
Lyonzon,Faya Comme Jamais,4 ContributorsFaya Comme Jamais Lyrics[à retranscrire]You might also likeEmbed
Lyonzon,Feu,"3 ContributorsFeu Lyrics[Paroles de ""Feu""]

[Couplet 1 : Mazoo]
Feu sur moi, et sur eux aussi
Feu sur toi, et sur eux aussi

Pourquoi tu crois qu'j'suis vénèr'
Car tu mens et tu t'sens bien
Argumente n'écoute pas seulement tes maux
Je garde tout pour moi vos erreurs vous appartiennent
A part ça faut qu'tu t'lèves tôt
On veut du shit
J'veux de l'or lannière antique
Là j'la baise et elle enlève ses lentilles
C'est pas gentil
Là j'me casse les amis
Viens on t'examine
J'suis pas content t'es parti
[?] dans mes cartes SIM
Payer en comptant j'm'égare si [?]

[Couplet 2 : Gouap]
J'suis avec Gouap du MMC
J'me sens comme Gregor MMA
Lyonzon c'est la qualité oui j'te l'assure comme MM-A
Amorce pas la trappe
Sur Lyon t'as Maisonnette
J'déboule comme [?] toi comme serpent à sonnette
J't'aime pas pour être honnête
Tes mouvements sont bizarres
J'suis comme blizzard la Nina retire déjà mon blazer
J'aime trop quand ça part en couilles
[????]
Tu parles que fame j'te parle pas en cash
Faya dans lin dans l'bail comme Francis Trash
En colère devant l'adversaire
[?]
You might also like[Couplet 3 : DIL]
[C'est trop pour moi wsh]Embed"
