Artist,Title,Lyrics
Lyonzon,La Flemme,"6 ContributorsLa Flemme Lyrics[Paroles de ""La Flemme""]

[Couplet 1 : Jolly]
Racconto  sempre le stesse storie
Perchè è ancora la stessa vita
La fama nessuno me la toglie
E anche una bella vita
E non parlare con me
E non parlare con me
Lei vorrebbe solo finire con me
Vede la squadra e capisce perchè
Tu devi dei soldi e non ti fai più vivo
Mette il cappuccio quando sei in giro
Dici che spacchi ma non ti si caga di stricio
Lei mi dice Jolly ti ammiro
I tuoi ricci sono bene dal vivo
Tutto questo per un exta *O mio dio*
Okay Okay tu non sei dei miei
Cosa faresti per la fame
Il giorno dopo non sai
Okay okay (okay) Cosa faresti per la fame

[Refrain : Gouap]
Lyonzon c'est nous tu le sais
Raballe l'Amocodo, y'a pas je sais qu'tu décedes
Fala croit pas qu't'es le sang
Tu veux coop pour de vrai on a trop la flemme
You might also like[Couplet 2 : Noma]
Fais tourner l'plavon qu'on [?]
On dormira quand on s'ra morts
Des kilos des kilogrammes, j'y pense encore
Jette le teh par la window
J't'ai coké t'es pas ma pine-co
Là pour l'aventure, l'lingot
Les formes qui m'rendent dingo
J'suis dans l'vaisseau
J'ai 2 bigo
Un pour les potes un pour l'client
D'ma beuh Nina est friande
Marche dans la brousse chemin m'frayant
Chaque service est payant
Chargé est mon pilon tout est bre-som d'puis l'épilogue
Quatrième épisode
'Challah le plug tu sonnes
[?] grille la ce-for
Pour la [?]

[Refrain : Gouap]
Lyonzon c'est nous tu le sais
Raballe l'Amocodo, y'a pas je sais qu'tu décedes
Fala croit pas qu't'es le sang
Tu veux coop pour de vrai on a trop la flemme
Lyonzon c'est nous tu le sais
Raballe l'Amocodo,y'a pas je sais qu'tu décedes
Fala croit pas qu't'es le sang
Tu veux coop pour de vrai on a trop la flemme
[Outro : Gouap]
Trop la flemme oh, trop la flemme oh, trop la flemme oh
Trop la flemme oh, trop la flemme oh, trop la flemme oh
Trop la flemme oh, trop la flemme oh, trop la flemme ohEmbed"
Lyonzon,La mafia,"13 ContributorsLa mafia Lyrics[Couplet 1: Gouap]
Le lean, faut faire des poches, m'en fous du club des 27
J’suis dans l'Euphon, les Phénergans, nan, mon lobby boit pas d'vin sec
J’fais attention à ma santé, un teh sur l'terrain d'basket
Fais attention, ta Nina, chez moi, porte mes caleçons, mes claquettes
En attendant la popance, y a d'jà 100k le premier jour
J'suis dans une ville de franc-maçons, la pyramide au-d'ssus d'la tour
Sur mon clan, t'as dour, Nina aime le zizi dur
Un monde de falas, j’suis pas pour
Dans le jeu, qui sont ces salopes ? Nous, jamais on galope
Allez, va chercher une canette, petits, ça t’mettait des calottes
Dans le jeu, qui sont ces salopes ? Nous, jamais on galope
Allez, va chercher une canette, petits, ça t'mettait des calottes

[Couplet 2: Ashe]
Wow, wow, wow (spash, splash, splash, splash)
J’vois qu'tout l'monde s'met à rapper (wow)
J’crois qu'ta mama t'a raté (bitch)
À la prod, on fait du karaté
Écoute seulement, tu vas finir épaté (splash)
J'vais t'faire manger du pâté
Tu vas goûter à l'enfer si t'es athée (skrr)
Ou si t'as fumé ou t'as gratté
Dans ma cellule à la  Talau', j'fais un gratin (wah)
La concurrence dans les gradins
Fils de pute, d'vant l'OPJ, j'parle en latin (psh, psh, psh)
Pour nous avoir, il racontent des baratins (brr, brr, brr, brr)
Ta daronne dans l'bar à tain-p'
Hachek, j'aurais pas dû
Toute la journée, j'fais des dineros, c'est pas dur (wah)
T'as croqué un fruit qu'est pas mûr
Si tu lean dans ma kara'a, j'appelle le Samu
On s'amuse mais on est prêts à tout pour l'amu'
On s'amuse mais on est prêts à tout pour l'amulette (wah)
Bitch, brr brr au fusil à lunette
Bitch, brr brr au fusil à lunette
You might also like[Couplet 3: Jolly]
Fumo erba nel escale, no spagnola, vale, vale
On sait tous que tu vas caler, un missile, j'allume pas d'camel
Entro notte vista laser, sulla fascia corro Pavel
Parla euro trovi [?], tu vois nos vies, tu pètes un câble
A la tua serata (wow), entra coca e tata (wow)
J'ai pas d'potes, j'ai une fafa, Lyonzon, noi siamo la mafia
Noi siamo la mafia (bitch), noi siamo la mafia (hey)
Noi siamo la mafia (hey), noi siamo la mafia (wow)
Noi siamo la mafia, bitch, ti schivo perchè snitch
Poi ti spremo come un pitch, la tua voce, meglio un mix
Forse è meglio il silenzio, faccio fumo uno stipendio
Voglio Versacce, voglio un Merco, voglio oro, voglio extendo

[Couplet 4: BU$HI]
Négro, va chercher ton drip, mon bigo sonne trop quand ça drop
Donne pas un kiss à la miss, elle a sucé des dicks, ils s'réveillent au taz, à la clope
Et personne va signer ton deal, 100k c'est une seule chaîne
200 c'est une de plus et 300 c'est beaucoup d'chiennes
Big Mamma veut sucer ma bite ou mon clout
J'fais ma maison avec l'argent du Cloud
Un trou sur son pull (breh, breh)
Un trou dans sa maman
Pas chercher à comprendre, ces négros sont nuls
Vont s'noyer dedans comme si c'était le Nil
Tu savais qu'ta fille, elle envoyait des nudes
Ces négros sont faibles donc j'les vois comme des noobs
J'écoute pas les suisses, j'écoute pas les français, j'écoute que mes G
Cette pute, elle m'a dit : ""si tu fais des thunes, j'reste avec toi à vie""
J'écoute pas les suisses, j'écoute pas les français, j'écoute que mes G
Cette pute, elle m'a dit : ""si tu fais des thunes, j'reste avec toi à vie""Embed"
Lyonzon,La menace,"5 ContributorsLa menace Lyrics[Couplet 1 : Ashe]
Ciel nuageux, j'pop donc y a plus de rageux
Dans sa chatte, j'nage, pas d'pointe, on a l'même âge
Goutte de sueur sur mon front après chaque péage
Moi c'est Ashe, j'ai plusieurs dro-drogue dans l'sachet
Bitch, faut qu'ils le sachent, 2k19, la confiance s’achète
Trahis-nous, on sort la machette ou j'appuie sur la gâchette
Gamin ton avenir est gâché, ça sert à rien d'te cacher
J'lean pour plus être fâché pendant qu'toi tu mâches des cachets
Tire dessus tu vas tousser, autour d'moi que des froussards
J'en place une pour Moussa, ien-cli, ien-cli a les yeux qui brillent
Quand j'déballe le mousseux, bitch, toi le tien est pâteux
T'en tiens un mais pas deux, t'as la dég'z à Kid Paddle, bitch

[Refrain : Noma]
Fais pas l'ancien quand on a l'même âge
Lyonzon les démarre, Lyonzon la menace, Lyonzon la menace
Fais pas l'ancien quand on a l'même âge
Lyonzon les démarre, Lyonzon la menace, Lyonzon la menace

[Couplet 2 : Mini]
Etant petit, j'ai traîné dans la merde tôt
C'est pour ça qu'aujourd'hui, j'veux pét' la Merco
Ici c'est Lyon, fils de, pas Sacramento
Fumer le bon, baiser des gos, la vida, on aime trop
Fala copie, t'façon, c'est pas la même [?]
Ah gros la keh elle veut du sale mais bon j'la connais même pas
Y a tout c'qu'il faut dans la che-po du veston
T'inquiète-toi pas pélo, pélo, tu sais qu'on a la best keh
Rien à foutre de ta bestah
Petit bâtard baisse ta main, sinon vas-y baise ta mère
Ils sont plein de ""qu'est-ce t'as ?"" Me posez plus de questions
J'fais confiance qu'à mon destin et aussi à mon bifton
You might also like[Refrain : Noma]
Fais pas l'ancien quand on a l'même âge
Lyonzon les démarre, Lyonzon la menace, Lyonzon la menace
Fais pas l'ancien quand on a l'même âge
Lyonzon les démarre, Lyonzon la menace, Lyonzon la menace

[Couplet 3: Mussy]
Lyonzon les démarre, vif comme un renard, j'suis dans la précision
Faut ficher les connards, non j'fais pas d'rencards, j'veux juste la pét' à fond
T'as fais chier mes collègues pour avoir le pétard, t'es parti, t'as fini rond
Fils, ma gova j'te la laisse, si j'en ai une dizaine, une black, elle peut prendre l'avion
J'suis souvent très honnête, j'prend pas de pincettes, j'ai l'dossier, fais attention
Ils font style de m'connaître, vérité comme gâchette pour créer la distinction
Elle a switché ta miss, tu bégayes, tu transpires, tu pètes un plomb
J'ai plongé dans mes vices, j'té-ma les coraux dans mon lagon
J'porte la même paire de Nike pour une sport', pour une pute, même pour Cendrillon
Sac vert, pantalon kaki, ha, ouais
J'porte la même paire de Nike pour une sport', pour une pute, même pour Cendrillon
Sac vert, pantalon kaki, ha, ouais

[Refrain : Noma] (x3)
Fais pas l'ancien quand on a l'même âge
Lyonzon les démarre, Lyonzon la menace, Lyonzon la menace
Fais pas l'ancien quand on a l'même âge
Lyonzon les démarre, Lyonzon la menace, Lyonzon la menaceEmbed"
Lyonzon,La popance,"12 ContributorsLa popance Lyrics[Intro: BU$HI]
Lyonzon, la popance

[Couplet 1: BU$HI]
Sa bouche est pleine, mais ta pute pas bonne
Ils disent qu'ils m'connaissent, on est même pas potes
Tout ça parce que ça pop, tout ça parce que j'fais partie d'la flotte, bande de fiottes
J'aime bien écouter vos sons quand j'me pose dans les chiottes
J'consomme bien plus, et c'est eux les tox'
C'est eux les salopes, Lyonzon c'est les boss
Ma queue tu peux galoche, va t'changer tes fringues
Tu parles de flingues, tu parles de drogue
Y'a d'la poussière de centime qui flotte dans tes poches
Ta tantine s'penche devant n'importe lequel d'mes proches
Tu fais trop la mala, tu fais trop le malin
Tu t'détruis si tu tires sur le tamien, anti-clout chaser, pas là

[Pont: BU$HI]
J'cherche pas à savoir elle est où quand t'es pas là
J'cherche pas à savoir, moi j'suis, moi j'suis..., j'fais l'bénef'
Rien qu'ça fume, fumer comme un chaman, j'consomme et j'te parle pas d'EDF
J'cherche pas à savoir elle est où quand t'es pas là
J'cherche pas à savoir, moi j'suis, moi j'suis..., j'fais l'bénef'
Rien qu'ça fume, fumer comme un chaman, j'consomme et j'te parle pas d'EDF

[Refrain: Gouap]
Elle est dans l'appart (appart), elle veut fumer sur ma moula, ma moula (ha)
Ca la laisse rentrer à pas d', mes frères dans le bolide, dans le bolide
Fala dans l'appart, cherche pas trop de mala, de mala (mala)
Lyonzon la popance, Lyonzon la popance (popance, popance), eh
Sur ma moula, sur ma moula, sur ma moula, sur ma moula
Dans le bolide, dans le bolide, dans le bolide, dans le bolide
Trop de mala, trop de mala, trop de mala, trop de mala
Lyonzon la popance (popance), Lyonzon la popance (popance)
You might also like[Couplet 2: Noma]
Rapper c'est trop facile, le parcours les fascine, j'veux elle et la voisine (pou)
Mets pas l'oeil dans le tajine, j'ai le code prométhazine et le drip comme Kpri (pou, pou, pou)
Rouges sont les tapis, dans l'ombre se tapit, sont graille comme des tapas (raah)
Le 808 qui tabasse (raah), la concu à la ramasse (ratata)
J'en roule un gros dans le gamos, plus des gamins (brr brr on arrose)
Noir Pacman ou Arrow, tire comme au Far West (piou piou on arrose)
Elle m'fait la meuf elle est [bado ?],rêve du back ou de la woke (hein)
Lyonzon joue pas d'rôles, si on piétine c'sera pas drôle
Elle m'fait la meuf elle est [bado ?],rêve du back ou de la woke (pute)
Lyonzon joue pas d'rôles, si on piétine c'sera pas drôle (ratata)
Pour la moula les doros, balec' et follow (rah)
Déballe le colis le carton, mon livre arrive d'un côlon

[Refrain: Gouap]
Elle est dans l'appart (appart), elle veut fumer sur ma moula, ma moula (ha)
Ca la laisse rentrer à pas d', mes frères dans le bolide, dans le bolide
Fala dans l'appart, cherche pas trop de mala, de mala (mala)
Lyonzon la popance, Lyonzon la popance (popance, popance), eh
Sur ma moula, sur ma moula, sur ma moula, sur ma moula
Dans le bolide, dans le bolide, dans le bolide, dans le bolide
Trop de mala, trop de mala, trop de mala, trop de mala
Lyonzon la popance (popance), Lyonzon la popance (popance)

[Couplet 3: Jolly]
Aspetti la popance, bitch, tanto finiro rich' (rich')
Preparami un sandwich, la coco la candy, bitch
Papa m'a detto che milli è halal, volgono piu di milione haram
Resto mais stesso fare il batârd, tu vas pas nous la faire en plus t'es cher tricard
No blabla c'est des salopes, [?] j'ai qu'une parole
Si svaglia di grosso si pensa che l'amo, [] quindi no richiam'
Martini cana, arriva appura, ti vedo dufra, vende la cura
[?]
Mi faccio un cup, mi mova stent, soprano stunt, prendevo il vent
[?]
Mi faccio un cup, mi mova stent, soprano stunt, prendevo il vent
[?]
[Refrain: Gouap]
Elle est dans l'appart (appart), elle veut fumer sur ma moula, ma moula (ha)
Ca la laisse rentrer à pas d', mes frères dans le bolide, dans le bolide
Fala dans l'appart, cherche pas trop de mala, de mala (mala)
Lyonzon la popance, Lyonzon la popance (popance, popance), eh
Sur ma moula, sur ma moula, sur ma moula, sur ma moula
Dans le bolide, dans le bolide, dans le bolide, dans le bolide
Trop de mala, trop de mala, trop de mala, trop de mala
Lyonzon la popance (popance), Lyonzon la popance (popance)Embed"
Lyonzon,Lean Rivera,"3 ContributorsLean Rivera Lyrics[Refrain : Gorjuice]
Verre de lean on my wrist
Vas-y  fais couler
Tu  m'fais trop coller
Bek bek c'est cool
Pas de tabac, coule une douille on s'en bat les couilles
Remets  gasolean, remets, remets gasolean

[Couplet 1 : Gorjuice]
Y  a Mazoo sous le lean
Qui fais des sous sous
Oh  nan me saoule pas pour 2 francs 6 sous
La spéciale Zizou
Et j'me barre vite zou
J'démarre fusée, cerveau lean, je contrôle pas mes lyrics
Verre  de lean on my wrist, fais couler
J'pense qu'le temps s'écoule et y a pas de temps à donner
J'consomme clope sur clope, y a que mes poumons à donner
Y a que mes punchs à donner

[Refrain : Gorjuice]
Verre de lean on my wrist
Vas-y fais couler
Tu m'fais trop coller
Bek bek c'est cool
Verre de lean on my wrist
Vas-y fais couler
Tu m'fais trop coller
Bek bek c'est cool
You might also like[Couplet 2 : Vitolo]
Dans la foule j'ai vu la chick
Faut juste qu'elle plane sur la dick
Sale pute, elle y revient toujours elle est addict
Dans la foule j'ai vu la chick
Faut juste qu'elle plane sur la dick
Sale pute, elle y revient toujours elle est addict
Elle y revient à chaque fois comme si elle en avait perdu le goût
Lyonzon sur scène toujours plus extrêmes, on tient la concu par le cou
C'est nous qui se rapprochons le plus de la vérité ici, y a pas de doute
Je vais devoir bloquer sa gorge vu qu'elle voulait me bloquer la route
Lyonzon MGP [?]
Lyonzon, les études, le taf ou bien la weed
Je vais pas la laisser mettre du rouge à lèvres sur sa vitrine
Elle ressemble à la sorcière dans Chihiro miskine

[Refrain : Gorjuice]
Verre de lean on my wrist
Vas-y fais couler
Tu m'fais trop coller
Bek bek c'est cool
Verre de lean on my wrist
Vas-y fais couler
Tu m'fais trop coller
Bek bek c'est cool
[Couplet 3 : Samourai]
On signera pas on le fait tout seuls
En indé en vrai c'est mieux
Chez Gouapo en vrai c'est mieux
Lyonzon arrive on est pas seuls
J'déboule, j'arrive
J'suis fluide comme Majestik
Ressent vertige quand elle cons' la lean
Toute la nuit on médite
Là on cons' la critical
Cons' des substances médicales
Tout se déroule comme prévu, impeccable
Roule un perse
Les liasses s'entassent
J'veux plus de moula plus de pesetas
Pour l'intense job de ces tasses-pé
On verra plus tard comment ça se passe
Là je suis fly comme espace
Je touche papier, wa, money

[Refrain : Gorjuice]
Verre de lean on my wrist
Vas-y fais couler
Tu m'fais trop coller
Bek bek c'est cool
Verre de lean on my wrist
Vas-y fais couler
Tu m'fais trop coller
Bek bek c'est cool
Pas de tabac, coule une douille on s'en bat les couilles
Remets gasolean, remets, remets gasolean
Verre de lean on my wrist
Vas-y fais couler
Tu m'fais trop coller
Bek bek c'est cool
Remets gasolean, remets, remets gasoleanEmbed"
Lyonzon,Le Lobby,"12 ContributorsLe Lobby Lyrics[Gouap]
Le filtre est de cali dans le teh met du GHB dans le thé
Du mal pour l'alimentaire
Guette comment l'avenir est gâtée
Negro j'suis devin, en défense William Saliba
Zéro coup bas, ...

[Mussy]
Elle a perdu sa serviette en ouvrant la porte
(J'recois ? ) des comères, des parents en carton
J'ai plein de sort, j'peux t'enfiler le bâton
J'traine tout mes pas quand faut sortir d'la grotte
Y a pas de perte dans mon entourage
Si t'es plus la...

[Bu$hi]
Y a pas le temps, il a envie de se mélanger
Tous ces rappeur ne peuvent que nous déranger
Le shit est afghan, la beuh-beuh est américaine
Et qu'est ce que dans mon gobelet je vais mélanger
Ma queue sur sa tête quand j'la regarde se déhancher
Jolie comme Marilyn
Beaucoup plus de biff, beaucoup plus de résine
Ils sont tous rincés comme si y sortez du pressing
Bande de con vous êtes beaucoup trop oppressé
Je suis là pour ma maison, mon frère et mon dressing
Et pour celle qui veulent goûter la fessée
Toi tu crois j'dors et j'reste assis
Je partirai avec des dents en platine
C'est pas difficile de baiser cette pute
Donc on va dire que c'est une fille facile
Toi tu crois que j'dors et j'reste assis
Je partirai avec des dents en platine
C'est pas difficile de baiser cette pute
Donc on va dire que c'est une fille facile
Y a que la couleur des billets qui me fascine
Et quand mes jordan sont jdid
Je les garde au lit et je tire dans le mille
You might also like[Jolly]
???

[Mini]Embed"
Lyonzon,Lobby,"3 ContributorsLobby Lyrics[Intro : Gouap]
Et dans la maison, oh, eh
Et dans la maison, il s'en passe beaucoup

[Couplet unique : Gouap]
Et dans ma maison (Maisonnette), il s'en passe beaucoup
Errday, j'nage dans la sip comme Laure Manaudou
J'suis dans [?]
Un rinçage, j'compte une boîte d'aspirine
Té-ma comme on est khali
J'suis dans Punto, fucked up, j'dérape comme au rallye
A personne on s'allie
Moi j'aime que mon Lobby
Et falafel, c'est pas la peine
Aux Pièces Vintage, falafel, touche pas la Play
Putain, j'aime trop mon Lobby
J'peux mourir pour mon Lobby
Et falafel, c'est pas la peine
Aux Pièces Vintage, falafel, touche pas la Play
Putain, j'aime trop mon Lobby
J'peux mourir pour mon LobbyYou might also likeEmbed"
Lyonzon,Lovés*,"1 ContributorLovés* LyricsParoles issues d'un extrait

[Paroles de ""Lovés*""]

[Couplet 1 : Kpri]
[?]
J'roule un plus gros, j'ai stoppé la lean
Même pas b'soin d'bluffer, j'mets all-in
Au lit [?]
Hier, j'avais pas un, maintenant j'rachète ton allée
Ça va bientôt faire une décennie que j'm'allume
J'ai du fumer mon poids en pollen
Avant, j'avais pas un, pas d'requins ni d'baleines
Et j'la touche même pas, elle sent de l'haleine
J'leur est mis tempête, ils m'cherchent jusque dans l'alléeYou might also likeEmbed"
Lyonzon,LY City,"6 ContributorsLY City Lyrics[Couplet 1 : Kpri]
LZ, 69 y a la frappe dans des condiments
Partout c'est desservi, tous les arrondissements
Partout, même pendant le confinement
Ton équipe décimée gît sur le ciment
Ces faces seraient prêts à tout pour une certif
Bientôt le vaisseau tout de diamants serti
Que ça me parle de beldia, j'étais encore en troisième Big Ashe m'en avait sorti
T'es jamais rentré le soir où t'es sorti
Toi ça t'as laissé pour mort dans les orties
Y avait un mouchard dans ton ordi
Dans mon 69 t'entends que des histoires sordides
Lyonzon bientôt sur les grands titres
Et, juste à l’œil, un bout de shit je peux quantifier
Ils l'ont pas senti, peuvent plus s'en tirer
Je m'arrêterai quand j'ai mon rouleur attitré
Je me gaze au volant du T-roc
Je suis jamais en état de pilote
Force et mon kho te ligote
Toi on te voit plus à la fin de l'épilogue
Je baise des mamans y a bien longtemps que je suis plus un ado
Compare moi plus jamais à tes gamins rappeurs bateaux

[Refrain : Mussy]
LY City je me sens pas mieux ailleurs
Toutes ses pétasses n'ont plus de pudeur
Depuis que je suis dedans, je les vois comme des voyeurs
LY City je me sens pas mieux ailleurs
Toutes ses pétasses n'ont plus de pudeur
Depuis que je suis dedans, je les vois comme des voyeurs
LY City je me sens pas mieux ailleurs
Toutes ses pétasses n'ont plus de pudeur
Depuis que je suis dedans, je les vois comme des voyeurs
LY City je me sens pas mieux ailleurs
Toutes ses pétasses n'ont plus de pudeur
Depuis que je suis dedans, je les vois comme des voyeurs
You might also like[Couplet 2 : Jolly]
[?], corro per il cash
Smetterò solo se avrò ste Benz
Pure i weekend, in giro la fam
Sparisci di colpo se infami la gang
[?], corro per il cash
Smetterò solo se avrò ste Benz
Pure i weekend, in giro la fam
Sparisci di colpo se infami la gang
Piove c'è il sole, il mio calibro 9
Faccio la [?], non sono parole
Rappo real, non sono parole
Tempo corre, fra, mi serve un rolex, mi serve un rolex
Tempo corre, fra, mi serve un rolex
Si era un nemico, ma oggi muore
Volevo un nome, ora ho un impero
La strada, sta troia e mi grida te quiero
Come un'ex che non trova di meglio (mai)
Ma sa che non torno
Volevo un nome, ora ho un impero
La strada, sta troia e mi grida te quiero
Come un'ex che non trova di meglio (no, ma sa che non torno)

[Refrain : Mussy]
LY City je me sens pas mieux ailleurs
Toutes ses pétasses n'ont plus de pudeur
Depuis que je suis dedans, je les vois comme des voyeurs
LY City je me sens pas mieux ailleurs
Toutes ses pétasses n'ont plus de pudeur
Depuis que je suis dedans, je les vois comme des voyeurs
LY City je me sens pas mieux ailleurs
Toutes ses pétasses n'ont plus de pudeur
Depuis que je suis dedans, je les vois comme des voyeurs
LY City je me sens pas mieux ailleurs
Toutes ses pétasses n'ont plus de pudeur
Depuis que je suis dedans, je les vois comme des voyeursEmbed"
Lyonzon,Lyonzon Le Gang,"7 ContributorsLyonzon Le Gang Lyrics[Couplet 1: Jolly]
Parlami in faccia, lascia la rete
Parlami in faccia
Non parlare di me, parla con me
Ho dieci anni in meno di te e sono molto più real di te
La tua tipa vuole me, la sua pussy vuole me
Ooh damn Lyonzon le gang
Ooh damn Lyonzon le gang
Ooh damn Lyonzon le gang
Neri neri, [?] ti prendono il posto
Per tutti noi sei già morto
Chiamami mi trovi pronto, mi trovi già di sotto
Neri neri, chiama il soccorso
Giravo senza una [?]
Grazie a dio adesso sono a posto
Neri neri, oh mio dio, siamo in sette nella clio

[Couplet 2: Mazoo]
Ici pas comme une fagget, pas commun d'avoir autant d'phase sous les oigts-d, soulé
Commence à comprendre pourquoi tu vas couler
Manger mes boules et appelle les poulets
Et la fais gaffe au poulain, ça va mieux quand j'me met à rouler
J'ai déboulé, dans ma lean tu veux une goulée
On t'envoie en mission phéner'
Si on investi c'est mort
Wesh c'est pas des cons d'attardés qui vont envisager nos tactiques
Mattes nos visages, ont est pas là par hasard j'crois que t'es parasite actif
Mode 'Florizarre ,elle à la beuh sur l'dos
Moi j'suis sûr d'moi
C'est pas ton son, moi j'bouge en même temps c'est ça qu't'aime
J'suis avec BU$HI, faut cocktail, pas d'la coke, matte la zone
Matte la confiance, j'la baise y a des poissons
Compare nous pas à des passants
You might also like[Couplet 3: BU$HI]
J'ai tâté ses tétés à deux mains, la tête, j'vais péter une garot
Elle habite à Paris c'est loin, l'soleil se couche, j'suis faya loup-garou
Cojones de créole sous l'sapin, voilà ton cadeau
Les groupies font l'tapin pourtant j'ai pas l'million
J'comprends pas trop gars
J'ai potion magique, saute, sur ma bite c'est gratuit pause
Tester la team si t'es fort comme un Broly
J'te roule comme automatique han
Mon némésis c'est Tommy Genesis, j'veux la voir dans un hentaï ou bien un film
J'veux devenir et bosser en Suisse, donc elle voudra lécher ma bite
J'fais ma magie ohh, ma magie marche
Et j'imagine que j'suis mort y a déjà 100 ans
Quand j'suis mal, j'fume un pain et puis j'suis bien
J'fais ma magie, ma magie marcheEmbed"
