Artist,Title,Lyrics
Missié GG,GGDN,"2 ContributorsGGDN LyricsIntwo:

Ah,yô:
Grand Genre de Nègre
Représente:Fuckly,Mister GG
GGDN
Monsieur GG par contre,yô


Rèfwin 1:

An ka èn volé lajan aw é fè sanblé shèshé èvèw
Fèw konpwann ou ni on style lè ou mète tee-shirt aw a lanvè,yô
Viv'èvè bondyé,twavay'pou lusifè
Kwiyé mwen:GGDN,Kwiyé mwwen Grand Genre de Nègre
Lèw vwè mouvman la mové,an koud si:an kay koupé
An pakay kwiyé lanbilans' mè plito ékwi on kouplé
Sponsorizé la violans',a 100% pou la violans'
Kwiyé mwen:GGDN,Kwiyé mwwen Grand Genre de Nègre

An ka èn pikèw:akonpanyèw ay pôté plint'
Pou lèw vwè mwen an lari:pouw pé save gadé mwen dwèt'
Brilé lajol pou on koud'pomp pou on koud'si
Kwiyé mwen:GGDN,Kwiyé mwwen Grand Genre de Nègre
Grand Genre de Nègre a MC's,anbasadè a baston
Pwovokatè,mové lawon:an somme on nouvo Timalon
On salope si on vewsyon ka bouskulèw san diw padon
Kwiyé mwen:GGDN,Kwiyé mwwen Grand Genre de Nègre
You might also like
Kouplé 1:

An eksplisit'é vyolan:si guèl an mwen maké insolan
Salop'é dégèlass'kon gwan mè a zôt'an kolan
Dégoutan,on sôte dè vampaya:bon boug a satan:
Tchouyeur dè sound system inspiré pa le Vatican
Fuckly;:tala ou ay'an mèm jan ou lov'an bistan
Fouwé dwèt aw an shat aw si pawol an mwen eksitan
Doudou pwan plézi kon fanm kè yo ka violé
'èn pann' vou adan on kaz,joustan kou aw viré o violé
Publik la afolé,lé MC's ka batifolé
An sé boss a yo,é an pani ayen a pwouvé
Fuckly pou'w pa invité,boug la fow évité
Sinon,manman'w,tass'aw,sè aw eksité


Rèfwin 2 :

An ka èn volé lajan aw é fè sanblé shèshé èvèw
Fèw konpwann ou ni on style lè ou mète tee-shirt aw a lanvè,yô
Viv'èvè bondyé,twavay'pou lusifè
Kwiyé mwen:GGDN,Kwiyé mwwen Grand Genre de Nègre
Lèw vwè mouvman la mové,an koud si:an kay koupé
An pakay kwiyé lanbilans' mè plito ékwi on kouplé
Sponsorizé la violans',a 100% pou la violans'
Kwiyé mwen:GGDN,Kwiyé mwwen Grand Genre de Nègre
An ka èn pikèw:akonpanyèw ay pôté plint'
Pou lèw vwè mwen an lari:pouw pé save gadé mwen dwèt'
Brilé lajol pou on koud'pomp pou on koud'si
Kwiyé mwen:GGDN,Kwiyé mwwen Grand Genre de Nègre
Grand Genre de Nègre a MC's,anbasadè a baston
Pwovokatè,mové lawon:an somme on nouvo Timalon
On salope si on vewsyon ka bouskulèw san diw padon
Kwiyé mwen:GGDN,Kwiyé mwwen Grand Genre de Nègre


Kouplé 2 :

A ki nèg la ki la?,nèg a mikwo la,boss a mouvman la
Tala ki ka diw tayé la:mèm si ou asheté CD la,ah!
Môso fè la i ka pwanw la lè papaw pa la
Kok an bonda aw tou pandan ou ka siwoté soda,ah,ah
On voyou Limbo,lè janw dè boug dingo
Ka pété chaine a manmanw:pah!la ri Frebault
Mové sado ka pwan tass'aw an sodo,an memb'a N'O
Asheté CD an mwen bann'bobobo,wack m'c ka fwapé bobobo
Yo toute vlé tess N'O mè yo klasé an ba tablobobo
Limbobobo ka shouté lé sale kabobobo
Underground Family:ENEMI!!!!allo maman bobo
An sale kon mové kok an kalson
Souseur dè kôkôte mèm si sa ka santi pwason
On pwazon ka rann fon a kilot aw mawon
Pwopozèw poz koshon:fôsé fanm aw a mawon

Pont:

An ka èn volé lajan aw é fè sanblé shèshé èvèw
Fèw konpwann ou ni on style lè ou mète tee-shirt aw a lanvè,yô
Viv'èvè bondyé,twavay'pou lusifè
Kwiyé mwen:GGDN,Kwiyé mwwen Grand Genre de Nègre

Ah,ah,ah,ah,ah,ah,ah,ah!


Kouplé 3:

Kwiyé mwen Grand Genre de Nègre nwè a gwan zizi a tèt wôz
Chercheur de cavités:shat'nwè a gwan nènèt'wôz
Pa bluff épi mwen,an paka mashé an shosèt wôz
An ka èn'twénèw,mawèw dè Bastè jiss a Sintwôz
Pawôl la klôz an sowt'kè ou pa jin anvi tess'mwen
Si ou vlé bless mwen kon di G-Kill:ou pé po fèss'mwen
Ès'mwen ja jin tchimbé on mic pou kwiyé:Love Jah
Lè an ka vwè mizè an Fuck-a-One:mè di mwen o dja!
La vi two koute:an kay o boute mwen baw bon plézi
Kon lè ou ka jwi:ou save sé o fon ki ni pliss plézi
Ès'ou sézi a ki nèg la yo kwiyé Fuckly?
Tala ki vlé tchouyé moune é woulé an toute sans'intewdi
Style inédi:mèm Bondyé paté'é jin kwè di
Kwiyé mwen GGDN:an ké vine pli puisan ki...ah shitEmbed"
Missié GG,Le Clown,"2 ContributorsLe Clown LyricsYô:sal shyen!
Yô mother fuckerz:sal shyen
Francky Castanet
Espès' dè salôp kiw yé
Jimmy
Ka zô té konpwann'?
Fuck Underground Family


Refrain 1:

Ruffnec le clown,Ruffnec le clown
Ruffnec le clown couché le chien:wouaf,wouaf
Ruffnec le clown,Ruffnec le clown
Ruffnec,Ruffnec
X2


Sous-Refrain 1:

An matièw dè fidélité kanine sé Ruffnec le chien ki o top zéwo
Ruffnec le clown:mon fidèle cabo
Oui mon petit chien:tu es le plus laid
X2

You might also likeCouplet 1:

Francky la pédale:teks aw fèt pou souyé seuf an mwen
Ou sé ti moune a fwè aw:ou ka rapé kon mongolyen
Vou é lé blag pite:zô ka fè yonn adan on skètch
An atandan kolé an tampax an figui aw kon jean strech
An save poukwa ou pa intewnasyonal
Ou ni twope zanmi shyen ka mô si la nasyonal
Dèpi an konèt vou an ja vwè la totale
Moul'a Katwyn fowmolé tèt'aw kon mass'a kawnaval
Shyen salôp'kiw yé ou fôsé mèt aw kon pani
Ou té vlé jouwé lé shyen éran:manjé caca o bô lari
Sorry:an dézolé an pa ti ni zanmi shyen
Si an téka tcheak vou sé pouw paté pé môdé mwen
Shyen méshan dent an plastik,ou kon gaine sans élastik
Ou ka stwésé mwen:figui aw kon jounou a kabwit
Dépozé mic la é pewmét'èw rinsé guèl aw
Pli bèl bitin ou fè an vi aw sé lè'w apwann fèmé guèl aw
Timal ou mal fè:ou ay klashé mwen pa téléfone:a pwopo
An paté save an nish aw ni téléfone
Èvè lè maximum:boug aw ka bay'lè minimum
Mèm'si ou té'é éséyé suiv'mwen:an pa té'é péyè'w pon album



Refrain 2:
Ruffnec le clown,Ruffnec le clown
Ruffnec le clown couché le chien:wouaf,wouaf
Ruffnec le clown,Ruffnec le clown
Ruffnec,Ruffnec
X2


Sous-Refrain 2:

An matièw dè fidélité kanine sé Ruffnec le chien ki o top zéwo
Ruffnec le clown:mon fidèle cabo
Oui mon petit chien:tu es le plus laid
X2


Couplet 2:

Fouwé ké aw an fèss'aw é atann'Nojah rivé
Ou pa wont':plézi aw fè yo sodomizè'w
Ès ou byen sizé?kon skèt sizé si on gode
An save ou enmé sa kon Katwyn enmé sa
Tala ki ka fè cri shak fwa i tann ""Y'en a'
Ka pwan yinki plan A: èss i mèm santi'y pwan'y ah
Pantin:mawiyonèt lontan fil aw koupé
Si vi aw sé la chanson an pa vlé tann on sèl kouplé
Pa wouklé!:shyen a lagoni pé guèl aw fuck up
Èss an jan mandèw si i ka mète bigoudi an twope?
N'O sé mète a zôt':alô pwan kabèsh' a zot
An té pann'yo an kou an mwen si yo bay sens é lô
An sé boss a mouvman la:sé mwen ki mons'a ipop la
Jou la N'O péké la ké ni plass' pou lé boga
Kon Underground Family:on bann' mini vanini
Ay'fè on vésèl pou fanmi aw o lyé ou shanté fwistayl santi
Nojah la grande gueule:Mc an rèle à fesse
Lyrics aw pite é initil kon string an fès'a bèf:wè
Ranjé string aw:stopé règ aw poukwa ou ka vèks?
Lè an ké fine èvèw ou ké pé jouss ka pwan'y pa fèss'

Refrain 3:

Ruffnec le clown,Ruffnec le clown
Ruffnec le clown couché le chien:wouaf,wouaf
Ruffnec le clown,Ruffnec le clown
Ruffnec,Ruffnec
X2

Sous-Refrain 3:

An matièw dè fidélité kanine sé Ruffnec le chien ki o top zéwo
Ruffnec le clown:mon fidèle cabo
Oui mon petit chien:tu es le plus laid
X2




Couplet 3:

Francky!:ésayé abiyèw désaman
Lass mèt'linj ba kabann twouvé résaman
Ou an shèntingue mèm jan ghetto la an shèntingue
Jou la vou é Katwyn en'n pwan'y pou on nish a shyen
Vou é L'Undergound zô ka shanté kon shass'a watè
Dèpi zô si podium ou té'é di on konsè a salle de bain
Ki moune ou yé?ou plito kaw ka repwézant?
Fo yo gadèw èvè on sèl zyé pou ke lôte la pa gaté
Djèl aw défazé:ou ka sanm on shyen kè yo mal kwazé
Sôti'w owa an mwen:ou ka pite:ou ka santi mové
Shyen la ki pwan Katwyn dwèt baye on poz ki mové
Pou vou é fwè aw sôti mongol é andikapé
Yon guèl ay takté:lôte la dwèt kon fizé
On high top sale an tèt aw kon balé adan on lawmwa
Mèm Castanet ki enmé shyen té bon épi zôte
Douvan salopté a zôte rèfizé èt bopè a zôte
Bwat a gag kasé:suffit,couché,assez
A pa fôte an mwen si ti zizi wôz aw kasé
Ou veksé,guèl aw kwensé kon fèss'fèmé
Bonda aw shiré:ouvè guèl a Nojah pou'w pisé


Sous-Refrain 4:

An matièw dè fidélité kanine sé Ruffnec le chien ki o top zéwo
Ruffnec le clown:mon fidèle cabo
Oui mon petit chien:tu es le plus laid

An matièw dè fidélité kanine...Embed"
Missié GG,Le loup,"2 ContributorsLe loup Lyrics[Intro]
Yeah baby
Dis l'heure de ragga
C'est cool baby
Pas flipper, pas flipper, pas flipper
Promenons-nous dans les bois
Vu qu'la vicieuse n'y est pas!
Ahou!!!
Je suis le loup

[Refrain 1 (*2)]
Ahou!!!
Pourquoi ta tête est comme ça?
Ahou!!!
Pourquoi t'es timide comme ça?
Ahou!!!
J'te croyais pas comme ça?
Ahou!!!
Je suis le loup!

[Couplet 1]
Ok
Il était une fois un gentil loup dans la forêt
Tout l'monde l'aimait même les enfant l'adoraient
Il aimait gambader, s'amuser sur le chemin
J'aurais préféré jouer avec le renard et la belеtte
Un jour de printemps tandis qu'il sе promenait
Il ne se doutait pas qu'une nymphomane le suivait
Cachée dans les bois entre les arbres, le guettait
J'aurais préféré jouer avec le renard et la belette
Petit chaperon rouge mais voyons mais qu'est-ce que tu m'fais
Mon grand-père m'attend faut qu'j'lui apporte du feu
Mais que fais-tu dans la forêt en p'tite culotte et soutien
Tu m'fais peur laisse-moi cueillir mes fleurs
Elle se jeta sur lui comme une chienne en chaleur
Lui bouffa la queue pendant des heures et des heures
Le loup pris d'panique poussa des cris de terreur
Je suis le loup, au secours!
You might also like[Refrain 1 (*2)]
Ahou!!!
Pourquoi ta tête est comme ça?
Ahou!!!
Pourquoi t'es timide comme ça?
Ahou!!!
J'te croyais pas comme ça?
Ahou!!!
Je suis le loup!

[Couplet 2]
Ok
Petit chaperon rouge n'était pas satisfaite
D'ailleurs en ce moment, n'avait qu'une seule chose en tête
Se taper le père loup, pensait qu'à lui faire sa fête
La porte était fermée, elle est passée par la fenêtre
Le loup ne se doutait pas de c'qui se préparait
Allongé sur son lit, paisiblement se reposait
Quand il aperçut les seufs de la nympho qui dépassaient
J'aurais préféré jouer avec le renard et la belette

[Refrain 2]
Pourquoi t'es fringuée comme ça?
(C'est pour te faire plaisir grand-père loup)
Pourquoi tes seins sont comme ça?
(C'est pour mieux respirer grand-père loup)
Pourquoi ta voix est comme ça?
(J'ai marché sous la pluie j'ai la voix cassée)
Pourquoi tes lèvres sont comme ça?
(C'est pour te chatouiller, je veux te bouffer)
[Refrain 1 (*2)]
Ahou!!!
Pourquoi ta tête est comme ça?
Ahou!!!
Pourquoi t'es timide comme ça?
Ahou!!!
J'te croyais pas comme ça?
Ahou!!!
Je suis le loup!

[Pont (*2)]
On veut voir, on veut voir, on veut voir les mains en l'air
Si t'es un loup, lève les mains en l'air
Tous les loups et toutes les louves et tous les loups et tous les loups
Toutes les femmes, levez les mains en l'air

[Interlude]
Promenons-nous dans les bois
Vu qu'la vicieuse n'y est pas
Ahou!!!
Pourquoi t'es fringuée comme ça?
(C'est pour te faire plaisir grand-père loup)

[Refrain 1 (*2)]
Ahou!!!
Pourquoi ta tête est comme ça?
Ahou!!!
Pourquoi t'es timide comme ça?
Ahou!!!
J'te croyais pas comme ça?
Ahou!!!
Je suis le loup!
[Outro]
Dis l'heure de ragga
On répète ça?Embed"
Missié GG,Noé,"2 ContributorsNoé LyricsIntro:

Yô,yô
Mister GG:Represent yô:GGDN:misyé GG
Hey yô:tcheak sa!ah,ah,ah
Gwan janw dè nèg:wiiii:ah,ah,ah
Ou ja konèt niggaz
Represent:ah!:Zi two .0.0 school:da zoo:yô


Couplet 1:

J'ai débarqué mon putain d'flow dans l'Arche de Noé
J'étais le seul rappeur hardcore à bord quand l'Arche a échoué
Noé sentait qu'j'ai assuré en gros:c'qu'il fallait
Ces cons qui n'ont pas cru au déluge sont morts tous noyés
Pendant des siècles et des siècles j'enseignais mes techniques
Tu sais déjà d'où viennent les putains d'platines technics
Quoi?!:c'est vrai:j'ai tout fait de A à Z
Ça commence à New-York pour s'terminer à mon bled:yô
Les rimes me dépriment:donc il faut que j'les supprime
J'dis seulement Ol'Dirty Bastar:Basta s'exprime
Fallait j'pense à tout:donc j'ai crée Busta:
Un pti gars speed avec des locks qui fait ""Whoa""
J'avais pas l'choix:du coup j'ai changé d'méthode
Tu sais déjà c'est qui qui s'pointe:regardes ses méthodes,man!:
Ah!j'parie que j'te mets raide man:mes méthodes étaient trop cool:
Encore plus que tes discours
Ah ce doggy Dog:son dog a fini en hold up
Alors j'ai cherché un pitt:dans DMX in my dog:yô
Même dans l'bon:y'à l'mauvais:j'le reconnais
J'ai pas fait gaffe:ça a donné du gansta rap:
Les hommes sont si mauvais que plus d'une fois:j'en ai eu marre
Quant ils ont butté Tupac:j'ai voulu mettre fin à l'histoire
À croire c'est c'qu'ils voulaient:
Ils buttent B.I.G:qu'est-ce qu'tu veux:j'leur avait dit
Pas d'mélange rap et nes-biz car:
You might also like
Refrain 1:

Je remercie Noé:pour son canoé
Grace à l'Arche de Noé:mon ipop gwad est né
Je remercie Noé:pour son canoé
Et Mister GG ,et Mister GG
X2


Couplet 2:

J'ai du inventé l'H.I.P:surement qu'j'avais quelque chose à choper
Un mic,deux platines,ampli,une table:j'lai pas loupé
J'travaille avec les meilleurs chaines:demande à Cut Killer
Où il a prit ses mix?et dans la main de quel dealer?
Allez dis leur:que j'dors pas:disons que j'm'endors pas:
Il a réponse à tout même si t'es underground:comme l'égou:
Remonte à la surface:c'qu'elle est bonne Foxy
Elle vend du rap et du sexe:j'm'en tape:c'est mon new concept
Bientôt l'Apocalypse:que Dieu me pardonne de mes vices
J't'ai empreigné:ma tâche au cul:comme un jean Levis
Noé:souviens toi de l'époque où on niquait la police:
NTM ont fait de même:et ça donne 'Nique la police""
Avec du vieux j'fais du neuf:demandes à Puff si j'l'bluff
Oxmo s'la joue comme Clifo:comme as c'est c'qu'il faut dire
Que j'dise tout à ces mecs pour qu'il y arrivent
Si j'mets pas mon grain d'sel:c'est sur qu'ils verront pas la rive
Et KRS,KRS:croit qu'il a crée l'hardcore!:
Mais toi qui sait l'Histoire:tu sais maintenant comme il a tord?
Si j'calcule bien:il est né dix siècles trop tard,et encore!:
Avec ma machine:y'a toujours quelque chose qui foire,car:

Refrain 2:

Je remercie Noé:pour son canoé
Grace à l'Arche de Noé:mon ipop gwad est né
Je remercie Noé:pour son canoé
Et Mister GG ,et Mister GG
X2


Couplet 3 :

Dis toi bien que j'suis Highlander,mais en version améliorée
Donne moi un putain d'mic,et branle toi avec ton épée
J'laisse faire les hommes:ils peuvent toujours s'vanter
Mille ans avant le Christ:j'faisais un double CD
J'ai insquinté l'mur:t'as décidé qu'c'était un tag
Une autre fois j'ai pissé:t'as eu l'culot d'appelé ça Graff
L'autre fois j'ai fais un truc:maintenant ils disent que c'est un scratch
Bref:quand j'fais pas gaffe:on dit que j'ajoute un paragraphe aux mots
J'ai une bombe qui va exploser dans mon labo
70 kilos qui tapent mortellement sur un plateau
Un truc nouveau qui s'passe jusqu'à la mort comme Rambo
Votez vite GGDN avec des arguments au kilo
J'vais pas te raconter la suite:ce serait trop long
Obligé d'limiter à 3m30 la durée d'une version
Le prochain tube j'le sors d'ici trois milliard d'années
Le temps que j'netoie mon stud:du style passer un bon coup d'balaie
D'ici là n'hésite pas à me contacter:6.6.6 j'suis dans l'enfer N'O Clan
Tu sonnes:tu rentres:laisses ton arme au bas de la porte
Demandes pour le Dieu du H.I.P et reste hors champ avec mes flammes car:

Je remercie Noé:pour son canoé
Grace à l'Arche de Noé:non c'est pas terminé
J'suis pas le style de mec à baclé mes textes:
J'le fais à plein temps temps:il m'l'a piqué ce Busta flex


Refrain 3:

Je remercie Noé:pour son canoé
Grace à l'Arche de Noé:mon ipop gwad est né
Je remercie Noé:pour son canoé
Et Mister GG ,et Mister GG
X2Embed"
Missié GG,Plan Carré,"2 ContributorsPlan Carré LyricsIntro:
Intro:

De toute façon c'est ma faute hein:
Tout est d'ma faute

Pont 1 :

Mais qu'est-ce que ça peut nous foutre que ça soit de ta faute:
Pauvre con!:fallait pas nous emmené là:
On est dans la merde à cause de toi
Et tout ce que tu trouves à faire c'est être juste bon
Te lamenter sur ton sort
T'as rien dans l'bide:t'es bon à être le larbin chez ta femme
C'est tout ce que t'es bon!:pauvre con!
On est dans la merde:on va tous crever là
On est dans la merde à cause de toi:parce que t'es qu'un con
Et puis t'es cocu t'es cocu tout l'temps demandes!


Couplet 1:

Yô,yô:imajiné on plan karé èvè on go chato a la klé
On big karé a séparé a 3 si sa paté fwaré
6 chambres,2 salons;3 vidéos,7 télés
Chaine an lô,diaman,émeraude:ou ka gadé twope télé,ah
Plan la té shuite pa té ni rézon flip
Sété ay speed:mète kaz la vide:é pati speed
On plan pwofésyonèl:on sèl alé:pani ritounèl
Ou pa vlé ay lajol:pa pwan'y kon mwen:pwan'y a la pewsonèl,man
An té ni konfyans a 100% an kawtyé la sété dé bad
Dé vré,an gwo dé gwo déman,gwo déman o fwon déman
Désidéman an pani shans'an ba dé pè kalott:
Yo fine pa bay nom é prénom:
Pou on fwa an té ni lokaz a kité la vièy vi
Voyaj,pétass,kayass,wè:sa sé la bèl' vi
Komandé koukoune an fast food,asheté aksyon Hollywood
Être calife à la place du calife,kon Iznogoud,mè:
Toujou ni on mè ki ka fè kè plan la fwaré
Bon sa nou ké vwè sa plita o dézièm kouplé
You might also like
Pont 2:

Mais qu'est-ce que ça peut nous foutre que ça soit de ta faute:
Pauvre con!:fallait pas nous emmené là:
On est dans la merde à cause de toi
Et tout ce que tu trouves à faire c'est être juste bon
Te lamenter sur ton sort:t'as rien dans l'bide


Couplet 2:

Dézièm'kouplé:si balan la nou té a twa
Twa kon twa dwèt poliss desann si nou pa kat:
Baléyaj,chlibidip:jandam'ka tann'chlibidip:
Awestasyon bidon a yo pani tan diré 6 minit
Direksyon pwentapit':on réyèl koud filé moins un
Évidaman kè an tayé:ou'ka oubliyé ki moune an yé?!
Blem-pwo la:on gwo koshon ki pa mèm soté on bayé
Èvè on gwan longuè ki ka kouwi djèl ay anlè:blah
Guèl ay bouwé si on finèt ki té ouvè:ou vwè?
Mè kaw vlé fè lè ou ni afè èvè tèbè
Poutan,an pa on blé:an sé on pwo a pété bwa
Spésyaliss an kôfwe fô,ké-bra la bak eksétéra
Mè la an pèd fwa:dizon an aji kon amatè
Film an mwen té'é pwan oska :si an té'é pwan pli bon aktè
Le landèmen matin:pou on fwa an lévé gwan bonè
Ou pa'a jin save:o ka sé kwamp'la balansé mwen
Comme dit:comme fait:sizè mwen dis' pil
Poliss ka gason,anviwon 30 hélico:ou téké kwèw adan Léon
Sizé o balkon:o pwèmyé plan kon spektatè:
Kom la an on ti jan lass':nou ké vwè sa o twazièm kouplé,yô



Pont 3:

De toute façon c'est ma faute hein:tout est d'ma faute
Mais qu'est-ce que ça peut nous foutre que ça soit de ta faute:
Pauvre con!:fallait pas nous emmené là:
On est dans la merde à cause de toi
Et tout ce que tu trouves à faire c'est être juste lbon
Te lamenter sur ton sort:t'as rien dans l'bide
T'es bon à être le larbin chez ta femme
C'est tout ce que t'es bon!:pauvre con!
On est dans la merde:on va tous crever là
On est dans la merde à cause de toi:parce que t'es qu'un con
Et puis t'es cocu t'es cocu



Couplet 3:

Twazièm séans':an on sinéma é fanm an mwen
Nou té pou aye vwè ""Titanic"":an fèt nou pwan on dôt' shimen
A pwemyèw vu:film la réyèl,afishe la pa two débièl'
Titr'la:aye si plan tou sèl gwada,pwoduksyon N'O Clan
Pétass'an mwen vénèw:an oubliyé fo'an té bay' dwèt:oh,oh
Film la té bad é an paté tin'sa an tèt timal
Sa pa pli mal:pou on fwa dwèt aw pa'a fèw mal
Nowmal:lè nou ansanm an ka twouvé toute film koushal
Poukwa sé o sinéma i ka anvi fè sinéma?
Péyé pou'w bwè salive ou suiv:sa sé plan sinéma
Toujou lé mèm klima:min an mwen ka sèvi tewmomèt'
Lè le minè pèd fwa,le majè ka vine pwan la relèv'
A on dwèt long' dè 6 mèt'èvè on diamèt'dè twa mèt'
Anbyans'jénital total:dé min an mwen ka tranpèt'
Mèm pa on jean C17,ou byen Lévis salopèt'
Sé inki jupe pli kout'ki sa:ou pé mèm baye on rakèt
San kilot':pa mèm on string fwè la:a pa pou Janet
Lè i ka desann'leskalyé la an ka sipôté on pakèt'
Imajiné kè i tonbé:plézi an mwen pa tcheak li
Ô,ô:fo sovgawdé répitasyon a Fuckly
Eksitasyon ay biza:sé swa si mwen,ou si aktè la
Dènyé fwa an mèt'an dwèt i di:oui spleen je suis à toi voilà,wè
La vérité fine pa eksplozé:
I fè mwen pèd fil an mwen adan on film kon Keyser Söze
Film la réyèl:vo myé an té aye si plan tou sèl:
I sétè,film la fine:an fouye a pyé sé lésansyèl

C'est comme ça qu'on s'fait buter quelques fois:
Bande de bites mollesEmbed"
Missié GG,Rolé,"2 ContributorsRolé Lyrics[Intro]
-Hé ouais gay sa an ka sanm, an bizin rentré la fwèw
-Awa ou pa'a rentré hein
-Hé-hé déja pa mannyé mwen man, gay sa an bizin rentré fwèw
- Hé déman kay ka fèt la ?!
-An ka pété sa si misyé !
-Awa messyé, zo' an shôt
-Ki shôt timal, nou ni chif si nou, nou vinn pwen pyé an nou !
-Awa mè messyé, zo' an shôt
-Hé, sé messyé vé kozé on pwoblem la, an la osi ..!
Sé messyé vé kozé on pwoblem la o swè la... Hé zo pa'a rentré !
Band dè chyen ki zot yé !

[Refrain]
Champagne, bling-bling, jet-set
A pènn an fè dé mèt' kè an ka tann ""Egri !""
Mé kay ka fèt an karé la, oh lé pagna é lé scarla
Obligé tann kè swaré la
""Rolé !""

[Couplet 1]
Comme d'habitude, an vinn an Beema, a pènn on pyé posé
Atmosfè la ja chanjé clima
Tout moun savé kè sé on gwo ty-pa, é ni on pomp adan kôf la
O ka ni yonn ki vé fè ji-ma, ok lé ga zo tout la sympa
Mwen pozé sif-ma, é si nou la sé pou pwen pyé la
Di lé boufon pa rété la, ay kriyé boss la
Di'y fè mannèv, ouvè pôt la
An vinn an shôt, vijil la ja égri, mé sa yo sav la
O swè la an cash money, rolé
Fô zot arété fè feeling, pas sa ké mal finn
Atta faya victim, bling-bling
Alè sé kon ou vé (jen ou vé)
E pa fan'n fè kôlè sinon ou ké touvé sa ou vé
Pa méchansté ou pa vé less'an entré, goumé zo vé goumé
An la pou reprézenté
You might also like[Refrain]
Champagne, bling-bling, jet-set
A pènn an fè dé mèt' kè an ka tann ""Egri !""
Mé kay ka fèt an karé la, oh lé pagna é lé scarla
Obligé tann kè swaré la
""Rolé !""
(x2)

[Couplet 2]
Zo vé joué lé gos-bo, mé si janmè yon tchoké mwen
An kenn pété guèl ay ""BLOW!"", an jen a zot zo kosto
Man kenn fou zot on kou krik a scoutè Piaggio, sa ka fè zot ri
Man ni dé twa pag chinwa kon Jackie Chan é Bruce Lee
Zo vinn èvè bal san fizi, zo kouyon kouyon a zot
Kon la band a Fuckly
An ja konèt dé pi [?], toujou vé baréw si sa ou tann
Ou sé on volè, on tapèt, ouvè guèl aw
Di mwen kay ka fèt, mwen é lé pagna nou ké rentré en mèt
Zo péké fè nou an mèd (Woy !)
Tou pendan an ka palé, yonn long ja eséyé bousculé mwen
Fouté on kou pyé, rentré on kouto an vent an mwen
Y té vé chopé mwen en trèt, an fou sa on baléyèt, on manchèt
Cool out, y cool out

[Refrain]
Champagne, bling-bling, jet-set
A pènn an fè dé mèt' kè an ka tann ""Egri !""
Mé kay ka fèt an karé la, oh lé pagna é lé scarla
Obligé tann kè swaré la
""Rolé !""
(x2)
[Couplet 3]
Esk zot la pou represent
(Oui nou la pou represent)
Ni on bon moman sé messyé ka énervé mwen
Yo la pou nargué mwen épi ataké mwen
Lé ga, édé mwen sé messyé vé masé mwen
On goumé lévé, pôt ja pété, sono krazé
Guèl a vijil chiré, rolé, lacrimogèn an sal la
Pwofité dè panik man pé tayé èvè kess la
Mouvman la déjénéré, a lè ki lè, zafè mélé
Tout bwèt ja chaviré, di mwen ki moun ka déliré
Considéré ou lwen dè imajiné fôs an pé généré
Styl é dérèspè total kè an pa ka toléré
Mi sé kon sa kè sa ka fèt (Ruff !)
Mentalité rolé, a lè ou sav ki moun an yé, yo !
Kontinyé palé aw, fè wol a tèbè aw
Dèpi ou vwè nou rivé, sé lésé nou rentré

[Refrain]
Champagne, bling-bling, jet-set
A pènn an fè dé mèt' kè an ka tann ""Egri !""
Mé kay ka fèt an karé la, oh lé pagna é lé scarla
Obligé tann kè swaré la
""Rolé !""
(x3)Embed"
