Artist,Title,Lyrics
Missié GG,San vou,"3 ContributorsSan vou Lyrics[Intro]

Dasha:
Dasha !
Misié GG

Comme d’hab i ka di an so fresh, an so fresh, I’m so fresh !
Comme d’hab i ka di an so fresh, I’m so fresh ! I’m so fresh !

[Couplet 1]

Misié GG:
Ou so fresh gyal ! Ou so clean !
Ou ni la first class, épi ou ni tròp style
Love à l’état pure, Cupidon pé di-w-li
Nobody pa sav sa an ka rèsanti
Yo di an trò sansib, trò romantik
Zanmi an-mwen ka dakò ralanti, an trò speed
Fè-mwen on sign, pa lésé-mwen an sursi !
Ban 06 a-w an ka dakò baby !

[Refrain]

Kijan an ké fè san vou ? Baby dou…
Sé sèl fason kè mwen touvé pou di-w-li
An gravé non a-vou an kè an-mwen
Sé sèl mwayen kè mwen touvé pou di-w-li
Kijan an ké fè san vou ? Baby dou…
Pli bèl fason kè mwen touvé pou di-w-li
An gravé non a-vou an kè an-mwen
Sé sèl mwayen kè mwen touvé pou di-w-li
You might also like[Couplet 2]

Dasha:
An ja ka vwè-w kadé, pran-mwen pou pwa, pou on viktim
Kouyonné-mwen jis pou pasé on moman entim
Ou ja kèksyonné-mwen, ja anvi kriyé-mwen
Tousa blabla, san menm konnèt non an-mwen…
Timal, ou trò présé !
Ou ja pran tròp balan !
A pa an wòl a Don Juan kè ou ni plis talan…
An ké sédé, mè fo-w ké ban-mwen tan
Aprann a konnèt-nou, pou mwen sé sa ki enpòtan

[Refrain]

Misié GG:
Ka mwen ké fè san vou ? Baby dou…
Pli bèl fason kè mwen touvé pou di-w-li
An gravé non a-vou an kè an-mwen
Sé sèl mwayen kè mwen touvé pou di-w-li
Ka mwen ké fè san vou ? Baby dou…
Pli bèl fason kè mwen touvé pou di-w-li
An gravé non a-vou an kè an-mwen
Sé sèl mwayеn kè mwen touvé pou di-w-li

[Couplet 3]
Lè ou ka pasé an kartyé-la, sa près majik !
Polis ka pèd kontròl, dilè ka stop trafik !
Kom ou sé dinamit, toutmoun an mòd panik. (Na na na na…)
Ès ni mo pou défini ki jan ou volkanik !?
Ou an slow motion wòb-la ka désann tight !
Tròp émosyon kè-la ka pati an live
An ni on dévosyon ba-w, ki pa ni pon fay
On èksitasyon, an ké pasé si lé détay…
Ou an slow motion wòb-la ka désann tight !
Tròp émosyon kè-la ka pati an live
An ni on dévosyon ba-w, ki pa ni pon fay
On èksitasyon, S’il tе plait négotions… (?)

[Refrain]

Dasha:
Ka mwen ké fè san vou ? Baby dou…
Sé sèl mannyè kè mwen touvé pou di-w-li
Gravé kon tatoo an kè an-mwen
Pli bèl fason kè mwen touvé pou di-w-li
Ka mwen ké fè san vou ? Baby dou…
Sé sèl mannyè kè mwen touvé pou di-w-li
An gravé non a-vou an kè an-mwen
Pli bèl fason kè mwen touvé pou di-w-li

[Couplet 4]
Chak fwa an té ka pasé, jòdi ou osé vin palé ban-mwen…
Èskè fo an lésé-y pasé, style kè mwen blazé ?
An ni on lidé mè an pa sav sa ki ka antann-mwen
Tèlman kèksyon an ka posé-mwen
Ès ou ké pé rasiré-mwen ?
Si ou ké la pou mwen dèmen
Ès ou pa la sèlman pou kò an-mwen ?
Tèlman kèksyon an ka posé-mwen
Ès ou ké pé rasiré-mwen ?
Si ou ké la pou mwen dèmen
Ès ou pa la sèlman pou kò an-mwen ? Baby…

[Refrain]

Dasha & Misié GG:
Ka mwen ké fè san vou ? Baby dou…
Pli bèl fason kè mwen touvé pou di-w-li
An gravé non a-vou an kè an-mwen
Sé sèl mannyè kè mwen touvé pou di-w-li
Ka mwen ké fè san vou ? Baby dou…
Pli bèl fason kè mwen touvé pou di-w-li
An gravé non a-vou an kè an-mwen
Pli bèl fason kè mwen touvé pou di-w-li

[Pont]

(Ho-ou-ho)
(Ho-ou-ho)
(Ho-ou-ho)

(Ho-ou-ho)
(Ho-ou-ho)
(Ho-ou-ho)

(Hoho-ou-ho)
(Hoho-ou-ho) (Attention !)
(Hoho-ou-ho)
(Ay ! Dégéné !)

(Hoho-ho)
(Hoho-ho)
(Hoho-ou-ho)
(Hoho-ou-ho)
(Hoho-ou-ho)(Ay ! Dégéné !)

[Outro]

Dasha:
Comme d’hab i ka di an so fresh, an so fresh, I’m so fresh !
Comme d’hab i ka di an so fresh, I’m so fresh ! I’m so fresh !

(Ho-ou-ho)
(Ho-ou-ho)
(Ho-ou-ho)

Misié GG:
Dasha !
GG ! GG !

Pétèt kè ou ja pri ?
Mé ou las èvè Nicy. (?)
Pétèt ou ka sòti épi on dòt bandi ?
Pa di-mwen sa baby, baby, baby…
Pa di-mwen sa baby, baby, baby…Embed"
Missié GG,Sexy Lady,"4 ContributorsSexy Lady LyricsA,an,an yô come on baby
Misyé Gg an diw:ou tan,tan,an,an
Baby,an an


Refrain 1 (Chang Lee):

Mè ki mannyè ou vé sa?
Mè ki mannyè ou vé pwan sa baby o swè la?,an,an
Mè ki mannyè ou vé sa?
Mè ki mannyè ou vé pwan'y baby o swè la?,an,an
X2

Pont (Dominique Lorté:

Ban mwen'y kon sa,Ban mwen'y konsa
Ban mwen'y kon sa,Ban mwen'y konsa


Couplet 1 (Fuckly):

Yô,yô an,an,tcheak
Sexy ladies:ou sé on flè kè'an vlé bitiné
Mèm si siklôn'pasé an péké jin lésé vou fané
Si an té on poèt an té'é montwèw jan'an ka konvwatèw
Domaj lé mo si fèb pou ekspwimé la pèn
Inki dè pansé kè ou pé trasé,lésé mwen tombé
An ka santi mwen ka fleshi:jiss'kè an mwen ka sényé
Toute byen gadé:si nou ansanm':sa té ja ékwi
Alô pa kasé vaz la paskè sa ké riské dè rann'mwen égwi
Pani pliss ki an dôt:é on dôt pani pliss kiw
Èvè'w an konèt toute:le méyéw épi le pir
É pui pou tan kè nou ansanm:finalman nou fine pa sanm
An pa save si'w rèmawké mè vou é  mwen nou ka fè yonn babe
You might also like
Refrain 2 (Chang Lee):

Mè ki mannyè ou vé sa?
Mè ki mannyè ou vé pwan sa baby o swè la?,an,an
Mè ki mannyè ou vé sa?
Mè ki mannyè ou vé pwan'y baby o swè la?,an,an
X2

Pont (Dominique Lorté:

Ban mwen'y kon sa,Ban mwen'y konsa
Ban mwen'y kon sa,Ban mwen'y konsa


Couplet 2 (Watè MC):

Babe,an,hey,baby
Dèpi pwèmyé fwa mwen vwè'w baby:mwen monté anlè
Dèpi sa,an tèt an mwen:mwen té ja sav kè yo dead
Yo pé di,yo pé fè sa yo vé:nou paka tan'n on mèd
An enmèw,ou enmé mwen baby:nou paka tan'n on mèd
Si janmè on jou nou kasé:lespwi an mwen ké fwakasé
Mwen ké pwyé bondyé pou vou é mwen sa woukoumansé
Obsewvé:rété kouté jan mwen ka palé:
Ou ké konpwan'n babe konbyen pou mwen ou ka konté
Ou pé pa konté konbyen fwa mwen ja fè'w pléré
Pasyon,ki jwa é gété an kè aw mwen ja pôté
Konsewvé,présewvé,rénové,inové
Tij a lanmou pou lanmou an nou toujou tijé
Ès ou ka pijé?ès ou ka sonjé?
Word up:fo nou suwmonté toute danjé
Jéré pou ayen pa resté kashé
Dayè pou yon:woté string aw mwen vwè sa'w ka kashé

Refrain 3 (Chang Lee):

Mè ki mannyè ou vé sa?
Mè ki mannyè ou vé pwan sa baby o swè la?,an,an
Mè ki mannyè ou vé sa?
Mè ki mannyè ou vé pwan'y baby o swè la?,an,an
X2

Pont (Dominique Lorté:

Ban mwen'y kon sa,Ban mwen'y konsa
Ban mwen'y kon sa,Ban mwen'y konsa


Couplet 3 (Skud MC):

An pa vé dôte kiw!:paskè sé vou ka asouvi
Ninpôt ki plézi:ninpôt ki dézi
Kè mwen pa kapab'dè twouvé dôte koté siw pa té ka ekzisté
La vi ban mwen té ké on kanivo pou mwen pé éré
Kon golomine lespwi an mwen téké pati an ruin'
Paskè sé vou ki sans'an mwen darling
Tou sa ki ni de mové ja mérité dispatché
Pou nou atèn on dimansyon kè lèv'an nou ké testé
Vou é mwen darling:kouté mwen darling
Mè kijan ou vé kè mwen baw li o swè la baby?
Ké twouvé teknik pou pé sav'vè vou pwan plézi
Dè tou sa mwen tini pou lov'an nou divini crazy
Pou nou pati on koté kè toute moune ka inyoré
Kè lanmou ka pwotéjé kè le mal pé pa apwoshé
Lésé mwen diw kè sé pou vou kè tini plass an kè a toute nonm
Mè sé mwen ki si la plass' yeah

Refrain 4:

Mè ki mannyè ou vé sa?
Mè ki mannyè ou vé pwan sa baby o swè la?,an,an
Mè ki mannyè ou vé sa?
Mè ki mannyè ou vé pwan'y baby o swè la?,an,an
X2
Ban mwen'y kon sa,Ban mwen'y konsa
Ban mwen'y kon sa,Ban mwen'y konsaEmbed"
Missié GG,Superstar,"2 ContributorsSuperstar LyricsIntro:

Ah,ah,ah Come on here
Baby:Mister GG
Gran janw dè nèg
Yô,yô
Sé super superstar
Come on baby girl
Mwen di vou


Refrain 1:

Dèpi yo konèt mwen:yo mète super douvan star
Sé super super superstar
Microphone an mwen limé:apré mwen pani star yô
Pani pani pani star
Hey Mister GG:hey!:sé super super superstar
Hey Mister GG:ho!:sé super super superstar


Couplet 1:

GG ni twope style,docside,Jamaican Style
Locks ay,èvè dé gawd du kô a boxe-taï
Adan on freestyle:ou save sé mwen ki ni pliss style
Fèw dansé asi son bizaw kon adan X-Files
Style an mwen mérité pwan an foto
Mète fess'an mwen a pwal kon ta Dominique Coco
Ou poko vwè kijan mwen ka baw li
Kè ou ja ay di sé mwen ki pli fô ki Fuckly
An super kon ESSO,star kon Sobesso
An toute jan an dwèt sôti adan on véso
Trip-ego an mwen intégwal kon MCM
An ka sinyé otogwaf mèm adan sound systèm
Sé mwen mèm:gwan janw dè nèg oups!
Gwan janw dè nèg nwè:nèg nwè,modèl dè nèg mèg nwè:wè!
Yo toute téké swété èt mwen:ka sanblé yo a toute
Pou yo pé save dead mwen
Mè mwen ni on poz douvan lenmi:
Kon si an té ka bwonzé si on plaj Miami
Fuckly:é pon moune pé pa dead li ,ni tess' li
Sinon Fuckly ké fuck you
Lèw ni on powtab':mwen ni on talkie Walkie
Lè ou ka pati lagé mwen ka baw fanm aw zizi
Gadé mwen byen mwen pani pon style a fri-fri
Freaky,freaky,freaky
You might also like
Refrain 2:

Dèpi yo konèt mwen:yo mète super douvan star
Sé super super superstar
Microphone an mwen limé:apré mwen pani star yô
Pani pani pani star
Hey Mister GG:hey!:sé super super superstar
Hey Mister GG:ho!:sé super super superstar


Couplet 2:

An ni on big posyon magik pou rann mwen kosto
Èvè dé kalité abdo pou voyéw fè on séjou losto
Ou save sa mwen yé,ou save sa mwen vo
Èvè on woch an min an mwen an paré bate la gè Kosovo
An poch'an mwen on kapsul:pich:on moto
Vroum,vroum:vroum,vroum:kap si Limbo
Pa flip bon:si pani esans'fè kôd Lisa
Pi'y pè anbawké mwen adan on dôte séri biza
Twope soundboy bankal vé tess'mwen an pangal
Kôte kasé boushe kasé:pa tess Steven Seagal
An sé on sôte dè gangstè intewnasyonal
Wi sé mwen mèm:sé tèt an mwen ou vwè si jounal
On gwan nonm cool ka jouwé kon i di yo
Min an mwen an fess a fanm aw pandan kè ou ka jouwé yoyo
Mc pédal si instwumantal:ipop aw ke dal:teks aw two banal
Ou ni shans ou po'o vine adan tcheak kanal
Kon Tao paï paï an ka en'tchouyèw èvè on sandal
An sé best la:boss la asi plass'la:mons's la
Ki save shalviré toute soss'la
Adan soss la an pa bizin sapé an Coste-La
Pou tcheak dé twa lope-sa èvè dé big bonda kon sa
Yô,yô hey yo big bonda kon sa:non!:big bonda kon sa

Refrain 3:

Dèpi yo konèt mwen:yo mète super douvan star
Sé super super superstar
Microphone an mwen limé:apré mwen pani star yô
Pani pani pani star
Hey Mister GG:hey!:sé super super superstar
Hey Mister GG:ho!:sé super super superstar


Couplet 3:

Game over,insert coin:Fatal Fury
Ou kay fini tèt blanshi kon l'agent Scully
Ou vlé la vérité i ayè kon di Mulder
Léta ka soupsoné mwen dè èt on Highlander
An ka frapé mc adan on style feelin' Vandanme
An sôti woté 4 dent an guèl aw kon ipopotam
Plézi an mwen,mwen é boug an mwen Jockerman
Lè nou pani ayen a fè téwowizé Gotham
Son an mwen two déman:fo mwen té sinyé aka Virgin
Fè dé featuring èvè députe kon la bann'a Lil'Kim
Sôti dé klip épi mwen ka rapé an slip
Èvè dé min an mwen an plin dé tété a Foxy
An sôte fè dé jalou kon Busta é Zoxea
An inmé zôt'mè adan toute sa:hello taxi
An ni an rendèv èvè Monica Lewinsky
Sinyé dènyé liv'ay titré:J'ai sucé Fuckly
Allo Fuckly?
On fanm ka foné mwen si powtab':
An ja lass diw pa kwiyé mwen ou vwèman insupowtab'
A pa paskè mwen sé on superstar
Fow konpwan kè tou bolman mwen sé zanmi aw
Hey Mister GG:hey!:sé super super superstar
Hey Mister GG:ho!:sé super super superstar



Refrain 4:

Dèpi yo konèt mwen:yo mète super douvan star
Sé super super superstar
Microphone an mwen limé:apré mwen pani star yô
Pani pani pani star
Hey Mister GG:hey!:sé super super superstar
Hey Mister GG:ho!:sé super super superstar

Vinn' siwoté adan limousin'la
Pou nou siwoté la tou lé swar

Nou déliré an refwin la....Embed"
