Artist,Title,Lyrics
Prince Waly,Rottweiler,"13 ContributorsRottweiler Lyrics[Paroles de ""Rottweiler"" ft. Ali]

[Intro : Prince Waly]
J'ai déjà le prénom si j'adopte un Rottweiler
Il aura du flair, je l'appellerai Rockefeller
Que tu sois jardinier ou Glock receleur
On prend les pièces, mais s'ils sont broke, laissez-leur
J'ai déjà le prénom si j'adopte un Rottweiler
Écoute, fils

[Couplet 1 : Ali]
Mais qu'est-ce que tu croyais ? Qu'on allait rester là à s'laisser noyer ?
Laisse les médisants médire, laisse-les aboyer
On m'a dit ""Ali Bomayé"", j'ai répondu : ""je ne tuerai personne""
À quoi nous sert de se venger quand pour nous tous la mort sonne ?
À l'heure, entretiens l'étincelle de la vie, l'humaine chaleur
Chaque pas c'est loin de la naissance, près du décès
Le temps pour allié, l'apprécier, ne pas se presser
Vibrer, près de ses frères, près de ses sœurs
Maillons forts, parmi successeurs, prédécesseurs
Puissants, du mental à nos processeurs
Esprit large comme le Professeur de Q.B
Quand faible est le Q.E, à quoi bon le gros Q.I
Ton instinct, suis-le, ou bien le doute subis
Ne pas laisser le stress nous tenir en laisse, en servitude
Que la foi éclaire nos pas, nos pensées, nos certitudes
Plus dangereux qu'être une gâchette presseur
Efficace est la prière de l'oppressé face à l'oppresseur
Positive énergie à en épuiser l'agresseur
Vois la calomnie retournée à son adresseur
Apprivoiser, maîtriser la colère, l'animosité
Pulsion dompteur, rottweiler dresseur
You might also like[Pont : Prince Waly]
J'ai déjà le prénom si j'adopte un Rottweiler
Il aura du flair, j'l'appellerai Rockefeller

[Couplet 2 : Prince Waly]
Faut que j'élargisse mon champ de vision
Faut que tu voies ma gueule dans plus en plus de zones pavillonnaires
J'suis pas millionnaire, ni camionneur, mais ton amie miaule, mon style défonce
Tu vois flou, c'est là qu'tu t'demandes si j'ai mis d'la gnôle
J'veux ma part du gâteau
On aura plusieurs arbres à came, plusieurs sortes de râteaux
On ramassera les billets dans le jardin comme Franck
Avant l'hiver si t'as un feu en dessous du manteau
Le temps est pluvieux, souvent gris, comme nos billets
Souvent pliés dans un Levi's, puis fuck, comment briller
À Sin City comment prier, attiré par la luxure
Habillé comme un modèle bien épilé dans défilé
J'ai longtemps hésité sur mes idées mais depuis que j'me lance
C'est plutôt cool, sur les moyens je ne vais pas lésiner
On donne de l'amour sur les inédits
J'vais pas te l'dessiner, tu sais que j'arrive comme Zinédine
Ou plutôt Cassius, je voulais dire Mohamed Ali
Comme dirait Ill, si tu baises pas, suce-moi et mes amis
La demi-molle, ça n'existe pas chez nous
Surtout si elle a du blé, on pourrait même fourrer mamie
Jouer mari pour ta frangine comme Manny (Ribera)
Et rajouter du X avec Manix (XL)
Bluffeur, super fort au poker on cache bien nos jeux
Des étoiles, y en a pleins nos yeux devant les teufeurs
Qui achètent au prix fort, after et before
Le biff sort, s'est retrouvé dans les mains d'un keuf
La provenance n'a pas d'importance
Un porc tente de prendre sa part, ébloui par la contenance
Un ponte pense avec un lingot à la place du cerveau
Toi ton esprit un porno d'M6, série B en promo
Y a pas d'concurrence face à Leader Price
La file de clients vide quand nos dealeurs brassent
Embrasse le joyau
Le fils du roi est entré dans la course, tu passes le maillot, jauneEmbed"
Prince Waly,Smoke,"11 ContributorsSmoke Lyrics[Paroles de ""Smoke"" ft. Loveni]

[Couplet 1 : Prince Waly]
Le Seigneur m'a béni (ouais ouais), j’suis un génie (amen)
T'es pas là quand elle gémit, elle prend les pennys
Le daddy dans jacuzzi, le quotidien s'adoucit
Une main sur le volant, une main sur le Uzi
C’est un hold up, j'arrive comme un gros lard
Dans un fast food, on prend la bouffe, on laisse des dollars
Mes négros n'ont pas l'BAC ni d'Philip Morris
La nourrice est de mèche avec la police
Y'a du feu, y'a d'la fumée, un négro s’est fait allumer (nan)
L’échange est annulé, met l'héroïne dans l’allumette (nan nan nan)
Tu peux choper des filles à nos concerts (à nos concerts)
Tu peux aussi choper des gitanes et un cancer (oh ouais)
Trouve-moi à Cuba avec un cigarillo (Waly love)
On envoie du jeu comme deux flics à Rio (elle est mouillée)
Comme le mégot à ma bouche, elle a mis l'eau (oups)
Tu danses liquide comme Leo DiCaprio

[Pont : Prince Waly]
""Fumer tue"", c'est d'la prévention
Dire que mes sons tuent, c’est pas d'la prétention
""Fumer tue"", c'est d'la prévention
Dire que mes sons tuent, c'est pas d'la prétention, bitch
You might also like[Refrain : Prince Waly]
Dans la voiture (elle smoke), elle est maquée (j'm'en moque)
Si c'est un paquet (j'la smoke), j'adore smoke
J'adore, j'adore, j'adore
Baby veut m'allumer comme si j'étais Big Smoke (j'adore smoke)
Dans la voiture (elle smoke), elle est maquée (j'm'en moque)
Si c'est un paquet (j'la smoke), j'adore smoke (j'adore smoke)
J'adore, j'adore, j'adore
J'adore smoke (smoke, smoke)
J'adore smoke

[Couplet 2 : Loveni]
Ma première cigarette, j'm'en souviens, c'était une Lucky Strike
J'l'ai allumée à Bastille, sur les marches de l'Opéra
J'ai vingt-cinq ans, ça fait déjà dix ans que je smoke
J'ai les poumons plein de goudron, j'adore cette dope
Ma préférée pour digérer, verse la gnôle, allume une clope
S'il-vous-plaît, amenez la note, quel montant ? J'paie comptant
Sur Belleville, Ménilmontant, j'fume quand j'marche dans la ville
J'fume quand j'ride, plus l'temps passe, plus j'm'en lasse et j'recommence
À chaque fois han, Waly s'te-plaît, passe le feu
Comme Denis Lavant, crache le feu, j'suis le meilleur à ce jeu
Han yeah, dans la bouche du game comme Philip Morris
Si Waly tombe pour meurtre, j'suis le complice, ciao bye-bye

[Refrain : Prince Waly]
Dans la voiture (elle smoke), elle est maquée (j'm'en moque)
Si c'est un paquet (j'la smoke), j'adore smoke
J'adore, j'adore, j'adore
Baby veut m'allumer comme si j'étais Big Smoke (j'adore smoke)
Dans la voiture (elle smoke), elle est maquée (j'm'en moque)
Si c'est un paquet (j'la smoke), j'adore smoke (j'adore smoke)
J'adore, j'adore, j'adore
J'adore smoke (smoke, smoke)
[Outro : Loveni]
J'finis tout l'paquet avant d'me faire fumer
J'finis tout l'paquet avant d'me faire fumer
J'm'occupe de m'tuer, j'veux pas m'faire doubler
J'm'occupe de m'tuer, j'veux pas m'faire doubler
J'finis tout l'paquet avant d'me faire fumer
J'finis tout l'paquet avant d'me faire fumer
J'm'occupe de m'tuer, j'veux pas m'faire doubler
J'm'occupe de m'tuer, j'veux pas m'faire doubler
J'adore, j'adore, j'adore
Smoke, smoke, smoke
J'adore, j'adore, j'adore
Smoke, smoke, smokeEmbed"
Prince Waly,Walygator,"9 ContributorsWalygator Lyrics[Paroles de ''Walygator'']

[Intro]
Walygator
La peau dure, le sang froid

[Couplet 1]
Les poches vides, j'pensais qu'à faire de l'argent, j'veux rouler en Porsche, vite
Le droit chemin a viré à gauche, j'achète et je vends, arrête et reprends
Des billets j'fauche, pas de regrets, Lunatic c'est le thème et les flics je sème
Aucun remords quand il faut le biff, pansemеnts sous les vêtements еn cuir, je saigne (Rah)
J'suis de ceux que les plaques tourmentent, obnubilé par la dope et les chiffres
La planque et les shifts, mais quand t'es un crack tout se vend (À fond)
Avec Alfred, on vend cette merde, pour investir dans le rap et les clips
Tous les jours fausse la Bac et les flics, quand les chiffres nous mentent, ça devient électrique
J'avais les pieds dans les Merco (Benz), les pieds dans les Audi sport
Je passais mon temps à regarder des films et à doper des poupées aux jolis corps
Perquisition, main dans le sac, aucun bluff, j'atterris chez les keufs
J'ai perdu des reufs à cause de la peuf (Fuck), depuis je fais plus la teuf

[Refrain]
Chaque jour je décède, marathon dans le désert
J'attends qu'il pleuve, un panier flotte dans le fleuve
Orphelins sont les hommes, morts d'hommes font les veuves
J'attire ton attention, attention à l'ascension
Chaque jour je décède, marathon dans le désert
J'attends qu'il pleuve, un panier flotte dans le fleuve
Orphelins sont les hommes, morts d'hommes font les veuves
J'attire ton attention, attention à l'ascension
You might also like[Couplet 2]
Hey, il regarde le passé, il se sent dépassé
Il a perdu du temps, les regrets se sont entassés
L'esprit était mauvais, il avait l'essence, il avait l'aisance
Walygator a été élu dès la naissance
Il n'a plus rien à perdre comme Django, sur étalon, a le Winchester dans le dos
Les coups de fouets ont fait de sa peau un cuir, Walygator et il erre dans le zoo
Gardé en captivité, mourir est la seule activité
Aujourd'hui son arme s'est vidée, sur un confédéré, drapeau en berne et drames évités
Là, tu ressens le mood, ressens le mouvement
Agressivité dans la diction, réalité devient fiction
On est sorti du movie, tu peux rallumer les bougies
Commence à prier, canon scié dans le noir va briller
Ils ont volé ma thune et le nom de l'établissement
Et ils souhaitent ma mort en m'envoyant ''bon rétablissement''
J'ai Dieu avant tout, j'ai le feu, j'ai le talisman
Mais la malice m'hante

[Refrain]
Chaque jour je décède, marathon dans le désert
J'attends qu'il pleuve, un panier flotte dans le fleuve
Orphelins sont les hommes, morts d'hommes font les veuves
J'attire ton attention, attention à l'ascensionEmbed"
Prince Waly,YZ,"8 ContributorsYZ Lyrics[Paroles de ""YZ"" ft. TripleGo]

[Intro : Prince Waly]
Mon coiffeur fait des dégradés
Le tien fait des dégradations
Dur sera la séparation
Juste après la déflagration
Tacle à la gorge
J'suis dans la surface de réparation
On vient enterrer ta nation (BO Y Z)

[Pré-refrain : Prince Waly]
J'suis qu'un négro, j'suis qu'un BO Y Z
J'suis qu'un négro, j'suis qu'un BO Y Z
J'suis qu'un négro, j'suis qu'un BO Y Z
J'suis qu'un négro, j'suis qu'un BO Y Z
Maman, j'suis dev'nu un homme, j'ai pris le dessus sur mon ombre
Papa, j'suis d'venu un homme, ton nom ne deviendra jamais un nombre

[Refrain : Sanguee]
T'es pas d'chez nous, toi, t'es chelou, chelou
T'es pas d'chez nous, toi, t'es chelou, chelou
T'es pas d'chez nous, toi, t'es chelou, chelou
T'es pas d'chez nous, toi, t'es chelou, chelou
Ouais narvalo, ouais narvalo
Ouais narvalo, ouais narvalo
Ouais narvalo, ouais narvalo
Ouais narvalo, ouais narvalo
You might also like[Couplet 1 : Prince Waly]
Paire de Nike sur la moto
Périphérique sous cirocco
Pas d'attirance pour la coco
Mets le produit dans les bocaux
Ils veulent les billets dans ma poche
Avoir les pieds dans la porsche
Amenons les negros au musée
Marre de traîner dans un porche
J'veux les chaussures croco
Ta mère prends la pose mais y a pas photo
J'ai les bons numéros, potogo
Jvous laisse jouer au loto
Bénéfice, (Bénéfice) téléphone
Ici le client dit qu'elle est bonne
Bénéfice, (Bénéfice) téléphone
T'auras ta part si tu mets les sommes
Ils ont des motos, font des roues arrières
Sur les boulevards à la mairie
Yamaha, motorisée, monsieur le maire m'a autorisé
Trafic est monopolisé
Client est lobotomisé
Ton cerveau est atomisé

[Pré-refrain : Prince Waly & Sanguee]
Ouais narvalo
J'suis qu'un négro, j'suis qu'un BO Y Z
J'suis qu'un négro, j'suis qu'un BO Y Z
J'suis qu'un négro, j'suis qu'un BO Y Z
J'suis qu'un négro, j'suis qu'un BO Y Z
Maman, j'suis dev'nu un homme, j'ai pris le dessus sur mon ombre
Papa, j'suis d'venu un homme, ton nom ne deviendra jamais un nombre
[Refrain : Sanguee]
T'es pas d'chez nous, toi, t'es chelou, chelou
T'es pas d'chez nous, toi, t'es chelou, chelou
T'es pas d'chez nous, toi, t'es chelou, chelou
T'es pas d'chez nous, toi, t'es chelou, chelou
Ouais narvalo, ouais narvalo
Ouais narvalo, ouais narvalo
Ouais narvalo, ouais narvalo
Ouais narvalo, ouais narvalo

[Pont : Prince Waly]
Mon coiffeur fais des dégradés
Le tiens fait des dégradations
Dur sera la séparation
Juste après la déflagration
Tacle à la gorge
J'suis dans la surface de réparation
On vient enterrer ta nation (BO Y Z)
Ma vie un film, on fait la BO en YZ
Ma vie un film, on fait la BO en YZ
Ma vie un film, on fait la BO en YZ
Que des crochets dans leurs mères, [?]

[Refrain : Sanguee]
T'es pas d'chez nous, toi, t'es chelou, chelou
T'es pas d'chez nous, toi, t'es chelou, chelou
T'es pas d'chez nous, toi, t'es chelou, chelou
T'es pas d'chez nous, toi, t'es chelou, chelou
Ouais narvalo, ouais narvalo
Ouais narvalo, ouais narvalo
Ouais narvalo, ouais narvalo
Ouais narvalo, ouais narvalo2Embed"
