Artist,Title,Lyrics
Prince Waly,Messe,"13 ContributorsMesse Lyrics[Intro]
- Eh lascar, c'est avec toi qu’on a traité le deal la dernière fois là
- Hin
- Mais rigole pas parce que là je suis venu récupérer ma thune là
- Attends pourquoi tu joues les vénères là ?
- Vénère parce que je veux ma thune là, tout de suite
- Quelle thune ? J'ai pas de thune
- T'as pas ma thune toi là ? Tu vas pas me donner ma thune ? On va aller la chercher tout de suite la thune
- Eh vas-y prends-la. Va te faire enculer
- Toi tu vas me dire d’aller me faire enculer ? Qu'est ce qu'il y a ?

[Couplet unique]
Un homme noir dans la cuisine, un dealer sorti d'un four
Cuisson, drogue dure planquée dans la cour
Buisson, sous les pulls, vêtements
Une arme à feu brûle bêtement et un frère meurt sans amour
Ils veulent qu'on diminue, dès minuit, se battent pour des mini sommes
Les poulets ont déjà nos prénoms sur des menus
Pénitenciers, mon frère faut les distancer
Disent penser quand l'argent est bêtement dépensé
Ils veulent nous faire croire que d'intelligence, dispensés sont les miens
Pères africains font des fils français
Une fois fiancé, licencié par Cupidon
Séparation, mère seule, problèmes financiers
Les idées noires font la guerre aux idées claires
Ségrégation dans mon esprit, la mort j'arrête pas d’y penser
J’y vais doucement, tous mentent à la cérémonie
Messes basses, chuchotements, toussotements
You might also likeS'il y’a un ennemi à terre
Que des brossés dans le visage, que des frottements
Diminuer fortement, dissimuler drogue blanche
Froc, manches, se distribuent tes ornements
Des hommes ont été mis au monde délibérément
Et dans le seul but de provoquer avortement des miens
Outfit black avant l'enterrement
Et si on paraît dangereux, c'est involontairement

J'assiste à la cérémonie
J’fais du sport, j'mange sainement, et j'fais les money
Retour aux pyramides, nique les clones
J'arrive comme un jeune pharaon chez les momies
Chaque vendredi j'assiste à la cérémonie
J'fais du sport, j'mange sainement, et j'fais les money, j'fais les money
Pour la famille, pour la famille…

J'ai connu les HLM et la précarité
Nos cicatrices sont dissimulées sous le beurre de karité
Je suis en voie d'extinction à cause de ma couleur de peau, gros
Comme les alligators, les joueurs de polo
Je remercie le ciel d'avoir un père
Je suis de ceux qu'on a traumatisés pour avoir la paix
Je suis en voie d'extinction à cause de ma couleur de peau, gros
Comme les alligators, les joueurs de polo
Les joueurs de polo
Comme les alligators, les joueurs de polo
Pour la famille, han
Un pour la famille, 93Embed"
Prince Waly,Miroir,"4 ContributorsMiroir Lyrics[Paroles de ""Miroir""]

[Couplet unique]
Je me reconnais plus quand je suis devant ma glace
Je me sens inutile quand je suis pas à ma place
Je fuis les idées sombres, dans ma solitude
Les armes à feu moins que la folie tuent
Beaucoup d’apparence, beaucoup de fioritures
Évidemment j’ai déjà chialé par manque de nourriture
Les hommes n’ont que la parole dissimulée sous l’assurance
(On a baigné dans la violence)
Jе dois assurer pour la daronne, pour ma future dеscendance
Soigner le mal par le mal aujourd’hui j’en paie les sentences
J’ai les cicatrices sur le torse
Ajoute les entorses et la mésentente
J’ai perdu du temps, souvent je me sens nul
Je vois les autres s’en mettre plein les poches, je suis habillé, mais je me sens nu
Désemparé je suis comme baleineau face à chalutier
Dans un filet j’ai l’impression de passer ma vie à lutter
J’ai l’impression d’être à côté de la plaque
J’ai l’impression d’être un océan à côté de la flaque
J’ai plus rien à vendre, j’ai plus peur de la BAC
Menottes sur le poignet, je me rappelle de la marque
Laisse-moi te faire une confidence
En moi j’ai perdu toute confiance
Malgré les sourires de connivence
(Plus l’amour est mort, plus on y pense)
J’ai connu les HLM et la précarité
Nos cicatrices sont dissimulées sous le beurre de karité
Je suis de ceux qu’on a traumatisés pour avoir la paix
Malgré tout, je remercie le ciel d’avoir un père
Maman a cru que j’allais crever, plus d’une fois dans ma vie
Elle aimerait changer le disque, elle a déjà perdu un fils
Mon père m’a déjà dit “je t’aime” avec les larmes aux yeux
Pas besoin d’encyclopédie, si j’ai un doute j’en parle au vieuxYou might also likeEmbed"
Prince Waly,Moussa (Part II) - Interlude,"9 ContributorsMoussa (Part II) - Interlude Lyrics[Paroles de ""Moussa (Part II) - Interlude""]

[Sample : Enchantée Julia]
J’pourrais prendre ton nom
Et en faire des chansons
D’amour, d’amour, d’amour oui
D’amour, d’amour, oui d’amour
Quelque part sur terre
Toi et moi bébé
J’m'en fous des galères
T'as pas idée
Une vue sur la mer
T’en dis quoi, ouais ?
Une vue sur la mer
T’en dis quoi, ouais ?
J’pourrais faire n’importe quoi
Pour avancer avec toi
Mon amour, mon amour
Mon amour
J’pourrais pas faire sans toi
Peu importe les heures, les mois
J’t’attends, je t’attends, je t’attendrai
Je t’attends, je t’attends, je t’attends
Tu es...You might also likeEmbed"
Prince Waly,Movie,"9 ContributorsMovie Lyrics[Paroles de ""Movie""]

[Intro: Cenza]
Faut être un cinéaste ma gueule pour kiffer cette merde

[Couplet 1]
Il m’a donné rendez-vous dans une ruelle sombre
Dans un quartier, sans action, parfait pour une transaction
J’suis arrivé en avance, repérer quelques caméras sur les toits
J’ai mis des gants, désolé, j’veux pas avoir ton ADN sur les doigts
C’est là qu’je lui demande :
« Où est l’sac négro ?»
Il me répond :
« Arrête de jouer le mac »
Mégot dans la bouche, shit
Ça sent la douche froide, on m’avait prévenu
Cet enfoiré, même nu, arrive à cacher des flingues
Dingue, on avait pourtant grandi dans la même rue
Trop défoncé il est sous héroïne, il s’en rappelle même plus, bref
Pique la sac, recule en sifflotant, roule sur une pipe de crack
Se faire entuber, ça gifle autant ?

[Refrain]
Si le biff a une odeur, alors j’ai le flair
Pas d’avocat, pas d’honoraires
J’ai le durag mais il faut le fer
Avec un gun, j’suis seul et mal accompagné
C’est Halloween, ton gamin va ajouter quelques dents à son panier
You might also like[Pont]
Eh merde, tu sais ce qu'il y avait dans ce putain d’sac négro
Pfff, en vrai c’est pas ton problème
Et quoi qu’il arrive, il faut qu’j’le récupère, tu me suis ?

[Couplet 2]
Périphérique, 93, il faut qu’je monte une équipe
Si t’es entre 89 et 96
Tu peux envoyer les CV, on te rappelle, si ton profil match
Négro t’es validé, on va les allumer comme Hallyday
Outfit, sac de sport, des black se tordent, des flaques se forment
Ça tire dans tous les sens, Walygator a le sang froid
La grenade est balancée, le Panamera finit sans toit
Le movie se finit sans toi
Je suis généreux, je lui ai rendu la monnaie de sa pièce
Mettez son corps dans le coffre
Le cabriolet s’affaisse
Pas d’ambulance, pas de civière, pas de cérémonie, pas de cimetière
Flash info
On a repêché un corps mort dans la rivière

[Refrain]
Si le biff a une odeur, alors j’ai le flair
Pas d’avocat, pas d’honoraires
J’ai le durag mais il faut le fer
Avec un gun, j’suis seul et mal accompagné
C’est Halloween, ton gamin va ajouter quelques dents à son panierEmbed"
Prince Waly,MP5,"8 ContributorsMP5 Lyrics[Paroles de ""MP5""]

[Couplet 1]
Les gamins ne parlent plus en MP3 mais en MP5
Ça sent le sapin
Le Père Noël s’habille en Prada, il a des sapes en satin
Fuck le top, faut que je stoppe cette bitch qui comme un gosse me note
Elle veut les sommes, les grosses menottes
Je suis toujours au-dessus comme un cosmonaute
91 ma génération, faut les carats, le cash, faut qu’on génère à fond
Le blé, le beurrе, argent liquide, j’attends quе mes céréales fondent
Mets le kérosène dans les réacteurs
J’écris ma life en fonction des caractères, je suis comme un rédacteur
On a les cartouches avec, (han han), ils veulent pas qu’on les sorte
J’envoie les trois points, ils font les fautes
Rappeurs font les sottes avant qu’on les saute
Le manque d’autorité, devant la mère se dressent
Un pied dans la rue ou dans le Mercedes
Sueur et larmes dans la mer se versent

[Refrain]
Fuck les cornes, mon esprit est sain mais mon corps déconne
Nous voient comme si on était des clones, nous envoient les virus et le Chlordécone
Je suis dans le fond, comme à l’école, je les regarde glousser comme des connes
La rue te blesse, laisse beaucoup de plomb dans le corps des hommes
Fuck les cornes, mon esprit est sain mais mon corps déconne
Nous voient comme si on était des clones, nous envoient les virus et le Chlordécone
Je suis dans le fond, comme à l’école, je les regarde glousser comme des connes
La rue te blesse, laisse beaucoup de plomb dans le corps des hommes
You might also like[Couplet 2]
Je prends les micros, les comiques on stoppe
Ils sont minuscules, ils sont chromosomes
Toujours un œil dans les microscopes
Et je suis toujours au-dessus, comme ozone
Au comico ce cop, voulait les infos, les prénoms, les noms, le cash et les comptes
Beaucoup de lèche-bottes, qui ne font que me tacher les (pompes)
J’arrive comme Django sur étalon, Nicolas n’est qu’un gangster sur des talons
C’est un BDG, c’est pas dur et pas long, à quoi sert 1 million en survêt’ à l’ombre ?
Tous les dogs sont chez le véto, pour faire ce pain, je me suis levé tôt
On a vendu dans le ghetto, j’ai tourné en rond dans le dépôt

[Refrain]
Fuck les cornes, mon esprit est sain mais mon corps déconne
Nous voient comme si on était des clones, nous envoient les virus et le Chlordécone
Je suis dans le fond, comme à l’école, je les regarde glousser comme des connes
La rue te blesse, laisse beaucoup de plomb dans le corps des hommes
Fuck les cornes, mon esprit est sain mais mon corps déconne
Nous voient comme si on était des clones, nous envoient les virus et le Chlordécone
Je suis dans le fond, comme à l’école, je les regarde glousser comme des connes
La rue te blesse, laisse beaucoup de plomb dans le corps des hommesEmbed"
Prince Waly,NeS ft. Prince Waly,"1 ContributorNeS ft. Prince Waly LyricsParoles issues d'un extrait
[Couplet : NeS & Prince Wally]
Ils sont bien out, kaput, K.O, eh
J'arrive comme [?]
J'ai bientôt les blousons et j'aurais bientôt les boutons sur les manchettes
Weston sur le goudron, billets dans la banque
J'arrive comme Tony, toujours bien habillé dans la banque
Tu veux du taf, pétasse, t'as qu'à être blonde
Les négros ont fait les teintures, baisse le prix d'vente pour mieux fourrer dans les voitures
Que des coups d'front [...]You might also likeEmbed"
Prince Waly,Passement de jambes (Part II),"7 ContributorsPassement de jambes (Part II) Lyrics[Paroles de ""Passement de jambes (Part II)""]

(Quand je flingue aucune balle n'est perdue)
Sur le terrain je découpe comme un ballon d’or
Mais j'ai pas le trophée dans mon palmarès
Quand je flingue aucune balle n'est perdue
À ma gauche, à ma droite : Abidal, Mahrez
Si l’herbe est plus verte ailleurs, je te la coupe sous le pied
Je prends la jambe avec
Je le fais intelligеmment
(Sur la route je viеns de croiser un de tes ligaments)
Comme Davids, je veux le maillot et la lunette orange
J'arrive chez toi, je me sers et je repars avec ta thune et ton Range
On nous apprend à courir bien plus vite que les balles dès le plus jeune âge
Je transpire plus, je nage, comme Ronaldo
Vos langues c'est des couteaux, on a le dos
Les politiciens nous font le coup du foulard à chaque élection
Font les passements de jambes comme Sharon Stone
Fumer à la mi-temps, ça rend stone
En défense, en attaque, dans mon équipe que des caméléons
Au milieu, devant, c'est Beckham et Léo
Slalom entre les camés, les hoes

Dans le rap les négros s'entassent comme têtes de beuh dans les joints
Alors je leur tire dessus
Je les fume sans armes à feu dans les mains
Prochain album, je fais monter les enchères et le prix du dico
J'ai juste besoin d'un Karcher pour arroser la mère à Nico
Le couplet sera court, j'y mets ce qu’il faut
Repère à la messe qui fraude
Fume le shit sous la veste qui fond
Le dealer pull up avec skis de fond
Prochain album, je fais monter les enchères et le prix du dico
La tenue est rouge comme Deco, j’arrive à fond, mets-toi sur le té-coYou might also likeEmbed"
Prince Waly,Plan,"23 ContributorsPlan Lyrics[Paroles de ""Plan"" ft. Alpha Wann]

[Couplet 1 : Alpha Wann]
En vendant du gros shit, pas de gros chèques
Hier dans un resto chic, demain devant la gare juste pour les brochettes (oh shit)
Philly Flingue, Prince Waly, pour s'amuser, faut qu’les miens soient ivres (ouais)
Pour t'allumer, il faut qu'leurs mains soient libres, pirate somalien, j’parle bien l'swahili
Tous sont tenus en laisse, fuck, Marianne est moche, venue sans fesses
Ma tenue empeste le neuf, Waly c'est le reuf donc j'suis venu en guest (sisi, Don Dada)
J'dédicace ceux derrière mes talons, j'ai les pieds sur terre grâce à mes gars d'l'ombre
Mes anges de gauche et droite concurrents comme Go Sport/ Decathlon
J’suis un piéton, pas de scoot, on se décontracte mais quand j’ai pas d'sous, j’reste gainé
La loi du silence, pas de scoop, 2018, c'est le flouze, let's get it
Sappé en blanc, on dirait qu'j’apporte la paix, style de mafieux, Phaal Capone la pègre
J'suis à bord d'la Benz, rapporte ma paie à la familia si j'cartonne après
Naître ici, faire sa mafia comme les Three 6 parce que le pouvoir d'achat n'augmente pas mais les prix si
Et quand les problèmes te visitent, ils sont accompagnés comme les vizirs (vizirs)
On garde les richesses, on partage la merde, ici-bas, la roue ne tourne pas, sa mère
Alors trace ta route et je trace la mienne, ouais

[Pré-refrain : Alpha Wann]
J'ai pas eu le même plan qu'toi, j'ai pas eu le même plan qu'toi
On atteindra pas en même temps l'toit, quand tu m'vois, change de chemin
Ou même, planque-toi, hey
J'ai pas eu le même plan qu'toi, j'ai pas eu le même plan qu'toi
On atteindra pas en même temps l'toit, quand tu m'vois, change de chemin
Ou même, planque-toi, hey
You might also like[Refrain : Alpha Wann]
J'ai pas eu le même plan qu'toi, j'ai pas eu le même plan qu'toi
J'ai pas eu le même plan qu'toi, j'ai pas eu le même plan qu'toi
J'ai pas eu le même plan qu'toi, j'ai pas eu le même plan qu'toi
J'ai pas eu le même plan qu'toi, j'ai pas eu le même plan qu'toi

[Couplet 2 : Prince Waly]
Les rottweilers ne font plus de Rockefeller, on vient dérober leurs (SWATCH)
J'suis dans les temps, on vient donner l'heure
À souvent dépenser beurre, en vêtements bêtement
Négro, mes pensées meurent en même temps qu'toi mais
Y'a aucune équité, j'ai pas eu le même plan qu'toi
Tous sont tenus en laisse, fuck un permis, j'suis quand même venu en caisse
Une leçon, t'as pas retenu, encaisse, t'es face à Mayweather
Y'aura pas louanges entendues en messe, à ton enterrement, l'addition est payée en caisse
Comme Hugo Boss, on va les tailler en pièces, vos rappeurs sont payés en cess
Le rap : un sport, on se tonifie, avec le temps, on se bonifie
Tony file un mauvais coton et modifie le code de la rue pour une jolie fille
J'suis Mike Tyson, t'es Holyfield, tu nous verras dans un holy filet
Tu nous as vu sur un gros défilé, à dévisager vos gos épilées (c'était un sport)
On en fait un job, on enterre à mort, à chaque apparition
Désolé, on t'avais pris pour un dog, je ne prie que pour un code
Tous ces rappeurs roumanovs, tous ces rappeurs roumanovs
J'ai pas eu le même plan, pas eu le même temps mais j'vais le faire comme un homme

[Pré-refrain : Alpha Wann]
J'ai pas eu le même plan qu'toi, j'ai pas eu le même plan qu'toi
On atteindra pas en même temps l'toit, quand tu m'vois, change de chemin
Ou même, planque-toi, hey
J'ai pas eu le même plan qu'toi, j'ai pas eu le même plan qu'toi
On atteindra pas en même temps l'toit, quand tu m'vois, change de chemin
Ou même, planque-toi, hey
[Refrain : Alpha Wann]
J'ai pas eu le même plan qu'toi, j'ai pas eu le même plan qu'toi
J'ai pas eu le même plan qu'toi, j'ai pas eu le même plan qu'toi
J'ai pas eu le même plan qu'toi, j'ai pas eu le même plan qu'toi
J'ai pas eu le même plan qu'toi, j'ai pas eu le même plan qu'toiEmbed"
Prince Waly,Problème,"16 ContributorsProblème Lyrics[Paroles de ""Problème""]

[Intro: ""La Cité de Dieu"" (2002)]
""Eh Buscapé, où t'en es pour les gonzesses ? Eh tu t'en es fait une, ça y est ? haha""
-Ah nan, pas encore...
-Ah t'es nul""
""Ahh Angelica, elle me rendait dingue cette fille""
""Et alors Buscapé, toujours avec tes photos""
""En plus d'être sublime c'était la seule qui couchait""

[Couplet 1 : Prince Waly]
Premier rendez-vous, stress (stress)
Je suis timide et sans complexe
Mais elle sait y faire, ellе veut qu'on flex (qu'on flex)
J'suis rеsté pour les cornflakes
Pour les, pour les cornflakes (cornflakes)
J'suis resté pour les cornflakes (han han, han han)
Quitter la planète Terre pour Vénus
Là où jamais l'amour ne s'atténue (let's go)
J'connais la route, j'ai la tenue
Sur l'avenue, là où vos ex font les tonneaux (accidents)
J'aime les femmes mais j'veux pas dire à mes gosses que (quoi)
Elles aiment les grosses voitures et les grosses queues
Le négro a plus de maitresses que son gosse
C'était un foutu rottweiler, il veut son os
Si t'es une fille du moove, viens voir le docteur
Mais avant, descends du Rolls, remets ton gloss
You might also like[Couplet 2 : Luidji]
Tu connais le problème (tu connais le problème)
Tu connais le problème
Bien trop de fois, j'ai vu bien trop de femmes dont les modèles de soirées mondaines bébé (oh baby)
Mais c'est pas ma nana (oh baby)
Mais c'est pas ma nana (c'est pas ma nana)
Ça vaut pas ma nana (nan c'est pas ma nana)
Ça vaut pas ma nana
Tu connais le problème (tu connais le problème)
Tu connais le problème
Bien trop de fois, j'ai vu bien trop de femmes dont les modèles de soirées mondaines bébé (oh baby)
Mais c'est pas ma nana (oh baby)
Mais c'est pas ma nana (c'est pas ma nana)
Ça vaut pas ma nana (oh pas ma nana)
Ça vaut pas ma nana

[Couplet 3 : Makala]
Pense que c'est toi, pense que cette fois
Ça sera la bonne, t'es là devant sa porte
B'hein, vas-y sonne qu'est ce que t'attends
Continue, de lui faire perdre son temps
Elle a dit qu'elle était prête à attendre (hey)
Mais quand elle parle ça s'entend
Qu'elle a besoin de plus, elle veut te voir (han)
Piloter sans le frein
Piloter sans le frein (nan)
Piloter sans le frein
En plus hier soir elle t'a embrassé
Comme s'il n'y avait pas de fin
T'es même pas encore réparé djo
Tu voudrais déjà redémarrer (han, han)
Oh tu me fais marrer (han), t'as l'air égaré
T'es paralysé devant cette porte depuis, bien trop longtemps maintenant
Je sais qu'elle est bonne et qu'elle a tout ce qui suit
Mais n'y va pas maintenant
Ne toque pas à cette porte (ne toque pas à cette porte), prends ces escaliers
Et tes esprits en passant
Ça sent bon elle a fait à grailler et tout mais…
C’est le moment de tailler
Écoute ce que je suis en train de te dire, joue pas au con gros, hein
Un cœur c'est comme un gun
Pose ça, joue pas avec
Tu risques de blesser quelqu'un
Qui a plein d'autres choses à faire
T'es pas prêt pour cette affection
Cette situation l'affecte
Quand le coup part c'est trop tard
Un cœur c'est comme un...Embed"
Prince Waly,Rain Man,"11 ContributorsRain Man Lyrics[Paroles de ""Rain Man"" ft. Tengo John]

[Intro : Tengo John]
Rain man, rain man

[Couplet 1 : Prince Waly]
Protéger les wifes, ils ont les flingues et les knifes
J'ai plus d’un tour dans mon Tommy, t'auras plus d'un trou, s/o Tony
J’suis venu changer de life, j'ai dit : ""J'suis venu changer de life""
J'suis comme ce gamin de Miami, j'veux les pluies de billets sur mes amis
Sur l'océan, j'ai mis les voiles, comme les étoiles, on a filé
Dans le ciel, on a défilé, j'veux pas finir dans les filets et dans les plats, on a mis les pieds
La paire est neuve, hey, le millimètre il est neuf
Dame nature m’a donné son phone, donne-le à ta maman si elle est veuve
Dans le Rover, elle est love mais baby dissimule-les
Sentiments sont dissimulés, conception immaculée, ADN immatriculée

[Pont : Prince Waly]
Et quand ça devient difficile, on s’en remet à Dieu (j'ai frôlé la mort)
À cause de la maladie, aucune lumière indiquant le paradis

[Refrain : Prince Waly]
On parle de mode, on parle de meufs, on parle de mode, on parle de meufs
On parle de drogues, on parle de teufs, on parle de drogues, on parle de teufs
On parle de codes, on parle de keufs, on parle de codes, on parle de keuf
Rain man, j’suis le Rain man
On parle de mode, on parle de meufs, Rain man, j'suis le Rain man
On parle de drogues, on parle de teufs, Rain man, j'suis le Rain man
On parle de codes, on parle de keufs, paw paw paw paw
On parle de codes, on parle de keufs
You might also like[Refrain : Prince Waly]
Rain man, Rain man, Rain man, j'suis le Rain man
Rain man, Rain man, Rain man, j’suis le Rain man
Rain man, Rain man, Rain man, j'suis le Rain man
Rain man, j'suis le Rain man

[Couplet 2 : Tengo John]
Hey man, hey man, pour ma famille j'suis le Rain man
J'fais tourné ta toupie Bayblade, si tu veux m'voir faut mater l'ciel
J'débarque en lyrical tsunami, fait pleuvoir les sous tah Abou Dabi
Hey man, j'suis le rain man, chargeur rempli de flow : bang bang
On fait la pluie et l'beau temps, tu sers à rien comme l'OTAN boy
J'le fais pour ma postérité quand j'pourrais m'reposer dans ma prospérité
Waly - Tengo ne parlent pas trop, on déploie les ailes de l'albatros
On va régner, tisser des liens, c'est au sommet que j'dois hisser les miens

[Outro : Tengo John]
Rain man, rain man, money maker, j'suis le rain man
Rain man, rain man, pour ma famille j'suis le rain man
Rain man, rain man, money maker, j'suis le rain man
Rain man, rain man, pour ma famille j'suis le rain man
Rain man, rain man, money maker, j'suis le rain man
Rain man, rain man, pour ma famille j'suis le rain man
Rain man, rain man, money maker, j'suis le rain man
Rain man, rain man, pour ma famille j'suis le rain manEmbed"
Prince Waly,Risotto,"7 ContributorsRisotto Lyrics[Paroles de ""Risotto""]

La nuit on rêve de Little Italy en mangeant un risotto
Désillusion, je me réveille sur un lit d’hosto
J’ai de nouveaux trous dans la peau, tu sais c’est pas nouveau
J’ai besoin d’un nouveau cœur, Cupidon possède un semi-auto

Cet enfoiré m’a flingué en plein cœur
Les impacts de balle ont formé un logo
Allô, maman, j’ai bobo
Je suis tombé si bas, j’ai trop mal au dos
J’ai gardé de mauvais réflexes
J’ai toujours un flingue qui peut rafaler comme reflex
C’est un pour les billets de banque
Deux pour les billets de banque
J’aurais dû coffrer, elle veut la maison
L’hiver arrive, c’est bientôt la saison
Je suis plus dans la gue-dro, je fais plus de livraisons
Les billets de banque m’ont fait perdre la raison
Les biches m’avaient dans la peau, dans le cellulaire
Je suis tombé pour elle, dans la cellule erre
Adrénaline, stress, cette ancienne vie me manque presque

La nuit on rêve de Little Italy en mangeant un risotto
Désillusion, je me réveille sur un lit d’hosto
J’ai de nouveaux trous dans la peau, tu sais c’est pas nouveau
J’ai besoin d’un nouveau cœur, Cupidon possède un semi-auto
La nuit on rêve de Little Italy en mangeant un risotto
Désillusion, je me réveille sur un lit d’hosto
J’ai de nouveaux trous dans la peau, tu sais c’est pas nouveau
J’ai besoin d’un nouveau cœur, Cupidon possède un semi-autoYou might also likeEmbed"
