Artist,Title,Lyrics
Siboy,Doué,"12 ContributorsDoué LyricsWe  live in special kind of space

[Intro]
Qu'est-ce qui s', qu'est-ce qui s'passe négro ?
Qu'est-ce qui s', qu'est-ce qui s'passe négro ?
Qu'est-ce qui s', qu'est-ce qui s'passe négro ?
Qu'est-ce qui s', qu'est-ce qui s'passe négro ?
Je m'sens trop différent d'eux
Je m'sens trop différent d'eux
Qu'est-ce qui s', qu'est-ce qui s'passe négro ?
Vous avez tous le même flow, qu'est-ce qui s'passe négro ?

[Couplet]
Le rap a trouvé son chaînon manquant
J'mets des KO, sans toucher l'menton
Dans mes artères, substance hallucinogène
Mon regard s'évade vers le ciel
On fait la paix aux cadavres
C'est la guerre faut être très peu bavard
J'baise des prod, que j'accouche, et vos oreilles subissent un décrassage
Quand je bosse je m'applique
Je recherche que du fric
Ripou en voiture banalisée
Pas de religion dans la musique : phrase à méditer
Posé au QG à poser des versets d'bâtard
J'nage dans une merde... remplie d'cafards
Passe le Salam à mes rebeu qui disent vrai
Parlent peu, font les choses toujours discrets
L'état j'm'en tape, c'est pour moi j'veux militer
Mon rap a la violence forfait illimité (rratatatatatatah)
Congolais comme 80% du Rap français
J'compte innover innover négro jamais envie de pioncer
C'est Marabout Gang
C'est Marabout Gang
C'est Marabout Gang
Ils rappent tous pareil, la même ADN, la chatte à leur mère
On fait l'boulot, dis-le à Laurent Bouneau
Pas d'Paradis pour les gangster, va le dire à Coolio
On sait rapper à défaut qu'à l'école on s'est raté
Les rappeurs j'vous crois pas, sur ça je suis athée
Vas-y vas-y vas-y qu'est-ce que j'suis doué !
Qu'est-ce que j'suis doué !
Je pose et ça plaît, dans leur coeur y'a des plaies
J'ai plus de flow que toi, sur ça la nature n'est pas fair play
On peut causer pendant 2 heures, petite pute
T'auras ni mon beef, ni mon sperme au mini-litre (Grosse garce)
Bizarre, y'a des cauchemars qui m'ont plu
Mon bled crève, parce que y'a des clochards qui le tuent
Ils ont du mal à m'analyser
Tout c'que je vais faire c'est vous rafaler
C'est ma façon de prouver mon amitié
J'écris ce texte à 3h48
Je le rappe à la suite, pour te crever à la suite (qu'est-ce que j'suis doué)
Prépare la mixtape, j'compte vous lapider
Redouté, mieux vaut être codé'
Nan, ils n'auront pas de pitié
Je sais mais je m'en cogne
Je raconte ma peine tel un ivrogne (let's get it) !
You might also like[Outro]
Negro, passe la codé que je lean
Qu'est-ce que j'suis doué
Qu'est-ce que j'suis doué
Qu'est-ce que j'suis doué
Qu'est-ce que j'suis doué
Qu'est-ce que j'suis doué
Grosse garce !
Qu'est-ce que j'suis doué
Kiubb 4 arrive
On a pris du retard mais ça arrive dur
La chatte à la mère du fiston qui a dit que Siboy il rappe mal
Au faite, retrouvez-moi au Noumatrouff le 27 février
Pour une premiere partie, on va cramer ça
Qu'est-ce qui s', qu'est-ce qui s'passe négro ?
Qu'est-ce qui s', qu'est-ce qui s'passe négro ?
Qu'est-ce qui s', qu'est-ce qui s'passe négro ?
Qu'est-ce qui s', qu'est-ce qui s'passe négro ?

Je m'sens trop différent d'eux
Je m'sens trop différent d'eux
Qu'est-ce qui s', qu'est-ce qui s'passe négro ?
Vous avez tous le même flow, qu'est-ce qui s'passe négro ?Embed"
Siboy,Dubbele*,"3 ContributorsDubbele* LyricsLyrics From Snippet

[Chorus]
Stack die money, ik moet dubbele
Stack die money, stack die money, ik moet dubbele
Stack-stack-stack die money ik moet dub-dub-dubbele
Dub-dub-dubbele
Dub-dub-dub-dub-dubbeleYou might also likeEmbed"
Siboy,Ennemis,"4 ContributorsEnnemis Lyrics[Intro : Bridjahting]
Eeeeeeeeh
Young young
Eeeeeeeeh
Young Bvngz on the track
Eeeeeeeeh
Ennemis
Ennemis

[Refrain : Bridjahting]
Ennemis, ennemis
Brûleurs vifs
Le 92i ne pardonne pas
Pirate ne pardonnera jamais
Tu couleras comme les autres à jamais

[Couplet 1 : Bridjahting]
On va t'enculer en anonymat
Fais le fou derrière un micro, devant nous tu restes juste abominable
Qui sont-ils vraiment ? Où sont-ils vraiment ?
Ne sois pas gênant car on est dominant
La haine dans leurs yeux quand negro vise la réussite
Espérons niquage, regarde le peuple nous félicite
Ne fais pas le caïd mes negros vont te saucissonner
Trop loin pour eux, personne pour nous impressionner
Cagoulé, kalashé, noir sont mes antillais
Quand c'est la guerre [?] êtes prêts à rafaler
Qui sont-ils vraiment ? Où sont-ils vraiment ?
Le niquage de mère ne fait que commencer
You might also like[Refrain : Bridjahting]
Ennemis, ennemis
Brûleurs vifs
Le 92i ne pardonne pas
Pirate ne pardonnera jamais
Tu couleras comme les autres à jamais
Ennemis, ennemis
Brûleurs vifs
Le 92i ne pardonne pas
Pirate ne pardonnera jamais
Tu couleras comme les autres à jamais

[Couplet 2 : Siboy]
Pas de temps à perdre pour être honnête
Baise le rap comme dans un bordel
Plus de biff j'aurais je promet
Dans les rues de ma ville je m'fait discret
Défoncé le soir car bonne est la beuh
Putain suce moi mieux putain d'blondes aux yeux bleus
Pouki à gauche j'ai bien localisé
Ennemi au sol peut pu m'neutraliser
Cœur de lion négro et couille de taureau
Touche à [?] je t'explose le cerveau
A la famille qu'on envoie des caviars
Je t'aime de tout mon cœur putain d'marijuana
J'suis bien défoncé dans la nuit
Absence noir comme Norman Bates
[?] joint 90
Papa enterrement [?]
Bridjahting dis moi ""sa kap fet""
Calcule pas les autres comme dans une secte
Parole de haineux, jamais nous a faites
Plus tu leur parle mal, plus elles aiment bien
C'est pas pour toi mais pour ton fric qu'elle vient
Plus de salope que de meufs biens (Sache-le)
[Refrain : Bridjahting]
Ennemis, ennemis
Brûleurs vifs
Le 92i ne pardonne pas
Pirate ne pardonnera jamais
Tu couleras comme les autres à jamais
Ennemis, ennemis
Brûleurs vifs
Le 92i ne pardonne pas
Pirate ne pardonnera jamais
Tu couleras comme les autres à jamaisEmbed"
Siboy,#Frenchmen - Saison 1 - Siboy,"3 Contributors#Frenchmen - Saison 1 - Siboy Lyrics[Couplet unique]
Président, j'fais du trap de président
Si y'a drah, tu perds une dent toi et ta femme, qui t'a dit qu'j'étais galant ?
Ces rappeurs sont trop suspects, ils ont plus de côtés bavard que bagarreur de Cassius Clay
Pas l'temps de parler coup de coude dans la tronche pour la présentation
Leur faire du mal ma seule orientation
Boy-si, 92iYou might also likeEmbed"
Siboy,Hey Mama,"8 ContributorsHey Mama Lyrics[Paroles de ""Hey Mama"" ft. Naza]

[Intro : Siboy]
Kysek on the beat
Hey mama !
J'suis parti, des fois je m'suis perdu
Dehors c'est dur surtout pour jeune du ghetto
J'dois mener la route guer-lar ces négros

[Couplet 1 : Siboy]
J'ai travaillé dur dans l'chantier
Négro africain comme antillais
Masta, j'viens du grand continent le plus pillé
Où misère est dur à oublier
Subsaharien était l'Africain
Il aime les gros boules le swag américain
J'baisse pas mon flow comme Wemba
J'dis c'que je pense comme lumumba
Africain, ce type pour réussir il doit changer d'fuseau horaire, abandonner
Famille et enfants, des familles se retrouvent décimées
Cagoulé pas là pour causer
Tu crois que je dors Masta ? Je fais que bosser
Je compte sur moi, personne pour m'saucer
Plongé dans le futur toute la noche

[Refrain : Siboy]
Hey mama !
J'suis parti, des fois je m'suis perdu
Dehors c'est dur surtout pour jeune du ghetto
J'dois mener la route guer-lar ces négros
Hey mama !
Hey mama !
Hey mama !
Hey mama !
Oh galère
Pauvre salaire
Ohlala !
Ohlala !
You might also like[Couplet 2 : Naza]
Ohlala ! On veut des lovés, du bizz dans la mallette
Ohlala ! On a des couteaux, d'la merde dans les mains
Nous c'est à la Street qu'on reste accrochés (bien sur)
Et c'est comme ça qu'on reste les meneurs
Nous mettre sur le banc ? Jamais d'la vie, on va casser des dents
On est belés dès le matin, si tu nous cherches on vient jusqu'à chez ta mama
Fais pas le gros bonnet, toi c'est à ta meuf que t'as tout donné
Moi j'fais le gros bonnet, c'est à mama que j'ai tout donné

[Refrain : Siboy]
Hey mama !
J'suis parti, des fois je m'suis perdu
Dehors c'est dur surtout pour jeune du ghetto
J'dois mener la route guer-lar ces négros
Hey mama !
Hey mama !
Hey mama !
Hey mama !
Oh galère
Pauvre salaire
Ohlala !
Ohlala !

[Couplet 3 : Siboy]
Dans la musique je m'confesse
Mon esprit est au bled et pas dans la tess'
L'industrie c'est ""Marche ou crève""
Chérie, est-ce que tu aimes moi ou mon chèque ?
Des euros je veux des millions !
Sous ma cagoule, elle me dit qu'j'suis mignon
Je l'ai ken en lui tirant les chignons (allright)
Elle est partie sans savoir mon prénom (ha ha ha !)
Hé, Masta c'est le game
Hé, je sais plus qui est sincère
[Refrain : Siboy]
Hey mama !
J'suis parti, des fois je m'suis perdu
Dehors c'est dur surtout pour jeune du ghetto
J'dois mener la route guer-lar ces négros
Hey mama !
Hey mama !
Hey mama !
Hey mama !
Oh galère
Pauvre salaire
Ohlala !
Ohlala !

[Outro : Siboy]
He he he Mac Dizer, le mécano ! (ohlala)
Mwana Mboka, Brazzaville ! (ohlala)
Marabouts Gang !
92i ! (ohlala)
OneFanibal !
Oui !
Twapplife (ohlala)Embed"
Siboy,Instantané,"13 ContributorsInstantané Lyrics[Paroles de ""Instantané""]

[Couplet 1]
(Sale ! Oh Ouh)
Ce putain d'negro m'a prit pour une tchoin
J'réfléchis où l'enterrer dans quel coin
Torturer le Rap game je prendrai soin
Je mettrai jamais de l'eau dans mon putain d'vin
On veut de l'oseille sur le cou de l'or
On rafale ta caisse même si y'a bébé à bord
T'es démodé comme le Jean Levis suce
Si la parole suffit pas faut donner des coups
Négro j'fais des rêves où j'dissèque des corps
Ma pute prends d'la C pendant qu'j'tripote son corps
J'ai dit à la faucheuse va sucer des putes
Marabout ça fait déjà longtemps qu'il est mort
Tellement bre-som j'ai les cernes d'Itachi
C'est ma pute qui commande sur VivaStreet
J'attends qu'le fric, plus rien de la vie
J'ai déjà un garçon j'ai déjà une fille
Je plane comme dans rêve astral
Plus de cagoule que d'habits à la casa
Masta ki sa ka alé la, Tu parles pour R lon wa kuma
Ton corps retrouvé dans les bois, des chiens qui aboient
Le climat est froid, tu me croiseras que le soir
L'odeur de ta meuf sur mes doigts
You might also like[Refrain]
Négro chelou quand j'ai bien observé
J'veux beaucoup d'billets j'suis un sans-papier
Toi tu veux sucer comme un nouveau-né (suce)
T'as la grande gueule comme Christophe Galtier
T'essaie beaucoup de me baratiner
J'habite à deux pas d'un pays frontalier
Ta peau d'bébé sera carabinée (toutoutou)
Et ta mort sera instantanée, instantanée (tch) instantanée
Instantanée (tch) instantanée (brrra)
Instantanée (tch) instantanée
Instantanée (tchtch) instantanée sache-le

[Couplet 2]
Entre
Eh ben t'es bonne eh ben (oui)
T'as l'air d'une fille bien (oui)
Suce des bites, c'est bien (ça alors)
T'as soif moi j'ai faim
Cette nuit s'ra trop dingue (ooooooh)
Attends j'te ressers un peu d'vin (ouh)
Me questionne pas sur mes ennemis (ouh)
Marabout n'a pas de limites
Chez moi pas qu'le Vendredi tout est permis (oui) Oui
Celui qu'affronte le sida d'un jaloux (oui)
Wa sav' an pa ka bat dous (oui)
Beaucoup dans le game ils trichent (oui)
Comme le profil sur Badoo (oui)
[Refrain]
Négro chelou quand j'ai bien observé
J'veux beaucoup d'billets j'suis un sans-papier
Toi tu veux sucer comme un nouveau-né (suce)
T'as la grande gueule comme Christophe Galtier
T'essaie beaucoup de me baratiner
J'habite à deux pas d'un pays frontalier
Ta peau d'bébé sera carabinée (toutoutou)
Et ta mort sera instantanée, instantanée (tch) (oui) instantanée
Instantanée (tch) instantanée (toutoutou)
Instantanée (tch) instantanée
Instantanée (tch) instantanée sache-le

[Outro]
Le S-ale
Twapplife
Instantanée1Embed"
Siboy,JIA,"15 ContributorsJIA Lyrics[Intro]
You are now listening to the smooth sounds of RicandThadeus music

[Couplet unique]
Au départ c'était des barres de rires après l'école
Inhaler des barres de shit
La rue tu l’aimes ou tu la quittes négro
Soit elle te baise pour une histoire de liquide
Seuls mes gars je peux côtoyer
A défaut de perdre j'suis obligé de gagner
J'fais mes courses dans les ché-mar
Toujours un seum contre les brigadiers
Le futur me réserve le pire
J'le sais j'ai même pas besoin qu'il me l'dit
Mauvais Karma, négro où on va?
Ils attendaient les morts pour se repentir
La musique m'évade, la musique me calme
Beaucoup de morts, beaucoup de drames
J'ai la voix grave comme un chef d'État
A force de baiser j'aurai l'cancer de la prostate
Et puis si tu m'appelles et qu'j'répond ap
N'insiste ap (mon shrab???)
Tu n'me verras jamais dans les bails bizarres
J'pense mon temps à débattre, insomniaque
Tous victime du système
Où faut taffer pour être quelqu'un
(Négro)
J'regrette ma jeune enfance à chaque pépin
On fait tous l'erreur de répondre
Quand la mort nous appelle en inconnu
Nos charclos ont le nez éclaté
Quand maman craque, je me sens trop nul
You might also like[Pont]
Le système l'a fait
Te dilater l'anus
Le système l'a fait
Il nous a baisé, il nous a eus
Obligé d'vous dire, dire, que j'ai faim là haut
Grand-mère me tient la main
Terne, terne est mon teint
Esprit mabé après le pain

[Refrain]
Notre force se trouve là où tu manges plus rien
Rappeurs non politiciens
Tout ces morts, morts j'y peux rien
Ma joie de vivre, vivre s'éteint
Jeune immigré Africain
Jeune immigré Africain
Venu juste chercher mon pain
Venu juste chercher mon pain
Jeune immigré Africain
Jeune immigré Africain
Tout ces morts, j'y peux rien
Rappeurs non politiciens
(Négro)

[Outro]
2, 4, 2
BMG
92i
NiniiiiiiiiiEmbed"
Siboy,Kiubb 1,"12 ContributorsKiubb 1 Lyrics[Intro]
Menace
Parle pas, on te nace-me
Parle pas, on te nace-me
Parle pas, on te nace-me
J'ai dit, parle pas, on te nace-me
Parle pas, on te nace-me
Parle pas, on te nace-me
Parle pas, on te nace-me
J'ai dit, parle pas, on te nace-me
Menace

[Couplet 1]
Tous mes négros me soutiennent, mon putain de flow africain
Le numéro un, y'en a que un, fais pas ton tchoin négro, on va t’éteindre
Mais qu'est-ce que, mais qu'est-ce que je te dis ?
Tous mes négros veulent te quer-ni
Le délire c'est devenu des délits
Wesh, négro, l’État est puppy
Je te baise par-ci, par-là
Flow quenelle, Mbala mbala
Masta, j'incarne, j'incarne l'étalage
Les négros font l'taf , moussala, moussala
Les négros me té-ma, cherche à comprendre ce que je dis
Congolais, je fais pas semblant de vous haïr
Eh sika biso, je vais vous percer comme Bisso na Bisso
Tu comprends ce que je te dis
Tu comprends ce que je te dis
Pour moi, négro, c'est trop facile makassy
Naza makassy na c'est qui ? Na c'est qui ?
Y'a rien de magique, lourdeur vocale
Ouais négro, je suis trop brutal
Mon négro, la France c'est Bac +5 pour finir vendeur de crack
Négro y'a quoi ? Tu connais, de la gue-dro sans langue de bois
Ici, t'as pas le choix, j'aurais été un criminel et toi avocat
Chien de la casse, négro, on est fait comme des chiens de la casse
Vive le tier-quar, le grec, que des braves, des chacals qui t'arrachent le bras si tu chiales ta race
You might also like*Changement d'instru*

[Couplet 2]
Négro, c'est pas la fête, la vie à chaque fois nous la met
Ces pédés sont pas contents, je vais les baiser, je peux me le permettre
J'arrive à gérer mes capacités, ma nervosité, ma nervosité
Maintenant chacun son 'blème, même dans la cité
Personne va t'aider, rêve pas, aucun pour toi va se sacrifier
Tu n'as pas idée, l'homme est mauvais
L'homme est mauvais, plus que la chatte à ta chienne
Des grosses cernes sous les yeuz
De la thune, ouais, c'est ce qu'on veut
La misère, une croisière, une galère, négro c'est affreux
Sur le ter-ter, les pieds ferment
Entre fleur et bédo oui j'alterne
Si t'es un bavard, négro tu la fermes
La rue te fera du mal à long terme
Tout le monde finira sous terre
T'es personne, s'te plait, arrête donc tes balivernes
Tellement de crime que tu gerbes, comment faire ?
Comment baiser cet état qu'on berne
Ils veulent faire croire qu'on a une maladie
Pas besoin négro d'une thérapie
Ma frappe, elle est nette et précise
Avec les mains, oui, je suis très habile
Dans la rue y'a que des Doumba
Pour la monnaie toko boumba
La jalousie, oui, te fait maigrir, te pousse à trahir ton roi #Mufasa
Tes potos me sous-estiment comme la merde qui se cache dans le cannabis
À chaque fois je dis j'vais arrêter
À chaque fois je sais j'viens d'mentir
We live in a special kind of space Embed"
Siboy,Kiubb 2,"6 ContributorsKiubb 2 Lyrics[Couplet unique]
Trop d'flemme, trop d'cernes
Le teint terne, trop d'problèmes
La misère, une traîtresse
Avec l'oseille, elle se prosterne
Le monde tourne, comme la mode
Hommes, femmes, se confondent
J'affronte, au front
Les coups de lame, sont mes offrandes
Profondes sont les blessures
Debout et fières sont nos postures
Le dos dur, bavure
Lentement, on sature
On voit tout, comme la 5D
Gauche, droite, cimetière blindé
L'Afrique, l'Europe, tout ça ne semble pas fair-play
Bidonvilles, ghettoyouth
[?] ça c'est louche
Du trap, j'en fais
J'vous baise, et ça vous plaît
Mes sens en éveil
On veut l'argent, on veut l'oseille
On traîne tard, puis rentre tôt
Le jour d'après? Outlaw
Des larmes, des pleurs
Des drames, des douleurs
Mama, je pars
J'reviendrai avec du biff de toutes les couleurs
Pas d'confiance, pas d'biff
T'as pas d'boul, t'auras pas d'bite
Toujours en partance dans ta chatte, avec mes phalanges
You might also like[Outro]
Tout ça me donne envie de bédave, de bédave
Tout ça me donne envie de bédave, de bédave
Quelle merde, sa mère
Bordel, nique sa mère
Quelle merde, sa mère
Bordel, nique sa mère
Me donne envie de bédave
Me donne envie de bédave
Me donne envie de bédave
Me donne envie de bédave
Bédave
BédaveEmbed"
Siboy,Kiubb 3,"4 ContributorsKiubb 3 Lyrics[Refrain]
Everyday nous on pense à l'oseille
Trouve moi en train de taffer dans le QG
Hargneux comme un réfugié
Rends mon biff et ne fais plus chier
Tu m'dois mes lovés, lovés, lovés
Mes lovés, lovés, lovés
Ou j'vais me lever, lever, lever
Me lever, lever, lever

[Couplet unique]
Rends moi euro, livre sterling, dead puis l'histoire se termine
On danse sur ton cadavre comme Sturridge
Mauvais karma, tu sais qu'j'ai un mauvais karma
J'suis prêt à tout jusqu'à balafrer ta baby mama
Ouais, tu veux faire l'Tony Montana
On t'paye un shah pour t'la mettre dans l'boul comme khouya DSK
Langage codé le keuf croit j'parle lingala
Ta suzax me convoite comme l'EDF
Joint de shit mé-cra, ma tête ner-tour
Et j'veux baiser des jumelles, négro comme Oussama
Y'a du XXX scar-la
Qui t'la foutent dans le boul' même si t'as tes ragnagna
Big up aux khey d'Toulouse, masta Mulhouse y'a trop d'loups
Ce son j'l'ai fait en trente minutes mais te-ma comme il est trop lourd
J'me moque de leur niveau, merde j'crois j'ai plus d'rivaux
Le peu qui reste repose déjà en paix dans l'caniveau
You might also like[Refrain]
Everyday nous on pense à l'oseille
Trouve moi en train de taffer dans le QG
Hargneux comme un réfugié
Rends mon biff et ne fais plus chier
Tu m'dois mes lovés, lovés, lovés, mes lovés, lovés, lovés
Ou j'vais me lever, lever, lever, me lever, lever, leverEmbed"
Siboy,Lelo,"11 ContributorsLelo Lyrics[Couplet Unique]
Je m’occupais pas de leur life
Juste de moi et de tous mes amis
Poto, dis-moi si t'as des ennuis
Je serai là plus vite que la brigade canine
Entre nous on se sait, on fait ce qui nous plait
Le respect c’est mieux qu'la monnaie, impossible d'le voler
Fais tes choix et crois-moi
Vire les mauvais qui parlent quand t’es pas là
Negro ce n’est pas la fête, fais le fou tu payes
Maman je sais que tu regrettes
J’ai pris le chemin que tu ne voulais pas en scred
La rue c’est que des problèmes
Y'a plus de coup de coudes que des ""je t'aime""
Le rap, mon doigt dans sa teu-cha, impossible qu'il s’échappe
Mon rap est violent toujours gé-char, impossible qu’il s’égare
Trainer tard negro c’est ma life
La journée ça dort comme des Koalas
R.I.P aux negros qui sont plus là
23 balles ne viendra pas les gênez dans la cabeza
On m’a dit yokasa ani ni lelo, labeni la complete a bangue lelo
Bako lala bako ngosso niousoul, bako lala bako ngosso niousoul
Lelo, lelo
Bako lala bako ngosso niousoul, bako lala bako ngosso niousoul
Lelo, leloYou might also like2Embed"
Siboy,Mailler,"8 ContributorsMailler Lyrics[Couplet]
M'en bats les couilles, celui qui fait l'chaud, je le té-sau
Mes djacks, mes négros
Makasi, tu me verras que à bord d'un vaisseau
J'ai 23 balais, j'suis fucked up, ouais négro je plane
Quand j'baise j'suis ""happy"" comme Pharrell Williams
L'euro, c'est l'euro que j'vais mailler, l'gangs'
Sors le cash, ta pute ira voir un autre gangs'
Si réversible, négro, est ta veste, j'espère électrique, négro, sera ta chaise
Je m'pavane avec d'la drogue dans les veines
C'est normal que la faucheuse a le sourire quand elle m'guette
La mort vient toujours après la fête
Je reverse du liquide pour mes kheys qui reposent en paix

[Refrain]
J'veux mailler! j'veux mailler! j'veux mailler! j'veux mailler!
J'veux mailler! j'veux mailler! j'veux mailler! j'veux mailler!
Négro, bomayé! bomayé! bomayé! bomayé! bomayé !
Si ils m'laissent pas mailler
Imbécile! Imbécile! Imbécile! Imbécile!
Imbécile! Imbécile! Imbécile! Imbécile!
Négro, j'veux mailler! j'veux mailler! j'veux mailler! j'veux mailler! j'veux mailler !
J'veux mailler! j'veux mailler! j'veux mailler !You might also like3Embed"
