Artist,Title,Lyrics
Siboy,Al Pacino,"17 ContributorsAl Pacino Lyrics[Paroles de ""Al Pacino""]

[Intro]
Yeah, yeah...

[Refrain]
J'ai fumé tellement d'herbe ça s'compte en kilos
Pour la moula, j'suis prêt à faire des réveils matinaux
J'ai vu des larmes et des pleurs dans les camps rivaux
Ces pédés voulaient trop ressembler à Al Pacino
Al Pacino, Al Pacino
J'veux voir la vie en rose, le boule à J-Lo
Oh, Al Pacino
J'suis chiné négro comme un latino

[Couplet 1]
Vive la moula fuck la voie de détresse
J'veux du liquide en période de sécheresse
Inoubliable est l'amour maternel
À cause de la guerre, je n'ai pas eu de maternelle
Ma haine se compte en Tera, qui me sucera avalera (suce moi)
Et je pleure pour les miens, les autres bon débarras
J'arpente les rues comme les darmes-gen
Je ne cherche que de l'argent
Plus de cœur en or, beaucoup d'contrefaçons
T'as pas de flow comme la misère en Afrique
Viens pas me parler négro si t'as pas d'fric
Négro, négro, éliminé
Regard froid illuminati
Je te bute et je suis lunatique
Al Pacino m'inspirait quand j'étais môme
J'ai pleuré des larmes de sang quand j'ai vu mon père en taule
You might also like[Refrain]
J'ai fumé tellement d'herbe ça s'compte en kilos
Pour la moula, j'suis prêt à faire des réveils matinaux
J'ai vu des larmes et des pleurs dans les camps rivaux
Ces pédés voulaient trop ressembler à Al Pacino
Al Pacino, Al Pacino
J'veux voir la vie en rose, le boule à J-Lo
Oh, Al Pacino
J'suis chiné négro comme un latino

[Couplet 2]
Mon négro faut mailler
Faut pas que je dorme, pas le temps de bailler
Leur faire du mal négro fallait, quand les keufs viendront je s'rai ailleurs
Al Pacino a gâché nos vies, nant-tronço beaucoup d'amis
Si grand-mère me regarde du ciel, je sais qu'elle ne sera pas ravie
Al Pacino qu'est-ce t'as fait ? T'as donné des envies meurtrières ?
La haine est collée à mes trousses et ne veut plus me quitter
Al Pacino qu'est-ce t'as fait ? Regarde, j'reconnais plus mes reufrés
Plus personne ne sait reculer, tout est noir dans nos idées
Merde, Al Pacino qu'est-ce t'as fait ?
J'crois bien que j'vais mettre le feu (blah blah blah blah)
Prêt à niquer des mères négros everyday, j'crois bien que je perds la tête
Maman désolé, meilleur que ces pédés depuis ado
Depuis le préau, Al Pacino jusqu'au sexe
[Pont]
Al Pacino jusqu'à dead
J'l'ai baisé, j'veux pas la doigter
Al Pacino everyday, ouais, Al Pacino everyday
Al Pacino jusqu'à dead, Al Pacino everyday
Al Pacino everyday

[Refrain]
J'ai fumé tellement d'herbe ça s'compte en kilos
Pour la moula, j'suis prêt à faire des réveils matinaux
J'ai vu des larmes et des pleurs dans les camps rivaux
Ces pédés voulaient trop ressembler à Al Pacino
Al Pacino, Al Pacino
J'veux voir la vie en rose, le boule à J-Lo
Oh, Al Pacino
J'suis chiné négro comme un latino2Embed"
Siboy,En bas,"9 ContributorsEn bas Lyrics[Intro : Siboy]
On a grandi dans ces bâtiments (oh, oh, ah, ah)
Cœur  sombre comme au Vatican (oh, oh, ah, ah)
On  a grandi dans ces bâtiments (oh, oh, ah, ah)
Cœur sombre comme au Vatican (oh, oh, ah, ah)
Faut tout niquer, moi, j'viens d'en bas
Faut  tout niquer, moi, j'viens d'en bas

[Couplet 1 : Siboy]
Elle  kiffe m'analyser, elle dort même plus la nuit
Je suis dans ma fusée, j'plane, j'parle à ma ville
Je  kiffe la chouchouter comme ma liasse sortie d'la banque
Le meilleur ami d'l'Homme, j'pense que c'est un glock
Ça bibi dans le bâtiment parce que mille deux, c'est fatiguant
Un sourire sans émotion quand canon brille devant ennemi

[Couplet 2 : Tiakola]
Mille  deux ça donne pas d'ambition, millions d'euros est la mission
J'dois ramener plus à la maison, jamais buguer d'vant l'addition
Parce que

[Pré-refrain : Tiakola]
J'suis dedans, j'suis dedans, j'sais que c'est noir
Suivez-moi, c'est devant, y'a même à boire
Haut les mains, haut les mains, j'suis dans le sale
La cagoule est d'sortie, merci, au revoir
J'suis dedans, j'suis dedans, j'sais que c'est noir
Suivez-moi, c'est devant, y'a même à boire
Haut les mains, haut les mains, j'suis dans le sale
La cagoule est d'sortie, merci, au revoir
You might also like[Refrain : Siboy]
Faut tout niquer, moi, j'viens d'en bas
Faut tout niquer, moi, j'viens d'en bas
On a grandi dans ces bâtiments (oh, oh, ah, ah)
Cœur sombre comme au Vatican (oh, oh, ah, ah)
On a grandi dans ces bâtiments (oh, oh, ah, ah)
Cœur sombre comme au Vatican (oh, oh, ah, ah)

[Couplet 3 : Bné]
Copine, m'en veux pas si tu t'es attachée
J'suis dans l'bâtiment, m'embête pas, j'fais les comptes de la journée
Je fais que recompter, recompter, recompter, hey
Tout est bon, tout est noir, tout est ok
Plavon, j'suis ganté, cagoulé, ok
Pas moins d'10K dans l'enveloppe, j'suis opé'
Trix-ma, qu'est-c't'as ? Étonné de me voir dans le sale
J'suis d'attaque, cache-toi, personne ne court plus vite que les balles

[Pré-refrain : Tiakola]
J'suis dedans, j'suis dedans, j'sais que c'est noir
Suivez-moi, c'est devant, y'a même à boire
Haut les mains, haut les mains, j'suis dans le sale
La cagoule est d'sortie, merci, au revoir

[Refrain : Siboy]
Faut tout niquer, moi, j'viens d'en bas
Faut tout niquer, moi, j'viens d'en bas
On a grandi dans ces bâtiments (oh, oh, ah, ah)
Cœur sombre comme au Vatican (oh, oh, ah, ah)
On a grandi dans ces bâtiments (oh, oh, ah, ah)
Cœur sombre comme au Vatican (oh, oh, ah, ah)
[Couplet 4 : Djeffi]
Moi, j'viens d'en bas, on est des fous, calibre 12, igo j't'étouffe
Y'a trop d'ients-cli, un p'tit coup d’œil, un p'tit coup d'souffle, j'veux pas qu'ils m'fouillent
Dans l'bâtiment, il fait trop noir, il fait trop sombre, mon cœur qui souffre
Tu veux ma peau ? Prends ton ticket, chacun son round
Tout ça gros, c'est fatiguant, des proches devenus étranges
Ça vend dans le bâtiment, ça fume la drogue du châtiment

[Pré-refrain : Tiakola]
J'suis dedans, j'suis dedans, j'sais que c'est noir
Suivez-moi, c'est devant, y'a même à boire
Haut les mains, haut les mains, j'suis dans le sale
La cagoule est d'sortie, merci, au revoir

[Refrain : Siboy]
Faut tout niquer (""Au revoir merci""), moi, j'viens d'en bas
Faut tout niquer, moi, j'viens d'en bas
On a grandi dans ces bâtiments (oh, oh, ah, ah)
Cœur sombre comme au Vatican (oh, oh, ah, ah)
On a grandi dans ces bâtiments (oh, oh, ah, ah)
Cœur sombre comme au Vatican (oh, oh, ah, ah) (""Au revoir merci"")2Embed"
Siboy,Hitch,"15 ContributorsHitch Lyrics[Paroles de ""Hitch""]

[Intro]
Hallélujah, chérie coco
Salut chérie coco, moi j'm'appelle marabout
C'est pas de ma faute, c'est pas de ma faute bitch

[Refrain]
Fuck négro snitch
Fuck négro snitch
J'veux ton cul l'amour j'm'en fiche
Je te baise et tu prends le heetch (d'accord, d'accord)
Fuck négro snitch, négro snitch
Fuck négro snitch, négro snitch
Fuck négro snitch, ta grosse bitch
Fuck négro snitch, ta grosse bitch

[Couplet 1]
Serre-moi la main masta, je veux la tête tah la guerre
J'suis entre terrien comme à la fête
Regarde-moi bien (aw, yeah), regarde-moi bien (aw, yeah)
Pouf, masta, ceci n'est pas match amical
En une saison, tu dégages comme Abidal (comme Abidal)
J'les graille comme Hannibal (aw, yeah)
Ma peau est sombre comme une vitre teintée
Tue tellement d'victimes, c'est moi qui va plainter
J'ai fait trafic, toi t'as zéro rain-té, tous ces batards veulent pas nous voir grimper
J'mélange la codé comme un physicien, drogué drogué était le musicien
Tu peux pas le faire masta ne l'promets pas, j'ai trop d'fierté masta pour faire le premier pas
You might also like[Refrain]
Fuck négro snitch
Fuck négro snitch
J'veux ton cul l'amour j'm'en fiche
Je te baise et tu prends le heetch (d'accord, d'accord)
Fuck négro snitch, fuck, fuck négro snitch
Fuck négro snitch, fuck, fuck négro snitch
Fuck négro, fuck négro, snitch
Fuck négro, fuck négro, snitch

[Couplet 2]
Fais le malin je sais où t'habites, bitch j'ai cer-per j'ai fait pétasse sur ma bite
Fuck un nigga snitch si ta femme est une bitch, me suce dans le heetch
Bien sûr que j'ai charbonné tout seul mon négro, maintenant j'vais les rafaler j'veux ma part du gâteau
Y'a des drames dans l'ghetto, je crame donc guette tôt
Mais qu'est ce qui se passe mon négro?
Fuck la Tour Eiffel quand je monte sur Paris, j'achète du Makemba à Saint denis
La D faut la quer-ni, avoir rendez-vous avec une pute, c'est avoir rendez-vous avec épidémie
XXX, droit dans l'fion voilà ma méthode
T'es tellement nul qu'elle prends des godes, elle prend des bites, elle prend des prot'

[Refrain]
Fuck négro snitch
Fuck négro snitch
J'veux ton cul l'amour j'm'en fiche
Je te baise et tu prends le heetch (d'accord, d'accord)
Fuck négro snitch, fuck, fuck négro snitch
Fuck négro snitch, fuck, fuck négro snitch
Fuck négro, fuck négro, snitch
Fuck négro, fuck négro, snitch1Embed"
Siboy,La nuit,"17 ContributorsLa nuit Lyrics[Paroles de ""La nuit""]

[Refrain]
La nuit on règle tous nos ennuis, mon cœur veut pas s'éclaircir
Des vrais c'est rare ici, j'ai pas que des amis dans la té-ci
La nuit on règle tous nos ennuis, mon cœur veut pas s'éclaircir
Des vrais c'est rare ici, j'ai pas que des amis dans la té-ci

[Couplet 1]
Pose pas de questions, laisse moi t'la mettre dans le caisson (Dans le caisson)
J'suis dans la rue comme à la maison, de toute façon depuis mineur j'suis au charbon (Ouh !)
J'prépare mon évasion, mauvais depuis la création j'dis bonjour à personne à la récréation
Pour la drogue, pourquoi j'ai une telle adoration ? (Adoration ?)
À ma mort, j'veux une incinération (Bouffon)
Fuck toutes tes opérations, j'gagne même si tu viens en coopération (Viens, viens, viens)
J'te baise tout d'suite, pas l'temps pour la fellation (Fuck off!)
J'mets la pote-ca pour m'accoupler, 92i vrai dal-so
D'mande à Damso pas de makoumé, ni depuis I.Z.I
Ça alors, qu'est-ce que j'ai progressé, j'vous trouvais fort maintenant faut laisser

[Interlude]
Turfu !

[Refrain]
La nuit on règle tous nos ennuis, mon cœur veut pas s'éclaircir
Des vrais c'est rare ici, j'ai pas que des amis dans la té-ci
La nuit on règle tous nos ennuis, mon cœur veut pas s'éclaircir
Des vrais c'est rare ici, j'ai pas que des amis dans la té-ci
You might also like[Couplet 2]
Crois pas qu't'es le plus fort, parce que tu passes en dio-ra
Pétasse tu pues d'la chatte, pourtant tu travailles à Séphora
Coriace comme une crotte qui part pas, après avoir tiré la chasse (Pas de maladresse !)
La pétasse me fait les yeux doux, dès qu'elle a vu ma liasse

[Pont]
La vie ne vaut rien, rien, rien, mais moi quand je tiens, tiens, tiens
Là dans mes deux mains éblouies, les deux jolis petits seins de mon amie
Et j'me dit : ""Rien, rien, rien... Rien ne vaut la vie
Rien, rien, rien... Rien ne vaut la vie.""

[Refrain]
La nuit on règle tous nos ennuis, mon cœur veut pas s'éclaircir
Des vrais c'est rare ici, j'ai pas que des amis dans la té-ci
La nuit on règle tous nos ennuis, mon cœur veut pas s'éclaircir
Des vrais c'est rare ici, j'ai pas que des amis dans la té-ci

[Outro]
La nuit on règle tous nos ennuis, mon cœur veut pas s'éclaircir
Des vrais c'est rare ici, j'ai pas que des amis dans la té-ciEmbed"
Siboy,Un jour,"17 ContributorsUn jour Lyrics[Paroles de ""Un jour""]

[Intro]
3, 2
Bibi !
Hmmhmm, hmm, hmm

[Refrain]
Je serai toujours là même si j'pars un jour
C'que maman m'a dit m'embrassant la joue
Ces jeunes noirs meurent bêtement comme Tupac Shakur
Mais bon c'est la vie faut qu'j'm'y fasse un jour
Oui j'en rêve encore, repartir au bled
Refaire ma valise, ma valise
Oui j'en rêve encore, repartir au bled
Revoir ma famille, ma famille

[Couplet 1]
Ces négros meurent, immédiate est la vengeance
On commet des meurtres pas par manque de conscience
À la fin j'assumerai toute la sentence
Je partirai comme un roi, pas comme une balance
J'suis né, igo, sur terre y'avait plus la paix
Beaucoup d'entre eux manqueront à l'appel
Jeune black déter' pour faire de la mula
Car ma vie était bancale comme les pas d'un soûlard
You might also like[Refrain]
Je serai toujours là même si j'pars un jour
C'que maman m'a dit m'embrassant la joue
Ces jeunes noirs meurent bêtement comme Tupac Shakur
Mais bon c'est la vie faut qu'j'm'y fasse un jour
Oui j'en rêve encore, repartir au bled
Refaire ma valise, ma valise
Oui j'en rêve encore, repartir au bled
Revoir ma famille, ma famille

[Couplet 2]
Depuis le début sublime est mon talent
À la vie, à la mort seulement pour ma maman
Aucune carence, j'me loupe rarement
M'en bat les couilles de toi, royalement
Adorable pendant un temps, à la fin j'deviens corrosif
J'vois des salopes me sucer, après Nero Nemesis
De la résine inhalée jusqu'à le cœur s'arrêtera
Tu m'as porté dans tes bras, jamais schizophrène devant toi
Validé par la rue c'est bien, mais c'est mieux quand c'est toi
J'f'rai d'la saleté toute ma vie, pour que tu retrouves la joie
Petit j'me sentais invincible, quand j'étais sous ton toit
La money vient et repart aussi vite que Bielsa
Ils veulent me porter le mauvais œil, m'isolent comme un fils unique
À six pieds sous terre je serai seul, pas avant qu'ma mission soit finie
[Refrain]
Je serai toujours là même si j'pars un jour
C'que maman m'a dit m'embrassant la joue
Ces jeunes noirs meurent bêtement comme Tupac Shakur
Mais bon c'est la vie faut qu'j'm'y fasse un jour
Oui j'en rêve encore, repartir au bled
Refaire ma valise, ma valise
Oui j'en rêve encore, repartir au bled
Revoir ma famille, ma famille6Embed"
Siboy,Ce n’était pas si simple,"17 ContributorsCe n’était pas si simple Lyrics[Paroles de ""Ce n'était pas si simple""]

[Refrain]
Putain, masta, j'suis là parce que y a mon gagne-pain
Si seulement tous ces bâtards savaient qu'c'n'était pas si simple
J'ai fait de la route depuis O'Yebi
J'veux quitter la France comme Ancelotti
J'veux quitter la France comme Ancelotti
Depuis tout petit, mon cœur souffre d’hémorragie
Putain, masta, j'suis là parce que y a mon gagne-pain
Si seulement tous ces bâtards savaient qu'c'n'était pas si simple
J'ai fait de la route depuis O'Yebi
J'veux quitter la France comme Ancelotti
J'veux quitter la France comme Ancelotti
Depuis tout petit, mon cœur souffre d’hémorragie

[Couplet 1]
Hey
Sais-tu vraiment qui sont tes vrais amis ?
Que ta bébé que t'aimes autant négro finira pas par trahir
Que Dieu m'pardonne cette nuit
Que Dieu m'pardonne cette nuit
J'vais commettre un homicide
Pétasse tu crois qu'tu m'manques
J'aime ton boule bébé c'est tout
Elle dit qu'elle m'aime même étant cagoulé
Avec moi y a que des contrats CDD
You might also like[Refrain]
Putain, masta, j'suis là parce que y a mon gagne-pain
Si seulement tous ces bâtards savaient qu'c'n'était pas si simple
J'ai fait de la route depuis O'Yebi
J'veux quitter la France comme Ancelotti
J'veux quitter la France comme Ancelotti
Depuis tout petit, mon cœur souffre d’hémorragie
Putain, masta, j'suis là parce que y a mon gagne-pain
Si seulement tous ces bâtards savaient qu'c'n'était pas si simple
J'ai fait de la route depuis O'Yebi
J'veux quitter la France comme Ancelotti
J'veux quitter la France comme Ancelotti
Depuis tout petit, mon cœur souffre d’hémorragie

[Couplet 2]
Touche à mon fils motherfuck c'est sûr toi aussi tu vas mourir
Sais-tu que les hommes ont désossés ? Capables de commettre le pire
Trahi par des lâches, je vis la nuit
Faut qu'j'évite le fusil sinon ils vont mourir
J'parle à moi-même comme un schizophrène
Hémorragie dans le cœur c'qui coule c'est la haine
Que Dieu m'pardonne pour cette nuit
Que Dieu m'pardonne pour cette nuit
J'vais commettre un homicide
Que Dieu m'pardonne pour cette nuit
[Refrain]
Putain, masta, j'suis là parce que y a mon gagne-pain
Si seulement tous ces bâtards savaient qu'c'n'était pas si simple
J'ai fait de la route depuis O'Yebi
J'veux quitter la France comme Ancelotti
J'veux quitter la France comme Ancelotti
Depuis tout petit, mon cœur souffre d’hémorragie
Putain, masta, j'suis là parce que y a mon gagne-pain
Si seulement tous ces bâtards savaient qu'c'n'était pas si simple
J'ai fait de la route depuis O'Yebi
J'veux quitter la France comme Ancelotti
J'veux quitter la France comme Ancelotti
Depuis tout petit, mon cœur souffre d’hémorragie

[Outro]
Ce n'était pas si simple
Ce n'était pas si simple
Ce n'était pas si simple
Ce n'était pas si simple
Je n'étais pas si sain
Ce n'était pas si simple
Ce n'était pas si simple
Ce n'était pas si simple
Je n'étais pas si sain
Je n'étais pas si sain
Bitch !Embed"
Siboy,Goût cerise (Bonus Track),"16 ContributorsGoût cerise (Bonus Track) Lyrics[Paroles de ""Goût cerise""]

[Intro]
Hun
Goût cerise, suce ma capote goût cerise
Goût cerise

[Couplet 1]
J'avance comme celui qui connait pas la peur, comme si j'ignorais l'existence de la mort (sache-le)
Pour mon dû, tu croiseras le côté bagarreur, t'auras sommeil éternel si on n'est pas d'accord
Des rêves plein la tête, des mains baladeuses, je sais ken femme flic comme Le Professeur
T'es une jolie salope et si j'te dis qu'tu commences à bien sucer, c'est qu'c'est prometteur (allez suce)
Faible devant plaisir charnel, devant gros cul et marmots, j'ai des boum au cœur
À la fin d'relation, elle m'traite de gros menteur, j'ai pas pris la grosse tête, j'suis juste un fin rôdeur
Suce ma capote goût cerise, doué dans l'écartement comme Moïse
Change de tchoin comme Mesrines, mon ange-gardien parle de crimes

[Pont 1]
Comment veux-tu évoluer sans prendre de risques ? (des risques)
Ma patience a pris des rides (des rides)
De l'inspiration en abondance (en abondance)
Après ta mort, j'écoute ""Alors on danse"" (Stromae)

[Couplet 2]
242 créé la tendance, pédophile pour toi simple s'ra la sentence
Han, simple sera la sentence, sur place publique pendu sur la potence
Ces rappeurs baissent dans mon estime, me serre pas la main, t'es qu'un faux type
Refais tes semblants, je te tartine, tu veux faire le gentil et ça sous-estime
Triste dans les yeux de terre mère, beaucoup d'ces enfants, on veut faire taire
Réussir est ma seule guerre, les gens de la street sont mes seuls frères, sache-le
You might also like[Pont 2]
Goût cerise, suce ma capote goût cerise
Goût cerise
Comme Moïse, doué dans l'écartement comme Moïse
Comme Moïse, sache-le

[Outro]
Gestuelle, gestuelle
Gestuelle,  twapplifeEmbed"
Siboy,Président,"13 ContributorsPrésident Lyrics[Paroles de ""Président""]

[Couplet unique]
Holy shit
Président, j'fais du trap de président
Si y'a drah tu perds une dent toi et ta femme, qui t'a dit qu'j'étais galant
Ces rappeurs sont trop suspects, ils ont plus de côtés bavard que bagarreur de Cassius Clay
Ouais négro, je perds mon temps
Ces négros m'feront perdre mon temps, ils m'parlent pas d'argent comptant
Pas l'temps de parler coup de coude dans la tronche pour la présentation
Leur faire du mal ma seule orientation
Uzi chargé, uzi chargé, uzi chargé
Mais à quoi ça sert si tu tires pas ? Pétasse
Oh, mais à quoi ça sert si tu tires pas ? Pétasse
Nan, nan c'est pas fini, j'ai pas fini de te quer-ni
Tu veux mon flow, tiens mon crachat
Enlève la cagoule ça te va pas
Si je te tire dessus c'est parce que j'suis honnête
On s'en bat les couilles de c'que tes anges promettent
Elle fait moins la maligne quand j'suis dedans
J'vois le rap français me sucer comme s'il n'a jamais eu de dents
Suce, suce, suce
Je salis ces négros depuis le début, j'vais baiser ces rappeurs comme dans un bar à putes
Dans le vaisseau d'la chance j'ai mon parachute

[Pont]
Trap de présidents, trap de présidents
Mulhousien résidant, breuvage de Phenergan
Coeur mystique comme le Vatican, tout niquer il était temps
Défoncé au volant, une cagoule dans la boîte à gants
You might also like[Outro]
Fais pas chier, 'vais pas m'énerver ça va chier
Fais pas le thug t'es une fiotte, je sors le canon ça va chier
J'oublie pas le mal qu'on m'a fait, j'oublie pas le mal qu'on m'a fait
J'ai trop d'amour pour l'oseille, je veux plus parler de bitch
Président, président, président, bitch
Président, président, président  bitch
Trap de président président
Trap de président président
Ma trap est de président
Ma trap est de président
Président, président, président
Président, président, président
Trap de président président
Trap de président président
Ma trap est de président
Ma trap est de président
Président, président
Président, président1Embed"
Siboy,Twapplife,"13 ContributorsTwapplife Lyrics[Paroles de ""Twapplife""]

[Intro]
Twapplife (ouais)
Twapplife (ouais)
Twapplife (ouais)
Twapplife (oh)
Twapplife (ouh)
Twapplife (yeah)
Twapplife (uh, ouh)

[Refrain]
Caresse l'arme, pense au meurtre
Même si personne n'a rien fait (sache le)
Promethazine, promethazine (han), j'arrive pas à m'arrêter (ouh)
Ton jnoun il le dresse (ouais), j't'ai baisé par naïveté (rah)
Regard vide dans les braises (regard) et j'm'endors dans une schneck (ouh)

[Couplet unique]
Comment ça qui vivra, verra ? On est armé donc qui vivra, nous verrons
Sourire glacial dans la pénombre (ouais), y'a que quand t'es mort que nous t'aimons salope (salope)
Y'a que du sale (salope), quand y'a marabout vagin s'écarte
Tu veux la paix ? Cherche Mandela, quand y'a cassage de bras négro t'sais qu'on est là
Tu n'as pas un rond, tu parles, connard, où sont les dineros ? (mucho)
Balle dans la tête comme un Kennedy, repars avec la classe Robert De Niro (rah)
Touche à ma princesse, tu meurs vite fait, au r'voir, gracias (woh)
Mon flow choque la NASA, sous la cagoule, c'est Mufasa (bitch)
Toujours beaucoup trop noir par ici (oui), par ici beaucoup trop pour Marine (ouais)
Négro, elle a peur que je la plaque (ouais)
À force de tout baiser je me lasse (oui)
De Pointe Noire, je vois Pointe-à-Pitre, pas d'différence, dans la mélanine
Mon négro ne touche jamais au crack, oh gros jamais touches à l'héroïne
Un négro meurt, demain négro s'venge, heureusement qu'y'a musique et sport
Sinon dur pour qu'un négro se range, grâce à tout ça négro a la côte
J'baise des putains lorsque je m'ennuie, briser les cœurs des putains, je m'en moque
Que du sale, que du sale, que du sale, négro voilà ce que j'élabore (Twapplife)
You might also like[Refrain]
Caresse l'arme, pense au meurtre même si personne n'a rien fait (sache-le)
Promethazine, promethazine (han), j'arrive pas à m'arrêter (ouh)
Ton jnoun il le dresse (ouais), j't'ai baisé par naïveté (rah)
Regard vide dans les braises (regard) et j'm'endors dans une schneck

[Outro]
Twapplife
Twapplife
Twapplife
Twapplife
Twapplife
Twapplife
TwapplifeEmbed"
Siboy,Mirinda,"14 ContributorsMirinda Lyrics[Intro]
On s'casse, ha ha !
Nigga je lean, je lean, je lean (je lean, je lean, je lean)
On m'a dit faut que j'dose... (Mama)
Un gros spiff et un codé' Sprite (Yeah, yeah)
Après j'me sens au chaud...
Nigga je lean, je lean, je lean (je lean, je lean, je lean)
On m'a dit faut que j'dose... (dose...)
Un gros spiff et un codé' Sprite (Yeah, yeah)
Après j'me sens au chaud... (ScottSoundsBeats.com)

[Couplet 1]
Pétasse à ce qu'il parait mon son tourne dans toutes les cités
Masta j't'ai déja dit j'suis pas au max de ma capacité
Drogba ! Talentueux comme Drogba
Je les quer-ni, je les quer-ni, je les quer-ni ces grosses garces
Du matin au soir haschich sur haschich
Défoncé je m'en bats les couilles d'écouter tout ces fachistes
Si Facebook avait le mode ennemi
J'aurais plus de 100.000 demande d'ajouts
Je félicite Jésus Christ
Car j'ai du mal à tendre ma joue
J'aime cette drogue
Codé' même si ça me nuit
OK, car je dors peu
Comme un nouveau né, je n'fais pas mes nuit
J'ai un marmot sur le dos
Pour lui j'ai mis la cagoule sur la tête
La vie n'est pas si rose
Elle a le même teint que tous ces traîtres
You might also like[Refrain]
Donc comprend que je me bats pour ma cause
Donc comprend que je me bats pour ma dose
Donc comprend que je me bats pour ma cause
Donc comprend que je me bats pour ma dose

[Pont]
C'est pas de ma faute
C'est pas de ma faute négro
C'est pas de ma faute (Yeah...)
C'est pas de ma faute
C'est pas de ma faute négro
C'est pas de ma faute (Yeah, yeah...)
Codé' Sprite
Codé' Mirinda
On m'a dit de baiser : ses ennemis c'est rentable (Yeah...)

[Couplet 2]
J'cogite
Trop de haine negro que j'ingurgite
Notre fierté nous a maudit
La chance me sourit
Malheureusement elle a des caries
Toujours une part de vérité même quand on te charrie

[Pont]
C'est pas de ma faute
C'est pas de ma faute négro
C'est pas de ma faute (Yeah...)
C'est pas de ma faute
C'est pas de ma faute négro
C'est pas de ma faute (Yeah, yeah...)
Codé' Sprite
Codé' Mirinda
On m'a dit de baiser : ses ennemis c'est rentable (Yeah...)
[Refrain]
Donc comprend que je me bats pour ma cause
Donc comprend que je me bats pour ma dose
Donc comprend que je me bats pour ma cause
Donc comprend que je me bats pour ma dose2Embed"
